"No.","Time","Source","Destination","Protocol","Length","Info"
"1","0.000000","100.86.247.80","150.171.22.12","TCP","55","63447  >  443 [ACK] Seq=1 Ack=1 Win=251 Len=1"
"2","0.011532","150.171.22.12","100.86.247.80","TCP","66","443  >  63447 [ACK] Seq=1 Ack=2 Win=16384 Len=0 SLE=1 SRE=2"
"3","2.651806","100.86.247.80","150.171.22.12","TLSv1.2","407","Application Data"
"4","2.651976","100.86.247.80","150.171.22.12","TLSv1.2","93","Application Data"
"5","2.664343","150.171.22.12","100.86.247.80","TCP","56","443  >  63394 [ACK] Seq=1 Ack=393 Win=16382 Len=0"
"6","2.664343","150.171.22.12","100.86.247.80","TLSv1.2","93","Application Data"
"7","2.720039","100.86.247.80","150.171.22.12","TCP","54","63394  >  443 [ACK] Seq=393 Ack=40 Win=508 Len=0"
"8","2.802493","150.171.22.12","100.86.247.80","TCP","1514","443  >  63394 [ACK] Seq=40 Ack=393 Win=16382 Len=1460 [TCP PDU reassembled in 10]"
"9","2.806553","150.171.22.12","100.86.247.80","TCP","1514","443  >  63394 [ACK] Seq=1500 Ack=393 Win=16382 Len=1460 [TCP PDU reassembled in 10]"
"10","2.806553","150.171.22.12","100.86.247.80","TLSv1.2","245","Application Data"
"11","2.806553","150.171.22.12","100.86.247.80","TCP","1514","443  >  63394 [ACK] Seq=3151 Ack=393 Win=16382 Len=1460 [TCP PDU reassembled in 13]"
"12","2.806553","150.171.22.12","100.86.247.80","TCP","1514","443  >  63394 [ACK] Seq=4611 Ack=393 Win=16382 Len=1460 [TCP PDU reassembled in 13]"
"13","2.806553","150.171.22.12","100.86.247.80","TLSv1.2","1261","Application Data"
"14","2.806553","150.171.22.12","100.86.247.80","TCP","1514","443  >  63394 [ACK] Seq=7278 Ack=393 Win=16382 Len=1460 [TCP PDU reassembled in 16]"
"15","2.806553","150.171.22.12","100.86.247.80","TCP","1514","443  >  63394 [ACK] Seq=8738 Ack=393 Win=16382 Len=1460 [TCP PDU reassembled in 16]"
"16","2.806553","150.171.22.12","100.86.247.80","TLSv1.2","1261","Application Data"
"17","2.806553","150.171.22.12","100.86.247.80","TCP","1514","443  >  63394 [ACK] Seq=11405 Ack=393 Win=16382 Len=1460 [TCP PDU reassembled in 25]"
"18","2.806553","150.171.22.12","100.86.247.80","TCP","1514","443  >  63394 [ACK] Seq=12865 Ack=393 Win=16382 Len=1460 [TCP PDU reassembled in 25]"
"19","2.807135","100.86.247.80","150.171.22.12","TCP","54","63394  >  443 [ACK] Seq=393 Ack=2960 Win=511 Len=0"
"20","2.807379","100.86.247.80","150.171.22.12","TCP","54","63394  >  443 [ACK] Seq=393 Ack=4611 Win=511 Len=0"
"21","2.807506","100.86.247.80","150.171.22.12","TCP","54","63394  >  443 [ACK] Seq=393 Ack=7278 Win=511 Len=0"
"22","2.807658","100.86.247.80","150.171.22.12","TCP","54","63394  >  443 [ACK] Seq=393 Ack=10198 Win=511 Len=0"
"23","2.807780","100.86.247.80","150.171.22.12","TCP","54","63394  >  443 [ACK] Seq=393 Ack=12865 Win=511 Len=0"
"24","2.810927","100.86.247.80","150.171.22.12","TLSv1.2","89","Application Data"
"25","2.827340","150.171.22.12","100.86.247.80","TLSv1.2","1261","Application Data"
"26","2.827340","150.171.22.12","100.86.247.80","TCP","1514","443  >  63394 [ACK] Seq=15532 Ack=393 Win=16382 Len=1460 [TCP PDU reassembled in 28]"
"27","2.827340","150.171.22.12","100.86.247.80","TCP","1514","443  >  63394 [ACK] Seq=16992 Ack=393 Win=16382 Len=1460 [TCP PDU reassembled in 28]"
"28","2.827340","150.171.22.12","100.86.247.80","TLSv1.2","461","Application Data"
"29","2.827340","150.171.22.12","100.86.247.80","TCP","1514","443  >  63394 [ACK] Seq=18859 Ack=393 Win=16382 Len=1460 [TCP PDU reassembled in 31]"
"30","2.827340","150.171.22.12","100.86.247.80","TCP","1514","443  >  63394 [ACK] Seq=20319 Ack=393 Win=16382 Len=1460 [TCP PDU reassembled in 31]"
"31","2.827340","150.171.22.12","100.86.247.80","TLSv1.2","1261","Application Data"
"32","2.827340","150.171.22.12","100.86.247.80","TCP","1514","443  >  63394 [ACK] Seq=22986 Ack=393 Win=16382 Len=1460 [TCP PDU reassembled in 34]"
"33","2.827340","150.171.22.12","100.86.247.80","TCP","1514","443  >  63394 [ACK] Seq=24446 Ack=393 Win=16382 Len=1460 [TCP PDU reassembled in 34]"
"34","2.827340","150.171.22.12","100.86.247.80","TLSv1.2","1261","Application Data"
"35","2.827340","150.171.22.12","100.86.247.80","TCP","1514","443  >  63394 [ACK] Seq=27113 Ack=393 Win=16382 Len=1460 [TCP PDU reassembled in 37]"
"36","2.827340","150.171.22.12","100.86.247.80","TCP","1514","443  >  63394 [ACK] Seq=28573 Ack=393 Win=16382 Len=1460 [TCP PDU reassembled in 37]"
"37","2.827340","150.171.22.12","100.86.247.80","TLSv1.2","1261","Application Data"
"38","2.827340","150.171.22.12","100.86.247.80","TCP","1514","443  >  63394 [ACK] Seq=31240 Ack=393 Win=16382 Len=1460 [TCP PDU reassembled in 40]"
"39","2.827340","150.171.22.12","100.86.247.80","TCP","1514","443  >  63394 [ACK] Seq=32700 Ack=393 Win=16382 Len=1460 [TCP PDU reassembled in 40]"
"40","2.827340","150.171.22.12","100.86.247.80","TLSv1.2","1261","Application Data"
"41","2.827340","150.171.22.12","100.86.247.80","TLSv1.2","885","Application Data"
"42","2.827340","150.171.22.12","100.86.247.80","TCP","1514","443  >  63394 [ACK] Seq=36198 Ack=393 Win=16382 Len=1460 [TCP PDU reassembled in 44]"
"43","2.827340","150.171.22.12","100.86.247.80","TCP","1514","443  >  63394 [ACK] Seq=37658 Ack=393 Win=16382 Len=1460 [TCP PDU reassembled in 44]"
"44","2.827340","150.171.22.12","100.86.247.80","TLSv1.2","1261","Application Data"
"45","2.827340","150.171.22.12","100.86.247.80","TCP","1514","443  >  63394 [ACK] Seq=40325 Ack=393 Win=16382 Len=1460 [TCP PDU reassembled in 47]"
"46","2.827340","150.171.22.12","100.86.247.80","TCP","1514","443  >  63394 [ACK] Seq=41785 Ack=393 Win=16382 Len=1460 [TCP PDU reassembled in 47]"
"47","2.827340","150.171.22.12","100.86.247.80","TLSv1.2","1261","Application Data"
"48","2.827340","150.171.22.12","100.86.247.80","TCP","1514","443  >  63394 [ACK] Seq=44452 Ack=393 Win=16382 Len=1460 [TCP PDU reassembled in 50]"
"49","2.827340","150.171.22.12","100.86.247.80","TCP","1514","443  >  63394 [ACK] Seq=45912 Ack=393 Win=16382 Len=1460 [TCP PDU reassembled in 50]"
"50","2.827340","150.171.22.12","100.86.247.80","TLSv1.2","1261","Application Data"
"51","2.829584","100.86.247.80","150.171.22.12","TCP","54","63394  >  443 [ACK] Seq=428 Ack=16992 Win=511 Len=0"
"52","2.829825","100.86.247.80","150.171.22.12","TCP","54","63394  >  443 [ACK] Seq=428 Ack=18452 Win=511 Len=0"
"53","2.830000","100.86.247.80","150.171.22.12","TCP","54","63394  >  443 [ACK] Seq=428 Ack=18859 Win=510 Len=0"
"54","2.830144","100.86.247.80","150.171.22.12","TCP","54","63394  >  443 [ACK] Seq=428 Ack=20319 Win=511 Len=0"
"55","2.830281","100.86.247.80","150.171.22.12","TCP","54","63394  >  443 [ACK] Seq=428 Ack=21779 Win=511 Len=0"
"56","2.830447","100.86.247.80","150.171.22.12","TCP","54","63394  >  443 [ACK] Seq=428 Ack=24446 Win=511 Len=0"
"57","2.830583","100.86.247.80","150.171.22.12","TCP","54","63394  >  443 [ACK] Seq=428 Ack=25906 Win=511 Len=0"
"58","2.830732","100.86.247.80","150.171.22.12","TCP","54","63394  >  443 [ACK] Seq=428 Ack=27113 Win=507 Len=0"
"59","2.830836","100.86.247.80","150.171.22.12","TCP","54","63394  >  443 [ACK] Seq=428 Ack=28573 Win=511 Len=0"
"60","2.830960","100.86.247.80","150.171.22.12","TCP","54","63394  >  443 [ACK] Seq=428 Ack=30033 Win=511 Len=0"
"61","2.831203","100.86.247.80","150.171.22.12","TCP","54","63394  >  443 [ACK] Seq=428 Ack=32700 Win=511 Len=0"
"62","2.831347","100.86.247.80","150.171.22.12","TCP","54","63394  >  443 [ACK] Seq=428 Ack=34160 Win=511 Len=0"
"63","2.831488","100.86.247.80","150.171.22.12","TCP","54","63394  >  443 [ACK] Seq=428 Ack=35367 Win=507 Len=0"
"64","2.831631","100.86.247.80","150.171.22.12","TCP","54","63394  >  443 [ACK] Seq=428 Ack=36198 Win=511 Len=0"
"65","2.831763","100.86.247.80","150.171.22.12","TCP","54","63394  >  443 [ACK] Seq=428 Ack=37658 Win=511 Len=0"
"66","2.831897","100.86.247.80","150.171.22.12","TCP","54","63394  >  443 [ACK] Seq=428 Ack=39118 Win=511 Len=0"
"67","2.832037","100.86.247.80","150.171.22.12","TCP","54","63394  >  443 [ACK] Seq=428 Ack=40325 Win=507 Len=0"
"68","2.832187","100.86.247.80","150.171.22.12","TCP","54","63394  >  443 [ACK] Seq=428 Ack=41785 Win=511 Len=0"
"69","2.832331","100.86.247.80","150.171.22.12","TCP","54","63394  >  443 [ACK] Seq=428 Ack=43245 Win=511 Len=0"
"70","2.832555","100.86.247.80","150.171.22.12","TCP","54","63394  >  443 [ACK] Seq=428 Ack=45912 Win=511 Len=0"
"71","2.832705","100.86.247.80","150.171.22.12","TCP","54","63394  >  443 [ACK] Seq=428 Ack=47372 Win=511 Len=0"
"72","2.832850","100.86.247.80","150.171.22.12","TCP","54","63394  >  443 [ACK] Seq=428 Ack=48579 Win=507 Len=0"
"73","2.848847","150.171.22.12","100.86.247.80","TCP","1514","443  >  63394 [ACK] Seq=48579 Ack=393 Win=16382 Len=1460 [TCP PDU reassembled in 75]"
"74","2.848847","150.171.22.12","100.86.247.80","TCP","1514","443  >  63394 [ACK] Seq=50039 Ack=393 Win=16382 Len=1460 [TCP PDU reassembled in 75]"
"75","2.848847","150.171.22.12","100.86.247.80","TLSv1.2","1261","Application Data"
"76","2.848847","150.171.22.12","100.86.247.80","TCP","1514","443  >  63394 [ACK] Seq=52706 Ack=393 Win=16382 Len=1460 [TCP PDU reassembled in 78]"
"77","2.848847","150.171.22.12","100.86.247.80","TCP","1514","443  >  63394 [ACK] Seq=54166 Ack=393 Win=16382 Len=1460 [TCP PDU reassembled in 78]"
"78","2.848847","150.171.22.12","100.86.247.80","TLSv1.2","1261","Application Data"
"79","2.848847","150.171.22.12","100.86.247.80","TCP","1514","443  >  63394 [ACK] Seq=56833 Ack=393 Win=16382 Len=1460 [TCP PDU reassembled in 81]"
"80","2.848847","150.171.22.12","100.86.247.80","TCP","1514","443  >  63394 [ACK] Seq=58293 Ack=393 Win=16382 Len=1460 [TCP PDU reassembled in 81]"
"81","2.848847","150.171.22.12","100.86.247.80","TLSv1.2","1261","Application Data"
"82","2.848847","150.171.22.12","100.86.247.80","TLSv1.2","878","Application Data"
"83","2.848847","150.171.22.12","100.86.247.80","TLSv1.2","88","Application Data"
"84","2.848847","150.171.22.12","100.86.247.80","TCP","1514","443  >  63394 [ACK] Seq=61818 Ack=393 Win=16382 Len=1460 [TCP PDU reassembled in 86]"
"85","2.848847","150.171.22.12","100.86.247.80","TCP","1514","443  >  63394 [ACK] Seq=63278 Ack=393 Win=16382 Len=1460 [TCP PDU reassembled in 86]"
"86","2.848847","150.171.22.12","100.86.247.80","TLSv1.2","1252","Application Data"
"87","2.848847","150.171.22.12","100.86.247.80","TCP","1514","443  >  63394 [ACK] Seq=65936 Ack=393 Win=16382 Len=1460 [TCP PDU reassembled in 89]"
"88","2.848847","150.171.22.12","100.86.247.80","TCP","1514","443  >  63394 [ACK] Seq=67396 Ack=393 Win=16382 Len=1460 [TCP PDU reassembled in 89]"
"89","2.848847","150.171.22.12","100.86.247.80","TLSv1.2","466","Application Data"
"90","2.848847","150.171.22.12","100.86.247.80","TCP","1514","443  >  63394 [ACK] Seq=69268 Ack=393 Win=16382 Len=1460 [TCP PDU reassembled in 92]"
"91","2.848847","150.171.22.12","100.86.247.80","TCP","1514","443  >  63394 [ACK] Seq=70728 Ack=393 Win=16382 Len=1460 [TCP PDU reassembled in 92]"
"92","2.848847","150.171.22.12","100.86.247.80","TLSv1.2","1261","Application Data"
"93","2.848847","150.171.22.12","100.86.247.80","TLSv1.2","266","Application Data"
"94","2.848847","150.171.22.12","100.86.247.80","TCP","1514","443  >  63394 [ACK] Seq=73607 Ack=393 Win=16382 Len=1460 [TCP PDU reassembled in 96]"
"95","2.848847","150.171.22.12","100.86.247.80","TCP","1514","443  >  63394 [ACK] Seq=75067 Ack=393 Win=16382 Len=1460 [TCP PDU reassembled in 96]"
"96","2.848847","150.171.22.12","100.86.247.80","TLSv1.2","1205","Application Data"
"97","2.850362","100.86.247.80","150.171.22.12","TCP","54","63394  >  443 [ACK] Seq=428 Ack=50039 Win=511 Len=0"
"98","2.850579","100.86.247.80","150.171.22.12","TCP","54","63394  >  443 [ACK] Seq=428 Ack=51499 Win=511 Len=0"
"99","2.850725","100.86.247.80","150.171.22.12","TCP","54","63394  >  443 [ACK] Seq=428 Ack=54166 Win=511 Len=0"
"100","2.850886","100.86.247.80","150.171.22.12","TCP","54","63394  >  443 [ACK] Seq=428 Ack=55626 Win=511 Len=0"
"101","2.850954","100.86.247.80","150.171.22.12","TCP","54","63394  >  443 [ACK] Seq=428 Ack=56833 Win=507 Len=0"
"102","2.851050","100.86.247.80","150.171.22.12","TCP","54","63394  >  443 [ACK] Seq=428 Ack=58293 Win=511 Len=0"
"103","2.851141","100.86.247.80","150.171.22.12","TCP","54","63394  >  443 [ACK] Seq=428 Ack=59753 Win=511 Len=0"
"104","2.851287","100.86.247.80","150.171.22.12","TCP","54","63394  >  443 [ACK] Seq=428 Ack=61784 Win=511 Len=0"
"105","2.851466","100.86.247.80","150.171.22.12","TCP","54","63394  >  443 [ACK] Seq=428 Ack=63278 Win=511 Len=0"
"106","2.851592","100.86.247.80","150.171.22.12","TCP","54","63394  >  443 [ACK] Seq=428 Ack=64738 Win=511 Len=0"
"107","2.851703","100.86.247.80","150.171.22.12","TCP","54","63394  >  443 [ACK] Seq=428 Ack=65936 Win=507 Len=0"
"108","2.852049","100.86.247.80","150.171.22.12","TCP","54","63394  >  443 [ACK] Seq=428 Ack=67396 Win=511 Len=0"
"109","2.852182","100.86.247.80","150.171.22.12","TCP","54","63394  >  443 [ACK] Seq=428 Ack=68856 Win=511 Len=0"
"110","2.852312","100.86.247.80","150.171.22.12","TCP","54","63394  >  443 [ACK] Seq=428 Ack=70728 Win=511 Len=0"
"111","2.852421","100.86.247.80","150.171.22.12","TCP","54","63394  >  443 [ACK] Seq=428 Ack=72188 Win=511 Len=0"
"112","2.852543","100.86.247.80","150.171.22.12","TCP","54","63394  >  443 [ACK] Seq=428 Ack=73395 Win=507 Len=0"
"113","2.852692","100.86.247.80","150.171.22.12","TCP","54","63394  >  443 [ACK] Seq=428 Ack=75067 Win=511 Len=0"
"114","2.852802","100.86.247.80","150.171.22.12","TCP","54","63394  >  443 [ACK] Seq=428 Ack=76527 Win=511 Len=0"
"115","2.852890","100.86.247.80","150.171.22.12","TCP","54","63394  >  443 [ACK] Seq=428 Ack=77678 Win=507 Len=0"
"116","2.854420","150.171.22.12","100.86.247.80","TLSv1.2","135","Application Data"
"117","2.854420","150.171.22.12","100.86.247.80","TCP","1514","443  >  63394 [ACK] Seq=77759 Ack=393 Win=16382 Len=1460 [TCP PDU reassembled in 119]"
"118","2.854420","150.171.22.12","100.86.247.80","TCP","1514","443  >  63394 [ACK] Seq=79219 Ack=393 Win=16382 Len=1460 [TCP PDU reassembled in 119]"
"119","2.854420","150.171.22.12","100.86.247.80","TLSv1.2","1261","Application Data"
"120","2.854420","150.171.22.12","100.86.247.80","TLSv1.2","138","Application Data"
"121","2.854420","150.171.22.12","100.86.247.80","TLSv1.2","222","Application Data"
"122","2.854747","100.86.247.80","150.171.22.12","TCP","54","63394  >  443 [ACK] Seq=428 Ack=79219 Win=511 Len=0"
"123","2.854872","100.86.247.80","150.171.22.12","TCP","54","63394  >  443 [ACK] Seq=428 Ack=80679 Win=511 Len=0"
"124","2.854940","100.86.247.80","150.171.22.12","TCP","54","63394  >  443 [ACK] Seq=428 Ack=81886 Win=507 Len=0"
"125","2.855033","100.86.247.80","150.171.22.12","TCP","54","63394  >  443 [ACK] Seq=428 Ack=82138 Win=511 Len=0"
"126","2.856131","150.171.22.12","100.86.247.80","TCP","1514","443  >  63394 [ACK] Seq=82138 Ack=393 Win=16382 Len=1460 [TCP PDU reassembled in 128]"
"127","2.856131","150.171.22.12","100.86.247.80","TCP","1514","443  >  63394 [ACK] Seq=83598 Ack=393 Win=16382 Len=1460 [TCP PDU reassembled in 128]"
"128","2.856131","150.171.22.12","100.86.247.80","TLSv1.2","285","Application Data"
"129","2.856131","150.171.22.12","100.86.247.80","TLSv1.2","210","Application Data"
"130","2.856131","150.171.22.12","100.86.247.80","TLSv1.2","190","Application Data"
"131","2.856131","150.171.22.12","100.86.247.80","TCP","56","443  >  63394 [ACK] Seq=85581 Ack=428 Win=16382 Len=0"
"132","2.856525","100.86.247.80","150.171.22.12","TCP","54","63394  >  443 [ACK] Seq=428 Ack=85058 Win=511 Len=0"
"133","2.856674","100.86.247.80","150.171.22.12","TCP","54","63394  >  443 [ACK] Seq=428 Ack=85445 Win=510 Len=0"
"134","2.909087","100.86.247.80","150.171.22.12","TCP","54","63394  >  443 [ACK] Seq=428 Ack=85581 Win=509 Len=0"
"135","3.073399","150.171.22.12","100.86.247.80","TLSv1.2","508","Application Data"
"136","3.086762","150.171.22.12","100.86.247.80","TLSv1.2","183","Application Data"
"137","3.086762","150.171.22.12","100.86.247.80","TCP","1514","443  >  63394 [ACK] Seq=86164 Ack=428 Win=16382 Len=1460 [TCP PDU reassembled in 139]"
"138","3.086762","150.171.22.12","100.86.247.80","TCP","1514","443  >  63394 [ACK] Seq=87624 Ack=428 Win=16382 Len=1460 [TCP PDU reassembled in 139]"
"139","3.086892","150.171.22.12","100.86.247.80","TLSv1.2","1157","Application Data"
"140","3.086892","150.171.22.12","100.86.247.80","TCP","1514","443  >  63394 [ACK] Seq=90187 Ack=428 Win=16382 Len=1460 [TCP PDU reassembled in 145]"
"141","3.087003","100.86.247.80","150.171.22.12","TCP","54","63394  >  443 [ACK] Seq=428 Ack=86164 Win=507 Len=0"
"142","3.087189","100.86.247.80","150.171.22.12","TCP","54","63394  >  443 [ACK] Seq=428 Ack=89084 Win=511 Len=0"
"143","3.087473","100.86.247.80","150.171.22.12","TCP","54","63394  >  443 [ACK] Seq=428 Ack=91647 Win=511 Len=0"
"144","3.088216","150.171.22.12","100.86.247.80","TCP","1514","443  >  63394 [ACK] Seq=91647 Ack=428 Win=16382 Len=1460 [TCP PDU reassembled in 145]"
"145","3.088216","150.171.22.12","100.86.247.80","TLSv1.2","181","Application Data"
"146","3.088459","100.86.247.80","150.171.22.12","TCP","54","63394  >  443 [ACK] Seq=428 Ack=93234 Win=511 Len=0"
"147","3.092335","150.171.22.12","100.86.247.80","TLSv1.2","1133","Application Data"
"148","3.135561","100.86.247.80","150.171.22.12","TCP","54","63394  >  443 [ACK] Seq=428 Ack=94313 Win=507 Len=0"
"149","3.170929","150.171.22.12","100.86.247.80","TCP","1514","443  >  63394 [ACK] Seq=94313 Ack=428 Win=16382 Len=1460 [TCP PDU reassembled in 151]"
"150","3.170929","150.171.22.12","100.86.247.80","TCP","1514","443  >  63394 [ACK] Seq=95773 Ack=428 Win=16382 Len=1460 [TCP PDU reassembled in 151]"
"151","3.170929","150.171.22.12","100.86.247.80","TLSv1.2","150","Application Data"
"152","3.171229","100.86.247.80","150.171.22.12","TCP","54","63394  >  443 [ACK] Seq=428 Ack=97233 Win=511 Len=0"
"153","3.173241","150.171.22.12","100.86.247.80","TLSv1.2","1190","Application Data"
"154","3.173241","150.171.22.12","100.86.247.80","TCP","1514","443  >  63394 [ACK] Seq=98465 Ack=428 Win=16382 Len=1460 [TCP PDU reassembled in 156]"
"155","3.173241","150.171.22.12","100.86.247.80","TCP","1514","443  >  63394 [ACK] Seq=99925 Ack=428 Win=16382 Len=1460 [TCP PDU reassembled in 156]"
"156","3.173241","150.171.22.12","100.86.247.80","TLSv1.2","1200","Application Data"
"157","3.173241","150.171.22.12","100.86.247.80","TCP","1514","443  >  63394 [ACK] Seq=102531 Ack=428 Win=16382 Len=1460 [TCP PDU reassembled in 159]"
"158","3.173241","150.171.22.12","100.86.247.80","TCP","1514","443  >  63394 [ACK] Seq=103991 Ack=428 Win=16382 Len=1460 [TCP PDU reassembled in 159]"
"159","3.173241","150.171.22.12","100.86.247.80","TLSv1.2","1261","Application Data"
"160","3.173241","150.171.22.12","100.86.247.80","TCP","1514","443  >  63394 [ACK] Seq=106658 Ack=428 Win=16382 Len=1460 [TCP PDU reassembled in 162]"
"161","3.173241","150.171.22.12","100.86.247.80","TCP","1514","443  >  63394 [ACK] Seq=108118 Ack=428 Win=16382 Len=1460 [TCP PDU reassembled in 162]"
"162","3.173241","150.171.22.12","100.86.247.80","TLSv1.2","1261","Application Data"
"163","3.173652","100.86.247.80","150.171.22.12","TCP","54","63394  >  443 [ACK] Seq=428 Ack=98465 Win=507 Len=0"
"164","3.173815","100.86.247.80","150.171.22.12","TCP","54","63394  >  443 [ACK] Seq=428 Ack=101385 Win=511 Len=0"
"165","3.173945","100.86.247.80","150.171.22.12","TCP","54","63394  >  443 [ACK] Seq=428 Ack=103991 Win=511 Len=0"
"166","3.174069","100.86.247.80","150.171.22.12","TCP","54","63394  >  443 [ACK] Seq=428 Ack=106658 Win=511 Len=0"
"167","3.174207","100.86.247.80","150.171.22.12","TCP","54","63394  >  443 [ACK] Seq=428 Ack=109578 Win=511 Len=0"
"168","3.175182","150.171.22.12","100.86.247.80","TCP","1514","443  >  63394 [ACK] Seq=110785 Ack=428 Win=16382 Len=1460 [TCP PDU reassembled in 169]"
"169","3.175182","150.171.22.12","100.86.247.80","TLSv1.2","1152","Application Data"
"170","3.175365","100.86.247.80","150.171.22.12","TCP","54","63394  >  443 [ACK] Seq=428 Ack=112245 Win=511 Len=0"
"171","3.221473","100.86.247.80","150.171.22.12","TCP","54","63394  >  443 [ACK] Seq=428 Ack=113343 Win=507 Len=0"
"172","3.221661","150.171.22.12","100.86.247.80","TCP","1514","443  >  63394 [ACK] Seq=113343 Ack=428 Win=16382 Len=1460 [TCP PDU reassembled in 174]"
"173","3.221661","150.171.22.12","100.86.247.80","TCP","1514","443  >  63394 [ACK] Seq=114803 Ack=428 Win=16382 Len=1460 [TCP PDU reassembled in 174]"
"174","3.221661","150.171.22.12","100.86.247.80","TLSv1.2","1205","Application Data"
"175","3.222007","100.86.247.80","150.171.22.12","TCP","54","63394  >  443 [ACK] Seq=428 Ack=116263 Win=511 Len=0"
"176","3.229154","150.171.22.12","100.86.247.80","TLSv1.2","135","Application Data"
"177","3.229154","150.171.22.12","100.86.247.80","TCP","1514","443  >  63394 [ACK] Seq=117495 Ack=428 Win=16382 Len=1460 [TCP PDU reassembled in 179]"
"178","3.229154","150.171.22.12","100.86.247.80","TCP","1514","443  >  63394 [ACK] Seq=118955 Ack=428 Win=16382 Len=1460 [TCP PDU reassembled in 179]"
"179","3.229154","150.171.22.12","100.86.247.80","TLSv1.2","1261","Application Data"
"180","3.229154","150.171.22.12","100.86.247.80","TLSv1.2","1153","Application Data"
"181","3.229357","100.86.247.80","150.171.22.12","TCP","54","63394  >  443 [ACK] Seq=428 Ack=117495 Win=507 Len=0"
"182","3.229511","100.86.247.80","150.171.22.12","TCP","54","63394  >  443 [ACK] Seq=428 Ack=120415 Win=511 Len=0"
"183","3.229622","100.86.247.80","150.171.22.12","TCP","54","63394  >  443 [ACK] Seq=428 Ack=122721 Win=511 Len=0"
"184","3.234286","150.171.22.12","100.86.247.80","TLSv1.2","559","Application Data"
"185","3.234769","150.171.22.12","100.86.247.80","TCP","1514","443  >  63394 [ACK] Seq=123226 Ack=428 Win=16382 Len=1460 [TCP PDU reassembled in 186]"
"186","3.234769","150.171.22.12","100.86.247.80","TLSv1.2","269","Application Data"
"187","3.234935","100.86.247.80","150.171.22.12","TCP","54","63394  >  443 [ACK] Seq=428 Ack=124686 Win=511 Len=0"
"188","3.249354","150.171.22.12","100.86.247.80","TLSv1.2","1277","Application Data"
"189","3.249588","100.86.247.80","150.171.22.12","TCP","54","63394  >  443 [ACK] Seq=428 Ack=126124 Win=506 Len=0"
"190","3.264582","150.171.22.12","100.86.247.80","TLSv1.2","795","Application Data"
"191","3.265503","150.171.22.12","100.86.247.80","TLSv1.2","120","Application Data"
"192","3.265577","100.86.247.80","150.171.22.12","TCP","54","63394  >  443 [ACK] Seq=428 Ack=126931 Win=511 Len=0"
"193","3.268992","150.171.22.12","100.86.247.80","TCP","1514","443  >  63394 [ACK] Seq=126931 Ack=428 Win=16382 Len=1460 [TCP PDU reassembled in 195]"
"194","3.268992","150.171.22.12","100.86.247.80","TCP","1514","443  >  63394 [ACK] Seq=128391 Ack=428 Win=16382 Len=1460 [TCP PDU reassembled in 195]"
"195","3.268992","150.171.22.12","100.86.247.80","TLSv1.2","1205","Application Data"
"196","3.269246","100.86.247.80","150.171.22.12","TCP","54","63394  >  443 [ACK] Seq=428 Ack=129851 Win=511 Len=0"
"197","3.270277","150.171.22.12","100.86.247.80","TLSv1.2","135","Application Data"
"198","3.270277","150.171.22.12","100.86.247.80","TLSv1.2","283","Application Data"
"199","3.270433","100.86.247.80","150.171.22.12","TCP","54","63394  >  443 [ACK] Seq=428 Ack=131083 Win=507 Len=0"
"200","3.271592","150.171.22.12","100.86.247.80","TLSv1.2","322","Application Data"
"201","3.271746","100.86.247.80","150.171.22.12","TCP","54","63394  >  443 [ACK] Seq=428 Ack=131580 Win=511 Len=0"
"202","3.278795","150.171.22.12","100.86.247.80","TCP","1514","443  >  63394 [ACK] Seq=131580 Ack=428 Win=16382 Len=1460 [TCP PDU reassembled in 203]"
"203","3.278795","150.171.22.12","100.86.247.80","TLSv1.2","256","Application Data"
"204","3.278973","100.86.247.80","150.171.22.12","TCP","54","63394  >  443 [ACK] Seq=428 Ack=133242 Win=511 Len=0"
"205","3.291632","150.171.22.12","100.86.247.80","TCP","1514","443  >  63394 [ACK] Seq=133242 Ack=428 Win=16382 Len=1460 [TCP PDU reassembled in 206]"
"206","3.291996","150.171.22.12","100.86.247.80","TLSv1.2","784","Application Data"
"207","3.291996","150.171.22.12","100.86.247.80","TLSv1.2","445","Application Data"
"208","3.292202","100.86.247.80","150.171.22.12","TCP","54","63394  >  443 [ACK] Seq=428 Ack=135432 Win=511 Len=0"
"209","3.292583","150.171.22.12","100.86.247.80","TCP","1514","443  >  63394 [ACK] Seq=135823 Ack=428 Win=16382 Len=1460 [TCP PDU reassembled in 210]"
"210","3.292583","150.171.22.12","100.86.247.80","TLSv1.2","301","Application Data"
"211","3.292735","100.86.247.80","150.171.22.12","TCP","54","63394  >  443 [ACK] Seq=428 Ack=137283 Win=511 Len=0"
"212","3.337491","100.86.247.80","150.171.22.12","TCP","54","63394  >  443 [ACK] Seq=428 Ack=137530 Win=511 Len=0"
"213","3.349698","150.171.22.12","100.86.247.80","TCP","1514","443  >  63394 [ACK] Seq=137530 Ack=428 Win=16382 Len=1460 [TCP PDU reassembled in 215]"
"214","3.350134","150.171.22.12","100.86.247.80","TCP","1514","443  >  63394 [ACK] Seq=138990 Ack=428 Win=16382 Len=1460 [TCP PDU reassembled in 215]"
"215","3.350134","150.171.22.12","100.86.247.80","TLSv1.2","1205","Application Data"
"216","3.350379","100.86.247.80","150.171.22.12","TCP","54","63394  >  443 [ACK] Seq=428 Ack=140450 Win=511 Len=0"
"217","3.351250","150.171.22.12","100.86.247.80","TLSv1.2","135","Application Data"
"218","3.351250","150.171.22.12","100.86.247.80","TCP","1514","443  >  63394 [ACK] Seq=141682 Ack=428 Win=16382 Len=1460 [TCP PDU reassembled in 220]"
"219","3.351250","150.171.22.12","100.86.247.80","TCP","1514","443  >  63394 [ACK] Seq=143142 Ack=428 Win=16382 Len=1460 [TCP PDU reassembled in 220]"
"220","3.351250","150.171.22.12","100.86.247.80","TLSv1.2","1261","Application Data"
"221","3.351250","150.171.22.12","100.86.247.80","TCP","1514","443  >  63394 [ACK] Seq=145809 Ack=428 Win=16382 Len=1460 [TCP PDU reassembled in 226]"
"222","3.351250","150.171.22.12","100.86.247.80","TCP","1514","443  >  63394 [ACK] Seq=147269 Ack=428 Win=16382 Len=1460 [TCP PDU reassembled in 226]"
"223","3.351569","100.86.247.80","150.171.22.12","TCP","54","63394  >  443 [ACK] Seq=428 Ack=141682 Win=507 Len=0"
"224","3.351754","100.86.247.80","150.171.22.12","TCP","54","63394  >  443 [ACK] Seq=428 Ack=144602 Win=511 Len=0"
"225","3.351894","100.86.247.80","150.171.22.12","TCP","54","63394  >  443 [ACK] Seq=428 Ack=147269 Win=511 Len=0"
"226","3.352350","150.171.22.12","100.86.247.80","TLSv1.2","1261","Application Data"
"227","3.352350","150.171.22.12","100.86.247.80","TCP","1514","443  >  63394 [ACK] Seq=149936 Ack=428 Win=16382 Len=1460 [TCP PDU reassembled in 229]"
"228","3.352350","150.171.22.12","100.86.247.80","TCP","1514","443  >  63394 [ACK] Seq=151396 Ack=428 Win=16382 Len=1460 [TCP PDU reassembled in 229]"
"229","3.352350","150.171.22.12","100.86.247.80","TLSv1.2","1261","Application Data"
"230","3.352589","100.86.247.80","150.171.22.12","TCP","54","63394  >  443 [ACK] Seq=428 Ack=149936 Win=511 Len=0"
"231","3.352719","100.86.247.80","150.171.22.12","TCP","54","63394  >  443 [ACK] Seq=428 Ack=152856 Win=511 Len=0"
"232","3.353232","150.171.22.12","100.86.247.80","TCP","1514","443  >  63394 [ACK] Seq=154063 Ack=428 Win=16382 Len=1460 [TCP PDU reassembled in 233]"
"233","3.353232","150.171.22.12","100.86.247.80","TLSv1.2","664","Application Data"
"234","3.353439","100.86.247.80","150.171.22.12","TCP","54","63394  >  443 [ACK] Seq=428 Ack=155523 Win=511 Len=0"
"235","3.377755","150.171.22.12","100.86.247.80","TCP","1514","443  >  63394 [ACK] Seq=156133 Ack=428 Win=16382 Len=1460 [TCP PDU reassembled in 237]"
"236","3.377975","100.86.247.80","150.171.22.12","TCP","54","63394  >  443 [ACK] Seq=428 Ack=157593 Win=511 Len=0"
"237","3.378519","150.171.22.12","100.86.247.80","TLSv1.2","1162","Application Data"
"238","3.422046","100.86.247.80","150.171.22.12","TCP","54","63394  >  443 [ACK] Seq=428 Ack=158701 Win=507 Len=0"
"239","4.164857","150.171.22.12","100.86.247.80","TCP","1514","443  >  63394 [ACK] Seq=158701 Ack=428 Win=16382 Len=1460 [TCP PDU reassembled in 240]"
"240","4.164857","150.171.22.12","100.86.247.80","TLSv1.2","121","Application Data"
"241","4.164857","150.171.22.12","100.86.247.80","TCP","1219","[TCP Previous segment not captured] 443  >  63394 [PSH, ACK] Seq=161688 Ack=428 Win=16382 Len=1165"
"242","4.165182","100.86.247.80","150.171.22.12","TCP","54","63394  >  443 [ACK] Seq=428 Ack=160228 Win=511 Len=0"
"243","4.165361","100.86.247.80","150.171.22.12","TCP","66","[TCP Dup ACK 242#1] 63394  >  443 [ACK] Seq=428 Ack=160228 Win=511 Len=0 SLE=161688 SRE=162853"
"244","4.169389","150.171.22.12","100.86.247.80","TCP","1514","443  >  63394 [ACK] Seq=162853 Ack=428 Win=16382 Len=1460 [TCP PDU reassembled in 288]"
"245","4.169389","150.171.22.12","100.86.247.80","TCP","1261","[TCP Previous segment not captured] 443  >  63394 [PSH, ACK] Seq=165773 Ack=428 Win=16382 Len=1207 [TCP PDU reassembled in 288]"
"246","4.169389","150.171.22.12","100.86.247.80","TCP","1514","443  >  63394 [ACK] Seq=166980 Ack=428 Win=16382 Len=1460 [TCP PDU reassembled in 247]"
"247","4.169389","150.171.22.12","100.86.247.80","TLSv1.2","554","Application Data"
"248","4.169389","150.171.22.12","100.86.247.80","TCP","1514","443  >  63394 [ACK] Seq=168940 Ack=428 Win=16382 Len=1460 [TCP PDU reassembled in 250]"
"249","4.169389","150.171.22.12","100.86.247.80","TCP","1514","443  >  63394 [ACK] Seq=170400 Ack=428 Win=16382 Len=1460 [TCP PDU reassembled in 250]"
"250","4.169389","150.171.22.12","100.86.247.80","TLSv1.2","1261","Application Data"
"251","4.169389","150.171.22.12","100.86.247.80","TCP","1514","443  >  63394 [ACK] Seq=173067 Ack=428 Win=16382 Len=1460 [TCP PDU reassembled in 253]"
"252","4.169389","150.171.22.12","100.86.247.80","TCP","1514","443  >  63394 [ACK] Seq=174527 Ack=428 Win=16382 Len=1460 [TCP PDU reassembled in 253]"
"253","4.169389","150.171.22.12","100.86.247.80","TLSv1.2","1261","Application Data"
"254","4.169389","150.171.22.12","100.86.247.80","TCP","1514","443  >  63394 [ACK] Seq=177194 Ack=428 Win=16382 Len=1460 [TCP PDU reassembled in 256]"
"255","4.169389","150.171.22.12","100.86.247.80","TCP","1514","443  >  63394 [ACK] Seq=178654 Ack=428 Win=16382 Len=1460 [TCP PDU reassembled in 256]"
"256","4.169389","150.171.22.12","100.86.247.80","TLSv1.2","1261","Application Data"
"257","4.169389","150.171.22.12","100.86.247.80","TCP","1514","443  >  63394 [ACK] Seq=181321 Ack=428 Win=16382 Len=1460 [TCP PDU reassembled in 259]"
"258","4.169389","150.171.22.12","100.86.247.80","TCP","1514","443  >  63394 [ACK] Seq=182781 Ack=428 Win=16382 Len=1460 [TCP PDU reassembled in 259]"
"259","4.169389","150.171.22.12","100.86.247.80","TLSv1.2","1261","Application Data"
"260","4.169389","150.171.22.12","100.86.247.80","TCP","1514","443  >  63394 [ACK] Seq=185448 Ack=428 Win=16382 Len=1460 [TCP PDU reassembled in 262]"
"261","4.169389","150.171.22.12","100.86.247.80","TCP","1514","443  >  63394 [ACK] Seq=186908 Ack=428 Win=16382 Len=1460 [TCP PDU reassembled in 262]"
"262","4.169389","150.171.22.12","100.86.247.80","TLSv1.2","1261","Application Data"
"263","4.169389","150.171.22.12","100.86.247.80","TCP","1514","443  >  63394 [ACK] Seq=189575 Ack=428 Win=16382 Len=1460 [TCP PDU reassembled in 264]"
"264","4.169389","150.171.22.12","100.86.247.80","TLSv1.2","308","Application Data"
"265","4.170550","100.86.247.80","150.171.22.12","TCP","66","[TCP Dup ACK 242#2] 63394  >  443 [ACK] Seq=428 Ack=160228 Win=511 Len=0 SLE=161688 SRE=164313"
"266","4.170623","100.86.247.80","150.171.22.12","TCP","74","[TCP Dup ACK 242#3] 63394  >  443 [ACK] Seq=428 Ack=160228 Win=511 Len=0 SLE=165773 SRE=166980 SLE=161688 SRE=164313"
"267","4.170665","100.86.247.80","150.171.22.12","TCP","74","[TCP Dup ACK 242#4] 63394  >  443 [ACK] Seq=428 Ack=160228 Win=511 Len=0 SLE=165773 SRE=168440 SLE=161688 SRE=164313"
"268","4.170710","100.86.247.80","150.171.22.12","TCP","74","[TCP Dup ACK 242#5] 63394  >  443 [ACK] Seq=428 Ack=160228 Win=511 Len=0 SLE=165773 SRE=168940 SLE=161688 SRE=164313"
"269","4.170735","100.86.247.80","150.171.22.12","TCP","74","[TCP Dup ACK 242#6] 63394  >  443 [ACK] Seq=428 Ack=160228 Win=511 Len=0 SLE=165773 SRE=170400 SLE=161688 SRE=164313"
"270","4.170760","100.86.247.80","150.171.22.12","TCP","74","[TCP Dup ACK 242#7] 63394  >  443 [ACK] Seq=428 Ack=160228 Win=511 Len=0 SLE=165773 SRE=171860 SLE=161688 SRE=164313"
"271","4.170784","100.86.247.80","150.171.22.12","TCP","74","[TCP Dup ACK 242#8] 63394  >  443 [ACK] Seq=428 Ack=160228 Win=511 Len=0 SLE=165773 SRE=173067 SLE=161688 SRE=164313"
"272","4.170812","100.86.247.80","150.171.22.12","TCP","74","[TCP Dup ACK 242#9] 63394  >  443 [ACK] Seq=428 Ack=160228 Win=511 Len=0 SLE=165773 SRE=174527 SLE=161688 SRE=164313"
"273","4.170838","100.86.247.80","150.171.22.12","TCP","74","[TCP Dup ACK 242#10] 63394  >  443 [ACK] Seq=428 Ack=160228 Win=511 Len=0 SLE=165773 SRE=175987 SLE=161688 SRE=164313"
"274","4.170859","100.86.247.80","150.171.22.12","TCP","74","[TCP Dup ACK 242#11] 63394  >  443 [ACK] Seq=428 Ack=160228 Win=511 Len=0 SLE=165773 SRE=177194 SLE=161688 SRE=164313"
"275","4.170880","100.86.247.80","150.171.22.12","TCP","74","[TCP Dup ACK 242#12] 63394  >  443 [ACK] Seq=428 Ack=160228 Win=511 Len=0 SLE=165773 SRE=178654 SLE=161688 SRE=164313"
"276","4.170911","100.86.247.80","150.171.22.12","TCP","74","[TCP Dup ACK 242#13] 63394  >  443 [ACK] Seq=428 Ack=160228 Win=511 Len=0 SLE=165773 SRE=180114 SLE=161688 SRE=164313"
"277","4.170948","100.86.247.80","150.171.22.12","TCP","74","[TCP Dup ACK 242#14] 63394  >  443 [ACK] Seq=428 Ack=160228 Win=511 Len=0 SLE=165773 SRE=181321 SLE=161688 SRE=164313"
"278","4.170970","100.86.247.80","150.171.22.12","TCP","74","[TCP Dup ACK 242#15] 63394  >  443 [ACK] Seq=428 Ack=160228 Win=511 Len=0 SLE=165773 SRE=182781 SLE=161688 SRE=164313"
"279","4.170991","100.86.247.80","150.171.22.12","TCP","74","[TCP Dup ACK 242#16] 63394  >  443 [ACK] Seq=428 Ack=160228 Win=511 Len=0 SLE=165773 SRE=184241 SLE=161688 SRE=164313"
"280","4.171013","100.86.247.80","150.171.22.12","TCP","74","[TCP Dup ACK 242#17] 63394  >  443 [ACK] Seq=428 Ack=160228 Win=511 Len=0 SLE=165773 SRE=185448 SLE=161688 SRE=164313"
"281","4.171035","100.86.247.80","150.171.22.12","TCP","74","[TCP Dup ACK 242#18] 63394  >  443 [ACK] Seq=428 Ack=160228 Win=511 Len=0 SLE=165773 SRE=186908 SLE=161688 SRE=164313"
"282","4.171057","100.86.247.80","150.171.22.12","TCP","74","[TCP Dup ACK 242#19] 63394  >  443 [ACK] Seq=428 Ack=160228 Win=511 Len=0 SLE=165773 SRE=188368 SLE=161688 SRE=164313"
"283","4.171078","100.86.247.80","150.171.22.12","TCP","74","[TCP Dup ACK 242#20] 63394  >  443 [ACK] Seq=428 Ack=160228 Win=511 Len=0 SLE=165773 SRE=189575 SLE=161688 SRE=164313"
"284","4.171100","100.86.247.80","150.171.22.12","TCP","74","[TCP Dup ACK 242#21] 63394  >  443 [ACK] Seq=428 Ack=160228 Win=511 Len=0 SLE=165773 SRE=191035 SLE=161688 SRE=164313"
"285","4.171121","100.86.247.80","150.171.22.12","TCP","74","[TCP Dup ACK 242#22] 63394  >  443 [ACK] Seq=428 Ack=160228 Win=511 Len=0 SLE=165773 SRE=191289 SLE=161688 SRE=164313"
"286","4.181659","150.171.22.12","100.86.247.80","TCP","1514","[TCP Fast Retransmission] 443  >  63394 [ACK] Seq=160228 Ack=428 Win=16382 Len=1460"
"287","4.182059","100.86.247.80","150.171.22.12","TCP","66","63394  >  443 [ACK] Seq=428 Ack=164313 Win=511 Len=0 SLE=165773 SRE=191289"
"288","4.188318","150.171.22.12","100.86.247.80","TCP","1514","[TCP Retransmission] 443  >  63394 [ACK] Seq=164313 Ack=428 Win=16382 Len=1460"
"289","4.188586","100.86.247.80","150.171.22.12","TCP","54","63394  >  443 [ACK] Seq=428 Ack=191289 Win=511 Len=0"
"290","4.211729","150.171.22.12","100.86.247.80","TLSv1.2","138","Application Data"
"291","4.212979","150.171.22.12","100.86.247.80","TLSv1.2","172","Application Data"
"292","4.212979","150.171.22.12","100.86.247.80","TLSv1.2","191","Application Data"
"293","4.212979","150.171.22.12","100.86.247.80","TLSv1.2","95","Application Data"
"294","4.213335","100.86.247.80","150.171.22.12","TCP","54","63394  >  443 [ACK] Seq=428 Ack=191491 Win=511 Len=0"
"295","4.213583","100.86.247.80","150.171.22.12","TCP","54","63394  >  443 [ACK] Seq=428 Ack=191669 Win=510 Len=0"
"296","4.215493","150.171.22.12","100.86.247.80","TLSv1.2","85","Application Data"
"297","4.257664","100.86.247.80","150.171.22.12","TCP","54","63394  >  443 [ACK] Seq=428 Ack=191700 Win=510 Len=0"
"298","4.359211","100.86.247.80","150.171.22.12","TCP","1494","63394  >  443 [ACK] Seq=428 Ack=191700 Win=510 Len=1440 [TCP PDU reassembled in 302]"
"299","4.359211","100.86.247.80","150.171.22.12","TCP","1494","63394  >  443 [ACK] Seq=1868 Ack=191700 Win=510 Len=1440 [TCP PDU reassembled in 302]"
"300","4.359211","100.86.247.80","150.171.22.12","TCP","1494","63394  >  443 [ACK] Seq=3308 Ack=191700 Win=510 Len=1440 [TCP PDU reassembled in 302]"
"301","4.359211","100.86.247.80","150.171.22.12","TCP","1494","63394  >  443 [ACK] Seq=4748 Ack=191700 Win=510 Len=1440 [TCP PDU reassembled in 302]"
"302","4.359211","100.86.247.80","150.171.22.12","TLSv1.2","549","Application Data"
"303","4.359349","100.86.247.80","150.171.22.12","TLSv1.2","266","Application Data"
"304","4.360501","100.86.247.80","150.171.22.12","TCP","1494","63394  >  443 [ACK] Seq=6895 Ack=191700 Win=510 Len=1440 [TCP PDU reassembled in 308]"
"305","4.360501","100.86.247.80","150.171.22.12","TCP","1494","63394  >  443 [ACK] Seq=8335 Ack=191700 Win=510 Len=1440 [TCP PDU reassembled in 308]"
"306","4.360501","100.86.247.80","150.171.22.12","TCP","1494","63394  >  443 [ACK] Seq=9775 Ack=191700 Win=510 Len=1440 [TCP PDU reassembled in 308]"
"307","4.360501","100.86.247.80","150.171.22.12","TCP","1494","63394  >  443 [ACK] Seq=11215 Ack=191700 Win=510 Len=1440 [TCP PDU reassembled in 308]"
"308","4.360501","100.86.247.80","150.171.22.12","TLSv1.2","587","Application Data"
"309","4.371248","150.171.22.12","100.86.247.80","TCP","56","443  >  63394 [ACK] Seq=191700 Ack=6895 Win=16385 Len=0"
"310","4.372014","150.171.22.12","100.86.247.80","TCP","56","443  >  63394 [ACK] Seq=191700 Ack=13188 Win=16385 Len=0"
"311","4.441262","150.171.22.12","100.86.247.80","TLSv1.2","362","Application Data"
"312","4.453464","150.171.22.12","100.86.247.80","TCP","1514","443  >  63394 [ACK] Seq=192008 Ack=13188 Win=16385 Len=1460 [TCP PDU reassembled in 314]"
"313","4.453758","100.86.247.80","150.171.22.12","TCP","54","63394  >  443 [ACK] Seq=13188 Ack=193468 Win=511 Len=0"
"314","4.456765","150.171.22.12","100.86.247.80","TLSv1.2","1488","Application Data"
"315","4.503402","100.86.247.80","150.171.22.12","TCP","54","63394  >  443 [ACK] Seq=13188 Ack=194902 Win=506 Len=0"
"316","4.581641","100.86.247.80","150.171.22.12","TCP","1494","63394  >  443 [ACK] Seq=13188 Ack=194902 Win=506 Len=1440 [TCP PDU reassembled in 320]"
"317","4.581641","100.86.247.80","150.171.22.12","TCP","1494","63394  >  443 [ACK] Seq=14628 Ack=194902 Win=506 Len=1440 [TCP PDU reassembled in 320]"
"318","4.581641","100.86.247.80","150.171.22.12","TCP","1494","63394  >  443 [ACK] Seq=16068 Ack=194902 Win=506 Len=1440 [TCP PDU reassembled in 320]"
"319","4.581641","100.86.247.80","150.171.22.12","TCP","1494","63394  >  443 [ACK] Seq=17508 Ack=194902 Win=506 Len=1440 [TCP PDU reassembled in 320]"
"320","4.581641","100.86.247.80","150.171.22.12","TLSv1.2","805","Application Data"
"321","4.581833","100.86.247.80","150.171.22.12","TLSv1.2","437","Application Data"
"322","4.592274","150.171.22.12","100.86.247.80","TCP","56","443  >  63394 [ACK] Seq=194902 Ack=20082 Win=16385 Len=0"
"323","4.698239","150.171.22.12","100.86.247.80","TLSv1.2","686","Application Data"
"324","4.698644","150.171.22.12","100.86.247.80","TLSv1.2","85","Application Data"
"325","4.698901","100.86.247.80","150.171.22.12","TCP","54","63394  >  443 [ACK] Seq=20082 Ack=195565 Win=511 Len=0"
