"No.","Time","Source","Destination","Protocol","Length","Info"
"1","0.000000","192.168.12.35","146.75.37.140","UDP","80","52870  >  443 Len=38"
"2","0.561877","192.168.12.35","146.75.37.140","UDP","80","52870  >  443 Len=38"
"3","0.785957","146.75.37.140","192.168.12.35","UDP","69","443  >  52870 Len=27"
"4","0.918840","146.75.37.140","192.168.12.35","UDP","71","443  >  52870 Len=29"
"5","2.095613","192.168.12.35","146.75.37.140","TLSv1.2","3246","Application Data"
"6","2.095715","192.168.12.35","146.75.37.140","TLSv1.2","93","Application Data"
"7","2.100197","192.168.12.35","146.75.37.140","TLSv1.2","3411","Application Data"
"8","2.100284","192.168.12.35","146.75.37.140","TLSv1.2","966","Application Data"
"9","2.149306","146.75.37.140","192.168.12.35","TCP","54","443  >  61013 [ACK] Seq=1 Ack=1397 Win=8244 Len=0"
"10","2.169269","146.75.37.140","192.168.12.35","TCP","54","443  >  61013 [ACK] Seq=1 Ack=2793 Win=8244 Len=0"
"11","2.179275","146.75.37.140","192.168.12.35","TCP","54","443  >  61013 [ACK] Seq=1 Ack=3193 Win=8244 Len=0"
"12","2.179275","146.75.37.140","192.168.12.35","TCP","54","443  >  61013 [ACK] Seq=1 Ack=3232 Win=8244 Len=0"
"13","2.185141","146.75.37.140","192.168.12.35","TLSv1.2","93","Application Data"
"14","2.206366","146.75.37.140","192.168.12.35","TCP","54","443  >  61013 [ACK] Seq=40 Ack=4628 Win=8244 Len=0"
"15","2.220416","146.75.37.140","192.168.12.35","TLSv1.2","579","Application Data"
"16","2.220416","146.75.37.140","192.168.12.35","TLSv1.2","1123","Application Data"
"17","2.220733","192.168.12.35","146.75.37.140","TCP","54","61013  >  443 [ACK] Seq=7501 Ack=565 Win=1022 Len=0"
"18","2.220855","192.168.12.35","146.75.37.140","TCP","54","61013  >  443 [ACK] Seq=7501 Ack=1634 Win=1025 Len=0"
"19","2.223458","146.75.37.140","192.168.12.35","TLSv1.2","428","Application Data"
"20","2.223948","192.168.12.35","146.75.37.140","TCP","54","61013  >  443 [ACK] Seq=7501 Ack=2008 Win=1023 Len=0"
"21","2.226814","192.168.12.35","146.75.37.140","TLSv1.2","89","Application Data"
"22","2.229111","146.75.37.140","192.168.12.35","TCP","54","443  >  61013 [ACK] Seq=2008 Ack=6024 Win=8244 Len=0"
"23","2.240583","146.75.37.140","192.168.12.35","TCP","54","443  >  61013 [ACK] Seq=2008 Ack=6589 Win=8244 Len=0"
"24","2.254048","146.75.37.140","192.168.12.35","TCP","54","443  >  61013 [ACK] Seq=2008 Ack=7501 Win=8244 Len=0"
"25","2.259058","146.75.37.140","192.168.12.35","TCP","54","443  >  61013 [ACK] Seq=2008 Ack=7536 Win=8244 Len=0"
"26","2.271024","146.75.37.140","192.168.12.35","TLSv1.2","223","Application Data"
"27","2.277349","146.75.37.140","192.168.12.35","TLSv1.2","296","Application Data"
"28","2.278058","192.168.12.35","146.75.37.140","TCP","54","61013  >  443 [ACK] Seq=7536 Ack=2419 Win=1022 Len=0"
"29","2.285992","146.75.37.140","192.168.12.35","TLSv1.2","655","Application Data"
"30","2.291310","146.75.37.140","192.168.12.35","TCP","1430","443  >  61013 [ACK] Seq=3020 Ack=7536 Win=8244 Len=1376 [TCP PDU reassembled in 32]"
"31","2.291310","146.75.37.140","192.168.12.35","TCP","1430","443  >  61013 [PSH, ACK] Seq=4396 Ack=7536 Win=8244 Len=1376 [TCP PDU reassembled in 32]"
"32","2.291310","146.75.37.140","192.168.12.35","TLSv1.2","887","Application Data"
"33","2.291310","146.75.37.140","192.168.12.35","TLSv1.2","194","Application Data"
"34","2.291310","146.75.37.140","192.168.12.35","TCP","1430","443  >  61013 [ACK] Seq=6745 Ack=7536 Win=8244 Len=1376 [TCP PDU reassembled in 35]"
"35","2.291310","146.75.37.140","192.168.12.35","TLSv1.2","802","Application Data"
"36","2.291310","146.75.37.140","192.168.12.35","TLSv1.2","406","Application Data"
"37","2.291310","146.75.37.140","192.168.12.35","TLSv1.2","161","Application Data"
"38","2.291310","146.75.37.140","192.168.12.35","TLSv1.2","329","Application Data"
"39","2.291964","192.168.12.35","146.75.37.140","TCP","54","61013  >  443 [ACK] Seq=7536 Ack=5772 Win=1025 Len=0"
"40","2.292121","192.168.12.35","146.75.37.140","TCP","54","61013  >  443 [ACK] Seq=7536 Ack=6605 Win=1021 Len=0"
"41","2.292162","192.168.12.35","146.75.37.140","TCP","54","61013  >  443 [ACK] Seq=7536 Ack=8121 Win=1025 Len=0"
"42","2.292192","192.168.12.35","146.75.37.140","TCP","54","61013  >  443 [ACK] Seq=7536 Ack=9221 Win=1020 Len=0"
"43","2.292229","192.168.12.35","146.75.37.140","TCP","54","61013  >  443 [ACK] Seq=7536 Ack=9603 Win=1025 Len=0"
"44","2.296369","146.75.37.140","192.168.12.35","TLSv1.2","353","Application Data"
"45","2.296369","146.75.37.140","192.168.12.35","TLSv1.2","152","Application Data"
"46","2.296369","146.75.37.140","192.168.12.35","TLSv1.2","185","Application Data"
"47","2.296369","146.75.37.140","192.168.12.35","TLSv1.2","400","Application Data"
"48","2.296369","146.75.37.140","192.168.12.35","TLSv1.2","129","Application Data"
"49","2.296369","146.75.37.140","192.168.12.35","TLSv1.2","104","Application Data"
"50","2.296369","146.75.37.140","192.168.12.35","TLSv1.2","132","Application Data"
"51","2.296369","146.75.37.140","192.168.12.35","TLSv1.2","169","Application Data"
"52","2.296369","146.75.37.140","192.168.12.35","TLSv1.2","124","Application Data"
"53","2.296369","146.75.37.140","192.168.12.35","TLSv1.2","170","Application Data"
"54","2.296369","146.75.37.140","192.168.12.35","TLSv1.2","138","Application Data"
"55","2.296369","146.75.37.140","192.168.12.35","TLSv1.2","324","Application Data"
"56","2.296369","146.75.37.140","192.168.12.35","TLSv1.2","269","Application Data"
"57","2.296369","146.75.37.140","192.168.12.35","TLSv1.2","163","Application Data"
"58","2.296369","146.75.37.140","192.168.12.35","TLSv1.2","105","Application Data"
"59","2.297060","192.168.12.35","146.75.37.140","TCP","54","61013  >  443 [ACK] Seq=7536 Ack=10000 Win=1023 Len=0"
"60","2.297273","192.168.12.35","146.75.37.140","TCP","54","61013  >  443 [ACK] Seq=7536 Ack=10477 Win=1021 Len=0"
"61","2.297341","192.168.12.35","146.75.37.140","TCP","54","61013  >  443 [ACK] Seq=7536 Ack=10602 Win=1021 Len=0"
"62","2.297384","192.168.12.35","146.75.37.140","TCP","54","61013  >  443 [ACK] Seq=7536 Ack=10795 Win=1020 Len=0"
"63","2.297441","192.168.12.35","146.75.37.140","TCP","54","61013  >  443 [ACK] Seq=7536 Ack=10981 Win=1019 Len=0"
"64","2.297524","192.168.12.35","146.75.37.140","TCP","54","61013  >  443 [ACK] Seq=7536 Ack=11335 Win=1025 Len=0"
"65","2.297583","192.168.12.35","146.75.37.140","TCP","54","61013  >  443 [ACK] Seq=7536 Ack=11659 Win=1023 Len=0"
"66","2.347835","192.168.12.35","146.75.37.140","TCP","54","61013  >  443 [ACK] Seq=7536 Ack=11710 Win=1023 Len=0"
"67","2.356630","146.75.37.140","192.168.12.35","TCP","1430","443  >  61013 [ACK] Seq=11710 Ack=7536 Win=8244 Len=1376 [TCP PDU reassembled in 68]"
"68","2.356630","146.75.37.140","192.168.12.35","TLSv1.2","954","Application Data"
"69","2.356943","192.168.12.35","146.75.37.140","TCP","54","61013  >  443 [ACK] Seq=7536 Ack=13986 Win=1025 Len=0"
"70","2.436382","146.75.37.140","192.168.12.35","TLSv1.2","206","Application Data"
"71","2.449527","146.75.37.140","192.168.12.35","TLSv1.2","938","Application Data"
"72","2.449717","192.168.12.35","146.75.37.140","TCP","54","61013  >  443 [ACK] Seq=7536 Ack=15022 Win=1021 Len=0"
"73","2.475934","146.75.37.140","192.168.12.35","TLSv1.2","98","Application Data"
"74","2.475934","146.75.37.140","192.168.12.35","TLSv1.2","163","Application Data"
"75","2.477084","192.168.12.35","146.75.37.140","TCP","54","61013  >  443 [ACK] Seq=7536 Ack=15175 Win=1020 Len=0"
"76","2.488094","146.75.37.140","192.168.12.35","TCP","1430","443  >  61013 [ACK] Seq=15175 Ack=7536 Win=8244 Len=1376 [TCP PDU reassembled in 77]"
"77","2.488094","146.75.37.140","192.168.12.35","TLSv1.2","983","Application Data"
"78","2.488094","146.75.37.140","192.168.12.35","TLSv1.2","1389","Application Data"
"79","2.488094","146.75.37.140","192.168.12.35","TLSv1.2","419","Application Data"
"80","2.489121","192.168.12.35","146.75.37.140","TCP","54","61013  >  443 [ACK] Seq=7536 Ack=17480 Win=1025 Len=0"
"81","2.489516","192.168.12.35","146.75.37.140","TCP","54","61013  >  443 [ACK] Seq=7536 Ack=19180 Win=1025 Len=0"
"82","2.503111","146.75.37.140","192.168.12.35","TLSv1.2","482","Application Data"
"83","2.503111","146.75.37.140","192.168.12.35","TLSv1.2","1169","Application Data"
"84","2.503111","146.75.37.140","192.168.12.35","TLSv1.2","588","Application Data"
"85","2.503111","146.75.37.140","192.168.12.35","TLSv1.2","1178","Application Data"
"86","2.503111","146.75.37.140","192.168.12.35","TLSv1.2","346","Application Data"
"87","2.503111","146.75.37.140","192.168.12.35","TLSv1.2","193","Application Data"
"88","2.503111","146.75.37.140","192.168.12.35","TLSv1.2","215","Application Data"
"89","2.503111","146.75.37.140","192.168.12.35","TCP","1430","443  >  61013 [ACK] Seq=22973 Ack=7536 Win=8244 Len=1376 [TCP PDU reassembled in 90]"
"90","2.503111","146.75.37.140","192.168.12.35","TLSv1.2","376","Application Data"
"91","2.503111","146.75.37.140","192.168.12.35","TCP","1430","443  >  61013 [ACK] Seq=24671 Ack=7536 Win=8244 Len=1376 [TCP PDU reassembled in 94]"
"92","2.503111","146.75.37.140","192.168.12.35","TCP","1430","443  >  61013 [ACK] Seq=26047 Ack=7536 Win=8244 Len=1376 [TCP PDU reassembled in 94]"
"93","2.503111","146.75.37.140","192.168.12.35","TCP","1430","443  >  61013 [PSH, ACK] Seq=27423 Ack=7536 Win=8244 Len=1376 [TCP PDU reassembled in 94]"
"94","2.503111","146.75.37.140","192.168.12.35","TLSv1.2","1076","Application Data"
"95","2.503754","192.168.12.35","146.75.37.140","TCP","54","61013  >  443 [ACK] Seq=7536 Ack=20723 Win=1025 Len=0"
"96","2.504154","192.168.12.35","146.75.37.140","TCP","54","61013  >  443 [ACK] Seq=7536 Ack=22381 Win=1025 Len=0"
"97","2.504224","192.168.12.35","146.75.37.140","TCP","54","61013  >  443 [ACK] Seq=7536 Ack=22812 Win=1023 Len=0"
"98","2.504294","192.168.12.35","146.75.37.140","TCP","54","61013  >  443 [ACK] Seq=7536 Ack=24349 Win=1025 Len=0"
"99","2.504366","192.168.12.35","146.75.37.140","TCP","54","61013  >  443 [ACK] Seq=7536 Ack=28799 Win=1025 Len=0"
"100","2.515624","146.75.37.140","192.168.12.35","TLSv1.2","750","Application Data"
"101","2.515624","146.75.37.140","192.168.12.35","TCP","1430","443  >  61013 [ACK] Seq=30517 Ack=7536 Win=8244 Len=1376 [TCP PDU reassembled in 102]"
"102","2.515624","146.75.37.140","192.168.12.35","TLSv1.2","544","Application Data"
"103","2.515624","146.75.37.140","192.168.12.35","TLSv1.2","1114","Application Data"
"104","2.515624","146.75.37.140","192.168.12.35","TLSv1.2","127","Application Data"
"105","2.515624","146.75.37.140","192.168.12.35","TLSv1.2","415","Application Data"
"106","2.515624","146.75.37.140","192.168.12.35","TLSv1.2","315","Application Data"
"107","2.515624","146.75.37.140","192.168.12.35","TLSv1.2","402","Application Data"
"108","2.515624","146.75.37.140","192.168.12.35","TLSv1.2","571","Application Data"
"109","2.515624","146.75.37.140","192.168.12.35","TLSv1.2","507","Application Data"
"110","2.515624","146.75.37.140","192.168.12.35","TLSv1.2","114","Application Data"
"111","2.515624","146.75.37.140","192.168.12.35","TCP","1430","443  >  61013 [ACK] Seq=35516 Ack=7536 Win=8244 Len=1376 [TCP PDU reassembled in 112]"
"112","2.515624","146.75.37.140","192.168.12.35","TLSv1.2","101","Application Data"
"113","2.515624","146.75.37.140","192.168.12.35","TLSv1.2","1061","Application Data"
"114","2.515624","146.75.37.140","192.168.12.35","TCP","1430","443  >  61013 [ACK] Seq=37946 Ack=7536 Win=8244 Len=1376 [TCP PDU reassembled in 115]"
"115","2.515624","146.75.37.140","192.168.12.35","TLSv1.2","402","Application Data"
"116","2.515624","146.75.37.140","192.168.12.35","TLSv1.2","374","Application Data"
"117","2.515624","146.75.37.140","192.168.12.35","TLSv1.2","113","Application Data"
"118","2.515624","146.75.37.140","192.168.12.35","TLSv1.2","85","Application Data"
"119","2.516166","192.168.12.35","146.75.37.140","TCP","54","61013  >  443 [ACK] Seq=7536 Ack=30517 Win=1025 Len=0"
"120","2.516302","192.168.12.35","146.75.37.140","TCP","54","61013  >  443 [ACK] Seq=7536 Ack=32383 Win=1025 Len=0"
"121","2.516338","192.168.12.35","146.75.37.140","TCP","54","61013  >  443 [ACK] Seq=7536 Ack=33516 Win=1020 Len=0"
"122","2.516366","192.168.12.35","146.75.37.140","TCP","54","61013  >  443 [ACK] Seq=7536 Ack=34138 Win=1025 Len=0"
"123","2.516416","192.168.12.35","146.75.37.140","TCP","54","61013  >  443 [ACK] Seq=7536 Ack=35003 Win=1021 Len=0"
"124","2.516449","192.168.12.35","146.75.37.140","TCP","54","61013  >  443 [ACK] Seq=7536 Ack=35516 Win=1019 Len=0"
"125","2.516477","192.168.12.35","146.75.37.140","TCP","54","61013  >  443 [ACK] Seq=7536 Ack=36939 Win=1025 Len=0"
"126","2.516503","192.168.12.35","146.75.37.140","TCP","54","61013  >  443 [ACK] Seq=7536 Ack=39322 Win=1025 Len=0"
"127","2.516540","192.168.12.35","146.75.37.140","TCP","54","61013  >  443 [ACK] Seq=7536 Ack=39990 Win=1022 Len=0"
"128","2.516575","192.168.12.35","146.75.37.140","TCP","54","61013  >  443 [ACK] Seq=7536 Ack=40080 Win=1022 Len=0"
"129","2.654947","192.168.12.35","146.75.37.140","TLSv1.2","3401","Application Data"
"130","2.655364","192.168.12.35","146.75.37.140","TLSv1.2","210","Application Data"
"131","2.673562","192.168.12.35","146.75.37.140","TLSv1.2","3402","Application Data"
"132","2.673757","192.168.12.35","146.75.37.140","TLSv1.2","261","Application Data"
"133","2.683051","192.168.12.35","146.75.37.140","TLSv1.2","233","Application Data"
"134","2.683206","192.168.12.35","146.75.37.140","TLSv1.2","93","Application Data"
"135","2.683240","192.168.12.35","146.75.37.140","TLSv1.2","207","Application Data"
"136","2.683269","192.168.12.35","146.75.37.140","TLSv1.2","206","Application Data"
"137","2.704214","146.75.37.140","192.168.12.35","TCP","54","443  >  61013 [ACK] Seq=40080 Ack=8932 Win=8244 Len=0"
"138","2.706803","192.168.12.35","146.75.37.140","TLSv1.2","3410","Application Data"
"139","2.707154","192.168.12.35","146.75.37.140","TLSv1.2","2829","Application Data"
"140","2.707186","192.168.12.35","146.75.37.140","TLSv1.2","3421","Application Data"
"141","2.728518","192.168.12.35","146.75.37.140","TLSv1.2","3369","Application Data"
"142","2.737036","146.75.37.140","192.168.12.35","TCP","54","443  >  61013 [ACK] Seq=40080 Ack=10328 Win=8244 Len=0"
"143","2.755728","192.168.12.35","146.75.37.140","TLSv1.2","3211","Application Data"
"144","2.756305","192.168.12.35","146.75.37.140","TLSv1.2","3250","Application Data"
"145","2.775578","192.168.12.35","146.75.37.140","TLSv1.2","143","Application Data"
"146","2.787364","146.75.37.140","192.168.12.35","TCP","54","443  >  61013 [ACK] Seq=40080 Ack=10883 Win=8244 Len=0"
"147","2.787364","146.75.37.140","192.168.12.35","TCP","54","443  >  61013 [ACK] Seq=40080 Ack=11039 Win=8244 Len=0"
"148","2.787364","146.75.37.140","192.168.12.35","TCP","54","443  >  61013 [ACK] Seq=40080 Ack=12435 Win=8244 Len=0"
"149","2.787510","192.168.12.35","146.75.37.140","TLSv1.2","3262","Application Data"
"150","2.788299","192.168.12.35","146.75.37.140","TLSv1.2","3246","Application Data"
"151","2.788460","192.168.12.35","146.75.37.140","TLSv1.2","3261","Application Data"
"152","2.794514","146.75.37.140","192.168.12.35","TCP","54","443  >  61013 [ACK] Seq=40080 Ack=13831 Win=8244 Len=0"
"153","2.799160","192.168.12.35","146.75.37.140","TLSv1.2","245","Application Data"
"154","2.799247","192.168.12.35","146.75.37.140","TLSv1.2","93","Application Data"
"155","2.799286","192.168.12.35","146.75.37.140","TLSv1.2","90","Application Data"
"156","2.800396","146.75.37.140","192.168.12.35","TCP","54","443  >  61013 [ACK] Seq=40080 Ack=14387 Win=8244 Len=0"
"157","2.800396","146.75.37.140","192.168.12.35","TCP","54","443  >  61013 [ACK] Seq=40080 Ack=14594 Win=8244 Len=0"
"158","2.803934","146.75.37.140","192.168.12.35","TCP","54","443  >  61039 [ACK] Seq=1 Ack=180 Win=424 Len=0"
"159","2.803934","146.75.37.140","192.168.12.35","TCP","54","443  >  61039 [ACK] Seq=1 Ack=219 Win=424 Len=0"
"160","2.803934","146.75.37.140","192.168.12.35","TLSv1.2","93","Application Data"
"161","2.812075","146.75.37.140","192.168.12.35","TLSv1.2","744","Application Data"
"162","2.812075","146.75.37.140","192.168.12.35","TCP","1430","443  >  61039 [ACK] Seq=730 Ack=219 Win=424 Len=1376 [TCP PDU reassembled in 165]"
"163","2.812075","146.75.37.140","192.168.12.35","TCP","1430","443  >  61039 [ACK] Seq=2106 Ack=219 Win=424 Len=1376 [TCP PDU reassembled in 165]"
"164","2.812075","146.75.37.140","192.168.12.35","TCP","1430","443  >  61039 [ACK] Seq=3482 Ack=219 Win=424 Len=1376 [TCP PDU reassembled in 165]"
"165","2.812075","146.75.37.140","192.168.12.35","TLSv1.2","1161","Application Data"
"166","2.812075","146.75.37.140","192.168.12.35","TCP","54","443  >  61039 [ACK] Seq=5965 Ack=372 Win=424 Len=0"
"167","2.812075","146.75.37.140","192.168.12.35","TLSv1.2","173","Application Data"
"168","2.812075","146.75.37.140","192.168.12.35","TCP","1430","443  >  61039 [ACK] Seq=6084 Ack=372 Win=424 Len=1376 [TCP PDU reassembled in 171]"
"169","2.812075","146.75.37.140","192.168.12.35","TCP","1430","443  >  61039 [ACK] Seq=7460 Ack=372 Win=424 Len=1376 [TCP PDU reassembled in 171]"
"170","2.812075","146.75.37.140","192.168.12.35","TCP","1430","443  >  61039 [ACK] Seq=8836 Ack=372 Win=424 Len=1376 [TCP PDU reassembled in 171]"
"171","2.812075","146.75.37.140","192.168.12.35","TLSv1.2","183","Application Data"
"172","2.812075","146.75.37.140","192.168.12.35","TCP","54","443  >  61039 [ACK] Seq=10341 Ack=524 Win=424 Len=0"
"173","2.812075","146.75.37.140","192.168.12.35","TLSv1.2","152","Application Data"
"174","2.812075","146.75.37.140","192.168.12.35","TCP","1430","443  >  61039 [ACK] Seq=10439 Ack=524 Win=424 Len=1376 [TCP PDU reassembled in 176]"
"175","2.812075","146.75.37.140","192.168.12.35","TCP","1430","443  >  61039 [ACK] Seq=11815 Ack=524 Win=424 Len=1376 [TCP PDU reassembled in 176]"
"176","2.812075","146.75.37.140","192.168.12.35","TLSv1.2","463","Application Data"
"177","2.812651","192.168.12.35","146.75.37.140","TCP","54","61039  >  443 [ACK] Seq=649 Ack=730 Win=4100 Len=0"
"178","2.812821","192.168.12.35","146.75.37.140","TCP","54","61039  >  443 [ACK] Seq=649 Ack=4858 Win=4100 Len=0"
"179","2.812879","192.168.12.35","146.75.37.140","TCP","54","61039  >  443 [ACK] Seq=649 Ack=5965 Win=4096 Len=0"
"180","2.812939","192.168.12.35","146.75.37.140","TCP","54","61039  >  443 [ACK] Seq=649 Ack=10212 Win=4100 Len=0"
"181","2.812999","192.168.12.35","146.75.37.140","TCP","54","61039  >  443 [ACK] Seq=649 Ack=10439 Win=4099 Len=0"
"182","2.813030","192.168.12.35","146.75.37.140","TCP","54","61039  >  443 [ACK] Seq=649 Ack=13191 Win=4100 Len=0"
"183","2.814241","192.168.12.35","146.75.37.140","TLSv1.2","89","Application Data"
"184","2.817171","146.75.37.140","192.168.12.35","TCP","1430","443  >  61013 [ACK] Seq=40080 Ack=14594 Win=8244 Len=1376 [TCP PDU reassembled in 185]"
"185","2.817171","146.75.37.140","192.168.12.35","TLSv1.2","285","Application Data"
"186","2.817171","146.75.37.140","192.168.12.35","TLSv1.2","222","Application Data"
"187","2.817623","192.168.12.35","146.75.37.140","TCP","54","61013  >  443 [ACK] Seq=43367 Ack=41456 Win=1025 Len=0"
"188","2.817811","192.168.12.35","146.75.37.140","TCP","54","61013  >  443 [ACK] Seq=43367 Ack=41687 Win=1024 Len=0"
"189","2.836441","146.75.37.140","192.168.12.35","TCP","54","443  >  61013 [ACK] Seq=41855 Ack=15990 Win=8244 Len=0"
"190","2.849003","146.75.37.140","192.168.12.35","TCP","54","443  >  61013 [ACK] Seq=41855 Ack=17386 Win=8244 Len=0"
"191","2.859562","146.75.37.140","192.168.12.35","TCP","54","443  >  61013 [ACK] Seq=41855 Ack=17950 Win=8244 Len=0"
"192","2.872239","192.168.12.35","146.75.37.140","TCP","54","61013  >  443 [ACK] Seq=43367 Ack=41855 Win=1023 Len=0"
"193","2.887995","146.75.37.140","192.168.12.35","TCP","54","443  >  61013 [ACK] Seq=41855 Ack=19346 Win=8244 Len=0"
"194","2.887995","146.75.37.140","192.168.12.35","TCP","1430","443  >  61013 [ACK] Seq=41855 Ack=19346 Win=8244 Len=1376 [TCP PDU reassembled in 195]"
"195","2.887995","146.75.37.140","192.168.12.35","TLSv1.2","1128","Application Data"
"196","2.888601","192.168.12.35","146.75.37.140","TCP","54","61013  >  443 [ACK] Seq=43367 Ack=43231 Win=1025 Len=0"
"197","2.888758","192.168.12.35","146.75.37.140","TCP","54","61013  >  443 [ACK] Seq=43367 Ack=44305 Win=1020 Len=0"
"198","2.904210","146.75.37.140","192.168.12.35","TCP","54","443  >  61013 [ACK] Seq=44305 Ack=20725 Win=8244 Len=0"
"199","2.915995","192.168.12.35","146.75.37.140","TLSv1.2","439","Application Data"
"200","2.916139","192.168.12.35","146.75.37.140","TLSv1.2","93","Application Data"
"201","2.918709","146.75.37.140","192.168.12.35","TCP","1430","443  >  61013 [ACK] Seq=44305 Ack=20725 Win=8244 Len=1376 [TCP PDU reassembled in 202]"
"202","2.918709","146.75.37.140","192.168.12.35","TLSv1.2","300","Application Data"
"203","2.918956","192.168.12.35","146.75.37.140","TCP","54","61013  >  443 [ACK] Seq=43367 Ack=45681 Win=1025 Len=0"
"204","2.919074","192.168.12.35","146.75.37.140","TCP","54","61013  >  443 [ACK] Seq=43367 Ack=45927 Win=1024 Len=0"
"205","2.933989","146.75.37.140","192.168.12.35","TCP","54","443  >  61013 [ACK] Seq=45927 Ack=22121 Win=8244 Len=0"
"206","2.949254","146.75.37.140","192.168.12.35","TCP","54","443  >  61013 [ACK] Seq=45927 Ack=23517 Win=8244 Len=0"
"207","2.956323","146.75.37.140","192.168.12.35","TCP","54","443  >  61013 [ACK] Seq=45927 Ack=24092 Win=8244 Len=0"
"208","2.995914","146.75.37.140","192.168.12.35","TCP","1430","443  >  61013 [ACK] Seq=45927 Ack=24092 Win=8244 Len=1376 [TCP PDU reassembled in 209]"
"209","2.995914","146.75.37.140","192.168.12.35","TLSv1.2","970","Application Data"
"210","2.995914","146.75.37.140","192.168.12.35","TCP","54","443  >  61013 [ACK] Seq=48219 Ack=25488 Win=8244 Len=0"
"211","2.996741","192.168.12.35","146.75.37.140","TCP","54","61013  >  443 [ACK] Seq=43367 Ack=48219 Win=1025 Len=0"
"212","3.019203","146.75.37.140","192.168.12.35","TCP","54","443  >  61013 [ACK] Seq=48219 Ack=26884 Win=8244 Len=0"
"213","3.019203","146.75.37.140","192.168.12.35","TCP","54","443  >  61013 [ACK] Seq=48219 Ack=27407 Win=8244 Len=0"
"214","3.046451","146.75.37.140","192.168.12.35","TCP","1430","443  >  61013 [ACK] Seq=48219 Ack=28803 Win=8244 Len=1376 [TCP PDU reassembled in 215]"
"215","3.046451","146.75.37.140","192.168.12.35","TLSv1.2","321","Application Data"
"216","3.047738","192.168.12.35","146.75.37.140","TCP","54","61013  >  443 [ACK] Seq=43367 Ack=49862 Win=1025 Len=0"
"217","3.069392","146.75.37.140","192.168.12.35","TCP","54","443  >  61013 [ACK] Seq=49862 Ack=30564 Win=8244 Len=0"
"218","3.095766","146.75.37.140","192.168.12.35","TCP","1430","443  >  61013 [ACK] Seq=49862 Ack=31960 Win=8244 Len=1376 [TCP PDU reassembled in 219]"
"219","3.095766","146.75.37.140","192.168.12.35","TLSv1.2","1118","Application Data"
"220","3.095766","146.75.37.140","192.168.12.35","TLSv1.2","100","Application Data"
"221","3.096014","192.168.12.35","146.75.37.140","TCP","54","61013  >  443 [ACK] Seq=43367 Ack=52302 Win=1025 Len=0"
"222","3.108980","146.75.37.140","192.168.12.35","TCP","54","443  >  61013 [ACK] Seq=52348 Ack=33760 Win=8244 Len=0"
"223","3.118957","146.75.37.140","192.168.12.35","TCP","54","443  >  61039 [ACK] Seq=13600 Ack=613 Win=424 Len=0"
"224","3.118957","146.75.37.140","192.168.12.35","TLSv1.2","127","Application Data"
"225","3.118957","146.75.37.140","192.168.12.35","TCP","1430","443  >  61039 [ACK] Seq=13673 Ack=613 Win=424 Len=1376 [TCP PDU reassembled in 236]"
"226","3.118957","146.75.37.140","192.168.12.35","TCP","1430","443  >  61039 [ACK] Seq=15049 Ack=613 Win=424 Len=1376 [TCP PDU reassembled in 236]"
"227","3.118957","146.75.37.140","192.168.12.35","TCP","1430","443  >  61039 [ACK] Seq=16425 Ack=613 Win=424 Len=1376 [TCP PDU reassembled in 236]"
"228","3.118957","146.75.37.140","192.168.12.35","TCP","1430","443  >  61039 [ACK] Seq=17801 Ack=613 Win=424 Len=1376 [TCP PDU reassembled in 236]"
"229","3.118957","146.75.37.140","192.168.12.35","TCP","1430","443  >  61039 [ACK] Seq=19177 Ack=613 Win=424 Len=1376 [TCP PDU reassembled in 236]"
"230","3.118957","146.75.37.140","192.168.12.35","TCP","1430","443  >  61039 [PSH, ACK] Seq=20553 Ack=613 Win=424 Len=1376 [TCP PDU reassembled in 236]"
"231","3.118957","146.75.37.140","192.168.12.35","TCP","1430","443  >  61039 [ACK] Seq=21929 Ack=613 Win=424 Len=1376 [TCP PDU reassembled in 236]"
"232","3.118957","146.75.37.140","192.168.12.35","TCP","1430","443  >  61039 [ACK] Seq=23305 Ack=613 Win=424 Len=1376 [TCP PDU reassembled in 236]"
"233","3.118957","146.75.37.140","192.168.12.35","TCP","1430","443  >  61039 [ACK] Seq=24681 Ack=613 Win=424 Len=1376 [TCP PDU reassembled in 236]"
"234","3.118957","146.75.37.140","192.168.12.35","TCP","1430","443  >  61039 [ACK] Seq=26057 Ack=613 Win=424 Len=1376 [TCP PDU reassembled in 236]"
"235","3.118957","146.75.37.140","192.168.12.35","TCP","1430","443  >  61039 [ACK] Seq=27433 Ack=613 Win=424 Len=1376 [TCP PDU reassembled in 236]"
"236","3.118957","146.75.37.140","192.168.12.35","TLSv1.2","1430","Application Data"
"237","3.118957","146.75.37.140","192.168.12.35","TCP","1430","443  >  61039 [ACK] Seq=30185 Ack=613 Win=424 Len=1376 [TCP PDU reassembled in 244]"
"238","3.118957","146.75.37.140","192.168.12.35","TCP","1430","443  >  61039 [ACK] Seq=31561 Ack=613 Win=424 Len=1376 [TCP PDU reassembled in 244]"
"239","3.118957","146.75.37.140","192.168.12.35","TCP","1430","443  >  61039 [ACK] Seq=32937 Ack=613 Win=424 Len=1376 [TCP PDU reassembled in 244]"
"240","3.118957","146.75.37.140","192.168.12.35","TCP","1430","443  >  61039 [ACK] Seq=34313 Ack=613 Win=424 Len=1376 [TCP PDU reassembled in 244]"
"241","3.118957","146.75.37.140","192.168.12.35","TCP","1430","443  >  61039 [ACK] Seq=35689 Ack=613 Win=424 Len=1376 [TCP PDU reassembled in 244]"
"242","3.118957","146.75.37.140","192.168.12.35","TCP","1430","443  >  61039 [PSH, ACK] Seq=37065 Ack=613 Win=424 Len=1376 [TCP PDU reassembled in 244]"
"243","3.120127","146.75.37.140","192.168.12.35","TCP","1430","443  >  61039 [ACK] Seq=38441 Ack=613 Win=424 Len=1376 [TCP PDU reassembled in 244]"
"244","3.120127","146.75.37.140","192.168.12.35","TLSv1.2","731","Application Data"
"245","3.120753","192.168.12.35","146.75.37.140","TCP","54","61039  >  443 [ACK] Seq=684 Ack=38441 Win=4100 Len=0"
"246","3.121197","192.168.12.35","146.75.37.140","TCP","54","61039  >  443 [ACK] Seq=684 Ack=39817 Win=4095 Len=0"
"247","3.121250","192.168.12.35","146.75.37.140","TCP","54","61039  >  443 [ACK] Seq=684 Ack=40494 Win=4100 Len=0"
"248","3.138984","146.75.37.140","192.168.12.35","TCP","54","443  >  61013 [ACK] Seq=52348 Ack=36552 Win=8244 Len=0"
"249","3.138984","146.75.37.140","192.168.12.35","TCP","1430","443  >  61013 [ACK] Seq=52348 Ack=36552 Win=8244 Len=1376 [TCP PDU reassembled in 250]"
"250","3.138984","146.75.37.140","192.168.12.35","TLSv1.2","341","Application Data"
"251","3.139241","192.168.12.35","146.75.37.140","TCP","54","61013  >  443 [ACK] Seq=43367 Ack=53724 Win=1025 Len=0"
"252","3.143991","146.75.37.140","192.168.12.35","TCP","54","443  >  61013 [ACK] Seq=54011 Ack=36968 Win=8244 Len=0"
"253","3.174353","146.75.37.140","192.168.12.35","TCP","1430","443  >  61013 [ACK] Seq=54011 Ack=38364 Win=8244 Len=1376 [TCP PDU reassembled in 254]"
"254","3.174353","146.75.37.140","192.168.12.35","TLSv1.2","993","Application Data"
"255","3.174353","146.75.37.140","192.168.12.35","TLSv1.2","100","Application Data"
"256","3.174353","146.75.37.140","192.168.12.35","TLSv1.2","594","Application Data"
"257","3.174603","192.168.12.35","146.75.37.140","TCP","54","61013  >  443 [ACK] Seq=43367 Ack=55387 Win=1025 Len=0"
"258","3.174701","192.168.12.35","146.75.37.140","TCP","54","61013  >  443 [ACK] Seq=43367 Ack=56372 Win=1021 Len=0"
"259","3.174718","192.168.12.35","146.75.37.140","TCP","54","61013  >  443 [ACK] Seq=43367 Ack=56912 Win=1025 Len=0"
"260","3.189796","146.75.37.140","192.168.12.35","TCP","54","443  >  61013 [ACK] Seq=56912 Ack=40160 Win=8244 Len=0"
"261","3.197018","192.168.12.35","146.75.37.140","TCP","478","[TCP Retransmission] 61140  >  443 [PSH, ACK] Seq=1 Ack=1 Win=4097 Len=424"
"262","3.204234","146.75.37.140","192.168.12.35","TLSv1.2","95","Application Data"
"263","3.204455","192.168.12.35","146.75.37.140","TCP","54","61013  >  443 [ACK] Seq=43367 Ack=56953 Win=1025 Len=0"
"264","3.210847","146.75.37.140","192.168.12.35","TLSv1.2","95","Application Data"
"265","3.229557","146.75.37.140","192.168.12.35","TCP","1430","443  >  61013 [ACK] Seq=56994 Ack=42952 Win=8244 Len=1376 [TCP PDU reassembled in 266]"
"266","3.229557","146.75.37.140","192.168.12.35","TLSv1.2","344","Application Data"
"267","3.229557","146.75.37.140","192.168.12.35","TCP","54","443  >  61013 [ACK] Seq=58660 Ack=43367 Win=8244 Len=0"
"268","3.230667","192.168.12.35","146.75.37.140","TCP","54","61013  >  443 [ACK] Seq=43367 Ack=58370 Win=1025 Len=0"
"269","3.234563","146.75.37.140","192.168.12.35","TCP","54","443  >  61034 [ACK] Seq=1 Ack=192 Win=424 Len=0"
"270","3.234563","146.75.37.140","192.168.12.35","TLSv1.2","181","Application Data"
"271","3.234563","146.75.37.140","192.168.12.35","TCP","1430","443  >  61034 [ACK] Seq=128 Ack=192 Win=424 Len=1376 [TCP PDU reassembled in 281]"
"272","3.234563","146.75.37.140","192.168.12.35","TCP","1430","443  >  61034 [ACK] Seq=1504 Ack=192 Win=424 Len=1376 [TCP PDU reassembled in 281]"
"273","3.234563","146.75.37.140","192.168.12.35","TCP","1430","443  >  61034 [ACK] Seq=2880 Ack=192 Win=424 Len=1376 [TCP PDU reassembled in 281]"
"274","3.234563","146.75.37.140","192.168.12.35","TCP","1430","443  >  61034 [ACK] Seq=4256 Ack=192 Win=424 Len=1376 [TCP PDU reassembled in 281]"
"275","3.234563","146.75.37.140","192.168.12.35","TCP","1430","443  >  61034 [ACK] Seq=5632 Ack=192 Win=424 Len=1376 [TCP PDU reassembled in 281]"
"276","3.234563","146.75.37.140","192.168.12.35","TCP","1430","443  >  61034 [ACK] Seq=7008 Ack=192 Win=424 Len=1376 [TCP PDU reassembled in 281]"
"277","3.234563","146.75.37.140","192.168.12.35","TCP","1430","443  >  61034 [ACK] Seq=8384 Ack=192 Win=424 Len=1376 [TCP PDU reassembled in 281]"
"278","3.234563","146.75.37.140","192.168.12.35","TCP","1430","443  >  61034 [ACK] Seq=9760 Ack=192 Win=424 Len=1376 [TCP PDU reassembled in 281]"
"279","3.234563","146.75.37.140","192.168.12.35","TCP","1430","443  >  61034 [ACK] Seq=11136 Ack=192 Win=424 Len=1376 [TCP PDU reassembled in 281]"
"280","3.234563","146.75.37.140","192.168.12.35","TCP","1430","443  >  61034 [ACK] Seq=12512 Ack=192 Win=424 Len=1376 [TCP PDU reassembled in 281]"
"281","3.234563","146.75.37.140","192.168.12.35","TLSv1.2","1240","Application Data"
"282","3.235529","192.168.12.35","146.75.37.140","TCP","54","61034  >  443 [ACK] Seq=231 Ack=13888 Win=8201 Len=0"
"283","3.235807","192.168.12.35","146.75.37.140","TCP","54","61034  >  443 [ACK] Seq=231 Ack=15074 Win=8196 Len=0"
"284","3.238850","192.168.12.35","146.75.37.140","TLSv1.2","89","Application Data"
"285","3.254971","146.75.37.140","192.168.12.35","TCP","1430","443  >  61034 [ACK] Seq=15074 Ack=192 Win=424 Len=1376 [TCP PDU reassembled in 296]"
"286","3.254971","146.75.37.140","192.168.12.35","TCP","1430","443  >  61034 [ACK] Seq=16450 Ack=192 Win=424 Len=1376 [TCP PDU reassembled in 296]"
"287","3.254971","146.75.37.140","192.168.12.35","TCP","1430","443  >  61034 [ACK] Seq=17826 Ack=192 Win=424 Len=1376 [TCP PDU reassembled in 296]"
"288","3.254971","146.75.37.140","192.168.12.35","TCP","1430","443  >  61034 [ACK] Seq=19202 Ack=192 Win=424 Len=1376 [TCP PDU reassembled in 296]"
"289","3.254971","146.75.37.140","192.168.12.35","TCP","1430","443  >  61034 [ACK] Seq=20578 Ack=192 Win=424 Len=1376 [TCP PDU reassembled in 296]"
"290","3.254971","146.75.37.140","192.168.12.35","TCP","1430","443  >  61034 [ACK] Seq=21954 Ack=192 Win=424 Len=1376 [TCP PDU reassembled in 296]"
"291","3.254971","146.75.37.140","192.168.12.35","TCP","1430","443  >  61034 [ACK] Seq=23330 Ack=192 Win=424 Len=1376 [TCP PDU reassembled in 296]"
"292","3.254971","146.75.37.140","192.168.12.35","TCP","1430","443  >  61034 [ACK] Seq=24706 Ack=192 Win=424 Len=1376 [TCP PDU reassembled in 296]"
"293","3.254971","146.75.37.140","192.168.12.35","TCP","1430","443  >  61034 [ACK] Seq=26082 Ack=192 Win=424 Len=1376 [TCP PDU reassembled in 296]"
"294","3.254971","146.75.37.140","192.168.12.35","TCP","1430","443  >  61034 [ACK] Seq=27458 Ack=192 Win=424 Len=1376 [TCP PDU reassembled in 296]"
"295","3.254971","146.75.37.140","192.168.12.35","TCP","1430","443  >  61034 [ACK] Seq=28834 Ack=192 Win=424 Len=1376 [TCP PDU reassembled in 296]"
"296","3.254971","146.75.37.140","192.168.12.35","TLSv1.2","1355","Application Data, Application Data"
"297","3.254971","146.75.37.140","192.168.12.35","TCP","1430","443  >  61034 [ACK] Seq=31511 Ack=192 Win=424 Len=1376 [TCP PDU reassembled in 308]"
"298","3.254971","146.75.37.140","192.168.12.35","TCP","1430","443  >  61034 [ACK] Seq=32887 Ack=192 Win=424 Len=1376 [TCP PDU reassembled in 308]"
"299","3.254971","146.75.37.140","192.168.12.35","TCP","1430","443  >  61034 [ACK] Seq=34263 Ack=192 Win=424 Len=1376 [TCP PDU reassembled in 308]"
"300","3.254971","146.75.37.140","192.168.12.35","TCP","1430","443  >  61034 [ACK] Seq=35639 Ack=192 Win=424 Len=1376 [TCP PDU reassembled in 308]"
"301","3.254971","146.75.37.140","192.168.12.35","TCP","1430","443  >  61034 [ACK] Seq=37015 Ack=192 Win=424 Len=1376 [TCP PDU reassembled in 308]"
"302","3.254971","146.75.37.140","192.168.12.35","TCP","1430","443  >  61034 [ACK] Seq=38391 Ack=192 Win=424 Len=1376 [TCP PDU reassembled in 308]"
"303","3.254971","146.75.37.140","192.168.12.35","TCP","1430","443  >  61034 [ACK] Seq=39767 Ack=192 Win=424 Len=1376 [TCP PDU reassembled in 308]"
"304","3.254971","146.75.37.140","192.168.12.35","TCP","1430","443  >  61034 [ACK] Seq=41143 Ack=192 Win=424 Len=1376 [TCP PDU reassembled in 308]"
"305","3.254971","146.75.37.140","192.168.12.35","TCP","1430","443  >  61034 [ACK] Seq=42519 Ack=192 Win=424 Len=1376 [TCP PDU reassembled in 308]"
"306","3.254971","146.75.37.140","192.168.12.35","TCP","1430","443  >  61034 [ACK] Seq=43895 Ack=192 Win=424 Len=1376 [TCP PDU reassembled in 308]"
"307","3.254971","146.75.37.140","192.168.12.35","TCP","1430","443  >  61034 [ACK] Seq=45271 Ack=192 Win=424 Len=1376 [TCP PDU reassembled in 308]"
"308","3.254971","146.75.37.140","192.168.12.35","TLSv1.2","1430","Application Data, Application Data"
"309","3.254971","146.75.37.140","192.168.12.35","TCP","1430","443  >  61034 [ACK] Seq=48023 Ack=192 Win=424 Len=1376 [TCP PDU reassembled in 321]"
"310","3.254971","146.75.37.140","192.168.12.35","TCP","1430","443  >  61034 [ACK] Seq=49399 Ack=192 Win=424 Len=1376 [TCP PDU reassembled in 321]"
"311","3.254971","146.75.37.140","192.168.12.35","TCP","1430","443  >  61034 [ACK] Seq=50775 Ack=192 Win=424 Len=1376 [TCP PDU reassembled in 321]"
"312","3.254971","146.75.37.140","192.168.12.35","TCP","1430","443  >  61034 [ACK] Seq=52151 Ack=192 Win=424 Len=1376 [TCP PDU reassembled in 321]"
"313","3.254971","146.75.37.140","192.168.12.35","TCP","1430","443  >  61034 [ACK] Seq=53527 Ack=192 Win=424 Len=1376 [TCP PDU reassembled in 321]"
"314","3.254971","146.75.37.140","192.168.12.35","TCP","1430","443  >  61034 [ACK] Seq=54903 Ack=192 Win=424 Len=1376 [TCP PDU reassembled in 321]"
"315","3.254971","146.75.37.140","192.168.12.35","TCP","1430","443  >  61034 [PSH, ACK] Seq=56279 Ack=192 Win=424 Len=1376 [TCP PDU reassembled in 321]"
"316","3.254971","146.75.37.140","192.168.12.35","TCP","1430","443  >  61034 [ACK] Seq=57655 Ack=192 Win=424 Len=1376 [TCP PDU reassembled in 321]"
"317","3.256298","192.168.12.35","146.75.37.140","TCP","54","61034  >  443 [ACK] Seq=266 Ack=30210 Win=8201 Len=0"
"318","3.256265","146.75.37.140","192.168.12.35","TCP","1430","443  >  61034 [ACK] Seq=59031 Ack=192 Win=424 Len=1376 [TCP PDU reassembled in 321]"
"319","3.256265","146.75.37.140","192.168.12.35","TCP","1430","443  >  61034 [ACK] Seq=60407 Ack=192 Win=424 Len=1376 [TCP PDU reassembled in 321]"
"320","3.256265","146.75.37.140","192.168.12.35","TCP","1430","443  >  61034 [ACK] Seq=61783 Ack=192 Win=424 Len=1376 [TCP PDU reassembled in 321]"
"321","3.256265","146.75.37.140","192.168.12.35","TLSv1.2","1430","Application Data"
"322","3.256265","146.75.37.140","192.168.12.35","TCP","1430","443  >  61034 [ACK] Seq=64535 Ack=192 Win=424 Len=1376 [TCP PDU reassembled in 325]"
"323","3.256265","146.75.37.140","192.168.12.35","TCP","1430","443  >  61034 [ACK] Seq=65911 Ack=192 Win=424 Len=1376 [TCP PDU reassembled in 325]"
"324","3.256265","146.75.37.140","192.168.12.35","TCP","1430","443  >  61034 [ACK] Seq=67287 Ack=192 Win=424 Len=1376 [TCP PDU reassembled in 325]"
"325","3.256265","146.75.37.140","192.168.12.35","TLSv1.2","1126","Application Data"
"326","3.256265","146.75.37.140","192.168.12.35","TCP","54","443  >  61039 [ACK] Seq=40494 Ack=649 Win=424 Len=0"
"327","3.256265","146.75.37.140","192.168.12.35","TCP","54","443  >  61039 [ACK] Seq=40494 Ack=684 Win=424 Len=0"
"328","3.256265","146.75.37.140","192.168.12.35","TCP","54","443  >  61034 [ACK] Seq=69735 Ack=231 Win=424 Len=0"
"329","3.256265","146.75.37.140","192.168.12.35","TLSv1.2","93","Application Data"
"330","3.256484","192.168.12.35","146.75.37.140","TCP","54","61034  >  443 [ACK] Seq=266 Ack=31511 Win=8196 Len=0"
"331","3.256543","192.168.12.35","146.75.37.140","TCP","54","61034  >  443 [ACK] Seq=266 Ack=59031 Win=8201 Len=0"
"332","3.256576","192.168.12.35","146.75.37.140","TCP","54","61034  >  443 [ACK] Seq=266 Ack=68663 Win=8201 Len=0"
"333","3.256600","192.168.12.35","146.75.37.140","TCP","54","61034  >  443 [ACK] Seq=266 Ack=69735 Win=8197 Len=0"
"334","3.259410","146.75.37.140","192.168.12.35","TCP","1430","443  >  61013 [ACK] Seq=58660 Ack=43367 Win=8244 Len=1376 [TCP PDU reassembled in 335]"
"335","3.259410","146.75.37.140","192.168.12.35","TLSv1.2","994","Application Data"
"336","3.259410","146.75.37.140","192.168.12.35","TLSv1.2","100","Application Data"
"337","3.259554","192.168.12.35","146.75.37.140","TCP","54","61013  >  443 [ACK] Seq=43367 Ack=60036 Win=1025 Len=0"
"338","3.259650","192.168.12.35","146.75.37.140","TCP","54","61013  >  443 [ACK] Seq=43367 Ack=61022 Win=1021 Len=0"
"339","3.278864","146.75.37.140","192.168.12.35","TCP","54","443  >  61140 [ACK] Seq=1 Ack=386 Win=424 Len=0"
"340","3.285018","146.75.37.140","192.168.12.35","TCP","1430","443  >  61140 [ACK] Seq=1 Ack=386 Win=424 Len=1376 [TCP PDU reassembled in 351]"
"341","3.285018","146.75.37.140","192.168.12.35","TCP","1430","443  >  61140 [ACK] Seq=1377 Ack=386 Win=424 Len=1376 [TCP PDU reassembled in 351]"
"342","3.285018","146.75.37.140","192.168.12.35","TCP","1430","443  >  61140 [ACK] Seq=2753 Ack=386 Win=424 Len=1376 [TCP PDU reassembled in 351]"
"343","3.285018","146.75.37.140","192.168.12.35","TCP","1430","443  >  61140 [ACK] Seq=4129 Ack=386 Win=424 Len=1376 [TCP PDU reassembled in 351]"
"344","3.285018","146.75.37.140","192.168.12.35","TCP","1430","443  >  61140 [ACK] Seq=5505 Ack=386 Win=424 Len=1376 [TCP PDU reassembled in 351]"
"345","3.285018","146.75.37.140","192.168.12.35","TCP","1430","443  >  61140 [PSH, ACK] Seq=6881 Ack=386 Win=424 Len=1376 [TCP PDU reassembled in 351]"
"346","3.285018","146.75.37.140","192.168.12.35","TCP","1430","443  >  61140 [ACK] Seq=8257 Ack=386 Win=424 Len=1376 [TCP PDU reassembled in 351]"
"347","3.285018","146.75.37.140","192.168.12.35","TCP","1430","443  >  61140 [ACK] Seq=9633 Ack=386 Win=424 Len=1376 [TCP PDU reassembled in 351]"
"348","3.285018","146.75.37.140","192.168.12.35","TCP","1430","443  >  61140 [ACK] Seq=11009 Ack=386 Win=424 Len=1376 [TCP PDU reassembled in 351]"
"349","3.285018","146.75.37.140","192.168.12.35","TCP","1430","443  >  61140 [ACK] Seq=12385 Ack=386 Win=424 Len=1376 [TCP PDU reassembled in 351]"
"350","3.285018","146.75.37.140","192.168.12.35","TCP","1430","443  >  61140 [ACK] Seq=13761 Ack=386 Win=424 Len=1376 [TCP PDU reassembled in 351]"
"351","3.285018","146.75.37.140","192.168.12.35","TLSv1.2","459","Application Data"
