"No.","Time","Source","Destination","Protocol","Length","Info"
"1","0.000000","192.168.12.35","146.75.37.140","UDP","80","52870  >  443 Len=38"
"2","0.048876","146.75.37.140","192.168.12.35","UDP","69","443  >  52870 Len=27"
"3","0.194085","192.168.12.35","146.75.37.140","TLSv1.2","200","Application Data"
"4","0.194176","192.168.12.35","146.75.37.140","TLSv1.2","93","Application Data"
"5","0.235505","146.75.37.140","192.168.12.35","TCP","54","443  >  61140 [ACK] Seq=1 Ack=147 Win=424 Len=0"
"6","0.235505","146.75.37.140","192.168.12.35","TCP","54","443  >  61140 [ACK] Seq=1 Ack=186 Win=424 Len=0"
"7","0.235505","146.75.37.140","192.168.12.35","TLSv1.2","93","Application Data"
"8","0.235505","146.75.37.140","192.168.12.35","TLSv1.2","186","Application Data"
"9","0.235505","146.75.37.140","192.168.12.35","TCP","1430","443  >  61140 [ACK] Seq=172 Ack=186 Win=424 Len=1376 [TCP PDU reassembled in 20]"
"10","0.235505","146.75.37.140","192.168.12.35","TCP","1430","443  >  61140 [ACK] Seq=1548 Ack=186 Win=424 Len=1376 [TCP PDU reassembled in 20]"
"11","0.235505","146.75.37.140","192.168.12.35","TCP","1430","443  >  61140 [ACK] Seq=2924 Ack=186 Win=424 Len=1376 [TCP PDU reassembled in 20]"
"12","0.235505","146.75.37.140","192.168.12.35","TCP","1430","443  >  61140 [ACK] Seq=4300 Ack=186 Win=424 Len=1376 [TCP PDU reassembled in 20]"
"13","0.235505","146.75.37.140","192.168.12.35","TCP","1430","443  >  61140 [ACK] Seq=5676 Ack=186 Win=424 Len=1376 [TCP PDU reassembled in 20]"
"14","0.235505","146.75.37.140","192.168.12.35","TCP","1430","443  >  61140 [PSH, ACK] Seq=7052 Ack=186 Win=424 Len=1376 [TCP PDU reassembled in 20]"
"15","0.235505","146.75.37.140","192.168.12.35","TCP","1430","443  >  61140 [ACK] Seq=8428 Ack=186 Win=424 Len=1376 [TCP PDU reassembled in 20]"
"16","0.235505","146.75.37.140","192.168.12.35","TCP","1430","443  >  61140 [ACK] Seq=9804 Ack=186 Win=424 Len=1376 [TCP PDU reassembled in 20]"
"17","0.235505","146.75.37.140","192.168.12.35","TCP","1430","443  >  61140 [ACK] Seq=11180 Ack=186 Win=424 Len=1376 [TCP PDU reassembled in 20]"
"18","0.235505","146.75.37.140","192.168.12.35","TCP","1430","443  >  61140 [ACK] Seq=12556 Ack=186 Win=424 Len=1376 [TCP PDU reassembled in 20]"
"19","0.235505","146.75.37.140","192.168.12.35","TCP","1430","443  >  61140 [ACK] Seq=13932 Ack=186 Win=424 Len=1376 [TCP PDU reassembled in 20]"
"20","0.235505","146.75.37.140","192.168.12.35","TLSv1.2","1355","Application Data, Application Data"
"21","0.235505","146.75.37.140","192.168.12.35","TCP","1430","443  >  61140 [ACK] Seq=16609 Ack=186 Win=424 Len=1376 [TCP PDU reassembled in 32]"
"22","0.235505","146.75.37.140","192.168.12.35","TCP","1430","443  >  61140 [ACK] Seq=17985 Ack=186 Win=424 Len=1376 [TCP PDU reassembled in 32]"
"23","0.235505","146.75.37.140","192.168.12.35","TCP","1430","443  >  61140 [ACK] Seq=19361 Ack=186 Win=424 Len=1376 [TCP PDU reassembled in 32]"
"24","0.235505","146.75.37.140","192.168.12.35","TCP","1430","443  >  61140 [ACK] Seq=20737 Ack=186 Win=424 Len=1376 [TCP PDU reassembled in 32]"
"25","0.235505","146.75.37.140","192.168.12.35","TCP","1430","443  >  61140 [ACK] Seq=22113 Ack=186 Win=424 Len=1376 [TCP PDU reassembled in 32]"
"26","0.235505","146.75.37.140","192.168.12.35","TCP","1430","443  >  61140 [PSH, ACK] Seq=23489 Ack=186 Win=424 Len=1376 [TCP PDU reassembled in 32]"
"27","0.235505","146.75.37.140","192.168.12.35","TCP","1430","443  >  61140 [ACK] Seq=24865 Ack=186 Win=424 Len=1376 [TCP PDU reassembled in 32]"
"28","0.235505","146.75.37.140","192.168.12.35","TCP","1430","443  >  61140 [ACK] Seq=26241 Ack=186 Win=424 Len=1376 [TCP PDU reassembled in 32]"
"29","0.235505","146.75.37.140","192.168.12.35","TCP","1430","443  >  61140 [ACK] Seq=27617 Ack=186 Win=424 Len=1376 [TCP PDU reassembled in 32]"
"30","0.235505","146.75.37.140","192.168.12.35","TCP","1430","443  >  61140 [ACK] Seq=28993 Ack=186 Win=424 Len=1376 [TCP PDU reassembled in 32]"
"31","0.235505","146.75.37.140","192.168.12.35","TCP","1430","443  >  61140 [ACK] Seq=30369 Ack=186 Win=424 Len=1376 [TCP PDU reassembled in 32]"
"32","0.235505","146.75.37.140","192.168.12.35","TLSv1.2","1430","Application Data"
"33","0.235505","146.75.37.140","192.168.12.35","TCP","1430","443  >  61140 [ACK] Seq=33121 Ack=186 Win=424 Len=1376 [TCP PDU reassembled in 44]"
"34","0.235505","146.75.37.140","192.168.12.35","TCP","1430","443  >  61140 [ACK] Seq=34497 Ack=186 Win=424 Len=1376 [TCP PDU reassembled in 44]"
"35","0.235505","146.75.37.140","192.168.12.35","TCP","1430","443  >  61140 [ACK] Seq=35873 Ack=186 Win=424 Len=1376 [TCP PDU reassembled in 44]"
"36","0.235505","146.75.37.140","192.168.12.35","TCP","1430","443  >  61140 [ACK] Seq=37249 Ack=186 Win=424 Len=1376 [TCP PDU reassembled in 44]"
"37","0.236302","146.75.37.140","192.168.12.35","TCP","1430","443  >  61140 [ACK] Seq=38625 Ack=186 Win=424 Len=1376 [TCP PDU reassembled in 44]"
"38","0.236302","146.75.37.140","192.168.12.35","TCP","1430","443  >  61140 [PSH, ACK] Seq=40001 Ack=186 Win=424 Len=1376 [TCP PDU reassembled in 44]"
"39","0.236302","146.75.37.140","192.168.12.35","TCP","1430","443  >  61140 [ACK] Seq=41377 Ack=186 Win=424 Len=1376 [TCP PDU reassembled in 44]"
"40","0.236302","146.75.37.140","192.168.12.35","TCP","1430","443  >  61140 [ACK] Seq=42753 Ack=186 Win=424 Len=1376 [TCP PDU reassembled in 44]"
"41","0.236302","146.75.37.140","192.168.12.35","TCP","1430","443  >  61140 [ACK] Seq=44129 Ack=186 Win=424 Len=1376 [TCP PDU reassembled in 44]"
"42","0.236302","146.75.37.140","192.168.12.35","TCP","1430","443  >  61140 [ACK] Seq=45505 Ack=186 Win=424 Len=1376 [TCP PDU reassembled in 44]"
"43","0.236302","146.75.37.140","192.168.12.35","TCP","1430","443  >  61140 [ACK] Seq=46881 Ack=186 Win=424 Len=1376 [TCP PDU reassembled in 44]"
"44","0.236302","146.75.37.140","192.168.12.35","TLSv1.2","1430","Application Data, Application Data"
"45","0.236302","146.75.37.140","192.168.12.35","TCP","1430","443  >  61140 [ACK] Seq=49633 Ack=186 Win=424 Len=1376 [TCP PDU reassembled in 56]"
"46","0.236302","146.75.37.140","192.168.12.35","TCP","1430","443  >  61140 [ACK] Seq=51009 Ack=186 Win=424 Len=1376 [TCP PDU reassembled in 56]"
"47","0.236302","146.75.37.140","192.168.12.35","TCP","1430","443  >  61140 [ACK] Seq=52385 Ack=186 Win=424 Len=1376 [TCP PDU reassembled in 56]"
"48","0.236302","146.75.37.140","192.168.12.35","TCP","1430","443  >  61140 [ACK] Seq=53761 Ack=186 Win=424 Len=1376 [TCP PDU reassembled in 56]"
"49","0.236302","146.75.37.140","192.168.12.35","TCP","1430","443  >  61140 [ACK] Seq=55137 Ack=186 Win=424 Len=1376 [TCP PDU reassembled in 56]"
"50","0.236302","146.75.37.140","192.168.12.35","TCP","1430","443  >  61140 [PSH, ACK] Seq=56513 Ack=186 Win=424 Len=1376 [TCP PDU reassembled in 56]"
"51","0.236302","146.75.37.140","192.168.12.35","TCP","1430","443  >  61140 [ACK] Seq=57889 Ack=186 Win=424 Len=1376 [TCP PDU reassembled in 56]"
"52","0.236302","146.75.37.140","192.168.12.35","TCP","1430","443  >  61140 [ACK] Seq=59265 Ack=186 Win=424 Len=1376 [TCP PDU reassembled in 56]"
"53","0.236302","146.75.37.140","192.168.12.35","TCP","1430","443  >  61140 [ACK] Seq=60641 Ack=186 Win=424 Len=1376 [TCP PDU reassembled in 56]"
"54","0.236302","146.75.37.140","192.168.12.35","TCP","1430","443  >  61140 [ACK] Seq=62017 Ack=186 Win=424 Len=1376 [TCP PDU reassembled in 56]"
"55","0.236302","146.75.37.140","192.168.12.35","TCP","1430","443  >  61140 [ACK] Seq=63393 Ack=186 Win=424 Len=1376 [TCP PDU reassembled in 56]"
"56","0.236302","146.75.37.140","192.168.12.35","TLSv1.2","1430","Application Data"
"57","0.236302","146.75.37.140","192.168.12.35","TCP","1430","443  >  61140 [ACK] Seq=66145 Ack=186 Win=424 Len=1376 [TCP PDU reassembled in 69]"
"58","0.236302","146.75.37.140","192.168.12.35","TCP","1430","443  >  61140 [ACK] Seq=67521 Ack=186 Win=424 Len=1376 [TCP PDU reassembled in 69]"
"59","0.236302","146.75.37.140","192.168.12.35","TCP","1430","443  >  61140 [ACK] Seq=68897 Ack=186 Win=424 Len=1376 [TCP PDU reassembled in 69]"
"60","0.236302","146.75.37.140","192.168.12.35","TCP","1430","443  >  61140 [ACK] Seq=70273 Ack=186 Win=424 Len=1376 [TCP PDU reassembled in 69]"
"61","0.236302","146.75.37.140","192.168.12.35","TCP","1430","443  >  61140 [ACK] Seq=71649 Ack=186 Win=424 Len=1376 [TCP PDU reassembled in 69]"
"62","0.236302","146.75.37.140","192.168.12.35","TCP","1430","443  >  61140 [PSH, ACK] Seq=73025 Ack=186 Win=424 Len=1376 [TCP PDU reassembled in 69]"
"63","0.236302","146.75.37.140","192.168.12.35","TCP","1430","443  >  61140 [ACK] Seq=74401 Ack=186 Win=424 Len=1376 [TCP PDU reassembled in 69]"
"64","0.236302","146.75.37.140","192.168.12.35","TCP","1430","443  >  61140 [ACK] Seq=75777 Ack=186 Win=424 Len=1376 [TCP PDU reassembled in 69]"
"65","0.236302","146.75.37.140","192.168.12.35","TCP","1430","443  >  61140 [ACK] Seq=77153 Ack=186 Win=424 Len=1376 [TCP PDU reassembled in 69]"
"66","0.236302","146.75.37.140","192.168.12.35","TCP","1430","443  >  61140 [ACK] Seq=78529 Ack=186 Win=424 Len=1376 [TCP PDU reassembled in 69]"
"67","0.236356","192.168.12.35","146.75.37.140","TCP","54","61140  >  443 [ACK] Seq=186 Ack=172 Win=2046 Len=0"
"68","0.236302","146.75.37.140","192.168.12.35","TCP","1430","443  >  61140 [ACK] Seq=79905 Ack=186 Win=424 Len=1376 [TCP PDU reassembled in 69]"
"69","0.236302","146.75.37.140","192.168.12.35","TLSv1.2","1430","Application Data, Application Data"
"70","0.236611","146.75.37.140","192.168.12.35","TCP","1430","443  >  61140 [ACK] Seq=82657 Ack=186 Win=424 Len=1376 [TCP PDU reassembled in 88]"
"71","0.236611","146.75.37.140","192.168.12.35","TCP","1430","443  >  61140 [ACK] Seq=84033 Ack=186 Win=424 Len=1376 [TCP PDU reassembled in 88]"
"72","0.236611","146.75.37.140","192.168.12.35","TCP","1430","443  >  61140 [ACK] Seq=85409 Ack=186 Win=424 Len=1376 [TCP PDU reassembled in 88]"
"73","0.236611","146.75.37.140","192.168.12.35","TCP","1430","443  >  61140 [ACK] Seq=86785 Ack=186 Win=424 Len=1376 [TCP PDU reassembled in 88]"
"74","0.236611","146.75.37.140","192.168.12.35","TCP","1430","443  >  61140 [ACK] Seq=88161 Ack=186 Win=424 Len=1376 [TCP PDU reassembled in 88]"
"75","0.236611","146.75.37.140","192.168.12.35","TCP","1430","443  >  61140 [PSH, ACK] Seq=89537 Ack=186 Win=424 Len=1376 [TCP PDU reassembled in 88]"
"76","0.236639","192.168.12.35","146.75.37.140","TCP","54","61140  >  443 [ACK] Seq=186 Ack=15308 Win=2050 Len=0"
"77","0.236727","192.168.12.35","146.75.37.140","TCP","54","61140  >  443 [ACK] Seq=186 Ack=16609 Win=2045 Len=0"
"78","0.236783","192.168.12.35","146.75.37.140","TCP","54","61140  >  443 [ACK] Seq=186 Ack=38625 Win=2050 Len=0"
"79","0.236880","192.168.12.35","146.75.37.140","TCP","54","61140  >  443 [ACK] Seq=186 Ack=82657 Win=2050 Len=0"
"80","0.236936","192.168.12.35","146.75.37.140","TCP","54","61140  >  443 [ACK] Seq=186 Ack=90913 Win=2018 Len=0"
"81","0.237720","192.168.12.35","146.75.37.140","TCP","54","[TCP Window Update] 61140  >  443 [ACK] Seq=186 Ack=90913 Win=2050 Len=0"
"82","0.238897","192.168.12.35","146.75.37.140","TLSv1.2","89","Application Data"
"83","0.251186","146.75.37.140","192.168.12.35","TCP","1430","443  >  61140 [ACK] Seq=90913 Ack=186 Win=424 Len=1376 [TCP PDU reassembled in 88]"
"84","0.251186","146.75.37.140","192.168.12.35","TCP","1430","443  >  61140 [ACK] Seq=92289 Ack=186 Win=424 Len=1376 [TCP PDU reassembled in 88]"
"85","0.251186","146.75.37.140","192.168.12.35","TCP","1430","443  >  61140 [ACK] Seq=93665 Ack=186 Win=424 Len=1376 [TCP PDU reassembled in 88]"
"86","0.251186","146.75.37.140","192.168.12.35","TCP","1430","443  >  61140 [ACK] Seq=95041 Ack=186 Win=424 Len=1376 [TCP PDU reassembled in 88]"
"87","0.251186","146.75.37.140","192.168.12.35","TCP","1430","443  >  61140 [ACK] Seq=96417 Ack=186 Win=424 Len=1376 [TCP PDU reassembled in 88]"
"88","0.251186","146.75.37.140","192.168.12.35","TLSv1.2","1430","Application Data, Application Data"
"89","0.251186","146.75.37.140","192.168.12.35","TCP","1430","443  >  61140 [ACK] Seq=99169 Ack=186 Win=424 Len=1376 [TCP PDU reassembled in 100]"
"90","0.251186","146.75.37.140","192.168.12.35","TCP","1430","443  >  61140 [ACK] Seq=100545 Ack=186 Win=424 Len=1376 [TCP PDU reassembled in 100]"
"91","0.251186","146.75.37.140","192.168.12.35","TCP","1430","443  >  61140 [ACK] Seq=101921 Ack=186 Win=424 Len=1376 [TCP PDU reassembled in 100]"
"92","0.251186","146.75.37.140","192.168.12.35","TCP","1430","443  >  61140 [ACK] Seq=103297 Ack=186 Win=424 Len=1376 [TCP PDU reassembled in 100]"
"93","0.251186","146.75.37.140","192.168.12.35","TCP","1430","443  >  61140 [PSH, ACK] Seq=104673 Ack=186 Win=424 Len=1376 [TCP PDU reassembled in 100]"
"94","0.251186","146.75.37.140","192.168.12.35","TCP","1430","443  >  61140 [ACK] Seq=106049 Ack=186 Win=424 Len=1376 [TCP PDU reassembled in 100]"
"95","0.251186","146.75.37.140","192.168.12.35","TCP","1430","443  >  61140 [ACK] Seq=107425 Ack=186 Win=424 Len=1376 [TCP PDU reassembled in 100]"
"96","0.251186","146.75.37.140","192.168.12.35","TCP","1430","443  >  61140 [ACK] Seq=108801 Ack=186 Win=424 Len=1376 [TCP PDU reassembled in 100]"
"97","0.251186","146.75.37.140","192.168.12.35","TCP","1430","443  >  61140 [ACK] Seq=110177 Ack=186 Win=424 Len=1376 [TCP PDU reassembled in 100]"
"98","0.251186","146.75.37.140","192.168.12.35","TCP","1430","443  >  61140 [ACK] Seq=111553 Ack=186 Win=424 Len=1376 [TCP PDU reassembled in 100]"
"99","0.251186","146.75.37.140","192.168.12.35","TCP","1430","443  >  61140 [PSH, ACK] Seq=112929 Ack=186 Win=424 Len=1376 [TCP PDU reassembled in 100]"
"100","0.251186","146.75.37.140","192.168.12.35","TLSv1.2","1430","Application Data"
"101","0.251186","146.75.37.140","192.168.12.35","TCP","1430","443  >  61140 [ACK] Seq=115681 Ack=186 Win=424 Len=1376 [TCP PDU reassembled in 112]"
"102","0.251186","146.75.37.140","192.168.12.35","TCP","1430","443  >  61140 [ACK] Seq=117057 Ack=186 Win=424 Len=1376 [TCP PDU reassembled in 112]"
"103","0.251186","146.75.37.140","192.168.12.35","TCP","1430","443  >  61140 [ACK] Seq=118433 Ack=186 Win=424 Len=1376 [TCP PDU reassembled in 112]"
"104","0.251186","146.75.37.140","192.168.12.35","TCP","1430","443  >  61140 [ACK] Seq=119809 Ack=186 Win=424 Len=1376 [TCP PDU reassembled in 112]"
"105","0.251186","146.75.37.140","192.168.12.35","TCP","1430","443  >  61140 [PSH, ACK] Seq=121185 Ack=186 Win=424 Len=1376 [TCP PDU reassembled in 112]"
"106","0.251186","146.75.37.140","192.168.12.35","TCP","1430","443  >  61140 [ACK] Seq=122561 Ack=186 Win=424 Len=1376 [TCP PDU reassembled in 112]"
"107","0.251186","146.75.37.140","192.168.12.35","TCP","1430","443  >  61140 [ACK] Seq=123937 Ack=186 Win=424 Len=1376 [TCP PDU reassembled in 112]"
"108","0.251186","146.75.37.140","192.168.12.35","TCP","1430","443  >  61140 [ACK] Seq=125313 Ack=186 Win=424 Len=1376 [TCP PDU reassembled in 112]"
"109","0.251186","146.75.37.140","192.168.12.35","TCP","1430","443  >  61140 [ACK] Seq=126689 Ack=186 Win=424 Len=1376 [TCP PDU reassembled in 112]"
"110","0.251186","146.75.37.140","192.168.12.35","TCP","1430","443  >  61140 [ACK] Seq=128065 Ack=186 Win=424 Len=1376 [TCP PDU reassembled in 112]"
"111","0.251186","146.75.37.140","192.168.12.35","TCP","1430","443  >  61140 [PSH, ACK] Seq=129441 Ack=186 Win=424 Len=1376 [TCP PDU reassembled in 112]"
"112","0.251186","146.75.37.140","192.168.12.35","TLSv1.2","1430","Application Data, Application Data"
"113","0.251186","146.75.37.140","192.168.12.35","TCP","1430","443  >  61140 [ACK] Seq=132193 Ack=186 Win=424 Len=1376 [TCP PDU reassembled in 123]"
"114","0.251186","146.75.37.140","192.168.12.35","TCP","1430","443  >  61140 [ACK] Seq=133569 Ack=186 Win=424 Len=1376 [TCP PDU reassembled in 123]"
"115","0.251870","146.75.37.140","192.168.12.35","TCP","1430","443  >  61140 [ACK] Seq=134945 Ack=186 Win=424 Len=1376 [TCP PDU reassembled in 123]"
"116","0.251870","146.75.37.140","192.168.12.35","TCP","1430","443  >  61140 [ACK] Seq=136321 Ack=186 Win=424 Len=1376 [TCP PDU reassembled in 123]"
"117","0.251870","146.75.37.140","192.168.12.35","TCP","1430","443  >  61140 [PSH, ACK] Seq=137697 Ack=186 Win=424 Len=1376 [TCP PDU reassembled in 123]"
"118","0.251870","146.75.37.140","192.168.12.35","TCP","1430","443  >  61140 [ACK] Seq=139073 Ack=186 Win=424 Len=1376 [TCP PDU reassembled in 123]"
"119","0.251870","146.75.37.140","192.168.12.35","TCP","1430","443  >  61140 [ACK] Seq=140449 Ack=186 Win=424 Len=1376 [TCP PDU reassembled in 123]"
"120","0.251870","146.75.37.140","192.168.12.35","TCP","1430","443  >  61140 [ACK] Seq=141825 Ack=186 Win=424 Len=1376 [TCP PDU reassembled in 123]"
"121","0.251870","146.75.37.140","192.168.12.35","TCP","1430","443  >  61140 [ACK] Seq=143201 Ack=186 Win=424 Len=1376 [TCP PDU reassembled in 123]"
"122","0.251870","146.75.37.140","192.168.12.35","TCP","1430","443  >  61140 [ACK] Seq=144577 Ack=186 Win=424 Len=1376 [TCP PDU reassembled in 123]"
"123","0.251870","146.75.37.140","192.168.12.35","TLSv1.2","1430","Application Data"
"124","0.251870","146.75.37.140","192.168.12.35","TLSv1.2","1430","Application Data"
"125","0.251870","146.75.37.140","192.168.12.35","TCP","1430","443  >  61140 [ACK] Seq=148705 Ack=186 Win=424 Len=1376 [TCP PDU reassembled in 132]"
"126","0.251870","146.75.37.140","192.168.12.35","TCP","1430","443  >  61140 [ACK] Seq=150081 Ack=186 Win=424 Len=1376 [TCP PDU reassembled in 132]"
"127","0.251870","146.75.37.140","192.168.12.35","TCP","1430","443  >  61140 [ACK] Seq=151457 Ack=186 Win=424 Len=1376 [TCP PDU reassembled in 132]"
"128","0.251870","146.75.37.140","192.168.12.35","TCP","1430","443  >  61140 [ACK] Seq=152833 Ack=186 Win=424 Len=1376 [TCP PDU reassembled in 132]"
"129","0.251870","146.75.37.140","192.168.12.35","TCP","1430","443  >  61140 [PSH, ACK] Seq=154209 Ack=186 Win=424 Len=1376 [TCP PDU reassembled in 132]"
"130","0.251870","146.75.37.140","192.168.12.35","TCP","1430","443  >  61140 [ACK] Seq=155585 Ack=186 Win=424 Len=1376 [TCP PDU reassembled in 132]"
"131","0.251870","146.75.37.140","192.168.12.35","TCP","1430","443  >  61140 [ACK] Seq=156961 Ack=186 Win=424 Len=1376 [TCP PDU reassembled in 132]"
"132","0.251870","146.75.37.140","192.168.12.35","TLSv1.2","1291","Application Data"
"133","0.252239","192.168.12.35","146.75.37.140","TCP","54","61140  >  443 [ACK] Seq=221 Ack=134945 Win=2050 Len=0"
"134","0.252579","192.168.12.35","146.75.37.140","TCP","54","61140  >  443 [ACK] Seq=221 Ack=158337 Win=2050 Len=0"
"135","0.252639","192.168.12.35","146.75.37.140","TCP","54","61140  >  443 [ACK] Seq=221 Ack=159574 Win=2045 Len=0"
"136","0.275855","146.75.37.140","192.168.12.35","TCP","54","443  >  61140 [ACK] Seq=159574 Ack=221 Win=424 Len=0"
"137","0.755479","192.168.12.35","146.75.37.140","TLSv1.2","3240","Application Data"
"138","0.755589","192.168.12.35","146.75.37.140","TLSv1.2","93","Application Data"
"139","0.755617","192.168.12.35","146.75.37.140","TLSv1.2","3358","Application Data"
"140","0.755641","192.168.12.35","146.75.37.140","TLSv1.2","1358","Application Data"
"141","0.802296","146.75.37.140","192.168.12.35","TCP","54","443  >  61013 [ACK] Seq=1 Ack=1397 Win=8244 Len=0"
"142","0.823346","146.75.37.140","192.168.12.35","TCP","54","443  >  61013 [ACK] Seq=1 Ack=2793 Win=8244 Len=0"
"143","0.834196","146.75.37.140","192.168.12.35","TCP","54","443  >  61013 [ACK] Seq=1 Ack=3187 Win=8244 Len=0"
"144","0.834196","146.75.37.140","192.168.12.35","TCP","54","443  >  61013 [ACK] Seq=1 Ack=3226 Win=8244 Len=0"
"145","0.834196","146.75.37.140","192.168.12.35","TLSv1.2","93","Application Data"
"146","0.873140","146.75.37.140","192.168.12.35","TCP","1430","443  >  61013 [ACK] Seq=40 Ack=3226 Win=8244 Len=1376 [TCP PDU reassembled in 147]"
"147","0.873140","146.75.37.140","192.168.12.35","TLSv1.2","591","Application Data"
"148","0.873140","146.75.37.140","192.168.12.35","TCP","1430","443  >  61013 [ACK] Seq=1953 Ack=3226 Win=8244 Len=1376 [TCP PDU reassembled in 149]"
"149","0.873140","146.75.37.140","192.168.12.35","TLSv1.2","1070","Application Data"
"150","0.873140","146.75.37.140","192.168.12.35","TCP","1430","443  >  61013 [ACK] Seq=4345 Ack=4622 Win=8244 Len=1376 [TCP PDU reassembled in 161]"
"151","0.873140","146.75.37.140","192.168.12.35","TCP","1430","443  >  61013 [PSH, ACK] Seq=5721 Ack=4622 Win=8244 Len=1376 [TCP PDU reassembled in 161]"
"152","0.873140","146.75.37.140","192.168.12.35","TCP","1430","443  >  61013 [ACK] Seq=7097 Ack=4622 Win=8244 Len=1376 [TCP PDU reassembled in 161]"
"153","0.873140","146.75.37.140","192.168.12.35","TCP","1430","443  >  61013 [PSH, ACK] Seq=8473 Ack=4622 Win=8244 Len=1376 [TCP PDU reassembled in 161]"
"154","0.873952","192.168.12.35","146.75.37.140","TCP","54","61013  >  443 [ACK] Seq=7834 Ack=1416 Win=1025 Len=0"
"155","0.874159","146.75.37.140","192.168.12.35","TCP","1430","443  >  61013 [ACK] Seq=9849 Ack=4622 Win=8244 Len=1376 [TCP PDU reassembled in 161]"
"156","0.874159","146.75.37.140","192.168.12.35","TCP","1430","443  >  61013 [PSH, ACK] Seq=11225 Ack=4622 Win=8244 Len=1376 [TCP PDU reassembled in 161]"
"157","0.874159","146.75.37.140","192.168.12.35","TCP","1430","443  >  61013 [ACK] Seq=12601 Ack=4622 Win=8244 Len=1376 [TCP PDU reassembled in 161]"
"158","0.874159","146.75.37.140","192.168.12.35","TCP","1430","443  >  61013 [PSH, ACK] Seq=13977 Ack=4622 Win=8244 Len=1376 [TCP PDU reassembled in 161]"
"159","0.874159","146.75.37.140","192.168.12.35","TCP","1430","443  >  61013 [ACK] Seq=15353 Ack=4622 Win=8244 Len=1376 [TCP PDU reassembled in 161]"
"160","0.874159","146.75.37.140","192.168.12.35","TCP","1430","443  >  61013 [PSH, ACK] Seq=16729 Ack=4622 Win=8244 Len=1376 [TCP PDU reassembled in 161]"
"161","0.874159","146.75.37.140","192.168.12.35","TLSv1.2","1159","Application Data, Application Data"
"162","0.874159","146.75.37.140","192.168.12.35","TLSv1.2","90","Application Data"
"163","0.874209","192.168.12.35","146.75.37.140","TCP","54","61013  >  443 [ACK] Seq=7834 Ack=3329 Win=1025 Len=0"
"164","0.874325","192.168.12.35","146.75.37.140","TCP","54","61013  >  443 [ACK] Seq=7834 Ack=9849 Win=1025 Len=0"
"165","0.874539","192.168.12.35","146.75.37.140","TCP","54","61013  >  443 [ACK] Seq=7834 Ack=18105 Win=1025 Len=0"
"166","0.874628","192.168.12.35","146.75.37.140","TCP","54","61013  >  443 [ACK] Seq=7834 Ack=19210 Win=1020 Len=0"
"167","0.880232","146.75.37.140","192.168.12.35","TCP","1430","443  >  61013 [ACK] Seq=19246 Ack=4622 Win=8244 Len=1376 [TCP PDU reassembled in 178]"
"168","0.880232","146.75.37.140","192.168.12.35","TCP","1430","443  >  61013 [PSH, ACK] Seq=20622 Ack=4622 Win=8244 Len=1376 [TCP PDU reassembled in 178]"
"169","0.880232","146.75.37.140","192.168.12.35","TCP","1430","443  >  61013 [ACK] Seq=21998 Ack=4622 Win=8244 Len=1376 [TCP PDU reassembled in 178]"
"170","0.880232","146.75.37.140","192.168.12.35","TCP","1430","443  >  61013 [PSH, ACK] Seq=23374 Ack=4622 Win=8244 Len=1376 [TCP PDU reassembled in 178]"
"171","0.880232","146.75.37.140","192.168.12.35","TCP","1430","443  >  61013 [ACK] Seq=24750 Ack=4622 Win=8244 Len=1376 [TCP PDU reassembled in 178]"
"172","0.880232","146.75.37.140","192.168.12.35","TCP","1430","443  >  61013 [PSH, ACK] Seq=26126 Ack=4622 Win=8244 Len=1376 [TCP PDU reassembled in 178]"
"173","0.880232","146.75.37.140","192.168.12.35","TCP","1430","443  >  61013 [ACK] Seq=27502 Ack=4622 Win=8244 Len=1376 [TCP PDU reassembled in 178]"
"174","0.880232","146.75.37.140","192.168.12.35","TCP","1430","443  >  61013 [PSH, ACK] Seq=28878 Ack=4622 Win=8244 Len=1376 [TCP PDU reassembled in 178]"
"175","0.880232","146.75.37.140","192.168.12.35","TCP","1430","443  >  61013 [ACK] Seq=30254 Ack=4622 Win=8244 Len=1376 [TCP PDU reassembled in 178]"
"176","0.880232","146.75.37.140","192.168.12.35","TCP","1430","443  >  61013 [PSH, ACK] Seq=31630 Ack=4622 Win=8244 Len=1376 [TCP PDU reassembled in 178]"
"177","0.880232","146.75.37.140","192.168.12.35","TCP","1430","443  >  61013 [ACK] Seq=33006 Ack=4622 Win=8244 Len=1376 [TCP PDU reassembled in 178]"
"178","0.880232","146.75.37.140","192.168.12.35","TLSv1.2","1430","Application Data"
"179","0.880232","146.75.37.140","192.168.12.35","TCP","1430","443  >  61013 [ACK] Seq=35758 Ack=4622 Win=8244 Len=1376 [TCP PDU reassembled in 192]"
"180","0.880232","146.75.37.140","192.168.12.35","TCP","1430","443  >  61013 [PSH, ACK] Seq=37134 Ack=4622 Win=8244 Len=1376 [TCP PDU reassembled in 192]"
"181","0.880725","192.168.12.35","146.75.37.140","TCP","54","61013  >  443 [ACK] Seq=7834 Ack=38510 Win=1025 Len=0"
"182","0.881983","192.168.12.35","146.75.37.140","TLSv1.2","89","Application Data"
"183","0.887379","146.75.37.140","192.168.12.35","TCP","1430","443  >  61013 [ACK] Seq=38510 Ack=6018 Win=8244 Len=1376 [TCP PDU reassembled in 192]"
"184","0.887379","146.75.37.140","192.168.12.35","TCP","1430","443  >  61013 [PSH, ACK] Seq=39886 Ack=6018 Win=8244 Len=1376 [TCP PDU reassembled in 192]"
"185","0.887379","146.75.37.140","192.168.12.35","TCP","1430","443  >  61013 [ACK] Seq=41262 Ack=6018 Win=8244 Len=1376 [TCP PDU reassembled in 192]"
"186","0.887379","146.75.37.140","192.168.12.35","TCP","1430","443  >  61013 [PSH, ACK] Seq=42638 Ack=6018 Win=8244 Len=1376 [TCP PDU reassembled in 192]"
"187","0.887379","146.75.37.140","192.168.12.35","TCP","1430","443  >  61013 [ACK] Seq=44014 Ack=6018 Win=8244 Len=1376 [TCP PDU reassembled in 192]"
"188","0.887379","146.75.37.140","192.168.12.35","TCP","1430","443  >  61013 [PSH, ACK] Seq=45390 Ack=6018 Win=8244 Len=1376 [TCP PDU reassembled in 192]"
"189","0.887379","146.75.37.140","192.168.12.35","TCP","1430","443  >  61013 [ACK] Seq=46766 Ack=6018 Win=8244 Len=1376 [TCP PDU reassembled in 192]"
"190","0.887379","146.75.37.140","192.168.12.35","TCP","1430","443  >  61013 [PSH, ACK] Seq=48142 Ack=6018 Win=8244 Len=1376 [TCP PDU reassembled in 192]"
"191","0.887379","146.75.37.140","192.168.12.35","TCP","1430","443  >  61013 [ACK] Seq=49518 Ack=6018 Win=8244 Len=1376 [TCP PDU reassembled in 192]"
"192","0.887379","146.75.37.140","192.168.12.35","TLSv1.2","1430","Application Data, Application Data"
"193","0.888255","192.168.12.35","146.75.37.140","TCP","54","61013  >  443 [ACK] Seq=7869 Ack=52270 Win=1025 Len=0"
"194","0.894806","146.75.37.140","192.168.12.35","TLSv1.2","1430","Application Data"
"195","0.894806","146.75.37.140","192.168.12.35","TLSv1.2","1430","Application Data"
"196","0.894806","146.75.37.140","192.168.12.35","TLSv1.2","1430","Application Data"
"197","0.894806","146.75.37.140","192.168.12.35","TLSv1.2","1430","Application Data"
"198","0.894806","146.75.37.140","192.168.12.35","TLSv1.2","1430","Application Data, Application Data"
"199","0.894806","146.75.37.140","192.168.12.35","TLSv1.2","1430","Application Data, Application Data, Application Data, Application Data, Application Data"
"200","0.894806","146.75.37.140","192.168.12.35","TCP","1430","443  >  61013 [ACK] Seq=60526 Ack=6018 Win=8244 Len=1376 [TCP PDU reassembled in 201]"
"201","0.894806","146.75.37.140","192.168.12.35","TLSv1.2","1430","Application Data, Application Data, Application Data"
"202","0.894806","146.75.37.140","192.168.12.35","TCP","54","443  >  61013 [ACK] Seq=63278 Ack=6530 Win=8244 Len=0"
"203","0.894806","146.75.37.140","192.168.12.35","TLSv1.2","1430","Application Data, Application Data, Application Data"
"204","0.894806","146.75.37.140","192.168.12.35","TLSv1.2","1189","Application Data, Application Data, Application Data, Application Data"
"205","0.895581","192.168.12.35","146.75.37.140","TCP","54","61013  >  443 [ACK] Seq=7869 Ack=63278 Win=1025 Len=0"
"206","0.895892","192.168.12.35","146.75.37.140","TCP","54","61013  >  443 [ACK] Seq=7869 Ack=65789 Win=1025 Len=0"
"207","0.897795","146.75.37.140","192.168.12.35","TLSv1.2","746","Application Data, Application Data, Application Data, Application Data, Application Data"
"208","0.897795","146.75.37.140","192.168.12.35","TLSv1.2","1303","Application Data, Application Data, Application Data, Application Data, Application Data, Application Data"
"209","0.898180","192.168.12.35","146.75.37.140","TCP","54","61013  >  443 [ACK] Seq=7869 Ack=67730 Win=1025 Len=0"
"210","0.916262","146.75.37.140","192.168.12.35","TCP","54","443  >  61013 [ACK] Seq=67730 Ack=7834 Win=8244 Len=0"
"211","0.916377","192.168.12.35","146.75.37.140","UDP","96","52870  >  443 Len=54"
"212","0.932884","146.75.37.140","192.168.12.35","TCP","54","443  >  61013 [ACK] Seq=67730 Ack=7869 Win=8244 Len=0"
"213","0.932884","146.75.37.140","192.168.12.35","TCP","1430","443  >  61013 [ACK] Seq=67730 Ack=7869 Win=8244 Len=1376 [TCP PDU reassembled in 214]"
"214","0.932884","146.75.37.140","192.168.12.35","TLSv1.2","822","Application Data"
"215","0.933751","192.168.12.35","146.75.37.140","TCP","54","61013  >  443 [ACK] Seq=7869 Ack=69874 Win=1025 Len=0"
"216","0.943539","146.75.37.140","192.168.12.35","UDP","67","443  >  52870 Len=25"
"217","0.959140","192.168.12.35","146.75.37.140","UDP","84","52870  >  443 Len=42"
"218","0.967831","146.75.37.140","192.168.12.35","UDP","69","443  >  52870 Len=27"
"219","1.133735","192.168.12.35","146.75.37.140","TCP","55","60961  >  443 [ACK] Seq=1 Ack=1 Win=1024 Len=1 [TCP PDU reassembled in 1668]"
"220","1.163605","146.75.37.140","192.168.12.35","TCP","66","443  >  60961 [ACK] Seq=1 Ack=2 Win=1924 Len=0 SLE=1 SRE=2"
"221","1.428584","146.75.37.140","192.168.12.35","TLSv1.2","564","Application Data"
"222","1.444251","146.75.37.140","192.168.12.35","TLSv1.2","133","Application Data"
"223","1.444892","192.168.12.35","146.75.37.140","TCP","54","61013  >  443 [ACK] Seq=7869 Ack=70463 Win=1022 Len=0"
"224","1.449753","146.75.37.140","192.168.12.35","TLSv1.2","399","Application Data"
"225","1.449753","146.75.37.140","192.168.12.35","TLSv1.2","203","Application Data"
"226","1.450178","192.168.12.35","146.75.37.140","TCP","54","61013  >  443 [ACK] Seq=7869 Ack=70957 Win=1020 Len=0"
"227","1.462088","146.75.37.140","192.168.12.35","TLSv1.2","215","Application Data"
"228","1.476120","146.75.37.140","192.168.12.35","TLSv1.2","154","Application Data"
"229","1.476120","146.75.37.140","192.168.12.35","TLSv1.2","114","Application Data"
"230","1.476549","192.168.12.35","146.75.37.140","TCP","54","61013  >  443 [ACK] Seq=7869 Ack=71218 Win=1019 Len=0"
"231","1.485153","146.75.37.140","192.168.12.35","TLSv1.2","198","Application Data"
"232","1.485647","192.168.12.35","146.75.37.140","TCP","54","61013  >  443 [ACK] Seq=7869 Ack=71422 Win=1025 Len=0"
"233","1.489116","146.75.37.140","192.168.12.35","TLSv1.2","738","Application Data"
"234","1.489116","146.75.37.140","192.168.12.35","TLSv1.2","209","Application Data"
"235","1.489116","146.75.37.140","192.168.12.35","TLSv1.2","163","Application Data"
"236","1.489116","146.75.37.140","192.168.12.35","TLSv1.2","374","Application Data"
"237","1.489116","146.75.37.140","192.168.12.35","TLSv1.2","138","Application Data"
"238","1.489116","146.75.37.140","192.168.12.35","TLSv1.2","185","Application Data"
"239","1.489116","146.75.37.140","192.168.12.35","TLSv1.2","1055","Application Data"
"240","1.489116","146.75.37.140","192.168.12.35","TLSv1.2","729","Application Data"
"241","1.489116","146.75.37.140","192.168.12.35","TCP","1430","443  >  61013 [ACK] Seq=74581 Ack=7869 Win=8244 Len=1376 [TCP PDU reassembled in 242]"
"242","1.489116","146.75.37.140","192.168.12.35","TLSv1.2","820","Application Data"
"243","1.489116","146.75.37.140","192.168.12.35","TLSv1.2","960","Application Data"
"244","1.489116","146.75.37.140","192.168.12.35","TLSv1.2","622","Application Data, Application Data"
"245","1.489116","146.75.37.140","192.168.12.35","TLSv1.2","155","Application Data"
"246","1.489116","146.75.37.140","192.168.12.35","TLSv1.2","517","Application Data"
"247","1.489116","146.75.37.140","192.168.12.35","TLSv1.2","257","Application Data"
"248","1.490527","192.168.12.35","146.75.37.140","TCP","54","61013  >  443 [ACK] Seq=7869 Ack=72261 Win=1021 Len=0"
"249","1.491070","192.168.12.35","146.75.37.140","TCP","54","61013  >  443 [ACK] Seq=7869 Ack=72690 Win=1020 Len=0"
"250","1.491420","192.168.12.35","146.75.37.140","TCP","54","61013  >  443 [ACK] Seq=7869 Ack=72905 Win=1025 Len=0"
"251","1.491606","192.168.12.35","146.75.37.140","TCP","54","61013  >  443 [ACK] Seq=7869 Ack=74581 Win=1025 Len=0"
"252","1.491828","192.168.12.35","146.75.37.140","TCP","54","61013  >  443 [ACK] Seq=7869 Ack=76723 Win=1025 Len=0"
"253","1.492033","192.168.12.35","146.75.37.140","TCP","54","61013  >  443 [ACK] Seq=7869 Ack=78197 Win=1025 Len=0"
"254","1.492386","192.168.12.35","146.75.37.140","TCP","54","61013  >  443 [ACK] Seq=7869 Ack=78761 Win=1022 Len=0"
"255","1.493391","146.75.37.140","192.168.12.35","TLSv1.2","270","Application Data"
"256","1.493791","192.168.12.35","146.75.37.140","TCP","54","61013  >  443 [ACK] Seq=7869 Ack=79180 Win=1021 Len=0"
"257","1.497716","146.75.37.140","192.168.12.35","TLSv1.2","222","Application Data"
"258","1.497716","146.75.37.140","192.168.12.35","TCP","1430","443  >  61013 [ACK] Seq=79348 Ack=7869 Win=8244 Len=1376 [TCP PDU reassembled in 259]"
"259","1.497716","146.75.37.140","192.168.12.35","TLSv1.2","90","Application Data"
"260","1.498002","192.168.12.35","146.75.37.140","TCP","54","61013  >  443 [ACK] Seq=7869 Ack=80724 Win=1025 Len=0"
"261","1.503733","146.75.37.140","192.168.12.35","TLSv1.2","550","Application Data"
"262","1.503733","146.75.37.140","192.168.12.35","TLSv1.2","646","Application Data"
"263","1.503733","146.75.37.140","192.168.12.35","TLSv1.2","319","Application Data"
"264","1.503945","192.168.12.35","146.75.37.140","TCP","54","61013  >  443 [ACK] Seq=7869 Ack=81256 Win=1023 Len=0"
"265","1.504012","192.168.12.35","146.75.37.140","TCP","54","61013  >  443 [ACK] Seq=7869 Ack=82113 Win=1019 Len=0"
"266","1.559474","146.75.37.140","192.168.12.35","TLSv1.2","640","Application Data"
"267","1.579607","146.75.37.140","192.168.12.35","TLSv1.2","234","Application Data"
"268","1.580217","192.168.12.35","146.75.37.140","TCP","54","61013  >  443 [ACK] Seq=7869 Ack=82879 Win=1025 Len=0"
"269","1.585711","146.75.37.140","192.168.12.35","TLSv1.2","387","Application Data"
"270","1.601629","146.75.37.140","192.168.12.35","TCP","1430","443  >  61013 [ACK] Seq=83212 Ack=7869 Win=8244 Len=1376 [TCP PDU reassembled in 271]"
"271","1.601629","146.75.37.140","192.168.12.35","TLSv1.2","387","Application Data"
"272","1.602385","192.168.12.35","146.75.37.140","TCP","54","61013  >  443 [ACK] Seq=7869 Ack=84588 Win=1025 Len=0"
"273","1.609205","146.75.37.140","192.168.12.35","TCP","1430","443  >  61013 [ACK] Seq=84921 Ack=7869 Win=8244 Len=1376 [TCP PDU reassembled in 274]"
"274","1.609205","146.75.37.140","192.168.12.35","TLSv1.2","327","Application Data"
"275","1.609836","192.168.12.35","146.75.37.140","TCP","54","61013  >  443 [ACK] Seq=7869 Ack=86297 Win=1025 Len=0"
"276","1.634578","146.75.37.140","192.168.12.35","TLSv1.2","121","Application Data"
"277","1.634578","146.75.37.140","192.168.12.35","TLSv1.2","407","Application Data"
"278","1.634578","146.75.37.140","192.168.12.35","TLSv1.2","849","Application Data"
"279","1.634578","146.75.37.140","192.168.12.35","TLSv1.2","146","Application Data"
"280","1.634578","146.75.37.140","192.168.12.35","TLSv1.2","864","Application Data"
"281","1.634578","146.75.37.140","192.168.12.35","TLSv1.2","271","Application Data"
"282","1.634578","146.75.37.140","192.168.12.35","TLSv1.2","105","Application Data"
"283","1.634578","146.75.37.140","192.168.12.35","TLSv1.2","94","Application Data"
"284","1.634578","146.75.37.140","192.168.12.35","TLSv1.2","1097","Application Data"
"285","1.634578","146.75.37.140","192.168.12.35","TLSv1.2","922","Application Data"
"286","1.635083","192.168.12.35","146.75.37.140","TCP","54","61013  >  443 [ACK] Seq=7869 Ack=86637 Win=1023 Len=0"
"287","1.635099","146.75.37.140","192.168.12.35","TLSv1.2","601","Application Data"
"288","1.635099","146.75.37.140","192.168.12.35","TLSv1.2","318","Application Data"
"289","1.635099","146.75.37.140","192.168.12.35","TLSv1.2","480","Application Data"
"290","1.635099","146.75.37.140","192.168.12.35","TLSv1.2","896","Application Data"
"291","1.635099","146.75.37.140","192.168.12.35","TLSv1.2","394","Application Data"
"292","1.635099","146.75.37.140","192.168.12.35","TLSv1.2","113","Application Data"
"293","1.635099","146.75.37.140","192.168.12.35","TLSv1.2","295","Application Data"
"294","1.635099","146.75.37.140","192.168.12.35","TLSv1.2","104","Application Data"
"295","1.635099","146.75.37.140","192.168.12.35","TLSv1.2","238","Application Data"
"296","1.635099","146.75.37.140","192.168.12.35","TLSv1.2","382","Application Data"
"297","1.635153","192.168.12.35","146.75.37.140","TCP","54","61013  >  443 [ACK] Seq=7869 Ack=87785 Win=1025 Len=0"
"298","1.635382","192.168.12.35","146.75.37.140","TCP","54","61013  >  443 [ACK] Seq=7869 Ack=88687 Win=1021 Len=0"
"299","1.635432","192.168.12.35","146.75.37.140","TCP","54","61013  >  443 [ACK] Seq=7869 Ack=88955 Win=1020 Len=0"
"300","1.635480","192.168.12.35","146.75.37.140","TCP","54","61013  >  443 [ACK] Seq=7869 Ack=90038 Win=1025 Len=0"
"301","1.635518","192.168.12.35","146.75.37.140","TCP","54","61013  >  443 [ACK] Seq=7869 Ack=91453 Win=1025 Len=0"
"302","1.635559","192.168.12.35","146.75.37.140","TCP","54","61013  >  443 [ACK] Seq=7869 Ack=92143 Win=1022 Len=0"
"303","1.635667","192.168.12.35","146.75.37.140","TCP","54","61013  >  443 [ACK] Seq=7869 Ack=93325 Win=1025 Len=0"
"304","1.635829","192.168.12.35","146.75.37.140","TCP","54","61013  >  443 [ACK] Seq=7869 Ack=93625 Win=1024 Len=0"
"305","1.635882","192.168.12.35","146.75.37.140","TCP","54","61013  >  443 [ACK] Seq=7869 Ack=93859 Win=1023 Len=0"
"306","1.691683","192.168.12.35","146.75.37.140","TCP","54","61013  >  443 [ACK] Seq=7869 Ack=94187 Win=1021 Len=0"
"307","1.701622","192.168.12.35","146.75.37.140","TLSv1.2","3184","Application Data"
"308","1.701784","192.168.12.35","146.75.37.140","TLSv1.2","718","Application Data"
"309","1.702506","192.168.12.35","146.75.37.140","TLSv1.2","3188","Application Data"
"310","1.735505","192.168.12.35","146.75.37.140","TLSv1.2","3197","Application Data"
"311","1.781202","146.75.37.140","192.168.12.35","TCP","54","443  >  61013 [ACK] Seq=94187 Ack=10661 Win=8244 Len=0"
"312","1.783872","146.75.37.140","192.168.12.35","TCP","54","443  >  61013 [ACK] Seq=94187 Ack=10999 Win=8244 Len=0"
"313","1.797227","146.75.37.140","192.168.12.35","TCP","54","443  >  61013 [ACK] Seq=94187 Ack=11663 Win=8244 Len=0"
"314","1.827794","146.75.37.140","192.168.12.35","TCP","54","443  >  61013 [ACK] Seq=94187 Ack=13059 Win=8244 Len=0"
"315","1.835782","146.75.37.140","192.168.12.35","TCP","54","443  >  61013 [ACK] Seq=94187 Ack=14455 Win=8244 Len=0"
"316","1.835782","146.75.37.140","192.168.12.35","TCP","1430","443  >  61013 [ACK] Seq=94187 Ack=14455 Win=8244 Len=1376 [TCP PDU reassembled in 317]"
"317","1.835782","146.75.37.140","192.168.12.35","TLSv1.2","437","Application Data"
"318","1.836100","192.168.12.35","146.75.37.140","TCP","54","61013  >  443 [ACK] Seq=17940 Ack=95563 Win=1025 Len=0"
"319","1.836234","192.168.12.35","146.75.37.140","TCP","54","61013  >  443 [ACK] Seq=17940 Ack=95946 Win=1023 Len=0"
"320","1.841202","146.75.37.140","192.168.12.35","TCP","54","443  >  61013 [ACK] Seq=95946 Ack=14797 Win=8244 Len=0"
"321","1.852147","192.168.12.35","146.75.37.140","TLSv1.2","3176","Application Data"
"322","1.852530","192.168.12.35","146.75.37.140","TLSv1.2","210","Application Data"
"323","1.857765","146.75.37.140","192.168.12.35","TCP","54","443  >  61013 [ACK] Seq=95946 Ack=16193 Win=8244 Len=0"
"324","1.876890","146.75.37.140","192.168.12.35","TCP","54","443  >  61013 [ACK] Seq=95946 Ack=17589 Win=8244 Len=0"
"325","1.876890","146.75.37.140","192.168.12.35","TCP","54","443  >  61013 [ACK] Seq=95946 Ack=17940 Win=8244 Len=0"
"326","1.894988","146.75.37.140","192.168.12.35","TCP","1430","443  >  61013 [ACK] Seq=95946 Ack=17940 Win=8244 Len=1376 [TCP PDU reassembled in 327]"
"327","1.894988","146.75.37.140","192.168.12.35","TLSv1.2","823","Application Data"
