"No.","Time","Source","Destination","Protocol","Length","Info"
"1","0.000000","192.168.12.35","146.75.37.140","UDP","80","52870  >  443 Len=38"
"2","0.050709","146.75.37.140","192.168.12.35","UDP","69","443  >  52870 Len=27"
"3","1.876722","146.75.37.140","192.168.12.35","UDP","1219","443  >  52870 Len=1177"
"4","1.894582","192.168.12.35","146.75.37.140","UDP","84","52870  >  443 Len=42"
"5","1.895428","192.168.12.35","146.75.37.140","UDP","1292","52870  >  443 Len=1250"
"6","1.895518","192.168.12.35","146.75.37.140","UDP","1022","52870  >  443 Len=980"
"7","1.970399","146.75.37.140","192.168.12.35","UDP","67","443  >  52870 Len=25"
"8","2.175863","192.168.12.35","146.75.37.140","UDP","80","52870  >  443 Len=38"
"9","2.223846","146.75.37.140","192.168.12.35","UDP","67","443  >  52870 Len=25"
"10","2.397924","192.168.12.35","146.75.37.140","TLSv1.2","149","Application Data"
"11","2.398120","192.168.12.35","146.75.37.140","TLSv1.2","93","Application Data"
"12","2.429893","146.75.37.140","192.168.12.35","TCP","54","443  >  62685 [ACK] Seq=1 Ack=96 Win=307 Len=0"
"13","2.429893","146.75.37.140","192.168.12.35","TCP","54","443  >  62685 [ACK] Seq=1 Ack=135 Win=307 Len=0"
"14","2.429893","146.75.37.140","192.168.12.35","TLSv1.2","93","Application Data"
"15","2.429893","146.75.37.140","192.168.12.35","TLSv1.2","180","Application Data"
"16","2.429893","146.75.37.140","192.168.12.35","TCP","1430","443  >  62685 [ACK] Seq=166 Ack=135 Win=307 Len=1376 [TCP PDU reassembled in 27]"
"17","2.429893","146.75.37.140","192.168.12.35","TCP","1430","443  >  62685 [ACK] Seq=1542 Ack=135 Win=307 Len=1376 [TCP PDU reassembled in 27]"
"18","2.429893","146.75.37.140","192.168.12.35","TCP","1430","443  >  62685 [ACK] Seq=2918 Ack=135 Win=307 Len=1376 [TCP PDU reassembled in 27]"
"19","2.429893","146.75.37.140","192.168.12.35","TCP","1430","443  >  62685 [ACK] Seq=4294 Ack=135 Win=307 Len=1376 [TCP PDU reassembled in 27]"
"20","2.429893","146.75.37.140","192.168.12.35","TCP","1430","443  >  62685 [ACK] Seq=5670 Ack=135 Win=307 Len=1376 [TCP PDU reassembled in 27]"
"21","2.429893","146.75.37.140","192.168.12.35","TCP","1430","443  >  62685 [ACK] Seq=7046 Ack=135 Win=307 Len=1376 [TCP PDU reassembled in 27]"
"22","2.429893","146.75.37.140","192.168.12.35","TCP","1430","443  >  62685 [ACK] Seq=8422 Ack=135 Win=307 Len=1376 [TCP PDU reassembled in 27]"
"23","2.429893","146.75.37.140","192.168.12.35","TCP","1430","443  >  62685 [ACK] Seq=9798 Ack=135 Win=307 Len=1376 [TCP PDU reassembled in 27]"
"24","2.429893","146.75.37.140","192.168.12.35","TCP","1430","443  >  62685 [PSH, ACK] Seq=11174 Ack=135 Win=307 Len=1376 [TCP PDU reassembled in 27]"
"25","2.429893","146.75.37.140","192.168.12.35","TCP","1430","443  >  62685 [ACK] Seq=12550 Ack=135 Win=307 Len=1376 [TCP PDU reassembled in 27]"
"26","2.429893","146.75.37.140","192.168.12.35","TCP","1430","443  >  62685 [ACK] Seq=13926 Ack=135 Win=307 Len=1376 [TCP PDU reassembled in 27]"
"27","2.429893","146.75.37.140","192.168.12.35","TLSv1.2","1430","Application Data"
"28","2.429893","146.75.37.140","192.168.12.35","TCP","1430","443  >  62685 [ACK] Seq=16678 Ack=135 Win=307 Len=1376 [TCP PDU reassembled in 39]"
"29","2.429893","146.75.37.140","192.168.12.35","TCP","1430","443  >  62685 [ACK] Seq=18054 Ack=135 Win=307 Len=1376 [TCP PDU reassembled in 39]"
"30","2.429893","146.75.37.140","192.168.12.35","TCP","1430","443  >  62685 [ACK] Seq=19430 Ack=135 Win=307 Len=1376 [TCP PDU reassembled in 39]"
"31","2.429893","146.75.37.140","192.168.12.35","TCP","1430","443  >  62685 [ACK] Seq=20806 Ack=135 Win=307 Len=1376 [TCP PDU reassembled in 39]"
"32","2.429893","146.75.37.140","192.168.12.35","TCP","1430","443  >  62685 [ACK] Seq=22182 Ack=135 Win=307 Len=1376 [TCP PDU reassembled in 39]"
"33","2.429893","146.75.37.140","192.168.12.35","TCP","1430","443  >  62685 [PSH, ACK] Seq=23558 Ack=135 Win=307 Len=1376 [TCP PDU reassembled in 39]"
"34","2.429893","146.75.37.140","192.168.12.35","TCP","1430","443  >  62685 [ACK] Seq=24934 Ack=135 Win=307 Len=1376 [TCP PDU reassembled in 39]"
"35","2.429893","146.75.37.140","192.168.12.35","TCP","1430","443  >  62685 [ACK] Seq=26310 Ack=135 Win=307 Len=1376 [TCP PDU reassembled in 39]"
"36","2.429893","146.75.37.140","192.168.12.35","TCP","1430","443  >  62685 [ACK] Seq=27686 Ack=135 Win=307 Len=1376 [TCP PDU reassembled in 39]"
"37","2.429893","146.75.37.140","192.168.12.35","TCP","1430","443  >  62685 [ACK] Seq=29062 Ack=135 Win=307 Len=1376 [TCP PDU reassembled in 39]"
"38","2.429893","146.75.37.140","192.168.12.35","TCP","1430","443  >  62685 [ACK] Seq=30438 Ack=135 Win=307 Len=1376 [TCP PDU reassembled in 39]"
"39","2.429893","146.75.37.140","192.168.12.35","TLSv1.2","1430","Application Data"
"40","2.429893","146.75.37.140","192.168.12.35","TCP","1430","443  >  62685 [ACK] Seq=33190 Ack=135 Win=307 Len=1376 [TCP PDU reassembled in 56]"
"41","2.431872","146.75.37.140","192.168.12.35","TCP","1430","443  >  62685 [ACK] Seq=34566 Ack=135 Win=307 Len=1376 [TCP PDU reassembled in 56]"
"42","2.431872","146.75.37.140","192.168.12.35","TCP","1430","443  >  62685 [PSH, ACK] Seq=35942 Ack=135 Win=307 Len=1376 [TCP PDU reassembled in 56]"
"43","2.431872","146.75.37.140","192.168.12.35","TCP","1430","443  >  62685 [ACK] Seq=37318 Ack=135 Win=307 Len=1376 [TCP PDU reassembled in 56]"
"44","2.431872","146.75.37.140","192.168.12.35","TCP","1430","443  >  62685 [ACK] Seq=38694 Ack=135 Win=307 Len=1376 [TCP PDU reassembled in 56]"
"45","2.431872","146.75.37.140","192.168.12.35","TCP","1430","443  >  62685 [ACK] Seq=40070 Ack=135 Win=307 Len=1376 [TCP PDU reassembled in 56]"
"46","2.431872","146.75.37.140","192.168.12.35","TCP","1430","443  >  62685 [ACK] Seq=41446 Ack=135 Win=307 Len=1376 [TCP PDU reassembled in 56]"
"47","2.431872","146.75.37.140","192.168.12.35","TCP","1430","443  >  62685 [ACK] Seq=42822 Ack=135 Win=307 Len=1376 [TCP PDU reassembled in 56]"
"48","2.431872","146.75.37.140","192.168.12.35","TCP","1430","443  >  62685 [ACK] Seq=44198 Ack=135 Win=307 Len=1376 [TCP PDU reassembled in 56]"
"49","2.431872","146.75.37.140","192.168.12.35","TCP","1430","443  >  62685 [ACK] Seq=45574 Ack=135 Win=307 Len=1376 [TCP PDU reassembled in 56]"
"50","2.431872","146.75.37.140","192.168.12.35","TCP","1430","443  >  62685 [ACK] Seq=46950 Ack=135 Win=307 Len=1376 [TCP PDU reassembled in 56]"
"51","2.432176","192.168.12.35","146.75.37.140","UDP","80","52870  >  443 Len=38"
"52","2.432254","192.168.12.35","146.75.37.140","TCP","54","62685  >  443 [ACK] Seq=135 Ack=166 Win=1021 Len=0"
"53","2.432371","192.168.12.35","146.75.37.140","TCP","54","62685  >  443 [ACK] Seq=135 Ack=24934 Win=1025 Len=0"
"54","2.432496","192.168.12.35","146.75.37.140","TCP","54","62685  >  443 [ACK] Seq=135 Ack=34566 Win=1025 Len=0"
"55","2.432675","192.168.12.35","146.75.37.140","TCP","54","62685  >  443 [ACK] Seq=135 Ack=48326 Win=1025 Len=0"
"56","2.434018","146.75.37.140","192.168.12.35","TLSv1.2","1430","Application Data"
"57","2.434018","146.75.37.140","192.168.12.35","TCP","1430","443  >  62685 [ACK] Seq=49702 Ack=135 Win=307 Len=1376 [TCP PDU reassembled in 70]"
"58","2.434018","146.75.37.140","192.168.12.35","TCP","1430","443  >  62685 [ACK] Seq=51078 Ack=135 Win=307 Len=1376 [TCP PDU reassembled in 70]"
"59","2.434018","146.75.37.140","192.168.12.35","TCP","1430","443  >  62685 [ACK] Seq=52454 Ack=135 Win=307 Len=1376 [TCP PDU reassembled in 70]"
"60","2.434018","146.75.37.140","192.168.12.35","TCP","1430","443  >  62685 [ACK] Seq=53830 Ack=135 Win=307 Len=1376 [TCP PDU reassembled in 70]"
"61","2.434018","146.75.37.140","192.168.12.35","TCP","1430","443  >  62685 [ACK] Seq=55206 Ack=135 Win=307 Len=1376 [TCP PDU reassembled in 70]"
"62","2.434018","146.75.37.140","192.168.12.35","TCP","1430","443  >  62685 [ACK] Seq=56582 Ack=135 Win=307 Len=1376 [TCP PDU reassembled in 70]"
"63","2.434018","146.75.37.140","192.168.12.35","TCP","1430","443  >  62685 [ACK] Seq=57958 Ack=135 Win=307 Len=1376 [TCP PDU reassembled in 70]"
"64","2.434018","146.75.37.140","192.168.12.35","TCP","1430","443  >  62685 [ACK] Seq=59334 Ack=135 Win=307 Len=1376 [TCP PDU reassembled in 70]"
"65","2.434018","146.75.37.140","192.168.12.35","TCP","1430","443  >  62685 [PSH, ACK] Seq=60710 Ack=135 Win=307 Len=1376 [TCP PDU reassembled in 70]"
"66","2.434548","192.168.12.35","146.75.37.140","TCP","54","62685  >  443 [ACK] Seq=135 Ack=62086 Win=1025 Len=0"
"67","2.435991","192.168.12.35","146.75.37.140","TLSv1.2","89","Application Data"
"68","2.440998","146.75.37.140","192.168.12.35","TCP","1430","443  >  62685 [ACK] Seq=62086 Ack=135 Win=307 Len=1376 [TCP PDU reassembled in 70]"
"69","2.440998","146.75.37.140","192.168.12.35","TCP","1430","443  >  62685 [ACK] Seq=63462 Ack=135 Win=307 Len=1376 [TCP PDU reassembled in 70]"
"70","2.440998","146.75.37.140","192.168.12.35","TLSv1.2","1430","Application Data, Application Data"
"71","2.440998","146.75.37.140","192.168.12.35","TCP","1430","443  >  62685 [ACK] Seq=66214 Ack=135 Win=307 Len=1376 [TCP PDU reassembled in 72]"
"72","2.440998","146.75.37.140","192.168.12.35","TLSv1.2","814","Application Data"
"73","2.441415","192.168.12.35","146.75.37.140","TCP","54","62685  >  443 [ACK] Seq=170 Ack=67590 Win=1025 Len=0"
"74","2.468778","146.75.37.140","192.168.12.35","TCP","54","443  >  62685 [ACK] Seq=68350 Ack=170 Win=307 Len=0"
"75","2.486419","192.168.12.35","146.75.37.140","TCP","54","62685  >  443 [ACK] Seq=170 Ack=68350 Win=1022 Len=0"
"76","2.494640","146.75.37.140","192.168.12.35","UDP","67","443  >  52870 Len=25"
"77","2.518381","192.168.12.35","146.75.37.140","TLSv1.2","3361","Application Data"
"78","2.518617","192.168.12.35","146.75.37.140","TLSv1.2","93","Application Data"
"79","2.518697","192.168.12.35","146.75.37.140","TLSv1.2","2375","Application Data"
"80","2.519470","192.168.12.35","146.75.37.140","TLSv1.2","3242","Application Data"
"81","2.558890","146.75.37.140","192.168.12.35","TCP","54","443  >  61013 [ACK] Seq=1 Ack=1397 Win=8244 Len=0"
"82","2.578802","146.75.37.140","192.168.12.35","TCP","54","443  >  61013 [ACK] Seq=1 Ack=2793 Win=8244 Len=0"
"83","2.588688","146.75.37.140","192.168.12.35","TCP","54","443  >  61013 [ACK] Seq=1 Ack=3308 Win=8244 Len=0"
"84","2.588688","146.75.37.140","192.168.12.35","TCP","54","443  >  61013 [ACK] Seq=1 Ack=3347 Win=8244 Len=0"
"85","2.588688","146.75.37.140","192.168.12.35","TLSv1.2","93","Application Data"
"86","2.610318","146.75.37.140","192.168.12.35","TCP","54","443  >  61013 [ACK] Seq=40 Ack=4743 Win=8244 Len=0"
"87","2.623393","146.75.37.140","192.168.12.35","TCP","54","443  >  61013 [ACK] Seq=40 Ack=5668 Win=8244 Len=0"
"88","2.640103","192.168.12.35","146.75.37.140","TCP","54","61013  >  443 [ACK] Seq=8856 Ack=40 Win=1025 Len=0"
"89","2.648372","146.75.37.140","192.168.12.35","TCP","54","443  >  61013 [ACK] Seq=40 Ack=7064 Win=8244 Len=0"
"90","2.663835","146.75.37.140","192.168.12.35","TCP","54","443  >  61013 [ACK] Seq=40 Ack=8460 Win=8244 Len=0"
"91","2.663835","146.75.37.140","192.168.12.35","TCP","54","443  >  61013 [ACK] Seq=40 Ack=8856 Win=8244 Len=0"
"92","2.681707","146.75.37.140","192.168.12.35","TCP","1430","443  >  61013 [ACK] Seq=40 Ack=8856 Win=8244 Len=1376 [TCP PDU reassembled in 93]"
"93","2.681707","146.75.37.140","192.168.12.35","TLSv1.2","829","Application Data"
"94","2.681707","146.75.37.140","192.168.12.35","TLSv1.2","87","Application Data"
"95","2.682380","192.168.12.35","146.75.37.140","TCP","54","61013  >  443 [ACK] Seq=8856 Ack=2191 Win=1025 Len=0"
"96","2.686644","192.168.12.35","146.75.37.140","TLSv1.2","89","Application Data"
"97","2.702092","146.75.37.140","192.168.12.35","TCP","1430","443  >  61013 [ACK] Seq=2224 Ack=8856 Win=8244 Len=1376 [TCP PDU reassembled in 98]"
"98","2.702092","146.75.37.140","192.168.12.35","TLSv1.2","568","Application Data"
"99","2.702092","146.75.37.140","192.168.12.35","TCP","1430","443  >  61013 [ACK] Seq=4114 Ack=8856 Win=8244 Len=1376 [TCP PDU reassembled in 100]"
"100","2.702092","146.75.37.140","192.168.12.35","TLSv1.2","1069","Application Data"
"101","2.702414","192.168.12.35","146.75.37.140","UDP","80","52870  >  443 Len=38"
"102","2.702606","192.168.12.35","146.75.37.140","TCP","54","61013  >  443 [ACK] Seq=8891 Ack=3600 Win=1025 Len=0"
"103","2.702866","192.168.12.35","146.75.37.140","TCP","54","61013  >  443 [ACK] Seq=8891 Ack=4114 Win=1023 Len=0"
"104","2.702980","192.168.12.35","146.75.37.140","TCP","54","61013  >  443 [ACK] Seq=8891 Ack=5490 Win=1025 Len=0"
"105","2.703082","192.168.12.35","146.75.37.140","TCP","54","61013  >  443 [ACK] Seq=8891 Ack=6505 Win=1021 Len=0"
"106","2.708140","146.75.37.140","192.168.12.35","TCP","1430","443  >  61013 [ACK] Seq=6505 Ack=8856 Win=8244 Len=1376 [TCP PDU reassembled in 116]"
"107","2.708140","146.75.37.140","192.168.12.35","TCP","1430","443  >  61013 [PSH, ACK] Seq=7881 Ack=8856 Win=8244 Len=1376 [TCP PDU reassembled in 116]"
"108","2.708140","146.75.37.140","192.168.12.35","TCP","1430","443  >  61013 [ACK] Seq=9257 Ack=8856 Win=8244 Len=1376 [TCP PDU reassembled in 116]"
"109","2.708140","146.75.37.140","192.168.12.35","TCP","1430","443  >  61013 [PSH, ACK] Seq=10633 Ack=8856 Win=8244 Len=1376 [TCP PDU reassembled in 116]"
"110","2.708140","146.75.37.140","192.168.12.35","TCP","1430","443  >  61013 [ACK] Seq=12009 Ack=8856 Win=8244 Len=1376 [TCP PDU reassembled in 116]"
"111","2.708140","146.75.37.140","192.168.12.35","TCP","1430","443  >  61013 [PSH, ACK] Seq=13385 Ack=8856 Win=8244 Len=1376 [TCP PDU reassembled in 116]"
"112","2.708140","146.75.37.140","192.168.12.35","TCP","1430","443  >  61013 [ACK] Seq=14761 Ack=8856 Win=8244 Len=1376 [TCP PDU reassembled in 116]"
"113","2.708140","146.75.37.140","192.168.12.35","TCP","1430","443  >  61013 [PSH, ACK] Seq=16137 Ack=8856 Win=8244 Len=1376 [TCP PDU reassembled in 116]"
"114","2.708140","146.75.37.140","192.168.12.35","TCP","1430","443  >  61013 [ACK] Seq=17513 Ack=8856 Win=8244 Len=1376 [TCP PDU reassembled in 116]"
"115","2.708140","146.75.37.140","192.168.12.35","TCP","1430","443  >  61013 [PSH, ACK] Seq=18889 Ack=8856 Win=8244 Len=1376 [TCP PDU reassembled in 116]"
"116","2.708140","146.75.37.140","192.168.12.35","TLSv1.2","349","Application Data"
"117","2.708140","146.75.37.140","192.168.12.35","TLSv1.2","864","Application Data"
"118","2.708888","192.168.12.35","146.75.37.140","TCP","54","61013  >  443 [ACK] Seq=8891 Ack=20265 Win=1025 Len=0"
"119","2.709264","192.168.12.35","146.75.37.140","TCP","54","61013  >  443 [ACK] Seq=8891 Ack=21370 Win=1020 Len=0"
"120","2.714722","146.75.37.140","192.168.12.35","TLSv1.2","90","Application Data"
"121","2.714722","146.75.37.140","192.168.12.35","TCP","54","443  >  61013 [ACK] Seq=21406 Ack=8891 Win=8244 Len=0"
"122","2.720129","146.75.37.140","192.168.12.35","TCP","1430","443  >  61013 [ACK] Seq=21406 Ack=8891 Win=8244 Len=1376 [TCP PDU reassembled in 133]"
"123","2.720129","146.75.37.140","192.168.12.35","TCP","1430","443  >  61013 [ACK] Seq=22782 Ack=8891 Win=8244 Len=1376 [TCP PDU reassembled in 133]"
"124","2.720129","146.75.37.140","192.168.12.35","TCP","1430","443  >  61013 [PSH, ACK] Seq=24158 Ack=8891 Win=8244 Len=1376 [TCP PDU reassembled in 133]"
"125","2.720129","146.75.37.140","192.168.12.35","TCP","1430","443  >  61013 [ACK] Seq=25534 Ack=8891 Win=8244 Len=1376 [TCP PDU reassembled in 133]"
"126","2.720129","146.75.37.140","192.168.12.35","TCP","1430","443  >  61013 [ACK] Seq=26910 Ack=8891 Win=8244 Len=1376 [TCP PDU reassembled in 133]"
"127","2.720129","146.75.37.140","192.168.12.35","TCP","1430","443  >  61013 [PSH, ACK] Seq=28286 Ack=8891 Win=8244 Len=1376 [TCP PDU reassembled in 133]"
"128","2.720129","146.75.37.140","192.168.12.35","TCP","1430","443  >  61013 [ACK] Seq=29662 Ack=8891 Win=8244 Len=1376 [TCP PDU reassembled in 133]"
"129","2.720129","146.75.37.140","192.168.12.35","TCP","1430","443  >  61013 [ACK] Seq=31038 Ack=8891 Win=8244 Len=1376 [TCP PDU reassembled in 133]"
"130","2.720129","146.75.37.140","192.168.12.35","TCP","1430","443  >  61013 [PSH, ACK] Seq=32414 Ack=8891 Win=8244 Len=1376 [TCP PDU reassembled in 133]"
"131","2.720129","146.75.37.140","192.168.12.35","TCP","1430","443  >  61013 [ACK] Seq=33790 Ack=8891 Win=8244 Len=1376 [TCP PDU reassembled in 133]"
"132","2.720129","146.75.37.140","192.168.12.35","TCP","1430","443  >  61013 [ACK] Seq=35166 Ack=8891 Win=8244 Len=1376 [TCP PDU reassembled in 133]"
"133","2.720129","146.75.37.140","192.168.12.35","TLSv1.2","549","Application Data"
"134","2.720814","192.168.12.35","146.75.37.140","TCP","54","61013  >  443 [ACK] Seq=8891 Ack=36542 Win=1025 Len=0"
"135","2.726170","146.75.37.140","192.168.12.35","TCP","1430","443  >  61013 [ACK] Seq=37037 Ack=8891 Win=8244 Len=1376 [TCP PDU reassembled in 146]"
"136","2.726170","146.75.37.140","192.168.12.35","TCP","1430","443  >  61013 [ACK] Seq=38413 Ack=8891 Win=8244 Len=1376 [TCP PDU reassembled in 146]"
"137","2.726170","146.75.37.140","192.168.12.35","TCP","1430","443  >  61013 [PSH, ACK] Seq=39789 Ack=8891 Win=8244 Len=1376 [TCP PDU reassembled in 146]"
"138","2.726170","146.75.37.140","192.168.12.35","TCP","1430","443  >  61013 [ACK] Seq=41165 Ack=8891 Win=8244 Len=1376 [TCP PDU reassembled in 146]"
"139","2.726170","146.75.37.140","192.168.12.35","TCP","1430","443  >  61013 [ACK] Seq=42541 Ack=8891 Win=8244 Len=1376 [TCP PDU reassembled in 146]"
"140","2.726170","146.75.37.140","192.168.12.35","TCP","1430","443  >  61013 [PSH, ACK] Seq=43917 Ack=8891 Win=8244 Len=1376 [TCP PDU reassembled in 146]"
"141","2.726170","146.75.37.140","192.168.12.35","TCP","1430","443  >  61013 [ACK] Seq=45293 Ack=8891 Win=8244 Len=1376 [TCP PDU reassembled in 146]"
"142","2.726170","146.75.37.140","192.168.12.35","TCP","1430","443  >  61013 [ACK] Seq=46669 Ack=8891 Win=8244 Len=1376 [TCP PDU reassembled in 146]"
"143","2.726170","146.75.37.140","192.168.12.35","TCP","1430","443  >  61013 [PSH, ACK] Seq=48045 Ack=8891 Win=8244 Len=1376 [TCP PDU reassembled in 146]"
"144","2.726170","146.75.37.140","192.168.12.35","TCP","1430","443  >  61013 [ACK] Seq=49421 Ack=8891 Win=8244 Len=1376 [TCP PDU reassembled in 146]"
"145","2.726170","146.75.37.140","192.168.12.35","TCP","1430","443  >  61013 [ACK] Seq=50797 Ack=8891 Win=8244 Len=1376 [TCP PDU reassembled in 146]"
"146","2.726170","146.75.37.140","192.168.12.35","TLSv1.2","1386","Application Data, Application Data, Application Data"
"147","2.726170","146.75.37.140","192.168.12.35","TCP","1430","443  >  61013 [ACK] Seq=53505 Ack=8891 Win=8244 Len=1376 [TCP PDU reassembled in 148]"
"148","2.726170","146.75.37.140","192.168.12.35","TLSv1.2","996","Application Data"
"149","2.727029","192.168.12.35","146.75.37.140","TCP","54","61013  >  443 [ACK] Seq=8891 Ack=52173 Win=1025 Len=0"
"150","2.727504","192.168.12.35","146.75.37.140","TCP","54","61013  >  443 [ACK] Seq=8891 Ack=54881 Win=1025 Len=0"
"151","2.732727","146.75.37.140","192.168.12.35","TLSv1.2","1048","Application Data"
"152","2.733073","192.168.12.35","146.75.37.140","TCP","54","61013  >  443 [ACK] Seq=8891 Ack=56817 Win=1025 Len=0"
"153","2.738778","146.75.37.140","192.168.12.35","TLSv1.2","1181","Application Data"
"154","2.738778","146.75.37.140","192.168.12.35","TLSv1.2","1068","Application Data"
"155","2.738778","146.75.37.140","192.168.12.35","TCP","1430","443  >  61013 [ACK] Seq=58958 Ack=8891 Win=8244 Len=1376 [TCP PDU reassembled in 156]"
"156","2.738778","146.75.37.140","192.168.12.35","TLSv1.2","333","Application Data"
"157","2.738778","146.75.37.140","192.168.12.35","TLSv1.2","1246","Application Data"
"158","2.739257","192.168.12.35","146.75.37.140","TCP","54","61013  >  443 [ACK] Seq=8891 Ack=58958 Win=1025 Len=0"
"159","2.739613","192.168.12.35","146.75.37.140","TCP","54","61013  >  443 [ACK] Seq=8891 Ack=60613 Win=1025 Len=0"
"160","2.748378","146.75.37.140","192.168.12.35","TLSv1.2","582","Application Data"
"161","2.748378","146.75.37.140","192.168.12.35","TCP","1430","443  >  61013 [ACK] Seq=62333 Ack=8891 Win=8244 Len=1376 [TCP PDU reassembled in 162]"
"162","2.748378","146.75.37.140","192.168.12.35","TLSv1.2","311","Application Data"
"163","2.748378","146.75.37.140","192.168.12.35","TLSv1.2","769","Application Data"
"164","2.748378","146.75.37.140","192.168.12.35","UDP","67","443  >  52870 Len=25"
"165","2.748918","192.168.12.35","146.75.37.140","TCP","54","61013  >  443 [ACK] Seq=8891 Ack=62333 Win=1025 Len=0"
"166","2.749269","192.168.12.35","146.75.37.140","TCP","54","61013  >  443 [ACK] Seq=8891 Ack=63966 Win=1025 Len=0"
"167","2.758784","146.75.37.140","192.168.12.35","TLSv1.2","97","Application Data"
"168","2.758784","146.75.37.140","192.168.12.35","TLSv1.2","604","Application Data"
"169","2.758784","146.75.37.140","192.168.12.35","TLSv1.2","118","Application Data"
"170","2.759335","192.168.12.35","146.75.37.140","TCP","54","61013  >  443 [ACK] Seq=8891 Ack=64724 Win=1022 Len=0"
"171","2.759712","192.168.12.35","146.75.37.140","TCP","54","61013  >  443 [ACK] Seq=8891 Ack=65338 Win=1019 Len=0"
"172","2.764805","192.168.12.35","146.75.37.140","UDP","97","52870  >  443 Len=55"
"173","2.764792","146.75.37.140","192.168.12.35","TLSv1.2","153","Application Data"
"174","2.764792","146.75.37.140","192.168.12.35","TLSv1.2","125","Application Data"
"175","2.764792","146.75.37.140","192.168.12.35","TLSv1.2","675","Application Data"
"176","2.764792","146.75.37.140","192.168.12.35","TLSv1.2","100","Application Data"
"177","2.765273","192.168.12.35","146.75.37.140","TCP","54","61013  >  443 [ACK] Seq=8891 Ack=65508 Win=1025 Len=0"
"178","2.765719","192.168.12.35","146.75.37.140","TCP","54","61013  >  443 [ACK] Seq=8891 Ack=66175 Win=1022 Len=0"
"179","2.771009","146.75.37.140","192.168.12.35","TLSv1.2","742","Application Data"
"180","2.771009","146.75.37.140","192.168.12.35","TLSv1.2","707","Application Data"
"181","2.771009","146.75.37.140","192.168.12.35","TLSv1.2","414","Application Data"
"182","2.771009","146.75.37.140","192.168.12.35","TLSv1.2","129","Application Data"
"183","2.771009","146.75.37.140","192.168.12.35","TLSv1.2","156","Application Data"
"184","2.771542","192.168.12.35","146.75.37.140","TCP","54","61013  >  443 [ACK] Seq=8891 Ack=67516 Win=1025 Len=0"
"185","2.771873","192.168.12.35","146.75.37.140","TCP","54","61013  >  443 [ACK] Seq=8891 Ack=67951 Win=1023 Len=0"
"186","2.776994","146.75.37.140","192.168.12.35","TLSv1.2","119","Application Data"
"187","2.777387","192.168.12.35","146.75.37.140","TCP","54","61013  >  443 [ACK] Seq=8891 Ack=68118 Win=1022 Len=0"
"188","2.782867","146.75.37.140","192.168.12.35","TLSv1.2","94","Application Data"
"189","2.789716","146.75.37.140","192.168.12.35","TLSv1.2","107","Application Data"
"190","2.789716","146.75.37.140","192.168.12.35","TLSv1.2","719","Application Data"
"191","2.789716","146.75.37.140","192.168.12.35","TLSv1.2","392","Application Data"
"192","2.789716","146.75.37.140","192.168.12.35","TLSv1.2","155","Application Data"
"193","2.789716","146.75.37.140","192.168.12.35","TLSv1.2","130","Application Data"
"194","2.789716","146.75.37.140","192.168.12.35","TLSv1.2","200","Application Data"
"195","2.789716","146.75.37.140","192.168.12.35","TLSv1.2","377","Application Data"
"196","2.790314","192.168.12.35","146.75.37.140","TCP","54","61013  >  443 [ACK] Seq=8891 Ack=68211 Win=1022 Len=0"
"197","2.790649","192.168.12.35","146.75.37.140","TCP","54","61013  >  443 [ACK] Seq=8891 Ack=69214 Win=1025 Len=0"
"198","2.790853","192.168.12.35","146.75.37.140","TCP","54","61013  >  443 [ACK] Seq=8891 Ack=69391 Win=1024 Len=0"
"199","2.790964","192.168.12.35","146.75.37.140","TCP","54","61013  >  443 [ACK] Seq=8891 Ack=69860 Win=1022 Len=0"
"200","2.798345","146.75.37.140","192.168.12.35","UDP","67","443  >  52870 Len=25"
"201","2.810381","192.168.12.35","146.75.37.140","UDP","84","52870  >  443 Len=42"
"202","2.823339","146.75.37.140","192.168.12.35","UDP","67","443  >  52870 Len=25"
"203","3.208808","146.75.37.140","192.168.12.35","TLSv1.2","564","Application Data"
"204","3.208808","146.75.37.140","192.168.12.35","TLSv1.2","133","Application Data"
"205","3.209380","192.168.12.35","146.75.37.140","TCP","54","61013  >  443 [ACK] Seq=8891 Ack=70449 Win=1020 Len=0"
"206","3.216038","146.75.37.140","192.168.12.35","TLSv1.2","399","Application Data"
"207","3.216038","146.75.37.140","192.168.12.35","TLSv1.2","203","Application Data"
"208","3.216502","192.168.12.35","146.75.37.140","TCP","54","61013  >  443 [ACK] Seq=8891 Ack=70943 Win=1025 Len=0"
"209","3.226352","146.75.37.140","192.168.12.35","TLSv1.2","215","Application Data"
"210","3.226352","146.75.37.140","192.168.12.35","TLSv1.2","154","Application Data"
"211","3.226865","192.168.12.35","146.75.37.140","TCP","54","61013  >  443 [ACK] Seq=8891 Ack=71204 Win=1024 Len=0"
"212","3.238580","146.75.37.140","192.168.12.35","TLSv1.2","114","Application Data"
"213","3.238580","146.75.37.140","192.168.12.35","TCP","1430","443  >  61013 [ACK] Seq=71264 Ack=8891 Win=8244 Len=1376 [TCP PDU reassembled in 214]"
"214","3.238580","146.75.37.140","192.168.12.35","TLSv1.2","68","Application Data"
"215","3.239171","192.168.12.35","146.75.37.140","TCP","54","61013  >  443 [ACK] Seq=8891 Ack=72640 Win=1025 Len=0"
"216","3.250884","146.75.37.140","192.168.12.35","TLSv1.2","136","Application Data"
"217","3.251407","192.168.12.35","146.75.37.140","TCP","54","61013  >  443 [ACK] Seq=8891 Ack=72736 Win=1024 Len=0"
"218","3.261356","146.75.37.140","192.168.12.35","TLSv1.2","995","Application Data"
"219","3.261356","146.75.37.140","192.168.12.35","TLSv1.2","723","Application Data"
"220","3.261893","192.168.12.35","146.75.37.140","TCP","54","61013  >  443 [ACK] Seq=8891 Ack=74346 Win=1025 Len=0"
"221","3.270185","146.75.37.140","192.168.12.35","TLSv1.2","497","Application Data"
"222","3.270185","146.75.37.140","192.168.12.35","TLSv1.2","846","Application Data"
"223","3.270185","146.75.37.140","192.168.12.35","TLSv1.2","532","Application Data"
"224","3.270185","146.75.37.140","192.168.12.35","TLSv1.2","604","Application Data"
"225","3.270185","146.75.37.140","192.168.12.35","TLSv1.2","230","Application Data"
"226","3.270185","146.75.37.140","192.168.12.35","TLSv1.2","927","Application Data"
"227","3.270185","146.75.37.140","192.168.12.35","TLSv1.2","287","Application Data"
"228","3.270185","146.75.37.140","192.168.12.35","TLSv1.2","258","Application Data"
"229","3.270978","192.168.12.35","146.75.37.140","TCP","54","61013  >  443 [ACK] Seq=8891 Ack=75581 Win=1020 Len=0"
"230","3.271427","192.168.12.35","146.75.37.140","TCP","54","61013  >  443 [ACK] Seq=8891 Ack=76609 Win=1025 Len=0"
"231","3.271584","192.168.12.35","146.75.37.140","TCP","54","61013  >  443 [ACK] Seq=8891 Ack=77658 Win=1021 Len=0"
"232","3.271702","192.168.12.35","146.75.37.140","TCP","54","61013  >  443 [ACK] Seq=8891 Ack=78095 Win=1025 Len=0"
"233","3.286354","146.75.37.140","192.168.12.35","TLSv1.2","202","Application Data"
"234","3.321410","146.75.37.140","192.168.12.35","TLSv1.2","397","Application Data"
"235","3.321901","192.168.12.35","146.75.37.140","TCP","54","61013  >  443 [ACK] Seq=8891 Ack=78586 Win=1023 Len=0"
"236","3.333374","146.75.37.140","192.168.12.35","TLSv1.2","378","Application Data"
"237","3.333374","146.75.37.140","192.168.12.35","TLSv1.2","225","Application Data"
"238","3.333876","192.168.12.35","146.75.37.140","TCP","54","61013  >  443 [ACK] Seq=8891 Ack=79081 Win=1021 Len=0"
"239","3.338678","146.75.37.140","192.168.12.35","TLSv1.2","312","Application Data"
"240","3.344724","146.75.37.140","192.168.12.35","TLSv1.2","698","Application Data"
"241","3.344724","146.75.37.140","192.168.12.35","TLSv1.2","129","Application Data"
"242","3.344724","146.75.37.140","192.168.12.35","TLSv1.2","243","Application Data"
"243","3.344724","146.75.37.140","192.168.12.35","TLSv1.2","830","Application Data"
"244","3.345200","192.168.12.35","146.75.37.140","TCP","54","61013  >  443 [ACK] Seq=8891 Ack=79983 Win=1025 Len=0"
"245","3.345545","192.168.12.35","146.75.37.140","TCP","54","61013  >  443 [ACK] Seq=8891 Ack=80247 Win=1024 Len=0"
"246","3.354332","146.75.37.140","192.168.12.35","TLSv1.2","188","Application Data"
"247","3.354332","146.75.37.140","192.168.12.35","TLSv1.2","97","Application Data"
"248","3.354332","146.75.37.140","192.168.12.35","TLSv1.2","245","Application Data"
"249","3.354874","192.168.12.35","146.75.37.140","TCP","54","61013  >  443 [ACK] Seq=8891 Ack=81157 Win=1020 Len=0"
"250","3.355175","192.168.12.35","146.75.37.140","TCP","54","61013  >  443 [ACK] Seq=8891 Ack=81391 Win=1025 Len=0"
"251","3.384439","146.75.37.140","192.168.12.35","TLSv1.2","107","Application Data"
"252","3.384439","146.75.37.140","192.168.12.35","TLSv1.2","141","Application Data"
"253","3.385017","192.168.12.35","146.75.37.140","TCP","54","61013  >  443 [ACK] Seq=8891 Ack=81531 Win=1024 Len=0"
"254","3.391432","146.75.37.140","192.168.12.35","TLSv1.2","110","Application Data"
"255","3.391432","146.75.37.140","192.168.12.35","TLSv1.2","395","Application Data"
"256","3.391947","192.168.12.35","146.75.37.140","TCP","54","61013  >  443 [ACK] Seq=8891 Ack=81928 Win=1023 Len=0"
"257","3.402093","146.75.37.140","192.168.12.35","TLSv1.2","159","Application Data"
"258","3.402093","146.75.37.140","192.168.12.35","TLSv1.2","452","Application Data"
"259","3.402093","146.75.37.140","192.168.12.35","TLSv1.2","477","Application Data"
"260","3.402093","146.75.37.140","192.168.12.35","TLSv1.2","544","Application Data"
"261","3.402093","146.75.37.140","192.168.12.35","TLSv1.2","207","Application Data"
"262","3.402775","192.168.12.35","146.75.37.140","TCP","54","61013  >  443 [ACK] Seq=8891 Ack=82431 Win=1021 Len=0"
"263","3.403089","192.168.12.35","146.75.37.140","TCP","54","61013  >  443 [ACK] Seq=8891 Ack=83344 Win=1025 Len=0"
"264","3.423347","146.75.37.140","192.168.12.35","TLSv1.2","317","Application Data"
"265","3.423813","192.168.12.35","146.75.37.140","TCP","54","61013  >  443 [ACK] Seq=8891 Ack=83760 Win=1023 Len=0"
"266","3.444489","146.75.37.140","192.168.12.35","TLSv1.2","123","Application Data"
"267","3.444489","146.75.37.140","192.168.12.35","TLSv1.2","122","Application Data"
"268","3.444489","146.75.37.140","192.168.12.35","TLSv1.2","403","Application Data"
"269","3.445116","192.168.12.35","146.75.37.140","TCP","54","61013  >  443 [ACK] Seq=8891 Ack=83897 Win=1023 Len=0"
"270","3.450871","146.75.37.140","192.168.12.35","TLSv1.2","539","Application Data"
"271","3.450871","146.75.37.140","192.168.12.35","TLSv1.2","286","Application Data"
"272","3.450871","146.75.37.140","192.168.12.35","TLSv1.2","253","Application Data"
"273","3.450871","146.75.37.140","192.168.12.35","TLSv1.2","720","Application Data"
"274","3.451423","192.168.12.35","146.75.37.140","TCP","54","61013  >  443 [ACK] Seq=8891 Ack=84731 Win=1019 Len=0"
"275","3.451776","192.168.12.35","146.75.37.140","TCP","54","61013  >  443 [ACK] Seq=8891 Ack=85162 Win=1025 Len=0"
"276","3.456818","146.75.37.140","192.168.12.35","TLSv1.2","530","Application Data"
"277","3.456818","146.75.37.140","192.168.12.35","TLSv1.2","219","Application Data"
"278","3.456818","146.75.37.140","192.168.12.35","TLSv1.2","235","Application Data"
"279","3.456818","146.75.37.140","192.168.12.35","TLSv1.2","250","Application Data"
"280","3.456818","146.75.37.140","192.168.12.35","TLSv1.2","230","Application Data"
"281","3.456818","146.75.37.140","192.168.12.35","TLSv1.2","207","Application Data"
"282","3.456818","146.75.37.140","192.168.12.35","TLSv1.2","207","Application Data"
"283","3.456818","146.75.37.140","192.168.12.35","TLSv1.2","189","Application Data"
"284","3.456818","146.75.37.140","192.168.12.35","TLSv1.2","226","Application Data"
"285","3.456818","146.75.37.140","192.168.12.35","TLSv1.2","266","Application Data"
"286","3.457566","192.168.12.35","146.75.37.140","TCP","54","61013  >  443 [ACK] Seq=8891 Ack=86304 Win=1020 Len=0"
"287","3.457888","192.168.12.35","146.75.37.140","TCP","54","61013  >  443 [ACK] Seq=8891 Ack=86650 Win=1025 Len=0"
"288","3.458180","192.168.12.35","146.75.37.140","TCP","54","61013  >  443 [ACK] Seq=8891 Ack=87022 Win=1023 Len=0"
"289","3.458331","192.168.12.35","146.75.37.140","TCP","54","61013  >  443 [ACK] Seq=8891 Ack=87328 Win=1022 Len=0"
"290","3.458446","192.168.12.35","146.75.37.140","TCP","54","61013  >  443 [ACK] Seq=8891 Ack=87635 Win=1021 Len=0"
"291","3.469424","146.75.37.140","192.168.12.35","TLSv1.2","251","Application Data"
"292","3.469424","146.75.37.140","192.168.12.35","TLSv1.2","195","Application Data"
"293","3.470039","192.168.12.35","146.75.37.140","TCP","54","61013  >  443 [ACK] Seq=8891 Ack=88044 Win=1019 Len=0"
"294","3.475917","146.75.37.140","192.168.12.35","TLSv1.2","210","Application Data"
"295","3.476422","192.168.12.35","146.75.37.140","TCP","54","61013  >  443 [ACK] Seq=8891 Ack=88341 Win=1025 Len=0"
"296","3.491563","146.75.37.140","192.168.12.35","TLSv1.2","207","Application Data"
"297","3.491563","146.75.37.140","192.168.12.35","TLSv1.2","716","Application Data"
"298","3.491563","146.75.37.140","192.168.12.35","TLSv1.2","146","Application Data"
"299","3.491563","146.75.37.140","192.168.12.35","TLSv1.2","231","Application Data"
"300","3.491563","146.75.37.140","192.168.12.35","TLSv1.2","404","Application Data"
"301","3.491563","146.75.37.140","192.168.12.35","TLSv1.2","282","Application Data"
"302","3.491563","146.75.37.140","192.168.12.35","TLSv1.2","93","Application Data"
"303","3.491563","146.75.37.140","192.168.12.35","TLSv1.2","447","Application Data"
"304","3.492353","192.168.12.35","146.75.37.140","TCP","54","61013  >  443 [ACK] Seq=8891 Ack=89156 Win=1022 Len=0"
"305","3.492676","192.168.12.35","146.75.37.140","TCP","54","61013  >  443 [ACK] Seq=8891 Ack=89425 Win=1020 Len=0"
"306","3.492877","192.168.12.35","146.75.37.140","TCP","54","61013  >  443 [ACK] Seq=8891 Ack=90003 Win=1025 Len=0"
"307","3.492978","192.168.12.35","146.75.37.140","TCP","54","61013  >  443 [ACK] Seq=8891 Ack=90435 Win=1023 Len=0"
"308","3.499265","146.75.37.140","192.168.12.35","TLSv1.2","93","Application Data"
"309","3.499265","146.75.37.140","192.168.12.35","TLSv1.2","154","Application Data"
"310","3.499265","146.75.37.140","192.168.12.35","TLSv1.2","93","Application Data"
"311","3.499265","146.75.37.140","192.168.12.35","TLSv1.2","234","Application Data"
"312","3.499265","146.75.37.140","192.168.12.35","TLSv1.2","103","Application Data"
"313","3.499265","146.75.37.140","192.168.12.35","TLSv1.2","491","Application Data"
"314","3.499265","146.75.37.140","192.168.12.35","TLSv1.2","107","Application Data"
"315","3.499265","146.75.37.140","192.168.12.35","TLSv1.2","272","Application Data"
"316","3.499265","146.75.37.140","192.168.12.35","TLSv1.2","414","Application Data"
"317","3.499265","146.75.37.140","192.168.12.35","TLSv1.2","100","Application Data"
"318","3.499265","146.75.37.140","192.168.12.35","TLSv1.2","216","Application Data"
"319","3.499265","146.75.37.140","192.168.12.35","TLSv1.2","139","Application Data"
"320","3.499265","146.75.37.140","192.168.12.35","TLSv1.2","129","Application Data"
"321","3.500219","192.168.12.35","146.75.37.140","TCP","54","61013  >  443 [ACK] Seq=8891 Ack=90574 Win=1022 Len=0"
"322","3.500539","192.168.12.35","146.75.37.140","TCP","54","61013  >  443 [ACK] Seq=8891 Ack=90793 Win=1022 Len=0"
"323","3.500767","192.168.12.35","146.75.37.140","TCP","54","61013  >  443 [ACK] Seq=8891 Ack=91279 Win=1020 Len=0"
"324","3.500899","192.168.12.35","146.75.37.140","TCP","54","61013  >  443 [ACK] Seq=8891 Ack=91550 Win=1025 Len=0"
"325","3.501032","192.168.12.35","146.75.37.140","TCP","54","61013  >  443 [ACK] Seq=8891 Ack=91956 Win=1023 Len=0"
"326","3.501149","192.168.12.35","146.75.37.140","TCP","54","61013  >  443 [ACK] Seq=8891 Ack=92203 Win=1022 Len=0"
"327","3.504280","146.75.37.140","192.168.12.35","TLSv1.2","104","Application Data"
"328","3.504280","146.75.37.140","192.168.12.35","TLSv1.2","117","Application Data"
"329","3.504715","192.168.12.35","146.75.37.140","TCP","54","61013  >  443 [ACK] Seq=8891 Ack=92328 Win=1022 Len=0"
"330","3.513732","146.75.37.140","192.168.12.35","TLSv1.2","125","Application Data"
"331","3.514236","192.168.12.35","146.75.37.140","TCP","54","61013  >  443 [ACK] Seq=8891 Ack=92462 Win=1021 Len=0"
"332","3.525707","146.75.37.140","192.168.12.35","TLSv1.2","104","Application Data"
"333","3.538387","146.75.37.140","192.168.12.35","TLSv1.2","181","Application Data"
"334","3.538913","192.168.12.35","146.75.37.140","TCP","54","61013  >  443 [ACK] Seq=8891 Ack=92639 Win=1020 Len=0"
"335","3.570343","146.75.37.140","192.168.12.35","TLSv1.2","105","Application Data"
"336","3.575269","146.75.37.140","192.168.12.35","TLSv1.2","94","Application Data"
"337","3.575269","146.75.37.140","192.168.12.35","TLSv1.2","519","Application Data"
"338","3.575769","192.168.12.35","146.75.37.140","TCP","54","61013  >  443 [ACK] Seq=8891 Ack=92730 Win=1020 Len=0"
"339","3.580716","146.75.37.140","192.168.12.35","TLSv1.2","656","Application Data"
"340","3.581128","192.168.12.35","146.75.37.140","TCP","54","61013  >  443 [ACK] Seq=8891 Ack=93797 Win=1025 Len=0"
"341","3.590876","146.75.37.140","192.168.12.35","TLSv1.2","702","Application Data"
"342","3.590876","146.75.37.140","192.168.12.35","TLSv1.2","310","Application Data"
"343","3.590876","146.75.37.140","192.168.12.35","TLSv1.2","604","Application Data"
"344","3.590876","146.75.37.140","192.168.12.35","TLSv1.2","322","Application Data"
"345","3.590876","146.75.37.140","192.168.12.35","TLSv1.2","480","Application Data"
"346","3.591524","192.168.12.35","146.75.37.140","TCP","54","61013  >  443 [ACK] Seq=8891 Ack=94701 Win=1021 Len=0"
"347","3.591830","192.168.12.35","146.75.37.140","TCP","54","61013  >  443 [ACK] Seq=8891 Ack=95519 Win=1025 Len=0"
"348","3.596699","146.75.37.140","192.168.12.35","TLSv1.2","1229","Application Data"
"349","3.596699","146.75.37.140","192.168.12.35","TLSv1.2","238","Application Data"
"350","3.596699","146.75.37.140","192.168.12.35","TLSv1.2","169","Application Data"
"351","3.596699","146.75.37.140","192.168.12.35","TLSv1.2","534","Application Data"
"352","3.597201","192.168.12.35","146.75.37.140","TCP","54","61013  >  443 [ACK] Seq=8891 Ack=97120 Win=1025 Len=0"
"353","3.597566","192.168.12.35","146.75.37.140","TCP","54","61013  >  443 [ACK] Seq=8891 Ack=97419 Win=1024 Len=0"
"354","3.651479","192.168.12.35","146.75.37.140","TCP","54","61013  >  443 [ACK] Seq=8891 Ack=97899 Win=1022 Len=0"
"355","3.748597","192.168.12.35","146.75.37.140","TLSv1.2","3190","Application Data"
"356","3.754318","192.168.12.35","146.75.37.140","TLSv1.2","3186","Application Data"
"357","3.754591","192.168.12.35","146.75.37.140","TLSv1.2","718","Application Data"
"358","3.759576","192.168.12.35","146.75.37.140","TLSv1.2","3199","Application Data"
"359","3.788774","146.75.37.140","192.168.12.35","TCP","54","443  >  61013 [ACK] Seq=97899 Ack=10287 Win=8244 Len=0"
"360","3.810407","146.75.37.140","192.168.12.35","TCP","54","443  >  61013 [ACK] Seq=97899 Ack=11683 Win=8244 Len=0"
"361","3.810407","146.75.37.140","192.168.12.35","TCP","54","443  >  61013 [ACK] Seq=97899 Ack=12027 Win=8244 Len=0"
"362","3.834921","146.75.37.140","192.168.12.35","TCP","54","443  >  61013 [ACK] Seq=97899 Ack=13423 Win=8244 Len=0"
"363","3.845202","146.75.37.140","192.168.12.35","TCP","1430","443  >  61013 [ACK] Seq=97899 Ack=13423 Win=8244 Len=1376 [TCP PDU reassembled in 364]"
"364","3.845202","146.75.37.140","192.168.12.35","TLSv1.2","849","Application Data"
"365","3.845705","192.168.12.35","146.75.37.140","TCP","54","61013  >  443 [ACK] Seq=18968 Ack=99275 Win=1025 Len=0"
"366","3.846019","192.168.12.35","146.75.37.140","TCP","54","61013  >  443 [ACK] Seq=18968 Ack=100070 Win=1022 Len=0"
"367","3.848776","146.75.37.140","192.168.12.35","TCP","54","443  >  61013 [ACK] Seq=100070 Ack=14819 Win=8244 Len=0"
"368","3.853944","146.75.37.140","192.168.12.35","TCP","54","443  >  61013 [ACK] Seq=100070 Ack=15159 Win=8244 Len=0"
"369","3.858803","146.75.37.140","192.168.12.35","TCP","54","443  >  61013 [ACK] Seq=100070 Ack=15823 Win=8244 Len=0"
