"No.","Time","Source","Destination","Protocol","Length","Info"
"1","0.000000","146.75.37.140","192.168.12.35","UDP","67","443  >  52870 Len=25"
"2","0.027766","146.75.37.140","192.168.12.35","TCP","54","443  >  60961 [ACK] Seq=1 Ack=1 Win=2545 Len=0"
"3","0.027766","146.75.37.140","192.168.12.35","UDP","69","443  >  52870 Len=27"
"4","0.234414","192.168.12.35","146.75.37.140","UDP","80","52870  >  443 Len=38"
"5","0.284453","146.75.37.140","192.168.12.35","UDP","69","443  >  52870 Len=27"
"6","0.491248","192.168.12.35","146.75.37.140","UDP","80","52870  >  443 Len=38"
"7","0.546282","146.75.37.140","192.168.12.35","UDP","69","443  >  52870 Len=27"
"8","0.749558","192.168.12.35","146.75.37.140","UDP","80","52870  >  443 Len=38"
"9","0.811015","146.75.37.140","192.168.12.35","UDP","69","443  >  52870 Len=27"
"10","1.016239","192.168.12.35","146.75.37.140","UDP","80","52870  >  443 Len=38"
"11","1.064545","146.75.37.140","192.168.12.35","UDP","69","443  >  52870 Len=27"
"12","1.280592","192.168.12.35","146.75.37.140","UDP","80","52870  >  443 Len=38"
"13","1.336549","146.75.37.140","192.168.12.35","UDP","69","443  >  52870 Len=27"
"14","1.547619","192.168.12.35","146.75.37.140","UDP","80","52870  >  443 Len=38"
"15","1.594417","146.75.37.140","192.168.12.35","UDP","69","443  >  52870 Len=27"
"16","1.999106","192.168.12.35","146.75.37.140","UDP","80","52870  >  443 Len=38"
"17","2.056232","146.75.37.140","192.168.12.35","UDP","69","443  >  52870 Len=27"
"18","2.282738","192.168.12.35","146.75.37.140","TLSv1.2","143","Application Data"
"19","2.282931","192.168.12.35","146.75.37.140","TLSv1.2","93","Application Data"
"20","2.314922","146.75.37.140","192.168.12.35","TCP","54","443  >  62685 [ACK] Seq=1 Ack=90 Win=307 Len=0"
"21","2.314922","146.75.37.140","192.168.12.35","TCP","54","443  >  62685 [ACK] Seq=1 Ack=129 Win=307 Len=0"
"22","2.320606","146.75.37.140","192.168.12.35","TLSv1.2","93","Application Data"
"23","2.320606","146.75.37.140","192.168.12.35","TLSv1.2","207","Application Data"
"24","2.320606","146.75.37.140","192.168.12.35","TLSv1.2","1430","Application Data"
"25","2.320606","146.75.37.140","192.168.12.35","TLSv1.2","1430","Application Data"
"26","2.320606","146.75.37.140","192.168.12.35","TLSv1.2","1430","Application Data"
"27","2.320606","146.75.37.140","192.168.12.35","TLSv1.2","1430","Application Data"
"28","2.320844","192.168.12.35","146.75.37.140","TCP","54","62685  >  443 [ACK] Seq=129 Ack=193 Win=512 Len=0"
"29","2.320942","192.168.12.35","146.75.37.140","TCP","54","62685  >  443 [ACK] Seq=129 Ack=5697 Win=512 Len=0"
"30","2.322749","192.168.12.35","146.75.37.140","TLSv1.2","89","Application Data"
"31","2.328798","146.75.37.140","192.168.12.35","TLSv1.2","1430","Application Data"
"32","2.328798","146.75.37.140","192.168.12.35","TLSv1.2","1430","Application Data"
"33","2.328798","146.75.37.140","192.168.12.35","TLSv1.2","1430","Application Data"
"34","2.328798","146.75.37.140","192.168.12.35","TLSv1.2","1430","Application Data"
"35","2.328923","192.168.12.35","146.75.37.140","TCP","54","62685  >  443 [ACK] Seq=164 Ack=11201 Win=512 Len=0"
"36","2.331582","146.75.37.140","192.168.12.35","TLSv1.2","1430","Application Data"
"37","2.331582","146.75.37.140","192.168.12.35","TLSv1.2","1430","Application Data"
"38","2.331582","146.75.37.140","192.168.12.35","TLSv1.2","1430","Application Data"
"39","2.331582","146.75.37.140","192.168.12.35","TLSv1.2","1430","Application Data"
"40","2.331582","146.75.37.140","192.168.12.35","TLSv1.2","1430","Application Data"
"41","2.331582","146.75.37.140","192.168.12.35","TLSv1.2","1430","Application Data"
"42","2.331690","192.168.12.35","146.75.37.140","TCP","54","62685  >  443 [ACK] Seq=164 Ack=19457 Win=512 Len=0"
"43","2.344027","146.75.37.140","192.168.12.35","TLSv1.2","1430","Application Data"
"44","2.344027","146.75.37.140","192.168.12.35","TLSv1.2","1430","Application Data"
"45","2.344027","146.75.37.140","192.168.12.35","TLSv1.2","1430","Application Data"
"46","2.344027","146.75.37.140","192.168.12.35","TLSv1.2","1430","Application Data"
"47","2.344027","146.75.37.140","192.168.12.35","TLSv1.2","1430","Application Data"
"48","2.344027","146.75.37.140","192.168.12.35","TLSv1.2","1430","Application Data"
"49","2.344027","146.75.37.140","192.168.12.35","TLSv1.2","1430","Application Data"
"50","2.344027","146.75.37.140","192.168.12.35","TLSv1.2","1430","Application Data"
"51","2.344027","146.75.37.140","192.168.12.35","TLSv1.2","1430","Application Data"
"52","2.344027","146.75.37.140","192.168.12.35","TLSv1.2","1430","Application Data"
"53","2.344321","192.168.12.35","146.75.37.140","TCP","54","62685  >  443 [ACK] Seq=164 Ack=33217 Win=512 Len=0"
"54","2.349586","146.75.37.140","192.168.12.35","TLSv1.2","1430","Application Data"
"55","2.349586","146.75.37.140","192.168.12.35","TLSv1.2","1430","Application Data"
"56","2.349586","146.75.37.140","192.168.12.35","TLSv1.2","1430","Application Data"
"57","2.349586","146.75.37.140","192.168.12.35","TLSv1.2","1430","Application Data"
"58","2.349586","146.75.37.140","192.168.12.35","TCP","54","443  >  62685 [ACK] Seq=38721 Ack=164 Win=307 Len=0"
"59","2.349703","192.168.12.35","146.75.37.140","TCP","54","62685  >  443 [ACK] Seq=164 Ack=38721 Win=512 Len=0"
"60","2.355696","146.75.37.140","192.168.12.35","TLSv1.2","1430","Application Data"
"61","2.355696","146.75.37.140","192.168.12.35","TLSv1.2","1430","Application Data"
"62","2.355696","146.75.37.140","192.168.12.35","TLSv1.2","1430","Application Data"
"63","2.355696","146.75.37.140","192.168.12.35","TLSv1.2","1430","Application Data"
"64","2.355696","146.75.37.140","192.168.12.35","TLSv1.2","1430","Application Data"
"65","2.355696","146.75.37.140","192.168.12.35","TLSv1.2","1430","Application Data"
"66","2.355696","146.75.37.140","192.168.12.35","TLSv1.2","1430","Application Data"
"67","2.355696","146.75.37.140","192.168.12.35","TLSv1.2","1430","Application Data"
"68","2.355898","192.168.12.35","146.75.37.140","TCP","54","62685  >  443 [ACK] Seq=164 Ack=49729 Win=512 Len=0"
"69","2.361753","146.75.37.140","192.168.12.35","TLSv1.2","1430","Application Data"
"70","2.361753","146.75.37.140","192.168.12.35","TLSv1.2","1430","Application Data"
"71","2.361753","146.75.37.140","192.168.12.35","TLSv1.2","1430","Application Data"
"72","2.361753","146.75.37.140","192.168.12.35","TLSv1.2","1430","Application Data"
"73","2.361753","146.75.37.140","192.168.12.35","TLSv1.2","1430","Application Data"
"74","2.361753","146.75.37.140","192.168.12.35","TLSv1.2","1430","Application Data"
"75","2.361753","146.75.37.140","192.168.12.35","TLSv1.2","1430","Application Data"
"76","2.361753","146.75.37.140","192.168.12.35","TLSv1.2","1430","Application Data"
"77","2.361967","192.168.12.35","146.75.37.140","TCP","54","62685  >  443 [ACK] Seq=164 Ack=60737 Win=512 Len=0"
"78","2.366812","146.75.37.140","192.168.12.35","TLSv1.2","1430","Application Data"
"79","2.366812","146.75.37.140","192.168.12.35","TLSv1.2","1430","Application Data"
"80","2.366812","146.75.37.140","192.168.12.35","TLSv1.2","1430","Application Data"
"81","2.366812","146.75.37.140","192.168.12.35","TLSv1.2","436","Application Data"
"82","2.366812","146.75.37.140","192.168.12.35","TLSv1.2","1430","Application Data"
"83","2.366812","146.75.37.140","192.168.12.35","TLSv1.2","1430","Application Data"
"84","2.366812","146.75.37.140","192.168.12.35","TLSv1.2","1430","Application Data"
"85","2.366812","146.75.37.140","192.168.12.35","TLSv1.2","1430","Application Data"
"86","2.366812","146.75.37.140","192.168.12.35","TLSv1.2","1430","Application Data"
"87","2.366812","146.75.37.140","192.168.12.35","TLSv1.2","1430","Application Data"
"88","2.366812","146.75.37.140","192.168.12.35","TLSv1.2","1430","Application Data"
"89","2.366812","146.75.37.140","192.168.12.35","TLSv1.2","1430","Application Data"
"90","2.367046","192.168.12.35","146.75.37.140","TCP","54","62685  >  443 [ACK] Seq=164 Ack=64865 Win=512 Len=0"
"91","2.367096","192.168.12.35","146.75.37.140","TCP","54","62685  >  443 [ACK] Seq=164 Ack=65247 Win=511 Len=0"
"92","2.367133","192.168.12.35","146.75.37.140","TCP","54","62685  >  443 [ACK] Seq=164 Ack=76255 Win=512 Len=0"
"93","2.375732","146.75.37.140","192.168.12.35","TLSv1.2","1430","Application Data"
"94","2.375732","146.75.37.140","192.168.12.35","TLSv1.2","1430","Application Data"
"95","2.375732","146.75.37.140","192.168.12.35","TLSv1.2","1430","Application Data"
"96","2.375732","146.75.37.140","192.168.12.35","TLSv1.2","1430","Application Data"
"97","2.375732","146.75.37.140","192.168.12.35","TLSv1.2","1430","Application Data"
"98","2.375732","146.75.37.140","192.168.12.35","TLSv1.2","1430","Application Data"
"99","2.375732","146.75.37.140","192.168.12.35","TCP","1430","443  >  62685 [ACK] Seq=84511 Ack=164 Win=307 Len=1376 [TCP PDU reassembled in 111]"
"100","2.375732","146.75.37.140","192.168.12.35","TCP","1430","443  >  62685 [PSH, ACK] Seq=85887 Ack=164 Win=307 Len=1376 [TCP PDU reassembled in 111]"
"101","2.375732","146.75.37.140","192.168.12.35","TCP","1430","443  >  62685 [ACK] Seq=87263 Ack=164 Win=307 Len=1376 [TCP PDU reassembled in 111]"
"102","2.375732","146.75.37.140","192.168.12.35","TCP","1430","443  >  62685 [PSH, ACK] Seq=88639 Ack=164 Win=307 Len=1376 [TCP PDU reassembled in 111]"
"103","2.375732","146.75.37.140","192.168.12.35","TCP","1430","443  >  62685 [ACK] Seq=90015 Ack=164 Win=307 Len=1376 [TCP PDU reassembled in 111]"
"104","2.376051","192.168.12.35","146.75.37.140","TCP","54","62685  >  443 [ACK] Seq=164 Ack=91391 Win=512 Len=0"
"105","2.380988","146.75.37.140","192.168.12.35","TCP","1430","443  >  62685 [PSH, ACK] Seq=91391 Ack=164 Win=307 Len=1376 [TCP PDU reassembled in 111]"
"106","2.380988","146.75.37.140","192.168.12.35","TCP","1430","443  >  62685 [ACK] Seq=92767 Ack=164 Win=307 Len=1376 [TCP PDU reassembled in 111]"
"107","2.380988","146.75.37.140","192.168.12.35","TCP","1430","443  >  62685 [PSH, ACK] Seq=94143 Ack=164 Win=307 Len=1376 [TCP PDU reassembled in 111]"
"108","2.380988","146.75.37.140","192.168.12.35","TCP","1430","443  >  62685 [ACK] Seq=95519 Ack=164 Win=307 Len=1376 [TCP PDU reassembled in 111]"
"109","2.380988","146.75.37.140","192.168.12.35","TCP","1430","443  >  62685 [PSH, ACK] Seq=96895 Ack=164 Win=307 Len=1376 [TCP PDU reassembled in 111]"
"110","2.380988","146.75.37.140","192.168.12.35","TCP","1430","443  >  62685 [ACK] Seq=98271 Ack=164 Win=307 Len=1376 [TCP PDU reassembled in 111]"
"111","2.380988","146.75.37.140","192.168.12.35","TLSv1.2","1430","Application Data"
"112","2.380988","146.75.37.140","192.168.12.35","TCP","1430","443  >  62685 [ACK] Seq=101023 Ack=164 Win=307 Len=1376 [TCP PDU reassembled in 123]"
"113","2.380988","146.75.37.140","192.168.12.35","TCP","1430","443  >  62685 [PSH, ACK] Seq=102399 Ack=164 Win=307 Len=1376 [TCP PDU reassembled in 123]"
"114","2.380988","146.75.37.140","192.168.12.35","TCP","1430","443  >  62685 [ACK] Seq=103775 Ack=164 Win=307 Len=1376 [TCP PDU reassembled in 123]"
"115","2.380988","146.75.37.140","192.168.12.35","TCP","1430","443  >  62685 [PSH, ACK] Seq=105151 Ack=164 Win=307 Len=1376 [TCP PDU reassembled in 123]"
"116","2.380988","146.75.37.140","192.168.12.35","TCP","1430","443  >  62685 [ACK] Seq=106527 Ack=164 Win=307 Len=1376 [TCP PDU reassembled in 123]"
"117","2.380988","146.75.37.140","192.168.12.35","TCP","1430","443  >  62685 [PSH, ACK] Seq=107903 Ack=164 Win=307 Len=1376 [TCP PDU reassembled in 123]"
"118","2.380988","146.75.37.140","192.168.12.35","TCP","1430","443  >  62685 [ACK] Seq=109279 Ack=164 Win=307 Len=1376 [TCP PDU reassembled in 123]"
"119","2.380988","146.75.37.140","192.168.12.35","TCP","1430","443  >  62685 [PSH, ACK] Seq=110655 Ack=164 Win=307 Len=1376 [TCP PDU reassembled in 123]"
"120","2.380988","146.75.37.140","192.168.12.35","TCP","1430","443  >  62685 [ACK] Seq=112031 Ack=164 Win=307 Len=1376 [TCP PDU reassembled in 123]"
"121","2.380988","146.75.37.140","192.168.12.35","TCP","1430","443  >  62685 [PSH, ACK] Seq=113407 Ack=164 Win=307 Len=1376 [TCP PDU reassembled in 123]"
"122","2.380988","146.75.37.140","192.168.12.35","TCP","1430","443  >  62685 [ACK] Seq=114783 Ack=164 Win=307 Len=1376 [TCP PDU reassembled in 123]"
"123","2.380988","146.75.37.140","192.168.12.35","TLSv1.2","1430","Application Data"
"124","2.381256","192.168.12.35","146.75.37.140","TCP","54","62685  >  443 [ACK] Seq=164 Ack=117535 Win=512 Len=0"
"125","2.387599","146.75.37.140","192.168.12.35","TCP","1430","443  >  62685 [ACK] Seq=117535 Ack=164 Win=307 Len=1376 [TCP PDU reassembled in 134]"
"126","2.387599","146.75.37.140","192.168.12.35","TCP","1430","443  >  62685 [PSH, ACK] Seq=118911 Ack=164 Win=307 Len=1376 [TCP PDU reassembled in 134]"
"127","2.387599","146.75.37.140","192.168.12.35","TCP","1430","443  >  62685 [ACK] Seq=120287 Ack=164 Win=307 Len=1376 [TCP PDU reassembled in 134]"
"128","2.387599","146.75.37.140","192.168.12.35","TCP","1430","443  >  62685 [PSH, ACK] Seq=121663 Ack=164 Win=307 Len=1376 [TCP PDU reassembled in 134]"
"129","2.387599","146.75.37.140","192.168.12.35","TCP","1430","443  >  62685 [ACK] Seq=123039 Ack=164 Win=307 Len=1376 [TCP PDU reassembled in 134]"
"130","2.387599","146.75.37.140","192.168.12.35","TCP","1430","443  >  62685 [PSH, ACK] Seq=124415 Ack=164 Win=307 Len=1376 [TCP PDU reassembled in 134]"
"131","2.387599","146.75.37.140","192.168.12.35","TCP","1430","443  >  62685 [ACK] Seq=125791 Ack=164 Win=307 Len=1376 [TCP PDU reassembled in 134]"
"132","2.387599","146.75.37.140","192.168.12.35","TCP","1430","443  >  62685 [PSH, ACK] Seq=127167 Ack=164 Win=307 Len=1376 [TCP PDU reassembled in 134]"
"133","2.387599","146.75.37.140","192.168.12.35","TCP","1430","443  >  62685 [ACK] Seq=128543 Ack=164 Win=307 Len=1376 [TCP PDU reassembled in 134]"
"134","2.387599","146.75.37.140","192.168.12.35","TLSv1.2","1430","Application Data"
"135","2.387599","146.75.37.140","192.168.12.35","TCP","1430","443  >  62685 [ACK] Seq=131295 Ack=164 Win=307 Len=1376 [TCP PDU reassembled in 144]"
"136","2.387599","146.75.37.140","192.168.12.35","TCP","1430","443  >  62685 [PSH, ACK] Seq=132671 Ack=164 Win=307 Len=1376 [TCP PDU reassembled in 144]"
"137","2.387599","146.75.37.140","192.168.12.35","TCP","1430","443  >  62685 [ACK] Seq=134047 Ack=164 Win=307 Len=1376 [TCP PDU reassembled in 144]"
"138","2.387599","146.75.37.140","192.168.12.35","TCP","1430","443  >  62685 [PSH, ACK] Seq=135423 Ack=164 Win=307 Len=1376 [TCP PDU reassembled in 144]"
"139","2.387599","146.75.37.140","192.168.12.35","TCP","1430","443  >  62685 [ACK] Seq=136799 Ack=164 Win=307 Len=1376 [TCP PDU reassembled in 144]"
"140","2.387599","146.75.37.140","192.168.12.35","TCP","1430","443  >  62685 [PSH, ACK] Seq=138175 Ack=164 Win=307 Len=1376 [TCP PDU reassembled in 144]"
"141","2.387987","192.168.12.35","146.75.37.140","TCP","54","62685  >  443 [ACK] Seq=164 Ack=139551 Win=1025 Len=0"
"142","2.393592","146.75.37.140","192.168.12.35","TCP","1430","443  >  62685 [ACK] Seq=139551 Ack=164 Win=307 Len=1376 [TCP PDU reassembled in 144]"
"143","2.393592","146.75.37.140","192.168.12.35","TCP","1430","443  >  62685 [PSH, ACK] Seq=140927 Ack=164 Win=307 Len=1376 [TCP PDU reassembled in 144]"
"144","2.393592","146.75.37.140","192.168.12.35","TLSv1.2","274","Application Data"
"145","2.393695","192.168.12.35","146.75.37.140","TCP","54","62685  >  443 [ACK] Seq=164 Ack=142303 Win=1025 Len=0"
"146","2.435179","192.168.12.35","146.75.37.140","TCP","54","62685  >  443 [ACK] Seq=164 Ack=142523 Win=1024 Len=0"
"147","2.795394","192.168.12.35","146.75.37.140","TLSv1.2","3265","Application Data"
"148","2.801193","192.168.12.35","146.75.37.140","TLSv1.2","3375","Application Data"
"149","2.801265","192.168.12.35","146.75.37.140","TLSv1.2","1603","Application Data"
"150","2.802097","192.168.12.35","146.75.37.140","TLSv1.2","3375","Application Data"
"151","2.802209","192.168.12.35","146.75.37.140","TLSv1.2","3375","Application Data"
"152","2.802253","192.168.12.35","146.75.37.140","TLSv1.2","1593","Application Data"
"153","2.802296","192.168.12.35","146.75.37.140","TLSv1.2","1639","Application Data"
"154","2.839402","146.75.37.140","192.168.12.35","TCP","54","443  >  61013 [ACK] Seq=1 Ack=1397 Win=8244 Len=0"
"155","2.856307","146.75.37.140","192.168.12.35","TCP","54","443  >  61013 [ACK] Seq=1 Ack=2793 Win=8244 Len=0"
"156","2.856307","146.75.37.140","192.168.12.35","TCP","54","443  >  61013 [ACK] Seq=1 Ack=3212 Win=8244 Len=0"
"157","2.859713","192.168.12.35","146.75.37.140","UDP","80","52870  >  443 Len=38"
"158","2.870676","146.75.37.140","192.168.12.35","TCP","54","443  >  61013 [ACK] Seq=1 Ack=4608 Win=8244 Len=0"
"159","2.884162","146.75.37.140","192.168.12.35","TCP","54","443  >  61013 [ACK] Seq=1 Ack=6004 Win=8244 Len=0"
"160","2.889506","146.75.37.140","192.168.12.35","TCP","54","443  >  61013 [ACK] Seq=1 Ack=6533 Win=8244 Len=0"
"161","2.902312","146.75.37.140","192.168.12.35","TLSv1.2","528","Application Data"
"162","2.911045","146.75.37.140","192.168.12.35","TLSv1.2","129","Application Data"
"163","2.911045","146.75.37.140","192.168.12.35","TCP","54","443  >  61013 [ACK] Seq=550 Ack=7929 Win=8244 Len=0"
"164","2.911045","146.75.37.140","192.168.12.35","TCP","54","443  >  61013 [ACK] Seq=550 Ack=8082 Win=8244 Len=0"
"165","2.911045","146.75.37.140","192.168.12.35","TLSv1.2","1105","Application Data"
"166","2.911545","192.168.12.35","146.75.37.140","TCP","54","61013  >  443 [ACK] Seq=17848 Ack=550 Win=1023 Len=0"
"167","2.911688","192.168.12.35","146.75.37.140","TCP","54","61013  >  443 [ACK] Seq=17848 Ack=1601 Win=1025 Len=0"
"168","2.914986","146.75.37.140","192.168.12.35","TLSv1.2","116","Application Data"
"169","2.915212","192.168.12.35","146.75.37.140","TCP","54","61013  >  443 [ACK] Seq=17848 Ack=1663 Win=1024 Len=0"
"170","2.922550","192.168.12.35","146.75.37.140","TLSv1.2","89","Application Data"
"171","2.923264","146.75.37.140","192.168.12.35","TLSv1.2","482","Application Data"
"172","2.939758","146.75.37.140","192.168.12.35","TCP","54","443  >  61013 [ACK] Seq=2091 Ack=11403 Win=8244 Len=0"
"173","2.939758","146.75.37.140","192.168.12.35","TCP","1430","443  >  61013 [ACK] Seq=2091 Ack=11403 Win=8244 Len=1376 [TCP PDU reassembled in 174]"
"174","2.939758","146.75.37.140","192.168.12.35","TLSv1.2","920","Application Data"
"175","2.940007","192.168.12.35","146.75.37.140","TCP","54","61013  >  443 [ACK] Seq=17883 Ack=3467 Win=1025 Len=0"
"176","2.947558","146.75.37.140","192.168.12.35","TCP","54","443  >  61013 [ACK] Seq=4333 Ack=12799 Win=8244 Len=0"
"177","2.953701","146.75.37.140","192.168.12.35","TLSv1.2","222","Application Data"
"178","2.954318","192.168.12.35","146.75.37.140","TCP","54","61013  >  443 [ACK] Seq=17883 Ack=4501 Win=1021 Len=0"
"179","2.959928","146.75.37.140","192.168.12.35","TLSv1.2","295","Application Data"
"180","2.959928","146.75.37.140","192.168.12.35","TLSv1.2","655","Application Data"
"181","2.959928","146.75.37.140","192.168.12.35","TCP","1430","443  >  61013 [ACK] Seq=5343 Ack=12799 Win=8244 Len=1376 [TCP PDU reassembled in 182]"
"182","2.959928","146.75.37.140","192.168.12.35","TLSv1.2","320","Application Data"
"183","2.960304","192.168.12.35","146.75.37.140","TCP","54","61013  >  443 [ACK] Seq=17883 Ack=5343 Win=1025 Len=0"
"184","2.960594","192.168.12.35","146.75.37.140","TCP","54","61013  >  443 [ACK] Seq=17883 Ack=6985 Win=1025 Len=0"
"185","2.965316","146.75.37.140","192.168.12.35","TLSv1.2","770","Application Data"
"186","2.965316","146.75.37.140","192.168.12.35","TCP","54","443  >  61013 [ACK] Seq=7701 Ack=14195 Win=8244 Len=0"
"187","2.965316","146.75.37.140","192.168.12.35","TCP","54","443  >  61013 [ACK] Seq=7701 Ack=14724 Win=8244 Len=0"
"188","2.965316","146.75.37.140","192.168.12.35","TLSv1.2","233","Application Data"
"189","2.965316","146.75.37.140","192.168.12.35","TLSv1.2","1227","Application Data"
"190","2.965316","146.75.37.140","192.168.12.35","TLSv1.2","113","Application Data"
"191","2.965316","146.75.37.140","192.168.12.35","TLSv1.2","138","Application Data"
"192","2.965316","146.75.37.140","192.168.12.35","TLSv1.2","104","Application Data"
"193","2.965316","146.75.37.140","192.168.12.35","TCP","1430","443  >  61013 [ACK] Seq=9246 Ack=14724 Win=8244 Len=1376 [TCP PDU reassembled in 194]"
"194","2.965316","146.75.37.140","192.168.12.35","TLSv1.2","74","Application Data"
"195","2.965316","146.75.37.140","192.168.12.35","TLSv1.2","291","Application Data"
"196","2.965316","146.75.37.140","192.168.12.35","TLSv1.2","472","Application Data"
"197","2.965316","146.75.37.140","192.168.12.35","TLSv1.2","94","Application Data"
"198","2.965316","146.75.37.140","192.168.12.35","TLSv1.2","139","Application Data"
"199","2.965316","146.75.37.140","192.168.12.35","TLSv1.2","408","Application Data"
"200","2.965316","146.75.37.140","192.168.12.35","TLSv1.2","161","Application Data"
"201","2.965316","146.75.37.140","192.168.12.35","TLSv1.2","208","Application Data"
"202","2.965316","146.75.37.140","192.168.12.35","TLSv1.2","94","Application Data"
"203","2.965316","146.75.37.140","192.168.12.35","TLSv1.2","332","Application Data"
"204","2.965316","146.75.37.140","192.168.12.35","TLSv1.2","125","Application Data"
"205","2.965316","146.75.37.140","192.168.12.35","TLSv1.2","107","Application Data"
"206","2.965316","146.75.37.140","192.168.12.35","TLSv1.2","106","Application Data"
"207","2.966403","192.168.12.35","146.75.37.140","TCP","54","61013  >  443 [ACK] Seq=17883 Ack=7880 Win=1021 Len=0"
"208","2.966526","192.168.12.35","146.75.37.140","TCP","54","61013  >  443 [ACK] Seq=17883 Ack=9053 Win=1025 Len=0"
"209","2.966571","192.168.12.35","146.75.37.140","TCP","54","61013  >  443 [ACK] Seq=17883 Ack=9112 Win=1024 Len=0"
"210","2.966618","192.168.12.35","146.75.37.140","TCP","54","61013  >  443 [ACK] Seq=17883 Ack=9246 Win=1024 Len=0"
"211","2.966650","192.168.12.35","146.75.37.140","TCP","54","61013  >  443 [ACK] Seq=17883 Ack=10622 Win=1025 Len=0"
"212","2.966694","192.168.12.35","146.75.37.140","TCP","54","61013  >  443 [ACK] Seq=17883 Ack=10642 Win=1025 Len=0"
"213","2.966755","192.168.12.35","146.75.37.140","TCP","54","61013  >  443 [ACK] Seq=17883 Ack=11297 Win=1022 Len=0"
"214","2.966808","192.168.12.35","146.75.37.140","TCP","54","61013  >  443 [ACK] Seq=17883 Ack=11422 Win=1022 Len=0"
"215","2.966870","192.168.12.35","146.75.37.140","TCP","54","61013  >  443 [ACK] Seq=17883 Ack=11883 Win=1020 Len=0"
"216","2.966911","192.168.12.35","146.75.37.140","TCP","54","61013  >  443 [ACK] Seq=17883 Ack=12037 Win=1025 Len=0"
"217","2.966949","192.168.12.35","146.75.37.140","TCP","54","61013  >  443 [ACK] Seq=17883 Ack=12077 Win=1025 Len=0"
"218","2.966999","192.168.12.35","146.75.37.140","TCP","54","61013  >  443 [ACK] Seq=17883 Ack=12426 Win=1023 Len=0"
"219","2.967173","192.168.12.35","146.75.37.140","TCP","54","61013  >  443 [ACK] Seq=17883 Ack=12531 Win=1023 Len=0"
"220","2.974986","146.75.37.140","192.168.12.35","TCP","54","443  >  61013 [ACK] Seq=12531 Ack=16263 Win=8244 Len=0"
"221","2.979976","146.75.37.140","192.168.12.35","TLSv1.2","144","Application Data"
"222","2.979976","146.75.37.140","192.168.12.35","TLSv1.2","99","Application Data"
"223","2.979976","146.75.37.140","192.168.12.35","TLSv1.2","94","Application Data"
"224","2.979976","146.75.37.140","192.168.12.35","TLSv1.2","129","Application Data"
"225","2.979976","146.75.37.140","192.168.12.35","TLSv1.2","312","Application Data"
"226","2.979976","146.75.37.140","192.168.12.35","TLSv1.2","114","Application Data"
"227","2.979976","146.75.37.140","192.168.12.35","TLSv1.2","164","Application Data"
"228","2.980304","192.168.12.35","146.75.37.140","TCP","54","61013  >  443 [ACK] Seq=17883 Ack=12666 Win=1022 Len=0"
"229","2.980514","192.168.12.35","146.75.37.140","TCP","54","61013  >  443 [ACK] Seq=17883 Ack=12781 Win=1022 Len=0"
"230","2.980568","192.168.12.35","146.75.37.140","TCP","54","61013  >  443 [ACK] Seq=17883 Ack=13099 Win=1021 Len=0"
"231","2.989441","146.75.37.140","192.168.12.35","TLSv1.2","157","Application Data"
"232","2.989441","146.75.37.140","192.168.12.35","TLSv1.2","105","Application Data"
"233","2.989441","146.75.37.140","192.168.12.35","TLSv1.2","264","Application Data"
"234","2.989441","146.75.37.140","192.168.12.35","TLSv1.2","105","Application Data"
"235","2.989441","146.75.37.140","192.168.12.35","TLSv1.2","131","Application Data"
"236","2.989441","146.75.37.140","192.168.12.35","TLSv1.2","104","Application Data"
"237","2.989441","146.75.37.140","192.168.12.35","TLSv1.2","185","Application Data"
"238","2.989441","146.75.37.140","192.168.12.35","TLSv1.2","134","Application Data"
"239","2.989441","146.75.37.140","192.168.12.35","TLSv1.2","158","Application Data"
"240","2.989441","146.75.37.140","192.168.12.35","TLSv1.2","104","Application Data"
"241","2.989441","146.75.37.140","192.168.12.35","TLSv1.2","153","Application Data"
"242","2.989441","146.75.37.140","192.168.12.35","TLSv1.2","130","Application Data"
"243","2.989441","146.75.37.140","192.168.12.35","TLSv1.2","105","Application Data"
"244","2.989441","146.75.37.140","192.168.12.35","TCP","54","443  >  61013 [ACK] Seq=14342 Ack=17848 Win=8244 Len=0"
"245","2.989441","146.75.37.140","192.168.12.35","TCP","54","443  >  61013 [ACK] Seq=14342 Ack=17883 Win=8244 Len=0"
"246","2.989441","146.75.37.140","192.168.12.35","TLSv1.2","138","Application Data"
"247","2.989441","146.75.37.140","192.168.12.35","TLSv1.2","327","Application Data"
"248","2.989441","146.75.37.140","192.168.12.35","TLSv1.2","162","Application Data"
"249","2.989441","146.75.37.140","192.168.12.35","TLSv1.2","105","Application Data"
"250","2.989927","192.168.12.35","146.75.37.140","TCP","54","61013  >  443 [ACK] Seq=17883 Ack=13312 Win=1020 Len=0"
"251","2.989947","192.168.12.35","146.75.37.140","TCP","54","61013  >  443 [ACK] Seq=17883 Ack=13573 Win=1025 Len=0"
"252","2.990034","192.168.12.35","146.75.37.140","TCP","54","61013  >  443 [ACK] Seq=17883 Ack=13701 Win=1024 Len=0"
"253","2.990099","192.168.12.35","146.75.37.140","TCP","54","61013  >  443 [ACK] Seq=17883 Ack=13882 Win=1023 Len=0"
"254","2.990160","192.168.12.35","146.75.37.140","TCP","54","61013  >  443 [ACK] Seq=17883 Ack=14066 Win=1023 Len=0"
"255","2.990196","192.168.12.35","146.75.37.140","TCP","54","61013  >  443 [ACK] Seq=17883 Ack=14215 Win=1022 Len=0"
"256","2.990230","192.168.12.35","146.75.37.140","TCP","54","61013  >  443 [ACK] Seq=17883 Ack=14342 Win=1022 Len=0"
"257","2.990270","192.168.12.35","146.75.37.140","TCP","54","61013  >  443 [ACK] Seq=17883 Ack=14699 Win=1020 Len=0"
"258","2.990306","192.168.12.35","146.75.37.140","TCP","54","61013  >  443 [ACK] Seq=17883 Ack=14858 Win=1020 Len=0"
"259","3.016376","192.168.12.35","146.75.37.140","UDP","80","52870  >  443 Len=38"
"260","3.020111","146.75.37.140","192.168.12.35","TCP","1430","443  >  61013 [ACK] Seq=14858 Ack=17883 Win=8244 Len=1376 [TCP PDU reassembled in 261]"
"261","3.020111","146.75.37.140","192.168.12.35","TLSv1.2","331","Application Data"
"262","3.020111","146.75.37.140","192.168.12.35","TLSv1.2","87","Application Data"
"263","3.020715","192.168.12.35","146.75.37.140","TCP","54","61013  >  443 [ACK] Seq=17883 Ack=16511 Win=1025 Len=0"
"264","3.021544","146.75.37.140","192.168.12.35","TCP","1430","443  >  61013 [ACK] Seq=16544 Ack=17883 Win=8244 Len=1376 [TCP PDU reassembled in 265]"
"265","3.021544","146.75.37.140","192.168.12.35","TLSv1.2","918","Application Data"
"266","3.021819","192.168.12.35","146.75.37.140","TCP","54","61013  >  443 [ACK] Seq=17883 Ack=17920 Win=1025 Len=0"
"267","3.027584","146.75.37.140","192.168.12.35","UDP","69","443  >  52870 Len=27"
"268","3.039186","146.75.37.140","192.168.12.35","UDP","71","443  >  52870 Len=29"
"269","3.062056","192.168.12.35","146.75.37.140","TCP","54","61013  >  443 [ACK] Seq=17883 Ack=18784 Win=1021 Len=0"
"270","3.419836","146.75.37.140","192.168.12.35","TLSv1.2","193","Application Data"
"271","3.419836","146.75.37.140","192.168.12.35","TLSv1.2","1223","Application Data"
"272","3.419836","146.75.37.140","192.168.12.35","TLSv1.2","98","Application Data"
"273","3.420327","192.168.12.35","146.75.37.140","TCP","54","61013  >  443 [ACK] Seq=17883 Ack=20092 Win=1025 Len=0"
"274","3.429733","146.75.37.140","192.168.12.35","TLSv1.2","177","Application Data"
"275","3.429953","192.168.12.35","146.75.37.140","TCP","54","61013  >  443 [ACK] Seq=17883 Ack=20259 Win=1024 Len=0"
"276","3.436533","146.75.37.140","192.168.12.35","TLSv1.2","113","Application Data"
"277","3.436533","146.75.37.140","192.168.12.35","TLSv1.2","178","Application Data"
"278","3.436533","146.75.37.140","192.168.12.35","TLSv1.2","106","Application Data"
"279","3.436533","146.75.37.140","192.168.12.35","TLSv1.2","193","Application Data"
"280","3.436772","192.168.12.35","146.75.37.140","TCP","54","61013  >  443 [ACK] Seq=17883 Ack=20442 Win=1023 Len=0"
"281","3.436855","192.168.12.35","146.75.37.140","TCP","54","61013  >  443 [ACK] Seq=17883 Ack=20633 Win=1023 Len=0"
"282","3.440688","146.75.37.140","192.168.12.35","TLSv1.2","116","Application Data"
"283","3.440688","146.75.37.140","192.168.12.35","TLSv1.2","920","Application Data"
"284","3.440688","146.75.37.140","192.168.12.35","TLSv1.2","370","Application Data"
"285","3.440688","146.75.37.140","192.168.12.35","TLSv1.2","116","Application Data"
"286","3.440688","146.75.37.140","192.168.12.35","TLSv1.2","150","Application Data"
"287","3.440688","146.75.37.140","192.168.12.35","TLSv1.2","223","Application Data"
"288","3.440688","146.75.37.140","192.168.12.35","TLSv1.2","111","Application Data"
"289","3.440688","146.75.37.140","192.168.12.35","TLSv1.2","740","Application Data"
"290","3.440688","146.75.37.140","192.168.12.35","TLSv1.2","461","Application Data"
"291","3.440688","146.75.37.140","192.168.12.35","TLSv1.2","1199","Application Data"
"292","3.440688","146.75.37.140","192.168.12.35","TLSv1.2","213","Application Data"
"293","3.440688","146.75.37.140","192.168.12.35","TLSv1.2","446","Application Data"
"294","3.440688","146.75.37.140","192.168.12.35","TLSv1.2","493","Application Data"
"295","3.440981","192.168.12.35","146.75.37.140","TCP","54","61013  >  443 [ACK] Seq=17883 Ack=21561 Win=1025 Len=0"
"296","3.441046","192.168.12.35","146.75.37.140","TCP","54","61013  >  443 [ACK] Seq=17883 Ack=21939 Win=1023 Len=0"
"297","3.441102","192.168.12.35","146.75.37.140","TCP","54","61013  >  443 [ACK] Seq=17883 Ack=22204 Win=1022 Len=0"
"298","3.441144","192.168.12.35","146.75.37.140","TCP","54","61013  >  443 [ACK] Seq=17883 Ack=22947 Win=1019 Len=0"
"299","3.441189","192.168.12.35","146.75.37.140","TCP","54","61013  >  443 [ACK] Seq=17883 Ack=24499 Win=1025 Len=0"
"300","3.441234","192.168.12.35","146.75.37.140","TCP","54","61013  >  443 [ACK] Seq=17883 Ack=25050 Win=1023 Len=0"
"301","3.461565","146.75.37.140","192.168.12.35","TLSv1.2","134","Application Data"
"302","3.462069","192.168.12.35","146.75.37.140","TCP","54","61013  >  443 [ACK] Seq=17883 Ack=25569 Win=1021 Len=0"
"303","3.471753","146.75.37.140","192.168.12.35","TLSv1.2","415","Application Data"
"304","3.478064","146.75.37.140","192.168.12.35","TLSv1.2","343","Application Data"
"305","3.478680","192.168.12.35","146.75.37.140","TCP","54","61013  >  443 [ACK] Seq=17883 Ack=26219 Win=1025 Len=0"
"306","3.510826","146.75.37.140","192.168.12.35","TLSv1.2","124","Application Data"
"307","3.525671","146.75.37.140","192.168.12.35","TLSv1.2","453","Application Data"
"308","3.526087","192.168.12.35","146.75.37.140","TCP","54","61013  >  443 [ACK] Seq=17883 Ack=26688 Win=1023 Len=0"
"309","3.538006","146.75.37.140","192.168.12.35","TLSv1.2","1006","Application Data"
"310","3.538006","146.75.37.140","192.168.12.35","TLSv1.2","448","Application Data"
"311","3.538746","192.168.12.35","146.75.37.140","TCP","54","61013  >  443 [ACK] Seq=17883 Ack=28034 Win=1025 Len=0"
"312","3.543534","146.75.37.140","192.168.12.35","TLSv1.2","102","Application Data"
"313","3.550811","146.75.37.140","192.168.12.35","TLSv1.2","95","Application Data"
"314","3.550811","146.75.37.140","192.168.12.35","TLSv1.2","915","Application Data"
"315","3.550811","146.75.37.140","192.168.12.35","TLSv1.2","488","Application Data"
"316","3.550811","146.75.37.140","192.168.12.35","TCP","1430","443  >  61013 [ACK] Seq=29418 Ack=17883 Win=8244 Len=1376 [TCP PDU reassembled in 317]"
"317","3.550811","146.75.37.140","192.168.12.35","TLSv1.2","232","Application Data"
"318","3.551022","192.168.12.35","146.75.37.140","TCP","54","61013  >  443 [ACK] Seq=17883 Ack=28123 Win=1024 Len=0"
"319","3.551130","192.168.12.35","146.75.37.140","TCP","54","61013  >  443 [ACK] Seq=17883 Ack=29418 Win=1019 Len=0"
"320","3.551196","192.168.12.35","146.75.37.140","TCP","54","61013  >  443 [ACK] Seq=17883 Ack=30972 Win=1025 Len=0"
"321","3.555680","146.75.37.140","192.168.12.35","TLSv1.2","1038","Application Data"
"322","3.555680","146.75.37.140","192.168.12.35","TLSv1.2","404","Application Data"
"323","3.555680","146.75.37.140","192.168.12.35","TLSv1.2","316","Application Data"
"324","3.555872","192.168.12.35","146.75.37.140","TCP","54","61013  >  443 [ACK] Seq=17883 Ack=32306 Win=1019 Len=0"
"325","3.583006","146.75.37.140","192.168.12.35","TCP","1430","443  >  61013 [ACK] Seq=32568 Ack=17883 Win=8244 Len=1376 [TCP PDU reassembled in 326]"
"326","3.583006","146.75.37.140","192.168.12.35","TLSv1.2","805","Application Data"
"327","3.583006","146.75.37.140","192.168.12.35","TLSv1.2","384","Application Data"
"328","3.583006","146.75.37.140","192.168.12.35","TLSv1.2","253","Application Data"
"329","3.583356","192.168.12.35","146.75.37.140","TCP","54","61013  >  443 [ACK] Seq=17883 Ack=33944 Win=1025 Len=0"
"330","3.583551","192.168.12.35","146.75.37.140","TCP","54","61013  >  443 [ACK] Seq=17883 Ack=35025 Win=1020 Len=0"
"331","3.590731","146.75.37.140","192.168.12.35","TLSv1.2","888","Application Data"
"332","3.590731","146.75.37.140","192.168.12.35","TLSv1.2","108","Application Data"
"333","3.591317","192.168.12.35","146.75.37.140","TCP","54","61013  >  443 [ACK] Seq=17883 Ack=36058 Win=1025 Len=0"
"334","3.597612","146.75.37.140","192.168.12.35","TLSv1.2","140","Application Data"
"335","3.597612","146.75.37.140","192.168.12.35","TLSv1.2","162","Application Data"
"336","3.597612","146.75.37.140","192.168.12.35","TCP","1430","443  >  61013 [ACK] Seq=36306 Ack=17883 Win=8244 Len=1376 [TCP PDU reassembled in 337]"
"337","3.597612","146.75.37.140","192.168.12.35","TLSv1.2","696","Application Data"
"338","3.597612","146.75.37.140","192.168.12.35","TCP","1430","443  >  61013 [ACK] Seq=38324 Ack=17883 Win=8244 Len=1376 [TCP PDU reassembled in 342]"
"339","3.597921","192.168.12.35","146.75.37.140","TCP","54","61013  >  443 [ACK] Seq=17883 Ack=36198 Win=1024 Len=0"
"340","3.598078","192.168.12.35","146.75.37.140","TCP","54","61013  >  443 [ACK] Seq=17883 Ack=37682 Win=1025 Len=0"
"341","3.598149","192.168.12.35","146.75.37.140","TCP","54","61013  >  443 [ACK] Seq=17883 Ack=39700 Win=1025 Len=0"
"342","3.604378","146.75.37.140","192.168.12.35","TLSv1.2","1241","Application Data"
"343","3.604378","146.75.37.140","192.168.12.35","TLSv1.2","756","Application Data"
"344","3.604378","146.75.37.140","192.168.12.35","TLSv1.2","369","Application Data"
"345","3.604378","146.75.37.140","192.168.12.35","TLSv1.2","708","Application Data"
"346","3.604790","192.168.12.35","146.75.37.140","TCP","54","61013  >  443 [ACK] Seq=17883 Ack=41589 Win=1025 Len=0"
"347","3.604992","192.168.12.35","146.75.37.140","TCP","54","61013  >  443 [ACK] Seq=17883 Ack=42558 Win=1021 Len=0"
"348","3.609481","146.75.37.140","192.168.12.35","TLSv1.2","568","Application Data"
"349","3.618006","146.75.37.140","192.168.12.35","TLSv1.2","1063","Application Data"
"350","3.618624","192.168.12.35","146.75.37.140","TCP","54","61013  >  443 [ACK] Seq=17883 Ack=44081 Win=1025 Len=0"
"351","3.626984","146.75.37.140","192.168.12.35","TLSv1.2","168","Application Data"
"352","3.626984","146.75.37.140","192.168.12.35","TLSv1.2","951","Application Data"
"353","3.627375","192.168.12.35","146.75.37.140","TCP","54","61013  >  443 [ACK] Seq=17883 Ack=45092 Win=1021 Len=0"
"354","3.644894","146.75.37.140","192.168.12.35","TLSv1.2","145","Application Data"
"355","3.644894","146.75.37.140","192.168.12.35","TLSv1.2","969","Application Data"
"356","3.645448","192.168.12.35","146.75.37.140","TCP","54","61013  >  443 [ACK] Seq=17883 Ack=46098 Win=1025 Len=0"
"357","3.657212","146.75.37.140","192.168.12.35","TLSv1.2","521","Application Data"
"358","3.657212","146.75.37.140","192.168.12.35","TLSv1.2","128","Application Data"
"359","3.657212","146.75.37.140","192.168.12.35","TLSv1.2","209","Application Data"
"360","3.657212","146.75.37.140","192.168.12.35","TLSv1.2","133","Application Data"
"361","3.657212","146.75.37.140","192.168.12.35","TLSv1.2","128","Application Data"
"362","3.657212","146.75.37.140","192.168.12.35","TLSv1.2","104","Application Data"
"363","3.657212","146.75.37.140","192.168.12.35","TLSv1.2","273","Application Data"
"364","3.657212","146.75.37.140","192.168.12.35","TLSv1.2","105","Application Data"
"365","3.657212","146.75.37.140","192.168.12.35","TLSv1.2","542","Application Data"
"366","3.657212","146.75.37.140","192.168.12.35","TLSv1.2","656","Application Data"
"367","3.657212","146.75.37.140","192.168.12.35","TLSv1.2","702","Application Data"
"368","3.658017","192.168.12.35","146.75.37.140","TCP","54","61013  >  443 [ACK] Seq=17883 Ack=46639 Win=1023 Len=0"
"369","3.658352","192.168.12.35","146.75.37.140","TCP","54","61013  >  443 [ACK] Seq=17883 Ack=46873 Win=1022 Len=0"
"370","3.658448","192.168.12.35","146.75.37.140","TCP","54","61013  >  443 [ACK] Seq=17883 Ack=46997 Win=1021 Len=0"
"371","3.658531","192.168.12.35","146.75.37.140","TCP","54","61013  >  443 [ACK] Seq=17883 Ack=47267 Win=1020 Len=0"
"372","3.658637","192.168.12.35","146.75.37.140","TCP","54","61013  >  443 [ACK] Seq=17883 Ack=48357 Win=1025 Len=0"
"373","3.669783","146.75.37.140","192.168.12.35","TLSv1.2","317","Application Data"
"374","3.670589","192.168.12.35","146.75.37.140","TCP","54","61013  >  443 [ACK] Seq=17883 Ack=49268 Win=1021 Len=0"
"375","3.674321","146.75.37.140","192.168.12.35","TLSv1.2","603","Application Data"
"376","3.679227","146.75.37.140","192.168.12.35","TLSv1.2","319","Application Data"
"377","3.679227","146.75.37.140","192.168.12.35","TLSv1.2","480","Application Data"
"378","3.679227","146.75.37.140","192.168.12.35","TLSv1.2","393","Application Data"
"379","3.679469","192.168.12.35","146.75.37.140","TCP","54","61013  >  443 [ACK] Seq=17883 Ack=50082 Win=1025 Len=0"
"380","3.679706","192.168.12.35","146.75.37.140","TCP","54","61013  >  443 [ACK] Seq=17883 Ack=50847 Win=1022 Len=0"
"381","3.684332","146.75.37.140","192.168.12.35","TLSv1.2","596","Application Data"
"382","3.684332","146.75.37.140","192.168.12.35","TLSv1.2","332","Application Data"
"383","3.684332","146.75.37.140","192.168.12.35","TLSv1.2","128","Application Data"
"384","3.684639","192.168.12.35","146.75.37.140","TCP","54","61013  >  443 [ACK] Seq=17883 Ack=51667 Win=1025 Len=0"
"385","3.690366","146.75.37.140","192.168.12.35","TLSv1.2","104","Application Data"
"386","3.690366","146.75.37.140","192.168.12.35","TLSv1.2","93","Application Data"
"387","3.690366","146.75.37.140","192.168.12.35","TLSv1.2","97","Application Data"
"388","3.690366","146.75.37.140","192.168.12.35","TLSv1.2","230","Application Data"
"389","3.690873","192.168.12.35","146.75.37.140","TCP","54","61013  >  443 [ACK] Seq=17883 Ack=51791 Win=1024 Len=0"
"390","3.691140","192.168.12.35","146.75.37.140","TCP","54","61013  >  443 [ACK] Seq=17883 Ack=51873 Win=1024 Len=0"
"391","3.695588","146.75.37.140","192.168.12.35","TLSv1.2","472","Application Data"
"392","3.695588","146.75.37.140","192.168.12.35","TLSv1.2","239","Application Data"
"393","3.695588","146.75.37.140","192.168.12.35","TLSv1.2","111","Application Data"
"394","3.695958","192.168.12.35","146.75.37.140","TCP","54","61013  >  443 [ACK] Seq=17883 Ack=52467 Win=1022 Len=0"
"395","3.696057","192.168.12.35","146.75.37.140","TCP","54","61013  >  443 [ACK] Seq=17883 Ack=52709 Win=1021 Len=0"
