"No.","Time","Source","Destination","Protocol","Length","Info"
"1","0.000000","146.75.37.140","192.168.12.35","UDP","67","443  >  50355 Len=25"
"2","0.000451","192.168.12.35","146.75.37.140","UDP","80","50355  >  443 Len=38"
"3","0.034738","146.75.37.140","192.168.12.35","UDP","69","443  >  50355 Len=27"
"4","1.521175","192.168.12.35","146.75.37.140","TLSv1.2","3239","Application Data"
"5","1.521253","192.168.12.35","146.75.37.140","TLSv1.2","93","Application Data"
"6","1.521272","192.168.12.35","146.75.37.140","TLSv1.2","3359","Application Data"
"7","1.521298","192.168.12.35","146.75.37.140","TLSv1.2","2203","Application Data"
"8","1.569431","146.75.37.140","192.168.12.35","TCP","54","443  >  61013 [ACK] Seq=1 Ack=1397 Win=8244 Len=0"
"9","1.569431","146.75.37.140","192.168.12.35","TCP","54","443  >  61013 [ACK] Seq=1 Ack=2793 Win=8244 Len=0"
"10","1.592430","146.75.37.140","192.168.12.35","TCP","54","443  >  61013 [ACK] Seq=1 Ack=3186 Win=8244 Len=0"
"11","1.592430","146.75.37.140","192.168.12.35","TCP","54","443  >  61013 [ACK] Seq=1 Ack=3225 Win=8244 Len=0"
"12","1.592430","146.75.37.140","192.168.12.35","TLSv1.2","93","Application Data"
"13","1.602022","146.75.37.140","192.168.12.35","TCP","54","443  >  61013 [ACK] Seq=40 Ack=4621 Win=8244 Len=0"
"14","1.612548","146.75.37.140","192.168.12.35","TCP","54","443  >  61013 [ACK] Seq=40 Ack=6017 Win=8244 Len=0"
"15","1.617567","146.75.37.140","192.168.12.35","TCP","54","443  >  61013 [ACK] Seq=40 Ack=6530 Win=8244 Len=0"
"16","1.634648","192.168.12.35","146.75.37.140","TCP","54","61013  >  443 [ACK] Seq=8679 Ack=40 Win=1023 Len=0"
"17","1.635270","146.75.37.140","192.168.12.35","TCP","54","443  >  61013 [ACK] Seq=40 Ack=7926 Win=8244 Len=0"
"18","1.636916","146.75.37.140","192.168.12.35","TCP","54","443  >  61013 [ACK] Seq=40 Ack=8679 Win=8244 Len=0"
"19","1.651026","192.168.12.35","146.75.37.140","UDP","80","50355  >  443 Len=38"
"20","1.659826","146.75.37.140","192.168.12.35","TCP","1430","443  >  61013 [ACK] Seq=40 Ack=8679 Win=8244 Len=1376 [TCP PDU reassembled in 21]"
"21","1.659826","146.75.37.140","192.168.12.35","TLSv1.2","930","Application Data"
"22","1.659826","146.75.37.140","192.168.12.35","TCP","1430","443  >  61013 [ACK] Seq=2292 Ack=8679 Win=8244 Len=1376 [TCP PDU reassembled in 23]"
"23","1.659826","146.75.37.140","192.168.12.35","TLSv1.2","1071","Application Data"
"24","1.659826","146.75.37.140","192.168.12.35","TCP","1430","443  >  61013 [ACK] Seq=4685 Ack=8679 Win=8244 Len=1376 [TCP PDU reassembled in 25]"
"25","1.659826","146.75.37.140","192.168.12.35","TLSv1.2","484","Application Data"
"26","1.660622","192.168.12.35","146.75.37.140","TCP","54","61013  >  443 [ACK] Seq=8679 Ack=2292 Win=1025 Len=0"
"27","1.660817","192.168.12.35","146.75.37.140","TCP","54","61013  >  443 [ACK] Seq=8679 Ack=4685 Win=1025 Len=0"
"28","1.660897","192.168.12.35","146.75.37.140","TCP","54","61013  >  443 [ACK] Seq=8679 Ack=6491 Win=1025 Len=0"
"29","1.665007","192.168.12.35","146.75.37.140","TLSv1.2","89","Application Data"
"30","1.668994","146.75.37.140","192.168.12.35","TCP","1430","443  >  61013 [ACK] Seq=6491 Ack=8679 Win=8244 Len=1376 [TCP PDU reassembled in 41]"
"31","1.668994","146.75.37.140","192.168.12.35","TCP","1430","443  >  61013 [PSH, ACK] Seq=7867 Ack=8679 Win=8244 Len=1376 [TCP PDU reassembled in 41]"
"32","1.668994","146.75.37.140","192.168.12.35","TCP","1430","443  >  61013 [ACK] Seq=9243 Ack=8679 Win=8244 Len=1376 [TCP PDU reassembled in 41]"
"33","1.668994","146.75.37.140","192.168.12.35","TCP","1430","443  >  61013 [PSH, ACK] Seq=10619 Ack=8679 Win=8244 Len=1376 [TCP PDU reassembled in 41]"
"34","1.668994","146.75.37.140","192.168.12.35","TCP","1430","443  >  61013 [ACK] Seq=11995 Ack=8679 Win=8244 Len=1376 [TCP PDU reassembled in 41]"
"35","1.668994","146.75.37.140","192.168.12.35","TCP","1430","443  >  61013 [PSH, ACK] Seq=13371 Ack=8679 Win=8244 Len=1376 [TCP PDU reassembled in 41]"
"36","1.669333","192.168.12.35","146.75.37.140","TCP","54","61013  >  443 [ACK] Seq=8714 Ack=14747 Win=1025 Len=0"
"37","1.675110","146.75.37.140","192.168.12.35","TCP","1430","443  >  61013 [ACK] Seq=14747 Ack=8679 Win=8244 Len=1376 [TCP PDU reassembled in 41]"
"38","1.675110","146.75.37.140","192.168.12.35","TCP","1430","443  >  61013 [PSH, ACK] Seq=16123 Ack=8679 Win=8244 Len=1376 [TCP PDU reassembled in 41]"
"39","1.675110","146.75.37.140","192.168.12.35","TCP","1430","443  >  61013 [ACK] Seq=17499 Ack=8679 Win=8244 Len=1376 [TCP PDU reassembled in 41]"
"40","1.675110","146.75.37.140","192.168.12.35","TCP","1430","443  >  61013 [PSH, ACK] Seq=18875 Ack=8679 Win=8244 Len=1376 [TCP PDU reassembled in 41]"
"41","1.675110","146.75.37.140","192.168.12.35","TLSv1.2","347","Application Data"
"42","1.675972","192.168.12.35","146.75.37.140","TCP","54","61013  >  443 [ACK] Seq=8714 Ack=20251 Win=1025 Len=0"
"43","1.692415","146.75.37.140","192.168.12.35","TLSv1.2","866","Application Data"
"44","1.692415","146.75.37.140","192.168.12.35","TLSv1.2","90","Application Data"
"45","1.693156","192.168.12.35","146.75.37.140","TCP","54","61013  >  443 [ACK] Seq=8714 Ack=21356 Win=1020 Len=0"
"46","1.703066","146.75.37.140","192.168.12.35","TCP","1430","443  >  61013 [ACK] Seq=21392 Ack=8679 Win=8244 Len=1376 [TCP PDU reassembled in 61]"
"47","1.703066","146.75.37.140","192.168.12.35","TCP","1430","443  >  61013 [PSH, ACK] Seq=22768 Ack=8679 Win=8244 Len=1376 [TCP PDU reassembled in 61]"
"48","1.703066","146.75.37.140","192.168.12.35","TCP","1430","443  >  61013 [ACK] Seq=24144 Ack=8679 Win=8244 Len=1376 [TCP PDU reassembled in 61]"
"49","1.703066","146.75.37.140","192.168.12.35","UDP","69","443  >  50355 Len=27"
"50","1.703066","146.75.37.140","192.168.12.35","TCP","1430","443  >  61013 [PSH, ACK] Seq=25520 Ack=8679 Win=8244 Len=1376 [TCP PDU reassembled in 61]"
"51","1.703066","146.75.37.140","192.168.12.35","TCP","1430","443  >  61013 [ACK] Seq=26896 Ack=8679 Win=8244 Len=1376 [TCP PDU reassembled in 61]"
"52","1.703066","146.75.37.140","192.168.12.35","TCP","1430","443  >  61013 [PSH, ACK] Seq=28272 Ack=8679 Win=8244 Len=1376 [TCP PDU reassembled in 61]"
"53","1.703066","146.75.37.140","192.168.12.35","TCP","1430","443  >  61013 [ACK] Seq=29648 Ack=8679 Win=8244 Len=1376 [TCP PDU reassembled in 61]"
"54","1.703066","146.75.37.140","192.168.12.35","TCP","1430","443  >  61013 [PSH, ACK] Seq=31024 Ack=8679 Win=8244 Len=1376 [TCP PDU reassembled in 61]"
"55","1.703665","192.168.12.35","146.75.37.140","TCP","54","61013  >  443 [ACK] Seq=8714 Ack=25520 Win=1025 Len=0"
"56","1.703933","192.168.12.35","146.75.37.140","TCP","54","61013  >  443 [ACK] Seq=8714 Ack=32400 Win=1025 Len=0"
"57","1.707301","192.168.12.35","146.75.37.140","UDP","96","50355  >  443 Len=54"
"58","1.708031","146.75.37.140","192.168.12.35","TCP","1430","443  >  61013 [ACK] Seq=32400 Ack=8679 Win=8244 Len=1376 [TCP PDU reassembled in 61]"
"59","1.708031","146.75.37.140","192.168.12.35","TCP","1430","443  >  61013 [PSH, ACK] Seq=33776 Ack=8679 Win=8244 Len=1376 [TCP PDU reassembled in 61]"
"60","1.708031","146.75.37.140","192.168.12.35","TCP","1430","443  >  61013 [ACK] Seq=35152 Ack=8679 Win=8244 Len=1376 [TCP PDU reassembled in 61]"
"61","1.708031","146.75.37.140","192.168.12.35","TLSv1.2","547","Application Data"
"62","1.708031","146.75.37.140","192.168.12.35","TCP","54","443  >  61013 [ACK] Seq=37021 Ack=8714 Win=8244 Len=0"
"63","1.708031","146.75.37.140","192.168.12.35","TCP","1430","443  >  61013 [ACK] Seq=37021 Ack=8714 Win=8244 Len=1376 [TCP PDU reassembled in 76]"
"64","1.708031","146.75.37.140","192.168.12.35","TCP","1430","443  >  61013 [PSH, ACK] Seq=38397 Ack=8714 Win=8244 Len=1376 [TCP PDU reassembled in 76]"
"65","1.708031","146.75.37.140","192.168.12.35","TCP","1430","443  >  61013 [ACK] Seq=39773 Ack=8714 Win=8244 Len=1376 [TCP PDU reassembled in 76]"
"66","1.708031","146.75.37.140","192.168.12.35","TCP","1430","443  >  61013 [PSH, ACK] Seq=41149 Ack=8714 Win=8244 Len=1376 [TCP PDU reassembled in 76]"
"67","1.708031","146.75.37.140","192.168.12.35","TCP","1430","443  >  61013 [ACK] Seq=42525 Ack=8714 Win=8244 Len=1376 [TCP PDU reassembled in 76]"
"68","1.708031","146.75.37.140","192.168.12.35","TCP","1430","443  >  61013 [PSH, ACK] Seq=43901 Ack=8714 Win=8244 Len=1376 [TCP PDU reassembled in 76]"
"69","1.708461","192.168.12.35","146.75.37.140","TCP","54","61013  >  443 [ACK] Seq=8714 Ack=36528 Win=1025 Len=0"
"70","1.708638","192.168.12.35","146.75.37.140","TCP","54","61013  >  443 [ACK] Seq=8714 Ack=45277 Win=1025 Len=0"
"71","1.714900","146.75.37.140","192.168.12.35","TCP","1430","443  >  61013 [ACK] Seq=45277 Ack=8714 Win=8244 Len=1376 [TCP PDU reassembled in 76]"
"72","1.714900","146.75.37.140","192.168.12.35","TCP","1430","443  >  61013 [PSH, ACK] Seq=46653 Ack=8714 Win=8244 Len=1376 [TCP PDU reassembled in 76]"
"73","1.714900","146.75.37.140","192.168.12.35","TCP","1430","443  >  61013 [ACK] Seq=48029 Ack=8714 Win=8244 Len=1376 [TCP PDU reassembled in 76]"
"74","1.714900","146.75.37.140","192.168.12.35","TCP","1430","443  >  61013 [PSH, ACK] Seq=49405 Ack=8714 Win=8244 Len=1376 [TCP PDU reassembled in 76]"
"75","1.714900","146.75.37.140","192.168.12.35","TCP","1430","443  >  61013 [ACK] Seq=50781 Ack=8714 Win=8244 Len=1376 [TCP PDU reassembled in 76]"
"76","1.714900","146.75.37.140","192.168.12.35","TLSv1.2","1355","Application Data, Application Data"
"77","1.715462","192.168.12.35","146.75.37.140","TCP","54","61013  >  443 [ACK] Seq=8714 Ack=49405 Win=1025 Len=0"
"78","1.715673","192.168.12.35","146.75.37.140","TCP","54","61013  >  443 [ACK] Seq=8714 Ack=52157 Win=1025 Len=0"
"79","1.729262","146.75.37.140","192.168.12.35","TCP","1430","443  >  61013 [ACK] Seq=53458 Ack=8714 Win=8244 Len=1376 [TCP PDU reassembled in 80]"
"80","1.729262","146.75.37.140","192.168.12.35","TLSv1.2","1002","Application Data"
"81","1.729947","192.168.12.35","146.75.37.140","TCP","54","61013  >  443 [ACK] Seq=8714 Ack=54834 Win=1025 Len=0"
"82","1.734867","146.75.37.140","192.168.12.35","TLSv1.2","1050","Application Data"
"83","1.735520","192.168.12.35","146.75.37.140","TCP","54","61013  >  443 [ACK] Seq=8714 Ack=56778 Win=1025 Len=0"
"84","1.742955","146.75.37.140","192.168.12.35","TLSv1.2","1181","Application Data"
"85","1.742955","146.75.37.140","192.168.12.35","TLSv1.2","1068","Application Data"
"86","1.743897","192.168.12.35","146.75.37.140","TCP","54","61013  >  443 [ACK] Seq=8714 Ack=58919 Win=1025 Len=0"
"87","1.746072","146.75.37.140","192.168.12.35","TLSv1.2","1191","Application Data"
"88","1.746072","146.75.37.140","192.168.12.35","TLSv1.2","603","Application Data"
"89","1.746072","146.75.37.140","192.168.12.35","TLSv1.2","1100","Application Data"
"90","1.746072","146.75.37.140","192.168.12.35","TLSv1.2","232","Application Data"
"91","1.746072","146.75.37.140","192.168.12.35","TLSv1.2","582","Application Data"
"92","1.746072","146.75.37.140","192.168.12.35","UDP","67","443  >  50355 Len=25"
"93","1.746072","146.75.37.140","192.168.12.35","TCP","1430","443  >  61013 [ACK] Seq=62357 Ack=8714 Win=8244 Len=1376 [TCP PDU reassembled in 94]"
"94","1.746072","146.75.37.140","192.168.12.35","TLSv1.2","310","Application Data"
"95","1.746072","146.75.37.140","192.168.12.35","TLSv1.2","781","Application Data"
"96","1.746072","146.75.37.140","192.168.12.35","TLSv1.2","213","Application Data"
"97","1.746072","146.75.37.140","192.168.12.35","TLSv1.2","509","Application Data"
"98","1.746072","146.75.37.140","192.168.12.35","TLSv1.2","95","Application Data"
"99","1.746072","146.75.37.140","192.168.12.35","TLSv1.2","113","Application Data"
"100","1.746072","146.75.37.140","192.168.12.35","TLSv1.2","115","Application Data"
"101","1.746072","146.75.37.140","192.168.12.35","TLSv1.2","107","Application Data"
"102","1.746609","192.168.12.35","146.75.37.140","TCP","54","61013  >  443 [ACK] Seq=8714 Ack=60605 Win=1025 Len=0"
"103","1.746714","192.168.12.35","146.75.37.140","TCP","54","61013  >  443 [ACK] Seq=8714 Ack=61829 Win=1020 Len=0"
"104","1.746817","192.168.12.35","146.75.37.140","TCP","54","61013  >  443 [ACK] Seq=8714 Ack=63733 Win=1025 Len=0"
"105","1.746855","192.168.12.35","146.75.37.140","TCP","54","61013  >  443 [ACK] Seq=8714 Ack=64716 Win=1021 Len=0"
"106","1.746917","192.168.12.35","146.75.37.140","TCP","54","61013  >  443 [ACK] Seq=8714 Ack=65330 Win=1025 Len=0"
"107","1.747049","192.168.12.35","146.75.37.140","TCP","54","61013  >  443 [ACK] Seq=8714 Ack=65430 Win=1024 Len=0"
"108","1.747096","192.168.12.35","146.75.37.140","TCP","54","61013  >  443 [ACK] Seq=8714 Ack=65544 Win=1024 Len=0"
"109","1.752207","146.75.37.140","192.168.12.35","TLSv1.2","1365","Application Data"
"110","1.752207","146.75.37.140","192.168.12.35","TLSv1.2","93","Application Data"
"111","1.752207","146.75.37.140","192.168.12.35","TLSv1.2","101","Application Data"
"112","1.752207","146.75.37.140","192.168.12.35","TLSv1.2","698","Application Data"
"113","1.752207","146.75.37.140","192.168.12.35","TLSv1.2","399","Application Data"
"114","1.752207","146.75.37.140","192.168.12.35","TLSv1.2","129","Application Data"
"115","1.752207","146.75.37.140","192.168.12.35","TLSv1.2","199","Application Data"
"116","1.752207","146.75.37.140","192.168.12.35","TLSv1.2","342","Application Data"
"117","1.752207","146.75.37.140","192.168.12.35","TLSv1.2","231","Application Data"
"118","1.752207","146.75.37.140","192.168.12.35","TLSv1.2","575","Application Data"
"119","1.752207","146.75.37.140","192.168.12.35","TLSv1.2","678","Application Data"
"120","1.753094","192.168.12.35","146.75.37.140","TCP","54","61013  >  443 [ACK] Seq=8714 Ack=66894 Win=1025 Len=0"
"121","1.753296","192.168.12.35","146.75.37.140","TCP","54","61013  >  443 [ACK] Seq=8714 Ack=67585 Win=1022 Len=0"
"122","1.753354","192.168.12.35","146.75.37.140","TCP","54","61013  >  443 [ACK] Seq=8714 Ack=68005 Win=1020 Len=0"
"123","1.753396","192.168.12.35","146.75.37.140","TCP","54","61013  >  443 [ACK] Seq=8714 Ack=68438 Win=1025 Len=0"
"124","1.753473","192.168.12.35","146.75.37.140","TCP","54","61013  >  443 [ACK] Seq=8714 Ack=69136 Win=1022 Len=0"
"125","1.753627","192.168.12.35","146.75.37.140","UDP","84","50355  >  443 Len=42"
"126","1.767654","146.75.37.140","192.168.12.35","UDP","69","443  >  50355 Len=27"
"127","1.805836","192.168.12.35","146.75.37.140","TCP","54","61013  >  443 [ACK] Seq=8714 Ack=69760 Win=1020 Len=0"
"128","2.233528","146.75.37.140","192.168.12.35","TLSv1.2","564","Application Data"
"129","2.233528","146.75.37.140","192.168.12.35","TLSv1.2","133","Application Data"
"130","2.233528","146.75.37.140","192.168.12.35","TLSv1.2","399","Application Data"
"131","2.234513","192.168.12.35","146.75.37.140","TCP","54","61013  >  443 [ACK] Seq=8714 Ack=70349 Win=1025 Len=0"
"132","2.238325","146.75.37.140","192.168.12.35","TLSv1.2","402","Application Data"
"133","2.238325","146.75.37.140","192.168.12.35","TLSv1.2","227","Application Data"
"134","2.238325","146.75.37.140","192.168.12.35","TLSv1.2","738","Application Data"
"135","2.238325","146.75.37.140","192.168.12.35","TLSv1.2","149","Application Data"
"136","2.238325","146.75.37.140","192.168.12.35","TLSv1.2","212","Application Data"
"137","2.238325","146.75.37.140","192.168.12.35","TLSv1.2","96","Application Data"
"138","2.238325","146.75.37.140","192.168.12.35","TLSv1.2","405","Application Data"
"139","2.238870","192.168.12.35","146.75.37.140","TCP","54","61013  >  443 [ACK] Seq=8714 Ack=71042 Win=1022 Len=0"
"140","2.239099","192.168.12.35","146.75.37.140","TCP","54","61013  >  443 [ACK] Seq=8714 Ack=71899 Win=1025 Len=0"
"141","2.239145","192.168.12.35","146.75.37.140","TCP","54","61013  >  443 [ACK] Seq=8714 Ack=72152 Win=1024 Len=0"
"142","2.239198","192.168.12.35","146.75.37.140","TCP","54","61013  >  443 [ACK] Seq=8714 Ack=72545 Win=1022 Len=0"
"143","2.248671","146.75.37.140","192.168.12.35","TLSv1.2","107","Application Data"
"144","2.248671","146.75.37.140","192.168.12.35","TLSv1.2","185","Application Data"
"145","2.248671","146.75.37.140","192.168.12.35","TCP","1430","443  >  61013 [ACK] Seq=72729 Ack=8714 Win=8244 Len=1376 [TCP PDU reassembled in 146]"
"146","2.248671","146.75.37.140","192.168.12.35","TLSv1.2","233","Application Data"
"147","2.248671","146.75.37.140","192.168.12.35","TLSv1.2","527","Application Data"
"148","2.248671","146.75.37.140","192.168.12.35","TCP","1430","443  >  61013 [ACK] Seq=74757 Ack=8714 Win=8244 Len=1376 [TCP PDU reassembled in 149]"
"149","2.248671","146.75.37.140","192.168.12.35","TLSv1.2","315","Application Data"
"150","2.248671","146.75.37.140","192.168.12.35","TLSv1.2","518","Application Data"
"151","2.248671","146.75.37.140","192.168.12.35","TLSv1.2","464","Application Data"
"152","2.248671","146.75.37.140","192.168.12.35","TLSv1.2","311","Application Data, Application Data"
"153","2.248671","146.75.37.140","192.168.12.35","TLSv1.2","571","Application Data, Application Data"
"154","2.248671","146.75.37.140","192.168.12.35","TLSv1.2","372","Application Data"
"155","2.248671","146.75.37.140","192.168.12.35","TLSv1.2","261","Application Data"
"156","2.248671","146.75.37.140","192.168.12.35","TLSv1.2","186","Application Data"
"157","2.249427","192.168.12.35","146.75.37.140","TCP","54","61013  >  443 [ACK] Seq=8714 Ack=72729 Win=1021 Len=0"
"158","2.249654","192.168.12.35","146.75.37.140","TCP","54","61013  >  443 [ACK] Seq=8714 Ack=74284 Win=1025 Len=0"
"159","2.249698","192.168.12.35","146.75.37.140","TCP","54","61013  >  443 [ACK] Seq=8714 Ack=76133 Win=1025 Len=0"
"160","2.249743","192.168.12.35","146.75.37.140","TCP","54","61013  >  443 [ACK] Seq=8714 Ack=76858 Win=1022 Len=0"
"161","2.249780","192.168.12.35","146.75.37.140","TCP","54","61013  >  443 [ACK] Seq=8714 Ack=77525 Win=1019 Len=0"
"162","2.249818","192.168.12.35","146.75.37.140","TCP","54","61013  >  443 [ACK] Seq=8714 Ack=78360 Win=1025 Len=0"
"163","2.249857","192.168.12.35","146.75.37.140","TCP","54","61013  >  443 [ACK] Seq=8714 Ack=78699 Win=1023 Len=0"
"164","2.250712","146.75.37.140","192.168.12.35","TLSv1.2","248","Application Data"
"165","2.250712","146.75.37.140","192.168.12.35","TLSv1.2","720","Application Data"
"166","2.250832","192.168.12.35","146.75.37.140","TCP","54","61013  >  443 [ACK] Seq=8714 Ack=79559 Win=1020 Len=0"
"167","2.261381","146.75.37.140","192.168.12.35","TLSv1.2","383","Application Data"
"168","2.261381","146.75.37.140","192.168.12.35","TLSv1.2","727","Application Data"
"169","2.261381","146.75.37.140","192.168.12.35","TLSv1.2","231","Application Data"
"170","2.261381","146.75.37.140","192.168.12.35","TLSv1.2","250","Application Data"
"171","2.261381","146.75.37.140","192.168.12.35","TLSv1.2","704","Application Data"
"172","2.262421","192.168.12.35","146.75.37.140","TCP","54","61013  >  443 [ACK] Seq=8714 Ack=80561 Win=1025 Len=0"
"173","2.262784","192.168.12.35","146.75.37.140","TCP","54","61013  >  443 [ACK] Seq=8714 Ack=80934 Win=1023 Len=0"
"174","2.267677","146.75.37.140","192.168.12.35","TCP","1430","443  >  61013 [ACK] Seq=81584 Ack=8714 Win=8244 Len=1376 [TCP PDU reassembled in 177]"
"175","2.267677","146.75.37.140","192.168.12.35","TCP","1430","443  >  61013 [PSH, ACK] Seq=82960 Ack=8714 Win=8244 Len=1376 [TCP PDU reassembled in 177]"
"176","2.267677","146.75.37.140","192.168.12.35","TCP","1430","443  >  61013 [ACK] Seq=84336 Ack=8714 Win=8244 Len=1376 [TCP PDU reassembled in 177]"
"177","2.267677","146.75.37.140","192.168.12.35","TLSv1.2","430","Application Data"
"178","2.268562","192.168.12.35","146.75.37.140","TCP","54","61013  >  443 [ACK] Seq=8714 Ack=85712 Win=1025 Len=0"
"179","2.272735","146.75.37.140","192.168.12.35","TLSv1.2","218","Application Data"
"180","2.272735","146.75.37.140","192.168.12.35","TLSv1.2","281","Application Data"
"181","2.272735","146.75.37.140","192.168.12.35","TLSv1.2","122","Application Data"
"182","2.272735","146.75.37.140","192.168.12.35","TLSv1.2","106","Application Data"
"183","2.272735","146.75.37.140","192.168.12.35","TLSv1.2","121","Application Data"
"184","2.272992","192.168.12.35","146.75.37.140","TCP","54","61013  >  443 [ACK] Seq=8714 Ack=86252 Win=1023 Len=0"
"185","2.273168","192.168.12.35","146.75.37.140","TCP","54","61013  >  443 [ACK] Seq=8714 Ack=86547 Win=1021 Len=0"
"186","2.273250","192.168.12.35","146.75.37.140","TCP","54","61013  >  443 [ACK] Seq=8714 Ack=86666 Win=1021 Len=0"
"187","2.281844","146.75.37.140","192.168.12.35","TLSv1.2","422","Application Data"
"188","2.281844","146.75.37.140","192.168.12.35","TLSv1.2","171","Application Data"
"189","2.281844","146.75.37.140","192.168.12.35","TLSv1.2","248","Application Data"
"190","2.281844","146.75.37.140","192.168.12.35","TLSv1.2","528","Application Data"
"191","2.283450","192.168.12.35","146.75.37.140","TCP","54","61013  >  443 [ACK] Seq=8714 Ack=87151 Win=1025 Len=0"
"192","2.284154","192.168.12.35","146.75.37.140","TCP","54","61013  >  443 [ACK] Seq=8714 Ack=87819 Win=1022 Len=0"
"193","2.288646","146.75.37.140","192.168.12.35","TLSv1.2","124","Application Data"
"194","2.288646","146.75.37.140","192.168.12.35","TLSv1.2","107","Application Data"
"195","2.288646","146.75.37.140","192.168.12.35","TLSv1.2","273","Application Data"
"196","2.288646","146.75.37.140","192.168.12.35","TLSv1.2","414","Application Data"
"197","2.288646","146.75.37.140","192.168.12.35","TLSv1.2","231","Application Data"
"198","2.288646","146.75.37.140","192.168.12.35","TLSv1.2","182","Application Data"
"199","2.288646","146.75.37.140","192.168.12.35","TLSv1.2","136","Application Data"
"200","2.288646","146.75.37.140","192.168.12.35","TLSv1.2","125","Application Data"
"201","2.288646","146.75.37.140","192.168.12.35","TLSv1.2","199","Application Data"
"202","2.288646","146.75.37.140","192.168.12.35","TLSv1.2","114","Application Data"
"203","2.288646","146.75.37.140","192.168.12.35","TLSv1.2","527","Application Data"
"204","2.288646","146.75.37.140","192.168.12.35","TLSv1.2","655","Application Data"
"205","2.288646","146.75.37.140","192.168.12.35","TLSv1.2","697","Application Data"
"206","2.288646","146.75.37.140","192.168.12.35","TLSv1.2","310","Application Data"
"207","2.288646","146.75.37.140","192.168.12.35","TLSv1.2","601","Application Data"
"208","2.288646","146.75.37.140","192.168.12.35","TLSv1.2","713","Application Data"
"209","2.289696","192.168.12.35","146.75.37.140","TCP","54","61013  >  443 [ACK] Seq=8714 Ack=87942 Win=1022 Len=0"
"210","2.290027","192.168.12.35","146.75.37.140","TCP","54","61013  >  443 [ACK] Seq=8714 Ack=88521 Win=1019 Len=0"
"211","2.290156","192.168.12.35","146.75.37.140","TCP","54","61013  >  443 [ACK] Seq=8714 Ack=88826 Win=1025 Len=0"
"212","2.290259","192.168.12.35","146.75.37.140","TCP","54","61013  >  443 [ACK] Seq=8714 Ack=88979 Win=1024 Len=0"
"213","2.290342","192.168.12.35","146.75.37.140","TCP","54","61013  >  443 [ACK] Seq=8714 Ack=89184 Win=1023 Len=0"
"214","2.290504","192.168.12.35","146.75.37.140","TCP","54","61013  >  443 [ACK] Seq=8714 Ack=90258 Win=1025 Len=0"
"215","2.290643","192.168.12.35","146.75.37.140","TCP","54","61013  >  443 [ACK] Seq=8714 Ack=91157 Win=1021 Len=0"
"216","2.290747","192.168.12.35","146.75.37.140","TCP","54","61013  >  443 [ACK] Seq=8714 Ack=92363 Win=1025 Len=0"
"217","2.301255","146.75.37.140","192.168.12.35","TLSv1.2","393","Application Data"
"218","2.339949","146.75.37.140","192.168.12.35","TLSv1.2","588","Application Data"
"219","2.339949","146.75.37.140","192.168.12.35","TLSv1.2","332","Application Data"
"220","2.339949","146.75.37.140","192.168.12.35","TLSv1.2","128","Application Data"
"221","2.339949","146.75.37.140","192.168.12.35","TLSv1.2","104","Application Data"
"222","2.339949","146.75.37.140","192.168.12.35","TLSv1.2","93","Application Data"
"223","2.339949","146.75.37.140","192.168.12.35","TLSv1.2","212","Application Data"
"224","2.339949","146.75.37.140","192.168.12.35","TLSv1.2","235","Application Data"
"225","2.339949","146.75.37.140","192.168.12.35","TLSv1.2","210","Application Data"
"226","2.339949","146.75.37.140","192.168.12.35","TLSv1.2","382","Application Data"
"227","2.341319","192.168.12.35","146.75.37.140","TCP","54","61013  >  443 [ACK] Seq=8714 Ack=93236 Win=1021 Len=0"
"228","2.341933","192.168.12.35","146.75.37.140","TCP","54","61013  >  443 [ACK] Seq=8714 Ack=93588 Win=1020 Len=0"
"229","2.342133","192.168.12.35","146.75.37.140","TCP","54","61013  >  443 [ACK] Seq=8714 Ack=93677 Win=1020 Len=0"
"230","2.342216","192.168.12.35","146.75.37.140","TCP","54","61013  >  443 [ACK] Seq=8714 Ack=94016 Win=1025 Len=0"
"231","2.342331","192.168.12.35","146.75.37.140","TCP","54","61013  >  443 [ACK] Seq=8714 Ack=94500 Win=1023 Len=0"
"232","2.412475","192.168.12.35","146.75.37.140","TLSv1.2","3187","Application Data"
"233","2.412747","192.168.12.35","146.75.37.140","TLSv1.2","718","Application Data"
"234","2.412834","192.168.12.35","146.75.37.140","TLSv1.2","3191","Application Data"
"235","2.457673","146.75.37.140","192.168.12.35","TCP","54","443  >  61013 [ACK] Seq=94500 Ack=10110 Win=8244 Len=0"
"236","2.460240","192.168.12.35","146.75.37.140","TLSv1.2","3200","Application Data"
"237","2.483230","146.75.37.140","192.168.12.35","TCP","54","443  >  61013 [ACK] Seq=94500 Ack=11506 Win=8244 Len=0"
"238","2.483230","146.75.37.140","192.168.12.35","TCP","54","443  >  61013 [ACK] Seq=94500 Ack=11847 Win=8244 Len=0"
"239","2.493074","146.75.37.140","192.168.12.35","TCP","54","443  >  61013 [ACK] Seq=94500 Ack=12511 Win=8244 Len=0"
"240","2.502741","146.75.37.140","192.168.12.35","TCP","54","443  >  61013 [ACK] Seq=94500 Ack=13907 Win=8244 Len=0"
"241","2.518732","146.75.37.140","192.168.12.35","TCP","1430","443  >  61013 [ACK] Seq=94500 Ack=13907 Win=8244 Len=1376 [TCP PDU reassembled in 242]"
"242","2.518732","146.75.37.140","192.168.12.35","TLSv1.2","767","Application Data"
"243","2.518732","146.75.37.140","192.168.12.35","TLSv1.2","87","Application Data"
"244","2.518732","146.75.37.140","192.168.12.35","TCP","54","443  >  61013 [ACK] Seq=96622 Ack=15303 Win=8244 Len=0"
"245","2.519271","192.168.12.35","146.75.37.140","TCP","54","61013  >  443 [ACK] Seq=18794 Ack=96589 Win=1025 Len=0"
"246","2.529504","146.75.37.140","192.168.12.35","TCP","54","443  >  61013 [ACK] Seq=96622 Ack=15648 Win=8244 Len=0"
"247","2.547876","146.75.37.140","192.168.12.35","TCP","54","443  >  61013 [ACK] Seq=96622 Ack=17044 Win=8244 Len=0"
"248","2.558485","146.75.37.140","192.168.12.35","TCP","54","443  >  61013 [ACK] Seq=96622 Ack=18440 Win=8244 Len=0"
"249","2.558485","146.75.37.140","192.168.12.35","TCP","54","443  >  61013 [ACK] Seq=96622 Ack=18794 Win=8244 Len=0"
"250","2.558485","146.75.37.140","192.168.12.35","TCP","1430","443  >  61013 [ACK] Seq=96622 Ack=18794 Win=8244 Len=1376 [TCP PDU reassembled in 251]"
"251","2.558485","146.75.37.140","192.168.12.35","TLSv1.2","473","Application Data"
"252","2.558485","146.75.37.140","192.168.12.35","TLSv1.2","87","Application Data"
"253","2.559136","192.168.12.35","146.75.37.140","TCP","54","61013  >  443 [ACK] Seq=18794 Ack=97998 Win=1025 Len=0"
"254","2.559277","192.168.12.35","146.75.37.140","TCP","54","61013  >  443 [ACK] Seq=18794 Ack=98450 Win=1023 Len=0"
"255","2.572665","192.168.12.35","146.75.37.140","TLSv1.2","3177","Application Data"
"256","2.573421","192.168.12.35","146.75.37.140","TLSv1.2","210","Application Data"
"257","2.585063","146.75.37.140","192.168.12.35","TCP","1430","443  >  61013 [ACK] Seq=98450 Ack=18794 Win=8244 Len=1376 [TCP PDU reassembled in 258]"
"258","2.585063","146.75.37.140","192.168.12.35","TLSv1.2","898","Application Data"
"259","2.585854","192.168.12.35","146.75.37.140","TCP","54","61013  >  443 [ACK] Seq=22073 Ack=99826 Win=1025 Len=0"
"260","2.586280","192.168.12.35","146.75.37.140","TCP","54","61013  >  443 [ACK] Seq=22073 Ack=100670 Win=1021 Len=0"
"261","2.627401","146.75.37.140","192.168.12.35","TCP","54","443  >  61013 [ACK] Seq=100670 Ack=20190 Win=8244 Len=0"
"262","2.639360","146.75.37.140","192.168.12.35","TLSv1.2","604","Application Data"
"263","2.639360","146.75.37.140","192.168.12.35","TCP","54","443  >  61013 [ACK] Seq=101220 Ack=21586 Win=8244 Len=0"
"264","2.647925","146.75.37.140","192.168.12.35","TCP","54","443  >  61013 [ACK] Seq=101220 Ack=21917 Win=8244 Len=0"
"265","2.647925","146.75.37.140","192.168.12.35","TCP","54","443  >  61013 [ACK] Seq=101220 Ack=22073 Win=8244 Len=0"
"266","2.693812","192.168.12.35","146.75.37.140","TCP","54","61013  >  443 [ACK] Seq=22073 Ack=101220 Win=1019 Len=0"
"267","2.714522","146.75.37.140","192.168.12.35","TCP","1430","443  >  61013 [ACK] Seq=101220 Ack=22073 Win=8244 Len=1376 [TCP PDU reassembled in 268]"
"268","2.714522","146.75.37.140","192.168.12.35","TLSv1.2","607","Application Data"
"269","2.714822","192.168.12.35","146.75.37.140","TCP","54","61013  >  443 [ACK] Seq=22073 Ack=103149 Win=1025 Len=0"
"270","2.747447","192.168.12.35","146.75.37.140","TLSv1.2","3285","Application Data"
"271","2.747692","192.168.12.35","146.75.37.140","TLSv1.2","3192","Application Data"
"272","2.747733","192.168.12.35","146.75.37.140","TLSv1.2","3207","Application Data"
"273","2.747766","192.168.12.35","146.75.37.140","TLSv1.2","3184","Application Data"
"274","2.797180","146.75.37.140","192.168.12.35","TCP","54","443  >  61013 [ACK] Seq=103149 Ack=23469 Win=8244 Len=0"
"275","2.820038","146.75.37.140","192.168.12.35","TCP","54","443  >  61013 [ACK] Seq=103149 Ack=24865 Win=8244 Len=0"
"276","2.820038","146.75.37.140","192.168.12.35","TCP","54","443  >  61013 [ACK] Seq=103149 Ack=25304 Win=8244 Len=0"
"277","2.852437","146.75.37.140","192.168.12.35","TCP","54","443  >  61013 [ACK] Seq=103149 Ack=26700 Win=8244 Len=0"
"278","2.868805","146.75.37.140","192.168.12.35","TCP","1430","443  >  61013 [ACK] Seq=103149 Ack=26700 Win=8244 Len=1376 [TCP PDU reassembled in 279]"
"279","2.868805","146.75.37.140","192.168.12.35","TLSv1.2","874","Application Data"
"280","2.868805","146.75.37.140","192.168.12.35","TLSv1.2","100","Application Data"
"281","2.869539","192.168.12.35","146.75.37.140","TCP","54","61013  >  443 [ACK] Seq=34725 Ack=105345 Win=1025 Len=0"
"282","2.882313","146.75.37.140","192.168.12.35","TCP","54","443  >  61013 [ACK] Seq=105391 Ack=28442 Win=8244 Len=0"
"283","2.908691","146.75.37.140","192.168.12.35","TCP","1430","443  >  61013 [ACK] Seq=105391 Ack=28442 Win=8244 Len=1376 [TCP PDU reassembled in 284]"
"284","2.908691","146.75.37.140","192.168.12.35","TLSv1.2","466","Application Data"
"285","2.908691","146.75.37.140","192.168.12.35","TLSv1.2","100","Application Data"
"286","2.909458","192.168.12.35","146.75.37.140","TCP","54","61013  >  443 [ACK] Seq=34725 Ack=106767 Win=1025 Len=0"
"287","2.910198","192.168.12.35","146.75.37.140","TCP","54","61013  >  443 [ACK] Seq=34725 Ack=107225 Win=1023 Len=0"
"288","2.929813","146.75.37.140","192.168.12.35","TCP","54","443  >  61013 [ACK] Seq=107225 Ack=31234 Win=8244 Len=0"
"289","2.929813","146.75.37.140","192.168.12.35","TCP","54","443  >  61013 [ACK] Seq=107225 Ack=31595 Win=8244 Len=0"
"290","2.948817","146.75.37.140","192.168.12.35","TLSv1.2","1034","Application Data"
"291","2.949268","192.168.12.35","146.75.37.140","TCP","54","61013  >  443 [ACK] Seq=34725 Ack=108205 Win=1025 Len=0"
"292","2.954898","146.75.37.140","192.168.12.35","TCP","1430","443  >  61013 [ACK] Seq=108205 Ack=31595 Win=8244 Len=1376 [TCP PDU reassembled in 293]"
"293","2.954898","146.75.37.140","192.168.12.35","TLSv1.2","871","Application Data"
"294","2.955507","192.168.12.35","146.75.37.140","TCP","54","61013  >  443 [ACK] Seq=34725 Ack=109581 Win=1019 Len=0"
"295","2.955834","192.168.12.35","146.75.37.140","TCP","54","61013  >  443 [ACK] Seq=34725 Ack=110398 Win=1025 Len=0"
"296","2.972567","146.75.37.140","192.168.12.35","TCP","54","443  >  61013 [ACK] Seq=110398 Ack=32991 Win=8244 Len=0"
"297","2.995317","146.75.37.140","192.168.12.35","TCP","54","443  >  61013 [ACK] Seq=110398 Ack=34725 Win=8244 Len=0"
"298","3.046179","146.75.37.140","192.168.12.35","TCP","1430","443  >  61013 [ACK] Seq=110398 Ack=34725 Win=8244 Len=1376 [TCP PDU reassembled in 299]"
"299","3.046179","146.75.37.140","192.168.12.35","TLSv1.2","497","Application Data"
"300","3.046179","146.75.37.140","192.168.12.35","TLSv1.2","100","Application Data"
"301","3.046925","192.168.12.35","146.75.37.140","TCP","54","61013  >  443 [ACK] Seq=34725 Ack=112217 Win=1025 Len=0"
"302","3.062930","192.168.12.35","146.75.37.140","TLSv1.2","3146","Application Data"
"303","3.105491","146.75.37.140","192.168.12.35","TCP","1430","443  >  61013 [ACK] Seq=112263 Ack=34725 Win=8244 Len=1376 [TCP PDU reassembled in 304]"
"304","3.105491","146.75.37.140","192.168.12.35","TLSv1.2","112","Application Data"
"305","3.105491","146.75.37.140","192.168.12.35","TLSv1.2","892","Application Data"
"306","3.105491","146.75.37.140","192.168.12.35","TLSv1.2","85","Application Data"
"307","3.106511","192.168.12.35","146.75.37.140","TCP","54","61013  >  443 [ACK] Seq=37817 Ack=113639 Win=1025 Len=0"
"308","3.107033","192.168.12.35","146.75.37.140","TCP","54","61013  >  443 [ACK] Seq=37817 Ack=113697 Win=1024 Len=0"
"309","3.107177","192.168.12.35","146.75.37.140","TCP","54","61013  >  443 [ACK] Seq=37817 Ack=114566 Win=1021 Len=0"
"310","3.125934","192.168.12.35","146.75.37.140","TLSv1.2","3176","Application Data"
"311","3.126328","192.168.12.35","146.75.37.140","TLSv1.2","134","Application Data"
"312","3.195288","146.75.37.140","192.168.12.35","TCP","54","443  >  61013 [ACK] Seq=114566 Ack=36121 Win=8244 Len=0"
"313","3.215419","146.75.37.140","192.168.12.35","TCP","54","443  >  61013 [ACK] Seq=114566 Ack=37817 Win=8244 Len=0"
"314","3.249797","146.75.37.140","192.168.12.35","TCP","1430","443  >  61013 [ACK] Seq=114566 Ack=37817 Win=8244 Len=1376 [TCP PDU reassembled in 315]"
"315","3.249797","146.75.37.140","192.168.12.35","TLSv1.2","794","Application Data"
"316","3.249797","146.75.37.140","192.168.12.35","TLSv1.2","87","Application Data"
"317","3.250431","192.168.12.35","146.75.37.140","TCP","54","61013  >  443 [ACK] Seq=41019 Ack=115942 Win=1025 Len=0"
"318","3.250669","192.168.12.35","146.75.37.140","TCP","54","61013  >  443 [ACK] Seq=41019 Ack=116682 Win=1022 Len=0"
"319","3.300017","192.168.12.35","146.75.37.140","TCP","54","61013  >  443 [ACK] Seq=41019 Ack=116715 Win=1022 Len=0"
"320","3.300319","146.75.37.140","192.168.12.35","TCP","54","443  >  61013 [ACK] Seq=116715 Ack=39213 Win=8244 Len=0"
"321","3.312415","146.75.37.140","192.168.12.35","TCP","54","443  >  61013 [ACK] Seq=116715 Ack=40939 Win=8244 Len=0"
"322","3.312415","146.75.37.140","192.168.12.35","TCP","54","443  >  61013 [ACK] Seq=116715 Ack=41019 Win=8244 Len=0"
"323","3.330195","146.75.37.140","192.168.12.35","TCP","1430","443  >  61013 [ACK] Seq=116715 Ack=41019 Win=8244 Len=1376 [TCP PDU reassembled in 325]"
"324","3.335750","146.75.37.140","192.168.12.35","TCP","1430","443  >  61013 [PSH, ACK] Seq=118091 Ack=41019 Win=8244 Len=1376 [TCP PDU reassembled in 325]"
"325","3.335750","146.75.37.140","192.168.12.35","TLSv1.2","125","Application Data"
"326","3.336158","192.168.12.35","146.75.37.140","TCP","54","61013  >  443 [ACK] Seq=41019 Ack=119467 Win=1025 Len=0"
"327","3.376637","192.168.12.35","146.75.37.140","TCP","54","61013  >  443 [ACK] Seq=41019 Ack=119538 Win=1024 Len=0"
"328","3.656835","146.75.37.140","192.168.12.35","TLSv1.2","957","Application Data"
"329","3.674611","192.168.12.35","146.75.37.140","UDP","1292","50355  >  443 Len=1250"
"330","3.674782","192.168.12.35","146.75.37.140","UDP","546","50355  >  443 Len=504"
"331","3.702942","192.168.12.35","146.75.37.140","TCP","54","61013  >  443 [ACK] Seq=41019 Ack=120441 Win=1021 Len=0"
"332","3.712972","146.75.37.140","192.168.12.35","TLSv1.2","251","Application Data"
"333","3.733082","146.75.37.140","192.168.12.35","TLSv1.2","173","Application Data"
"334","3.733082","146.75.37.140","192.168.12.35","TLSv1.2","1119","Application Data"
"335","3.733082","146.75.37.140","192.168.12.35","TLSv1.2","836","Application Data"
"336","3.733082","146.75.37.140","192.168.12.35","TLSv1.2","538","Application Data"
"337","3.733082","146.75.37.140","192.168.12.35","TLSv1.2","818","Application Data"
"338","3.733082","146.75.37.140","192.168.12.35","TLSv1.2","309","Application Data"
"339","3.733082","146.75.37.140","192.168.12.35","TLSv1.2","567","Application Data"
"340","3.733082","146.75.37.140","192.168.12.35","TLSv1.2","645","Application Data"
"341","3.733082","146.75.37.140","192.168.12.35","TLSv1.2","338","Application Data"
"342","3.733082","146.75.37.140","192.168.12.35","TLSv1.2","744","Application Data"
"343","3.733696","192.168.12.35","146.75.37.140","TCP","54","61013  >  443 [ACK] Seq=41019 Ack=120757 Win=1020 Len=0"
"344","3.733955","192.168.12.35","146.75.37.140","TCP","54","61013  >  443 [ACK] Seq=41019 Ack=122604 Win=1025 Len=0"
"345","3.734352","192.168.12.35","146.75.37.140","TCP","54","61013  >  443 [ACK] Seq=41019 Ack=123852 Win=1020 Len=0"
"346","3.734434","192.168.12.35","146.75.37.140","TCP","54","61013  >  443 [ACK] Seq=41019 Ack=124620 Win=1025 Len=0"
"347","3.734503","192.168.12.35","146.75.37.140","TCP","54","61013  >  443 [ACK] Seq=41019 Ack=125495 Win=1021 Len=0"
"348","3.734932","146.75.37.140","192.168.12.35","TLSv1.2","483","Application Data"
"349","3.734932","146.75.37.140","192.168.12.35","TLSv1.2","191","Application Data"
"350","3.734932","146.75.37.140","192.168.12.35","TLSv1.2","448","Application Data"
"351","3.734932","146.75.37.140","192.168.12.35","TLSv1.2","290","Application Data"
"352","3.735250","192.168.12.35","146.75.37.140","TCP","54","61013  >  443 [ACK] Seq=41019 Ack=126614 Win=1025 Len=0"
"353","3.735376","192.168.12.35","146.75.37.140","TCP","54","61013  >  443 [ACK] Seq=41019 Ack=127145 Win=1023 Len=0"
"354","3.742571","146.75.37.140","192.168.12.35","UDP","67","443  >  50355 Len=25"
"355","3.754347","146.75.37.140","192.168.12.35","TLSv1.2","393","Application Data"
"356","3.754347","146.75.37.140","192.168.12.35","UDP","834","443  >  50355 Len=792"
"357","3.754347","146.75.37.140","192.168.12.35","UDP","187","443  >  50355 Len=145"
"358","3.754848","192.168.12.35","146.75.37.140","TCP","54","61013  >  443 [ACK] Seq=41019 Ack=127720 Win=1020 Len=0"
"359","3.763304","146.75.37.140","192.168.12.35","TLSv1.2","237","Application Data"
"360","3.764771","192.168.12.35","146.75.37.140","UDP","84","50355  >  443 Len=42"
"361","3.768568","146.75.37.140","192.168.12.35","TLSv1.2","306","Application Data"
"362","3.768568","146.75.37.140","192.168.12.35","TLSv1.2","173","Application Data"
"363","3.769070","192.168.12.35","146.75.37.140","TCP","54","61013  >  443 [ACK] Seq=41019 Ack=128155 Win=1025 Len=0"
"364","3.780243","146.75.37.140","192.168.12.35","TLSv1.2","324","Application Data"
"365","3.780596","192.168.12.35","146.75.37.140","UDP","1292","50355  >  443 Len=1250"
"366","3.781079","192.168.12.35","146.75.37.140","TCP","54","61013  >  443 [ACK] Seq=41019 Ack=128544 Win=1023 Len=0"
"367","3.781251","192.168.12.35","146.75.37.140","UDP","543","50355  >  443 Len=501"
"368","3.804861","146.75.37.140","192.168.12.35","TLSv1.2","148","Application Data"
"369","3.804861","146.75.37.140","192.168.12.35","TLSv1.2","376","Application Data"
"370","3.804861","146.75.37.140","192.168.12.35","TLSv1.2","237","Application Data"
"371","3.805572","192.168.12.35","146.75.37.140","TCP","54","61013  >  443 [ACK] Seq=41019 Ack=128960 Win=1022 Len=0"
"372","3.811750","146.75.37.140","192.168.12.35","TLSv1.2","273","Application Data"
"373","3.811750","146.75.37.140","192.168.12.35","TLSv1.2","407","Application Data"
"374","3.812812","192.168.12.35","146.75.37.140","TCP","54","61013  >  443 [ACK] Seq=41019 Ack=129362 Win=1020 Len=0"
"375","3.826955","146.75.37.140","192.168.12.35","TLSv1.2","126","Application Data"
"376","3.826955","146.75.37.140","192.168.12.35","TLSv1.2","705","Application Data"
"377","3.827871","192.168.12.35","146.75.37.140","TCP","54","61013  >  443 [ACK] Seq=41019 Ack=129787 Win=1025 Len=0"
"378","3.844413","146.75.37.140","192.168.12.35","UDP","67","443  >  50355 Len=25"
"379","3.863278","146.75.37.140","192.168.12.35","UDP","835","443  >  50355 Len=793"
