"No.","Time","Source","Destination","Protocol","Length","Info"
"1","0.000000","192.168.12.35","146.75.37.140","UDP","80","52870  >  443 Len=38"
"2","0.050463","146.75.37.140","192.168.12.35","UDP","71","443  >  52870 Len=29"
"3","2.601954","146.75.37.140","192.168.12.35","UDP","1219","443  >  52870 Len=1177"
"4","2.610556","192.168.12.35","146.75.37.140","UDP","84","52870  >  443 Len=42"
"5","2.610904","192.168.12.35","146.75.37.140","UDP","1292","52870  >  443 Len=1250"
"6","2.610931","192.168.12.35","146.75.37.140","UDP","1022","52870  >  443 Len=980"
"7","2.667463","146.75.37.140","192.168.12.35","UDP","67","443  >  52870 Len=25"
"8","2.880670","192.168.12.35","146.75.37.140","UDP","80","52870  >  443 Len=38"
"9","2.930708","146.75.37.140","192.168.12.35","UDP","67","443  >  52870 Len=25"
"10","3.147338","192.168.12.35","146.75.37.140","UDP","80","52870  >  443 Len=38"
"11","3.196414","146.75.37.140","192.168.12.35","UDP","67","443  >  52870 Len=25"
"12","3.412360","192.168.12.35","146.75.37.140","UDP","80","52870  >  443 Len=38"
"13","3.467632","146.75.37.140","192.168.12.35","UDP","67","443  >  52870 Len=25"
"14","3.675863","192.168.12.35","146.75.37.140","UDP","80","52870  >  443 Len=38"
"15","3.725521","146.75.37.140","192.168.12.35","UDP","67","443  >  52870 Len=25"
"16","3.941651","192.168.12.35","146.75.37.140","UDP","80","52870  >  443 Len=38"
"17","3.991766","146.75.37.140","192.168.12.35","UDP","67","443  >  52870 Len=25"
"18","4.205619","192.168.12.35","146.75.37.140","UDP","80","52870  >  443 Len=38"
"19","4.227936","192.168.12.35","146.75.37.140","TLSv1.2","3241","Application Data"
"20","4.228026","192.168.12.35","146.75.37.140","TLSv1.2","93","Application Data"
"21","4.228055","192.168.12.35","146.75.37.140","TLSv1.2","3360","Application Data"
"22","4.228081","192.168.12.35","146.75.37.140","TLSv1.2","2513","Application Data"
"23","4.255722","146.75.37.140","192.168.12.35","UDP","67","443  >  52870 Len=25"
"24","4.271240","146.75.37.140","192.168.12.35","TCP","54","443  >  61013 [ACK] Seq=1 Ack=1397 Win=8244 Len=0"
"25","4.290805","146.75.37.140","192.168.12.35","TCP","54","443  >  61013 [ACK] Seq=1 Ack=2793 Win=8244 Len=0"
"26","4.301568","146.75.37.140","192.168.12.35","TCP","54","443  >  61013 [ACK] Seq=1 Ack=3188 Win=8244 Len=0"
"27","4.301568","146.75.37.140","192.168.12.35","TCP","54","443  >  61013 [ACK] Seq=1 Ack=3227 Win=8244 Len=0"
"28","4.301568","146.75.37.140","192.168.12.35","TLSv1.2","93","Application Data"
"29","4.317552","146.75.37.140","192.168.12.35","TCP","54","443  >  61013 [ACK] Seq=40 Ack=4623 Win=8244 Len=0"
"30","4.341025","146.75.37.140","192.168.12.35","TCP","1430","443  >  61013 [ACK] Seq=40 Ack=4623 Win=8244 Len=1376 [TCP PDU reassembled in 31]"
"31","4.341025","146.75.37.140","192.168.12.35","TLSv1.2","1076","Application Data"
"32","4.341025","146.75.37.140","192.168.12.35","TCP","54","443  >  61013 [ACK] Seq=2438 Ack=6019 Win=8244 Len=0"
"33","4.341761","192.168.12.35","146.75.37.140","TCP","54","61013  >  443 [ACK] Seq=8992 Ack=1416 Win=1025 Len=0"
"34","4.342891","146.75.37.140","192.168.12.35","TCP","54","443  >  61013 [ACK] Seq=2438 Ack=6533 Win=8244 Len=0"
"35","4.347398","146.75.37.140","192.168.12.35","TCP","1430","443  >  61013 [ACK] Seq=2438 Ack=6533 Win=8244 Len=1376 [TCP PDU reassembled in 36]"
"36","4.347398","146.75.37.140","192.168.12.35","TLSv1.2","1069","Application Data"
"37","4.347398","146.75.37.140","192.168.12.35","TCP","1430","443  >  61013 [ACK] Seq=4829 Ack=6533 Win=8244 Len=1376 [TCP PDU reassembled in 50]"
"38","4.347398","146.75.37.140","192.168.12.35","TCP","1430","443  >  61013 [PSH, ACK] Seq=6205 Ack=6533 Win=8244 Len=1376 [TCP PDU reassembled in 50]"
"39","4.347398","146.75.37.140","192.168.12.35","TCP","1430","443  >  61013 [ACK] Seq=7581 Ack=6533 Win=8244 Len=1376 [TCP PDU reassembled in 50]"
"40","4.347398","146.75.37.140","192.168.12.35","TCP","1430","443  >  61013 [PSH, ACK] Seq=8957 Ack=6533 Win=8244 Len=1376 [TCP PDU reassembled in 50]"
"41","4.347398","146.75.37.140","192.168.12.35","TCP","1430","443  >  61013 [ACK] Seq=10333 Ack=6533 Win=8244 Len=1376 [TCP PDU reassembled in 50]"
"42","4.347398","146.75.37.140","192.168.12.35","TCP","1430","443  >  61013 [PSH, ACK] Seq=11709 Ack=6533 Win=8244 Len=1376 [TCP PDU reassembled in 50]"
"43","4.347398","146.75.37.140","192.168.12.35","TCP","1430","443  >  61013 [ACK] Seq=13085 Ack=6533 Win=8244 Len=1376 [TCP PDU reassembled in 50]"
"44","4.347398","146.75.37.140","192.168.12.35","TCP","1430","443  >  61013 [PSH, ACK] Seq=14461 Ack=6533 Win=8244 Len=1376 [TCP PDU reassembled in 50]"
"45","4.347398","146.75.37.140","192.168.12.35","TCP","1430","443  >  61013 [ACK] Seq=15837 Ack=6533 Win=8244 Len=1376 [TCP PDU reassembled in 50]"
"46","4.347398","146.75.37.140","192.168.12.35","TCP","1430","443  >  61013 [PSH, ACK] Seq=17213 Ack=6533 Win=8244 Len=1376 [TCP PDU reassembled in 50]"
"47","4.348505","192.168.12.35","146.75.37.140","TCP","54","61013  >  443 [ACK] Seq=8992 Ack=3814 Win=1025 Len=0"
"48","4.348984","192.168.12.35","146.75.37.140","TCP","54","61013  >  443 [ACK] Seq=8992 Ack=18589 Win=1025 Len=0"
"49","4.352703","192.168.12.35","146.75.37.140","TLSv1.2","89","Application Data"
"50","4.353026","146.75.37.140","192.168.12.35","TLSv1.2","1159","Application Data, Application Data"
"51","4.353026","146.75.37.140","192.168.12.35","TLSv1.2","90","Application Data"
"52","4.353026","146.75.37.140","192.168.12.35","TCP","1430","443  >  61013 [ACK] Seq=19730 Ack=6533 Win=8244 Len=1376 [TCP PDU reassembled in 63]"
"53","4.353026","146.75.37.140","192.168.12.35","TCP","1430","443  >  61013 [PSH, ACK] Seq=21106 Ack=6533 Win=8244 Len=1376 [TCP PDU reassembled in 63]"
"54","4.353026","146.75.37.140","192.168.12.35","TCP","1430","443  >  61013 [ACK] Seq=22482 Ack=6533 Win=8244 Len=1376 [TCP PDU reassembled in 63]"
"55","4.353026","146.75.37.140","192.168.12.35","TCP","1430","443  >  61013 [PSH, ACK] Seq=23858 Ack=6533 Win=8244 Len=1376 [TCP PDU reassembled in 63]"
"56","4.353026","146.75.37.140","192.168.12.35","TCP","1430","443  >  61013 [ACK] Seq=25234 Ack=6533 Win=8244 Len=1376 [TCP PDU reassembled in 63]"
"57","4.353026","146.75.37.140","192.168.12.35","TCP","1430","443  >  61013 [PSH, ACK] Seq=26610 Ack=6533 Win=8244 Len=1376 [TCP PDU reassembled in 63]"
"58","4.353026","146.75.37.140","192.168.12.35","TCP","1430","443  >  61013 [ACK] Seq=27986 Ack=6533 Win=8244 Len=1376 [TCP PDU reassembled in 63]"
"59","4.353026","146.75.37.140","192.168.12.35","TCP","1430","443  >  61013 [PSH, ACK] Seq=29362 Ack=6533 Win=8244 Len=1376 [TCP PDU reassembled in 63]"
"60","4.353026","146.75.37.140","192.168.12.35","TCP","1430","443  >  61013 [ACK] Seq=30738 Ack=7929 Win=8244 Len=1376 [TCP PDU reassembled in 63]"
"61","4.353026","146.75.37.140","192.168.12.35","TCP","1430","443  >  61013 [PSH, ACK] Seq=32114 Ack=7929 Win=8244 Len=1376 [TCP PDU reassembled in 63]"
"62","4.353026","146.75.37.140","192.168.12.35","TCP","1430","443  >  61013 [ACK] Seq=33490 Ack=7929 Win=8244 Len=1376 [TCP PDU reassembled in 63]"
"63","4.353026","146.75.37.140","192.168.12.35","TLSv1.2","549","Application Data"
"64","4.353571","192.168.12.35","146.75.37.140","TCP","54","61013  >  443 [ACK] Seq=9027 Ack=19730 Win=1020 Len=0"
"65","4.353664","192.168.12.35","146.75.37.140","TCP","54","61013  >  443 [ACK] Seq=9027 Ack=34866 Win=1025 Len=0"
"66","4.353709","192.168.12.35","146.75.37.140","TCP","54","61013  >  443 [ACK] Seq=9027 Ack=35361 Win=1023 Len=0"
"67","4.358745","146.75.37.140","192.168.12.35","TCP","1430","443  >  61013 [ACK] Seq=35361 Ack=7929 Win=8244 Len=1376 [TCP PDU reassembled in 79]"
"68","4.358745","146.75.37.140","192.168.12.35","TCP","1430","443  >  61013 [PSH, ACK] Seq=36737 Ack=7929 Win=8244 Len=1376 [TCP PDU reassembled in 79]"
"69","4.358745","146.75.37.140","192.168.12.35","TCP","1430","443  >  61013 [ACK] Seq=38113 Ack=7929 Win=8244 Len=1376 [TCP PDU reassembled in 79]"
"70","4.358745","146.75.37.140","192.168.12.35","TCP","1430","443  >  61013 [PSH, ACK] Seq=39489 Ack=7929 Win=8244 Len=1376 [TCP PDU reassembled in 79]"
"71","4.358745","146.75.37.140","192.168.12.35","TCP","1430","443  >  61013 [ACK] Seq=40865 Ack=7929 Win=8244 Len=1376 [TCP PDU reassembled in 79]"
"72","4.358745","146.75.37.140","192.168.12.35","TCP","1430","443  >  61013 [PSH, ACK] Seq=42241 Ack=7929 Win=8244 Len=1376 [TCP PDU reassembled in 79]"
"73","4.358745","146.75.37.140","192.168.12.35","TCP","1430","443  >  61013 [ACK] Seq=43617 Ack=7929 Win=8244 Len=1376 [TCP PDU reassembled in 79]"
"74","4.358745","146.75.37.140","192.168.12.35","TCP","1430","443  >  61013 [PSH, ACK] Seq=44993 Ack=7929 Win=8244 Len=1376 [TCP PDU reassembled in 79]"
"75","4.358745","146.75.37.140","192.168.12.35","TCP","1430","443  >  61013 [ACK] Seq=46369 Ack=7929 Win=8244 Len=1376 [TCP PDU reassembled in 79]"
"76","4.358745","146.75.37.140","192.168.12.35","TCP","1430","443  >  61013 [PSH, ACK] Seq=47745 Ack=7929 Win=8244 Len=1376 [TCP PDU reassembled in 79]"
"77","4.359013","192.168.12.35","146.75.37.140","TCP","54","61013  >  443 [ACK] Seq=9027 Ack=49121 Win=1025 Len=0"
"78","4.365236","146.75.37.140","192.168.12.35","TCP","1430","443  >  61013 [ACK] Seq=49121 Ack=7929 Win=8244 Len=1376 [TCP PDU reassembled in 79]"
"79","4.365236","146.75.37.140","192.168.12.35","TLSv1.2","1430","Application Data"
"80","4.365236","146.75.37.140","192.168.12.35","TCP","1430","443  >  61013 [ACK] Seq=51873 Ack=7929 Win=8244 Len=1376 [TCP PDU reassembled in 81]"
"81","4.365236","146.75.37.140","192.168.12.35","TLSv1.2","1430","Application Data"
"82","4.365236","146.75.37.140","192.168.12.35","TLSv1.2","1430","Application Data"
"83","4.365236","146.75.37.140","192.168.12.35","TCP","1430","443  >  61013 [PSH, ACK] Seq=56001 Ack=7929 Win=8244 Len=1376 [TCP PDU reassembled in 85]"
"84","4.365236","146.75.37.140","192.168.12.35","TCP","1430","443  >  61013 [ACK] Seq=57377 Ack=7929 Win=8244 Len=1376 [TCP PDU reassembled in 85]"
"85","4.365236","146.75.37.140","192.168.12.35","TLSv1.2","1430","Application Data"
"86","4.365236","146.75.37.140","192.168.12.35","TLSv1.2","1430","Application Data"
"87","4.365236","146.75.37.140","192.168.12.35","TLSv1.2","1430","Application Data"
"88","4.365236","146.75.37.140","192.168.12.35","TLSv1.2","171","Application Data"
"89","4.365236","146.75.37.140","192.168.12.35","TLSv1.2","476","Application Data"
"90","4.365236","146.75.37.140","192.168.12.35","TLSv1.2","118","Application Data"
"91","4.365960","192.168.12.35","146.75.37.140","TCP","54","61013  >  443 [ACK] Seq=9027 Ack=62881 Win=1025 Len=0"
"92","4.366225","192.168.12.35","146.75.37.140","TCP","54","61013  >  443 [ACK] Seq=9027 Ack=63420 Win=1023 Len=0"
"93","4.389293","192.168.12.35","146.75.37.140","UDP","96","52870  >  443 Len=54"
"94","4.391411","146.75.37.140","192.168.12.35","TCP","54","443  >  61013 [ACK] Seq=63484 Ack=8992 Win=8244 Len=0"
"95","4.391411","146.75.37.140","192.168.12.35","TCP","54","443  >  61013 [ACK] Seq=63484 Ack=9027 Win=8244 Len=0"
"96","4.391411","146.75.37.140","192.168.12.35","TLSv1.2","123","Application Data"
"97","4.391773","192.168.12.35","146.75.37.140","TCP","54","61013  >  443 [ACK] Seq=9027 Ack=63553 Win=1022 Len=0"
"98","4.397529","146.75.37.140","192.168.12.35","TLSv1.2","115","Application Data"
"99","4.415156","146.75.37.140","192.168.12.35","TCP","1430","443  >  61013 [ACK] Seq=63614 Ack=9027 Win=8244 Len=1376 [TCP PDU reassembled in 100]"
"100","4.415156","146.75.37.140","192.168.12.35","TLSv1.2","504","Application Data"
"101","4.415597","192.168.12.35","146.75.37.140","TCP","54","61013  >  443 [ACK] Seq=9027 Ack=64990 Win=1025 Len=0"
"102","4.424835","146.75.37.140","192.168.12.35","TLSv1.2","94","Application Data"
"103","4.424835","146.75.37.140","192.168.12.35","UDP","67","443  >  52870 Len=25"
"104","4.425691","192.168.12.35","146.75.37.140","TCP","54","61013  >  443 [ACK] Seq=9027 Ack=65480 Win=1023 Len=0"
"105","4.427764","146.75.37.140","192.168.12.35","TLSv1.2","98","Application Data"
"106","4.433794","146.75.37.140","192.168.12.35","TLSv1.2","103","Application Data"
"107","4.434154","192.168.12.35","146.75.37.140","TCP","54","61013  >  443 [ACK] Seq=9027 Ack=65573 Win=1022 Len=0"
"108","4.435013","192.168.12.35","146.75.37.140","UDP","84","52870  >  443 Len=42"
"109","4.441523","146.75.37.140","192.168.12.35","TLSv1.2","656","Application Data"
"110","4.441523","146.75.37.140","192.168.12.35","TLSv1.2","119","Application Data"
"111","4.441523","146.75.37.140","192.168.12.35","TLSv1.2","174","Application Data"
"112","4.442401","192.168.12.35","146.75.37.140","TCP","54","61013  >  443 [ACK] Seq=9027 Ack=66240 Win=1020 Len=0"
"113","4.448022","146.75.37.140","192.168.12.35","TCP","1430","443  >  61013 [ACK] Seq=66360 Ack=9027 Win=8244 Len=1376 [TCP PDU reassembled in 114]"
"114","4.448022","146.75.37.140","192.168.12.35","TLSv1.2","272","Application Data"
"115","4.448022","146.75.37.140","192.168.12.35","TLSv1.2","221","Application Data"
"116","4.448022","146.75.37.140","192.168.12.35","TLSv1.2","106","Application Data"
"117","4.448022","146.75.37.140","192.168.12.35","TLSv1.2","215","Application Data"
"118","4.448022","146.75.37.140","192.168.12.35","UDP","67","443  >  52870 Len=25"
"119","4.448617","192.168.12.35","146.75.37.140","TCP","54","61013  >  443 [ACK] Seq=9027 Ack=67736 Win=1025 Len=0"
"120","4.448902","192.168.12.35","146.75.37.140","TCP","54","61013  >  443 [ACK] Seq=9027 Ack=68121 Win=1023 Len=0"
"121","4.448993","192.168.12.35","146.75.37.140","TCP","54","61013  >  443 [ACK] Seq=9027 Ack=68334 Win=1022 Len=0"
"122","4.453847","146.75.37.140","192.168.12.35","TLSv1.2","1397","Application Data"
"123","4.500756","192.168.12.35","146.75.37.140","TCP","54","61013  >  443 [ACK] Seq=9027 Ack=69677 Win=1025 Len=0"
"124","5.035785","146.75.37.140","192.168.12.35","TLSv1.2","564","Application Data"
"125","5.045517","146.75.37.140","192.168.12.35","TLSv1.2","133","Application Data"
"126","5.045838","192.168.12.35","146.75.37.140","TCP","54","61013  >  443 [ACK] Seq=9027 Ack=70266 Win=1022 Len=0"
"127","5.087993","146.75.37.140","192.168.12.35","TLSv1.2","399","Application Data"
"128","5.094212","146.75.37.140","192.168.12.35","TLSv1.2","204","Application Data"
"129","5.095073","192.168.12.35","146.75.37.140","TCP","54","61013  >  443 [ACK] Seq=9027 Ack=70761 Win=1020 Len=0"
"130","5.103585","146.75.37.140","192.168.12.35","TLSv1.2","214","Application Data"
"131","5.135755","192.168.12.35","146.75.37.140","TCP","55","62685  >  443 [ACK] Seq=1 Ack=1 Win=512 Len=1"
"132","5.149057","146.75.37.140","192.168.12.35","TLSv1.2","154","Application Data"
"133","5.149057","146.75.37.140","192.168.12.35","TLSv1.2","114","Application Data"
"134","5.149361","192.168.12.35","146.75.37.140","TCP","54","61013  >  443 [ACK] Seq=9027 Ack=71021 Win=1019 Len=0"
"135","5.157812","146.75.37.140","192.168.12.35","TLSv1.2","198","Application Data"
"136","5.158396","192.168.12.35","146.75.37.140","TCP","54","61013  >  443 [ACK] Seq=9027 Ack=71225 Win=1025 Len=0"
"137","5.163568","146.75.37.140","192.168.12.35","TCP","66","443  >  62685 [ACK] Seq=1 Ack=2 Win=302 Len=0 SLE=1 SRE=2"
"138","5.170232","146.75.37.140","192.168.12.35","TLSv1.2","115","Application Data"
"139","5.175819","146.75.37.140","192.168.12.35","TLSv1.2","566","Application Data"
"140","5.176469","192.168.12.35","146.75.37.140","TCP","54","61013  >  443 [ACK] Seq=9027 Ack=71798 Win=1022 Len=0"
"141","5.181370","146.75.37.140","192.168.12.35","TLSv1.2","227","Application Data"
"142","5.197108","146.75.37.140","192.168.12.35","TLSv1.2","120","Application Data"
"143","5.197880","192.168.12.35","146.75.37.140","TCP","54","61013  >  443 [ACK] Seq=9027 Ack=72037 Win=1022 Len=0"
"144","5.207738","146.75.37.140","192.168.12.35","TLSv1.2","114","Application Data"
"145","5.214904","146.75.37.140","192.168.12.35","TLSv1.2","102","Application Data"
"146","5.214904","146.75.37.140","192.168.12.35","TLSv1.2","195","Application Data"
"147","5.215693","192.168.12.35","146.75.37.140","TCP","54","61013  >  443 [ACK] Seq=9027 Ack=72145 Win=1021 Len=0"
"148","5.219704","146.75.37.140","192.168.12.35","TLSv1.2","96","Application Data"
"149","5.219939","192.168.12.35","146.75.37.140","TCP","54","61013  >  443 [ACK] Seq=9027 Ack=72328 Win=1020 Len=0"
"150","5.228043","146.75.37.140","192.168.12.35","TLSv1.2","374","Application Data"
"151","5.237502","146.75.37.140","192.168.12.35","TLSv1.2","116","Application Data"
"152","5.237502","146.75.37.140","192.168.12.35","TLSv1.2","156","Application Data"
"153","5.237502","146.75.37.140","192.168.12.35","TLSv1.2","136","Application Data"
"154","5.237502","146.75.37.140","192.168.12.35","TLSv1.2","984","Application Data"
"155","5.237502","146.75.37.140","192.168.12.35","TLSv1.2","756","Application Data"
"156","5.237502","146.75.37.140","192.168.12.35","TLSv1.2","1003","Application Data"
"157","5.237502","146.75.37.140","192.168.12.35","TLSv1.2","1271","Application Data"
"158","5.238065","192.168.12.35","146.75.37.140","TCP","54","61013  >  443 [ACK] Seq=9027 Ack=72710 Win=1025 Len=0"
"159","5.238325","192.168.12.35","146.75.37.140","TCP","54","61013  >  443 [ACK] Seq=9027 Ack=72894 Win=1024 Len=0"
"160","5.238398","192.168.12.35","146.75.37.140","TCP","54","61013  >  443 [ACK] Seq=9027 Ack=74526 Win=1025 Len=0"
"161","5.238517","192.168.12.35","146.75.37.140","TCP","54","61013  >  443 [ACK] Seq=9027 Ack=76692 Win=1025 Len=0"
"162","5.242289","146.75.37.140","192.168.12.35","TLSv1.2","443","Application Data"
"163","5.252747","146.75.37.140","192.168.12.35","TLSv1.2","633","Application Data"
"164","5.252747","146.75.37.140","192.168.12.35","TLSv1.2","262","Application Data"
"165","5.252747","146.75.37.140","192.168.12.35","TLSv1.2","473","Application Data"
"166","5.252747","146.75.37.140","192.168.12.35","TLSv1.2","135","Application Data"
"167","5.252747","146.75.37.140","192.168.12.35","TLSv1.2","321","Application Data"
"168","5.252747","146.75.37.140","192.168.12.35","TLSv1.2","756","Application Data"
"169","5.252747","146.75.37.140","192.168.12.35","TLSv1.2","421","Application Data"
"170","5.252747","146.75.37.140","192.168.12.35","TLSv1.2","273","Application Data"
"171","5.253561","192.168.12.35","146.75.37.140","TCP","54","61013  >  443 [ACK] Seq=9027 Ack=77660 Win=1021 Len=0"
"172","5.253914","192.168.12.35","146.75.37.140","TCP","54","61013  >  443 [ACK] Seq=9027 Ack=78287 Win=1025 Len=0"
"173","5.253977","192.168.12.35","146.75.37.140","TCP","54","61013  >  443 [ACK] Seq=9027 Ack=78635 Win=1023 Len=0"
"174","5.254024","192.168.12.35","146.75.37.140","TCP","54","61013  >  443 [ACK] Seq=9027 Ack=79704 Win=1025 Len=0"
"175","5.260118","192.168.12.35","146.75.37.140","TLSv1.2","215","Application Data"
"176","5.260166","192.168.12.35","146.75.37.140","TLSv1.2","93","Application Data"
"177","5.260628","146.75.37.140","192.168.12.35","TLSv1.2","919","Application Data"
"178","5.261245","192.168.12.35","146.75.37.140","TCP","54","61013  >  443 [ACK] Seq=9027 Ack=80788 Win=1020 Len=0"
"179","5.271706","146.75.37.140","192.168.12.35","TLSv1.2","245","Application Data"
"180","5.271706","146.75.37.140","192.168.12.35","TLSv1.2","385","Application Data"
"181","5.272363","192.168.12.35","146.75.37.140","TCP","54","61013  >  443 [ACK] Seq=9027 Ack=81310 Win=1025 Len=0"
"182","5.285541","146.75.37.140","192.168.12.35","TLSv1.2","268","Application Data"
"183","5.285541","146.75.37.140","192.168.12.35","TLSv1.2","383","Application Data"
"184","5.285630","192.168.12.35","146.75.37.140","TLSv1.2","218","Application Data"
"185","5.286055","192.168.12.35","146.75.37.140","TCP","54","61013  >  443 [ACK] Seq=9027 Ack=81853 Win=1023 Len=0"
"186","5.289456","146.75.37.140","192.168.12.35","TLSv1.2","339","Application Data"
"187","5.291812","146.75.37.140","192.168.12.35","TCP","54","443  >  61034 [ACK] Seq=1 Ack=162 Win=424 Len=0"
"188","5.291812","146.75.37.140","192.168.12.35","TCP","54","443  >  61034 [ACK] Seq=1 Ack=201 Win=424 Len=0"
"189","5.291812","146.75.37.140","192.168.12.35","TLSv1.2","93","Application Data"
"190","5.291812","146.75.37.140","192.168.12.35","TLSv1.2","461","Application Data"
"191","5.291812","146.75.37.140","192.168.12.35","TLSv1.2","210","Application Data"
"192","5.291812","146.75.37.140","192.168.12.35","TCP","1430","443  >  61034 [ACK] Seq=196 Ack=201 Win=424 Len=1376 [TCP PDU reassembled in 194]"
"193","5.291812","146.75.37.140","192.168.12.35","TCP","1430","443  >  61034 [ACK] Seq=1572 Ack=201 Win=424 Len=1376 [TCP PDU reassembled in 194]"
"194","5.291812","146.75.37.140","192.168.12.35","TLSv1.2","75","Application Data"
"195","5.291812","146.75.37.140","192.168.12.35","TCP","1430","443  >  61034 [ACK] Seq=2969 Ack=201 Win=424 Len=1376 [TCP PDU reassembled in 201]"
"196","5.291812","146.75.37.140","192.168.12.35","TCP","1430","443  >  61034 [ACK] Seq=4345 Ack=201 Win=424 Len=1376 [TCP PDU reassembled in 201]"
"197","5.291812","146.75.37.140","192.168.12.35","TCP","1430","443  >  61034 [ACK] Seq=5721 Ack=201 Win=424 Len=1376 [TCP PDU reassembled in 201]"
"198","5.291812","146.75.37.140","192.168.12.35","TCP","1430","443  >  61034 [ACK] Seq=7097 Ack=201 Win=424 Len=1376 [TCP PDU reassembled in 201]"
"199","5.291812","146.75.37.140","192.168.12.35","TCP","1430","443  >  61034 [ACK] Seq=8473 Ack=201 Win=424 Len=1376 [TCP PDU reassembled in 201]"
"200","5.291812","146.75.37.140","192.168.12.35","TCP","1430","443  >  61034 [ACK] Seq=9849 Ack=201 Win=424 Len=1376 [TCP PDU reassembled in 201]"
"201","5.291812","146.75.37.140","192.168.12.35","TLSv1.2","55","Application Data"
"202","5.291812","146.75.37.140","192.168.12.35","TCP","1430","443  >  61034 [ACK] Seq=11226 Ack=201 Win=424 Len=1376 [TCP PDU reassembled in 208]"
"203","5.291812","146.75.37.140","192.168.12.35","TCP","1430","443  >  61034 [ACK] Seq=12602 Ack=201 Win=424 Len=1376 [TCP PDU reassembled in 208]"
"204","5.291812","146.75.37.140","192.168.12.35","TCP","1430","443  >  61034 [ACK] Seq=13978 Ack=201 Win=424 Len=1376 [TCP PDU reassembled in 208]"
"205","5.291812","146.75.37.140","192.168.12.35","TCP","1430","443  >  61034 [ACK] Seq=15354 Ack=201 Win=424 Len=1376 [TCP PDU reassembled in 208]"
"206","5.291812","146.75.37.140","192.168.12.35","TCP","1430","443  >  61034 [ACK] Seq=16730 Ack=201 Win=424 Len=1376 [TCP PDU reassembled in 208]"
"207","5.291812","146.75.37.140","192.168.12.35","TCP","1430","443  >  61034 [ACK] Seq=18106 Ack=201 Win=424 Len=1376 [TCP PDU reassembled in 208]"
"208","5.291812","146.75.37.140","192.168.12.35","TLSv1.2","1430","Application Data"
"209","5.291812","146.75.37.140","192.168.12.35","TCP","1430","443  >  61034 [ACK] Seq=20858 Ack=201 Win=424 Len=1376 [TCP PDU reassembled in 212]"
"210","5.291812","146.75.37.140","192.168.12.35","TCP","1430","443  >  61034 [ACK] Seq=22234 Ack=201 Win=424 Len=1376 [TCP PDU reassembled in 212]"
"211","5.291812","146.75.37.140","192.168.12.35","TCP","1430","443  >  61034 [ACK] Seq=23610 Ack=201 Win=424 Len=1376 [TCP PDU reassembled in 212]"
"212","5.291812","146.75.37.140","192.168.12.35","TLSv1.2","66","Application Data"
"213","5.291812","146.75.37.140","192.168.12.35","TCP","1430","443  >  61034 [ACK] Seq=24998 Ack=201 Win=424 Len=1376 [TCP PDU reassembled in 227]"
"214","5.291812","146.75.37.140","192.168.12.35","TCP","1430","443  >  61034 [ACK] Seq=26374 Ack=201 Win=424 Len=1376 [TCP PDU reassembled in 227]"
"215","5.292385","192.168.12.35","146.75.37.140","TCP","66","[TCP Dup ACK 175#1] 61034  >  443 [ACK] Seq=365 Ack=1 Win=8201 Len=0 SLE=11225 SRE=11226"
"216","5.292404","192.168.12.35","146.75.37.140","TCP","66","61034  >  443 [ACK] Seq=365 Ack=196 Win=8200 Len=0 SLE=11225 SRE=11226"
"217","5.292479","192.168.12.35","146.75.37.140","TCP","66","61034  >  443 [ACK] Seq=365 Ack=2948 Win=8201 Len=0 SLE=11225 SRE=11226"
"218","5.292543","192.168.12.35","146.75.37.140","TCP","54","61013  >  443 [ACK] Seq=9027 Ack=82545 Win=1020 Len=0"
"219","5.292572","192.168.12.35","146.75.37.140","TCP","66","61034  >  443 [ACK] Seq=365 Ack=2969 Win=8201 Len=0 SLE=11225 SRE=11226"
"220","5.292649","192.168.12.35","146.75.37.140","TCP","54","61034  >  443 [ACK] Seq=365 Ack=11226 Win=8201 Len=0"
"221","5.292703","192.168.12.35","146.75.37.140","TCP","54","61034  >  443 [ACK] Seq=365 Ack=24986 Win=8201 Len=0"
"222","5.292733","192.168.12.35","146.75.37.140","TCP","54","61034  >  443 [ACK] Seq=365 Ack=24998 Win=8201 Len=0"
"223","5.292761","192.168.12.35","146.75.37.140","TCP","54","61034  >  443 [ACK] Seq=365 Ack=27750 Win=8201 Len=0"
"224","5.292999","192.168.12.35","146.75.37.140","TLSv1.2","89","Application Data"
"225","5.312986","146.75.37.140","192.168.12.35","TCP","1430","443  >  61034 [ACK] Seq=27750 Ack=201 Win=424 Len=1376 [TCP PDU reassembled in 227]"
"226","5.312986","146.75.37.140","192.168.12.35","TCP","1430","443  >  61034 [ACK] Seq=29126 Ack=201 Win=424 Len=1376 [TCP PDU reassembled in 227]"
"227","5.312986","146.75.37.140","192.168.12.35","TLSv1.2","65","Application Data"
"228","5.312986","146.75.37.140","192.168.12.35","TCP","1430","443  >  61034 [ACK] Seq=30513 Ack=201 Win=424 Len=1376 [TCP PDU reassembled in 231]"
"229","5.312986","146.75.37.140","192.168.12.35","TCP","1430","443  >  61034 [ACK] Seq=31889 Ack=201 Win=424 Len=1376 [TCP PDU reassembled in 231]"
"230","5.312986","146.75.37.140","192.168.12.35","TCP","1430","443  >  61034 [ACK] Seq=33265 Ack=201 Win=424 Len=1376 [TCP PDU reassembled in 231]"
"231","5.312986","146.75.37.140","192.168.12.35","TLSv1.2","1430","Application Data"
"232","5.312986","146.75.37.140","192.168.12.35","TLSv1.2","1430","Application Data"
"233","5.312986","146.75.37.140","192.168.12.35","TCP","1430","443  >  61034 [ACK] Seq=37393 Ack=201 Win=424 Len=1376 [TCP PDU reassembled in 234]"
"234","5.312986","146.75.37.140","192.168.12.35","TLSv1.2","1430","Application Data"
"235","5.312986","146.75.37.140","192.168.12.35","TCP","1430","443  >  61034 [ACK] Seq=40145 Ack=201 Win=424 Len=1376 [TCP PDU reassembled in 236]"
"236","5.312986","146.75.37.140","192.168.12.35","TLSv1.2","1430","Application Data"
"237","5.312986","146.75.37.140","192.168.12.35","TCP","1430","443  >  61034 [ACK] Seq=42897 Ack=201 Win=424 Len=1376 [TCP PDU reassembled in 238]"
"238","5.312986","146.75.37.140","192.168.12.35","TLSv1.2","1430","Application Data"
"239","5.312986","146.75.37.140","192.168.12.35","TCP","1430","443  >  61034 [ACK] Seq=45649 Ack=201 Win=424 Len=1376 [TCP PDU reassembled in 240]"
"240","5.312986","146.75.37.140","192.168.12.35","TLSv1.2","1430","Application Data"
"241","5.312986","146.75.37.140","192.168.12.35","TLSv1.2","1430","Application Data"
"242","5.312986","146.75.37.140","192.168.12.35","TCP","1430","443  >  61034 [ACK] Seq=49777 Ack=201 Win=424 Len=1376 [TCP PDU reassembled in 248]"
"243","5.312986","146.75.37.140","192.168.12.35","TCP","1430","443  >  61034 [ACK] Seq=51153 Ack=201 Win=424 Len=1376 [TCP PDU reassembled in 248]"
"244","5.312986","146.75.37.140","192.168.12.35","TCP","1430","443  >  61034 [ACK] Seq=52529 Ack=201 Win=424 Len=1376 [TCP PDU reassembled in 248]"
"245","5.312986","146.75.37.140","192.168.12.35","TCP","1430","443  >  61034 [ACK] Seq=53905 Ack=201 Win=424 Len=1376 [TCP PDU reassembled in 248]"
"246","5.312986","146.75.37.140","192.168.12.35","TCP","1430","443  >  61034 [ACK] Seq=55281 Ack=201 Win=424 Len=1376 [TCP PDU reassembled in 248]"
"247","5.312986","146.75.37.140","192.168.12.35","TCP","1430","443  >  61034 [ACK] Seq=56657 Ack=201 Win=424 Len=1376 [TCP PDU reassembled in 248]"
"248","5.312986","146.75.37.140","192.168.12.35","TLSv1.2","195","Application Data"
"249","5.312986","146.75.37.140","192.168.12.35","TCP","1430","443  >  61034 [ACK] Seq=58174 Ack=201 Win=424 Len=1376 [TCP PDU reassembled in 251]"
"250","5.312986","146.75.37.140","192.168.12.35","TCP","1430","443  >  61034 [ACK] Seq=59550 Ack=201 Win=424 Len=1376 [TCP PDU reassembled in 251]"
"251","5.312986","146.75.37.140","192.168.12.35","TLSv1.2","1430","Application Data"
"252","5.312986","146.75.37.140","192.168.12.35","TCP","1430","443  >  61034 [ACK] Seq=62302 Ack=201 Win=424 Len=1376 [TCP PDU reassembled in 263]"
"253","5.312986","146.75.37.140","192.168.12.35","TCP","1430","443  >  61034 [ACK] Seq=63678 Ack=201 Win=424 Len=1376 [TCP PDU reassembled in 263]"
"254","5.312986","146.75.37.140","192.168.12.35","TCP","1430","443  >  61034 [ACK] Seq=65054 Ack=201 Win=424 Len=1376 [TCP PDU reassembled in 263]"
"255","5.312986","146.75.37.140","192.168.12.35","TCP","1430","443  >  61034 [ACK] Seq=66430 Ack=201 Win=424 Len=1376 [TCP PDU reassembled in 263]"
"256","5.312986","146.75.37.140","192.168.12.35","TCP","1430","443  >  61034 [ACK] Seq=67806 Ack=201 Win=424 Len=1376 [TCP PDU reassembled in 263]"
"257","5.313779","146.75.37.140","192.168.12.35","TCP","1430","443  >  61034 [ACK] Seq=69182 Ack=201 Win=424 Len=1376 [TCP PDU reassembled in 263]"
"258","5.313779","146.75.37.140","192.168.12.35","TCP","1430","443  >  61034 [ACK] Seq=70558 Ack=201 Win=424 Len=1376 [TCP PDU reassembled in 263]"
"259","5.313779","146.75.37.140","192.168.12.35","TCP","1430","443  >  61034 [ACK] Seq=71934 Ack=201 Win=424 Len=1376 [TCP PDU reassembled in 263]"
"260","5.313779","146.75.37.140","192.168.12.35","TCP","1430","443  >  61034 [ACK] Seq=73310 Ack=201 Win=424 Len=1376 [TCP PDU reassembled in 263]"
"261","5.313779","146.75.37.140","192.168.12.35","TCP","1430","443  >  61034 [ACK] Seq=74686 Ack=201 Win=424 Len=1376 [TCP PDU reassembled in 263]"
"262","5.313779","146.75.37.140","192.168.12.35","TCP","1430","443  >  61034 [ACK] Seq=76062 Ack=201 Win=424 Len=1376 [TCP PDU reassembled in 263]"
"263","5.313779","146.75.37.140","192.168.12.35","TLSv1.2","1430","Application Data, Application Data"
"264","5.313779","146.75.37.140","192.168.12.35","TCP","1430","443  >  61034 [ACK] Seq=78814 Ack=201 Win=424 Len=1376 [TCP PDU reassembled in 275]"
"265","5.313779","146.75.37.140","192.168.12.35","TCP","1430","443  >  61034 [ACK] Seq=80190 Ack=201 Win=424 Len=1376 [TCP PDU reassembled in 275]"
"266","5.313779","146.75.37.140","192.168.12.35","TCP","1430","443  >  61034 [ACK] Seq=81566 Ack=201 Win=424 Len=1376 [TCP PDU reassembled in 275]"
"267","5.313779","146.75.37.140","192.168.12.35","TCP","1430","443  >  61034 [ACK] Seq=82942 Ack=201 Win=424 Len=1376 [TCP PDU reassembled in 275]"
"268","5.313779","146.75.37.140","192.168.12.35","TCP","1430","443  >  61034 [ACK] Seq=84318 Ack=201 Win=424 Len=1376 [TCP PDU reassembled in 275]"
"269","5.313779","146.75.37.140","192.168.12.35","TCP","1430","443  >  61034 [ACK] Seq=85694 Ack=201 Win=424 Len=1376 [TCP PDU reassembled in 275]"
"270","5.313779","146.75.37.140","192.168.12.35","TCP","1430","443  >  61034 [PSH, ACK] Seq=87070 Ack=201 Win=424 Len=1376 [TCP PDU reassembled in 275]"
"271","5.313779","146.75.37.140","192.168.12.35","TCP","1430","443  >  61034 [ACK] Seq=88446 Ack=201 Win=424 Len=1376 [TCP PDU reassembled in 275]"
"272","5.313779","146.75.37.140","192.168.12.35","TCP","1430","443  >  61034 [ACK] Seq=89822 Ack=201 Win=424 Len=1376 [TCP PDU reassembled in 275]"
"273","5.313779","146.75.37.140","192.168.12.35","TCP","1430","443  >  61034 [ACK] Seq=91198 Ack=201 Win=424 Len=1376 [TCP PDU reassembled in 275]"
"274","5.313779","146.75.37.140","192.168.12.35","TCP","1430","443  >  61034 [ACK] Seq=92574 Ack=201 Win=424 Len=1376 [TCP PDU reassembled in 275]"
"275","5.313779","146.75.37.140","192.168.12.35","TLSv1.2","1430","Application Data, Application Data"
"276","5.313779","146.75.37.140","192.168.12.35","TCP","1430","443  >  61034 [ACK] Seq=95326 Ack=201 Win=424 Len=1376 [TCP PDU reassembled in 287]"
"277","5.313779","146.75.37.140","192.168.12.35","TCP","1430","443  >  61034 [ACK] Seq=96702 Ack=201 Win=424 Len=1376 [TCP PDU reassembled in 287]"
"278","5.313779","146.75.37.140","192.168.12.35","TCP","1430","443  >  61034 [ACK] Seq=98078 Ack=201 Win=424 Len=1376 [TCP PDU reassembled in 287]"
"279","5.313779","146.75.37.140","192.168.12.35","TCP","1430","443  >  61034 [ACK] Seq=99454 Ack=201 Win=424 Len=1376 [TCP PDU reassembled in 287]"
"280","5.313779","146.75.37.140","192.168.12.35","TCP","1430","443  >  61034 [ACK] Seq=100830 Ack=201 Win=424 Len=1376 [TCP PDU reassembled in 287]"
"281","5.313779","146.75.37.140","192.168.12.35","TCP","1430","443  >  61034 [ACK] Seq=102206 Ack=201 Win=424 Len=1376 [TCP PDU reassembled in 287]"
"282","5.313779","146.75.37.140","192.168.12.35","TCP","1430","443  >  61034 [ACK] Seq=103582 Ack=201 Win=424 Len=1376 [TCP PDU reassembled in 287]"
"283","5.313779","146.75.37.140","192.168.12.35","TCP","1430","443  >  61034 [ACK] Seq=104958 Ack=201 Win=424 Len=1376 [TCP PDU reassembled in 287]"
"284","5.313779","146.75.37.140","192.168.12.35","TCP","1430","443  >  61034 [ACK] Seq=106334 Ack=201 Win=424 Len=1376 [TCP PDU reassembled in 287]"
"285","5.313779","146.75.37.140","192.168.12.35","TCP","1430","443  >  61034 [ACK] Seq=107710 Ack=201 Win=424 Len=1376 [TCP PDU reassembled in 287]"
"286","5.313779","146.75.37.140","192.168.12.35","TCP","1430","443  >  61034 [ACK] Seq=109086 Ack=201 Win=424 Len=1376 [TCP PDU reassembled in 287]"
"287","5.313779","146.75.37.140","192.168.12.35","TLSv1.2","1430","Application Data, Application Data"
"288","5.313779","146.75.37.140","192.168.12.35","TCP","1430","443  >  61034 [ACK] Seq=111838 Ack=201 Win=424 Len=1376 [TCP PDU reassembled in 300]"
"289","5.313964","192.168.12.35","146.75.37.140","TCP","54","61034  >  443 [ACK] Seq=400 Ack=30502 Win=8201 Len=0"
"290","5.314067","146.75.37.140","192.168.12.35","TCP","1430","443  >  61034 [ACK] Seq=113214 Ack=201 Win=424 Len=1376 [TCP PDU reassembled in 300]"
"291","5.314067","146.75.37.140","192.168.12.35","TCP","1430","443  >  61034 [ACK] Seq=114590 Ack=201 Win=424 Len=1376 [TCP PDU reassembled in 300]"
"292","5.314067","146.75.37.140","192.168.12.35","TCP","1430","443  >  61034 [ACK] Seq=115966 Ack=201 Win=424 Len=1376 [TCP PDU reassembled in 300]"
"293","5.314067","146.75.37.140","192.168.12.35","TCP","1430","443  >  61034 [PSH, ACK] Seq=117342 Ack=201 Win=424 Len=1376 [TCP PDU reassembled in 300]"
"294","5.314067","146.75.37.140","192.168.12.35","TCP","1430","443  >  61034 [ACK] Seq=118718 Ack=201 Win=424 Len=1376 [TCP PDU reassembled in 300]"
"295","5.314067","146.75.37.140","192.168.12.35","TCP","1430","443  >  61034 [ACK] Seq=120094 Ack=201 Win=424 Len=1376 [TCP PDU reassembled in 300]"
"296","5.314067","146.75.37.140","192.168.12.35","TCP","1430","443  >  61034 [ACK] Seq=121470 Ack=201 Win=424 Len=1376 [TCP PDU reassembled in 300]"
"297","5.314067","146.75.37.140","192.168.12.35","TCP","1430","443  >  61034 [ACK] Seq=122846 Ack=201 Win=424 Len=1376 [TCP PDU reassembled in 300]"
"298","5.314067","146.75.37.140","192.168.12.35","TCP","1430","443  >  61034 [ACK] Seq=124222 Ack=201 Win=424 Len=1376 [TCP PDU reassembled in 300]"
"299","5.314067","146.75.37.140","192.168.12.35","TCP","1430","443  >  61034 [ACK] Seq=125598 Ack=201 Win=424 Len=1376 [TCP PDU reassembled in 300]"
"300","5.314067","146.75.37.140","192.168.12.35","TLSv1.2","1430","Application Data, Application Data"
"301","5.314067","146.75.37.140","192.168.12.35","TCP","1430","443  >  61034 [ACK] Seq=128350 Ack=201 Win=424 Len=1376 [TCP PDU reassembled in 312]"
"302","5.314067","146.75.37.140","192.168.12.35","TCP","1430","443  >  61034 [ACK] Seq=129726 Ack=201 Win=424 Len=1376 [TCP PDU reassembled in 312]"
"303","5.314067","146.75.37.140","192.168.12.35","TCP","1430","443  >  61034 [ACK] Seq=131102 Ack=201 Win=424 Len=1376 [TCP PDU reassembled in 312]"
"304","5.314067","146.75.37.140","192.168.12.35","TCP","1430","443  >  61034 [ACK] Seq=132478 Ack=201 Win=424 Len=1376 [TCP PDU reassembled in 312]"
"305","5.314067","146.75.37.140","192.168.12.35","TCP","1430","443  >  61034 [ACK] Seq=133854 Ack=201 Win=424 Len=1376 [TCP PDU reassembled in 312]"
"306","5.314067","146.75.37.140","192.168.12.35","TCP","1430","443  >  61034 [ACK] Seq=135230 Ack=201 Win=424 Len=1376 [TCP PDU reassembled in 312]"
"307","5.314067","146.75.37.140","192.168.12.35","TCP","1430","443  >  61034 [ACK] Seq=136606 Ack=201 Win=424 Len=1376 [TCP PDU reassembled in 312]"
"308","5.314067","146.75.37.140","192.168.12.35","TCP","1430","443  >  61034 [ACK] Seq=137982 Ack=201 Win=424 Len=1376 [TCP PDU reassembled in 312]"
"309","5.314067","146.75.37.140","192.168.12.35","TCP","1430","443  >  61034 [ACK] Seq=139358 Ack=201 Win=424 Len=1376 [TCP PDU reassembled in 312]"
"310","5.314067","146.75.37.140","192.168.12.35","TCP","1430","443  >  61034 [ACK] Seq=140734 Ack=201 Win=424 Len=1376 [TCP PDU reassembled in 312]"
"311","5.314067","146.75.37.140","192.168.12.35","TCP","1430","443  >  61034 [ACK] Seq=142110 Ack=201 Win=424 Len=1376 [TCP PDU reassembled in 312]"
"312","5.314067","146.75.37.140","192.168.12.35","TLSv1.2","1430","Application Data, Application Data"
"313","5.314067","146.75.37.140","192.168.12.35","TCP","1430","443  >  61034 [ACK] Seq=144862 Ack=201 Win=424 Len=1376 [TCP PDU reassembled in 326]"
"314","5.314067","146.75.37.140","192.168.12.35","TCP","1430","443  >  61034 [ACK] Seq=146238 Ack=201 Win=424 Len=1376 [TCP PDU reassembled in 326]"
"315","5.314067","146.75.37.140","192.168.12.35","TCP","1430","443  >  61034 [PSH, ACK] Seq=147614 Ack=201 Win=424 Len=1376 [TCP PDU reassembled in 326]"
"316","5.314067","146.75.37.140","192.168.12.35","TCP","1430","443  >  61034 [ACK] Seq=148990 Ack=201 Win=424 Len=1376 [TCP PDU reassembled in 326]"
"317","5.314067","146.75.37.140","192.168.12.35","TCP","1430","443  >  61034 [ACK] Seq=150366 Ack=201 Win=424 Len=1376 [TCP PDU reassembled in 326]"
"318","5.314067","146.75.37.140","192.168.12.35","TCP","1430","443  >  61034 [ACK] Seq=151742 Ack=201 Win=424 Len=1376 [TCP PDU reassembled in 326]"
"319","5.314067","146.75.37.140","192.168.12.35","TCP","1430","443  >  61034 [ACK] Seq=153118 Ack=201 Win=424 Len=1376 [TCP PDU reassembled in 326]"
"320","5.314067","146.75.37.140","192.168.12.35","TCP","1430","443  >  61034 [ACK] Seq=154494 Ack=201 Win=424 Len=1376 [TCP PDU reassembled in 326]"
"321","5.314067","146.75.37.140","192.168.12.35","TCP","1430","443  >  61034 [ACK] Seq=155870 Ack=201 Win=424 Len=1376 [TCP PDU reassembled in 326]"
"322","5.314366","192.168.12.35","146.75.37.140","TCP","54","61034  >  443 [ACK] Seq=400 Ack=58033 Win=8201 Len=0"
"323","5.314522","192.168.12.35","146.75.37.140","TCP","54","61034  >  443 [ACK] Seq=400 Ack=58174 Win=8200 Len=0"
"324","5.314559","146.75.37.140","192.168.12.35","TCP","1430","443  >  61034 [ACK] Seq=157246 Ack=201 Win=424 Len=1376 [TCP PDU reassembled in 326]"
"325","5.314559","146.75.37.140","192.168.12.35","TCP","1430","443  >  61034 [ACK] Seq=158622 Ack=201 Win=424 Len=1376 [TCP PDU reassembled in 326]"
"326","5.314559","146.75.37.140","192.168.12.35","TLSv1.2","1430","Application Data"
"327","5.314559","146.75.37.140","192.168.12.35","TCP","1430","443  >  61034 [ACK] Seq=161374 Ack=201 Win=424 Len=1376 [TCP PDU reassembled in 338]"
"328","5.314559","146.75.37.140","192.168.12.35","TCP","1430","443  >  61034 [ACK] Seq=162750 Ack=201 Win=424 Len=1376 [TCP PDU reassembled in 338]"
"329","5.314559","146.75.37.140","192.168.12.35","TCP","1430","443  >  61034 [ACK] Seq=164126 Ack=201 Win=424 Len=1376 [TCP PDU reassembled in 338]"
"330","5.314559","146.75.37.140","192.168.12.35","TCP","1430","443  >  61034 [ACK] Seq=165502 Ack=201 Win=424 Len=1376 [TCP PDU reassembled in 338]"
"331","5.314559","146.75.37.140","192.168.12.35","TCP","1430","443  >  61034 [ACK] Seq=166878 Ack=201 Win=424 Len=1376 [TCP PDU reassembled in 338]"
"332","5.314559","146.75.37.140","192.168.12.35","TCP","1430","443  >  61034 [ACK] Seq=168254 Ack=201 Win=424 Len=1376 [TCP PDU reassembled in 338]"
"333","5.314559","146.75.37.140","192.168.12.35","TCP","1430","443  >  61034 [ACK] Seq=169630 Ack=201 Win=424 Len=1376 [TCP PDU reassembled in 338]"
"334","5.314559","146.75.37.140","192.168.12.35","TCP","1430","443  >  61034 [ACK] Seq=171006 Ack=201 Win=424 Len=1376 [TCP PDU reassembled in 338]"
