"No.","Time","Source","Destination","Protocol","Length","Info"
"1","0.000000","192.168.12.35","146.75.37.140","TLSv1.2","3235","Application Data"
"2","0.000096","192.168.12.35","146.75.37.140","TLSv1.2","3359","Application Data"
"3","0.000124","192.168.12.35","146.75.37.140","TLSv1.2","1800","Application Data"
"4","0.126558","146.75.37.140","192.168.12.35","TCP","54","443  >  61013 [ACK] Seq=1 Ack=1397 Win=5496 Len=0"
"5","0.144460","146.75.37.140","192.168.12.35","TCP","54","443  >  61013 [ACK] Seq=1 Ack=2793 Win=5502 Len=0"
"6","0.144460","146.75.37.140","192.168.12.35","TCP","54","443  >  61013 [ACK] Seq=1 Ack=3182 Win=5502 Len=0"
"7","0.165859","146.75.37.140","192.168.12.35","TCP","54","443  >  61013 [ACK] Seq=1 Ack=4578 Win=5507 Len=0"
"8","0.187528","146.75.37.140","192.168.12.35","TCP","54","443  >  61013 [ACK] Seq=1 Ack=5974 Win=5513 Len=0"
"9","0.187528","146.75.37.140","192.168.12.35","TCP","1430","443  >  61013 [ACK] Seq=1 Ack=5974 Win=5513 Len=1376 [TCP PDU reassembled in 13]"
"10","0.187528","146.75.37.140","192.168.12.35","TCP","1430","443  >  61013 [ACK] Seq=1377 Ack=5974 Win=5513 Len=1376 [TCP PDU reassembled in 13]"
"11","0.187528","146.75.37.140","192.168.12.35","TCP","1430","443  >  61013 [PSH, ACK] Seq=2753 Ack=5974 Win=5513 Len=1376 [TCP PDU reassembled in 13]"
"12","0.187781","192.168.12.35","146.75.37.140","TCP","54","61013  >  443 [ACK] Seq=8233 Ack=4129 Win=1025 Len=0"
"13","0.190309","146.75.37.140","192.168.12.35","TLSv1.2","553","Application Data"
"14","0.190309","146.75.37.140","192.168.12.35","TCP","54","443  >  61013 [ACK] Seq=4628 Ack=6487 Win=5513 Len=0"
"15","0.190309","146.75.37.140","192.168.12.35","TCP","1430","443  >  61013 [ACK] Seq=4628 Ack=6487 Win=5513 Len=1376 [TCP PDU reassembled in 28]"
"16","0.190309","146.75.37.140","192.168.12.35","TCP","1430","443  >  61013 [ACK] Seq=6004 Ack=6487 Win=5513 Len=1376 [TCP PDU reassembled in 28]"
"17","0.190309","146.75.37.140","192.168.12.35","TCP","1430","443  >  61013 [PSH, ACK] Seq=7380 Ack=6487 Win=5513 Len=1376 [TCP PDU reassembled in 28]"
"18","0.190309","146.75.37.140","192.168.12.35","TCP","1430","443  >  61013 [ACK] Seq=8756 Ack=6487 Win=5513 Len=1376 [TCP PDU reassembled in 28]"
"19","0.190309","146.75.37.140","192.168.12.35","TCP","1430","443  >  61013 [ACK] Seq=10132 Ack=6487 Win=5513 Len=1376 [TCP PDU reassembled in 28]"
"20","0.190309","146.75.37.140","192.168.12.35","TCP","1430","443  >  61013 [PSH, ACK] Seq=11508 Ack=6487 Win=5513 Len=1376 [TCP PDU reassembled in 28]"
"21","0.190739","192.168.12.35","146.75.37.140","TCP","54","61013  >  443 [ACK] Seq=8233 Ack=4628 Win=1023 Len=0"
"22","0.190836","192.168.12.35","146.75.37.140","TCP","54","61013  >  443 [ACK] Seq=8233 Ack=12884 Win=1025 Len=0"
"23","0.196138","146.75.37.140","192.168.12.35","TCP","1430","443  >  61013 [ACK] Seq=12884 Ack=6487 Win=5513 Len=1376 [TCP PDU reassembled in 28]"
"24","0.197647","192.168.12.35","146.75.37.140","TLSv1.2","89","Application Data"
"25","0.207285","146.75.37.140","192.168.12.35","TCP","1430","443  >  61013 [ACK] Seq=14260 Ack=6487 Win=5513 Len=1376 [TCP PDU reassembled in 28]"
"26","0.207285","146.75.37.140","192.168.12.35","TCP","1430","443  >  61013 [PSH, ACK] Seq=15636 Ack=6487 Win=5513 Len=1376 [TCP PDU reassembled in 28]"
"27","0.207285","146.75.37.140","192.168.12.35","TCP","1430","443  >  61013 [ACK] Seq=17012 Ack=6487 Win=5513 Len=1376 [TCP PDU reassembled in 28]"
"28","0.207285","146.75.37.140","192.168.12.35","TLSv1.2","1133","Application Data"
"29","0.207285","146.75.37.140","192.168.12.35","TCP","1430","443  >  61013 [ACK] Seq=19467 Ack=6487 Win=5513 Len=1376 [TCP PDU reassembled in 44]"
"30","0.207285","146.75.37.140","192.168.12.35","TCP","1430","443  >  61013 [ACK] Seq=20843 Ack=6487 Win=5513 Len=1376 [TCP PDU reassembled in 44]"
"31","0.207285","146.75.37.140","192.168.12.35","TCP","1430","443  >  61013 [PSH, ACK] Seq=22219 Ack=6487 Win=5513 Len=1376 [TCP PDU reassembled in 44]"
"32","0.207285","146.75.37.140","192.168.12.35","TCP","1430","443  >  61013 [ACK] Seq=23595 Ack=6487 Win=5513 Len=1376 [TCP PDU reassembled in 44]"
"33","0.207285","146.75.37.140","192.168.12.35","TCP","1430","443  >  61013 [ACK] Seq=24971 Ack=6487 Win=5513 Len=1376 [TCP PDU reassembled in 44]"
"34","0.207285","146.75.37.140","192.168.12.35","TCP","1430","443  >  61013 [PSH, ACK] Seq=26347 Ack=6487 Win=5513 Len=1376 [TCP PDU reassembled in 44]"
"35","0.207681","192.168.12.35","146.75.37.140","TCP","54","61013  >  443 [ACK] Seq=8268 Ack=18388 Win=1025 Len=0"
"36","0.207880","192.168.12.35","146.75.37.140","TCP","54","61013  >  443 [ACK] Seq=8268 Ack=19467 Win=1020 Len=0"
"37","0.207952","192.168.12.35","146.75.37.140","TCP","54","61013  >  443 [ACK] Seq=8268 Ack=27723 Win=1025 Len=0"
"38","0.217667","192.168.12.35","146.75.37.140","UDP","95","54767  >  443 Len=53"
"39","0.217538","146.75.37.140","192.168.12.35","TCP","1430","443  >  61013 [ACK] Seq=27723 Ack=6487 Win=5513 Len=1376 [TCP PDU reassembled in 44]"
"40","0.217538","146.75.37.140","192.168.12.35","TCP","1430","443  >  61013 [ACK] Seq=29099 Ack=6487 Win=5513 Len=1376 [TCP PDU reassembled in 44]"
"41","0.217538","146.75.37.140","192.168.12.35","TCP","1430","443  >  61013 [PSH, ACK] Seq=30475 Ack=6487 Win=5513 Len=1376 [TCP PDU reassembled in 44]"
"42","0.217538","146.75.37.140","192.168.12.35","TCP","1430","443  >  61013 [ACK] Seq=31851 Ack=6487 Win=5513 Len=1376 [TCP PDU reassembled in 44]"
"43","0.217538","146.75.37.140","192.168.12.35","TCP","1430","443  >  61013 [ACK] Seq=33227 Ack=6487 Win=5513 Len=1376 [TCP PDU reassembled in 44]"
"44","0.217538","146.75.37.140","192.168.12.35","TLSv1.2","545","Application Data"
"45","0.217538","146.75.37.140","192.168.12.35","TCP","1430","443  >  61013 [ACK] Seq=35094 Ack=6487 Win=5513 Len=1376 [TCP PDU reassembled in 56]"
"46","0.217538","146.75.37.140","192.168.12.35","TCP","1430","443  >  61013 [ACK] Seq=36470 Ack=6487 Win=5513 Len=1376 [TCP PDU reassembled in 56]"
"47","0.217538","146.75.37.140","192.168.12.35","TCP","1430","443  >  61013 [PSH, ACK] Seq=37846 Ack=6487 Win=5513 Len=1376 [TCP PDU reassembled in 56]"
"48","0.217538","146.75.37.140","192.168.12.35","TCP","1430","443  >  61013 [ACK] Seq=39222 Ack=6487 Win=5513 Len=1376 [TCP PDU reassembled in 56]"
"49","0.217538","146.75.37.140","192.168.12.35","TCP","1430","443  >  61013 [ACK] Seq=40598 Ack=6487 Win=5513 Len=1376 [TCP PDU reassembled in 56]"
"50","0.217538","146.75.37.140","192.168.12.35","TCP","1430","443  >  61013 [PSH, ACK] Seq=41974 Ack=6487 Win=5513 Len=1376 [TCP PDU reassembled in 56]"
"51","0.217538","146.75.37.140","192.168.12.35","TCP","1430","443  >  61013 [ACK] Seq=43350 Ack=6487 Win=5513 Len=1376 [TCP PDU reassembled in 56]"
"52","0.217538","146.75.37.140","192.168.12.35","TCP","1430","443  >  61013 [ACK] Seq=44726 Ack=6487 Win=5513 Len=1376 [TCP PDU reassembled in 56]"
"53","0.217538","146.75.37.140","192.168.12.35","TCP","1430","443  >  61013 [PSH, ACK] Seq=46102 Ack=6487 Win=5513 Len=1376 [TCP PDU reassembled in 56]"
"54","0.217538","146.75.37.140","192.168.12.35","TCP","1430","443  >  61013 [ACK] Seq=47478 Ack=6487 Win=5513 Len=1376 [TCP PDU reassembled in 56]"
"55","0.217538","146.75.37.140","192.168.12.35","TCP","1430","443  >  61013 [ACK] Seq=48854 Ack=6487 Win=5513 Len=1376 [TCP PDU reassembled in 56]"
"56","0.217538","146.75.37.140","192.168.12.35","TLSv1.2","1430","Application Data"
"57","0.217538","146.75.37.140","192.168.12.35","TCP","1430","443  >  61013 [ACK] Seq=51606 Ack=6487 Win=5513 Len=1376 [TCP PDU reassembled in 60]"
"58","0.217538","146.75.37.140","192.168.12.35","TCP","1430","443  >  61013 [ACK] Seq=52982 Ack=6487 Win=5513 Len=1376 [TCP PDU reassembled in 60]"
"59","0.217538","146.75.37.140","192.168.12.35","TCP","1430","443  >  61013 [PSH, ACK] Seq=54358 Ack=6487 Win=5513 Len=1376 [TCP PDU reassembled in 60]"
"60","0.217538","146.75.37.140","192.168.12.35","TLSv1.2","223","Application Data"
"61","0.217538","146.75.37.140","192.168.12.35","TLSv1.2","1068","Application Data"
"62","0.217538","146.75.37.140","192.168.12.35","TLSv1.2","1191","Application Data"
"63","0.217538","146.75.37.140","192.168.12.35","TCP","54","443  >  61013 [ACK] Seq=58054 Ack=8233 Win=5518 Len=0"
"64","0.217538","146.75.37.140","192.168.12.35","TCP","1430","443  >  61013 [ACK] Seq=58054 Ack=8233 Win=5518 Len=1376 [TCP PDU reassembled in 66]"
"65","0.217538","146.75.37.140","192.168.12.35","TCP","1430","443  >  61013 [ACK] Seq=59430 Ack=8233 Win=5518 Len=1376 [TCP PDU reassembled in 66]"
"66","0.217538","146.75.37.140","192.168.12.35","TLSv1.2","1107","Application Data"
"67","0.217538","146.75.37.140","192.168.12.35","TLSv1.2","1423","Application Data"
"68","0.217538","146.75.37.140","192.168.12.35","TLSv1.2","708","Application Data"
"69","0.217538","146.75.37.140","192.168.12.35","TLSv1.2","174","Application Data"
"70","0.217538","146.75.37.140","192.168.12.35","TLSv1.2","677","Application Data"
"71","0.219181","192.168.12.35","146.75.37.140","TCP","54","61013  >  443 [ACK] Seq=8268 Ack=34603 Win=1025 Len=0"
"72","0.219224","192.168.12.35","146.75.37.140","TCP","54","61013  >  443 [ACK] Seq=8268 Ack=35094 Win=1023 Len=0"
"73","0.219329","192.168.12.35","146.75.37.140","TCP","54","61013  >  443 [ACK] Seq=8268 Ack=55734 Win=1025 Len=0"
"74","0.219404","192.168.12.35","146.75.37.140","TCP","54","61013  >  443 [ACK] Seq=8268 Ack=55903 Win=1024 Len=0"
"75","0.219359","146.75.37.140","192.168.12.35","TLSv1.2","304","Application Data"
"76","0.219359","146.75.37.140","192.168.12.35","TLSv1.2","100","Application Data"
"77","0.219359","146.75.37.140","192.168.12.35","TLSv1.2","432","Application Data"
"78","0.219359","146.75.37.140","192.168.12.35","TLSv1.2","93","Application Data"
"79","0.219359","146.75.37.140","192.168.12.35","TLSv1.2","147","Application Data"
"80","0.219359","146.75.37.140","192.168.12.35","TLSv1.2","405","Application Data"
"81","0.219359","146.75.37.140","192.168.12.35","TLSv1.2","156","Application Data"
"82","0.219359","146.75.37.140","192.168.12.35","TLSv1.2","119","Application Data"
"83","0.219359","146.75.37.140","192.168.12.35","TLSv1.2","108","Application Data"
"84","0.219359","146.75.37.140","192.168.12.35","TLSv1.2","93","Application Data"
"85","0.219359","146.75.37.140","192.168.12.35","TLSv1.2","198","Application Data"
"86","0.219359","146.75.37.140","192.168.12.35","TLSv1.2","123","Application Data"
"87","0.219359","146.75.37.140","192.168.12.35","TLSv1.2","107","Application Data"
"88","0.219359","146.75.37.140","192.168.12.35","TLSv1.2","125","Application Data"
"89","0.219359","146.75.37.140","192.168.12.35","TLSv1.2","128","Application Data"
"90","0.219359","146.75.37.140","192.168.12.35","TLSv1.2","157","Application Data"
"91","0.219359","146.75.37.140","192.168.12.35","TLSv1.2","94","Application Data"
"92","0.219359","146.75.37.140","192.168.12.35","TLSv1.2","129","Application Data"
"93","0.219359","146.75.37.140","192.168.12.35","TLSv1.2","395","Application Data"
"94","0.219359","146.75.37.140","192.168.12.35","TLSv1.2","200","Application Data"
"95","0.219359","146.75.37.140","192.168.12.35","TLSv1.2","131","Application Data"
"96","0.219359","146.75.37.140","192.168.12.35","TLSv1.2","104","Application Data"
"97","0.219359","146.75.37.140","192.168.12.35","TLSv1.2","156","Application Data"
"98","0.219359","146.75.37.140","192.168.12.35","TLSv1.2","136","Application Data"
"99","0.219359","146.75.37.140","192.168.12.35","TLSv1.2","104","Application Data"
"100","0.219359","146.75.37.140","192.168.12.35","TLSv1.2","291","Application Data"
"101","0.219359","146.75.37.140","192.168.12.35","TLSv1.2","217","Application Data"
"102","0.219359","146.75.37.140","192.168.12.35","TLSv1.2","176","Application Data"
"103","0.219359","146.75.37.140","192.168.12.35","TLSv1.2","108","Application Data"
"104","0.219601","192.168.12.35","146.75.37.140","TCP","54","61013  >  443 [ACK] Seq=8268 Ack=58054 Win=1025 Len=0"
"105","0.219770","192.168.12.35","146.75.37.140","TCP","54","61013  >  443 [ACK] Seq=8268 Ack=60806 Win=1025 Len=0"
"106","0.220347","192.168.12.35","146.75.37.140","TCP","54","61013  >  443 [ACK] Seq=8268 Ack=63228 Win=1025 Len=0"
"107","0.220453","192.168.12.35","146.75.37.140","TCP","54","61013  >  443 [ACK] Seq=8268 Ack=64002 Win=1022 Len=0"
"108","0.220594","192.168.12.35","146.75.37.140","TCP","54","61013  >  443 [ACK] Seq=8268 Ack=64625 Win=1025 Len=0"
"109","0.220676","192.168.12.35","146.75.37.140","TCP","54","61013  >  443 [ACK] Seq=8268 Ack=64875 Win=1024 Len=0"
"110","0.220771","192.168.12.35","146.75.37.140","TCP","54","61013  >  443 [ACK] Seq=8268 Ack=65299 Win=1022 Len=0"
"111","0.220870","192.168.12.35","146.75.37.140","TCP","54","61013  >  443 [ACK] Seq=8268 Ack=65431 Win=1022 Len=0"
"112","0.220962","192.168.12.35","146.75.37.140","TCP","54","61013  >  443 [ACK] Seq=8268 Ack=65884 Win=1020 Len=0"
"113","0.221057","192.168.12.35","146.75.37.140","TCP","54","61013  >  443 [ACK] Seq=8268 Ack=66003 Win=1019 Len=0"
"114","0.221128","192.168.12.35","146.75.37.140","TCP","54","61013  >  443 [ACK] Seq=8268 Ack=66042 Win=1025 Len=0"
"115","0.221177","192.168.12.35","146.75.37.140","TCP","54","61013  >  443 [ACK] Seq=8268 Ack=66186 Win=1024 Len=0"
"116","0.221273","192.168.12.35","146.75.37.140","TCP","54","61013  >  443 [ACK] Seq=8268 Ack=66308 Win=1024 Len=0"
"117","0.221335","192.168.12.35","146.75.37.140","TCP","54","61013  >  443 [ACK] Seq=8268 Ack=66453 Win=1023 Len=0"
"118","0.221433","192.168.12.35","146.75.37.140","TCP","54","61013  >  443 [ACK] Seq=8268 Ack=66596 Win=1023 Len=0"
"119","0.221489","192.168.12.35","146.75.37.140","TCP","54","61013  >  443 [ACK] Seq=8268 Ack=67012 Win=1021 Len=0"
"120","0.221792","192.168.12.35","146.75.37.140","TCP","54","61013  >  443 [ACK] Seq=8268 Ack=67235 Win=1020 Len=0"
"121","0.221901","192.168.12.35","146.75.37.140","TCP","54","61013  >  443 [ACK] Seq=8268 Ack=67387 Win=1019 Len=0"
"122","0.221997","192.168.12.35","146.75.37.140","TCP","54","61013  >  443 [ACK] Seq=8268 Ack=67469 Win=1025 Len=0"
"123","0.222056","192.168.12.35","146.75.37.140","TCP","54","61013  >  443 [ACK] Seq=8268 Ack=67519 Win=1024 Len=0"
"124","0.222127","192.168.12.35","146.75.37.140","TCP","54","61013  >  443 [ACK] Seq=8268 Ack=67919 Win=1023 Len=0"
"125","0.222184","192.168.12.35","146.75.37.140","TCP","54","61013  >  443 [ACK] Seq=8268 Ack=68095 Win=1022 Len=0"
"126","0.237412","146.75.37.140","192.168.12.35","TCP","54","443  >  61013 [ACK] Seq=68095 Ack=8268 Win=5518 Len=0"
"127","0.237412","146.75.37.140","192.168.12.35","TCP","1430","443  >  61013 [ACK] Seq=68095 Ack=8268 Win=5518 Len=1376 [TCP PDU reassembled in 128]"
"128","0.237412","146.75.37.140","192.168.12.35","TLSv1.2","469","Application Data"
"129","0.237412","146.75.37.140","192.168.12.35","UDP","67","443  >  54767 Len=25"
"130","0.237858","192.168.12.35","146.75.37.140","TCP","54","61013  >  443 [ACK] Seq=8268 Ack=69886 Win=1025 Len=0"
"131","0.242231","146.75.37.140","192.168.12.35","TLSv1.2","87","Application Data"
"132","0.262139","192.168.12.35","146.75.37.140","UDP","84","54767  >  443 Len=42"
"133","0.265965","146.75.37.140","192.168.12.35","UDP","67","443  >  54767 Len=25"
"134","0.293017","192.168.12.35","146.75.37.140","TCP","54","61013  >  443 [ACK] Seq=8268 Ack=69919 Win=1025 Len=0"
"135","0.807541","146.75.37.140","192.168.12.35","TLSv1.2","564","Application Data"
"136","0.818291","146.75.37.140","192.168.12.35","TLSv1.2","133","Application Data"
"137","0.818291","146.75.37.140","192.168.12.35","TLSv1.2","399","Application Data"
"138","0.818804","192.168.12.35","146.75.37.140","TCP","54","61013  >  443 [ACK] Seq=8268 Ack=70508 Win=1022 Len=0"
"139","0.823522","146.75.37.140","192.168.12.35","TLSv1.2","333","Application Data"
"140","0.823522","146.75.37.140","192.168.12.35","TLSv1.2","326","Application Data"
"141","0.823522","146.75.37.140","192.168.12.35","TLSv1.2","566","Application Data"
"142","0.823522","146.75.37.140","192.168.12.35","TLSv1.2","227","Application Data"
"143","0.823522","146.75.37.140","192.168.12.35","TLSv1.2","149","Application Data"
"144","0.823522","146.75.37.140","192.168.12.35","TLSv1.2","543","Application Data"
"145","0.823522","146.75.37.140","192.168.12.35","TLSv1.2","156","Application Data"
"146","0.823522","146.75.37.140","192.168.12.35","TLSv1.2","136","Application Data"
"147","0.823522","146.75.37.140","192.168.12.35","TCP","1430","443  >  61013 [ACK] Seq=72857 Ack=8268 Win=5518 Len=1376 [TCP PDU reassembled in 148]"
"148","0.823522","146.75.37.140","192.168.12.35","TLSv1.2","537","Application Data"
"149","0.823522","146.75.37.140","192.168.12.35","TLSv1.2","494","Application Data"
"150","0.823522","146.75.37.140","192.168.12.35","TLSv1.2","1430","Application Data"
"151","0.823522","146.75.37.140","192.168.12.35","TLSv1.2","70","Application Data"
"152","0.823522","146.75.37.140","192.168.12.35","TLSv1.2","282","Application Data"
"153","0.824007","192.168.12.35","146.75.37.140","TCP","54","61013  >  443 [ACK] Seq=8268 Ack=71132 Win=1020 Len=0"
"154","0.824140","192.168.12.35","146.75.37.140","TCP","54","61013  >  443 [ACK] Seq=8268 Ack=71916 Win=1025 Len=0"
"155","0.824183","192.168.12.35","146.75.37.140","TCP","54","61013  >  443 [ACK] Seq=8268 Ack=72184 Win=1024 Len=0"
"156","0.824221","192.168.12.35","146.75.37.140","TCP","54","61013  >  443 [ACK] Seq=8268 Ack=72775 Win=1021 Len=0"
"157","0.824252","192.168.12.35","146.75.37.140","TCP","54","61013  >  443 [ACK] Seq=8268 Ack=74233 Win=1025 Len=0"
"158","0.824315","192.168.12.35","146.75.37.140","TCP","54","61013  >  443 [ACK] Seq=8268 Ack=75156 Win=1021 Len=0"
"159","0.824379","192.168.12.35","146.75.37.140","TCP","54","61013  >  443 [ACK] Seq=8268 Ack=76548 Win=1025 Len=0"
"160","0.830119","146.75.37.140","192.168.12.35","TLSv1.2","456","Application Data"
"161","0.830119","146.75.37.140","192.168.12.35","TLSv1.2","443","Application Data"
"162","0.830203","192.168.12.35","146.75.37.140","TCP","54","61013  >  443 [ACK] Seq=8268 Ack=77178 Win=1022 Len=0"
"163","0.837388","146.75.37.140","192.168.12.35","TLSv1.2","190","Application Data"
"164","0.837388","146.75.37.140","192.168.12.35","TLSv1.2","433","Application Data"
"165","0.837388","146.75.37.140","192.168.12.35","TLSv1.2","244","Application Data"
"166","0.837388","146.75.37.140","192.168.12.35","TCP","1430","443  >  61013 [ACK] Seq=78272 Ack=8268 Win=5518 Len=1376 [TCP PDU reassembled in 167]"
"167","0.837388","146.75.37.140","192.168.12.35","TLSv1.2","243","Application Data"
"168","0.837388","146.75.37.140","192.168.12.35","TLSv1.2","166","Application Data"
"169","0.837388","146.75.37.140","192.168.12.35","TLSv1.2","628","Application Data"
"170","0.837388","146.75.37.140","192.168.12.35","TLSv1.2","314","Application Data"
"171","0.837388","146.75.37.140","192.168.12.35","TLSv1.2","899","Application Data"
"172","0.838067","192.168.12.35","146.75.37.140","TCP","54","61013  >  443 [ACK] Seq=8268 Ack=77703 Win=1020 Len=0"
"173","0.838302","192.168.12.35","146.75.37.140","TCP","54","61013  >  443 [ACK] Seq=8268 Ack=78272 Win=1025 Len=0"
"174","0.838332","192.168.12.35","146.75.37.140","TCP","54","61013  >  443 [ACK] Seq=8268 Ack=79837 Win=1025 Len=0"
"175","0.838381","192.168.12.35","146.75.37.140","TCP","54","61013  >  443 [ACK] Seq=8268 Ack=80523 Win=1022 Len=0"
"176","0.838498","192.168.12.35","146.75.37.140","TCP","54","61013  >  443 [ACK] Seq=8268 Ack=81628 Win=1025 Len=0"
"177","0.846462","146.75.37.140","192.168.12.35","TLSv1.2","449","Application Data"
"178","0.846462","146.75.37.140","192.168.12.35","TLSv1.2","1366","Application Data"
"179","0.846462","146.75.37.140","192.168.12.35","TLSv1.2","942","Application Data"
"180","0.846462","146.75.37.140","192.168.12.35","TLSv1.2","342","Application Data"
"181","0.846462","146.75.37.140","192.168.12.35","TLSv1.2","386","Application Data"
"182","0.846462","146.75.37.140","192.168.12.35","TLSv1.2","369","Application Data"
"183","0.846462","146.75.37.140","192.168.12.35","TLSv1.2","184","Application Data"
"184","0.846462","146.75.37.140","192.168.12.35","TLSv1.2","568","Application Data"
"185","0.846462","146.75.37.140","192.168.12.35","TCP","1430","443  >  61013 [ACK] Seq=85802 Ack=8268 Win=5518 Len=1376 [TCP PDU reassembled in 186]"
"186","0.846462","146.75.37.140","192.168.12.35","TLSv1.2","396","Application Data"
"187","0.846890","192.168.12.35","146.75.37.140","TCP","54","61013  >  443 [ACK] Seq=8268 Ack=83335 Win=1025 Len=0"
"188","0.847095","192.168.12.35","146.75.37.140","TCP","54","61013  >  443 [ACK] Seq=8268 Ack=84511 Win=1020 Len=0"
"189","0.847168","192.168.12.35","146.75.37.140","TCP","54","61013  >  443 [ACK] Seq=8268 Ack=85158 Win=1025 Len=0"
"190","0.847253","192.168.12.35","146.75.37.140","TCP","54","61013  >  443 [ACK] Seq=8268 Ack=85802 Win=1022 Len=0"
"191","0.847340","192.168.12.35","146.75.37.140","TCP","54","61013  >  443 [ACK] Seq=8268 Ack=87520 Win=1025 Len=0"
"192","0.856337","146.75.37.140","192.168.12.35","TLSv1.2","126","Application Data"
"193","0.859668","192.168.12.35","146.75.37.140","TLSv1.2","207","Application Data"
"194","0.859751","192.168.12.35","146.75.37.140","TLSv1.2","93","Application Data"
"195","0.862106","146.75.37.140","192.168.12.35","TLSv1.2","99","Application Data"
"196","0.862195","192.168.12.35","146.75.37.140","TCP","54","61013  >  443 [ACK] Seq=8268 Ack=87637 Win=1024 Len=0"
"197","0.868291","146.75.37.140","192.168.12.35","TLSv1.2","93","Application Data"
"198","0.868291","146.75.37.140","192.168.12.35","TLSv1.2","121","Application Data"
"199","0.868532","192.168.12.35","146.75.37.140","TCP","54","61013  >  443 [ACK] Seq=8268 Ack=87743 Win=1024 Len=0"
"200","0.873627","146.75.37.140","192.168.12.35","TLSv1.2","1070","Application Data"
"201","0.873627","146.75.37.140","192.168.12.35","TLSv1.2","107","Application Data"
"202","0.873627","146.75.37.140","192.168.12.35","TLSv1.2","270","Application Data"
"203","0.873627","146.75.37.140","192.168.12.35","TLSv1.2","563","Application Data"
"204","0.873627","146.75.37.140","192.168.12.35","TLSv1.2","183","Application Data"
"205","0.873627","146.75.37.140","192.168.12.35","TLSv1.2","176","Application Data"
"206","0.873627","146.75.37.140","192.168.12.35","TLSv1.2","229","Application Data"
"207","0.873627","146.75.37.140","192.168.12.35","TLSv1.2","517","Application Data"
"208","0.873627","146.75.37.140","192.168.12.35","TLSv1.2","664","Application Data"
"209","0.873627","146.75.37.140","192.168.12.35","TLSv1.2","705","Application Data"
"210","0.873627","146.75.37.140","192.168.12.35","TCP","1430","443  >  61013 [ACK] Seq=91687 Ack=8268 Win=5518 Len=1376 [TCP PDU reassembled in 211]"
"211","0.873627","146.75.37.140","192.168.12.35","TLSv1.2","1218","Application Data"
"212","0.873627","146.75.37.140","192.168.12.35","TLSv1.2","97","Application Data"
"213","0.873627","146.75.37.140","192.168.12.35","TLSv1.2","200","Application Data"
"214","0.873627","146.75.37.140","192.168.12.35","TLSv1.2","360","Application Data"
"215","0.873627","146.75.37.140","192.168.12.35","TLSv1.2","383","Application Data"
"216","0.874091","192.168.12.35","146.75.37.140","TCP","54","61013  >  443 [ACK] Seq=8268 Ack=88812 Win=1020 Len=0"
"217","0.874146","192.168.12.35","146.75.37.140","TCP","54","61013  >  443 [ACK] Seq=8268 Ack=89537 Win=1025 Len=0"
"218","0.874185","192.168.12.35","146.75.37.140","TCP","54","61013  >  443 [ACK] Seq=8268 Ack=89788 Win=1024 Len=0"
"219","0.874210","192.168.12.35","146.75.37.140","TCP","54","61013  >  443 [ACK] Seq=8268 Ack=90426 Win=1021 Len=0"
"220","0.874248","192.168.12.35","146.75.37.140","TCP","54","61013  >  443 [ACK] Seq=8268 Ack=91687 Win=1025 Len=0"
"221","0.874289","192.168.12.35","146.75.37.140","TCP","54","61013  >  443 [ACK] Seq=8268 Ack=94227 Win=1025 Len=0"
"222","0.874356","192.168.12.35","146.75.37.140","TCP","54","61013  >  443 [ACK] Seq=8268 Ack=94416 Win=1024 Len=0"
"223","0.874394","192.168.12.35","146.75.37.140","TCP","54","61013  >  443 [ACK] Seq=8268 Ack=95051 Win=1021 Len=0"
"224","0.884202","146.75.37.140","192.168.12.35","TCP","54","443  >  61034 [ACK] Seq=1 Ack=154 Win=424 Len=0"
"225","0.884202","146.75.37.140","192.168.12.35","TLSv1.2","185","Application Data"
"226","0.884202","146.75.37.140","192.168.12.35","TCP","1430","443  >  61034 [ACK] Seq=132 Ack=154 Win=424 Len=1376 [TCP PDU reassembled in 232]"
"227","0.884627","192.168.12.35","146.75.37.140","TCP","54","61034  >  443 [ACK] Seq=193 Ack=1508 Win=8201 Len=0"
"228","0.893617","146.75.37.140","192.168.12.35","TCP","1430","443  >  61034 [ACK] Seq=1508 Ack=154 Win=424 Len=1376 [TCP PDU reassembled in 232]"
"229","0.893617","146.75.37.140","192.168.12.35","TCP","1430","443  >  61034 [ACK] Seq=2884 Ack=154 Win=424 Len=1376 [TCP PDU reassembled in 232]"
"230","0.893617","146.75.37.140","192.168.12.35","TCP","1430","443  >  61034 [ACK] Seq=4260 Ack=154 Win=424 Len=1376 [TCP PDU reassembled in 232]"
"231","0.893617","146.75.37.140","192.168.12.35","TCP","1430","443  >  61034 [ACK] Seq=5636 Ack=154 Win=424 Len=1376 [TCP PDU reassembled in 232]"
"232","0.893617","146.75.37.140","192.168.12.35","TLSv1.2","1224","Application Data"
"233","0.893617","146.75.37.140","192.168.12.35","TCP","1430","443  >  61034 [ACK] Seq=8182 Ack=154 Win=424 Len=1376 [TCP PDU reassembled in 244]"
"234","0.893617","146.75.37.140","192.168.12.35","TCP","1430","443  >  61034 [ACK] Seq=9558 Ack=154 Win=424 Len=1376 [TCP PDU reassembled in 244]"
"235","0.893617","146.75.37.140","192.168.12.35","TCP","1430","443  >  61034 [ACK] Seq=10934 Ack=154 Win=424 Len=1376 [TCP PDU reassembled in 244]"
"236","0.893617","146.75.37.140","192.168.12.35","TCP","1430","443  >  61034 [ACK] Seq=12310 Ack=154 Win=424 Len=1376 [TCP PDU reassembled in 244]"
"237","0.893617","146.75.37.140","192.168.12.35","TCP","1430","443  >  61034 [ACK] Seq=13686 Ack=154 Win=424 Len=1376 [TCP PDU reassembled in 244]"
"238","0.893617","146.75.37.140","192.168.12.35","TCP","1430","443  >  61034 [ACK] Seq=15062 Ack=154 Win=424 Len=1376 [TCP PDU reassembled in 244]"
"239","0.893617","146.75.37.140","192.168.12.35","TCP","1430","443  >  61034 [ACK] Seq=16438 Ack=154 Win=424 Len=1376 [TCP PDU reassembled in 244]"
"240","0.893617","146.75.37.140","192.168.12.35","TCP","1430","443  >  61034 [ACK] Seq=17814 Ack=154 Win=424 Len=1376 [TCP PDU reassembled in 244]"
"241","0.893617","146.75.37.140","192.168.12.35","TCP","1430","443  >  61034 [ACK] Seq=19190 Ack=154 Win=424 Len=1376 [TCP PDU reassembled in 244]"
"242","0.893617","146.75.37.140","192.168.12.35","TCP","1430","443  >  61034 [ACK] Seq=20566 Ack=154 Win=424 Len=1376 [TCP PDU reassembled in 244]"
"243","0.893617","146.75.37.140","192.168.12.35","TCP","1430","443  >  61034 [ACK] Seq=21942 Ack=154 Win=424 Len=1376 [TCP PDU reassembled in 244]"
"244","0.893617","146.75.37.140","192.168.12.35","TLSv1.2","1355","Application Data, Application Data"
"245","0.893878","192.168.12.35","146.75.37.140","TCP","54","61034  >  443 [ACK] Seq=193 Ack=7012 Win=8201 Len=0"
"246","0.893932","192.168.12.35","146.75.37.140","TCP","54","61034  >  443 [ACK] Seq=193 Ack=23318 Win=8201 Len=0"
"247","0.897818","192.168.12.35","146.75.37.140","TLSv1.2","89","Application Data"
"248","0.899909","146.75.37.140","192.168.12.35","TCP","1430","443  >  61034 [ACK] Seq=24619 Ack=154 Win=424 Len=1376 [TCP PDU reassembled in 259]"
"249","0.899909","146.75.37.140","192.168.12.35","TCP","1430","443  >  61034 [ACK] Seq=25995 Ack=154 Win=424 Len=1376 [TCP PDU reassembled in 259]"
"250","0.899909","146.75.37.140","192.168.12.35","TCP","1430","443  >  61034 [ACK] Seq=27371 Ack=154 Win=424 Len=1376 [TCP PDU reassembled in 259]"
"251","0.899909","146.75.37.140","192.168.12.35","TCP","1430","443  >  61034 [ACK] Seq=28747 Ack=154 Win=424 Len=1376 [TCP PDU reassembled in 259]"
"252","0.899909","146.75.37.140","192.168.12.35","TCP","1430","443  >  61034 [ACK] Seq=30123 Ack=154 Win=424 Len=1376 [TCP PDU reassembled in 259]"
"253","0.899909","146.75.37.140","192.168.12.35","TCP","1430","443  >  61034 [ACK] Seq=31499 Ack=154 Win=424 Len=1376 [TCP PDU reassembled in 259]"
"254","0.899909","146.75.37.140","192.168.12.35","TCP","1430","443  >  61034 [ACK] Seq=32875 Ack=154 Win=424 Len=1376 [TCP PDU reassembled in 259]"
"255","0.899909","146.75.37.140","192.168.12.35","TCP","1430","443  >  61034 [ACK] Seq=34251 Ack=154 Win=424 Len=1376 [TCP PDU reassembled in 259]"
"256","0.899909","146.75.37.140","192.168.12.35","TCP","1430","443  >  61034 [ACK] Seq=35627 Ack=154 Win=424 Len=1376 [TCP PDU reassembled in 259]"
"257","0.899909","146.75.37.140","192.168.12.35","TCP","1430","443  >  61034 [ACK] Seq=37003 Ack=154 Win=424 Len=1376 [TCP PDU reassembled in 259]"
"258","0.899909","146.75.37.140","192.168.12.35","TCP","1430","443  >  61034 [ACK] Seq=38379 Ack=154 Win=424 Len=1376 [TCP PDU reassembled in 259]"
"259","0.899909","146.75.37.140","192.168.12.35","TLSv1.2","1430","Application Data, Application Data"
"260","0.899909","146.75.37.140","192.168.12.35","TCP","1430","443  >  61034 [ACK] Seq=41131 Ack=154 Win=424 Len=1376 [TCP PDU reassembled in 272]"
"261","0.899909","146.75.37.140","192.168.12.35","TCP","1430","443  >  61034 [ACK] Seq=42507 Ack=154 Win=424 Len=1376 [TCP PDU reassembled in 272]"
"262","0.899909","146.75.37.140","192.168.12.35","TCP","1430","443  >  61034 [ACK] Seq=43883 Ack=154 Win=424 Len=1376 [TCP PDU reassembled in 272]"
"263","0.899909","146.75.37.140","192.168.12.35","TCP","1430","443  >  61034 [ACK] Seq=45259 Ack=154 Win=424 Len=1376 [TCP PDU reassembled in 272]"
"264","0.899909","146.75.37.140","192.168.12.35","TCP","1430","443  >  61034 [ACK] Seq=46635 Ack=154 Win=424 Len=1376 [TCP PDU reassembled in 272]"
"265","0.899909","146.75.37.140","192.168.12.35","TCP","1430","443  >  61034 [ACK] Seq=48011 Ack=154 Win=424 Len=1376 [TCP PDU reassembled in 272]"
"266","0.899909","146.75.37.140","192.168.12.35","TCP","1430","443  >  61034 [ACK] Seq=49387 Ack=154 Win=424 Len=1376 [TCP PDU reassembled in 272]"
"267","0.899909","146.75.37.140","192.168.12.35","TCP","1430","443  >  61034 [ACK] Seq=50763 Ack=154 Win=424 Len=1376 [TCP PDU reassembled in 272]"
"268","0.900758","192.168.12.35","146.75.37.140","TCP","54","61034  >  443 [ACK] Seq=228 Ack=52139 Win=8201 Len=0"
"269","0.901621","146.75.37.140","192.168.12.35","TCP","1430","443  >  61034 [PSH, ACK] Seq=52139 Ack=154 Win=424 Len=1376 [TCP PDU reassembled in 272]"
"270","0.901621","146.75.37.140","192.168.12.35","TCP","1430","443  >  61034 [ACK] Seq=53515 Ack=154 Win=424 Len=1376 [TCP PDU reassembled in 272]"
"271","0.901621","146.75.37.140","192.168.12.35","TCP","1430","443  >  61034 [ACK] Seq=54891 Ack=154 Win=424 Len=1376 [TCP PDU reassembled in 272]"
"272","0.901621","146.75.37.140","192.168.12.35","TLSv1.2","1430","Application Data, Application Data"
"273","0.901621","146.75.37.140","192.168.12.35","TCP","1430","443  >  61034 [ACK] Seq=57643 Ack=154 Win=424 Len=1376 [TCP PDU reassembled in 284]"
"274","0.901621","146.75.37.140","192.168.12.35","TCP","1430","443  >  61034 [ACK] Seq=59019 Ack=154 Win=424 Len=1376 [TCP PDU reassembled in 284]"
"275","0.901621","146.75.37.140","192.168.12.35","TCP","1430","443  >  61034 [ACK] Seq=60395 Ack=154 Win=424 Len=1376 [TCP PDU reassembled in 284]"
"276","0.901621","146.75.37.140","192.168.12.35","TCP","1430","443  >  61034 [ACK] Seq=61771 Ack=154 Win=424 Len=1376 [TCP PDU reassembled in 284]"
"277","0.901621","146.75.37.140","192.168.12.35","TCP","1430","443  >  61034 [ACK] Seq=63147 Ack=154 Win=424 Len=1376 [TCP PDU reassembled in 284]"
"278","0.901621","146.75.37.140","192.168.12.35","TCP","1430","443  >  61034 [ACK] Seq=64523 Ack=154 Win=424 Len=1376 [TCP PDU reassembled in 284]"
"279","0.901621","146.75.37.140","192.168.12.35","TCP","1430","443  >  61034 [ACK] Seq=65899 Ack=154 Win=424 Len=1376 [TCP PDU reassembled in 284]"
"280","0.901621","146.75.37.140","192.168.12.35","TCP","1430","443  >  61034 [ACK] Seq=67275 Ack=154 Win=424 Len=1376 [TCP PDU reassembled in 284]"
"281","0.901621","146.75.37.140","192.168.12.35","TCP","1430","443  >  61034 [ACK] Seq=68651 Ack=154 Win=424 Len=1376 [TCP PDU reassembled in 284]"
"282","0.901621","146.75.37.140","192.168.12.35","TCP","1430","443  >  61034 [ACK] Seq=70027 Ack=154 Win=424 Len=1376 [TCP PDU reassembled in 284]"
"283","0.901621","146.75.37.140","192.168.12.35","TCP","1430","443  >  61034 [ACK] Seq=71403 Ack=154 Win=424 Len=1376 [TCP PDU reassembled in 284]"
"284","0.901621","146.75.37.140","192.168.12.35","TLSv1.2","1430","Application Data, Application Data"
"285","0.901621","146.75.37.140","192.168.12.35","TCP","1430","443  >  61034 [ACK] Seq=74155 Ack=154 Win=424 Len=1376 [TCP PDU reassembled in 296]"
"286","0.901621","146.75.37.140","192.168.12.35","TCP","1430","443  >  61034 [ACK] Seq=75531 Ack=154 Win=424 Len=1376 [TCP PDU reassembled in 296]"
"287","0.901621","146.75.37.140","192.168.12.35","TCP","1430","443  >  61034 [ACK] Seq=76907 Ack=154 Win=424 Len=1376 [TCP PDU reassembled in 296]"
"288","0.901621","146.75.37.140","192.168.12.35","TCP","1430","443  >  61034 [ACK] Seq=78283 Ack=154 Win=424 Len=1376 [TCP PDU reassembled in 296]"
"289","0.901621","146.75.37.140","192.168.12.35","TCP","1430","443  >  61034 [ACK] Seq=79659 Ack=154 Win=424 Len=1376 [TCP PDU reassembled in 296]"
"290","0.901621","146.75.37.140","192.168.12.35","TCP","1430","443  >  61034 [PSH, ACK] Seq=81035 Ack=154 Win=424 Len=1376 [TCP PDU reassembled in 296]"
"291","0.901621","146.75.37.140","192.168.12.35","TCP","1430","443  >  61034 [ACK] Seq=82411 Ack=154 Win=424 Len=1376 [TCP PDU reassembled in 296]"
"292","0.901621","146.75.37.140","192.168.12.35","TCP","1430","443  >  61034 [ACK] Seq=83787 Ack=154 Win=424 Len=1376 [TCP PDU reassembled in 296]"
"293","0.901621","146.75.37.140","192.168.12.35","TCP","1430","443  >  61034 [ACK] Seq=85163 Ack=154 Win=424 Len=1376 [TCP PDU reassembled in 296]"
"294","0.901621","146.75.37.140","192.168.12.35","TCP","1430","443  >  61034 [ACK] Seq=86539 Ack=154 Win=424 Len=1376 [TCP PDU reassembled in 296]"
"295","0.901621","146.75.37.140","192.168.12.35","TCP","1430","443  >  61034 [ACK] Seq=87915 Ack=154 Win=424 Len=1376 [TCP PDU reassembled in 296]"
"296","0.901621","146.75.37.140","192.168.12.35","TLSv1.2","1430","Application Data, Application Data"
"297","0.901621","146.75.37.140","192.168.12.35","TCP","1430","443  >  61034 [ACK] Seq=90667 Ack=154 Win=424 Len=1376 [TCP PDU reassembled in 308]"
"298","0.901621","146.75.37.140","192.168.12.35","TCP","1430","443  >  61034 [ACK] Seq=92043 Ack=154 Win=424 Len=1376 [TCP PDU reassembled in 308]"
"299","0.901621","146.75.37.140","192.168.12.35","TCP","1430","443  >  61034 [ACK] Seq=93419 Ack=154 Win=424 Len=1376 [TCP PDU reassembled in 308]"
"300","0.901621","146.75.37.140","192.168.12.35","TCP","1430","443  >  61034 [ACK] Seq=94795 Ack=154 Win=424 Len=1376 [TCP PDU reassembled in 308]"
"301","0.902222","146.75.37.140","192.168.12.35","TCP","1430","443  >  61034 [ACK] Seq=96171 Ack=154 Win=424 Len=1376 [TCP PDU reassembled in 308]"
"302","0.902222","146.75.37.140","192.168.12.35","TCP","1430","443  >  61034 [ACK] Seq=97547 Ack=154 Win=424 Len=1376 [TCP PDU reassembled in 308]"
"303","0.902222","146.75.37.140","192.168.12.35","TCP","1430","443  >  61034 [ACK] Seq=98923 Ack=154 Win=424 Len=1376 [TCP PDU reassembled in 308]"
"304","0.902222","146.75.37.140","192.168.12.35","TCP","1430","443  >  61034 [ACK] Seq=100299 Ack=154 Win=424 Len=1376 [TCP PDU reassembled in 308]"
"305","0.902222","146.75.37.140","192.168.12.35","TCP","1430","443  >  61034 [ACK] Seq=101675 Ack=154 Win=424 Len=1376 [TCP PDU reassembled in 308]"
"306","0.902222","146.75.37.140","192.168.12.35","TCP","1430","443  >  61034 [ACK] Seq=103051 Ack=154 Win=424 Len=1376 [TCP PDU reassembled in 308]"
"307","0.902222","146.75.37.140","192.168.12.35","TCP","1430","443  >  61034 [ACK] Seq=104427 Ack=154 Win=424 Len=1376 [TCP PDU reassembled in 308]"
"308","0.902222","146.75.37.140","192.168.12.35","TLSv1.2","1430","Application Data, Application Data"
"309","0.902222","146.75.37.140","192.168.12.35","TCP","1430","443  >  61034 [ACK] Seq=107179 Ack=154 Win=424 Len=1376 [TCP PDU reassembled in 310]"
"310","0.902222","146.75.37.140","192.168.12.35","TLSv1.2","1103","Application Data"
"311","0.902222","146.75.37.140","192.168.12.35","TCP","54","443  >  61034 [ACK] Seq=109604 Ack=193 Win=424 Len=0"
"312","0.902222","146.75.37.140","192.168.12.35","TLSv1.2","93","Application Data"
"313","0.902308","192.168.12.35","146.75.37.140","TCP","54","61034  >  443 [ACK] Seq=228 Ack=96171 Win=8201 Len=0"
"314","0.902488","192.168.12.35","146.75.37.140","TCP","54","61034  >  443 [ACK] Seq=228 Ack=109604 Win=8197 Len=0"
"315","0.902491","192.168.12.35","146.75.37.140","TCP","54","61034  >  443 [ACK] Seq=228 Ack=108555 Win=8201 Len=0"
"316","0.903156","192.168.12.35","146.75.37.140","TLSv1.2","3184","Application Data"
"317","0.903222","192.168.12.35","146.75.37.140","TLSv1.2","718","Application Data"
"318","0.903796","192.168.12.35","146.75.37.140","TLSv1.2","3188","Application Data"
"319","0.916256","192.168.12.35","146.75.37.140","TLSv1.2","3197","Application Data"
"320","0.926553","146.75.37.140","192.168.12.35","TCP","54","443  >  61034 [ACK] Seq=109643 Ack=228 Win=424 Len=0"
"321","0.945402","192.168.12.35","146.75.37.140","TCP","54","61034  >  443 [ACK] Seq=228 Ack=109643 Win=8197 Len=0"
"322","0.960579","146.75.37.140","192.168.12.35","TCP","54","443  >  61013 [ACK] Seq=95051 Ack=9664 Win=5524 Len=0"
"323","0.968132","192.168.12.35","146.75.37.140","TLSv1.2","3175","Application Data"
"324","0.968317","192.168.12.35","146.75.37.140","TLSv1.2","210","Application Data"
"325","0.974148","146.75.37.140","192.168.12.35","TCP","54","443  >  61013 [ACK] Seq=95051 Ack=11060 Win=5529 Len=0"
"326","0.978928","146.75.37.140","192.168.12.35","TCP","54","443  >  61013 [ACK] Seq=95051 Ack=11398 Win=5529 Len=0"
"327","0.988973","146.75.37.140","192.168.12.35","TCP","54","443  >  61013 [ACK] Seq=95051 Ack=12062 Win=5529 Len=0"
"328","1.022287","146.75.37.140","192.168.12.35","TCP","54","443  >  61013 [ACK] Seq=95051 Ack=13458 Win=5534 Len=0"
"329","1.022287","146.75.37.140","192.168.12.35","TCP","1430","443  >  61013 [ACK] Seq=95051 Ack=13458 Win=5534 Len=1376 [TCP PDU reassembled in 330]"
"330","1.022287","146.75.37.140","192.168.12.35","TLSv1.2","779","Application Data"
"331","1.023010","192.168.12.35","146.75.37.140","TCP","54","61013  >  443 [ACK] Seq=21616 Ack=96427 Win=1025 Len=0"
"332","1.023266","192.168.12.35","146.75.37.140","TCP","54","61013  >  443 [ACK] Seq=21616 Ack=97152 Win=1022 Len=0"
"333","1.044618","146.75.37.140","192.168.12.35","TCP","54","443  >  61013 [ACK] Seq=97152 Ack=14854 Win=5540 Len=0"
"334","1.047147","192.168.12.35","146.75.37.140","TLSv1.2","3195","Application Data"
"335","1.047324","192.168.12.35","146.75.37.140","TLSv1.2","3210","Application Data"
"336","1.047420","192.168.12.35","146.75.37.140","TLSv1.2","3187","Application Data"
"337","1.047988","192.168.12.35","146.75.37.140","TLSv1.2","3289","Application Data"
"338","1.048893","146.75.37.140","192.168.12.35","TCP","54","443  >  61013 [ACK] Seq=97152 Ack=15196 Win=5540 Len=0"
"339","1.069626","146.75.37.140","192.168.12.35","TCP","54","443  >  61013 [ACK] Seq=97152 Ack=16592 Win=5545 Len=0"
"340","1.094657","146.75.37.140","192.168.12.35","TCP","1430","443  >  61013 [ACK] Seq=97152 Ack=16592 Win=5545 Len=1376 [TCP PDU reassembled in 341]"
"341","1.094657","146.75.37.140","192.168.12.35","TLSv1.2","485","Application Data"
"342","1.095075","192.168.12.35","146.75.37.140","TCP","54","61013  >  443 [ACK] Seq=34281 Ack=98528 Win=1025 Len=0"
"343","1.095264","192.168.12.35","146.75.37.140","TCP","54","61013  >  443 [ACK] Seq=34281 Ack=98959 Win=1023 Len=0"
"344","1.099404","146.75.37.140","192.168.12.35","TCP","54","443  >  61013 [ACK] Seq=98959 Ack=17988 Win=5551 Len=0"
"345","1.109196","146.75.37.140","192.168.12.35","TCP","54","443  >  61013 [ACK] Seq=98959 Ack=18339 Win=5551 Len=0"
"346","1.129603","146.75.37.140","192.168.12.35","TCP","54","443  >  61013 [ACK] Seq=98959 Ack=19735 Win=5556 Len=0"
