"No.","Time","Source","Destination","Protocol","Length","Info"
"1","0.000000","192.168.12.35","146.75.37.140","TCP","55","61034  >  443 [ACK] Seq=1 Ack=1 Win=8197 Len=1 [TCP PDU reassembled in 2682]"
"2","0.024110","146.75.37.140","192.168.12.35","TCP","66","443  >  61034 [ACK] Seq=1 Ack=2 Win=424 Len=0 SLE=1 SRE=2"
"3","0.821325","192.168.12.35","146.75.37.140","UDP","80","63474  >  443 Len=38"
"4","0.872512","146.75.37.140","192.168.12.35","UDP","67","443  >  63474 Len=25"
"5","1.002536","192.168.12.35","146.75.37.140","TLSv1.2","3236","Application Data"
"6","1.002607","192.168.12.35","146.75.37.140","TLSv1.2","93","Application Data"
"7","1.002633","192.168.12.35","146.75.37.140","TLSv1.2","3359","Application Data"
"8","1.002665","192.168.12.35","146.75.37.140","TLSv1.2","2545","Application Data"
"9","1.042935","146.75.37.140","192.168.12.35","TCP","54","443  >  61013 [ACK] Seq=1 Ack=1397 Win=6003 Len=0"
"10","1.054305","146.75.37.140","192.168.12.35","TCP","54","443  >  61013 [ACK] Seq=1 Ack=2793 Win=6009 Len=0"
"11","1.054305","146.75.37.140","192.168.12.35","TCP","54","443  >  61013 [ACK] Seq=1 Ack=3183 Win=6009 Len=0"
"12","1.060185","146.75.37.140","192.168.12.35","TCP","54","443  >  61013 [ACK] Seq=1 Ack=3222 Win=6009 Len=0"
"13","1.060185","146.75.37.140","192.168.12.35","TLSv1.2","93","Application Data"
"14","1.079976","146.75.37.140","192.168.12.35","TCP","54","443  >  61013 [ACK] Seq=40 Ack=4618 Win=6014 Len=0"
"15","1.079976","146.75.37.140","192.168.12.35","TCP","54","443  >  61013 [ACK] Seq=40 Ack=6014 Win=6020 Len=0"
"16","1.079976","146.75.37.140","192.168.12.35","TCP","54","443  >  61013 [ACK] Seq=40 Ack=6527 Win=6020 Len=0"
"17","1.106992","146.75.37.140","192.168.12.35","TCP","1430","443  >  61013 [ACK] Seq=40 Ack=6527 Win=6020 Len=1376 [TCP PDU reassembled in 18]"
"18","1.106992","146.75.37.140","192.168.12.35","TLSv1.2","1075","Application Data"
"19","1.106992","146.75.37.140","192.168.12.35","TCP","1430","443  >  61013 [ACK] Seq=2437 Ack=6527 Win=6020 Len=1376 [TCP PDU reassembled in 20]"
"20","1.106992","146.75.37.140","192.168.12.35","TLSv1.2","1071","Application Data"
"21","1.106992","146.75.37.140","192.168.12.35","TCP","54","443  >  61013 [ACK] Seq=4830 Ack=7923 Win=6025 Len=0"
"22","1.106992","146.75.37.140","192.168.12.35","TCP","1430","443  >  61013 [ACK] Seq=4830 Ack=7923 Win=6025 Len=1376 [TCP PDU reassembled in 35]"
"23","1.106992","146.75.37.140","192.168.12.35","TCP","1430","443  >  61013 [PSH, ACK] Seq=6206 Ack=7923 Win=6025 Len=1376 [TCP PDU reassembled in 35]"
"24","1.106992","146.75.37.140","192.168.12.35","TCP","1430","443  >  61013 [ACK] Seq=7582 Ack=7923 Win=6025 Len=1376 [TCP PDU reassembled in 35]"
"25","1.106992","146.75.37.140","192.168.12.35","TCP","1430","443  >  61013 [PSH, ACK] Seq=8958 Ack=7923 Win=6025 Len=1376 [TCP PDU reassembled in 35]"
"26","1.107508","192.168.12.35","146.75.37.140","TCP","54","61013  >  443 [ACK] Seq=9018 Ack=1416 Win=1025 Len=0"
"27","1.107701","192.168.12.35","146.75.37.140","TCP","54","61013  >  443 [ACK] Seq=9018 Ack=3813 Win=1025 Len=0"
"28","1.107760","192.168.12.35","146.75.37.140","TCP","54","61013  >  443 [ACK] Seq=9018 Ack=10334 Win=1025 Len=0"
"29","1.112500","146.75.37.140","192.168.12.35","TCP","1430","443  >  61013 [ACK] Seq=10334 Ack=7923 Win=6025 Len=1376 [TCP PDU reassembled in 35]"
"30","1.112500","146.75.37.140","192.168.12.35","TCP","1430","443  >  61013 [PSH, ACK] Seq=11710 Ack=7923 Win=6025 Len=1376 [TCP PDU reassembled in 35]"
"31","1.112500","146.75.37.140","192.168.12.35","TCP","1430","443  >  61013 [ACK] Seq=13086 Ack=7923 Win=6025 Len=1376 [TCP PDU reassembled in 35]"
"32","1.112500","146.75.37.140","192.168.12.35","TCP","1430","443  >  61013 [PSH, ACK] Seq=14462 Ack=7923 Win=6025 Len=1376 [TCP PDU reassembled in 35]"
"33","1.112500","146.75.37.140","192.168.12.35","TCP","1430","443  >  61013 [ACK] Seq=15838 Ack=7923 Win=6025 Len=1376 [TCP PDU reassembled in 35]"
"34","1.112500","146.75.37.140","192.168.12.35","TCP","1430","443  >  61013 [PSH, ACK] Seq=17214 Ack=7923 Win=6025 Len=1376 [TCP PDU reassembled in 35]"
"35","1.112500","146.75.37.140","192.168.12.35","TLSv1.2","347","Application Data"
"36","1.112971","192.168.12.35","146.75.37.140","TCP","54","61013  >  443 [ACK] Seq=9018 Ack=18590 Win=1025 Len=0"
"37","1.113075","192.168.12.35","146.75.37.140","TCP","54","61013  >  443 [ACK] Seq=9018 Ack=18883 Win=1024 Len=0"
"38","1.113935","192.168.12.35","146.75.37.140","TLSv1.2","89","Application Data"
"39","1.118283","146.75.37.140","192.168.12.35","TLSv1.2","866","Application Data"
"40","1.118283","146.75.37.140","192.168.12.35","TCP","54","443  >  61013 [ACK] Seq=19695 Ack=9018 Win=6031 Len=0"
"41","1.124267","146.75.37.140","192.168.12.35","TLSv1.2","90","Application Data"
"42","1.124616","192.168.12.35","146.75.37.140","TCP","54","61013  >  443 [ACK] Seq=9053 Ack=19731 Win=1020 Len=0"
"43","1.130657","146.75.37.140","192.168.12.35","TCP","1430","443  >  61013 [ACK] Seq=19731 Ack=9018 Win=6031 Len=1376 [TCP PDU reassembled in 55]"
"44","1.130657","146.75.37.140","192.168.12.35","TCP","1430","443  >  61013 [PSH, ACK] Seq=21107 Ack=9018 Win=6031 Len=1376 [TCP PDU reassembled in 55]"
"45","1.130657","146.75.37.140","192.168.12.35","TCP","1430","443  >  61013 [ACK] Seq=22483 Ack=9018 Win=6031 Len=1376 [TCP PDU reassembled in 55]"
"46","1.130657","146.75.37.140","192.168.12.35","TCP","1430","443  >  61013 [PSH, ACK] Seq=23859 Ack=9018 Win=6031 Len=1376 [TCP PDU reassembled in 55]"
"47","1.130657","146.75.37.140","192.168.12.35","TCP","1430","443  >  61013 [ACK] Seq=25235 Ack=9018 Win=6031 Len=1376 [TCP PDU reassembled in 55]"
"48","1.130657","146.75.37.140","192.168.12.35","TCP","1430","443  >  61013 [PSH, ACK] Seq=26611 Ack=9018 Win=6031 Len=1376 [TCP PDU reassembled in 55]"
"49","1.130657","146.75.37.140","192.168.12.35","TCP","1430","443  >  61013 [ACK] Seq=27987 Ack=9018 Win=6031 Len=1376 [TCP PDU reassembled in 55]"
"50","1.130657","146.75.37.140","192.168.12.35","TCP","1430","443  >  61013 [PSH, ACK] Seq=29363 Ack=9018 Win=6031 Len=1376 [TCP PDU reassembled in 55]"
"51","1.131359","192.168.12.35","146.75.37.140","TCP","54","61013  >  443 [ACK] Seq=9053 Ack=30739 Win=1025 Len=0"
"52","1.136055","146.75.37.140","192.168.12.35","TCP","1430","443  >  61013 [ACK] Seq=30739 Ack=9018 Win=6031 Len=1376 [TCP PDU reassembled in 55]"
"53","1.136055","146.75.37.140","192.168.12.35","TCP","1430","443  >  61013 [PSH, ACK] Seq=32115 Ack=9018 Win=6031 Len=1376 [TCP PDU reassembled in 55]"
"54","1.136055","146.75.37.140","192.168.12.35","TCP","1430","443  >  61013 [ACK] Seq=33491 Ack=9018 Win=6031 Len=1376 [TCP PDU reassembled in 55]"
"55","1.136055","146.75.37.140","192.168.12.35","TLSv1.2","1430","Application Data"
"56","1.136055","146.75.37.140","192.168.12.35","TCP","1430","443  >  61013 [ACK] Seq=36243 Ack=9018 Win=6031 Len=1376 [TCP PDU reassembled in 68]"
"57","1.136055","146.75.37.140","192.168.12.35","TCP","1430","443  >  61013 [PSH, ACK] Seq=37619 Ack=9018 Win=6031 Len=1376 [TCP PDU reassembled in 68]"
"58","1.136055","146.75.37.140","192.168.12.35","TCP","1430","443  >  61013 [ACK] Seq=38995 Ack=9018 Win=6031 Len=1376 [TCP PDU reassembled in 68]"
"59","1.136055","146.75.37.140","192.168.12.35","TCP","1430","443  >  61013 [PSH, ACK] Seq=40371 Ack=9018 Win=6031 Len=1376 [TCP PDU reassembled in 68]"
"60","1.136055","146.75.37.140","192.168.12.35","TCP","1430","443  >  61013 [ACK] Seq=41747 Ack=9018 Win=6031 Len=1376 [TCP PDU reassembled in 68]"
"61","1.136055","146.75.37.140","192.168.12.35","TCP","1430","443  >  61013 [PSH, ACK] Seq=43123 Ack=9018 Win=6031 Len=1376 [TCP PDU reassembled in 68]"
"62","1.136660","192.168.12.35","146.75.37.140","TCP","54","61013  >  443 [ACK] Seq=9053 Ack=44499 Win=1025 Len=0"
"63","1.141555","146.75.37.140","192.168.12.35","TCP","1430","443  >  61013 [ACK] Seq=44499 Ack=9018 Win=6031 Len=1376 [TCP PDU reassembled in 68]"
"64","1.141555","146.75.37.140","192.168.12.35","TCP","1430","443  >  61013 [PSH, ACK] Seq=45875 Ack=9018 Win=6031 Len=1376 [TCP PDU reassembled in 68]"
"65","1.141555","146.75.37.140","192.168.12.35","TCP","1430","443  >  61013 [ACK] Seq=47251 Ack=9018 Win=6031 Len=1376 [TCP PDU reassembled in 68]"
"66","1.141555","146.75.37.140","192.168.12.35","TCP","1430","443  >  61013 [PSH, ACK] Seq=48627 Ack=9018 Win=6031 Len=1376 [TCP PDU reassembled in 68]"
"67","1.141555","146.75.37.140","192.168.12.35","TCP","1430","443  >  61013 [ACK] Seq=50003 Ack=9018 Win=6031 Len=1376 [TCP PDU reassembled in 68]"
"68","1.141555","146.75.37.140","192.168.12.35","TLSv1.2","1430","Application Data, Application Data"
"69","1.141555","146.75.37.140","192.168.12.35","TLSv1.2","1430","Application Data"
"70","1.141555","146.75.37.140","192.168.12.35","TCP","1430","443  >  61013 [PSH, ACK] Seq=54131 Ack=9018 Win=6031 Len=1376 [TCP PDU reassembled in 73]"
"71","1.142101","192.168.12.35","146.75.37.140","TCP","54","61013  >  443 [ACK] Seq=9053 Ack=55507 Win=1025 Len=0"
"72","1.143946","192.168.12.35","146.75.37.140","UDP","95","63474  >  443 Len=53"
"73","1.148291","146.75.37.140","192.168.12.35","TLSv1.2","1430","Application Data, Application Data"
"74","1.148291","146.75.37.140","192.168.12.35","TLSv1.2","1259","Application Data, Application Data"
"75","1.148291","146.75.37.140","192.168.12.35","TLSv1.2","1068","Application Data"
"76","1.148291","146.75.37.140","192.168.12.35","TCP","54","443  >  61013 [ACK] Seq=59102 Ack=9053 Win=6031 Len=0"
"77","1.148547","192.168.12.35","146.75.37.140","TCP","54","61013  >  443 [ACK] Seq=9053 Ack=58088 Win=1025 Len=0"
"78","1.153520","146.75.37.140","192.168.12.35","TLSv1.2","1191","Application Data"
"79","1.153520","146.75.37.140","192.168.12.35","TLSv1.2","603","Application Data"
"80","1.153520","146.75.37.140","192.168.12.35","TLSv1.2","901","Application Data"
"81","1.153520","146.75.37.140","192.168.12.35","TLSv1.2","181","Application Data"
"82","1.153520","146.75.37.140","192.168.12.35","TLSv1.2","186","Application Data"
"83","1.153520","146.75.37.140","192.168.12.35","TLSv1.2","232","Application Data"
"84","1.153520","146.75.37.140","192.168.12.35","TLSv1.2","582","Application Data"
"85","1.153520","146.75.37.140","192.168.12.35","TCP","1430","443  >  61013 [ACK] Seq=62600 Ack=9053 Win=6031 Len=1376 [TCP PDU reassembled in 87]"
"86","1.153520","146.75.37.140","192.168.12.35","TCP","1430","443  >  61013 [PSH, ACK] Seq=63976 Ack=9053 Win=6031 Len=1376 [TCP PDU reassembled in 87]"
"87","1.153520","146.75.37.140","192.168.12.35","TLSv1.2","290","Application Data"
"88","1.154131","192.168.12.35","146.75.37.140","TCP","54","61013  >  443 [ACK] Seq=9053 Ack=60239 Win=1025 Len=0"
"89","1.154366","192.168.12.35","146.75.37.140","TCP","54","61013  >  443 [ACK] Seq=9053 Ack=61635 Win=1025 Len=0"
"90","1.154424","192.168.12.35","146.75.37.140","TCP","54","61013  >  443 [ACK] Seq=9053 Ack=61894 Win=1024 Len=0"
"91","1.154467","192.168.12.35","146.75.37.140","TCP","54","61013  >  443 [ACK] Seq=9053 Ack=62600 Win=1021 Len=0"
"92","1.154527","192.168.12.35","146.75.37.140","TCP","54","61013  >  443 [ACK] Seq=9053 Ack=65352 Win=1025 Len=0"
"93","1.160270","146.75.37.140","192.168.12.35","TLSv1.2","675","Application Data"
"94","1.160270","146.75.37.140","192.168.12.35","TLSv1.2","220","Application Data, Application Data"
"95","1.160270","146.75.37.140","192.168.12.35","TLSv1.2","911","Application Data"
"96","1.160270","146.75.37.140","192.168.12.35","TLSv1.2","780","Application Data"
"97","1.160270","146.75.37.140","192.168.12.35","TLSv1.2","200","Application Data"
"98","1.160270","146.75.37.140","192.168.12.35","TLSv1.2","171","Application Data"
"99","1.160270","146.75.37.140","192.168.12.35","TLSv1.2","177","Application Data"
"100","1.160270","146.75.37.140","192.168.12.35","TLSv1.2","123","Application Data"
"101","1.160270","146.75.37.140","192.168.12.35","TLSv1.2","335","Application Data"
"102","1.160859","192.168.12.35","146.75.37.140","TCP","54","61013  >  443 [ACK] Seq=9053 Ack=66209 Win=1021 Len=0"
"103","1.160992","192.168.12.35","146.75.37.140","TCP","54","61013  >  443 [ACK] Seq=9053 Ack=67232 Win=1025 Len=0"
"104","1.161028","192.168.12.35","146.75.37.140","TCP","54","61013  >  443 [ACK] Seq=9053 Ack=68104 Win=1021 Len=0"
"105","1.161126","192.168.12.35","146.75.37.140","TCP","54","61013  >  443 [ACK] Seq=9053 Ack=68344 Win=1020 Len=0"
"106","1.161163","192.168.12.35","146.75.37.140","TCP","54","61013  >  443 [ACK] Seq=9053 Ack=68694 Win=1025 Len=0"
"107","1.188317","146.75.37.140","192.168.12.35","TLSv1.2","291","Application Data"
"108","1.198112","146.75.37.140","192.168.12.35","TLSv1.2","113","Application Data"
"109","1.198112","146.75.37.140","192.168.12.35","UDP","67","443  >  63474 Len=25"
"110","1.198558","192.168.12.35","146.75.37.140","TCP","54","61013  >  443 [ACK] Seq=9053 Ack=68990 Win=1024 Len=0"
"111","1.206865","192.168.12.35","146.75.37.140","UDP","84","63474  >  443 Len=42"
"112","1.208341","146.75.37.140","192.168.12.35","TLSv1.2","321","Application Data"
"113","1.208341","146.75.37.140","192.168.12.35","TLSv1.2","679","Application Data"
"114","1.208626","192.168.12.35","146.75.37.140","TCP","54","61013  >  443 [ACK] Seq=9053 Ack=69882 Win=1020 Len=0"
"115","1.222890","146.75.37.140","192.168.12.35","UDP","67","443  >  63474 Len=25"
"116","1.730004","146.75.37.140","192.168.12.35","TLSv1.2","564","Application Data"
"117","1.740612","146.75.37.140","192.168.12.35","TLSv1.2","133","Application Data"
"118","1.740774","192.168.12.35","146.75.37.140","TCP","54","61013  >  443 [ACK] Seq=9053 Ack=70471 Win=1025 Len=0"
"119","1.746387","146.75.37.140","192.168.12.35","TLSv1.2","858","Application Data"
"120","1.746387","146.75.37.140","192.168.12.35","TLSv1.2","940","Application Data"
"121","1.746387","146.75.37.140","192.168.12.35","TLSv1.2","1413","Application Data"
"122","1.746387","146.75.37.140","192.168.12.35","TLSv1.2","743","Application Data"
"123","1.746387","146.75.37.140","192.168.12.35","TLSv1.2","1104","Application Data"
"124","1.746387","146.75.37.140","192.168.12.35","TLSv1.2","564","Application Data"
"125","1.746387","146.75.37.140","192.168.12.35","TLSv1.2","719","Application Data"
"126","1.746593","192.168.12.35","146.75.37.140","TCP","54","61013  >  443 [ACK] Seq=9053 Ack=72161 Win=1025 Len=0"
"127","1.746634","192.168.12.35","146.75.37.140","TCP","54","61013  >  443 [ACK] Seq=9053 Ack=74209 Win=1025 Len=0"
"128","1.746659","192.168.12.35","146.75.37.140","TCP","54","61013  >  443 [ACK] Seq=9053 Ack=75769 Win=1025 Len=0"
"129","1.753815","146.75.37.140","192.168.12.35","TCP","1430","443  >  61013 [ACK] Seq=76434 Ack=9053 Win=6031 Len=1376 [TCP PDU reassembled in 130]"
"130","1.753815","146.75.37.140","192.168.12.35","TLSv1.2","99","Application Data"
"131","1.753815","146.75.37.140","192.168.12.35","TLSv1.2","1252","Application Data"
"132","1.753815","146.75.37.140","192.168.12.35","TLSv1.2","495","Application Data"
"133","1.753815","146.75.37.140","192.168.12.35","TLSv1.2","260","Application Data"
"134","1.753815","146.75.37.140","192.168.12.35","TCP","1430","443  >  61013 [ACK] Seq=79700 Ack=9053 Win=6031 Len=1376 [TCP PDU reassembled in 135]"
"135","1.753815","146.75.37.140","192.168.12.35","TLSv1.2","708","Application Data"
"136","1.753815","146.75.37.140","192.168.12.35","TLSv1.2","440","Application Data"
"137","1.753947","192.168.12.35","146.75.37.140","TCP","54","61013  >  443 [ACK] Seq=9053 Ack=77810 Win=1025 Len=0"
"138","1.753984","192.168.12.35","146.75.37.140","TCP","54","61013  >  443 [ACK] Seq=9053 Ack=79053 Win=1020 Len=0"
"139","1.754003","192.168.12.35","146.75.37.140","TCP","54","61013  >  443 [ACK] Seq=9053 Ack=79700 Win=1025 Len=0"
"140","1.754026","192.168.12.35","146.75.37.140","TCP","54","61013  >  443 [ACK] Seq=9053 Ack=81730 Win=1025 Len=0"
"141","1.758246","146.75.37.140","192.168.12.35","TLSv1.2","898","Application Data"
"142","1.758246","146.75.37.140","192.168.12.35","TLSv1.2","1045","Application Data"
"143","1.758246","146.75.37.140","192.168.12.35","TLSv1.2","306","Application Data"
"144","1.758246","146.75.37.140","192.168.12.35","TLSv1.2","1305","Application Data"
"145","1.758246","146.75.37.140","192.168.12.35","TLSv1.2","226","Application Data"
"146","1.758246","146.75.37.140","192.168.12.35","TLSv1.2","785","Application Data"
"147","1.758246","146.75.37.140","192.168.12.35","TLSv1.2","530","Application Data"
"148","1.758380","192.168.12.35","146.75.37.140","TCP","54","61013  >  443 [ACK] Seq=9053 Ack=82960 Win=1020 Len=0"
"149","1.758398","192.168.12.35","146.75.37.140","TCP","54","61013  >  443 [ACK] Seq=9053 Ack=84203 Win=1025 Len=0"
"150","1.758415","192.168.12.35","146.75.37.140","TCP","54","61013  >  443 [ACK] Seq=9053 Ack=85626 Win=1025 Len=0"
"151","1.758443","192.168.12.35","146.75.37.140","TCP","54","61013  >  443 [ACK] Seq=9053 Ack=86833 Win=1020 Len=0"
"152","1.764169","146.75.37.140","192.168.12.35","TLSv1.2","220","Application Data"
"153","1.764169","146.75.37.140","192.168.12.35","TLSv1.2","249","Application Data"
"154","1.764169","146.75.37.140","192.168.12.35","TLSv1.2","762","Application Data"
"155","1.764437","192.168.12.35","146.75.37.140","TCP","54","61013  >  443 [ACK] Seq=9053 Ack=87194 Win=1025 Len=0"
"156","1.769553","146.75.37.140","192.168.12.35","TLSv1.2","121","Application Data"
"157","1.769553","146.75.37.140","192.168.12.35","TLSv1.2","350","Application Data"
"158","1.769553","146.75.37.140","192.168.12.35","TLSv1.2","242","Application Data"
"159","1.769553","146.75.37.140","192.168.12.35","TLSv1.2","243","Application Data"
"160","1.769553","146.75.37.140","192.168.12.35","TLSv1.2","514","Application Data"
"161","1.769553","146.75.37.140","192.168.12.35","TLSv1.2","270","Application Data"
"162","1.769553","146.75.37.140","192.168.12.35","TLSv1.2","414","Application Data"
"163","1.769553","146.75.37.140","192.168.12.35","TLSv1.2","349","Application Data"
"164","1.769553","146.75.37.140","192.168.12.35","TLSv1.2","117","Application Data"
"165","1.769553","146.75.37.140","192.168.12.35","TLSv1.2","125","Application Data"
"166","1.769553","146.75.37.140","192.168.12.35","TLSv1.2","104","Application Data"
"167","1.769553","146.75.37.140","192.168.12.35","TLSv1.2","181","Application Data"
"168","1.769553","146.75.37.140","192.168.12.35","TLSv1.2","114","Application Data"
"169","1.769553","146.75.37.140","192.168.12.35","TLSv1.2","518","Application Data"
"170","1.769553","146.75.37.140","192.168.12.35","TLSv1.2","659","Application Data"
"171","1.769553","146.75.37.140","192.168.12.35","TLSv1.2","702","Application Data"
"172","1.769553","146.75.37.140","192.168.12.35","TLSv1.2","310","Application Data"
"173","1.769553","146.75.37.140","192.168.12.35","TLSv1.2","605","Application Data"
"174","1.769553","146.75.37.140","192.168.12.35","TLSv1.2","717","Application Data"
"175","1.769553","146.75.37.140","192.168.12.35","TLSv1.2","394","Application Data"
"176","1.769553","146.75.37.140","192.168.12.35","TLSv1.2","589","Application Data"
"177","1.769553","146.75.37.140","192.168.12.35","TLSv1.2","404","Application Data"
"178","1.769553","146.75.37.140","192.168.12.35","TLSv1.2","97","Application Data"
"179","1.769553","146.75.37.140","192.168.12.35","TLSv1.2","238","Application Data"
"180","1.769553","146.75.37.140","192.168.12.35","TLSv1.2","150","Application Data"
"181","1.769553","146.75.37.140","192.168.12.35","TLSv1.2","104","Application Data"
"182","1.769553","146.75.37.140","192.168.12.35","TLSv1.2","536","Application Data"
"183","1.770208","192.168.12.35","146.75.37.140","TCP","54","61013  >  443 [ACK] Seq=9053 Ack=87969 Win=1022 Len=0"
"184","1.770309","192.168.12.35","146.75.37.140","TCP","54","61013  >  443 [ACK] Seq=9053 Ack=88453 Win=1020 Len=0"
"185","1.770337","192.168.12.35","146.75.37.140","TCP","54","61013  >  443 [ACK] Seq=9053 Ack=89102 Win=1025 Len=0"
"186","1.770360","192.168.12.35","146.75.37.140","TCP","54","61013  >  443 [ACK] Seq=9053 Ack=89678 Win=1022 Len=0"
"187","1.770385","192.168.12.35","146.75.37.140","TCP","54","61013  >  443 [ACK] Seq=9053 Ack=90036 Win=1021 Len=0"
"188","1.770429","192.168.12.35","146.75.37.140","TCP","54","61013  >  443 [ACK] Seq=9053 Ack=90157 Win=1021 Len=0"
"189","1.770495","192.168.12.35","146.75.37.140","TCP","54","61013  >  443 [ACK] Seq=9053 Ack=90344 Win=1020 Len=0"
"190","1.770548","192.168.12.35","146.75.37.140","TCP","54","61013  >  443 [ACK] Seq=9053 Ack=91413 Win=1025 Len=0"
"191","1.770592","192.168.12.35","146.75.37.140","TCP","54","61013  >  443 [ACK] Seq=9053 Ack=92317 Win=1021 Len=0"
"192","1.770627","192.168.12.35","146.75.37.140","TCP","54","61013  >  443 [ACK] Seq=9053 Ack=93531 Win=1025 Len=0"
"193","1.770679","192.168.12.35","146.75.37.140","TCP","54","61013  >  443 [ACK] Seq=9053 Ack=94406 Win=1021 Len=0"
"194","1.770724","192.168.12.35","146.75.37.140","TCP","54","61013  >  443 [ACK] Seq=9053 Ack=94799 Win=1020 Len=0"
"195","1.770775","192.168.12.35","146.75.37.140","TCP","54","61013  >  443 [ACK] Seq=9053 Ack=95079 Win=1025 Len=0"
"196","1.770811","192.168.12.35","146.75.37.140","TCP","54","61013  >  443 [ACK] Seq=9053 Ack=95611 Win=1023 Len=0"
"197","1.808636","192.168.12.35","146.75.37.140","TLSv1.2","3186","Application Data"
"198","1.808764","192.168.12.35","146.75.37.140","TLSv1.2","718","Application Data"
"199","1.808827","192.168.12.35","146.75.37.140","TLSv1.2","3189","Application Data"
"200","1.820600","192.168.12.35","146.75.37.140","TLSv1.2","3199","Application Data"
"201","1.853100","146.75.37.140","192.168.12.35","TCP","54","443  >  61013 [ACK] Seq=95611 Ack=10449 Win=6036 Len=0"
"202","1.857711","146.75.37.140","192.168.12.35","TCP","54","443  >  61013 [ACK] Seq=95611 Ack=11845 Win=6042 Len=0"
"203","1.857711","146.75.37.140","192.168.12.35","TCP","54","443  >  61013 [ACK] Seq=95611 Ack=12185 Win=6042 Len=0"
"204","1.862676","146.75.37.140","192.168.12.35","TCP","54","443  >  61013 [ACK] Seq=95611 Ack=12849 Win=6042 Len=0"
"205","1.867037","192.168.12.35","146.75.37.140","TLSv1.2","3177","Application Data"
"206","1.867187","192.168.12.35","146.75.37.140","TLSv1.2","210","Application Data"
"207","1.882894","146.75.37.140","192.168.12.35","TCP","54","443  >  61013 [ACK] Seq=95611 Ack=14245 Win=6047 Len=0"
"208","1.898353","146.75.37.140","192.168.12.35","TCP","1430","443  >  61013 [ACK] Seq=95611 Ack=14245 Win=6047 Len=1376 [TCP PDU reassembled in 209]"
"209","1.898353","146.75.37.140","192.168.12.35","TLSv1.2","767","Application Data"
"210","1.898353","146.75.37.140","192.168.12.35","TLSv1.2","87","Application Data"
"211","1.898353","146.75.37.140","192.168.12.35","TCP","54","443  >  61013 [ACK] Seq=97733 Ack=15641 Win=6053 Len=0"
"212","1.898543","192.168.12.35","146.75.37.140","TCP","54","61013  >  443 [ACK] Seq=22408 Ack=97700 Win=1025 Len=0"
"213","1.900734","192.168.12.35","146.75.37.140","TLSv1.2","3288","Application Data"
"214","1.907855","146.75.37.140","192.168.12.35","TCP","54","443  >  61013 [ACK] Seq=97733 Ack=15984 Win=6053 Len=0"
"215","1.912375","192.168.12.35","146.75.37.140","TLSv1.2","3194","Application Data"
"216","1.912524","192.168.12.35","146.75.37.140","TLSv1.2","3209","Application Data"
"217","1.912552","192.168.12.35","146.75.37.140","TLSv1.2","3186","Application Data"
"218","1.923759","146.75.37.140","192.168.12.35","TCP","54","443  >  61013 [ACK] Seq=97733 Ack=17380 Win=6058 Len=0"
"219","1.932797","146.75.37.140","192.168.12.35","TCP","1430","443  >  61013 [ACK] Seq=97733 Ack=17380 Win=6058 Len=1376 [TCP PDU reassembled in 220]"
"220","1.932797","146.75.37.140","192.168.12.35","TLSv1.2","484","Application Data"
"221","1.933008","192.168.12.35","146.75.37.140","TCP","54","61013  >  443 [ACK] Seq=35069 Ack=99109 Win=1025 Len=0"
"222","1.933063","192.168.12.35","146.75.37.140","TCP","54","61013  >  443 [ACK] Seq=35069 Ack=99539 Win=1023 Len=0"
"223","1.938305","146.75.37.140","192.168.12.35","TCP","54","443  >  61013 [ACK] Seq=99539 Ack=18776 Win=6063 Len=0"
"224","1.938803","192.168.12.35","146.75.37.140","TLSv1.2","146","Application Data"
"225","1.938911","192.168.12.35","146.75.37.140","TLSv1.2","93","Application Data"
"226","1.940132","192.168.12.35","146.75.37.140","TLSv1.2","174","Application Data"
"227","1.944135","146.75.37.140","192.168.12.35","TCP","54","443  >  61013 [ACK] Seq=99539 Ack=19129 Win=6063 Len=0"
"228","1.963112","146.75.37.140","192.168.12.35","TCP","54","443  >  61013 [ACK] Seq=99539 Ack=20525 Win=6069 Len=0"
"229","1.963112","146.75.37.140","192.168.12.35","TCP","1430","443  >  61013 [ACK] Seq=99539 Ack=20525 Win=6069 Len=1376 [TCP PDU reassembled in 230]"
"230","1.963112","146.75.37.140","192.168.12.35","TLSv1.2","897","Application Data"
"231","1.963327","192.168.12.35","146.75.37.140","TCP","54","61013  >  443 [ACK] Seq=35069 Ack=100915 Win=1025 Len=0"
"232","1.963412","192.168.12.35","146.75.37.140","TCP","54","61013  >  443 [ACK] Seq=35069 Ack=101758 Win=1021 Len=0"
"233","1.988050","146.75.37.140","192.168.12.35","TCP","54","443  >  61013 [ACK] Seq=101758 Ack=21921 Win=6074 Len=0"
"234","1.993227","146.75.37.140","192.168.12.35","TCP","54","443  >  61013 [ACK] Seq=101758 Ack=22252 Win=6074 Len=0"
"235","1.993227","146.75.37.140","192.168.12.35","TCP","54","443  >  61013 [ACK] Seq=101758 Ack=22408 Win=6074 Len=0"
"236","1.993490","192.168.12.35","146.75.37.140","TLSv1.2","3144","Application Data"
"237","1.999803","146.75.37.140","192.168.12.35","TLSv1.2","604","Application Data"
"238","2.023311","146.75.37.140","192.168.12.35","TCP","54","443  >  61013 [ACK] Seq=102308 Ack=23804 Win=6080 Len=0"
"239","2.039906","146.75.37.140","192.168.12.35","TCP","54","443  >  61013 [ACK] Seq=102308 Ack=25200 Win=6085 Len=0"
"240","2.039906","146.75.37.140","192.168.12.35","TCP","54","443  >  61013 [ACK] Seq=102308 Ack=25642 Win=6085 Len=0"
"241","2.044295","192.168.12.35","146.75.37.140","TCP","54","61013  >  443 [ACK] Seq=38159 Ack=102308 Win=1019 Len=0"
"242","2.063265","146.75.37.140","192.168.12.35","TCP","54","443  >  61013 [ACK] Seq=102308 Ack=27038 Win=6091 Len=0"
"243","2.079592","146.75.37.140","192.168.12.35","TCP","1430","443  >  61013 [ACK] Seq=102308 Ack=27038 Win=6091 Len=1376 [TCP PDU reassembled in 244]"
"244","2.079592","146.75.37.140","192.168.12.35","TLSv1.2","467","Application Data"
"245","2.079592","146.75.37.140","192.168.12.35","TLSv1.2","100","Application Data"
"246","2.080231","192.168.12.35","146.75.37.140","TCP","54","61013  >  443 [ACK] Seq=38159 Ack=103684 Win=1025 Len=0"
"247","2.080532","192.168.12.35","146.75.37.140","TCP","54","61013  >  443 [ACK] Seq=38159 Ack=104097 Win=1023 Len=0"
"248","2.084383","146.75.37.140","192.168.12.35","TCP","54","443  >  61013 [ACK] Seq=104143 Ack=28434 Win=6096 Len=0"
"249","2.084383","146.75.37.140","192.168.12.35","TCP","54","443  >  61013 [ACK] Seq=104143 Ack=28782 Win=6096 Len=0"
"250","2.084383","146.75.37.140","192.168.12.35","TCP","1430","443  >  61013 [ACK] Seq=104143 Ack=28782 Win=6096 Len=1376 [TCP PDU reassembled in 251]"
"251","2.084383","146.75.37.140","192.168.12.35","TLSv1.2","943","Application Data"
"252","2.085046","192.168.12.35","146.75.37.140","TCP","54","61013  >  443 [ACK] Seq=38159 Ack=105519 Win=1025 Len=0"
"253","2.102969","146.75.37.140","192.168.12.35","TCP","54","443  >  61013 [ACK] Seq=106408 Ack=30178 Win=6102 Len=0"
"254","2.120274","146.75.37.140","192.168.12.35","TCP","1430","443  >  61013 [ACK] Seq=106408 Ack=30178 Win=6102 Len=1376 [TCP PDU reassembled in 255]"
"255","2.120274","146.75.37.140","192.168.12.35","TLSv1.2","540","Application Data"
"256","2.120274","146.75.37.140","192.168.12.35","TLSv1.2","100","Application Data"
"257","2.120274","146.75.37.140","192.168.12.35","TCP","54","443  >  61013 [ACK] Seq=108316 Ack=31574 Win=6107 Len=0"
"258","2.120274","146.75.37.140","192.168.12.35","TCP","54","443  >  61013 [ACK] Seq=108316 Ack=31937 Win=6107 Len=0"
"259","2.120883","192.168.12.35","146.75.37.140","TCP","54","61013  >  443 [ACK] Seq=38159 Ack=107784 Win=1025 Len=0"
"260","2.121103","192.168.12.35","146.75.37.140","TCP","54","61013  >  443 [ACK] Seq=38159 Ack=108316 Win=1023 Len=0"
"261","2.142781","146.75.37.140","192.168.12.35","TCP","54","443  >  61013 [ACK] Seq=108316 Ack=33333 Win=6113 Len=0"
"262","2.162900","146.75.37.140","192.168.12.35","TCP","54","443  >  61013 [ACK] Seq=108316 Ack=34729 Win=6118 Len=0"
"263","2.168087","146.75.37.140","192.168.12.35","TCP","54","443  >  61013 [ACK] Seq=108316 Ack=35069 Win=6118 Len=0"
"264","2.168087","146.75.37.140","192.168.12.35","TCP","1430","443  >  61013 [ACK] Seq=108316 Ack=35069 Win=6118 Len=1376 [TCP PDU reassembled in 266]"
"265","2.168422","192.168.12.35","146.75.37.140","TCP","54","61013  >  443 [ACK] Seq=38159 Ack=109692 Win=1025 Len=0"
"266","2.174170","146.75.37.140","192.168.12.35","TLSv1.2","798","Application Data"
"267","2.174170","146.75.37.140","192.168.12.35","TLSv1.2","100","Application Data"
"268","2.174480","192.168.12.35","146.75.37.140","TCP","54","61013  >  443 [ACK] Seq=38159 Ack=110436 Win=1022 Len=0"
"269","2.200700","146.75.37.140","192.168.12.35","TCP","54","443  >  61155 [ACK] Seq=1 Ack=93 Win=302 Len=0"
"270","2.200700","146.75.37.140","192.168.12.35","TCP","54","443  >  61155 [ACK] Seq=1 Ack=132 Win=302 Len=0"
"271","2.200700","146.75.37.140","192.168.12.35","TLSv1.2","93","Application Data"
"272","2.200700","146.75.37.140","192.168.12.35","TLSv1.2","179","Application Data"
"273","2.200700","146.75.37.140","192.168.12.35","TLSv1.2","1430","Application Data"
"274","2.200700","146.75.37.140","192.168.12.35","TLSv1.2","1430","Application Data"
"275","2.200700","146.75.37.140","192.168.12.35","TLSv1.2","1430","Application Data"
"276","2.200700","146.75.37.140","192.168.12.35","TLSv1.2","1430","Application Data"
"277","2.201659","192.168.12.35","146.75.37.140","TCP","54","61155  >  443 [ACK] Seq=252 Ack=165 Win=1023 Len=0"
"278","2.201898","192.168.12.35","146.75.37.140","TCP","54","61155  >  443 [ACK] Seq=252 Ack=5669 Win=1025 Len=0"
"279","2.204137","192.168.12.35","146.75.37.140","TLSv1.2","89","Application Data"
"280","2.211193","146.75.37.140","192.168.12.35","TLSv1.2","1158","Application Data"
"281","2.211193","146.75.37.140","192.168.12.35","TCP","54","443  >  61155 [ACK] Seq=6773 Ack=252 Win=302 Len=0"
"282","2.211193","146.75.37.140","192.168.12.35","TLSv1.2","121","Application Data"
"283","2.211608","192.168.12.35","146.75.37.140","TCP","54","61155  >  443 [ACK] Seq=287 Ack=6840 Win=1020 Len=0"
"284","2.216555","192.168.12.35","146.75.37.140","TCP","54","61013  >  443 [ACK] Seq=38159 Ack=110482 Win=1022 Len=0"
"285","2.217856","146.75.37.140","192.168.12.35","TCP","1430","443  >  61013 [ACK] Seq=110482 Ack=35069 Win=6118 Len=1376 [TCP PDU reassembled in 286]"
"286","2.217856","146.75.37.140","192.168.12.35","TLSv1.2","513","Application Data"
"287","2.217856","146.75.37.140","192.168.12.35","TLSv1.2","100","Application Data"
"288","2.218025","192.168.12.35","146.75.37.140","TCP","54","61013  >  443 [ACK] Seq=38159 Ack=111858 Win=1025 Len=0"
"289","2.218095","192.168.12.35","146.75.37.140","TCP","54","61013  >  443 [ACK] Seq=38159 Ack=112317 Win=1023 Len=0"
"290","2.223362","146.75.37.140","192.168.12.35","TCP","54","443  >  61013 [ACK] Seq=112363 Ack=36465 Win=6123 Len=0"
"291","2.225140","192.168.12.35","146.75.37.140","TCP","66","62083  >  443 [SYN] Seq=0 Win=64240 Len=0 MSS=1460 WS=256 SACK_PERM"
"292","2.230160","146.75.37.140","192.168.12.35","TCP","54","443  >  61013 [ACK] Seq=112363 Ack=37861 Win=6129 Len=0"
"293","2.239384","146.75.37.140","192.168.12.35","TCP","54","443  >  61013 [ACK] Seq=112363 Ack=38159 Win=6129 Len=0"
"294","2.248266","146.75.37.140","192.168.12.35","TCP","66","443  >  62083 [SYN, ACK] Seq=0 Ack=1 Win=65535 Len=0 MSS=1396 SACK_PERM WS=512"
"295","2.248604","192.168.12.35","146.75.37.140","TCP","54","62083  >  443 [ACK] Seq=1 Ack=1 Win=262400 Len=0"
"296","2.249480","192.168.12.35","146.75.37.140","TLSv1.3","1848","Client Hello (SNI=www.redditstatic.com)"
"297","2.257868","146.75.37.140","192.168.12.35","TCP","1430","443  >  61013 [ACK] Seq=112363 Ack=38159 Win=6129 Len=1376 [TCP PDU reassembled in 298]"
"298","2.257868","146.75.37.140","192.168.12.35","TLSv1.2","833","Application Data"
"299","2.257990","192.168.12.35","146.75.37.140","TCP","54","61013  >  443 [ACK] Seq=38159 Ack=113739 Win=1025 Len=0"
"300","2.280456","146.75.37.140","192.168.12.35","TLSv1.2","947","Application Data"
"301","2.280456","146.75.37.140","192.168.12.35","TLSv1.2","95","Application Data"
"302","2.280729","192.168.12.35","146.75.37.140","TCP","54","61013  >  443 [ACK] Seq=38159 Ack=115411 Win=1025 Len=0"
"303","2.308547","192.168.12.35","146.75.37.140","TCP","1450","[TCP Retransmission] 62083  >  443 [PSH, ACK] Seq=399 Ack=1 Win=262400 Len=1396"
"304","2.311575","146.75.37.140","192.168.12.35","TCP","1430","443  >  61013 [ACK] Seq=115452 Ack=38159 Win=6129 Len=1376 [TCP PDU reassembled in 305]"
"305","2.311575","146.75.37.140","192.168.12.35","TLSv1.2","112","Application Data"
"306","2.311575","146.75.37.140","192.168.12.35","TLSv1.2","610","Application Data"
"307","2.311575","146.75.37.140","192.168.12.35","TLSv1.2","367","Application Data"
"308","2.311997","192.168.12.35","146.75.37.140","TCP","54","61013  >  443 [ACK] Seq=38159 Ack=116828 Win=1025 Len=0"
"309","2.312138","192.168.12.35","146.75.37.140","TCP","54","61013  >  443 [ACK] Seq=38159 Ack=117442 Win=1022 Len=0"
"310","2.314343","146.75.37.140","192.168.12.35","TLSv1.2","85","Application Data"
"311","2.314441","192.168.12.35","146.75.37.140","TCP","54","61013  >  443 [ACK] Seq=38159 Ack=117786 Win=1021 Len=0"
"312","2.349835","146.75.37.140","192.168.12.35","TCP","54","443  >  61155 [ACK] Seq=6840 Ack=287 Win=302 Len=0"
"313","2.400837","146.75.37.140","192.168.12.35","TCP","54","443  >  62083 [ACK] Seq=1 Ack=1397 Win=148992 Len=0"
"314","2.402226","192.168.12.35","146.75.37.140","UDP","1292","63474  >  443 Len=1250"
"315","2.402255","192.168.12.35","146.75.37.140","UDP","546","63474  >  443 Len=504"
"316","2.411430","192.168.12.35","146.75.37.140","UDP","1292","63474  >  443 Len=1250"
"317","2.411511","192.168.12.35","146.75.37.140","UDP","543","63474  >  443 Len=501"
"318","2.414338","146.75.37.140","192.168.12.35","TCP","54","443  >  62083 [ACK] Seq=1 Ack=1795 Win=152064 Len=0"
"319","2.414338","146.75.37.140","192.168.12.35","TLSv1.3","1430","Server Hello, Change Cipher Spec, Application Data"
"320","2.414338","146.75.37.140","192.168.12.35","TCP","1430","443  >  62083 [PSH, ACK] Seq=1377 Ack=1795 Win=152064 Len=1376 [TCP PDU reassembled in 322]"
"321","2.414338","146.75.37.140","192.168.12.35","TCP","1430","443  >  62083 [ACK] Seq=2753 Ack=1795 Win=152064 Len=1376 [TCP PDU reassembled in 322]"
"322","2.414338","146.75.37.140","192.168.12.35","TLSv1.3","1263","Application Data, Application Data, Application Data, Application Data"
"323","2.414690","192.168.12.35","146.75.37.140","TCP","54","62083  >  443 [ACK] Seq=1795 Ack=4129 Win=262400 Len=0"
"324","2.414830","192.168.12.35","146.75.37.140","TCP","54","62083  >  443 [ACK] Seq=1795 Ack=5338 Win=261120 Len=0"
"325","2.415248","192.168.12.35","146.75.37.140","TLSv1.3","118","Change Cipher Spec, Application Data"
"326","2.415708","192.168.12.35","146.75.37.140","TLSv1.3","146","Application Data"
"327","2.415891","192.168.12.35","146.75.37.140","TLSv1.3","538","Application Data"
"328","2.417825","192.168.12.35","146.75.37.140","UDP","1292","63474  >  443 Len=1250"
"329","2.417863","192.168.12.35","146.75.37.140","UDP","1020","63474  >  443 Len=978"
"330","2.458365","146.75.37.140","192.168.12.35","TCP","66","[TCP Dup ACK 318#1] 443  >  62083 [ACK] Seq=5338 Ack=1795 Win=152064 Len=0 SLE=399 SRE=1795"
"331","2.554231","192.168.12.35","146.75.37.140","TLSv1.2","3349","Application Data"
"332","2.554320","192.168.12.35","146.75.37.140","TLSv1.2","134","Application Data"
"333","2.558768","146.75.37.140","192.168.12.35","UDP","67","443  >  63474 Len=25"
"334","2.578334","146.75.37.140","192.168.12.35","UDP","952","443  >  63474 Len=910"
"335","2.583687","146.75.37.140","192.168.12.35","TCP","54","443  >  62083 [ACK] Seq=5338 Ack=1859 Win=152064 Len=0"
"336","2.583687","146.75.37.140","192.168.12.35","UDP","67","443  >  63474 Len=25"
"337","2.586924","192.168.12.35","146.75.37.140","UDP","84","63474  >  443 Len=42"
"338","2.600009","146.75.37.140","192.168.12.35","TCP","54","443  >  62083 [ACK] Seq=5338 Ack=1951 Win=152064 Len=0"
"339","2.600009","146.75.37.140","192.168.12.35","TLSv1.3","119","Application Data"
"340","2.600009","146.75.37.140","192.168.12.35","TCP","54","443  >  62083 [ACK] Seq=5403 Ack=2435 Win=154624 Len=0"
"341","2.600009","146.75.37.140","192.168.12.35","TLSv1.3","1430","Application Data"
"342","2.600009","146.75.37.140","192.168.12.35","TLSv1.3","1117","Application Data"
"343","2.600339","192.168.12.35","146.75.37.140","TCP","54","62083  >  443 [ACK] Seq=2435 Ack=6779 Win=262400 Len=0"
"344","2.601343","192.168.12.35","146.75.37.140","TLSv1.3","85","Application Data"
"345","2.607848","192.168.12.35","146.75.37.140","TLSv1.3","196","Application Data"
"346","2.607935","192.168.12.35","146.75.37.140","TLSv1.3","147","Application Data"
"347","2.609187","192.168.12.35","146.75.37.140","TLSv1.3","138","Application Data"
"348","2.613905","146.75.37.140","192.168.12.35","UDP","1322","443  >  63474 Len=1280"
"349","2.613905","146.75.37.140","192.168.12.35","UDP","638","443  >  63474 Len=596"
"350","2.623338","146.75.37.140","192.168.12.35","UDP","67","443  >  63474 Len=25"
"351","2.623904","192.168.12.35","146.75.37.140","UDP","83","63474  >  443 Len=41"
"352","2.647861","146.75.37.140","192.168.12.35","UDP","834","443  >  63474 Len=792"
"353","2.647861","146.75.37.140","192.168.12.35","UDP","453","443  >  63474 Len=411"
"354","2.654253","146.75.37.140","192.168.12.35","TCP","54","443  >  61013 [ACK] Seq=117786 Ack=39555 Win=6134 Len=0"
"355","2.655334","192.168.12.35","146.75.37.140","UDP","84","63474  >  443 Len=42"
"356","2.658982","192.168.12.35","146.75.37.140","UDP","1292","63474  >  443 Len=1250"
"357","2.659161","192.168.12.35","146.75.37.140","UDP","1022","63474  >  443 Len=980"
"358","2.680196","146.75.37.140","192.168.12.35","TCP","54","443  >  61013 [ACK] Seq=117786 Ack=40951 Win=6140 Len=0"
"359","2.694370","146.75.37.140","192.168.12.35","TCP","54","443  >  61013 [ACK] Seq=117786 Ack=41454 Win=6140 Len=0"
"360","2.694370","146.75.37.140","192.168.12.35","TCP","54","443  >  61013 [ACK] Seq=117786 Ack=41534 Win=6140 Len=0"
"361","2.708752","146.75.37.140","192.168.12.35","TCP","54","443  >  62083 [ACK] Seq=7842 Ack=2466 Win=154624 Len=0"
"362","2.708752","146.75.37.140","192.168.12.35","TCP","54","443  >  62083 [ACK] Seq=7842 Ack=2608 Win=157184 Len=0"
"363","2.708752","146.75.37.140","192.168.12.35","TLSv1.3","1430","Application Data"
"364","2.708752","146.75.37.140","192.168.12.35","TLSv1.3","1430","Application Data"
"365","2.708752","146.75.37.140","192.168.12.35","TLSv1.3","1430","Application Data"
"366","2.708752","146.75.37.140","192.168.12.35","TLSv1.3","1430","Application Data"
"367","2.708752","146.75.37.140","192.168.12.35","TLSv1.3","1430","Application Data"
"368","2.708752","146.75.37.140","192.168.12.35","TLSv1.3","1430","Application Data"
"369","2.708752","146.75.37.140","192.168.12.35","TLSv1.3","1430","Application Data"
"370","2.708752","146.75.37.140","192.168.12.35","TLSv1.3","1430","Application Data"
"371","2.709267","192.168.12.35","146.75.37.140","TCP","54","62083  >  443 [ACK] Seq=2785 Ack=18850 Win=262400 Len=0"
"372","2.714799","146.75.37.140","192.168.12.35","TCP","54","443  >  62083 [ACK] Seq=18850 Ack=2701 Win=157184 Len=0"
"373","2.714799","146.75.37.140","192.168.12.35","TCP","54","443  >  62083 [ACK] Seq=18850 Ack=2785 Win=157184 Len=0"
"374","2.714799","146.75.37.140","192.168.12.35","TLSv1.3","1430","Application Data"
"375","2.714799","146.75.37.140","192.168.12.35","TLSv1.3","1430","Application Data"
"376","2.714799","146.75.37.140","192.168.12.35","TLSv1.3","1430","Application Data"
"377","2.714799","146.75.37.140","192.168.12.35","TLSv1.3","429","Application Data"
