"No.","Time","Source","Destination","Protocol","Length","Info"
"1","0.000000","192.168.12.35","146.75.37.140","UDP","80","52870  >  443 Len=38"
"2","0.592917","192.168.12.35","146.75.37.140","UDP","80","52870  >  443 Len=38"
"3","0.680119","146.75.37.140","192.168.12.35","UDP","71","443  >  52870 Len=29"
"4","0.955054","146.75.37.140","192.168.12.35","UDP","73","443  >  52870 Len=31"
"5","0.958596","192.168.12.35","146.75.37.140","TLSv1.2","3240","Application Data"
"6","0.958644","192.168.12.35","146.75.37.140","TLSv1.2","93","Application Data"
"7","0.958663","192.168.12.35","146.75.37.140","TLSv1.2","3358","Application Data"
"8","0.958689","192.168.12.35","146.75.37.140","TLSv1.2","2533","Application Data"
"9","1.012704","146.75.37.140","192.168.12.35","TCP","54","443  >  61013 [ACK] Seq=1 Ack=1397 Win=8244 Len=0"
"10","1.012704","146.75.37.140","192.168.12.35","TCP","54","443  >  61013 [ACK] Seq=1 Ack=2793 Win=8244 Len=0"
"11","1.027697","146.75.37.140","192.168.12.35","TCP","54","443  >  61013 [ACK] Seq=1 Ack=3187 Win=8244 Len=0"
"12","1.027697","146.75.37.140","192.168.12.35","TCP","54","443  >  61013 [ACK] Seq=1 Ack=3226 Win=8244 Len=0"
"13","1.027697","146.75.37.140","192.168.12.35","TLSv1.2","93","Application Data"
"14","1.027982","192.168.12.35","146.75.37.140","TCP","54","61013  >  443 [ACK] Seq=9009 Ack=40 Win=1025 Len=0"
"15","1.044066","146.75.37.140","192.168.12.35","TCP","54","443  >  61013 [ACK] Seq=40 Ack=4622 Win=8244 Len=0"
"16","1.074693","146.75.37.140","192.168.12.35","TCP","54","443  >  61013 [ACK] Seq=40 Ack=6018 Win=8244 Len=0"
"17","1.074693","146.75.37.140","192.168.12.35","TCP","1430","443  >  61013 [ACK] Seq=40 Ack=6018 Win=8244 Len=1376 [TCP PDU reassembled in 18]"
"18","1.074693","146.75.37.140","192.168.12.35","TLSv1.2","1058","Application Data"
"19","1.074693","146.75.37.140","192.168.12.35","TCP","1430","443  >  61013 [ACK] Seq=2420 Ack=6018 Win=8244 Len=1376 [TCP PDU reassembled in 20]"
"20","1.074693","146.75.37.140","192.168.12.35","TLSv1.2","1070","Application Data"
"21","1.075142","192.168.12.35","146.75.37.140","TCP","54","61013  >  443 [ACK] Seq=9009 Ack=2420 Win=1025 Len=0"
"22","1.075249","192.168.12.35","146.75.37.140","TCP","54","61013  >  443 [ACK] Seq=9009 Ack=4812 Win=1025 Len=0"
"23","1.078735","146.75.37.140","192.168.12.35","TCP","1430","443  >  61013 [ACK] Seq=4812 Ack=6018 Win=8244 Len=1376 [TCP PDU reassembled in 33]"
"24","1.078735","146.75.37.140","192.168.12.35","TCP","1430","443  >  61013 [ACK] Seq=6188 Ack=6018 Win=8244 Len=1376 [TCP PDU reassembled in 33]"
"25","1.078735","146.75.37.140","192.168.12.35","TCP","1430","443  >  61013 [ACK] Seq=7564 Ack=6018 Win=8244 Len=1376 [TCP PDU reassembled in 33]"
"26","1.078735","146.75.37.140","192.168.12.35","TCP","1430","443  >  61013 [PSH, ACK] Seq=8940 Ack=6018 Win=8244 Len=1376 [TCP PDU reassembled in 33]"
"27","1.078735","146.75.37.140","192.168.12.35","TCP","1430","443  >  61013 [ACK] Seq=10316 Ack=6018 Win=8244 Len=1376 [TCP PDU reassembled in 33]"
"28","1.078735","146.75.37.140","192.168.12.35","TCP","1430","443  >  61013 [ACK] Seq=11692 Ack=6018 Win=8244 Len=1376 [TCP PDU reassembled in 33]"
"29","1.078735","146.75.37.140","192.168.12.35","TCP","1430","443  >  61013 [ACK] Seq=13068 Ack=6018 Win=8244 Len=1376 [TCP PDU reassembled in 33]"
"30","1.078735","146.75.37.140","192.168.12.35","TCP","1430","443  >  61013 [PSH, ACK] Seq=14444 Ack=6018 Win=8244 Len=1376 [TCP PDU reassembled in 33]"
"31","1.078735","146.75.37.140","192.168.12.35","TCP","1430","443  >  61013 [ACK] Seq=15820 Ack=6018 Win=8244 Len=1376 [TCP PDU reassembled in 33]"
"32","1.078735","146.75.37.140","192.168.12.35","TCP","1430","443  >  61013 [ACK] Seq=17196 Ack=6018 Win=8244 Len=1376 [TCP PDU reassembled in 33]"
"33","1.078735","146.75.37.140","192.168.12.35","TLSv1.2","348","Application Data"
"34","1.078735","146.75.37.140","192.168.12.35","TCP","54","443  >  61013 [ACK] Seq=18866 Ack=6530 Win=8244 Len=0"
"35","1.078735","146.75.37.140","192.168.12.35","TLSv1.2","870","Application Data"
"36","1.078735","146.75.37.140","192.168.12.35","TCP","1430","443  >  61013 [ACK] Seq=19682 Ack=6530 Win=8244 Len=1376 [TCP PDU reassembled in 47]"
"37","1.078735","146.75.37.140","192.168.12.35","TCP","1430","443  >  61013 [ACK] Seq=21058 Ack=6530 Win=8244 Len=1376 [TCP PDU reassembled in 47]"
"38","1.078735","146.75.37.140","192.168.12.35","TCP","1430","443  >  61013 [ACK] Seq=22434 Ack=6530 Win=8244 Len=1376 [TCP PDU reassembled in 47]"
"39","1.078735","146.75.37.140","192.168.12.35","TCP","1430","443  >  61013 [PSH, ACK] Seq=23810 Ack=6530 Win=8244 Len=1376 [TCP PDU reassembled in 47]"
"40","1.078735","146.75.37.140","192.168.12.35","TCP","1430","443  >  61013 [ACK] Seq=25186 Ack=6530 Win=8244 Len=1376 [TCP PDU reassembled in 47]"
"41","1.078735","146.75.37.140","192.168.12.35","TCP","1430","443  >  61013 [ACK] Seq=26562 Ack=6530 Win=8244 Len=1376 [TCP PDU reassembled in 47]"
"42","1.078735","146.75.37.140","192.168.12.35","TCP","1430","443  >  61013 [ACK] Seq=27938 Ack=6530 Win=8244 Len=1376 [TCP PDU reassembled in 47]"
"43","1.078735","146.75.37.140","192.168.12.35","TCP","1430","443  >  61013 [PSH, ACK] Seq=29314 Ack=6530 Win=8244 Len=1376 [TCP PDU reassembled in 47]"
"44","1.078735","146.75.37.140","192.168.12.35","TCP","1430","443  >  61013 [ACK] Seq=30690 Ack=6530 Win=8244 Len=1376 [TCP PDU reassembled in 47]"
"45","1.078735","146.75.37.140","192.168.12.35","TCP","1430","443  >  61013 [ACK] Seq=32066 Ack=6530 Win=8244 Len=1376 [TCP PDU reassembled in 47]"
"46","1.078735","146.75.37.140","192.168.12.35","TCP","1430","443  >  61013 [ACK] Seq=33442 Ack=6530 Win=8244 Len=1376 [TCP PDU reassembled in 47]"
"47","1.078735","146.75.37.140","192.168.12.35","TLSv1.2","548","Application Data"
"48","1.078735","146.75.37.140","192.168.12.35","TCP","1430","443  >  61013 [ACK] Seq=35312 Ack=6530 Win=8244 Len=1376 [TCP PDU reassembled in 59]"
"49","1.078735","146.75.37.140","192.168.12.35","TCP","1430","443  >  61013 [ACK] Seq=36688 Ack=6530 Win=8244 Len=1376 [TCP PDU reassembled in 59]"
"50","1.078735","146.75.37.140","192.168.12.35","TCP","1430","443  >  61013 [ACK] Seq=38064 Ack=6530 Win=8244 Len=1376 [TCP PDU reassembled in 59]"
"51","1.078735","146.75.37.140","192.168.12.35","TCP","1430","443  >  61013 [PSH, ACK] Seq=39440 Ack=6530 Win=8244 Len=1376 [TCP PDU reassembled in 59]"
"52","1.078735","146.75.37.140","192.168.12.35","TCP","1430","443  >  61013 [ACK] Seq=40816 Ack=6530 Win=8244 Len=1376 [TCP PDU reassembled in 59]"
"53","1.078735","146.75.37.140","192.168.12.35","TCP","1430","443  >  61013 [ACK] Seq=42192 Ack=6530 Win=8244 Len=1376 [TCP PDU reassembled in 59]"
"54","1.078735","146.75.37.140","192.168.12.35","TCP","1430","443  >  61013 [ACK] Seq=43568 Ack=6530 Win=8244 Len=1376 [TCP PDU reassembled in 59]"
"55","1.080026","146.75.37.140","192.168.12.35","TCP","1430","443  >  61013 [PSH, ACK] Seq=44944 Ack=6530 Win=8244 Len=1376 [TCP PDU reassembled in 59]"
"56","1.080026","146.75.37.140","192.168.12.35","TCP","1430","443  >  61013 [ACK] Seq=46320 Ack=6530 Win=8244 Len=1376 [TCP PDU reassembled in 59]"
"57","1.080026","146.75.37.140","192.168.12.35","TCP","1430","443  >  61013 [ACK] Seq=47696 Ack=6530 Win=8244 Len=1376 [TCP PDU reassembled in 59]"
"58","1.080026","146.75.37.140","192.168.12.35","TCP","1430","443  >  61013 [ACK] Seq=49072 Ack=6530 Win=8244 Len=1376 [TCP PDU reassembled in 59]"
"59","1.080026","146.75.37.140","192.168.12.35","TLSv1.2","1430","Application Data, Application Data"
"60","1.080026","146.75.37.140","192.168.12.35","TCP","1430","443  >  61013 [ACK] Seq=51824 Ack=6530 Win=8244 Len=1376 [TCP PDU reassembled in 61]"
"61","1.080026","146.75.37.140","192.168.12.35","TLSv1.2","1430","Application Data"
"62","1.080026","146.75.37.140","192.168.12.35","TLSv1.2","1430","Application Data"
"63","1.080026","146.75.37.140","192.168.12.35","TLSv1.2","1430","Application Data"
"64","1.080026","146.75.37.140","192.168.12.35","TLSv1.2","1038","Application Data"
"65","1.080065","192.168.12.35","146.75.37.140","TCP","54","61013  >  443 [ACK] Seq=9009 Ack=18572 Win=1025 Len=0"
"66","1.080381","192.168.12.35","146.75.37.140","TCP","54","61013  >  443 [ACK] Seq=9009 Ack=19682 Win=1020 Len=0"
"67","1.080327","146.75.37.140","192.168.12.35","TLSv1.2","603","Application Data"
"68","1.080473","192.168.12.35","146.75.37.140","TCP","54","61013  >  443 [ACK] Seq=9009 Ack=34818 Win=1025 Len=0"
"69","1.080573","192.168.12.35","146.75.37.140","TCP","54","61013  >  443 [ACK] Seq=9009 Ack=35312 Win=1023 Len=0"
"70","1.080638","192.168.12.35","146.75.37.140","TCP","54","61013  >  443 [ACK] Seq=9009 Ack=44944 Win=1025 Len=0"
"71","1.080724","192.168.12.35","146.75.37.140","TCP","54","61013  >  443 [ACK] Seq=9009 Ack=57328 Win=1025 Len=0"
"72","1.080813","192.168.12.35","146.75.37.140","TCP","54","61013  >  443 [ACK] Seq=9009 Ack=58861 Win=1025 Len=0"
"73","1.080935","192.168.12.35","146.75.37.140","TLSv1.2","89","Application Data"
"74","1.092191","146.75.37.140","192.168.12.35","TLSv1.2","841","Application Data"
"75","1.092191","146.75.37.140","192.168.12.35","TCP","54","443  >  61013 [ACK] Seq=59648 Ack=9009 Win=8244 Len=0"
"76","1.099579","146.75.37.140","192.168.12.35","TLSv1.2","112","Application Data"
"77","1.099774","192.168.12.35","146.75.37.140","TCP","54","61013  >  443 [ACK] Seq=9044 Ack=59706 Win=1021 Len=0"
"78","1.106752","146.75.37.140","192.168.12.35","TLSv1.2","117","Application Data"
"79","1.106752","146.75.37.140","192.168.12.35","TLSv1.2","181","Application Data"
"80","1.107045","192.168.12.35","146.75.37.140","TCP","54","61013  >  443 [ACK] Seq=9044 Ack=59896 Win=1021 Len=0"
"81","1.114026","146.75.37.140","192.168.12.35","TLSv1.2","187","Application Data"
"82","1.114026","146.75.37.140","192.168.12.35","TLSv1.2","232","Application Data"
"83","1.114026","146.75.37.140","192.168.12.35","TCP","54","443  >  61013 [ACK] Seq=60207 Ack=9044 Win=8244 Len=0"
"84","1.114581","192.168.12.35","146.75.37.140","TCP","54","61013  >  443 [ACK] Seq=9044 Ack=60207 Win=1019 Len=0"
"85","1.115896","192.168.12.35","146.75.37.140","UDP","96","52870  >  443 Len=54"
"86","1.120870","146.75.37.140","192.168.12.35","TCP","1430","443  >  61013 [ACK] Seq=60207 Ack=9044 Win=8244 Len=1376 [TCP PDU reassembled in 87]"
"87","1.120870","146.75.37.140","192.168.12.35","TLSv1.2","503","Application Data"
"88","1.121626","192.168.12.35","146.75.37.140","TCP","54","61013  >  443 [ACK] Seq=9044 Ack=62032 Win=1025 Len=0"
"89","1.142006","146.75.37.140","192.168.12.35","UDP","67","443  >  52870 Len=25"
"90","1.147517","146.75.37.140","192.168.12.35","TLSv1.2","582","Application Data"
"91","1.147517","146.75.37.140","192.168.12.35","TCP","1430","443  >  61013 [ACK] Seq=62560 Ack=9044 Win=8244 Len=1376 [TCP PDU reassembled in 92]"
"92","1.147517","146.75.37.140","192.168.12.35","TLSv1.2","311","Application Data"
"93","1.147737","192.168.12.35","146.75.37.140","TCP","54","61013  >  443 [ACK] Seq=9044 Ack=63936 Win=1025 Len=0"
"94","1.151761","192.168.12.35","146.75.37.140","TCP","55","61140  >  443 [ACK] Seq=1 Ack=1 Win=4100 Len=1 [TCP PDU reassembled in 694]"
"95","1.152760","192.168.12.35","146.75.37.140","UDP","84","52870  >  443 Len=42"
"96","1.153854","146.75.37.140","192.168.12.35","TLSv1.2","769","Application Data"
"97","1.154376","192.168.12.35","146.75.37.140","TCP","54","61013  >  443 [ACK] Seq=9044 Ack=64908 Win=1021 Len=0"
"98","1.160204","146.75.37.140","192.168.12.35","TLSv1.2","97","Application Data"
"99","1.160204","146.75.37.140","192.168.12.35","TLSv1.2","635","Application Data"
"100","1.160204","146.75.37.140","192.168.12.35","TLSv1.2","95","Application Data"
"101","1.160204","146.75.37.140","192.168.12.35","TLSv1.2","113","Application Data"
"102","1.160204","146.75.37.140","192.168.12.35","TLSv1.2","137","Application Data"
"103","1.160204","146.75.37.140","192.168.12.35","TLSv1.2","103","Application Data"
"104","1.160204","146.75.37.140","192.168.12.35","TLSv1.2","667","Application Data"
"105","1.161013","192.168.12.35","146.75.37.140","TCP","54","61013  >  443 [ACK] Seq=9044 Ack=65532 Win=1025 Len=0"
"106","1.161088","146.75.37.140","192.168.12.35","TLSv1.2","197","Application Data"
"107","1.161088","146.75.37.140","192.168.12.35","TLSv1.2","653","Application Data"
"108","1.161088","146.75.37.140","192.168.12.35","TLSv1.2","328","Application Data"
"109","1.161088","146.75.37.140","192.168.12.35","TLSv1.2","479","Application Data"
"110","1.161088","146.75.37.140","192.168.12.35","TLSv1.2","399","Application Data"
"111","1.161312","192.168.12.35","146.75.37.140","TCP","54","61013  >  443 [ACK] Seq=9044 Ack=65632 Win=1024 Len=0"
"112","1.161479","192.168.12.35","146.75.37.140","TCP","54","61013  >  443 [ACK] Seq=9044 Ack=65764 Win=1024 Len=0"
"113","1.161552","192.168.12.35","146.75.37.140","TCP","54","61013  >  443 [ACK] Seq=9044 Ack=66520 Win=1021 Len=0"
"114","1.161630","192.168.12.35","146.75.37.140","TCP","54","61013  >  443 [ACK] Seq=9044 Ack=67393 Win=1025 Len=0"
"115","1.161710","192.168.12.35","146.75.37.140","TCP","54","61013  >  443 [ACK] Seq=9044 Ack=68163 Win=1022 Len=0"
"116","1.165235","146.75.37.140","192.168.12.35","TLSv1.2","416","Application Data"
"117","1.165235","146.75.37.140","192.168.12.35","TLSv1.2","147","Application Data"
"118","1.165235","146.75.37.140","192.168.12.35","TLSv1.2","128","Application Data"
"119","1.165235","146.75.37.140","192.168.12.35","TLSv1.2","130","Application Data"
"120","1.165235","146.75.37.140","192.168.12.35","TLSv1.2","112","Application Data"
"121","1.165235","146.75.37.140","192.168.12.35","TLSv1.2","158","Application Data"
"122","1.165235","146.75.37.140","192.168.12.35","TLSv1.2","319","Application Data"
"123","1.165235","146.75.37.140","192.168.12.35","TLSv1.2","164","Application Data"
"124","1.165235","146.75.37.140","192.168.12.35","TLSv1.2","242","Application Data"
"125","1.165235","146.75.37.140","192.168.12.35","TLSv1.2","207","Application Data"
"126","1.165235","146.75.37.140","192.168.12.35","TLSv1.2","149","Application Data"
"127","1.165235","146.75.37.140","192.168.12.35","TLSv1.2","378","Application Data"
"128","1.165235","146.75.37.140","192.168.12.35","TLSv1.2","199","Application Data"
"129","1.166278","192.168.12.35","146.75.37.140","TCP","54","61013  >  443 [ACK] Seq=9044 Ack=68618 Win=1020 Len=0"
"130","1.166478","192.168.12.35","146.75.37.140","TCP","54","61013  >  443 [ACK] Seq=9044 Ack=68768 Win=1019 Len=0"
"131","1.166834","192.168.12.35","146.75.37.140","TCP","54","61013  >  443 [ACK] Seq=9044 Ack=68930 Win=1025 Len=0"
"132","1.167038","192.168.12.35","146.75.37.140","TCP","54","61013  >  443 [ACK] Seq=9044 Ack=69305 Win=1023 Len=0"
"133","1.167202","192.168.12.35","146.75.37.140","TCP","54","61013  >  443 [ACK] Seq=9044 Ack=69646 Win=1022 Len=0"
"134","1.167335","192.168.12.35","146.75.37.140","TCP","54","61013  >  443 [ACK] Seq=9044 Ack=70065 Win=1020 Len=0"
"135","1.171675","146.75.37.140","192.168.12.35","UDP","73","443  >  52870 Len=31"
"136","1.182634","146.75.37.140","192.168.12.35","TCP","66","443  >  61140 [ACK] Seq=1 Ack=2 Win=424 Len=0 SLE=1 SRE=2"
"137","1.217151","192.168.12.35","146.75.37.140","TCP","54","61013  >  443 [ACK] Seq=9044 Ack=70210 Win=1020 Len=0"
"138","1.658815","146.75.37.140","192.168.12.35","TLSv1.2","612","Application Data"
"139","1.658815","146.75.37.140","192.168.12.35","TLSv1.2","399","Application Data"
"140","1.659857","192.168.12.35","146.75.37.140","TCP","54","61013  >  443 [ACK] Seq=9044 Ack=71113 Win=1025 Len=0"
"141","1.664413","146.75.37.140","192.168.12.35","TLSv1.2","201","Application Data"
"142","1.664413","146.75.37.140","192.168.12.35","TLSv1.2","217","Application Data"
"143","1.664413","146.75.37.140","192.168.12.35","TLSv1.2","154","Application Data"
"144","1.664413","146.75.37.140","192.168.12.35","TLSv1.2","114","Application Data"
"145","1.664413","146.75.37.140","192.168.12.35","TLSv1.2","228","Application Data"
"146","1.664413","146.75.37.140","192.168.12.35","TLSv1.2","910","Application Data"
"147","1.664413","146.75.37.140","192.168.12.35","TLSv1.2","405","Application Data"
"148","1.664413","146.75.37.140","192.168.12.35","TLSv1.2","107","Application Data"
"149","1.664413","146.75.37.140","192.168.12.35","TLSv1.2","185","Application Data"
"150","1.664413","146.75.37.140","192.168.12.35","TCP","1430","443  >  61013 [ACK] Seq=73148 Ack=9044 Win=8244 Len=1376 [TCP PDU reassembled in 152]"
"151","1.664413","146.75.37.140","192.168.12.35","TCP","1430","443  >  61013 [ACK] Seq=74524 Ack=9044 Win=8244 Len=1376 [TCP PDU reassembled in 152]"
"152","1.664413","146.75.37.140","192.168.12.35","TLSv1.2","1259","Application Data"
"153","1.664413","146.75.37.140","192.168.12.35","TLSv1.2","243","Application Data"
"154","1.664413","146.75.37.140","192.168.12.35","TLSv1.2","358","Application Data"
"155","1.664413","146.75.37.140","192.168.12.35","TLSv1.2","590","Application Data"
"156","1.664413","146.75.37.140","192.168.12.35","TLSv1.2","1215","Application Data"
"157","1.664413","146.75.37.140","192.168.12.35","TLSv1.2","436","Application Data"
"158","1.664413","146.75.37.140","192.168.12.35","TLSv1.2","812","Application Data"
"159","1.665839","192.168.12.35","146.75.37.140","TCP","54","61013  >  443 [ACK] Seq=9044 Ack=71423 Win=1023 Len=0"
"160","1.666129","192.168.12.35","146.75.37.140","TCP","54","61013  >  443 [ACK] Seq=9044 Ack=71583 Win=1023 Len=0"
"161","1.666356","192.168.12.35","146.75.37.140","TCP","54","61013  >  443 [ACK] Seq=9044 Ack=72613 Win=1025 Len=0"
"162","1.666433","192.168.12.35","146.75.37.140","TCP","54","61013  >  443 [ACK] Seq=9044 Ack=73017 Win=1023 Len=0"
"163","1.666538","192.168.12.35","146.75.37.140","TCP","54","61013  >  443 [ACK] Seq=9044 Ack=75900 Win=1025 Len=0"
"164","1.666599","192.168.12.35","146.75.37.140","TCP","54","61013  >  443 [ACK] Seq=9044 Ack=77105 Win=1020 Len=0"
"165","1.666714","192.168.12.35","146.75.37.140","TCP","54","61013  >  443 [ACK] Seq=9044 Ack=77598 Win=1025 Len=0"
"166","1.666831","192.168.12.35","146.75.37.140","TCP","54","61013  >  443 [ACK] Seq=9044 Ack=79295 Win=1025 Len=0"
"167","1.667237","192.168.12.35","146.75.37.140","TCP","54","61013  >  443 [ACK] Seq=9044 Ack=80435 Win=1020 Len=0"
"168","1.681867","146.75.37.140","192.168.12.35","TLSv1.2","372","Application Data"
"169","1.681867","146.75.37.140","192.168.12.35","TLSv1.2","97","Application Data"
"170","1.681867","146.75.37.140","192.168.12.35","TLSv1.2","336","Application Data"
"171","1.682286","192.168.12.35","146.75.37.140","TCP","54","61013  >  443 [ACK] Seq=9044 Ack=80796 Win=1025 Len=0"
"172","1.728811","192.168.12.35","146.75.37.140","TCP","54","61013  >  443 [ACK] Seq=9044 Ack=81078 Win=1024 Len=0"
"173","1.730622","192.168.12.35","146.75.37.140","TLSv1.2","210","Application Data"
"174","1.730674","192.168.12.35","146.75.37.140","TLSv1.2","93","Application Data"
"175","1.731286","192.168.12.35","146.75.37.140","TLSv1.2","215","Application Data"
"176","1.731318","192.168.12.35","146.75.37.140","TLSv1.2","93","Application Data"
"177","1.962778","146.75.37.140","192.168.12.35","TLSv1.2","461","Application Data"
"178","1.967076","146.75.37.140","192.168.12.35","TLSv1.2","700","Application Data"
"179","1.967076","146.75.37.140","192.168.12.35","TLSv1.2","719","Application Data"
"180","1.967076","146.75.37.140","192.168.12.35","TLSv1.2","351","Application Data"
"181","1.967076","146.75.37.140","192.168.12.35","TCP","1430","443  >  61013 [ACK] Seq=83093 Ack=9044 Win=8244 Len=1376 [TCP PDU reassembled in 182]"
"182","1.967076","146.75.37.140","192.168.12.35","TLSv1.2","92","Application Data"
"183","1.967076","146.75.37.140","192.168.12.35","TLSv1.2","308","Application Data"
"184","1.967076","146.75.37.140","192.168.12.35","TLSv1.2","229","Application Data"
"185","1.967076","146.75.37.140","192.168.12.35","TLSv1.2","847","Application Data"
"186","1.967076","146.75.37.140","192.168.12.35","TLSv1.2","1047","Application Data"
"187","1.967076","146.75.37.140","192.168.12.35","TLSv1.2","208","Application Data"
"188","1.967076","146.75.37.140","192.168.12.35","TLSv1.2","197","Application Data"
"189","1.967076","146.75.37.140","192.168.12.35","TLSv1.2","329","Application Data"
"190","1.967076","146.75.37.140","192.168.12.35","TLSv1.2","217","Application Data"
"191","1.967076","146.75.37.140","192.168.12.35","TLSv1.2","808","Application Data"
"192","1.967340","192.168.12.35","146.75.37.140","TCP","54","61013  >  443 [ACK] Seq=9044 Ack=82131 Win=1019 Len=0"
"193","1.967494","192.168.12.35","146.75.37.140","TCP","54","61013  >  443 [ACK] Seq=9044 Ack=83093 Win=1025 Len=0"
"194","1.967564","192.168.12.35","146.75.37.140","TCP","54","61013  >  443 [ACK] Seq=9044 Ack=84507 Win=1025 Len=0"
"195","1.967620","192.168.12.35","146.75.37.140","TCP","54","61013  >  443 [ACK] Seq=9044 Ack=84936 Win=1023 Len=0"
"196","1.967715","192.168.12.35","146.75.37.140","TCP","54","61013  >  443 [ACK] Seq=9044 Ack=86722 Win=1025 Len=0"
"197","1.967778","192.168.12.35","146.75.37.140","TCP","54","61013  >  443 [ACK] Seq=9044 Ack=87019 Win=1024 Len=0"
"198","1.967858","192.168.12.35","146.75.37.140","TCP","54","61013  >  443 [ACK] Seq=9044 Ack=87457 Win=1022 Len=0"
"199","1.994403","146.75.37.140","192.168.12.35","TLSv1.2","297","Application Data"
"200","1.994403","146.75.37.140","192.168.12.35","TLSv1.2","213","Application Data"
"201","1.994403","146.75.37.140","192.168.12.35","TLSv1.2","170","Application Data"
"202","1.994403","146.75.37.140","192.168.12.35","TLSv1.2","103","Application Data"
"203","1.995539","192.168.12.35","146.75.37.140","TCP","54","61013  >  443 [ACK] Seq=9044 Ack=88454 Win=1025 Len=0"
"204","1.995897","192.168.12.35","146.75.37.140","TCP","54","61013  >  443 [ACK] Seq=9044 Ack=88729 Win=1024 Len=0"
"205","2.005452","146.75.37.140","192.168.12.35","TLSv1.2","223","Application Data"
"206","2.006046","192.168.12.35","146.75.37.140","TCP","54","61013  >  443 [ACK] Seq=9044 Ack=88947 Win=1023 Len=0"
"207","2.019345","146.75.37.140","192.168.12.35","TLSv1.2","195","Application Data"
"208","2.037670","146.75.37.140","192.168.12.35","TLSv1.2","240","Application Data"
"209","2.037670","146.75.37.140","192.168.12.35","TLSv1.2","1054","Application Data"
"210","2.037670","146.75.37.140","192.168.12.35","TLSv1.2","102","Application Data"
"211","2.037670","146.75.37.140","192.168.12.35","TLSv1.2","168","Application Data"
"212","2.037670","146.75.37.140","192.168.12.35","TLSv1.2","226","Application Data"
"213","2.037670","146.75.37.140","192.168.12.35","TLSv1.2","472","Application Data"
"214","2.037670","146.75.37.140","192.168.12.35","TLSv1.2","146","Application Data"
"215","2.037670","146.75.37.140","192.168.12.35","TLSv1.2","273","Application Data"
"216","2.037670","146.75.37.140","192.168.12.35","TLSv1.2","563","Application Data"
"217","2.037670","146.75.37.140","192.168.12.35","TLSv1.2","182","Application Data"
"218","2.037670","146.75.37.140","192.168.12.35","TLSv1.2","104","Application Data"
"219","2.039233","192.168.12.35","146.75.37.140","TCP","54","61013  >  443 [ACK] Seq=9044 Ack=89274 Win=1021 Len=0"
"220","2.039690","192.168.12.35","146.75.37.140","TCP","54","61013  >  443 [ACK] Seq=9044 Ack=90322 Win=1025 Len=0"
"221","2.039793","192.168.12.35","146.75.37.140","TCP","54","61013  >  443 [ACK] Seq=9044 Ack=90608 Win=1024 Len=0"
"222","2.039831","192.168.12.35","146.75.37.140","TCP","54","61013  >  443 [ACK] Seq=9044 Ack=91118 Win=1022 Len=0"
"223","2.039913","192.168.12.35","146.75.37.140","TCP","54","61013  >  443 [ACK] Seq=9044 Ack=91846 Win=1025 Len=0"
"224","2.039987","192.168.12.35","146.75.37.140","TCP","54","61013  >  443 [ACK] Seq=9044 Ack=92024 Win=1024 Len=0"
"225","2.044681","146.75.37.140","192.168.12.35","TLSv1.2","300","Application Data"
"226","2.044681","146.75.37.140","192.168.12.35","TLSv1.2","516","Application Data"
"227","2.044681","146.75.37.140","192.168.12.35","TLSv1.2","663","Application Data"
"228","2.044681","146.75.37.140","192.168.12.35","TCP","1430","443  >  61013 [ACK] Seq=93341 Ack=9044 Win=8244 Len=1376 [TCP PDU reassembled in 229]"
"229","2.044681","146.75.37.140","192.168.12.35","TLSv1.2","80","Application Data"
"230","2.044681","146.75.37.140","192.168.12.35","TLSv1.2","717","Application Data"
"231","2.044681","146.75.37.140","192.168.12.35","TLSv1.2","391","Application Data"
"232","2.044681","146.75.37.140","192.168.12.35","TLSv1.2","910","Application Data"
"233","2.044681","146.75.37.140","192.168.12.35","TLSv1.2","784","Application Data"
"234","2.044681","146.75.37.140","192.168.12.35","TLSv1.2","85","Application Data"
"235","2.044681","146.75.37.140","192.168.12.35","TCP","54","443  >  61039 [ACK] Seq=1 Ack=162 Win=424 Len=0"
"236","2.044681","146.75.37.140","192.168.12.35","TCP","54","443  >  61039 [ACK] Seq=1 Ack=201 Win=424 Len=0"
"237","2.044681","146.75.37.140","192.168.12.35","TCP","54","443  >  61034 [ACK] Seq=1 Ack=157 Win=424 Len=0"
"238","2.044681","146.75.37.140","192.168.12.35","TCP","54","443  >  61034 [ACK] Seq=1 Ack=196 Win=424 Len=0"
"239","2.045093","192.168.12.35","146.75.37.140","TCP","54","61013  >  443 [ACK] Seq=9044 Ack=92732 Win=1021 Len=0"
"240","2.045238","192.168.12.35","146.75.37.140","TCP","54","61013  >  443 [ACK] Seq=9044 Ack=94717 Win=1025 Len=0"
"241","2.045302","192.168.12.35","146.75.37.140","TCP","54","61013  >  443 [ACK] Seq=9044 Ack=95406 Win=1022 Len=0"
"242","2.045393","192.168.12.35","146.75.37.140","TCP","54","61013  >  443 [ACK] Seq=9044 Ack=96599 Win=1025 Len=0"
"243","2.045436","192.168.12.35","146.75.37.140","TCP","54","61013  >  443 [ACK] Seq=9044 Ack=97360 Win=1022 Len=0"
"244","2.048619","146.75.37.140","192.168.12.35","TLSv1.2","93","Application Data"
"245","2.048619","146.75.37.140","192.168.12.35","TLSv1.2","93","Application Data"
"246","2.048619","146.75.37.140","192.168.12.35","TLSv1.2","1313","Application Data"
"247","2.048619","146.75.37.140","192.168.12.35","TLSv1.2","553","Application Data"
"248","2.048619","146.75.37.140","192.168.12.35","TCP","1430","443  >  61034 [ACK] Seq=539 Ack=196 Win=424 Len=1376 [TCP PDU reassembled in 262]"
"249","2.048619","146.75.37.140","192.168.12.35","TCP","1430","443  >  61034 [ACK] Seq=1915 Ack=196 Win=424 Len=1376 [TCP PDU reassembled in 262]"
"250","2.048619","146.75.37.140","192.168.12.35","TCP","1430","443  >  61034 [ACK] Seq=3291 Ack=196 Win=424 Len=1376 [TCP PDU reassembled in 262]"
"251","2.048619","146.75.37.140","192.168.12.35","TCP","1430","443  >  61034 [ACK] Seq=4667 Ack=196 Win=424 Len=1376 [TCP PDU reassembled in 262]"
"252","2.048619","146.75.37.140","192.168.12.35","TCP","1430","443  >  61034 [ACK] Seq=6043 Ack=196 Win=424 Len=1376 [TCP PDU reassembled in 262]"
"253","2.048619","146.75.37.140","192.168.12.35","TCP","1430","443  >  61034 [ACK] Seq=7419 Ack=196 Win=424 Len=1376 [TCP PDU reassembled in 262]"
"254","2.048619","146.75.37.140","192.168.12.35","TCP","1430","443  >  61034 [ACK] Seq=8795 Ack=196 Win=424 Len=1376 [TCP PDU reassembled in 262]"
"255","2.048619","146.75.37.140","192.168.12.35","TCP","1430","443  >  61034 [ACK] Seq=10171 Ack=196 Win=424 Len=1376 [TCP PDU reassembled in 262]"
"256","2.048619","146.75.37.140","192.168.12.35","TCP","1430","443  >  61034 [ACK] Seq=11547 Ack=196 Win=424 Len=1376 [TCP PDU reassembled in 262]"
"257","2.048619","146.75.37.140","192.168.12.35","TCP","1430","443  >  61034 [ACK] Seq=12923 Ack=196 Win=424 Len=1376 [TCP PDU reassembled in 262]"
"258","2.048619","146.75.37.140","192.168.12.35","TCP","1430","443  >  61034 [ACK] Seq=14299 Ack=196 Win=424 Len=1376 [TCP PDU reassembled in 262]"
"259","2.049309","192.168.12.35","146.75.37.140","TCP","54","61034  >  443 [ACK] Seq=196 Ack=539 Win=8198 Len=0"
"260","2.049503","192.168.12.35","146.75.37.140","TCP","54","61034  >  443 [ACK] Seq=196 Ack=15675 Win=8201 Len=0"
"261","2.049584","192.168.12.35","146.75.37.140","TCP","54","61039  >  443 [ACK] Seq=201 Ack=1299 Win=4100 Len=0"
"262","2.049841","146.75.37.140","192.168.12.35","TLSv1.2","1355","Application Data, Application Data"
"263","2.050132","192.168.12.35","146.75.37.140","TCP","54","61034  >  443 [ACK] Seq=196 Ack=16976 Win=8196 Len=0"
"264","2.050782","146.75.37.140","192.168.12.35","TCP","1430","443  >  61034 [ACK] Seq=16976 Ack=196 Win=424 Len=1376 [TCP PDU reassembled in 275]"
"265","2.050782","146.75.37.140","192.168.12.35","TCP","1430","443  >  61034 [ACK] Seq=18352 Ack=196 Win=424 Len=1376 [TCP PDU reassembled in 275]"
"266","2.050782","146.75.37.140","192.168.12.35","TCP","1430","443  >  61034 [ACK] Seq=19728 Ack=196 Win=424 Len=1376 [TCP PDU reassembled in 275]"
"267","2.050782","146.75.37.140","192.168.12.35","TCP","1430","443  >  61034 [ACK] Seq=21104 Ack=196 Win=424 Len=1376 [TCP PDU reassembled in 275]"
"268","2.050782","146.75.37.140","192.168.12.35","TCP","1430","443  >  61034 [ACK] Seq=22480 Ack=196 Win=424 Len=1376 [TCP PDU reassembled in 275]"
"269","2.050782","146.75.37.140","192.168.12.35","TCP","1430","443  >  61034 [ACK] Seq=23856 Ack=196 Win=424 Len=1376 [TCP PDU reassembled in 275]"
"270","2.050782","146.75.37.140","192.168.12.35","TCP","1430","443  >  61034 [ACK] Seq=25232 Ack=196 Win=424 Len=1376 [TCP PDU reassembled in 275]"
"271","2.050782","146.75.37.140","192.168.12.35","TCP","1430","443  >  61034 [ACK] Seq=26608 Ack=196 Win=424 Len=1376 [TCP PDU reassembled in 275]"
"272","2.050782","146.75.37.140","192.168.12.35","TCP","1430","443  >  61034 [ACK] Seq=27984 Ack=196 Win=424 Len=1376 [TCP PDU reassembled in 275]"
"273","2.050782","146.75.37.140","192.168.12.35","TCP","1430","443  >  61034 [ACK] Seq=29360 Ack=196 Win=424 Len=1376 [TCP PDU reassembled in 275]"
"274","2.050782","146.75.37.140","192.168.12.35","TCP","1430","443  >  61034 [ACK] Seq=30736 Ack=196 Win=424 Len=1376 [TCP PDU reassembled in 275]"
"275","2.050782","146.75.37.140","192.168.12.35","TLSv1.2","1430","Application Data"
"276","2.050782","146.75.37.140","192.168.12.35","TCP","1430","443  >  61034 [ACK] Seq=33488 Ack=196 Win=424 Len=1376 [TCP PDU reassembled in 287]"
"277","2.050782","146.75.37.140","192.168.12.35","TCP","1430","443  >  61034 [PSH, ACK] Seq=34864 Ack=196 Win=424 Len=1376 [TCP PDU reassembled in 287]"
"278","2.050782","146.75.37.140","192.168.12.35","TCP","1430","443  >  61034 [ACK] Seq=36240 Ack=196 Win=424 Len=1376 [TCP PDU reassembled in 287]"
"279","2.050782","146.75.37.140","192.168.12.35","TCP","1430","443  >  61034 [ACK] Seq=37616 Ack=196 Win=424 Len=1376 [TCP PDU reassembled in 287]"
"280","2.050782","146.75.37.140","192.168.12.35","TCP","1430","443  >  61034 [ACK] Seq=38992 Ack=196 Win=424 Len=1376 [TCP PDU reassembled in 287]"
"281","2.050782","146.75.37.140","192.168.12.35","TCP","1430","443  >  61034 [ACK] Seq=40368 Ack=196 Win=424 Len=1376 [TCP PDU reassembled in 287]"
"282","2.050782","146.75.37.140","192.168.12.35","TCP","1430","443  >  61034 [ACK] Seq=41744 Ack=196 Win=424 Len=1376 [TCP PDU reassembled in 287]"
"283","2.050782","146.75.37.140","192.168.12.35","TCP","1430","443  >  61034 [ACK] Seq=43120 Ack=196 Win=424 Len=1376 [TCP PDU reassembled in 287]"
"284","2.050782","146.75.37.140","192.168.12.35","TCP","1430","443  >  61034 [ACK] Seq=44496 Ack=196 Win=424 Len=1376 [TCP PDU reassembled in 287]"
"285","2.050782","146.75.37.140","192.168.12.35","TCP","1430","443  >  61034 [ACK] Seq=45872 Ack=196 Win=424 Len=1376 [TCP PDU reassembled in 287]"
"286","2.050782","146.75.37.140","192.168.12.35","TCP","1430","443  >  61034 [ACK] Seq=47248 Ack=196 Win=424 Len=1376 [TCP PDU reassembled in 287]"
"287","2.050782","146.75.37.140","192.168.12.35","TLSv1.2","1430","Application Data"
"288","2.050782","146.75.37.140","192.168.12.35","TCP","1430","443  >  61034 [ACK] Seq=50000 Ack=196 Win=424 Len=1376 [TCP PDU reassembled in 297]"
"289","2.050782","146.75.37.140","192.168.12.35","TCP","1430","443  >  61034 [ACK] Seq=51376 Ack=196 Win=424 Len=1376 [TCP PDU reassembled in 297]"
"290","2.050782","146.75.37.140","192.168.12.35","TCP","1430","443  >  61034 [ACK] Seq=52752 Ack=196 Win=424 Len=1376 [TCP PDU reassembled in 297]"
"291","2.050782","146.75.37.140","192.168.12.35","TCP","1430","443  >  61034 [PSH, ACK] Seq=54128 Ack=196 Win=424 Len=1376 [TCP PDU reassembled in 297]"
"292","2.050782","146.75.37.140","192.168.12.35","TCP","1430","443  >  61034 [ACK] Seq=55504 Ack=196 Win=424 Len=1376 [TCP PDU reassembled in 297]"
"293","2.050782","146.75.37.140","192.168.12.35","TCP","1430","443  >  61034 [ACK] Seq=56880 Ack=196 Win=424 Len=1376 [TCP PDU reassembled in 297]"
"294","2.050782","146.75.37.140","192.168.12.35","TCP","1430","443  >  61034 [ACK] Seq=58256 Ack=196 Win=424 Len=1376 [TCP PDU reassembled in 297]"
"295","2.050782","146.75.37.140","192.168.12.35","TCP","1430","443  >  61034 [ACK] Seq=59632 Ack=196 Win=424 Len=1376 [TCP PDU reassembled in 297]"
"296","2.051649","146.75.37.140","192.168.12.35","TCP","1430","443  >  61034 [ACK] Seq=61008 Ack=196 Win=424 Len=1376 [TCP PDU reassembled in 297]"
"297","2.051649","146.75.37.140","192.168.12.35","TLSv1.2","1430","Application Data"
"298","2.051649","146.75.37.140","192.168.12.35","TCP","1430","443  >  61034 [ACK] Seq=63760 Ack=196 Win=424 Len=1376 [TCP PDU reassembled in 309]"
"299","2.051649","146.75.37.140","192.168.12.35","TCP","1430","443  >  61034 [ACK] Seq=65136 Ack=196 Win=424 Len=1376 [TCP PDU reassembled in 309]"
"300","2.051649","146.75.37.140","192.168.12.35","TCP","1430","443  >  61034 [ACK] Seq=66512 Ack=196 Win=424 Len=1376 [TCP PDU reassembled in 309]"
"301","2.051649","146.75.37.140","192.168.12.35","TCP","1430","443  >  61034 [ACK] Seq=67888 Ack=196 Win=424 Len=1376 [TCP PDU reassembled in 309]"
"302","2.051649","146.75.37.140","192.168.12.35","TCP","1430","443  >  61034 [ACK] Seq=69264 Ack=196 Win=424 Len=1376 [TCP PDU reassembled in 309]"
"303","2.051649","146.75.37.140","192.168.12.35","TCP","1430","443  >  61034 [ACK] Seq=70640 Ack=196 Win=424 Len=1376 [TCP PDU reassembled in 309]"
"304","2.051649","146.75.37.140","192.168.12.35","TCP","1430","443  >  61034 [ACK] Seq=72016 Ack=196 Win=424 Len=1376 [TCP PDU reassembled in 309]"
"305","2.051649","146.75.37.140","192.168.12.35","TCP","1430","443  >  61034 [PSH, ACK] Seq=73392 Ack=196 Win=424 Len=1376 [TCP PDU reassembled in 309]"
"306","2.051649","146.75.37.140","192.168.12.35","TCP","1430","443  >  61034 [ACK] Seq=74768 Ack=196 Win=424 Len=1376 [TCP PDU reassembled in 309]"
"307","2.051649","146.75.37.140","192.168.12.35","TCP","1430","443  >  61034 [ACK] Seq=76144 Ack=196 Win=424 Len=1376 [TCP PDU reassembled in 309]"
"308","2.051649","146.75.37.140","192.168.12.35","TCP","1430","443  >  61034 [ACK] Seq=77520 Ack=196 Win=424 Len=1376 [TCP PDU reassembled in 309]"
"309","2.051649","146.75.37.140","192.168.12.35","TLSv1.2","1361","Application Data, Application Data"
"310","2.051772","192.168.12.35","146.75.37.140","TCP","54","61034  >  443 [ACK] Seq=196 Ack=61008 Win=8201 Len=0"
"311","2.052092","192.168.12.35","146.75.37.140","TCP","54","61034  >  443 [ACK] Seq=196 Ack=78896 Win=8201 Len=0"
"312","2.052292","192.168.12.35","146.75.37.140","TLSv1.2","89","Application Data"
"313","2.053941","192.168.12.35","146.75.37.140","TLSv1.2","89","Application Data"
"314","2.093325","192.168.12.35","146.75.37.140","TLSv1.2","3185","Application Data"
"315","2.093542","192.168.12.35","146.75.37.140","TLSv1.2","718","Application Data"
"316","2.093568","192.168.12.35","146.75.37.140","TLSv1.2","3189","Application Data"
"317","2.101303","192.168.12.35","146.75.37.140","TCP","54","61034  >  443 [ACK] Seq=231 Ack=80203 Win=8196 Len=0"
"318","2.122169","192.168.12.35","146.75.37.140","TLSv1.2","3198","Application Data"
"319","2.213394","192.168.12.35","146.75.37.140","TLSv1.2","3176","Application Data"
"320","2.213519","192.168.12.35","146.75.37.140","TLSv1.2","210","Application Data"
"321","2.274194","192.168.12.35","146.75.37.140","TCP","1450","[TCP Retransmission] 61013  >  443 [PSH, ACK] Seq=21000 Ack=97360 Win=1022 Len=1396"
"322","2.333630","192.168.12.35","146.75.37.140","TLSv1.2","3288","Application Data"
"323","2.342043","192.168.12.35","146.75.37.140","TLSv1.2","3194","Application Data"
"324","2.342551","192.168.12.35","146.75.37.140","TLSv1.2","3209","Application Data"
"325","2.342610","192.168.12.35","146.75.37.140","TLSv1.2","3186","Application Data"
"326","2.444977","192.168.12.35","146.75.37.140","TLSv1.2","3144","Application Data"
"327","2.477350","192.168.12.35","146.75.37.140","TCP","89","[TCP Retransmission] 61039  >  443 [PSH, ACK] Seq=201 Ack=1299 Win=4100 Len=35"
"328","2.522067","146.75.37.140","192.168.12.35","TCP","54","443  >  61039 [ACK] Seq=1299 Ack=236 Win=424 Len=0"
"329","2.522067","146.75.37.140","192.168.12.35","TCP","54","443  >  61034 [ACK] Seq=80203 Ack=231 Win=424 Len=0"
"330","2.576947","146.75.37.140","192.168.12.35","TCP","54","443  >  61013 [ACK] Seq=97360 Ack=10440 Win=8244 Len=0"
"331","2.587988","146.75.37.140","192.168.12.35","TCP","54","443  >  61013 [ACK] Seq=97360 Ack=11836 Win=8244 Len=0"
"332","2.594499","146.75.37.140","192.168.12.35","TCP","54","443  >  61013 [ACK] Seq=97360 Ack=12175 Win=8244 Len=0"
"333","2.602182","146.75.37.140","192.168.12.35","TCP","54","443  >  61013 [ACK] Seq=97360 Ack=12839 Win=8244 Len=0"
"334","2.622661","146.75.37.140","192.168.12.35","TCP","54","443  >  61013 [ACK] Seq=97360 Ack=15631 Win=8244 Len=0"
"335","2.622661","146.75.37.140","192.168.12.35","TCP","54","443  >  61013 [ACK] Seq=97360 Ack=15974 Win=8244 Len=0"
"336","2.622661","146.75.37.140","192.168.12.35","TCP","54","443  >  61013 [ACK] Seq=97360 Ack=18766 Win=8244 Len=0"
"337","2.622661","146.75.37.140","192.168.12.35","TCP","54","443  >  61013 [ACK] Seq=97360 Ack=19118 Win=8244 Len=0"
"338","2.622661","146.75.37.140","192.168.12.35","TCP","54","443  >  61013 [ACK] Seq=97360 Ack=21910 Win=8244 Len=0"
"339","2.622661","146.75.37.140","192.168.12.35","TCP","54","443  >  61013 [ACK] Seq=97360 Ack=22240 Win=8244 Len=0"
"340","2.622661","146.75.37.140","192.168.12.35","TCP","54","443  >  61013 [ACK] Seq=97360 Ack=22396 Win=8244 Len=0"
"341","2.634487","146.75.37.140","192.168.12.35","TCP","1430","443  >  61013 [ACK] Seq=97360 Ack=22396 Win=8244 Len=1376 [TCP PDU reassembled in 342]"
"342","2.634487","146.75.37.140","192.168.12.35","TLSv1.2","778","Application Data"
"343","2.634990","192.168.12.35","146.75.37.140","TCP","54","61013  >  443 [ACK] Seq=38147 Ack=98736 Win=1025 Len=0"
"344","2.635199","192.168.12.35","146.75.37.140","TCP","54","61013  >  443 [ACK] Seq=38147 Ack=99460 Win=1022 Len=0"
"345","2.648113","146.75.37.140","192.168.12.35","TCP","1430","443  >  61013 [ACK] Seq=99460 Ack=22396 Win=8244 Len=1376 [TCP PDU reassembled in 346]"
"346","2.648113","146.75.37.140","192.168.12.35","TLSv1.2","482","Application Data"
"347","2.648797","192.168.12.35","146.75.37.140","TCP","54","61013  >  443 [ACK] Seq=38147 Ack=100836 Win=1025 Len=0"
"348","2.649237","192.168.12.35","146.75.37.140","TCP","54","61013  >  443 [ACK] Seq=38147 Ack=101264 Win=1023 Len=0"
"349","2.653289","146.75.37.140","192.168.12.35","TCP","1430","443  >  61013 [ACK] Seq=101264 Ack=22396 Win=8244 Len=1376 [TCP PDU reassembled in 350]"
"350","2.653289","146.75.37.140","192.168.12.35","TLSv1.2","872","Application Data"
"351","2.653289","146.75.37.140","192.168.12.35","TLSv1.2","100","Application Data"
"352","2.653902","192.168.12.35","146.75.37.140","TCP","54","61013  >  443 [ACK] Seq=38147 Ack=102640 Win=1025 Len=0"
"353","2.654156","192.168.12.35","146.75.37.140","TCP","54","61013  >  443 [ACK] Seq=38147 Ack=103458 Win=1021 Len=0"
"354","2.657998","146.75.37.140","192.168.12.35","TCP","66","[TCP Dup ACK 340#1] 443  >  61013 [ACK] Seq=103504 Ack=22396 Win=8244 Len=0 SLE=21000 SRE=22396"
"355","2.677610","146.75.37.140","192.168.12.35","TCP","54","443  >  61013 [ACK] Seq=103504 Ack=23792 Win=8244 Len=0"
"356","2.688093","146.75.37.140","192.168.12.35","TCP","1430","443  >  61013 [ACK] Seq=103504 Ack=23792 Win=8244 Len=1376 [TCP PDU reassembled in 357]"
"357","2.688093","146.75.37.140","192.168.12.35","TLSv1.2","607","Application Data"
"358","2.688852","192.168.12.35","146.75.37.140","TCP","54","61013  >  443 [ACK] Seq=38147 Ack=104880 Win=1025 Len=0"
