"No.","Time","Source","Destination","Protocol","Length","Info"
"1","0.000000","192.168.12.35","146.75.37.140","TCP","55","63571  >  443 [ACK] Seq=1 Ack=1 Win=508 Len=1"
"2","0.112904","146.75.37.140","192.168.12.35","TCP","66","443  >  63571 [ACK] Seq=1 Ack=2 Win=373 Len=0 SLE=1 SRE=2"
"3","0.194910","192.168.12.35","146.75.37.140","TLSv1.2","3415","Application Data"
"4","0.195268","192.168.12.35","146.75.37.140","TLSv1.2","1278","Application Data"
"5","0.197330","192.168.12.35","146.75.37.140","TLSv1.2","3297","Application Data"
"6","0.199871","192.168.12.35","146.75.37.140","TLSv1.2","3415","Application Data"
"7","0.200255","192.168.12.35","146.75.37.140","TLSv1.2","1786","Application Data"
"8","0.209748","192.168.12.35","146.75.37.140","TLSv1.2","3415","Application Data"
"9","0.210417","192.168.12.35","146.75.37.140","TLSv1.2","1832","Application Data"
"10","0.235371","146.75.37.140","192.168.12.35","TCP","54","443  >  63572 [ACK] Seq=1 Ack=1397 Win=593 Len=0"
"11","0.261961","146.75.37.140","192.168.12.35","TCP","54","443  >  63572 [ACK] Seq=1 Ack=2793 Win=598 Len=0"
"12","0.266680","146.75.37.140","192.168.12.35","TCP","54","443  >  63572 [ACK] Seq=1 Ack=3362 Win=604 Len=0"
"13","0.282281","146.75.37.140","192.168.12.35","TCP","54","443  >  63572 [ACK] Seq=1 Ack=4586 Win=609 Len=0"
"14","0.314484","146.75.37.140","192.168.12.35","TCP","54","443  >  63572 [ACK] Seq=1 Ack=5982 Win=615 Len=0"
"15","0.314484","146.75.37.140","192.168.12.35","TCP","1430","443  >  63572 [ACK] Seq=1 Ack=5982 Win=615 Len=1376 [TCP PDU reassembled in 16]"
"16","0.314484","146.75.37.140","192.168.12.35","TLSv1.2","503","Application Data"
"17","0.314757","192.168.12.35","146.75.37.140","TCP","54","63572  >  443 [ACK] Seq=18061 Ack=1377 Win=512 Len=0"
"18","0.314853","192.168.12.35","146.75.37.140","TCP","54","63572  >  443 [ACK] Seq=18061 Ack=1826 Win=510 Len=0"
"19","0.318670","192.168.12.35","146.75.37.140","TLSv1.2","89","Application Data"
"20","0.331806","146.75.37.140","192.168.12.35","TCP","54","443  >  63572 [ACK] Seq=1826 Ack=7378 Win=620 Len=0"
"21","0.336885","146.75.37.140","192.168.12.35","TCP","54","443  >  63572 [ACK] Seq=1826 Ack=7829 Win=626 Len=0"
"22","0.357287","146.75.37.140","192.168.12.35","TCP","54","443  >  63572 [ACK] Seq=1826 Ack=9225 Win=631 Len=0"
"23","0.380664","146.75.37.140","192.168.12.35","TCP","1430","443  >  63572 [ACK] Seq=1826 Ack=9225 Win=631 Len=1376 [TCP PDU reassembled in 24]"
"24","0.380664","146.75.37.140","192.168.12.35","TLSv1.2","905","Application Data"
"25","0.380664","146.75.37.140","192.168.12.35","TCP","54","443  >  63572 [ACK] Seq=4053 Ack=10621 Win=637 Len=0"
"26","0.381020","192.168.12.35","146.75.37.140","TCP","54","63572  >  443 [ACK] Seq=18096 Ack=4053 Win=512 Len=0"
"27","0.393852","146.75.37.140","192.168.12.35","TCP","1430","443  >  63572 [ACK] Seq=4053 Ack=10621 Win=637 Len=1376 [TCP PDU reassembled in 28]"
"28","0.393852","146.75.37.140","192.168.12.35","TLSv1.2","813","Application Data"
"29","0.393852","146.75.37.140","192.168.12.35","TCP","1430","443  >  63572 [ACK] Seq=6188 Ack=10621 Win=637 Len=1376 [TCP PDU reassembled in 41]"
"30","0.393852","146.75.37.140","192.168.12.35","TCP","1430","443  >  63572 [PSH, ACK] Seq=7564 Ack=10621 Win=637 Len=1376 [TCP PDU reassembled in 41]"
"31","0.393852","146.75.37.140","192.168.12.35","TCP","1430","443  >  63572 [ACK] Seq=8940 Ack=10621 Win=637 Len=1376 [TCP PDU reassembled in 41]"
"32","0.393852","146.75.37.140","192.168.12.35","TCP","1430","443  >  63572 [PSH, ACK] Seq=10316 Ack=10621 Win=637 Len=1376 [TCP PDU reassembled in 41]"
"33","0.394778","192.168.12.35","146.75.37.140","TCP","54","63572  >  443 [ACK] Seq=18096 Ack=6188 Win=512 Len=0"
"34","0.394965","192.168.12.35","146.75.37.140","TCP","54","63572  >  443 [ACK] Seq=18096 Ack=11692 Win=512 Len=0"
"35","0.399244","146.75.37.140","192.168.12.35","TCP","1430","443  >  63572 [ACK] Seq=11692 Ack=10621 Win=637 Len=1376 [TCP PDU reassembled in 41]"
"36","0.399244","146.75.37.140","192.168.12.35","TCP","1430","443  >  63572 [PSH, ACK] Seq=13068 Ack=10621 Win=637 Len=1376 [TCP PDU reassembled in 41]"
"37","0.399244","146.75.37.140","192.168.12.35","TCP","1430","443  >  63572 [ACK] Seq=14444 Ack=10621 Win=637 Len=1376 [TCP PDU reassembled in 41]"
"38","0.399244","146.75.37.140","192.168.12.35","TCP","1430","443  >  63572 [PSH, ACK] Seq=15820 Ack=10621 Win=637 Len=1376 [TCP PDU reassembled in 41]"
"39","0.399244","146.75.37.140","192.168.12.35","TCP","1430","443  >  63572 [ACK] Seq=17196 Ack=10621 Win=637 Len=1376 [TCP PDU reassembled in 41]"
"40","0.399244","146.75.37.140","192.168.12.35","TCP","1430","443  >  63572 [PSH, ACK] Seq=18572 Ack=10621 Win=637 Len=1376 [TCP PDU reassembled in 41]"
"41","0.399244","146.75.37.140","192.168.12.35","TLSv1.2","1174","Application Data, Application Data"
"42","0.399244","146.75.37.140","192.168.12.35","TCP","54","443  >  63572 [ACK] Seq=21068 Ack=11190 Win=642 Len=0"
"43","0.399244","146.75.37.140","192.168.12.35","TCP","1430","443  >  63572 [ACK] Seq=21068 Ack=11190 Win=642 Len=1376 [TCP PDU reassembled in 54]"
"44","0.399244","146.75.37.140","192.168.12.35","TCP","1430","443  >  63572 [PSH, ACK] Seq=22444 Ack=11190 Win=642 Len=1376 [TCP PDU reassembled in 54]"
"45","0.399244","146.75.37.140","192.168.12.35","TCP","1430","443  >  63572 [ACK] Seq=23820 Ack=11190 Win=642 Len=1376 [TCP PDU reassembled in 54]"
"46","0.399244","146.75.37.140","192.168.12.35","TCP","1430","443  >  63572 [PSH, ACK] Seq=25196 Ack=11190 Win=642 Len=1376 [TCP PDU reassembled in 54]"
"47","0.399244","146.75.37.140","192.168.12.35","TCP","1430","443  >  63572 [ACK] Seq=26572 Ack=11190 Win=642 Len=1376 [TCP PDU reassembled in 54]"
"48","0.399244","146.75.37.140","192.168.12.35","TCP","1430","443  >  63572 [PSH, ACK] Seq=27948 Ack=11190 Win=642 Len=1376 [TCP PDU reassembled in 54]"
"49","0.399244","146.75.37.140","192.168.12.35","TCP","1430","443  >  63572 [ACK] Seq=29324 Ack=11190 Win=642 Len=1376 [TCP PDU reassembled in 54]"
"50","0.399244","146.75.37.140","192.168.12.35","TCP","1430","443  >  63572 [PSH, ACK] Seq=30700 Ack=11190 Win=642 Len=1376 [TCP PDU reassembled in 54]"
"51","0.399244","146.75.37.140","192.168.12.35","TCP","1430","443  >  63572 [ACK] Seq=32076 Ack=11190 Win=642 Len=1376 [TCP PDU reassembled in 54]"
"52","0.399244","146.75.37.140","192.168.12.35","TCP","1430","443  >  63572 [PSH, ACK] Seq=33452 Ack=11190 Win=642 Len=1376 [TCP PDU reassembled in 54]"
"53","0.399244","146.75.37.140","192.168.12.35","TCP","1430","443  >  63572 [ACK] Seq=34828 Ack=11190 Win=642 Len=1376 [TCP PDU reassembled in 54]"
"54","0.399244","146.75.37.140","192.168.12.35","TLSv1.2","1430","Application Data"
"55","0.400639","192.168.12.35","146.75.37.140","TCP","54","63572  >  443 [ACK] Seq=18096 Ack=19948 Win=512 Len=0"
"56","0.401099","192.168.12.35","146.75.37.140","TCP","54","63572  >  443 [ACK] Seq=18096 Ack=37580 Win=512 Len=0"
"57","0.404554","146.75.37.140","192.168.12.35","TCP","1430","443  >  63572 [ACK] Seq=37580 Ack=11190 Win=642 Len=1376 [TCP PDU reassembled in 69]"
"58","0.404554","146.75.37.140","192.168.12.35","TCP","1430","443  >  63572 [PSH, ACK] Seq=38956 Ack=11190 Win=642 Len=1376 [TCP PDU reassembled in 69]"
"59","0.404554","146.75.37.140","192.168.12.35","TCP","1430","443  >  63572 [ACK] Seq=40332 Ack=11190 Win=642 Len=1376 [TCP PDU reassembled in 69]"
"60","0.404554","146.75.37.140","192.168.12.35","TCP","1430","443  >  63572 [PSH, ACK] Seq=41708 Ack=11190 Win=642 Len=1376 [TCP PDU reassembled in 69]"
"61","0.404554","146.75.37.140","192.168.12.35","TCP","1430","443  >  63572 [ACK] Seq=43084 Ack=11190 Win=642 Len=1376 [TCP PDU reassembled in 69]"
"62","0.404554","146.75.37.140","192.168.12.35","TCP","1430","443  >  63572 [PSH, ACK] Seq=44460 Ack=11190 Win=642 Len=1376 [TCP PDU reassembled in 69]"
"63","0.404554","146.75.37.140","192.168.12.35","TCP","1430","443  >  63572 [ACK] Seq=45836 Ack=11190 Win=642 Len=1376 [TCP PDU reassembled in 69]"
"64","0.404554","146.75.37.140","192.168.12.35","TCP","1430","443  >  63572 [PSH, ACK] Seq=47212 Ack=11190 Win=642 Len=1376 [TCP PDU reassembled in 69]"
"65","0.405378","192.168.12.35","146.75.37.140","TCP","54","63572  >  443 [ACK] Seq=18096 Ack=48588 Win=512 Len=0"
"66","0.411067","146.75.37.140","192.168.12.35","TCP","1430","443  >  63572 [ACK] Seq=48588 Ack=11190 Win=642 Len=1376 [TCP PDU reassembled in 69]"
"67","0.411067","146.75.37.140","192.168.12.35","TCP","1430","443  >  63572 [PSH, ACK] Seq=49964 Ack=11190 Win=642 Len=1376 [TCP PDU reassembled in 69]"
"68","0.411067","146.75.37.140","192.168.12.35","TCP","1430","443  >  63572 [ACK] Seq=51340 Ack=11190 Win=642 Len=1376 [TCP PDU reassembled in 69]"
"69","0.411067","146.75.37.140","192.168.12.35","TLSv1.2","1430","Application Data"
"70","0.411067","146.75.37.140","192.168.12.35","TLSv1.2","1430","Application Data"
"71","0.411067","146.75.37.140","192.168.12.35","TLSv1.2","1430","Application Data"
"72","0.411067","146.75.37.140","192.168.12.35","TCP","1430","443  >  63572 [ACK] Seq=56844 Ack=11190 Win=642 Len=1376 [TCP PDU reassembled in 75]"
"73","0.411067","146.75.37.140","192.168.12.35","TCP","1430","443  >  63572 [PSH, ACK] Seq=58220 Ack=11190 Win=642 Len=1376 [TCP PDU reassembled in 75]"
"74","0.411067","146.75.37.140","192.168.12.35","TCP","1430","443  >  63572 [ACK] Seq=59596 Ack=11190 Win=642 Len=1376 [TCP PDU reassembled in 75]"
"75","0.411067","146.75.37.140","192.168.12.35","TLSv1.2","391","Application Data"
"76","0.412354","192.168.12.35","146.75.37.140","TCP","54","63572  >  443 [ACK] Seq=18096 Ack=60972 Win=512 Len=0"
"77","0.417071","146.75.37.140","192.168.12.35","TCP","54","443  >  63572 [ACK] Seq=61309 Ack=12586 Win=648 Len=0"
"78","0.417071","146.75.37.140","192.168.12.35","TCP","54","443  >  63572 [ACK] Seq=61309 Ack=12922 Win=653 Len=0"
"79","0.429460","146.75.37.140","192.168.12.35","TLSv1.2","335","Application Data"
"80","0.430501","192.168.12.35","146.75.37.140","TCP","54","63572  >  443 [ACK] Seq=18096 Ack=61590 Win=510 Len=0"
"81","0.441827","146.75.37.140","192.168.12.35","TCP","54","443  >  63572 [ACK] Seq=61590 Ack=14318 Win=658 Len=0"
"82","0.446704","146.75.37.140","192.168.12.35","TCP","1430","443  >  63572 [ACK] Seq=61590 Ack=14318 Win=658 Len=1376 [TCP PDU reassembled in 83]"
"83","0.446704","146.75.37.140","192.168.12.35","TLSv1.2","505","Application Data"
"84","0.447060","192.168.12.35","146.75.37.140","TCP","54","63572  >  443 [ACK] Seq=18096 Ack=62966 Win=512 Len=0"
"85","0.447222","192.168.12.35","146.75.37.140","TCP","54","63572  >  443 [ACK] Seq=18096 Ack=63417 Win=510 Len=0"
"86","0.452579","192.168.12.35","146.75.37.140","UDP","97","52870  >  443 Len=55"
"87","0.458345","146.75.37.140","192.168.12.35","TLSv1.2","581","Application Data"
"88","0.458345","146.75.37.140","192.168.12.35","TCP","1430","443  >  63572 [ACK] Seq=63944 Ack=14318 Win=658 Len=1376 [TCP PDU reassembled in 91]"
"89","0.458345","146.75.37.140","192.168.12.35","TCP","1430","443  >  63572 [PSH, ACK] Seq=65320 Ack=14318 Win=658 Len=1376 [TCP PDU reassembled in 91]"
"90","0.458345","146.75.37.140","192.168.12.35","TCP","1430","443  >  63572 [ACK] Seq=66696 Ack=14318 Win=658 Len=1376 [TCP PDU reassembled in 91]"
"91","0.458345","146.75.37.140","192.168.12.35","TLSv1.2","305","Application Data"
"92","0.458345","146.75.37.140","192.168.12.35","TLSv1.2","661","Application Data"
"93","0.458345","146.75.37.140","192.168.12.35","TLSv1.2","1321","Application Data"
"94","0.458345","146.75.37.140","192.168.12.35","TLSv1.2","285","Application Data"
"95","0.458345","146.75.37.140","192.168.12.35","TLSv1.2","297","Application Data, Application Data, Application Data, Application Data"
"96","0.458345","146.75.37.140","192.168.12.35","TLSv1.2","539","Application Data, Application Data, Application Data"
"97","0.458345","146.75.37.140","192.168.12.35","TLSv1.2","207","Application Data"
"98","0.458345","146.75.37.140","192.168.12.35","TLSv1.2","431","Application Data"
"99","0.458345","146.75.37.140","192.168.12.35","TLSv1.2","157","Application Data"
"100","0.458345","146.75.37.140","192.168.12.35","TLSv1.2","297","Application Data"
"101","0.458345","146.75.37.140","192.168.12.35","TLSv1.2","283","Application Data"
"102","0.458345","146.75.37.140","192.168.12.35","TCP","54","443  >  63572 [ACK] Seq=72261 Ack=15714 Win=664 Len=0"
"103","0.458345","146.75.37.140","192.168.12.35","TLSv1.2","105","Application Data"
"104","0.459105","192.168.12.35","146.75.37.140","TCP","54","63572  >  443 [ACK] Seq=18096 Ack=68072 Win=512 Len=0"
"105","0.459330","192.168.12.35","146.75.37.140","TCP","54","63572  >  443 [ACK] Seq=18096 Ack=68930 Win=509 Len=0"
"106","0.459424","192.168.12.35","146.75.37.140","TCP","54","63572  >  443 [ACK] Seq=18096 Ack=70428 Win=512 Len=0"
"107","0.459481","192.168.12.35","146.75.37.140","TCP","54","63572  >  443 [ACK] Seq=18096 Ack=71156 Win=509 Len=0"
"108","0.459534","192.168.12.35","146.75.37.140","TCP","54","63572  >  443 [ACK] Seq=18096 Ack=71686 Win=507 Len=0"
"109","0.459583","192.168.12.35","146.75.37.140","TCP","54","63572  >  443 [ACK] Seq=18096 Ack=72032 Win=1025 Len=0"
"110","0.459655","192.168.12.35","146.75.37.140","TCP","54","63572  >  443 [ACK] Seq=18096 Ack=72312 Win=1024 Len=0"
"111","0.471981","146.75.37.140","192.168.12.35","TCP","54","443  >  63572 [ACK] Seq=72312 Ack=16283 Win=669 Len=0"
"112","0.502036","146.75.37.140","192.168.12.35","TCP","54","443  >  63572 [ACK] Seq=72312 Ack=17679 Win=675 Len=0"
"113","0.507553","146.75.37.140","192.168.12.35","TCP","54","443  >  63572 [ACK] Seq=72312 Ack=18061 Win=680 Len=0"
"114","0.507553","146.75.37.140","192.168.12.35","TCP","54","443  >  63572 [ACK] Seq=72312 Ack=18096 Win=680 Len=0"
"115","0.513763","146.75.37.140","192.168.12.35","UDP","67","443  >  52870 Len=25"
"116","0.530192","192.168.12.35","146.75.37.140","UDP","84","52870  >  443 Len=42"
"117","0.532029","146.75.37.140","192.168.12.35","TLSv1.2","206","Application Data"
"118","0.532029","146.75.37.140","192.168.12.35","TLSv1.2","1233","Application Data"
"119","0.532029","146.75.37.140","192.168.12.35","TLSv1.2","98","Application Data"
"120","0.532029","146.75.37.140","192.168.12.35","TCP","1430","443  >  63572 [ACK] Seq=73687 Ack=18096 Win=680 Len=1376 [TCP PDU reassembled in 121]"
"121","0.532029","146.75.37.140","192.168.12.35","TLSv1.2","742","Application Data"
"122","0.532029","146.75.37.140","192.168.12.35","TLSv1.2","87","Application Data"
"123","0.532954","192.168.12.35","146.75.37.140","TCP","54","63572  >  443 [ACK] Seq=18096 Ack=73643 Win=1025 Len=0"
"124","0.533261","192.168.12.35","146.75.37.140","TCP","54","63572  >  443 [ACK] Seq=18096 Ack=75063 Win=1025 Len=0"
"125","0.533365","192.168.12.35","146.75.37.140","TCP","54","63572  >  443 [ACK] Seq=18096 Ack=75784 Win=1022 Len=0"
"126","0.538812","146.75.37.140","192.168.12.35","UDP","71","443  >  52870 Len=29"
"127","0.547331","146.75.37.140","192.168.12.35","TLSv1.2","163","Application Data"
"128","0.547331","146.75.37.140","192.168.12.35","TLSv1.2","110","Application Data"
"129","0.547647","192.168.12.35","146.75.37.140","TCP","54","63572  >  443 [ACK] Seq=18096 Ack=75949 Win=1021 Len=0"
"130","0.551979","146.75.37.140","192.168.12.35","TLSv1.2","411","Application Data"
"131","0.551979","146.75.37.140","192.168.12.35","TLSv1.2","109","Application Data"
"132","0.551979","146.75.37.140","192.168.12.35","TLSv1.2","710","Application Data"
"133","0.551979","146.75.37.140","192.168.12.35","TLSv1.2","265","Application Data"
"134","0.551979","146.75.37.140","192.168.12.35","TLSv1.2","182","Application Data"
"135","0.551979","146.75.37.140","192.168.12.35","TLSv1.2","149","Application Data"
"136","0.551979","146.75.37.140","192.168.12.35","TLSv1.2","395","Application Data"
"137","0.551979","146.75.37.140","192.168.12.35","TLSv1.2","213","Application Data"
"138","0.551979","146.75.37.140","192.168.12.35","TLSv1.2","761","Application Data"
"139","0.551979","146.75.37.140","192.168.12.35","TLSv1.2","1418","Application Data"
"140","0.551979","146.75.37.140","192.168.12.35","TLSv1.2","417","Application Data"
"141","0.551979","146.75.37.140","192.168.12.35","TLSv1.2","511","Application Data"
"142","0.551979","146.75.37.140","192.168.12.35","TLSv1.2","1430","Application Data"
"143","0.551979","146.75.37.140","192.168.12.35","TLSv1.2","829","Application Data"
"144","0.551979","146.75.37.140","192.168.12.35","TLSv1.2","804","Application Data"
"145","0.551979","146.75.37.140","192.168.12.35","TLSv1.2","893","Application Data, Application Data"
"146","0.551979","146.75.37.140","192.168.12.35","TLSv1.2","348","Application Data, Application Data"
"147","0.551979","146.75.37.140","192.168.12.35","TLSv1.2","276","Application Data"
"148","0.552703","192.168.12.35","146.75.37.140","TCP","54","63572  >  443 [ACK] Seq=18096 Ack=76361 Win=1020 Len=0"
"149","0.552867","192.168.12.35","146.75.37.140","TCP","54","63572  >  443 [ACK] Seq=18096 Ack=77228 Win=1025 Len=0"
"150","0.552953","192.168.12.35","146.75.37.140","TCP","54","63572  >  443 [ACK] Seq=18096 Ack=77451 Win=1024 Len=0"
"151","0.553011","192.168.12.35","146.75.37.140","TCP","54","63572  >  443 [ACK] Seq=18096 Ack=77951 Win=1022 Len=0"
"152","0.553077","192.168.12.35","146.75.37.140","TCP","54","63572  >  443 [ACK] Seq=18096 Ack=80022 Win=1025 Len=0"
"153","0.553130","192.168.12.35","146.75.37.140","TCP","54","63572  >  443 [ACK] Seq=18096 Ack=80842 Win=1021 Len=0"
"154","0.553186","192.168.12.35","146.75.37.140","TCP","54","63572  >  443 [ACK] Seq=18096 Ack=82993 Win=1025 Len=0"
"155","0.553274","192.168.12.35","146.75.37.140","TCP","54","63572  >  443 [ACK] Seq=18096 Ack=84582 Win=1025 Len=0"
"156","0.553325","192.168.12.35","146.75.37.140","TCP","54","63572  >  443 [ACK] Seq=18096 Ack=85098 Win=1023 Len=0"
"157","0.749882","146.75.37.140","192.168.12.35","TCP","1430","443  >  63572 [ACK] Seq=85098 Ack=18096 Win=680 Len=1376 [TCP PDU reassembled in 161]"
"158","0.749882","146.75.37.140","192.168.12.35","TCP","1430","443  >  63572 [PSH, ACK] Seq=86474 Ack=18096 Win=680 Len=1376 [TCP PDU reassembled in 161]"
"159","0.749882","146.75.37.140","192.168.12.35","TCP","1430","443  >  63572 [ACK] Seq=87850 Ack=18096 Win=680 Len=1376 [TCP PDU reassembled in 161]"
"160","0.749882","146.75.37.140","192.168.12.35","TCP","1430","443  >  63572 [PSH, ACK] Seq=89226 Ack=18096 Win=680 Len=1376 [TCP PDU reassembled in 161]"
"161","0.749882","146.75.37.140","192.168.12.35","TLSv1.2","964","Application Data"
"162","0.749882","146.75.37.140","192.168.12.35","TLSv1.2","476","Application Data"
"163","0.750474","192.168.12.35","146.75.37.140","TCP","54","63572  >  443 [ACK] Seq=18096 Ack=90602 Win=1025 Len=0"
"164","0.750705","192.168.12.35","146.75.37.140","TCP","54","63572  >  443 [ACK] Seq=18096 Ack=91934 Win=1019 Len=0"
"165","0.760116","146.75.37.140","192.168.12.35","TLSv1.2","348","Application Data"
"166","0.760116","146.75.37.140","192.168.12.35","TCP","1430","443  >  63572 [ACK] Seq=92228 Ack=18096 Win=680 Len=1376 [TCP PDU reassembled in 167]"
"167","0.760116","146.75.37.140","192.168.12.35","TLSv1.2","519","Application Data"
"168","0.760116","146.75.37.140","192.168.12.35","TLSv1.2","384","Application Data"
"169","0.760116","146.75.37.140","192.168.12.35","TCP","1430","443  >  63572 [ACK] Seq=94399 Ack=18096 Win=680 Len=1376 [TCP PDU reassembled in 170]"
"170","0.760116","146.75.37.140","192.168.12.35","TLSv1.2","1007","Application Data"
"171","0.760116","146.75.37.140","192.168.12.35","TCP","1430","443  >  63572 [ACK] Seq=96728 Ack=18096 Win=680 Len=1376 [TCP PDU reassembled in 172]"
"172","0.760116","146.75.37.140","192.168.12.35","TLSv1.2","908","Application Data"
"173","0.760922","192.168.12.35","146.75.37.140","TCP","54","63572  >  443 [ACK] Seq=18096 Ack=93604 Win=1025 Len=0"
"174","0.761203","192.168.12.35","146.75.37.140","TCP","54","63572  >  443 [ACK] Seq=18096 Ack=94399 Win=1022 Len=0"
"175","0.761304","192.168.12.35","146.75.37.140","TCP","54","63572  >  443 [ACK] Seq=18096 Ack=96728 Win=1025 Len=0"
"176","0.761373","192.168.12.35","146.75.37.140","TCP","54","63572  >  443 [ACK] Seq=18096 Ack=98958 Win=1025 Len=0"
"177","0.769747","146.75.37.140","192.168.12.35","TCP","1430","443  >  63572 [ACK] Seq=98958 Ack=18096 Win=680 Len=1376 [TCP PDU reassembled in 179]"
"178","0.769747","146.75.37.140","192.168.12.35","TCP","1430","443  >  63572 [PSH, ACK] Seq=100334 Ack=18096 Win=680 Len=1376 [TCP PDU reassembled in 179]"
"179","0.769747","146.75.37.140","192.168.12.35","TLSv1.2","596","Application Data"
"180","0.770257","192.168.12.35","146.75.37.140","TCP","54","63572  >  443 [ACK] Seq=18096 Ack=101710 Win=1025 Len=0"
"181","0.779936","146.75.37.140","192.168.12.35","TLSv1.2","1207","Application Data"
"182","0.779936","146.75.37.140","192.168.12.35","TLSv1.2","202","Application Data"
"183","0.779936","146.75.37.140","192.168.12.35","TCP","1430","443  >  63572 [ACK] Seq=103553 Ack=18096 Win=680 Len=1376 [TCP PDU reassembled in 186]"
"184","0.779936","146.75.37.140","192.168.12.35","TCP","1430","443  >  63572 [PSH, ACK] Seq=104929 Ack=18096 Win=680 Len=1376 [TCP PDU reassembled in 186]"
"185","0.779936","146.75.37.140","192.168.12.35","TCP","1430","443  >  63572 [ACK] Seq=106305 Ack=18096 Win=680 Len=1376 [TCP PDU reassembled in 186]"
"186","0.779936","146.75.37.140","192.168.12.35","TLSv1.2","573","Application Data"
"187","0.779936","146.75.37.140","192.168.12.35","TLSv1.2","525","Application Data"
"188","0.780491","192.168.12.35","146.75.37.140","TCP","54","63572  >  443 [ACK] Seq=18096 Ack=103405 Win=1025 Len=0"
"189","0.780681","192.168.12.35","146.75.37.140","TCP","54","63572  >  443 [ACK] Seq=18096 Ack=107681 Win=1025 Len=0"
"190","0.780865","192.168.12.35","146.75.37.140","TCP","54","63572  >  443 [ACK] Seq=18096 Ack=108671 Win=1021 Len=0"
"191","0.783122","192.168.12.35","146.75.37.140","TLSv1.2","3213","Application Data"
"192","0.829661","146.75.37.140","192.168.12.35","TCP","54","443  >  63572 [ACK] Seq=108671 Ack=19492 Win=686 Len=0"
"193","0.847181","146.75.37.140","192.168.12.35","TCP","54","443  >  63572 [ACK] Seq=108671 Ack=20888 Win=691 Len=0"
"194","0.858688","146.75.37.140","192.168.12.35","TCP","54","443  >  63572 [ACK] Seq=108671 Ack=21255 Win=697 Len=0"
"195","0.883748","146.75.37.140","192.168.12.35","TCP","1430","443  >  63572 [ACK] Seq=108671 Ack=21255 Win=697 Len=1376 [TCP PDU reassembled in 196]"
"196","0.883748","146.75.37.140","192.168.12.35","TLSv1.2","661","Application Data"
"197","0.884121","192.168.12.35","146.75.37.140","TCP","54","63572  >  443 [ACK] Seq=21255 Ack=110654 Win=1025 Len=0"
"198","1.085819","192.168.12.35","146.75.37.140","TLSv1.2","3240","Application Data"
"199","1.086018","192.168.12.35","146.75.37.140","TLSv1.2","1010","Application Data"
"200","1.091517","192.168.12.35","146.75.37.140","TLSv1.2","3253","Application Data"
"201","1.126735","192.168.12.35","146.75.37.140","TLSv1.2","3254","Application Data"
"202","1.132002","146.75.37.140","192.168.12.35","TCP","54","443  >  63572 [ACK] Seq=110654 Ack=22651 Win=702 Len=0"
"203","1.146723","146.75.37.140","192.168.12.35","TCP","54","443  >  63572 [ACK] Seq=110654 Ack=24047 Win=708 Len=0"
"204","1.157692","146.75.37.140","192.168.12.35","TCP","54","443  >  63572 [ACK] Seq=110654 Ack=24441 Win=713 Len=0"
"205","1.167336","146.75.37.140","192.168.12.35","TCP","54","443  >  63572 [ACK] Seq=110654 Ack=25397 Win=718 Len=0"
"206","1.188366","146.75.37.140","192.168.12.35","TCP","1430","443  >  63572 [ACK] Seq=110654 Ack=25397 Win=718 Len=1376 [TCP PDU reassembled in 207]"
"207","1.188366","146.75.37.140","192.168.12.35","TLSv1.2","826","Application Data"
"208","1.188776","192.168.12.35","146.75.37.140","TCP","54","63572  >  443 [ACK] Seq=31796 Ack=112802 Win=1025 Len=0"
"209","1.193628","146.75.37.140","192.168.12.35","TCP","54","443  >  63572 [ACK] Seq=112802 Ack=26793 Win=724 Len=0"
"210","1.211838","146.75.37.140","192.168.12.35","TCP","54","443  >  63572 [ACK] Seq=112802 Ack=28189 Win=729 Len=0"
"211","1.217665","146.75.37.140","192.168.12.35","TCP","54","443  >  63572 [ACK] Seq=112802 Ack=28596 Win=735 Len=0"
"212","1.242720","146.75.37.140","192.168.12.35","TLSv1.2","147","Application Data"
"213","1.242720","146.75.37.140","192.168.12.35","TCP","54","443  >  63572 [ACK] Seq=112895 Ack=29992 Win=740 Len=0"
"214","1.242720","146.75.37.140","192.168.12.35","TLSv1.2","223","Application Data"
"215","1.242720","146.75.37.140","192.168.12.35","TCP","1430","443  >  63572 [ACK] Seq=113064 Ack=29992 Win=740 Len=1376 [TCP PDU reassembled in 217]"
"216","1.242720","146.75.37.140","192.168.12.35","TCP","1430","443  >  63572 [PSH, ACK] Seq=114440 Ack=29992 Win=740 Len=1376 [TCP PDU reassembled in 217]"
"217","1.242720","146.75.37.140","192.168.12.35","TLSv1.2","78","Application Data"
"218","1.242720","146.75.37.140","192.168.12.35","TLSv1.2","727","Application Data"
"219","1.242720","146.75.37.140","192.168.12.35","TLSv1.2","243","Application Data"
"220","1.242720","146.75.37.140","192.168.12.35","TCP","1430","443  >  63572 [ACK] Seq=116702 Ack=29992 Win=740 Len=1376 [TCP PDU reassembled in 221]"
"221","1.242720","146.75.37.140","192.168.12.35","TLSv1.2","594","Application Data"
"222","1.242720","146.75.37.140","192.168.12.35","TLSv1.2","716","Application Data"
"223","1.243554","192.168.12.35","146.75.37.140","TCP","54","63572  >  443 [ACK] Seq=31796 Ack=113064 Win=1024 Len=0"
"224","1.243807","192.168.12.35","146.75.37.140","TCP","54","63572  >  443 [ACK] Seq=31796 Ack=115816 Win=1025 Len=0"
"225","1.243869","192.168.12.35","146.75.37.140","TCP","54","63572  >  443 [ACK] Seq=31796 Ack=116513 Win=1022 Len=0"
"226","1.244016","192.168.12.35","146.75.37.140","TCP","54","63572  >  443 [ACK] Seq=31796 Ack=118078 Win=1025 Len=0"
"227","1.244073","192.168.12.35","146.75.37.140","TCP","54","63572  >  443 [ACK] Seq=31796 Ack=119280 Win=1020 Len=0"
"228","1.248757","146.75.37.140","192.168.12.35","TLSv1.2","984","Application Data, Application Data, Application Data"
"229","1.248757","146.75.37.140","192.168.12.35","TLSv1.2","385","Application Data"
"230","1.248757","146.75.37.140","192.168.12.35","TLSv1.2","296","Application Data"
"231","1.248757","146.75.37.140","192.168.12.35","TLSv1.2","216","Application Data"
"232","1.248757","146.75.37.140","192.168.12.35","TLSv1.2","706","Application Data"
"233","1.248757","146.75.37.140","192.168.12.35","TLSv1.2","299","Application Data"
"234","1.248757","146.75.37.140","192.168.12.35","TLSv1.2","169","Application Data"
"235","1.249412","192.168.12.35","146.75.37.140","TCP","54","63572  >  443 [ACK] Seq=31796 Ack=120210 Win=1025 Len=0"
"236","1.249855","192.168.12.35","146.75.37.140","TCP","54","63572  >  443 [ACK] Seq=31796 Ack=120541 Win=1023 Len=0"
"237","1.249932","192.168.12.35","146.75.37.140","TCP","54","63572  >  443 [ACK] Seq=31796 Ack=120945 Win=1022 Len=0"
"238","1.250018","192.168.12.35","146.75.37.140","TCP","54","63572  >  443 [ACK] Seq=31796 Ack=121842 Win=1025 Len=0"
"239","1.253669","146.75.37.140","192.168.12.35","TCP","1430","443  >  63572 [ACK] Seq=121957 Ack=29992 Win=740 Len=1376 [TCP PDU reassembled in 240]"
"240","1.253669","146.75.37.140","192.168.12.35","TLSv1.2","455","Application Data"
"241","1.254034","192.168.12.35","146.75.37.140","TCP","54","63572  >  443 [ACK] Seq=31796 Ack=123333 Win=1025 Len=0"
"242","1.259660","146.75.37.140","192.168.12.35","TLSv1.2","228","Application Data"
"243","1.259985","192.168.12.35","146.75.37.140","TCP","54","63572  >  443 [ACK] Seq=31796 Ack=123908 Win=1022 Len=0"
"244","1.266789","146.75.37.140","192.168.12.35","TCP","54","443  >  63572 [ACK] Seq=123908 Ack=31388 Win=746 Len=0"
"245","1.277747","146.75.37.140","192.168.12.35","TLSv1.2","126","Application Data"
"246","1.277747","146.75.37.140","192.168.12.35","TLSv1.2","310","Application Data"
"247","1.277747","146.75.37.140","192.168.12.35","TLSv1.2","146","Application Data"
"248","1.277747","146.75.37.140","192.168.12.35","TLSv1.2","146","Application Data"
"249","1.277747","146.75.37.140","192.168.12.35","TCP","54","443  >  63572 [ACK] Seq=124420 Ack=31796 Win=751 Len=0"
"250","1.278092","192.168.12.35","146.75.37.140","TCP","54","63572  >  443 [ACK] Seq=31796 Ack=124236 Win=1021 Len=0"
"251","1.278262","192.168.12.35","146.75.37.140","TCP","54","63572  >  443 [ACK] Seq=31796 Ack=124420 Win=1020 Len=0"
"252","1.287260","146.75.37.140","192.168.12.35","TLSv1.2","282","Application Data"
"253","1.287260","146.75.37.140","192.168.12.35","TLSv1.2","364","Application Data"
"254","1.287260","146.75.37.140","192.168.12.35","TLSv1.2","127","Application Data"
"255","1.287260","146.75.37.140","192.168.12.35","TLSv1.2","372","Application Data"
"256","1.287260","146.75.37.140","192.168.12.35","TLSv1.2","1090","Application Data"
"257","1.287260","146.75.37.140","192.168.12.35","TLSv1.2","123","Application Data"
"258","1.287260","146.75.37.140","192.168.12.35","TLSv1.2","1257","Application Data"
"259","1.287260","146.75.37.140","192.168.12.35","TLSv1.2","184","Application Data"
"260","1.287260","146.75.37.140","192.168.12.35","TLSv1.2","505","Application Data"
"261","1.287649","192.168.12.35","146.75.37.140","TCP","54","63572  >  443 [ACK] Seq=31796 Ack=124958 Win=1025 Len=0"
"262","1.287803","192.168.12.35","146.75.37.140","TCP","54","63572  >  443 [ACK] Seq=31796 Ack=125349 Win=1023 Len=0"
"263","1.287853","192.168.12.35","146.75.37.140","TCP","54","63572  >  443 [ACK] Seq=31796 Ack=126454 Win=1025 Len=0"
"264","1.287932","192.168.12.35","146.75.37.140","TCP","54","63572  >  443 [ACK] Seq=31796 Ack=127787 Win=1019 Len=0"
"265","1.301902","146.75.37.140","192.168.12.35","TLSv1.2","214","Application Data"
"266","1.302372","192.168.12.35","146.75.37.140","TCP","54","63572  >  443 [ACK] Seq=31796 Ack=128398 Win=1025 Len=0"
"267","1.307712","146.75.37.140","192.168.12.35","TLSv1.2","122","Application Data"
"268","1.313734","146.75.37.140","192.168.12.35","TLSv1.2","203","Application Data"
"269","1.313734","146.75.37.140","192.168.12.35","TLSv1.2","581","Application Data"
"270","1.313734","146.75.37.140","192.168.12.35","TLSv1.2","194","Application Data"
"271","1.314005","192.168.12.35","146.75.37.140","TCP","54","63572  >  443 [ACK] Seq=31796 Ack=128615 Win=1024 Len=0"
"272","1.314183","192.168.12.35","146.75.37.140","TCP","54","63572  >  443 [ACK] Seq=31796 Ack=129282 Win=1021 Len=0"
"273","1.325810","146.75.37.140","192.168.12.35","TLSv1.2","509","Application Data"
"274","1.325924","192.168.12.35","146.75.37.140","TLSv1.2","3230","Application Data"
"275","1.326271","192.168.12.35","146.75.37.140","TLSv1.2","210","Application Data"
"276","1.331835","146.75.37.140","192.168.12.35","TLSv1.2","544","Application Data"
"277","1.331835","146.75.37.140","192.168.12.35","TLSv1.2","840","Application Data"
"278","1.331835","146.75.37.140","192.168.12.35","TLSv1.2","1310","Application Data"
"279","1.332109","192.168.12.35","146.75.37.140","TCP","54","63572  >  443 [ACK] Seq=35128 Ack=130227 Win=1025 Len=0"
"280","1.332249","192.168.12.35","146.75.37.140","TCP","54","63572  >  443 [ACK] Seq=35128 Ack=132269 Win=1025 Len=0"
"281","1.338719","146.75.37.140","192.168.12.35","TCP","1430","443  >  63572 [ACK] Seq=132269 Ack=31796 Win=751 Len=1376 [TCP PDU reassembled in 282]"
"282","1.338719","146.75.37.140","192.168.12.35","TLSv1.2","933","Application Data"
"283","1.338996","192.168.12.35","146.75.37.140","TCP","54","63572  >  443 [ACK] Seq=35128 Ack=134524 Win=1025 Len=0"
"284","1.343681","146.75.37.140","192.168.12.35","TLSv1.2","292","Application Data"
"285","1.343681","146.75.37.140","192.168.12.35","TLSv1.2","593","Application Data"
"286","1.343681","146.75.37.140","192.168.12.35","TLSv1.2","202","Application Data"
"287","1.344005","192.168.12.35","146.75.37.140","TCP","54","63572  >  443 [ACK] Seq=35128 Ack=135301 Win=1022 Len=0"
"288","1.354754","146.75.37.140","192.168.12.35","TLSv1.2","650","Application Data"
"289","1.355358","192.168.12.35","146.75.37.140","TCP","54","63572  >  443 [ACK] Seq=35128 Ack=136045 Win=1025 Len=0"
"290","1.359646","146.75.37.140","192.168.12.35","TLSv1.2","324","Application Data"
"291","1.359646","146.75.37.140","192.168.12.35","TLSv1.2","194","Application Data"
"292","1.359646","146.75.37.140","192.168.12.35","TLSv1.2","267","Application Data"
"293","1.359646","146.75.37.140","192.168.12.35","TLSv1.2","161","Application Data"
"294","1.359646","146.75.37.140","192.168.12.35","TLSv1.2","144","Application Data"
"295","1.360073","192.168.12.35","146.75.37.140","TCP","54","63572  >  443 [ACK] Seq=35128 Ack=136455 Win=1023 Len=0"
"296","1.360265","192.168.12.35","146.75.37.140","TCP","54","63572  >  443 [ACK] Seq=35128 Ack=136775 Win=1022 Len=0"
"297","1.365817","146.75.37.140","192.168.12.35","TLSv1.2","209","Application Data"
"298","1.365817","146.75.37.140","192.168.12.35","TLSv1.2","363","Application Data"
"299","1.365817","146.75.37.140","192.168.12.35","TCP","1430","443  >  63572 [ACK] Seq=137329 Ack=31796 Win=751 Len=1376 [TCP PDU reassembled in 300]"
"300","1.365817","146.75.37.140","192.168.12.35","TLSv1.2","304","Application Data"
"301","1.365817","146.75.37.140","192.168.12.35","TCP","54","443  >  63572 [ACK] Seq=138955 Ack=33192 Win=757 Len=0"
"302","1.366514","192.168.12.35","146.75.37.140","TCP","54","63572  >  443 [ACK] Seq=35128 Ack=137020 Win=1021 Len=0"
"303","1.366804","192.168.12.35","146.75.37.140","TCP","54","63572  >  443 [ACK] Seq=35128 Ack=138705 Win=1025 Len=0"
"304","1.373105","146.75.37.140","192.168.12.35","TLSv1.2","127","Application Data"
"305","1.373105","146.75.37.140","192.168.12.35","TLSv1.2","1043","Application Data"
"306","1.373105","146.75.37.140","192.168.12.35","TLSv1.2","1228","Application Data"
"307","1.373429","192.168.12.35","146.75.37.140","TCP","54","63572  >  443 [ACK] Seq=35128 Ack=139028 Win=1023 Len=0"
"308","1.373610","192.168.12.35","146.75.37.140","TCP","54","63572  >  443 [ACK] Seq=35128 Ack=141191 Win=1025 Len=0"
"309","1.377612","146.75.37.140","192.168.12.35","TLSv1.2","1149","Application Data"
"310","1.377612","146.75.37.140","192.168.12.35","TLSv1.2","872","Application Data"
"311","1.377612","146.75.37.140","192.168.12.35","TLSv1.2","315","Application Data"
"312","1.377612","146.75.37.140","192.168.12.35","TLSv1.2","192","Application Data"
"313","1.377978","192.168.12.35","146.75.37.140","TCP","54","63572  >  443 [ACK] Seq=35128 Ack=143104 Win=1025 Len=0"
"314","1.378101","192.168.12.35","146.75.37.140","TCP","54","63572  >  443 [ACK] Seq=35128 Ack=143503 Win=1023 Len=0"
"315","1.384860","146.75.37.140","192.168.12.35","TLSv1.2","594","Application Data"
"316","1.384860","146.75.37.140","192.168.12.35","TLSv1.2","95","Application Data"
"317","1.384860","146.75.37.140","192.168.12.35","TCP","54","443  >  63572 [ACK] Seq=144084 Ack=34588 Win=762 Len=0"
"318","1.385512","192.168.12.35","146.75.37.140","TCP","54","63572  >  443 [ACK] Seq=35128 Ack=144084 Win=1021 Len=0"
"319","1.389752","146.75.37.140","192.168.12.35","TLSv1.2","85","Application Data"
"320","1.389752","146.75.37.140","192.168.12.35","TCP","54","443  >  63572 [ACK] Seq=144115 Ack=34972 Win=768 Len=0"
"321","1.396661","146.75.37.140","192.168.12.35","TCP","54","443  >  63572 [ACK] Seq=144115 Ack=35128 Win=773 Len=0"
"322","1.439779","192.168.12.35","146.75.37.140","TCP","54","63572  >  443 [ACK] Seq=35128 Ack=144115 Win=1021 Len=0"
"323","1.448571","146.75.37.140","192.168.12.35","TCP","1430","443  >  63572 [ACK] Seq=144115 Ack=35128 Win=773 Len=1376 [TCP PDU reassembled in 324]"
"324","1.448571","146.75.37.140","192.168.12.35","TLSv1.2","571","Application Data"
"325","1.449020","192.168.12.35","146.75.37.140","TCP","54","63572  >  443 [ACK] Seq=35128 Ack=146008 Win=1025 Len=0"
"326","1.468824","192.168.12.35","146.75.37.140","TLSv1.2","3244","Application Data"
"327","1.472880","192.168.12.35","146.75.37.140","TLSv1.2","3183","Application Data"
"328","1.473074","192.168.12.35","146.75.37.140","TLSv1.2","519","Application Data"
"329","1.536657","192.168.12.35","146.75.37.140","TLSv1.2","3193","Application Data"
"330","1.538166","192.168.12.35","146.75.37.140","TLSv1.2","3208","Application Data"
"331","1.538384","192.168.12.35","146.75.37.140","TLSv1.2","3185","Application Data"
"332","1.538439","192.168.12.35","146.75.37.140","TLSv1.2","3210","Application Data"
"333","1.562254","146.75.37.140","192.168.12.35","TCP","54","443  >  63572 [ACK] Seq=146008 Ack=36524 Win=778 Len=0"
"334","1.578623","146.75.37.140","192.168.12.35","TCP","54","443  >  63572 [ACK] Seq=146008 Ack=37920 Win=784 Len=0"
"335","1.591878","146.75.37.140","192.168.12.35","TCP","54","443  >  63572 [ACK] Seq=146008 Ack=38318 Win=789 Len=0"
"336","1.607199","146.75.37.140","192.168.12.35","TCP","54","443  >  63572 [ACK] Seq=146008 Ack=39714 Win=795 Len=0"
"337","1.634098","146.75.37.140","192.168.12.35","TCP","54","443  >  63572 [ACK] Seq=146008 Ack=41110 Win=800 Len=0"
"338","1.634098","146.75.37.140","192.168.12.35","TLSv1.2","950","Application Data"
"339","1.634098","146.75.37.140","192.168.12.35","TLSv1.2","1384","Application Data"
"340","1.634098","146.75.37.140","192.168.12.35","TCP","54","443  >  63572 [ACK] Seq=148234 Ack=41447 Win=806 Len=0"
"341","1.634819","192.168.12.35","146.75.37.140","TCP","54","63572  >  443 [ACK] Seq=54492 Ack=148234 Win=1025 Len=0"
"342","1.641874","146.75.37.140","192.168.12.35","TCP","54","443  >  63572 [ACK] Seq=148234 Ack=41912 Win=811 Len=0"
"343","1.641874","146.75.37.140","192.168.12.35","TLSv1.2","223","Application Data"
"344","1.641874","146.75.37.140","192.168.12.35","TLSv1.2","294","Application Data"
"345","1.641874","146.75.37.140","192.168.12.35","TCP","1430","443  >  63572 [ACK] Seq=148643 Ack=41912 Win=811 Len=1376 [TCP PDU reassembled in 346]"
"346","1.641874","146.75.37.140","192.168.12.35","TLSv1.2","893","Application Data"
"347","1.641874","146.75.37.140","192.168.12.35","TLSv1.2","783","Application Data"
"348","1.641874","146.75.37.140","192.168.12.35","TLSv1.2","221","Application Data"
"349","1.641874","146.75.37.140","192.168.12.35","TLSv1.2","548","Application Data"
"350","1.641874","146.75.37.140","192.168.12.35","TLSv1.2","249","Application Data, Application Data, Application Data"
"351","1.641874","146.75.37.140","192.168.12.35","TLSv1.2","702","Application Data"
"352","1.641874","146.75.37.140","192.168.12.35","TLSv1.2","233","Application Data"
"353","1.642503","192.168.12.35","146.75.37.140","TCP","54","63572  >  443 [ACK] Seq=54492 Ack=148643 Win=1023 Len=0"
"354","1.642688","192.168.12.35","146.75.37.140","TCP","54","63572  >  443 [ACK] Seq=54492 Ack=150019 Win=1025 Len=0"
"355","1.642765","192.168.12.35","146.75.37.140","TCP","54","63572  >  443 [ACK] Seq=54492 Ack=150858 Win=1021 Len=0"
"356","1.642807","192.168.12.35","146.75.37.140","TCP","54","63572  >  443 [ACK] Seq=54492 Ack=151587 Win=1025 Len=0"
"357","1.642851","192.168.12.35","146.75.37.140","TCP","54","63572  >  443 [ACK] Seq=54492 Ack=151754 Win=1024 Len=0"
"358","1.642934","192.168.12.35","146.75.37.140","TCP","54","63572  >  443 [ACK] Seq=54492 Ack=152443 Win=1021 Len=0"
"359","1.642971","192.168.12.35","146.75.37.140","TCP","54","63572  >  443 [ACK] Seq=54492 Ack=153091 Win=1025 Len=0"
"360","1.643013","192.168.12.35","146.75.37.140","TCP","54","63572  >  443 [ACK] Seq=54492 Ack=153270 Win=1024 Len=0"
"361","1.646813","146.75.37.140","192.168.12.35","TLSv1.2","664","Application Data"
"362","1.646813","146.75.37.140","192.168.12.35","TLSv1.2","109","Application Data"
"363","1.646813","146.75.37.140","192.168.12.35","TLSv1.2","335","Application Data"
"364","1.646813","146.75.37.140","192.168.12.35","TLSv1.2","476","Application Data"
"365","1.646813","146.75.37.140","192.168.12.35","TLSv1.2","123","Application Data"
"366","1.646813","146.75.37.140","192.168.12.35","TLSv1.2","487","Application Data"
"367","1.646813","146.75.37.140","192.168.12.35","TLSv1.2","119","Application Data"
"368","1.646813","146.75.37.140","192.168.12.35","TLSv1.2","137","Application Data"
"369","1.646813","146.75.37.140","192.168.12.35","TLSv1.2","242","Application Data"
