"No.","Time","Source","Destination","Protocol","Length","Info"
"1","0.000000","192.168.12.35","146.75.37.140","TCP","55","62083  >  443 [ACK] Seq=1 Ack=1 Win=1023 Len=1 [TCP PDU reassembled in 1586]"
"2","0.026809","146.75.37.140","192.168.12.35","TCP","66","443  >  62083 [ACK] Seq=1 Ack=2 Win=313 Len=0 SLE=1 SRE=2"
"3","3.668543","192.168.12.35","146.75.37.140","TCP","55","62042  >  443 [ACK] Seq=1 Ack=1 Win=1025 Len=1"
"4","3.699354","146.75.37.140","192.168.12.35","TCP","66","443  >  62042 [ACK] Seq=1 Ack=2 Win=302 Len=0 SLE=1 SRE=2"
"5","4.469604","192.168.12.35","146.75.37.140","TLSv1.2","3412","Application Data"
"6","4.469657","192.168.12.35","146.75.37.140","TLSv1.2","93","Application Data"
"7","4.469677","192.168.12.35","146.75.37.140","TLSv1.2","1145","Application Data"
"8","4.469817","192.168.12.35","146.75.37.140","UDP","1292","50355  >  443 Len=1250"
"9","4.469845","192.168.12.35","146.75.37.140","UDP","1017","50355  >  443 Len=975"
"10","4.470121","192.168.12.35","146.75.37.140","TLSv1.2","3438","Application Data"
"11","4.515457","146.75.37.140","192.168.12.35","TCP","54","443  >  61013 [ACK] Seq=1 Ack=1397 Win=8196 Len=0"
"12","4.535923","146.75.37.140","192.168.12.35","TCP","54","443  >  61013 [ACK] Seq=1 Ack=2793 Win=8196 Len=0"
"13","4.552377","146.75.37.140","192.168.12.35","TCP","54","443  >  61013 [ACK] Seq=1 Ack=3359 Win=8196 Len=0"
"14","4.552377","146.75.37.140","192.168.12.35","TCP","54","443  >  61013 [ACK] Seq=1 Ack=3398 Win=8196 Len=0"
"15","4.552377","146.75.37.140","192.168.12.35","TLSv1.2","93","Application Data"
"16","4.565944","146.75.37.140","192.168.12.35","TCP","54","443  >  61013 [ACK] Seq=40 Ack=4489 Win=8196 Len=0"
"17","4.596510","146.75.37.140","192.168.12.35","UDP","66","443  >  50355 Len=24"
"18","4.604154","192.168.12.35","146.75.37.140","TCP","54","61013  >  443 [ACK] Seq=7873 Ack=40 Win=1025 Len=0"
"19","4.610268","146.75.37.140","192.168.12.35","TCP","54","443  >  61013 [ACK] Seq=40 Ack=5885 Win=8196 Len=0"
"20","4.623472","146.75.37.140","192.168.12.35","TCP","54","443  >  61013 [ACK] Seq=40 Ack=7281 Win=8196 Len=0"
"21","4.623884","146.75.37.140","192.168.12.35","UDP","834","443  >  50355 Len=792"
"22","4.623884","146.75.37.140","192.168.12.35","UDP","452","443  >  50355 Len=410"
"23","4.624798","192.168.12.35","146.75.37.140","UDP","82","50355  >  443 Len=40"
"24","4.634560","146.75.37.140","192.168.12.35","TCP","54","443  >  61013 [ACK] Seq=40 Ack=7873 Win=8196 Len=0"
"25","4.635865","192.168.12.35","146.75.37.140","UDP","1292","50355  >  443 Len=1250"
"26","4.635994","192.168.12.35","146.75.37.140","UDP","1019","50355  >  443 Len=977"
"27","4.641116","146.75.37.140","192.168.12.35","TCP","1430","443  >  61013 [ACK] Seq=40 Ack=7873 Win=8196 Len=1376 [TCP PDU reassembled in 28]"
"28","4.641116","146.75.37.140","192.168.12.35","TLSv1.2","504","Application Data"
"29","4.641326","192.168.12.35","146.75.37.140","TCP","54","61013  >  443 [ACK] Seq=7873 Ack=1866 Win=1025 Len=0"
"30","4.643237","192.168.12.35","146.75.37.140","TLSv1.2","89","Application Data"
"31","4.697036","146.75.37.140","192.168.12.35","TCP","1430","443  >  61013 [ACK] Seq=1866 Ack=7873 Win=8196 Len=1376 [TCP PDU reassembled in 32]"
"32","4.697036","146.75.37.140","192.168.12.35","TLSv1.2","774","Application Data"
"33","4.697036","146.75.37.140","192.168.12.35","UDP","66","443  >  50355 Len=24"
"34","4.697036","146.75.37.140","192.168.12.35","TCP","54","443  >  61013 [ACK] Seq=3962 Ack=7908 Win=8196 Len=0"
"35","4.697216","192.168.12.35","146.75.37.140","TCP","54","61013  >  443 [ACK] Seq=7908 Ack=3962 Win=1025 Len=0"
"36","4.898501","192.168.12.35","146.75.37.140","UDP","80","50355  >  443 Len=38"
"37","4.952184","146.75.37.140","192.168.12.35","UDP","67","443  >  50355 Len=25"
"38","5.165251","192.168.12.35","146.75.37.140","UDP","80","50355  >  443 Len=38"
"39","5.189518","192.168.12.35","146.75.37.140","TLSv1.2","3296","Application Data"
"40","5.189572","192.168.12.35","146.75.37.140","TLSv1.2","3415","Application Data"
"41","5.189593","192.168.12.35","146.75.37.140","TLSv1.2","888","Application Data"
"42","5.189660","192.168.12.35","146.75.37.140","TLSv1.2","3415","Application Data"
"43","5.189716","192.168.12.35","146.75.37.140","TLSv1.2","3415","Application Data"
"44","5.189739","192.168.12.35","146.75.37.140","TLSv1.2","1002","Application Data"
"45","5.189759","192.168.12.35","146.75.37.140","TLSv1.2","1048","Application Data"
"46","5.369750","146.75.37.140","192.168.12.35","TCP","54","443  >  61013 [ACK] Seq=3962 Ack=9304 Win=8196 Len=0"
"47","5.371732","146.75.37.140","192.168.12.35","UDP","67","443  >  50355 Len=25"
"48","5.380778","146.75.37.140","192.168.12.35","TCP","54","443  >  61013 [ACK] Seq=3962 Ack=10700 Win=8196 Len=0"
"49","5.386491","146.75.37.140","192.168.12.35","TCP","54","443  >  61013 [ACK] Seq=3962 Ack=11150 Win=8196 Len=0"
"50","5.400926","146.75.37.140","192.168.12.35","TCP","54","443  >  61013 [ACK] Seq=3962 Ack=12546 Win=8196 Len=0"
"51","5.419144","146.75.37.140","192.168.12.35","TCP","54","443  >  61013 [ACK] Seq=3962 Ack=13942 Win=8196 Len=0"
"52","5.425054","146.75.37.140","192.168.12.35","TCP","1430","443  >  61013 [ACK] Seq=3962 Ack=13942 Win=8196 Len=1376 [TCP PDU reassembled in 53]"
"53","5.425054","146.75.37.140","192.168.12.35","TLSv1.2","591","Application Data"
"54","5.425054","146.75.37.140","192.168.12.35","TCP","1430","443  >  61013 [ACK] Seq=5875 Ack=13942 Win=8196 Len=1376 [TCP PDU reassembled in 55]"
"55","5.425054","146.75.37.140","192.168.12.35","TLSv1.2","814","Application Data"
"56","5.425054","146.75.37.140","192.168.12.35","TCP","1430","443  >  61013 [ACK] Seq=8011 Ack=13942 Win=8196 Len=1376 [TCP PDU reassembled in 70]"
"57","5.425054","146.75.37.140","192.168.12.35","TCP","1430","443  >  61013 [PSH, ACK] Seq=9387 Ack=13942 Win=8196 Len=1376 [TCP PDU reassembled in 70]"
"58","5.425774","192.168.12.35","146.75.37.140","TCP","54","61013  >  443 [ACK] Seq=24009 Ack=5875 Win=1025 Len=0"
"59","5.426023","192.168.12.35","146.75.37.140","TCP","54","61013  >  443 [ACK] Seq=24009 Ack=8011 Win=1025 Len=0"
"60","5.426087","192.168.12.35","146.75.37.140","TCP","54","61013  >  443 [ACK] Seq=24009 Ack=10763 Win=1025 Len=0"
"61","5.433292","146.75.37.140","192.168.12.35","TCP","1430","443  >  61013 [ACK] Seq=10763 Ack=13942 Win=8196 Len=1376 [TCP PDU reassembled in 70]"
"62","5.433292","146.75.37.140","192.168.12.35","TCP","1430","443  >  61013 [PSH, ACK] Seq=12139 Ack=13942 Win=8196 Len=1376 [TCP PDU reassembled in 70]"
"63","5.433292","146.75.37.140","192.168.12.35","TCP","1430","443  >  61013 [ACK] Seq=13515 Ack=13942 Win=8196 Len=1376 [TCP PDU reassembled in 70]"
"64","5.433292","146.75.37.140","192.168.12.35","TCP","1430","443  >  61013 [PSH, ACK] Seq=14891 Ack=13942 Win=8196 Len=1376 [TCP PDU reassembled in 70]"
"65","5.433292","146.75.37.140","192.168.12.35","TCP","1430","443  >  61013 [ACK] Seq=16267 Ack=13942 Win=8196 Len=1376 [TCP PDU reassembled in 70]"
"66","5.433292","146.75.37.140","192.168.12.35","TCP","1430","443  >  61013 [PSH, ACK] Seq=17643 Ack=13942 Win=8196 Len=1376 [TCP PDU reassembled in 70]"
"67","5.433292","146.75.37.140","192.168.12.35","TCP","1430","443  >  61013 [ACK] Seq=19019 Ack=13942 Win=8196 Len=1376 [TCP PDU reassembled in 70]"
"68","5.433292","146.75.37.140","192.168.12.35","TCP","1430","443  >  61013 [PSH, ACK] Seq=20395 Ack=13942 Win=8196 Len=1376 [TCP PDU reassembled in 70]"
"69","5.433292","146.75.37.140","192.168.12.35","TCP","54","443  >  61013 [ACK] Seq=21771 Ack=14511 Win=8196 Len=0"
"70","5.433292","146.75.37.140","192.168.12.35","TLSv1.2","1205","Application Data, Application Data, Application Data"
"71","5.433292","146.75.37.140","192.168.12.35","TCP","1430","443  >  61013 [ACK] Seq=22922 Ack=14511 Win=8196 Len=1376 [TCP PDU reassembled in 82]"
"72","5.433292","146.75.37.140","192.168.12.35","TCP","1430","443  >  61013 [PSH, ACK] Seq=24298 Ack=14511 Win=8196 Len=1376 [TCP PDU reassembled in 82]"
"73","5.433292","146.75.37.140","192.168.12.35","TCP","1430","443  >  61013 [ACK] Seq=25674 Ack=14511 Win=8196 Len=1376 [TCP PDU reassembled in 82]"
"74","5.433292","146.75.37.140","192.168.12.35","TCP","1430","443  >  61013 [PSH, ACK] Seq=27050 Ack=14511 Win=8196 Len=1376 [TCP PDU reassembled in 82]"
"75","5.433292","146.75.37.140","192.168.12.35","TCP","1430","443  >  61013 [ACK] Seq=28426 Ack=14511 Win=8196 Len=1376 [TCP PDU reassembled in 82]"
"76","5.433292","146.75.37.140","192.168.12.35","TCP","1430","443  >  61013 [PSH, ACK] Seq=29802 Ack=14511 Win=8196 Len=1376 [TCP PDU reassembled in 82]"
"77","5.433292","146.75.37.140","192.168.12.35","TCP","1430","443  >  61013 [ACK] Seq=31178 Ack=14511 Win=8196 Len=1376 [TCP PDU reassembled in 82]"
"78","5.433292","146.75.37.140","192.168.12.35","TCP","1430","443  >  61013 [PSH, ACK] Seq=32554 Ack=14511 Win=8196 Len=1376 [TCP PDU reassembled in 82]"
"79","5.433292","146.75.37.140","192.168.12.35","TCP","1430","443  >  61013 [ACK] Seq=33930 Ack=14511 Win=8196 Len=1376 [TCP PDU reassembled in 82]"
"80","5.433292","146.75.37.140","192.168.12.35","TCP","1430","443  >  61013 [PSH, ACK] Seq=35306 Ack=14511 Win=8196 Len=1376 [TCP PDU reassembled in 82]"
"81","5.433292","146.75.37.140","192.168.12.35","TCP","1430","443  >  61013 [ACK] Seq=36682 Ack=14511 Win=8196 Len=1376 [TCP PDU reassembled in 82]"
"82","5.433292","146.75.37.140","192.168.12.35","TLSv1.2","1430","Application Data"
"83","5.433828","192.168.12.35","146.75.37.140","TCP","54","61013  >  443 [ACK] Seq=24009 Ack=16267 Win=1025 Len=0"
"84","5.434053","192.168.12.35","146.75.37.140","TCP","54","61013  >  443 [ACK] Seq=24009 Ack=21771 Win=1025 Len=0"
"85","5.434126","192.168.12.35","146.75.37.140","TCP","54","61013  >  443 [ACK] Seq=24009 Ack=39434 Win=1025 Len=0"
"86","5.438143","146.75.37.140","192.168.12.35","TCP","1430","443  >  61013 [ACK] Seq=39434 Ack=14511 Win=8196 Len=1376 [TCP PDU reassembled in 100]"
"87","5.438143","146.75.37.140","192.168.12.35","TCP","1430","443  >  61013 [PSH, ACK] Seq=40810 Ack=14511 Win=8196 Len=1376 [TCP PDU reassembled in 100]"
"88","5.438143","146.75.37.140","192.168.12.35","TCP","54","443  >  61013 [ACK] Seq=42186 Ack=15345 Win=8196 Len=0"
"89","5.438143","146.75.37.140","192.168.12.35","TCP","1430","443  >  61013 [ACK] Seq=42186 Ack=15345 Win=8196 Len=1376 [TCP PDU reassembled in 100]"
"90","5.438143","146.75.37.140","192.168.12.35","TCP","1430","443  >  61013 [PSH, ACK] Seq=43562 Ack=15345 Win=8196 Len=1376 [TCP PDU reassembled in 100]"
"91","5.438143","146.75.37.140","192.168.12.35","TCP","1430","443  >  61013 [ACK] Seq=44938 Ack=15345 Win=8196 Len=1376 [TCP PDU reassembled in 100]"
"92","5.438143","146.75.37.140","192.168.12.35","TCP","1430","443  >  61013 [PSH, ACK] Seq=46314 Ack=15345 Win=8196 Len=1376 [TCP PDU reassembled in 100]"
"93","5.438143","146.75.37.140","192.168.12.35","TCP","1430","443  >  61013 [ACK] Seq=47690 Ack=15345 Win=8196 Len=1376 [TCP PDU reassembled in 100]"
"94","5.438143","146.75.37.140","192.168.12.35","TCP","1430","443  >  61013 [PSH, ACK] Seq=49066 Ack=15345 Win=8196 Len=1376 [TCP PDU reassembled in 100]"
"95","5.438143","146.75.37.140","192.168.12.35","TCP","1430","443  >  61013 [ACK] Seq=50442 Ack=15345 Win=8196 Len=1376 [TCP PDU reassembled in 100]"
"96","5.438143","146.75.37.140","192.168.12.35","TCP","1430","443  >  61013 [PSH, ACK] Seq=51818 Ack=15345 Win=8196 Len=1376 [TCP PDU reassembled in 100]"
"97","5.438516","192.168.12.35","146.75.37.140","TCP","54","61013  >  443 [ACK] Seq=24009 Ack=42186 Win=1025 Len=0"
"98","5.438705","192.168.12.35","146.75.37.140","TCP","54","61013  >  443 [ACK] Seq=24009 Ack=53194 Win=1025 Len=0"
"99","5.444292","146.75.37.140","192.168.12.35","TCP","1430","443  >  61013 [ACK] Seq=53194 Ack=15345 Win=8196 Len=1376 [TCP PDU reassembled in 100]"
"100","5.444292","146.75.37.140","192.168.12.35","TLSv1.2","1430","Application Data"
"101","5.444292","146.75.37.140","192.168.12.35","TCP","1430","443  >  61013 [ACK] Seq=55946 Ack=15345 Win=8196 Len=1376 [TCP PDU reassembled in 102]"
"102","5.444292","146.75.37.140","192.168.12.35","TLSv1.2","1430","Application Data"
"103","5.444292","146.75.37.140","192.168.12.35","TLSv1.2","1430","Application Data"
"104","5.444292","146.75.37.140","192.168.12.35","TCP","1430","443  >  61013 [PSH, ACK] Seq=60074 Ack=15345 Win=8196 Len=1376 [TCP PDU reassembled in 105]"
"105","5.444292","146.75.37.140","192.168.12.35","TLSv1.2","1430","Application Data, Application Data"
"106","5.444292","146.75.37.140","192.168.12.35","TLSv1.2","482","Application Data, Application Data"
"107","5.444874","192.168.12.35","146.75.37.140","TCP","54","61013  >  443 [ACK] Seq=24009 Ack=62826 Win=1025 Len=0"
"108","5.460789","146.75.37.140","192.168.12.35","TCP","54","443  >  61013 [ACK] Seq=63254 Ack=16741 Win=8196 Len=0"
"109","5.465015","192.168.12.35","146.75.37.140","UDP","92","50355  >  443 Len=50"
"110","5.467713","146.75.37.140","192.168.12.35","TCP","1430","443  >  61013 [ACK] Seq=63254 Ack=16741 Win=8196 Len=1376 [TCP PDU reassembled in 111]"
"111","5.467713","146.75.37.140","192.168.12.35","TLSv1.2","809","Application Data"
"112","5.467885","192.168.12.35","146.75.37.140","TCP","54","61013  >  443 [ACK] Seq=24009 Ack=64630 Win=1025 Len=0"
"113","5.471826","146.75.37.140","192.168.12.35","TLSv1.2","87","Application Data"
"114","5.471826","146.75.37.140","192.168.12.35","TCP","54","443  >  61013 [ACK] Seq=65418 Ack=18137 Win=8196 Len=0"
"115","5.471826","146.75.37.140","192.168.12.35","TCP","54","443  >  61013 [ACK] Seq=65418 Ack=18706 Win=8196 Len=0"
"116","5.472049","192.168.12.35","146.75.37.140","TCP","54","61013  >  443 [ACK] Seq=24009 Ack=65418 Win=1022 Len=0"
"117","5.472525","192.168.12.35","146.75.37.140","TLSv1.2","89","Application Data"
"118","5.478424","146.75.37.140","192.168.12.35","TLSv1.2","188","Application Data"
"119","5.487310","146.75.37.140","192.168.12.35","TLSv1.2","232","Application Data"
"120","5.487310","146.75.37.140","192.168.12.35","TLSv1.2","581","Application Data"
"121","5.487310","146.75.37.140","192.168.12.35","TCP","1430","443  >  61013 [ACK] Seq=66257 Ack=18706 Win=8196 Len=1376 [TCP PDU reassembled in 122]"
"122","5.487310","146.75.37.140","192.168.12.35","TLSv1.2","311","Application Data"
"123","5.487974","192.168.12.35","146.75.37.140","TCP","54","61013  >  443 [ACK] Seq=24044 Ack=65730 Win=1020 Len=0"
"124","5.488211","192.168.12.35","146.75.37.140","TCP","54","61013  >  443 [ACK] Seq=24044 Ack=66257 Win=1025 Len=0"
"125","5.488243","192.168.12.35","146.75.37.140","TCP","54","61013  >  443 [ACK] Seq=24044 Ack=67633 Win=1019 Len=0"
"126","5.488270","192.168.12.35","146.75.37.140","TCP","54","61013  >  443 [ACK] Seq=24044 Ack=67890 Win=1025 Len=0"
"127","5.492212","146.75.37.140","192.168.12.35","TLSv1.2","769","Application Data"
"128","5.492212","146.75.37.140","192.168.12.35","TLSv1.2","97","Application Data"
"129","5.492212","146.75.37.140","192.168.12.35","TLSv1.2","220","Application Data"
"130","5.492212","146.75.37.140","192.168.12.35","TLSv1.2","1247","Application Data"
"131","5.492212","146.75.37.140","192.168.12.35","TLSv1.2","93","Application Data"
"132","5.492212","146.75.37.140","192.168.12.35","TLSv1.2","118","Application Data"
"133","5.492212","146.75.37.140","192.168.12.35","TLSv1.2","700","Application Data"
"134","5.492212","146.75.37.140","192.168.12.35","TLSv1.2","674","Application Data"
"135","5.492212","146.75.37.140","192.168.12.35","TLSv1.2","440","Application Data, Application Data"
"136","5.492212","146.75.37.140","192.168.12.35","TLSv1.2","433","Application Data"
"137","5.492212","146.75.37.140","192.168.12.35","TLSv1.2","539","Application Data"
"138","5.492212","146.75.37.140","192.168.12.35","TLSv1.2","527","Application Data, Application Data"
"139","5.492212","146.75.37.140","192.168.12.35","TLSv1.2","205","Application Data, Application Data"
"140","5.492212","146.75.37.140","192.168.12.35","TLSv1.2","262","Application Data, Application Data"
"141","5.492212","146.75.37.140","192.168.12.35","TLSv1.2","312","Application Data"
"142","5.492212","146.75.37.140","192.168.12.35","TLSv1.2","169","Application Data"
"143","5.492212","146.75.37.140","192.168.12.35","TLSv1.2","108","Application Data"
"144","5.492212","146.75.37.140","192.168.12.35","TLSv1.2","213","Application Data"
"145","5.492212","146.75.37.140","192.168.12.35","TLSv1.2","327","Application Data"
"146","5.492212","146.75.37.140","192.168.12.35","TLSv1.2","176","Application Data"
"147","5.492212","146.75.37.140","192.168.12.35","TLSv1.2","233","Application Data"
"148","5.492212","146.75.37.140","192.168.12.35","TLSv1.2","149","Application Data"
"149","5.492212","146.75.37.140","192.168.12.35","TLSv1.2","205","Application Data"
"150","5.492212","146.75.37.140","192.168.12.35","TLSv1.2","129","Application Data"
"151","5.492212","146.75.37.140","192.168.12.35","TLSv1.2","139","Application Data"
"152","5.492781","192.168.12.35","146.75.37.140","TCP","54","61013  >  443 [ACK] Seq=24044 Ack=68605 Win=1022 Len=0"
"153","5.492992","192.168.12.35","146.75.37.140","TCP","54","61013  >  443 [ACK] Seq=24044 Ack=68814 Win=1021 Len=0"
"154","5.493028","192.168.12.35","146.75.37.140","TCP","54","61013  >  443 [ACK] Seq=24044 Ack=70007 Win=1025 Len=0"
"155","5.493076","192.168.12.35","146.75.37.140","TCP","54","61013  >  443 [ACK] Seq=24044 Ack=70046 Win=1025 Len=0"
"156","5.493128","192.168.12.35","146.75.37.140","TCP","54","61013  >  443 [ACK] Seq=24044 Ack=70756 Win=1022 Len=0"
"157","5.493173","192.168.12.35","146.75.37.140","TCP","54","61013  >  443 [ACK] Seq=24044 Ack=71762 Win=1025 Len=0"
"158","5.493211","192.168.12.35","146.75.37.140","TCP","54","61013  >  443 [ACK] Seq=24044 Ack=72626 Win=1021 Len=0"
"159","5.493275","192.168.12.35","146.75.37.140","TCP","54","61013  >  443 [ACK] Seq=24044 Ack=73250 Win=1025 Len=0"
"160","5.493306","192.168.12.35","146.75.37.140","TCP","54","61013  >  443 [ACK] Seq=24044 Ack=73716 Win=1023 Len=0"
"161","5.493337","192.168.12.35","146.75.37.140","TCP","54","61013  >  443 [ACK] Seq=24044 Ack=73885 Win=1022 Len=0"
"162","5.493363","192.168.12.35","146.75.37.140","TCP","54","61013  >  443 [ACK] Seq=24044 Ack=74317 Win=1021 Len=0"
"163","5.493394","192.168.12.35","146.75.37.140","TCP","54","61013  >  443 [ACK] Seq=24044 Ack=74618 Win=1019 Len=0"
"164","5.493429","192.168.12.35","146.75.37.140","TCP","54","61013  >  443 [ACK] Seq=24044 Ack=74713 Win=1025 Len=0"
"165","5.493477","192.168.12.35","146.75.37.140","TCP","54","61013  >  443 [ACK] Seq=24044 Ack=74864 Win=1024 Len=0"
"166","5.493519","192.168.12.35","146.75.37.140","TCP","54","61013  >  443 [ACK] Seq=24044 Ack=75024 Win=1023 Len=0"
"167","5.512227","146.75.37.140","192.168.12.35","TCP","54","443  >  61013 [ACK] Seq=75024 Ack=20102 Win=8196 Len=0"
"168","5.525462","146.75.37.140","192.168.12.35","TCP","54","443  >  61013 [ACK] Seq=75024 Ack=21498 Win=8196 Len=0"
"169","5.535343","146.75.37.140","192.168.12.35","TCP","54","443  >  61013 [ACK] Seq=75024 Ack=22067 Win=8196 Len=0"
"170","5.540810","146.75.37.140","192.168.12.35","TCP","54","443  >  61013 [ACK] Seq=75024 Ack=23015 Win=8196 Len=0"
"171","5.555465","146.75.37.140","192.168.12.35","TCP","54","443  >  61013 [ACK] Seq=75024 Ack=24009 Win=8196 Len=0"
"172","5.563314","146.75.37.140","192.168.12.35","TCP","1430","443  >  61013 [ACK] Seq=75024 Ack=24009 Win=8196 Len=1376 [TCP PDU reassembled in 173]"
"173","5.563314","146.75.37.140","192.168.12.35","TLSv1.2","436","Application Data"
"174","5.563969","192.168.12.35","146.75.37.140","TCP","54","61013  >  443 [ACK] Seq=24044 Ack=76400 Win=1025 Len=0"
"175","5.564238","192.168.12.35","146.75.37.140","TCP","54","61013  >  443 [ACK] Seq=24044 Ack=76782 Win=1023 Len=0"
"176","5.571556","146.75.37.140","192.168.12.35","TCP","54","443  >  61013 [ACK] Seq=76782 Ack=24044 Win=8196 Len=0"
"177","5.571556","146.75.37.140","192.168.12.35","UDP","66","443  >  50355 Len=24"
"178","5.593477","146.75.37.140","192.168.12.35","TCP","1430","443  >  61013 [ACK] Seq=76782 Ack=24044 Win=8196 Len=1376 [TCP PDU reassembled in 179]"
"179","5.593477","146.75.37.140","192.168.12.35","TLSv1.2","823","Application Data"
"180","5.593477","146.75.37.140","192.168.12.35","UDP","67","443  >  50355 Len=25"
"181","5.594333","192.168.12.35","146.75.37.140","TCP","54","61013  >  443 [ACK] Seq=24044 Ack=78927 Win=1025 Len=0"
"182","5.597258","192.168.12.35","146.75.37.140","UDP","82","50355  >  443 Len=40"
"183","5.721667","146.75.37.140","192.168.12.35","TLSv1.2","207","Application Data"
"184","5.726404","146.75.37.140","192.168.12.35","TLSv1.2","1235","Application Data"
"185","5.726404","146.75.37.140","192.168.12.35","TLSv1.2","98","Application Data"
"186","5.726404","146.75.37.140","192.168.12.35","TLSv1.2","163","Application Data"
"187","5.726890","192.168.12.35","146.75.37.140","TCP","54","61013  >  443 [ACK] Seq=24044 Ack=80261 Win=1019 Len=0"
"188","5.727196","192.168.12.35","146.75.37.140","TCP","54","61013  >  443 [ACK] Seq=24044 Ack=80414 Win=1025 Len=0"
"189","5.734046","146.75.37.140","192.168.12.35","TLSv1.2","110","Application Data"
"190","5.734046","146.75.37.140","192.168.12.35","TLSv1.2","411","Application Data"
"191","5.734046","146.75.37.140","192.168.12.35","TLSv1.2","109","Application Data"
"192","5.734046","146.75.37.140","192.168.12.35","TLSv1.2","195","Application Data"
"193","5.734046","146.75.37.140","192.168.12.35","TLSv1.2","112","Application Data"
"194","5.734046","146.75.37.140","192.168.12.35","TLSv1.2","573","Application Data"
"195","5.734046","146.75.37.140","192.168.12.35","TLSv1.2","265","Application Data"
"196","5.734046","146.75.37.140","192.168.12.35","TLSv1.2","130","Application Data"
"197","5.734046","146.75.37.140","192.168.12.35","TLSv1.2","137","Application Data"
"198","5.734046","146.75.37.140","192.168.12.35","TLSv1.2","138","Application Data"
"199","5.734046","146.75.37.140","192.168.12.35","TLSv1.2","96","Application Data"
"200","5.734046","146.75.37.140","192.168.12.35","TLSv1.2","451","Application Data"
"201","5.734046","146.75.37.140","192.168.12.35","TLSv1.2","264","Application Data"
"202","5.734046","146.75.37.140","192.168.12.35","TLSv1.2","193","Application Data"
"203","5.734046","146.75.37.140","192.168.12.35","TLSv1.2","215","Application Data"
"204","5.734046","146.75.37.140","192.168.12.35","TLSv1.2","138","Application Data"
"205","5.734046","146.75.37.140","192.168.12.35","TLSv1.2","327","Application Data"
"206","5.734046","146.75.37.140","192.168.12.35","TLSv1.2","1415","Application Data"
"207","5.734706","192.168.12.35","146.75.37.140","TCP","54","61013  >  443 [ACK] Seq=24044 Ack=80827 Win=1023 Len=0"
"208","5.734943","192.168.12.35","146.75.37.140","TCP","54","61013  >  443 [ACK] Seq=24044 Ack=81023 Win=1022 Len=0"
"209","5.734984","192.168.12.35","146.75.37.140","TCP","54","61013  >  443 [ACK] Seq=24044 Ack=81600 Win=1020 Len=0"
"210","5.735017","192.168.12.35","146.75.37.140","TCP","54","61013  >  443 [ACK] Seq=24044 Ack=81887 Win=1025 Len=0"
"211","5.735050","192.168.12.35","146.75.37.140","TCP","54","61013  >  443 [ACK] Seq=24044 Ack=82054 Win=1024 Len=0"
"212","5.735140","192.168.12.35","146.75.37.140","TCP","54","61013  >  443 [ACK] Seq=24044 Ack=82493 Win=1022 Len=0"
"213","5.735174","192.168.12.35","146.75.37.140","TCP","54","61013  >  443 [ACK] Seq=24044 Ack=82842 Win=1021 Len=0"
"214","5.735213","192.168.12.35","146.75.37.140","TCP","54","61013  >  443 [ACK] Seq=24044 Ack=83087 Win=1020 Len=0"
"215","5.735265","192.168.12.35","146.75.37.140","TCP","54","61013  >  443 [ACK] Seq=24044 Ack=84721 Win=1025 Len=0"
"216","5.747072","146.75.37.140","192.168.12.35","TLSv1.2","950","Application Data"
"217","5.747072","146.75.37.140","192.168.12.35","TLSv1.2","511","Application Data"
"218","5.747072","146.75.37.140","192.168.12.35","TLSv1.2","1126","Application Data"
"219","5.747072","146.75.37.140","192.168.12.35","TLSv1.2","466","Application Data"
"220","5.747072","146.75.37.140","192.168.12.35","TLSv1.2","729","Application Data"
"221","5.747958","192.168.12.35","146.75.37.140","TCP","54","61013  >  443 [ACK] Seq=24044 Ack=86074 Win=1019 Len=0"
"222","5.748141","192.168.12.35","146.75.37.140","TCP","54","61013  >  443 [ACK] Seq=24044 Ack=87558 Win=1025 Len=0"
"223","5.752634","146.75.37.140","192.168.12.35","TLSv1.2","458","Application Data"
"224","5.752634","146.75.37.140","192.168.12.35","TLSv1.2","344","Application Data"
"225","5.752634","146.75.37.140","192.168.12.35","TLSv1.2","286","Application Data"
"226","5.752634","146.75.37.140","192.168.12.35","TLSv1.2","172","Application Data"
"227","5.752634","146.75.37.140","192.168.12.35","TLSv1.2","111","Application Data"
"228","5.752634","146.75.37.140","192.168.12.35","TLSv1.2","97","Application Data"
"229","5.752634","146.75.37.140","192.168.12.35","TLSv1.2","182","Application Data"
"230","5.752634","146.75.37.140","192.168.12.35","TLSv1.2","139","Application Data"
"231","5.753477","192.168.12.35","146.75.37.140","TCP","54","61013  >  443 [ACK] Seq=24044 Ack=88637 Win=1020 Len=0"
"232","5.753976","192.168.12.35","146.75.37.140","TCP","54","61013  >  443 [ACK] Seq=24044 Ack=89159 Win=1025 Len=0"
"233","5.754083","192.168.12.35","146.75.37.140","TCP","54","61013  >  443 [ACK] Seq=24044 Ack=89334 Win=1024 Len=0"
"234","5.754153","192.168.12.35","146.75.37.140","TCP","54","61013  >  443 [ACK] Seq=24044 Ack=89505 Win=1023 Len=0"
"235","5.803227","192.168.12.35","146.75.37.140","TCP","54","61013  >  443 [ACK] Seq=24044 Ack=89590 Win=1023 Len=0"
"236","6.127460","192.168.12.35","146.75.37.140","TLSv1.2","3212","Application Data"
"237","6.191296","146.75.37.140","192.168.12.35","TCP","54","443  >  61013 [ACK] Seq=89590 Ack=25440 Win=8196 Len=0"
"238","6.206298","146.75.37.140","192.168.12.35","TLSv1.2","163","Application Data"
"239","6.206298","146.75.37.140","192.168.12.35","TCP","1430","443  >  61013 [ACK] Seq=89699 Ack=25440 Win=8196 Len=1376 [TCP PDU reassembled in 240]"
"240","6.206298","146.75.37.140","192.168.12.35","TLSv1.2","279","Application Data"
"241","6.206298","146.75.37.140","192.168.12.35","TCP","54","443  >  61013 [ACK] Seq=91300 Ack=26836 Win=8196 Len=0"
"242","6.206298","146.75.37.140","192.168.12.35","TCP","1430","443  >  61013 [ACK] Seq=91300 Ack=26836 Win=8196 Len=1376 [TCP PDU reassembled in 245]"
"243","6.206298","146.75.37.140","192.168.12.35","TCP","1430","443  >  61013 [PSH, ACK] Seq=92676 Ack=26836 Win=8196 Len=1376 [TCP PDU reassembled in 245]"
"244","6.206298","146.75.37.140","192.168.12.35","TCP","1430","443  >  61013 [ACK] Seq=94052 Ack=26836 Win=8196 Len=1376 [TCP PDU reassembled in 245]"
"245","6.206298","146.75.37.140","192.168.12.35","TLSv1.2","1061","Application Data"
"246","6.206797","192.168.12.35","146.75.37.140","TCP","54","61013  >  443 [ACK] Seq=27202 Ack=91075 Win=1025 Len=0"
"247","6.206990","192.168.12.35","146.75.37.140","TCP","54","61013  >  443 [ACK] Seq=27202 Ack=95428 Win=1025 Len=0"
"248","6.222309","146.75.37.140","192.168.12.35","TCP","54","443  >  61013 [ACK] Seq=96435 Ack=27202 Win=8196 Len=0"
"249","6.225201","146.75.37.140","192.168.12.35","TCP","1430","443  >  61013 [ACK] Seq=96435 Ack=27202 Win=8196 Len=1376 [TCP PDU reassembled in 261]"
"250","6.225201","146.75.37.140","192.168.12.35","TCP","1430","443  >  61013 [PSH, ACK] Seq=97811 Ack=27202 Win=8196 Len=1376 [TCP PDU reassembled in 261]"
"251","6.225201","146.75.37.140","192.168.12.35","TCP","1430","443  >  61013 [ACK] Seq=99187 Ack=27202 Win=8196 Len=1376 [TCP PDU reassembled in 261]"
"252","6.225201","146.75.37.140","192.168.12.35","TCP","1430","443  >  61013 [PSH, ACK] Seq=100563 Ack=27202 Win=8196 Len=1376 [TCP PDU reassembled in 261]"
"253","6.225201","146.75.37.140","192.168.12.35","TCP","1430","443  >  61013 [ACK] Seq=101939 Ack=27202 Win=8196 Len=1376 [TCP PDU reassembled in 261]"
"254","6.225201","146.75.37.140","192.168.12.35","TCP","1430","443  >  61013 [PSH, ACK] Seq=103315 Ack=27202 Win=8196 Len=1376 [TCP PDU reassembled in 261]"
"255","6.225201","146.75.37.140","192.168.12.35","TCP","1430","443  >  61013 [ACK] Seq=104691 Ack=27202 Win=8196 Len=1376 [TCP PDU reassembled in 261]"
"256","6.225201","146.75.37.140","192.168.12.35","TCP","1430","443  >  61013 [PSH, ACK] Seq=106067 Ack=27202 Win=8196 Len=1376 [TCP PDU reassembled in 261]"
"257","6.225201","146.75.37.140","192.168.12.35","TCP","1430","443  >  61013 [ACK] Seq=107443 Ack=27202 Win=8196 Len=1376 [TCP PDU reassembled in 261]"
"258","6.225201","146.75.37.140","192.168.12.35","TCP","1430","443  >  61013 [PSH, ACK] Seq=108819 Ack=27202 Win=8196 Len=1376 [TCP PDU reassembled in 261]"
"259","6.226083","192.168.12.35","146.75.37.140","TCP","54","61013  >  443 [ACK] Seq=27202 Ack=110195 Win=1025 Len=0"
"260","6.235205","146.75.37.140","192.168.12.35","TCP","1430","443  >  61013 [ACK] Seq=110195 Ack=27202 Win=8196 Len=1376 [TCP PDU reassembled in 261]"
"261","6.235205","146.75.37.140","192.168.12.35","TLSv1.2","1355","Application Data, Application Data"
"262","6.235205","146.75.37.140","192.168.12.35","TCP","1430","443  >  61013 [ACK] Seq=112872 Ack=27202 Win=8196 Len=1376 [TCP PDU reassembled in 264]"
"263","6.235205","146.75.37.140","192.168.12.35","TCP","1430","443  >  61013 [PSH, ACK] Seq=114248 Ack=27202 Win=8196 Len=1376 [TCP PDU reassembled in 264]"
"264","6.235205","146.75.37.140","192.168.12.35","TLSv1.2","415","Application Data"
"265","6.235985","192.168.12.35","146.75.37.140","TCP","54","61013  >  443 [ACK] Seq=27202 Ack=111571 Win=1019 Len=0"
"266","6.236343","192.168.12.35","146.75.37.140","TCP","54","61013  >  443 [ACK] Seq=27202 Ack=115624 Win=1025 Len=0"
"267","6.236412","192.168.12.35","146.75.37.140","TCP","54","61013  >  443 [ACK] Seq=27202 Ack=115985 Win=1023 Len=0"
"268","6.246225","146.75.37.140","192.168.12.35","TCP","1430","443  >  61013 [ACK] Seq=115985 Ack=27202 Win=8196 Len=1376 [TCP PDU reassembled in 269]"
"269","6.246225","146.75.37.140","192.168.12.35","TLSv1.2","634","Application Data"
"270","6.246225","146.75.37.140","192.168.12.35","TLSv1.2","654","Application Data"
"271","6.246225","146.75.37.140","192.168.12.35","TLSv1.2","100","Application Data"
"272","6.246751","192.168.12.35","146.75.37.140","TCP","54","61013  >  443 [ACK] Seq=27202 Ack=117941 Win=1025 Len=0"
"273","6.247149","192.168.12.35","146.75.37.140","TCP","54","61013  >  443 [ACK] Seq=27202 Ack=118587 Win=1022 Len=0"
"274","6.251026","146.75.37.140","192.168.12.35","TLSv1.2","442","Application Data"
"275","6.267180","146.75.37.140","192.168.12.35","TLSv1.2","213","Application Data"
"276","6.268386","192.168.12.35","146.75.37.140","TCP","54","61013  >  443 [ACK] Seq=27202 Ack=119134 Win=1020 Len=0"
"277","6.278559","146.75.37.140","192.168.12.35","TLSv1.2","201","Application Data"
"278","6.278559","146.75.37.140","192.168.12.35","TLSv1.2","182","Application Data"
"279","6.278559","146.75.37.140","192.168.12.35","TLSv1.2","161","Application Data"
"280","6.278559","146.75.37.140","192.168.12.35","TLSv1.2","147","Application Data"
"281","6.279463","192.168.12.35","146.75.37.140","TCP","54","61013  >  443 [ACK] Seq=27202 Ack=119409 Win=1025 Len=0"
"282","6.279916","192.168.12.35","146.75.37.140","TCP","54","61013  >  443 [ACK] Seq=27202 Ack=119609 Win=1024 Len=0"
"283","6.283827","146.75.37.140","192.168.12.35","TLSv1.2","149","Application Data"
"284","6.298330","146.75.37.140","192.168.12.35","TLSv1.2","164","Application Data"
"285","6.299661","192.168.12.35","146.75.37.140","TCP","54","61013  >  443 [ACK] Seq=27202 Ack=119814 Win=1023 Len=0"
"286","6.331238","146.75.37.140","192.168.12.35","TLSv1.2","220","Application Data"
"287","6.381710","192.168.12.35","146.75.37.140","TCP","54","61013  >  443 [ACK] Seq=27202 Ack=119980 Win=1022 Len=0"
"288","6.406802","146.75.37.140","192.168.12.35","TLSv1.2","434","Application Data"
"289","6.439055","146.75.37.140","192.168.12.35","TLSv1.2","334","Application Data"
"290","6.439305","192.168.12.35","146.75.37.140","TCP","54","61013  >  443 [ACK] Seq=27202 Ack=120640 Win=1020 Len=0"
"291","6.455065","146.75.37.140","192.168.12.35","TLSv1.2","207","Application Data"
"292","6.470326","146.75.37.140","192.168.12.35","TLSv1.2","176","Application Data"
"293","6.470760","192.168.12.35","146.75.37.140","TCP","54","61013  >  443 [ACK] Seq=27202 Ack=120915 Win=1025 Len=0"
"294","6.487889","146.75.37.140","192.168.12.35","TLSv1.2","449","Application Data"
"295","6.487889","146.75.37.140","192.168.12.35","TLSv1.2","632","Application Data"
"296","6.488219","192.168.12.35","146.75.37.140","TCP","54","61013  >  443 [ACK] Seq=27202 Ack=121888 Win=1021 Len=0"
"297","6.530853","146.75.37.140","192.168.12.35","TLSv1.2","342","Application Data"
"298","6.542025","146.75.37.140","192.168.12.35","TLSv1.2","263","Application Data"
"299","6.542740","192.168.12.35","146.75.37.140","TCP","54","61013  >  443 [ACK] Seq=27202 Ack=122385 Win=1025 Len=0"
"300","6.547833","146.75.37.140","192.168.12.35","TLSv1.2","421","Application Data"
"301","6.559242","146.75.37.140","192.168.12.35","TLSv1.2","403","Application Data"
"302","6.559242","146.75.37.140","192.168.12.35","TLSv1.2","177","Application Data"
"303","6.559242","146.75.37.140","192.168.12.35","TLSv1.2","405","Application Data"
"304","6.559242","146.75.37.140","192.168.12.35","TLSv1.2","381","Application Data"
"305","6.559242","146.75.37.140","192.168.12.35","TLSv1.2","502","Application Data"
"306","6.559667","192.168.12.35","146.75.37.140","TCP","54","61013  >  443 [ACK] Seq=27202 Ack=123101 Win=1022 Len=0"
"307","6.559894","146.75.37.140","192.168.12.35","TLSv1.2","413","Application Data"
"308","6.559894","146.75.37.140","192.168.12.35","TLSv1.2","168","Application Data"
"309","6.559894","146.75.37.140","192.168.12.35","TLSv1.2","392","Application Data"
"310","6.559894","146.75.37.140","192.168.12.35","TLSv1.2","376","Application Data"
"311","6.559894","146.75.37.140","192.168.12.35","TLSv1.2","169","Application Data"
"312","6.559894","146.75.37.140","192.168.12.35","TLSv1.2","384","Application Data"
"313","6.559894","146.75.37.140","192.168.12.35","TLSv1.2","363","Application Data"
"314","6.560390","192.168.12.35","146.75.37.140","TCP","54","61013  >  443 [ACK] Seq=27202 Ack=123575 Win=1020 Len=0"
"315","6.560530","192.168.12.35","146.75.37.140","TCP","54","61013  >  443 [ACK] Seq=27202 Ack=124350 Win=1025 Len=0"
"316","6.560613","192.168.12.35","146.75.37.140","TCP","54","61013  >  443 [ACK] Seq=27202 Ack=124823 Win=1023 Len=0"
"317","6.560666","192.168.12.35","146.75.37.140","TCP","54","61013  >  443 [ACK] Seq=27202 Ack=125483 Win=1020 Len=0"
"318","6.560702","192.168.12.35","146.75.37.140","TCP","54","61013  >  443 [ACK] Seq=27202 Ack=125928 Win=1025 Len=0"
"319","6.566308","146.75.37.140","192.168.12.35","TLSv1.2","163","Application Data"
"320","6.566308","146.75.37.140","192.168.12.35","TLSv1.2","360","Application Data"
"321","6.566663","192.168.12.35","146.75.37.140","TCP","54","61013  >  443 [ACK] Seq=27202 Ack=126346 Win=1023 Len=0"
"322","6.575397","146.75.37.140","192.168.12.35","TLSv1.2","369","Application Data"
"323","6.575397","146.75.37.140","192.168.12.35","TLSv1.2","166","Application Data"
"324","6.575397","146.75.37.140","192.168.12.35","TLSv1.2","591","Application Data"
"325","6.575397","146.75.37.140","192.168.12.35","TLSv1.2","555","Application Data"
"326","6.575916","192.168.12.35","146.75.37.140","TCP","54","61013  >  443 [ACK] Seq=27202 Ack=126967 Win=1021 Len=0"
"327","6.576099","192.168.12.35","146.75.37.140","TCP","54","61013  >  443 [ACK] Seq=27202 Ack=127616 Win=1025 Len=0"
"328","6.596096","146.75.37.140","192.168.12.35","TLSv1.2","177","Application Data"
"329","6.596096","146.75.37.140","192.168.12.35","TLSv1.2","171","Application Data"
"330","6.596096","146.75.37.140","192.168.12.35","TLSv1.2","185","Application Data"
"331","6.596096","146.75.37.140","192.168.12.35","TLSv1.2","185","Application Data"
"332","6.596096","146.75.37.140","192.168.12.35","TLSv1.2","189","Application Data"
"333","6.596096","146.75.37.140","192.168.12.35","TLSv1.2","192","Application Data"
"334","6.596096","146.75.37.140","192.168.12.35","TLSv1.2","231","Application Data"
"335","6.596096","146.75.37.140","192.168.12.35","TLSv1.2","595","Application Data"
"336","6.596096","146.75.37.140","192.168.12.35","TLSv1.2","277","Application Data"
"337","6.596096","146.75.37.140","192.168.12.35","TLSv1.2","213","Application Data"
"338","6.596096","146.75.37.140","192.168.12.35","TLSv1.2","205","Application Data"
"339","6.596096","146.75.37.140","192.168.12.35","TLSv1.2","453","Application Data"
"340","6.596096","146.75.37.140","192.168.12.35","TLSv1.2","148","Application Data"
"341","6.596096","146.75.37.140","192.168.12.35","TLSv1.2","216","Application Data"
"342","6.596096","146.75.37.140","192.168.12.35","TLSv1.2","251","Application Data"
"343","6.596096","146.75.37.140","192.168.12.35","TLSv1.2","174","Application Data"
"344","6.596096","146.75.37.140","192.168.12.35","TLSv1.2","149","Application Data"
"345","6.596096","146.75.37.140","192.168.12.35","TLSv1.2","123","Application Data"
"346","6.596096","146.75.37.140","192.168.12.35","TLSv1.2","317","Application Data"
"347","6.596096","146.75.37.140","192.168.12.35","TLSv1.2","202","Application Data"
"348","6.596096","146.75.37.140","192.168.12.35","TLSv1.2","204","Application Data"
"349","6.596096","146.75.37.140","192.168.12.35","TLSv1.2","282","Application Data"
"350","6.597662","192.168.12.35","146.75.37.140","TCP","54","61013  >  443 [ACK] Seq=27202 Ack=128240 Win=1022 Len=0"
"351","6.598247","192.168.12.35","146.75.37.140","TCP","54","61013  >  443 [ACK] Seq=27202 Ack=128619 Win=1021 Len=0"
"352","6.598399","192.168.12.35","146.75.37.140","TCP","54","61013  >  443 [ACK] Seq=27202 Ack=128754 Win=1020 Len=0"
"353","6.598486","192.168.12.35","146.75.37.140","TCP","54","61013  >  443 [ACK] Seq=27202 Ack=129069 Win=1025 Len=0"
"354","6.598724","192.168.12.35","146.75.37.140","TCP","54","61013  >  443 [ACK] Seq=27202 Ack=129833 Win=1022 Len=0"
"355","6.598815","192.168.12.35","146.75.37.140","TCP","54","61013  >  443 [ACK] Seq=27202 Ack=130143 Win=1020 Len=0"
"356","6.598943","192.168.12.35","146.75.37.140","TCP","54","61013  >  443 [ACK] Seq=27202 Ack=130636 Win=1025 Len=0"
"357","6.599022","192.168.12.35","146.75.37.140","TCP","54","61013  >  443 [ACK] Seq=27202 Ack=130995 Win=1023 Len=0"
"358","6.599093","192.168.12.35","146.75.37.140","TCP","54","61013  >  443 [ACK] Seq=27202 Ack=131210 Win=1022 Len=0"
"359","6.599172","192.168.12.35","146.75.37.140","TCP","54","61013  >  443 [ACK] Seq=27202 Ack=131542 Win=1021 Len=0"
"360","6.599309","192.168.12.35","146.75.37.140","TCP","54","61013  >  443 [ACK] Seq=27202 Ack=131840 Win=1020 Len=0"
"361","6.607219","146.75.37.140","192.168.12.35","TLSv1.2","211","Application Data"
"362","6.608105","192.168.12.35","146.75.37.140","TCP","54","61013  >  443 [ACK] Seq=27202 Ack=132225 Win=1025 Len=0"
"363","6.616356","146.75.37.140","192.168.12.35","TLSv1.2","206","Application Data"
"364","6.616356","146.75.37.140","192.168.12.35","TLSv1.2","511","Application Data"
"365","6.617074","192.168.12.35","146.75.37.140","TCP","54","61013  >  443 [ACK] Seq=27202 Ack=132834 Win=1022 Len=0"
"366","6.622234","146.75.37.140","192.168.12.35","TLSv1.2","462","Application Data"
"367","6.622234","146.75.37.140","192.168.12.35","TLSv1.2","163","Application Data"
"368","6.622234","146.75.37.140","192.168.12.35","TLSv1.2","1374","Application Data"
"369","6.622234","146.75.37.140","192.168.12.35","TLSv1.2","461","Application Data"
"370","6.622234","146.75.37.140","192.168.12.35","TLSv1.2","440","Application Data"
"371","6.622234","146.75.37.140","192.168.12.35","TLSv1.2","181","Application Data"
"372","6.622234","146.75.37.140","192.168.12.35","TLSv1.2","552","Application Data"
"373","6.622234","146.75.37.140","192.168.12.35","TLSv1.2","314","Application Data"
"374","6.622234","146.75.37.140","192.168.12.35","TLSv1.2","184","Application Data"
"375","6.622234","146.75.37.140","192.168.12.35","TLSv1.2","161","Application Data"
"376","6.622234","146.75.37.140","192.168.12.35","TLSv1.2","183","Application Data"
