"No.","Time","Source","Destination","Protocol","Length","Info"
"1","0.000000","192.168.12.35","146.75.37.140","UDP","80","50355  >  443 Len=38"
"2","0.048966","146.75.37.140","192.168.12.35","UDP","67","443  >  50355 Len=25"
"3","0.765455","192.168.12.35","146.75.37.140","TLSv1.2","3241","Application Data"
"4","0.765531","192.168.12.35","146.75.37.140","TLSv1.2","3361","Application Data"
"5","0.765565","192.168.12.35","146.75.37.140","TLSv1.2","1549","Application Data"
"6","0.811158","146.75.37.140","192.168.12.35","TCP","54","443  >  61013 [ACK] Seq=1 Ack=1397 Win=8244 Len=0"
"7","0.824109","146.75.37.140","192.168.12.35","TCP","54","443  >  61013 [ACK] Seq=1 Ack=2793 Win=8244 Len=0"
"8","0.824109","146.75.37.140","192.168.12.35","TCP","54","443  >  61013 [ACK] Seq=1 Ack=3188 Win=8244 Len=0"
"9","0.834537","146.75.37.140","192.168.12.35","TCP","54","443  >  61013 [ACK] Seq=1 Ack=4584 Win=8244 Len=0"
"10","0.853769","146.75.37.140","192.168.12.35","TCP","54","443  >  61013 [ACK] Seq=1 Ack=5980 Win=8244 Len=0"
"11","0.868814","146.75.37.140","192.168.12.35","TCP","54","443  >  61013 [ACK] Seq=1 Ack=6495 Win=8244 Len=0"
"12","0.868814","146.75.37.140","192.168.12.35","TCP","1430","443  >  61013 [ACK] Seq=1 Ack=6495 Win=8244 Len=1376 [TCP PDU reassembled in 13]"
"13","0.868814","146.75.37.140","192.168.12.35","TLSv1.2","1062","Application Data"
"14","0.868814","146.75.37.140","192.168.12.35","TCP","1430","443  >  61013 [ACK] Seq=2385 Ack=6495 Win=8244 Len=1376 [TCP PDU reassembled in 15]"
"15","0.868814","146.75.37.140","192.168.12.35","TLSv1.2","1071","Application Data"
"16","0.868814","146.75.37.140","192.168.12.35","TCP","1430","443  >  61013 [ACK] Seq=4778 Ack=6495 Win=8244 Len=1376 [TCP PDU reassembled in 22]"
"17","0.868814","146.75.37.140","192.168.12.35","TCP","1430","443  >  61013 [PSH, ACK] Seq=6154 Ack=6495 Win=8244 Len=1376 [TCP PDU reassembled in 22]"
"18","0.868814","146.75.37.140","192.168.12.35","TCP","1430","443  >  61013 [ACK] Seq=7530 Ack=6495 Win=8244 Len=1376 [TCP PDU reassembled in 22]"
"19","0.868814","146.75.37.140","192.168.12.35","TCP","1430","443  >  61013 [PSH, ACK] Seq=8906 Ack=6495 Win=8244 Len=1376 [TCP PDU reassembled in 22]"
"20","0.868814","146.75.37.140","192.168.12.35","TCP","1430","443  >  61013 [ACK] Seq=10282 Ack=6495 Win=8244 Len=1376 [TCP PDU reassembled in 22]"
"21","0.868814","146.75.37.140","192.168.12.35","TCP","1430","443  >  61013 [PSH, ACK] Seq=11658 Ack=6495 Win=8244 Len=1376 [TCP PDU reassembled in 22]"
"22","0.868814","146.75.37.140","192.168.12.35","TLSv1.2","1430","Application Data"
"23","0.868814","146.75.37.140","192.168.12.35","TCP","1430","443  >  61013 [PSH, ACK] Seq=14410 Ack=6495 Win=8244 Len=1376 [TCP PDU reassembled in 27]"
"24","0.868814","146.75.37.140","192.168.12.35","TCP","1430","443  >  61013 [ACK] Seq=15786 Ack=6495 Win=8244 Len=1376 [TCP PDU reassembled in 27]"
"25","0.868814","146.75.37.140","192.168.12.35","TCP","1430","443  >  61013 [PSH, ACK] Seq=17162 Ack=6495 Win=8244 Len=1376 [TCP PDU reassembled in 27]"
"26","0.868814","146.75.37.140","192.168.12.35","TCP","54","443  >  61013 [ACK] Seq=18538 Ack=7990 Win=8244 Len=0"
"27","0.868814","146.75.37.140","192.168.12.35","TLSv1.2","1190","Application Data, Application Data"
"28","0.868814","146.75.37.140","192.168.12.35","TLSv1.2","90","Application Data"
"29","0.868814","146.75.37.140","192.168.12.35","TCP","1430","443  >  61013 [ACK] Seq=19710 Ack=7990 Win=8244 Len=1376 [TCP PDU reassembled in 45]"
"30","0.868814","146.75.37.140","192.168.12.35","TCP","1430","443  >  61013 [PSH, ACK] Seq=21086 Ack=7990 Win=8244 Len=1376 [TCP PDU reassembled in 45]"
"31","0.869957","192.168.12.35","146.75.37.140","TCP","54","61013  >  443 [ACK] Seq=7990 Ack=2385 Win=1025 Len=0"
"32","0.870187","192.168.12.35","146.75.37.140","TCP","54","61013  >  443 [ACK] Seq=7990 Ack=4778 Win=1025 Len=0"
"33","0.870296","192.168.12.35","146.75.37.140","TCP","54","61013  >  443 [ACK] Seq=7990 Ack=18538 Win=1025 Len=0"
"34","0.870365","192.168.12.35","146.75.37.140","TCP","54","61013  >  443 [ACK] Seq=7990 Ack=19710 Win=1020 Len=0"
"35","0.870433","192.168.12.35","146.75.37.140","TCP","54","61013  >  443 [ACK] Seq=7990 Ack=22462 Win=1025 Len=0"
"36","0.872040","146.75.37.140","192.168.12.35","TCP","1430","443  >  61013 [ACK] Seq=22462 Ack=7990 Win=8244 Len=1376 [TCP PDU reassembled in 45]"
"37","0.872040","146.75.37.140","192.168.12.35","TCP","1430","443  >  61013 [PSH, ACK] Seq=23838 Ack=7990 Win=8244 Len=1376 [TCP PDU reassembled in 45]"
"38","0.872040","146.75.37.140","192.168.12.35","TCP","1430","443  >  61013 [ACK] Seq=25214 Ack=7990 Win=8244 Len=1376 [TCP PDU reassembled in 45]"
"39","0.872040","146.75.37.140","192.168.12.35","TCP","1430","443  >  61013 [PSH, ACK] Seq=26590 Ack=7990 Win=8244 Len=1376 [TCP PDU reassembled in 45]"
"40","0.872040","146.75.37.140","192.168.12.35","TCP","1430","443  >  61013 [ACK] Seq=27966 Ack=7990 Win=8244 Len=1376 [TCP PDU reassembled in 45]"
"41","0.872040","146.75.37.140","192.168.12.35","TCP","1430","443  >  61013 [PSH, ACK] Seq=29342 Ack=7990 Win=8244 Len=1376 [TCP PDU reassembled in 45]"
"42","0.872040","146.75.37.140","192.168.12.35","TCP","1430","443  >  61013 [ACK] Seq=30718 Ack=7990 Win=8244 Len=1376 [TCP PDU reassembled in 45]"
"43","0.872040","146.75.37.140","192.168.12.35","TCP","1430","443  >  61013 [PSH, ACK] Seq=32094 Ack=7990 Win=8244 Len=1376 [TCP PDU reassembled in 45]"
"44","0.872040","146.75.37.140","192.168.12.35","TCP","1430","443  >  61013 [ACK] Seq=33470 Ack=7990 Win=8244 Len=1376 [TCP PDU reassembled in 45]"
"45","0.872040","146.75.37.140","192.168.12.35","TLSv1.2","1430","Application Data"
"46","0.872040","146.75.37.140","192.168.12.35","TCP","1430","443  >  61013 [ACK] Seq=36222 Ack=7990 Win=8244 Len=1376 [TCP PDU reassembled in 52]"
"47","0.872040","146.75.37.140","192.168.12.35","TCP","1430","443  >  61013 [PSH, ACK] Seq=37598 Ack=7990 Win=8244 Len=1376 [TCP PDU reassembled in 52]"
"48","0.872515","192.168.12.35","146.75.37.140","TCP","54","61013  >  443 [ACK] Seq=7990 Ack=38974 Win=1025 Len=0"
"49","0.878569","146.75.37.140","192.168.12.35","TCP","1430","443  >  61013 [ACK] Seq=38974 Ack=7990 Win=8244 Len=1376 [TCP PDU reassembled in 52]"
"50","0.878569","146.75.37.140","192.168.12.35","TCP","1430","443  >  61013 [PSH, ACK] Seq=40350 Ack=7990 Win=8244 Len=1376 [TCP PDU reassembled in 52]"
"51","0.878569","146.75.37.140","192.168.12.35","TCP","1430","443  >  61013 [ACK] Seq=41726 Ack=7990 Win=8244 Len=1376 [TCP PDU reassembled in 52]"
"52","0.878569","146.75.37.140","192.168.12.35","TLSv1.2","1430","Application Data"
"53","0.878569","146.75.37.140","192.168.12.35","TCP","1430","443  >  61013 [ACK] Seq=44478 Ack=7990 Win=8244 Len=1376 [TCP PDU reassembled in 60]"
"54","0.878569","146.75.37.140","192.168.12.35","TCP","1430","443  >  61013 [PSH, ACK] Seq=45854 Ack=7990 Win=8244 Len=1376 [TCP PDU reassembled in 60]"
"55","0.878569","146.75.37.140","192.168.12.35","TCP","1430","443  >  61013 [ACK] Seq=47230 Ack=7990 Win=8244 Len=1376 [TCP PDU reassembled in 60]"
"56","0.878569","146.75.37.140","192.168.12.35","TCP","1430","443  >  61013 [PSH, ACK] Seq=48606 Ack=7990 Win=8244 Len=1376 [TCP PDU reassembled in 60]"
"57","0.878569","146.75.37.140","192.168.12.35","TCP","1430","443  >  61013 [ACK] Seq=49982 Ack=7990 Win=8244 Len=1376 [TCP PDU reassembled in 60]"
"58","0.878569","146.75.37.140","192.168.12.35","TCP","1430","443  >  61013 [PSH, ACK] Seq=51358 Ack=7990 Win=8244 Len=1376 [TCP PDU reassembled in 60]"
"59","0.879195","192.168.12.35","146.75.37.140","TCP","54","61013  >  443 [ACK] Seq=7990 Ack=52734 Win=1025 Len=0"
"60","0.884303","146.75.37.140","192.168.12.35","TLSv1.2","1430","Application Data"
"61","0.884303","146.75.37.140","192.168.12.35","TLSv1.2","1430","Application Data"
"62","0.884973","192.168.12.35","146.75.37.140","TCP","54","61013  >  443 [ACK] Seq=7990 Ack=55486 Win=1025 Len=0"
"63","0.890824","146.75.37.140","192.168.12.35","TCP","1430","443  >  61013 [ACK] Seq=55486 Ack=7990 Win=8244 Len=1376 [TCP PDU reassembled in 64]"
"64","0.890824","146.75.37.140","192.168.12.35","TLSv1.2","1430","Application Data"
"65","0.890824","146.75.37.140","192.168.12.35","TCP","1430","443  >  61013 [ACK] Seq=58238 Ack=7990 Win=8244 Len=1376 [TCP PDU reassembled in 66]"
"66","0.890824","146.75.37.140","192.168.12.35","TLSv1.2","1430","Application Data"
"67","0.890824","146.75.37.140","192.168.12.35","TLSv1.2","1430","Application Data"
"68","0.890824","146.75.37.140","192.168.12.35","TLSv1.2","1430","Application Data"
"69","0.890824","146.75.37.140","192.168.12.35","TLSv1.2","1430","Application Data, Application Data"
"70","0.890824","146.75.37.140","192.168.12.35","TLSv1.2","1336","Application Data, Application Data, Application Data"
"71","0.890824","146.75.37.140","192.168.12.35","TLSv1.2","1375","Application Data, Application Data, Application Data, Application Data, Application Data, Application Data, Application Data"
"72","0.890824","146.75.37.140","192.168.12.35","TLSv1.2","108","Application Data"
"73","0.890824","146.75.37.140","192.168.12.35","TCP","1430","443  >  61013 [ACK] Seq=67775 Ack=7990 Win=8244 Len=1376 [TCP PDU reassembled in 74]"
"74","0.890824","146.75.37.140","192.168.12.35","TLSv1.2","506","Application Data"
"75","0.892112","192.168.12.35","146.75.37.140","TCP","54","61013  >  443 [ACK] Seq=7990 Ack=65118 Win=1025 Len=0"
"76","0.892474","192.168.12.35","146.75.37.140","TCP","54","61013  >  443 [ACK] Seq=7990 Ack=66400 Win=1020 Len=0"
"77","0.892568","192.168.12.35","146.75.37.140","TCP","54","61013  >  443 [ACK] Seq=7990 Ack=67775 Win=1025 Len=0"
"78","0.892670","192.168.12.35","146.75.37.140","TCP","54","61013  >  443 [ACK] Seq=7990 Ack=69603 Win=1025 Len=0"
"79","0.926151","192.168.12.35","146.75.37.140","UDP","95","50355  >  443 Len=53"
"80","0.949768","146.75.37.140","192.168.12.35","UDP","67","443  >  50355 Len=25"
"81","0.963429","192.168.12.35","146.75.37.140","UDP","84","50355  >  443 Len=42"
"82","0.975787","146.75.37.140","192.168.12.35","UDP","67","443  >  50355 Len=25"
"83","1.379949","146.75.37.140","192.168.12.35","TLSv1.2","564","Application Data"
"84","1.379949","146.75.37.140","192.168.12.35","TLSv1.2","133","Application Data"
"85","1.380447","192.168.12.35","146.75.37.140","TCP","54","61013  >  443 [ACK] Seq=7990 Ack=70192 Win=1022 Len=0"
"86","1.399255","146.75.37.140","192.168.12.35","TLSv1.2","399","Application Data"
"87","1.410775","146.75.37.140","192.168.12.35","TLSv1.2","196","Application Data"
"88","1.411552","192.168.12.35","146.75.37.140","TCP","54","61013  >  443 [ACK] Seq=7990 Ack=70679 Win=1020 Len=0"
"89","1.422323","146.75.37.140","192.168.12.35","TLSv1.2","222","Application Data"
"90","1.430204","146.75.37.140","192.168.12.35","TLSv1.2","154","Application Data"
"91","1.430785","192.168.12.35","146.75.37.140","TCP","54","61013  >  443 [ACK] Seq=7990 Ack=70947 Win=1019 Len=0"
"92","1.447270","146.75.37.140","192.168.12.35","TLSv1.2","114","Application Data"
"93","1.447270","146.75.37.140","192.168.12.35","TLSv1.2","198","Application Data"
"94","1.447270","146.75.37.140","192.168.12.35","TLSv1.2","115","Application Data"
"95","1.447270","146.75.37.140","192.168.12.35","TLSv1.2","566","Application Data"
"96","1.447270","146.75.37.140","192.168.12.35","TLSv1.2","227","Application Data"
"97","1.448562","192.168.12.35","146.75.37.140","TCP","54","61013  >  443 [ACK] Seq=7990 Ack=71151 Win=1025 Len=0"
"98","1.449024","192.168.12.35","146.75.37.140","TCP","54","61013  >  443 [ACK] Seq=7990 Ack=71724 Win=1022 Len=0"
"99","1.457000","146.75.37.140","192.168.12.35","TLSv1.2","576","Application Data"
"100","1.457000","146.75.37.140","192.168.12.35","TLSv1.2","187","Application Data"
"101","1.457000","146.75.37.140","192.168.12.35","TLSv1.2","136","Application Data"
"102","1.457000","146.75.37.140","192.168.12.35","TCP","1430","443  >  61013 [ACK] Seq=72634 Ack=7990 Win=8244 Len=1376 [TCP PDU reassembled in 103]"
"103","1.457000","146.75.37.140","192.168.12.35","TLSv1.2","180","Application Data"
"104","1.457000","146.75.37.140","192.168.12.35","TLSv1.2","1018","Application Data"
"105","1.457000","146.75.37.140","192.168.12.35","TLSv1.2","452","Application Data"
"106","1.458089","192.168.12.35","146.75.37.140","TCP","54","61013  >  443 [ACK] Seq=7990 Ack=72419 Win=1020 Len=0"
"107","1.458082","146.75.37.140","192.168.12.35","TLSv1.2","689","Application Data, Application Data"
"108","1.458082","146.75.37.140","192.168.12.35","TLSv1.2","502","Application Data"
"109","1.458082","146.75.37.140","192.168.12.35","TLSv1.2","1263","Application Data"
"110","1.458082","146.75.37.140","192.168.12.35","TLSv1.2","417","Application Data"
"111","1.458082","146.75.37.140","192.168.12.35","TLSv1.2","424","Application Data"
"112","1.458082","146.75.37.140","192.168.12.35","TLSv1.2","130","Application Data"
"113","1.458082","146.75.37.140","192.168.12.35","TLSv1.2","267","Application Data"
"114","1.458082","146.75.37.140","192.168.12.35","TLSv1.2","464","Application Data"
"115","1.458082","146.75.37.140","192.168.12.35","TLSv1.2","568","Application Data"
"116","1.458082","146.75.37.140","192.168.12.35","TLSv1.2","558","Application Data"
"117","1.458082","146.75.37.140","192.168.12.35","TLSv1.2","97","Application Data"
"118","1.458082","146.75.37.140","192.168.12.35","TLSv1.2","728","Application Data"
"119","1.458082","146.75.37.140","192.168.12.35","TLSv1.2","267","Application Data"
"120","1.458082","146.75.37.140","192.168.12.35","TLSv1.2","599","Application Data"
"121","1.458082","146.75.37.140","192.168.12.35","TLSv1.2","1135","Application Data"
"122","1.458082","146.75.37.140","192.168.12.35","TLSv1.2","680","Application Data"
"123","1.458082","146.75.37.140","192.168.12.35","TLSv1.2","1024","Application Data"
"124","1.458082","146.75.37.140","192.168.12.35","TLSv1.2","462","Application Data"
"125","1.458082","146.75.37.140","192.168.12.35","TLSv1.2","247","Application Data"
"126","1.458082","146.75.37.140","192.168.12.35","TLSv1.2","1277","Application Data"
"127","1.458082","146.75.37.140","192.168.12.35","TLSv1.2","552","Application Data"
"128","1.458741","192.168.12.35","146.75.37.140","TCP","54","61013  >  443 [ACK] Seq=7990 Ack=72634 Win=1025 Len=0"
"129","1.458911","192.168.12.35","146.75.37.140","TCP","54","61013  >  443 [ACK] Seq=7990 Ack=74136 Win=1025 Len=0"
"130","1.459035","192.168.12.35","146.75.37.140","TCP","54","61013  >  443 [ACK] Seq=7990 Ack=75498 Win=1019 Len=0"
"131","1.459127","192.168.12.35","146.75.37.140","TCP","54","61013  >  443 [ACK] Seq=7990 Ack=76581 Win=1025 Len=0"
"132","1.459553","192.168.12.35","146.75.37.140","TCP","54","61013  >  443 [ACK] Seq=7990 Ack=78153 Win=1025 Len=0"
"133","1.459677","192.168.12.35","146.75.37.140","TCP","54","61013  >  443 [ACK] Seq=7990 Ack=78599 Win=1023 Len=0"
"134","1.459817","192.168.12.35","146.75.37.140","TCP","54","61013  >  443 [ACK] Seq=7990 Ack=79222 Win=1021 Len=0"
"135","1.459972","192.168.12.35","146.75.37.140","TCP","54","61013  >  443 [ACK] Seq=7990 Ack=80240 Win=1025 Len=0"
"136","1.460097","192.168.12.35","146.75.37.140","TCP","54","61013  >  443 [ACK] Seq=7990 Ack=80957 Win=1022 Len=0"
"137","1.460200","192.168.12.35","146.75.37.140","TCP","54","61013  >  443 [ACK] Seq=7990 Ack=81715 Win=1025 Len=0"
"138","1.460310","192.168.12.35","146.75.37.140","TCP","54","61013  >  443 [ACK] Seq=7990 Ack=83422 Win=1025 Len=0"
"139","1.460412","192.168.12.35","146.75.37.140","TCP","54","61013  >  443 [ACK] Seq=7990 Ack=84800 Win=1019 Len=0"
"140","1.460556","192.168.12.35","146.75.37.140","TCP","54","61013  >  443 [ACK] Seq=7990 Ack=86216 Win=1025 Len=0"
"141","1.470203","146.75.37.140","192.168.12.35","TLSv1.2","135","Application Data"
"142","1.470717","192.168.12.35","146.75.37.140","TCP","54","61013  >  443 [ACK] Seq=7990 Ack=86795 Win=1022 Len=0"
"143","1.475854","146.75.37.140","192.168.12.35","TLSv1.2","123","Application Data"
"144","1.483466","146.75.37.140","192.168.12.35","TLSv1.2","235","Application Data"
"145","1.483764","192.168.12.35","146.75.37.140","TCP","54","61013  >  443 [ACK] Seq=7990 Ack=87045 Win=1021 Len=0"
"146","1.487175","146.75.37.140","192.168.12.35","TLSv1.2","177","Application Data"
"147","1.487175","146.75.37.140","192.168.12.35","TLSv1.2","106","Application Data"
"148","1.487175","146.75.37.140","192.168.12.35","TLSv1.2","122","Application Data"
"149","1.487175","146.75.37.140","192.168.12.35","TLSv1.2","349","Application Data"
"150","1.487175","146.75.37.140","192.168.12.35","TLSv1.2","157","Application Data"
"151","1.487175","146.75.37.140","192.168.12.35","TLSv1.2","155","Application Data"
"152","1.487175","146.75.37.140","192.168.12.35","TLSv1.2","93","Application Data"
"153","1.487175","146.75.37.140","192.168.12.35","TLSv1.2","93","Application Data"
"154","1.487175","146.75.37.140","192.168.12.35","TLSv1.2","248","Application Data"
"155","1.487175","146.75.37.140","192.168.12.35","TLSv1.2","576","Application Data"
"156","1.487175","146.75.37.140","192.168.12.35","TLSv1.2","98","Application Data"
"157","1.487175","146.75.37.140","192.168.12.35","TLSv1.2","273","Application Data"
"158","1.487175","146.75.37.140","192.168.12.35","TLSv1.2","429","Application Data"
"159","1.487438","192.168.12.35","146.75.37.140","TCP","54","61013  >  443 [ACK] Seq=7990 Ack=87220 Win=1021 Len=0"
"160","1.487546","192.168.12.35","146.75.37.140","TCP","54","61013  >  443 [ACK] Seq=7990 Ack=87583 Win=1019 Len=0"
"161","1.487601","192.168.12.35","146.75.37.140","TCP","54","61013  >  443 [ACK] Seq=7990 Ack=87787 Win=1025 Len=0"
"162","1.487623","192.168.12.35","146.75.37.140","TCP","54","61013  >  443 [ACK] Seq=7990 Ack=87865 Win=1024 Len=0"
"163","1.487661","192.168.12.35","146.75.37.140","TCP","54","61013  >  443 [ACK] Seq=7990 Ack=88581 Win=1022 Len=0"
"164","1.487702","192.168.12.35","146.75.37.140","TCP","54","61013  >  443 [ACK] Seq=7990 Ack=88844 Win=1021 Len=0"
"165","1.494901","146.75.37.140","192.168.12.35","TLSv1.2","95","Application Data"
"166","1.494901","146.75.37.140","192.168.12.35","TLSv1.2","206","Application Data"
"167","1.494901","146.75.37.140","192.168.12.35","TLSv1.2","138","Application Data"
"168","1.494901","146.75.37.140","192.168.12.35","TLSv1.2","129","Application Data"
"169","1.494901","146.75.37.140","192.168.12.35","TLSv1.2","104","Application Data"
"170","1.494901","146.75.37.140","192.168.12.35","TLSv1.2","117","Application Data"
"171","1.494901","146.75.37.140","192.168.12.35","TLSv1.2","125","Application Data"
"172","1.494901","146.75.37.140","192.168.12.35","TLSv1.2","104","Application Data"
"173","1.494901","146.75.37.140","192.168.12.35","TLSv1.2","181","Application Data"
"174","1.494901","146.75.37.140","192.168.12.35","TLSv1.2","105","Application Data"
"175","1.494901","146.75.37.140","192.168.12.35","TLSv1.2","94","Application Data"
"176","1.494901","146.75.37.140","192.168.12.35","TLSv1.2","526","Application Data"
"177","1.494901","146.75.37.140","192.168.12.35","TLSv1.2","655","Application Data"
"178","1.494901","146.75.37.140","192.168.12.35","TLSv1.2","697","Application Data"
"179","1.494901","146.75.37.140","192.168.12.35","TLSv1.2","310","Application Data"
"180","1.494901","146.75.37.140","192.168.12.35","TLSv1.2","601","Application Data"
"181","1.495685","192.168.12.35","146.75.37.140","TCP","54","61013  >  443 [ACK] Seq=7990 Ack=89260 Win=1025 Len=0"
"182","1.495984","192.168.12.35","146.75.37.140","TCP","54","61013  >  443 [ACK] Seq=7990 Ack=89496 Win=1024 Len=0"
"183","1.496042","192.168.12.35","146.75.37.140","TCP","54","61013  >  443 [ACK] Seq=7990 Ack=89621 Win=1023 Len=0"
"184","1.496081","192.168.12.35","146.75.37.140","TCP","54","61013  >  443 [ACK] Seq=7990 Ack=89755 Win=1023 Len=0"
"185","1.496120","192.168.12.35","146.75.37.140","TCP","54","61013  >  443 [ACK] Seq=7990 Ack=89932 Win=1022 Len=0"
"186","1.496189","192.168.12.35","146.75.37.140","TCP","54","61013  >  443 [ACK] Seq=7990 Ack=90023 Win=1022 Len=0"
"187","1.496261","192.168.12.35","146.75.37.140","TCP","54","61013  >  443 [ACK] Seq=7990 Ack=91096 Win=1025 Len=0"
"188","1.496443","192.168.12.35","146.75.37.140","TCP","54","61013  >  443 [ACK] Seq=7990 Ack=91995 Win=1021 Len=0"
"189","1.498859","146.75.37.140","192.168.12.35","TLSv1.2","713","Application Data"
"190","1.498859","146.75.37.140","192.168.12.35","TLSv1.2","1141","Application Data"
"191","1.498859","146.75.37.140","192.168.12.35","TLSv1.2","147","Application Data"
"192","1.498859","146.75.37.140","192.168.12.35","TLSv1.2","93","Application Data"
"193","1.498859","146.75.37.140","192.168.12.35","TLSv1.2","105","Application Data"
"194","1.498859","146.75.37.140","192.168.12.35","TLSv1.2","192","Application Data"
"195","1.498859","146.75.37.140","192.168.12.35","TLSv1.2","123","Application Data"
"196","1.498859","146.75.37.140","192.168.12.35","TLSv1.2","150","Application Data"
"197","1.498859","146.75.37.140","192.168.12.35","TLSv1.2","257","Application Data"
"198","1.498859","146.75.37.140","192.168.12.35","TLSv1.2","381","Application Data"
"199","1.498859","146.75.37.140","192.168.12.35","TLSv1.2","85","Application Data"
"200","1.499192","192.168.12.35","146.75.37.140","TCP","54","61013  >  443 [ACK] Seq=7990 Ack=93201 Win=1025 Len=0"
"201","1.499264","192.168.12.35","146.75.37.140","TCP","54","61013  >  443 [ACK] Seq=7990 Ack=94381 Win=1020 Len=0"
"202","1.499336","192.168.12.35","146.75.37.140","TCP","54","61013  >  443 [ACK] Seq=7990 Ack=94471 Win=1020 Len=0"
"203","1.499392","192.168.12.35","146.75.37.140","TCP","54","61013  >  443 [ACK] Seq=7990 Ack=94678 Win=1025 Len=0"
"204","1.499445","192.168.12.35","146.75.37.140","TCP","54","61013  >  443 [ACK] Seq=7990 Ack=94977 Win=1024 Len=0"
"205","1.499511","192.168.12.35","146.75.37.140","TCP","54","61013  >  443 [ACK] Seq=7990 Ack=95335 Win=1022 Len=0"
"206","1.548868","192.168.12.35","146.75.37.140","TLSv1.2","3185","Application Data"
"207","1.548992","192.168.12.35","146.75.37.140","TLSv1.2","718","Application Data"
"208","1.549023","192.168.12.35","146.75.37.140","TLSv1.2","3189","Application Data"
"209","1.572129","192.168.12.35","146.75.37.140","TLSv1.2","3198","Application Data"
"210","1.596889","146.75.37.140","192.168.12.35","TCP","54","443  >  61013 [ACK] Seq=95335 Ack=9386 Win=8244 Len=0"
"211","1.611892","146.75.37.140","192.168.12.35","TCP","54","443  >  61013 [ACK] Seq=95335 Ack=10782 Win=8244 Len=0"
"212","1.611892","146.75.37.140","192.168.12.35","TCP","54","443  >  61013 [ACK] Seq=95335 Ack=11121 Win=8244 Len=0"
"213","1.611892","146.75.37.140","192.168.12.35","TCP","54","443  >  61013 [ACK] Seq=95335 Ack=11785 Win=8244 Len=0"
"214","1.634622","146.75.37.140","192.168.12.35","TCP","54","443  >  61013 [ACK] Seq=95335 Ack=13181 Win=8244 Len=0"
"215","1.644930","146.75.37.140","192.168.12.35","TCP","54","443  >  61013 [ACK] Seq=95335 Ack=14577 Win=8244 Len=0"
"216","1.651325","146.75.37.140","192.168.12.35","TCP","54","443  >  61013 [ACK] Seq=95335 Ack=14920 Win=8244 Len=0"
"217","1.660734","146.75.37.140","192.168.12.35","TCP","1430","443  >  61013 [ACK] Seq=95335 Ack=14920 Win=8244 Len=1376 [TCP PDU reassembled in 218]"
"218","1.660734","146.75.37.140","192.168.12.35","TLSv1.2","779","Application Data"
"219","1.661156","192.168.12.35","146.75.37.140","TCP","54","61013  >  443 [ACK] Seq=18064 Ack=96711 Win=1025 Len=0"
"220","1.661286","192.168.12.35","146.75.37.140","TCP","54","61013  >  443 [ACK] Seq=18064 Ack=97436 Win=1022 Len=0"
"221","1.665077","192.168.12.35","146.75.37.140","TLSv1.2","3176","Application Data"
"222","1.665180","192.168.12.35","146.75.37.140","TLSv1.2","210","Application Data"
"223","1.675744","146.75.37.140","192.168.12.35","TCP","1430","443  >  61013 [ACK] Seq=97436 Ack=14920 Win=8244 Len=1376 [TCP PDU reassembled in 224]"
"224","1.675744","146.75.37.140","192.168.12.35","TLSv1.2","486","Application Data"
"225","1.675744","146.75.37.140","192.168.12.35","TCP","54","443  >  61013 [ACK] Seq=99244 Ack=16316 Win=8244 Len=0"
"226","1.676231","192.168.12.35","146.75.37.140","TCP","54","61013  >  443 [ACK] Seq=21342 Ack=99244 Win=1025 Len=0"
"227","1.691290","146.75.37.140","192.168.12.35","TCP","54","443  >  61013 [ACK] Seq=99244 Ack=17712 Win=8244 Len=0"
"228","1.691290","146.75.37.140","192.168.12.35","TCP","54","443  >  61013 [ACK] Seq=99244 Ack=18064 Win=8244 Len=0"
"229","1.730796","146.75.37.140","192.168.12.35","TCP","1430","443  >  61013 [ACK] Seq=99244 Ack=18064 Win=8244 Len=1376 [TCP PDU reassembled in 230]"
"230","1.730796","146.75.37.140","192.168.12.35","TLSv1.2","876","Application Data"
"231","1.730796","146.75.37.140","192.168.12.35","TLSv1.2","100","Application Data"
"232","1.731342","192.168.12.35","146.75.37.140","TCP","54","61013  >  443 [ACK] Seq=21342 Ack=101442 Win=1025 Len=0"
"233","1.735668","146.75.37.140","192.168.12.35","TCP","54","443  >  61013 [ACK] Seq=101488 Ack=19460 Win=8244 Len=0"
"234","1.749645","146.75.37.140","192.168.12.35","TCP","54","443  >  61013 [ACK] Seq=101488 Ack=20856 Win=8244 Len=0"
"235","1.749645","146.75.37.140","192.168.12.35","TCP","54","443  >  61013 [ACK] Seq=101488 Ack=21186 Win=8244 Len=0"
"236","1.749645","146.75.37.140","192.168.12.35","TCP","54","443  >  61013 [ACK] Seq=101488 Ack=21342 Win=8244 Len=0"
"237","1.780983","192.168.12.35","146.75.37.140","TCP","54","61013  >  443 [ACK] Seq=21342 Ack=101488 Win=1025 Len=0"
"238","1.869901","146.75.37.140","192.168.12.35","TLSv1.2","604","Application Data"
"239","1.869901","146.75.37.140","192.168.12.35","TLSv1.2","85","Application Data"
"240","1.869901","146.75.37.140","192.168.12.35","TCP","1430","443  >  61013 [ACK] Seq=102069 Ack=21342 Win=8244 Len=1376 [TCP PDU reassembled in 241]"
"241","1.869901","146.75.37.140","192.168.12.35","TLSv1.2","462","Application Data"
"242","1.869901","146.75.37.140","192.168.12.35","TLSv1.2","222","Application Data"
"243","1.870382","192.168.12.35","146.75.37.140","TCP","54","61013  >  443 [ACK] Seq=21342 Ack=102069 Win=1022 Len=0"
"244","1.870435","192.168.12.35","146.75.37.140","TCP","54","61013  >  443 [ACK] Seq=21342 Ack=103853 Win=1025 Len=0"
"245","1.919536","192.168.12.35","146.75.37.140","TCP","54","61013  >  443 [ACK] Seq=21342 Ack=104021 Win=1024 Len=0"
"246","2.097876","192.168.12.35","146.75.37.140","TLSv1.2","3194","Application Data"
"247","2.098442","192.168.12.35","146.75.37.140","TLSv1.2","3209","Application Data"
"248","2.098484","192.168.12.35","146.75.37.140","TLSv1.2","3288","Application Data"
"249","2.098965","192.168.12.35","146.75.37.140","TLSv1.2","3186","Application Data"
"250","2.137881","146.75.37.140","192.168.12.35","TCP","54","443  >  61013 [ACK] Seq=104021 Ack=22738 Win=8244 Len=0"
"251","2.152987","146.75.37.140","192.168.12.35","TCP","54","443  >  61013 [ACK] Seq=104021 Ack=24134 Win=8244 Len=0"
"252","2.158436","146.75.37.140","192.168.12.35","TCP","54","443  >  61013 [ACK] Seq=104021 Ack=24482 Win=8244 Len=0"
"253","2.178718","146.75.37.140","192.168.12.35","TCP","54","443  >  61013 [ACK] Seq=104021 Ack=25878 Win=8244 Len=0"
"254","2.186662","146.75.37.140","192.168.12.35","TCP","1430","443  >  61013 [ACK] Seq=104021 Ack=25878 Win=8244 Len=1376 [TCP PDU reassembled in 255]"
"255","2.186662","146.75.37.140","192.168.12.35","TLSv1.2","874","Application Data"
"256","2.186662","146.75.37.140","192.168.12.35","TLSv1.2","100","Application Data"
"257","2.186662","146.75.37.140","192.168.12.35","TCP","54","443  >  61013 [ACK] Seq=106263 Ack=27274 Win=8244 Len=0"
"258","2.187574","192.168.12.35","146.75.37.140","TCP","54","61013  >  443 [ACK] Seq=34003 Ack=106217 Win=1025 Len=0"
"259","2.199658","146.75.37.140","192.168.12.35","TCP","54","443  >  61013 [ACK] Seq=106263 Ack=27637 Win=8244 Len=0"
"260","2.217262","146.75.37.140","192.168.12.35","TCP","54","443  >  61013 [ACK] Seq=106263 Ack=29033 Win=8244 Len=0"
"261","2.230101","192.168.12.35","146.75.37.140","TCP","54","61013  >  443 [ACK] Seq=34003 Ack=106263 Win=1025 Len=0"
"262","2.230387","146.75.37.140","192.168.12.35","TCP","1430","443  >  61013 [ACK] Seq=106263 Ack=29033 Win=8244 Len=1376 [TCP PDU reassembled in 263]"
"263","2.230387","146.75.37.140","192.168.12.35","TLSv1.2","466","Application Data"
"264","2.230387","146.75.37.140","192.168.12.35","TLSv1.2","100","Application Data"
"265","2.230387","146.75.37.140","192.168.12.35","TCP","54","443  >  61013 [ACK] Seq=108097 Ack=30429 Win=8244 Len=0"
"266","2.230387","146.75.37.140","192.168.12.35","TCP","54","443  >  61013 [ACK] Seq=108097 Ack=30871 Win=8244 Len=0"
"267","2.231224","192.168.12.35","146.75.37.140","TCP","54","61013  >  443 [ACK] Seq=34003 Ack=107639 Win=1025 Len=0"
"268","2.231272","192.168.12.35","146.75.37.140","TCP","54","61013  >  443 [ACK] Seq=34003 Ack=108051 Win=1023 Len=0"
"269","2.242999","146.75.37.140","192.168.12.35","TLSv1.2","996","Application Data"
"270","2.242999","146.75.37.140","192.168.12.35","TLSv1.2","123","Application Data"
"271","2.242999","146.75.37.140","192.168.12.35","TLSv1.2","85","Application Data"
"272","2.243523","192.168.12.35","146.75.37.140","TCP","54","61013  >  443 [ACK] Seq=34003 Ack=109039 Win=1025 Len=0"
"273","2.243870","192.168.12.35","146.75.37.140","TCP","54","61013  >  443 [ACK] Seq=34003 Ack=109139 Win=1024 Len=0"
"274","2.251113","146.75.37.140","192.168.12.35","TCP","54","443  >  61013 [ACK] Seq=109139 Ack=32267 Win=8244 Len=0"
"275","2.264718","146.75.37.140","192.168.12.35","TCP","54","443  >  61013 [ACK] Seq=109139 Ack=33663 Win=8244 Len=0"
"276","2.274740","146.75.37.140","192.168.12.35","TCP","54","443  >  61013 [ACK] Seq=109139 Ack=34003 Win=8244 Len=0"
"277","2.288115","146.75.37.140","192.168.12.35","TCP","1430","443  >  61013 [ACK] Seq=109139 Ack=34003 Win=8244 Len=1376 [TCP PDU reassembled in 278]"
"278","2.288115","146.75.37.140","192.168.12.35","TLSv1.2","848","Application Data"
"279","2.288115","146.75.37.140","192.168.12.35","TLSv1.2","100","Application Data"
"280","2.288391","192.168.12.35","146.75.37.140","TCP","54","61013  >  443 [ACK] Seq=34003 Ack=111309 Win=1025 Len=0"
"281","2.299344","146.75.37.140","192.168.12.35","TLSv1.2","957","Application Data"
"282","2.299344","146.75.37.140","192.168.12.35","TCP","1430","443  >  61013 [ACK] Seq=112258 Ack=34003 Win=8244 Len=1376 [TCP PDU reassembled in 283]"
"283","2.299344","146.75.37.140","192.168.12.35","TLSv1.2","464","Application Data"
"284","2.299344","146.75.37.140","192.168.12.35","TLSv1.2","100","Application Data"
"285","2.299906","192.168.12.35","146.75.37.140","TCP","54","61013  >  443 [ACK] Seq=34003 Ack=112258 Win=1021 Len=0"
"286","2.300201","192.168.12.35","146.75.37.140","TCP","54","61013  >  443 [ACK] Seq=34003 Ack=114044 Win=1025 Len=0"
"287","2.332956","192.168.12.35","146.75.37.140","TLSv1.2","3174","Application Data"
"288","2.333312","192.168.12.35","146.75.37.140","TLSv1.2","134","Application Data"
"289","2.369568","146.75.37.140","192.168.12.35","TCP","1430","443  >  61013 [ACK] Seq=114090 Ack=34003 Win=8244 Len=1376 [TCP PDU reassembled in 290]"
"290","2.369568","146.75.37.140","192.168.12.35","TLSv1.2","919","Application Data"
"291","2.370287","192.168.12.35","146.75.37.140","TCP","54","61013  >  443 [ACK] Seq=37203 Ack=115466 Win=1025 Len=0"
"292","2.370554","192.168.12.35","146.75.37.140","TCP","54","61013  >  443 [ACK] Seq=37203 Ack=116331 Win=1021 Len=0"
"293","2.373963","146.75.37.140","192.168.12.35","TCP","54","443  >  61013 [ACK] Seq=116331 Ack=35399 Win=8244 Len=0"
"294","2.385230","146.75.37.140","192.168.12.35","TCP","54","443  >  61013 [ACK] Seq=116331 Ack=36795 Win=8244 Len=0"
"295","2.394180","146.75.37.140","192.168.12.35","TCP","54","443  >  61013 [ACK] Seq=116331 Ack=37123 Win=8244 Len=0"
"296","2.394180","146.75.37.140","192.168.12.35","TCP","54","443  >  61013 [ACK] Seq=116331 Ack=37203 Win=8244 Len=0"
"297","2.428950","146.75.37.140","192.168.12.35","TCP","1430","443  >  61013 [ACK] Seq=116331 Ack=37203 Win=8244 Len=1376 [TCP PDU reassembled in 299]"
"298","2.428950","146.75.37.140","192.168.12.35","TCP","1430","443  >  61013 [PSH, ACK] Seq=117707 Ack=37203 Win=8244 Len=1376 [TCP PDU reassembled in 299]"
"299","2.428950","146.75.37.140","192.168.12.35","TLSv1.2","435","Application Data"
"300","2.428950","146.75.37.140","192.168.12.35","TLSv1.2","126","Application Data, Application Data"
"301","2.429577","192.168.12.35","146.75.37.140","TCP","54","61013  >  443 [ACK] Seq=37203 Ack=119083 Win=1025 Len=0"
"302","2.429795","192.168.12.35","146.75.37.140","TCP","54","61013  >  443 [ACK] Seq=37203 Ack=119536 Win=1023 Len=0"
"303","2.450824","192.168.12.35","146.75.37.140","TLSv1.2","3144","Application Data"
"304","2.494251","146.75.37.140","192.168.12.35","TCP","54","443  >  61013 [ACK] Seq=119536 Ack=38599 Win=8244 Len=0"
"305","2.517244","146.75.37.140","192.168.12.35","TCP","54","443  >  61013 [ACK] Seq=119536 Ack=39995 Win=8244 Len=0"
"306","2.517244","146.75.37.140","192.168.12.35","TCP","54","443  >  61013 [ACK] Seq=119536 Ack=40293 Win=8244 Len=0"
"307","2.571171","146.75.37.140","192.168.12.35","TCP","1430","443  >  61013 [ACK] Seq=119536 Ack=40293 Win=8244 Len=1376 [TCP PDU reassembled in 308]"
"308","2.571171","146.75.37.140","192.168.12.35","TLSv1.2","477","Application Data"
"309","2.571751","192.168.12.35","146.75.37.140","TCP","54","61013  >  443 [ACK] Seq=40293 Ack=121335 Win=1025 Len=0"
"310","2.984474","192.168.12.35","146.75.37.140","UDP","1292","50355  >  443 Len=1250"
"311","2.984711","192.168.12.35","146.75.37.140","UDP","546","50355  >  443 Len=504"
"312","3.022264","192.168.12.35","146.75.37.140","UDP","1292","50355  >  443 Len=1250"
"313","3.023864","192.168.12.35","146.75.37.140","UDP","543","50355  >  443 Len=501"
"314","3.029433","146.75.37.140","192.168.12.35","UDP","67","443  >  50355 Len=25"
"315","3.052314","146.75.37.140","192.168.12.35","UDP","952","443  >  50355 Len=910"
"316","3.071087","192.168.12.35","146.75.37.140","UDP","84","50355  >  443 Len=42"
"317","3.073967","146.75.37.140","192.168.12.35","UDP","67","443  >  50355 Len=25"
"318","3.096578","146.75.37.140","192.168.12.35","UDP","1322","443  >  50355 Len=1280"
"319","3.096578","146.75.37.140","192.168.12.35","UDP","638","443  >  50355 Len=596"
"320","3.118325","192.168.12.35","146.75.37.140","UDP","84","50355  >  443 Len=42"
"321","3.122546","192.168.12.35","146.75.37.140","UDP","1292","50355  >  443 Len=1250"
"322","3.122783","192.168.12.35","146.75.37.140","UDP","1019","50355  >  443 Len=977"
"323","3.159827","146.75.37.140","192.168.12.35","UDP","67","443  >  50355 Len=25"
"324","3.170165","146.75.37.140","192.168.12.35","TLSv1.2","251","Application Data"
"325","3.180247","192.168.12.35","146.75.37.140","TLSv1.2","89","Application Data"
"326","3.187980","146.75.37.140","192.168.12.35","TLSv1.2","173","Application Data"
"327","3.194079","146.75.37.140","192.168.12.35","UDP","834","443  >  50355 Len=792"
"328","3.194079","146.75.37.140","192.168.12.35","UDP","453","443  >  50355 Len=411"
"329","3.199533","146.75.37.140","192.168.12.35","TCP","1430","443  >  61013 [ACK] Seq=121651 Ack=40293 Win=8244 Len=1376 [TCP PDU reassembled in 330]"
"330","3.199533","146.75.37.140","192.168.12.35","TLSv1.2","417","Application Data"
"331","3.199533","146.75.37.140","192.168.12.35","TLSv1.2","992","Application Data"
"332","3.199533","146.75.37.140","192.168.12.35","TLSv1.2","1195","Application Data"
"333","3.199533","146.75.37.140","192.168.12.35","TLSv1.2","677","Application Data"
"334","3.199533","146.75.37.140","192.168.12.35","TLSv1.2","918","Application Data"
"335","3.199533","146.75.37.140","192.168.12.35","TLSv1.2","1101","Application Data"
"336","3.199533","146.75.37.140","192.168.12.35","TLSv1.2","292","Application Data"
"337","3.199533","146.75.37.140","192.168.12.35","TLSv1.2","735","Application Data"
"338","3.199533","146.75.37.140","192.168.12.35","TLSv1.2","427","Application Data"
"339","3.199533","146.75.37.140","192.168.12.35","TLSv1.2","285","Application Data"
"340","3.199533","146.75.37.140","192.168.12.35","TLSv1.2","454","Application Data"
"341","3.199533","146.75.37.140","192.168.12.35","TLSv1.2","172","Application Data"
"342","3.199533","146.75.37.140","192.168.12.35","TLSv1.2","589","Application Data"
"343","3.200493","192.168.12.35","146.75.37.140","TCP","54","61013  >  443 [ACK] Seq=40328 Ack=123027 Win=1025 Len=0"
"344","3.200940","192.168.12.35","146.75.37.140","TCP","54","61013  >  443 [ACK] Seq=40328 Ack=124328 Win=1020 Len=0"
"345","3.201088","192.168.12.35","146.75.37.140","TCP","54","61013  >  443 [ACK] Seq=40328 Ack=125469 Win=1025 Len=0"
"346","3.201137","192.168.12.35","146.75.37.140","TCP","54","61013  >  443 [ACK] Seq=40328 Ack=126092 Win=1022 Len=0"
"347","3.201194","192.168.12.35","146.75.37.140","TCP","54","61013  >  443 [ACK] Seq=40328 Ack=126956 Win=1025 Len=0"
"348","3.201257","192.168.12.35","146.75.37.140","TCP","54","61013  >  443 [ACK] Seq=40328 Ack=128003 Win=1021 Len=0"
"349","3.201384","192.168.12.35","146.75.37.140","TCP","54","61013  >  443 [ACK] Seq=40328 Ack=128922 Win=1025 Len=0"
"350","3.201488","192.168.12.35","146.75.37.140","TCP","54","61013  >  443 [ACK] Seq=40328 Ack=129526 Win=1022 Len=0"
"351","3.201577","192.168.12.35","146.75.37.140","TCP","54","61013  >  443 [ACK] Seq=40328 Ack=130044 Win=1020 Len=0"
"352","3.201637","192.168.12.35","146.75.37.140","TCP","54","61013  >  443 [ACK] Seq=40328 Ack=130579 Win=1025 Len=0"
"353","3.212234","146.75.37.140","192.168.12.35","TCP","54","443  >  61013 [ACK] Seq=130579 Ack=40328 Win=8244 Len=0"
"354","3.212234","146.75.37.140","192.168.12.35","TLSv1.2","735","Application Data"
"355","3.213257","192.168.12.35","146.75.37.140","TCP","54","61013  >  443 [ACK] Seq=40328 Ack=131260 Win=1022 Len=0"
"356","3.213257","192.168.12.35","146.75.37.140","UDP","84","50355  >  443 Len=42"
"357","3.231639","146.75.37.140","192.168.12.35","TLSv1.2","349","Application Data"
"358","3.231639","146.75.37.140","192.168.12.35","TLSv1.2","432","Application Data"
"359","3.231639","146.75.37.140","192.168.12.35","TLSv1.2","1165","Application Data"
"360","3.231639","146.75.37.140","192.168.12.35","TCP","1430","443  >  61013 [ACK] Seq=133044 Ack=40328 Win=8244 Len=1376 [TCP PDU reassembled in 361]"
"361","3.231639","146.75.37.140","192.168.12.35","TLSv1.2","114","Application Data"
"362","3.231639","146.75.37.140","192.168.12.35","TLSv1.2","187","Application Data"
"363","3.231639","146.75.37.140","192.168.12.35","TLSv1.2","579","Application Data"
"364","3.231639","146.75.37.140","192.168.12.35","TLSv1.2","1123","Application Data"
"365","3.231639","146.75.37.140","192.168.12.35","TLSv1.2","504","Application Data"
"366","3.231639","146.75.37.140","192.168.12.35","TLSv1.2","338","Application Data"
"367","3.231639","146.75.37.140","192.168.12.35","TLSv1.2","774","Application Data"
"368","3.231639","146.75.37.140","192.168.12.35","TLSv1.2","626","Application Data"
"369","3.232763","192.168.12.35","146.75.37.140","TCP","54","61013  >  443 [ACK] Seq=40328 Ack=131933 Win=1019 Len=0"
"370","3.233263","192.168.12.35","146.75.37.140","TCP","54","61013  >  443 [ACK] Seq=40328 Ack=134420 Win=1025 Len=0"
"371","3.233363","192.168.12.35","146.75.37.140","TCP","54","61013  >  443 [ACK] Seq=40328 Ack=134613 Win=1024 Len=0"
"372","3.233417","192.168.12.35","146.75.37.140","TCP","54","61013  >  443 [ACK] Seq=40328 Ack=136207 Win=1025 Len=0"
"373","3.233505","192.168.12.35","146.75.37.140","TCP","54","61013  >  443 [ACK] Seq=40328 Ack=136941 Win=1022 Len=0"
"374","3.233556","192.168.12.35","146.75.37.140","TCP","54","61013  >  443 [ACK] Seq=40328 Ack=138233 Win=1025 Len=0"
"375","3.246272","146.75.37.140","192.168.12.35","TLSv1.2","274","Application Data"
"376","3.246272","146.75.37.140","192.168.12.35","TLSv1.2","204","Application Data"
"377","3.246739","192.168.12.35","146.75.37.140","TCP","54","61013  >  443 [ACK] Seq=40328 Ack=138603 Win=1023 Len=0"
"378","3.256250","146.75.37.140","192.168.12.35","TLSv1.2","211","Application Data"
"379","3.262143","146.75.37.140","192.168.12.35","TLSv1.2","350","Application Data"
"380","3.262530","192.168.12.35","146.75.37.140","TCP","54","61013  >  443 [ACK] Seq=40328 Ack=139056 Win=1021 Len=0"
