"No.","Time","Source","Destination","Protocol","Length","Info"
"1","0.000000","192.168.12.35","146.75.37.140","TCP","55","62685  >  443 [ACK] Seq=1 Ack=1 Win=512 Len=1"
"2","0.029851","146.75.37.140","192.168.12.35","TCP","66","443  >  62685 [ACK] Seq=1 Ack=2 Win=302 Len=0 SLE=1 SRE=2"
"3","0.262788","192.168.12.35","146.75.37.140","TCP","55","61155  >  443 [ACK] Seq=1 Ack=1 Win=1022 Len=1 [TCP PDU reassembled in 1221]"
"4","0.284918","146.75.37.140","192.168.12.35","TCP","66","443  >  61155 [ACK] Seq=1 Ack=2 Win=302 Len=0 SLE=1 SRE=2"
"5","1.934544","192.168.12.35","146.75.37.140","TLSv1.2","3404","Application Data"
"6","1.934640","192.168.12.35","146.75.37.140","TLSv1.2","93","Application Data"
"7","1.934664","192.168.12.35","146.75.37.140","TLSv1.2","897","Application Data"
"8","1.935855","192.168.12.35","146.75.37.140","TLSv1.2","3288","Application Data"
"9","1.935893","192.168.12.35","146.75.37.140","TLSv1.2","3405","Application Data"
"10","1.935935","192.168.12.35","146.75.37.140","TLSv1.2","3405","Application Data"
"11","1.935957","192.168.12.35","146.75.37.140","TLSv1.2","1195","Application Data"
"12","1.935977","192.168.12.35","146.75.37.140","TLSv1.2","1241","Application Data"
"13","2.042475","146.75.37.140","192.168.12.35","TCP","54","443  >  61013 [ACK] Seq=1 Ack=1397 Win=8244 Len=0"
"14","2.059462","146.75.37.140","192.168.12.35","TCP","54","443  >  61013 [ACK] Seq=1 Ack=2793 Win=8244 Len=0"
"15","2.070063","146.75.37.140","192.168.12.35","TCP","54","443  >  61013 [ACK] Seq=1 Ack=3351 Win=8244 Len=0"
"16","2.070063","146.75.37.140","192.168.12.35","TCP","54","443  >  61013 [ACK] Seq=1 Ack=3390 Win=8244 Len=0"
"17","2.070063","146.75.37.140","192.168.12.35","TLSv1.2","93","Application Data"
"18","2.082310","146.75.37.140","192.168.12.35","TCP","54","443  >  61013 [ACK] Seq=40 Ack=4233 Win=8244 Len=0"
"19","2.099872","146.75.37.140","192.168.12.35","TCP","54","443  >  61013 [ACK] Seq=40 Ack=5629 Win=8244 Len=0"
"20","2.099872","146.75.37.140","192.168.12.35","TCP","1430","443  >  61013 [ACK] Seq=40 Ack=5629 Win=8244 Len=1376 [TCP PDU reassembled in 21]"
"21","2.099872","146.75.37.140","192.168.12.35","TLSv1.2","438","Application Data"
"22","2.100072","192.168.12.35","146.75.37.140","TCP","54","61013  >  443 [ACK] Seq=16497 Ack=1416 Win=1025 Len=0"
"23","2.107107","192.168.12.35","146.75.37.140","TLSv1.2","89","Application Data"
"24","2.115703","146.75.37.140","192.168.12.35","TCP","54","443  >  61013 [ACK] Seq=1800 Ack=7025 Win=8244 Len=0"
"25","2.115703","146.75.37.140","192.168.12.35","TCP","54","443  >  61013 [ACK] Seq=1800 Ack=7467 Win=8244 Len=0"
"26","2.115703","146.75.37.140","192.168.12.35","TCP","54","443  >  61013 [ACK] Seq=1800 Ack=8863 Win=8244 Len=0"
"27","2.140028","146.75.37.140","192.168.12.35","TCP","54","443  >  61013 [ACK] Seq=1800 Ack=10259 Win=8244 Len=0"
"28","2.150023","146.75.37.140","192.168.12.35","TCP","54","443  >  61013 [ACK] Seq=1800 Ack=10818 Win=8244 Len=0"
"29","2.150023","146.75.37.140","192.168.12.35","TCP","1430","443  >  61013 [ACK] Seq=1800 Ack=10818 Win=8244 Len=1376 [TCP PDU reassembled in 30]"
"30","2.150023","146.75.37.140","192.168.12.35","TLSv1.2","910","Application Data"
"31","2.150023","146.75.37.140","192.168.12.35","TCP","1430","443  >  61013 [ACK] Seq=4032 Ack=10818 Win=8244 Len=1376 [TCP PDU reassembled in 32]"
"32","2.150023","146.75.37.140","192.168.12.35","TLSv1.2","814","Application Data"
"33","2.150322","192.168.12.35","146.75.37.140","TCP","54","61013  >  443 [ACK] Seq=16532 Ack=3176 Win=1025 Len=0"
"34","2.150406","192.168.12.35","146.75.37.140","TCP","54","61013  >  443 [ACK] Seq=16532 Ack=4032 Win=1021 Len=0"
"35","2.150426","192.168.12.35","146.75.37.140","TCP","54","61013  >  443 [ACK] Seq=16532 Ack=5408 Win=1025 Len=0"
"36","2.150468","192.168.12.35","146.75.37.140","TCP","54","61013  >  443 [ACK] Seq=16532 Ack=6168 Win=1022 Len=0"
"37","2.157549","146.75.37.140","192.168.12.35","TCP","1430","443  >  61013 [ACK] Seq=6168 Ack=10818 Win=8244 Len=1376 [TCP PDU reassembled in 48]"
"38","2.157549","146.75.37.140","192.168.12.35","TCP","1430","443  >  61013 [PSH, ACK] Seq=7544 Ack=10818 Win=8244 Len=1376 [TCP PDU reassembled in 48]"
"39","2.157549","146.75.37.140","192.168.12.35","TCP","1430","443  >  61013 [ACK] Seq=8920 Ack=10818 Win=8244 Len=1376 [TCP PDU reassembled in 48]"
"40","2.157549","146.75.37.140","192.168.12.35","TCP","1430","443  >  61013 [PSH, ACK] Seq=10296 Ack=10818 Win=8244 Len=1376 [TCP PDU reassembled in 48]"
"41","2.157549","146.75.37.140","192.168.12.35","TCP","1430","443  >  61013 [ACK] Seq=11672 Ack=10818 Win=8244 Len=1376 [TCP PDU reassembled in 48]"
"42","2.157549","146.75.37.140","192.168.12.35","TCP","1430","443  >  61013 [PSH, ACK] Seq=13048 Ack=10818 Win=8244 Len=1376 [TCP PDU reassembled in 48]"
"43","2.157549","146.75.37.140","192.168.12.35","TCP","1430","443  >  61013 [ACK] Seq=14424 Ack=10818 Win=8244 Len=1376 [TCP PDU reassembled in 48]"
"44","2.157549","146.75.37.140","192.168.12.35","TCP","1430","443  >  61013 [PSH, ACK] Seq=15800 Ack=10818 Win=8244 Len=1376 [TCP PDU reassembled in 48]"
"45","2.157549","146.75.37.140","192.168.12.35","TCP","1430","443  >  61013 [ACK] Seq=17176 Ack=10818 Win=8244 Len=1376 [TCP PDU reassembled in 48]"
"46","2.157549","146.75.37.140","192.168.12.35","TCP","1430","443  >  61013 [PSH, ACK] Seq=18552 Ack=10818 Win=8244 Len=1376 [TCP PDU reassembled in 48]"
"47","2.157853","192.168.12.35","146.75.37.140","TCP","54","61013  >  443 [ACK] Seq=16532 Ack=19928 Win=1025 Len=0"
"48","2.163286","146.75.37.140","192.168.12.35","TLSv1.2","1169","Application Data, Application Data"
"49","2.163286","146.75.37.140","192.168.12.35","TLSv1.2","90","Application Data"
"50","2.164421","192.168.12.35","146.75.37.140","TCP","54","61013  >  443 [ACK] Seq=16532 Ack=21079 Win=1020 Len=0"
"51","2.177566","146.75.37.140","192.168.12.35","TCP","1430","443  >  61013 [ACK] Seq=21079 Ack=13610 Win=8244 Len=1376 [TCP PDU reassembled in 63]"
"52","2.177566","146.75.37.140","192.168.12.35","TCP","1430","443  >  61013 [PSH, ACK] Seq=22455 Ack=13610 Win=8244 Len=1376 [TCP PDU reassembled in 63]"
"53","2.177566","146.75.37.140","192.168.12.35","TCP","1430","443  >  61013 [ACK] Seq=23831 Ack=13610 Win=8244 Len=1376 [TCP PDU reassembled in 63]"
"54","2.177566","146.75.37.140","192.168.12.35","TCP","1430","443  >  61013 [PSH, ACK] Seq=25207 Ack=13610 Win=8244 Len=1376 [TCP PDU reassembled in 63]"
"55","2.178149","192.168.12.35","146.75.37.140","TCP","54","61013  >  443 [ACK] Seq=16532 Ack=26583 Win=1025 Len=0"
"56","2.186908","146.75.37.140","192.168.12.35","TCP","1430","443  >  61013 [ACK] Seq=26583 Ack=13610 Win=8244 Len=1376 [TCP PDU reassembled in 63]"
"57","2.186908","146.75.37.140","192.168.12.35","TCP","1430","443  >  61013 [PSH, ACK] Seq=27959 Ack=13610 Win=8244 Len=1376 [TCP PDU reassembled in 63]"
"58","2.186908","146.75.37.140","192.168.12.35","TCP","1430","443  >  61013 [ACK] Seq=29335 Ack=13610 Win=8244 Len=1376 [TCP PDU reassembled in 63]"
"59","2.186908","146.75.37.140","192.168.12.35","TCP","1430","443  >  61013 [PSH, ACK] Seq=30711 Ack=13610 Win=8244 Len=1376 [TCP PDU reassembled in 63]"
"60","2.186908","146.75.37.140","192.168.12.35","TCP","1430","443  >  61013 [ACK] Seq=32087 Ack=13610 Win=8244 Len=1376 [TCP PDU reassembled in 63]"
"61","2.186908","146.75.37.140","192.168.12.35","TCP","1430","443  >  61013 [PSH, ACK] Seq=33463 Ack=13610 Win=8244 Len=1376 [TCP PDU reassembled in 63]"
"62","2.186908","146.75.37.140","192.168.12.35","TCP","1430","443  >  61013 [ACK] Seq=34839 Ack=13610 Win=8244 Len=1376 [TCP PDU reassembled in 63]"
"63","2.186908","146.75.37.140","192.168.12.35","TLSv1.2","794","Application Data"
"64","2.186908","146.75.37.140","192.168.12.35","TCP","1430","443  >  61013 [ACK] Seq=36955 Ack=13610 Win=8244 Len=1376 [TCP PDU reassembled in 78]"
"65","2.186908","146.75.37.140","192.168.12.35","TCP","1430","443  >  61013 [PSH, ACK] Seq=38331 Ack=13610 Win=8244 Len=1376 [TCP PDU reassembled in 78]"
"66","2.186908","146.75.37.140","192.168.12.35","TCP","1430","443  >  61013 [ACK] Seq=39707 Ack=13610 Win=8244 Len=1376 [TCP PDU reassembled in 78]"
"67","2.186908","146.75.37.140","192.168.12.35","TCP","1430","443  >  61013 [PSH, ACK] Seq=41083 Ack=13610 Win=8244 Len=1376 [TCP PDU reassembled in 78]"
"68","2.186908","146.75.37.140","192.168.12.35","TCP","1430","443  >  61013 [ACK] Seq=42459 Ack=13610 Win=8244 Len=1376 [TCP PDU reassembled in 78]"
"69","2.186908","146.75.37.140","192.168.12.35","TCP","1430","443  >  61013 [PSH, ACK] Seq=43835 Ack=13610 Win=8244 Len=1376 [TCP PDU reassembled in 78]"
"70","2.186908","146.75.37.140","192.168.12.35","TCP","1430","443  >  61013 [ACK] Seq=45211 Ack=13610 Win=8244 Len=1376 [TCP PDU reassembled in 78]"
"71","2.186908","146.75.37.140","192.168.12.35","TCP","1430","443  >  61013 [PSH, ACK] Seq=46587 Ack=13610 Win=8244 Len=1376 [TCP PDU reassembled in 78]"
"72","2.187806","192.168.12.35","146.75.37.140","TCP","54","61013  >  443 [ACK] Seq=16532 Ack=36215 Win=1025 Len=0"
"73","2.188106","192.168.12.35","146.75.37.140","TCP","54","61013  >  443 [ACK] Seq=16532 Ack=36955 Win=1022 Len=0"
"74","2.188203","192.168.12.35","146.75.37.140","TCP","54","61013  >  443 [ACK] Seq=16532 Ack=47963 Win=1025 Len=0"
"75","2.193474","146.75.37.140","192.168.12.35","TCP","1430","443  >  61013 [ACK] Seq=47963 Ack=13610 Win=8244 Len=1376 [TCP PDU reassembled in 78]"
"76","2.193474","146.75.37.140","192.168.12.35","TCP","1430","443  >  61013 [PSH, ACK] Seq=49339 Ack=13610 Win=8244 Len=1376 [TCP PDU reassembled in 78]"
"77","2.193474","146.75.37.140","192.168.12.35","TCP","1430","443  >  61013 [ACK] Seq=50715 Ack=13610 Win=8244 Len=1376 [TCP PDU reassembled in 78]"
"78","2.193474","146.75.37.140","192.168.12.35","TLSv1.2","1386","Application Data, Application Data, Application Data"
"79","2.193474","146.75.37.140","192.168.12.35","TCP","1430","443  >  61013 [ACK] Seq=53423 Ack=13610 Win=8244 Len=1376 [TCP PDU reassembled in 80]"
"80","2.193474","146.75.37.140","192.168.12.35","TLSv1.2","759","Application Data"
"81","2.193474","146.75.37.140","192.168.12.35","TCP","54","443  >  61013 [ACK] Seq=55504 Ack=14169 Win=8244 Len=0"
"82","2.193474","146.75.37.140","192.168.12.35","TLSv1.2","1049","Application Data"
"83","2.194227","192.168.12.35","146.75.37.140","TCP","54","61013  >  443 [ACK] Seq=16532 Ack=52091 Win=1025 Len=0"
"84","2.194634","192.168.12.35","146.75.37.140","TCP","54","61013  >  443 [ACK] Seq=16532 Ack=53423 Win=1019 Len=0"
"85","2.194707","192.168.12.35","146.75.37.140","TCP","54","61013  >  443 [ACK] Seq=16532 Ack=55504 Win=1025 Len=0"
"86","2.197276","146.75.37.140","192.168.12.35","TCP","1430","443  >  61013 [ACK] Seq=56499 Ack=14169 Win=8244 Len=1376 [TCP PDU reassembled in 87]"
"87","2.197276","146.75.37.140","192.168.12.35","TLSv1.2","788","Application Data"
"88","2.197276","146.75.37.140","192.168.12.35","TLSv1.2","1397","Application Data"
"89","2.197276","146.75.37.140","192.168.12.35","TLSv1.2","636","Application Data"
"90","2.197276","146.75.37.140","192.168.12.35","TLSv1.2","1000","Application Data"
"91","2.197276","146.75.37.140","192.168.12.35","TCP","54","443  >  61013 [ACK] Seq=61480 Ack=15310 Win=8244 Len=0"
"92","2.197701","192.168.12.35","146.75.37.140","TCP","54","61013  >  443 [ACK] Seq=16532 Ack=57875 Win=1025 Len=0"
"93","2.197937","192.168.12.35","146.75.37.140","TCP","54","61013  >  443 [ACK] Seq=16532 Ack=59952 Win=1025 Len=0"
"94","2.197985","192.168.12.35","146.75.37.140","TCP","54","61013  >  443 [ACK] Seq=16532 Ack=61480 Win=1025 Len=0"
"95","2.215006","146.75.37.140","192.168.12.35","TCP","54","443  >  61013 [ACK] Seq=61480 Ack=16497 Win=8244 Len=0"
"96","2.215006","146.75.37.140","192.168.12.35","TLSv1.2","188","Application Data"
"97","2.215006","146.75.37.140","192.168.12.35","TLSv1.2","232","Application Data"
"98","2.215006","146.75.37.140","192.168.12.35","TLSv1.2","581","Application Data"
"99","2.215006","146.75.37.140","192.168.12.35","TCP","1430","443  >  61013 [ACK] Seq=62319 Ack=16497 Win=8244 Len=1376 [TCP PDU reassembled in 100]"
"100","2.215006","146.75.37.140","192.168.12.35","TLSv1.2","310","Application Data"
"101","2.215350","192.168.12.35","146.75.37.140","TCP","54","61013  >  443 [ACK] Seq=16532 Ack=61792 Win=1023 Len=0"
"102","2.215477","192.168.12.35","146.75.37.140","TCP","54","61013  >  443 [ACK] Seq=16532 Ack=63695 Win=1025 Len=0"
"103","2.220688","146.75.37.140","192.168.12.35","TLSv1.2","769","Application Data"
"104","2.220688","146.75.37.140","192.168.12.35","TLSv1.2","97","Application Data"
"105","2.220688","146.75.37.140","192.168.12.35","TLSv1.2","220","Application Data"
"106","2.220688","146.75.37.140","192.168.12.35","TLSv1.2","1181","Application Data, Application Data"
"107","2.220688","146.75.37.140","192.168.12.35","TLSv1.2","219","Application Data, Application Data"
"108","2.220688","146.75.37.140","192.168.12.35","TLSv1.2","93","Application Data"
"109","2.220688","146.75.37.140","192.168.12.35","TLSv1.2","118","Application Data"
"110","2.220688","146.75.37.140","192.168.12.35","TLSv1.2","675","Application Data"
"111","2.220688","146.75.37.140","192.168.12.35","TLSv1.2","772","Application Data"
"112","2.220688","146.75.37.140","192.168.12.35","TLSv1.2","311","Application Data"
"113","2.220688","146.75.37.140","192.168.12.35","TLSv1.2","456","Application Data"
"114","2.220688","146.75.37.140","192.168.12.35","TLSv1.2","148","Application Data"
"115","2.220688","146.75.37.140","192.168.12.35","TLSv1.2","359","Application Data"
"116","2.220688","146.75.37.140","192.168.12.35","TLSv1.2","128","Application Data"
"117","2.220688","146.75.37.140","192.168.12.35","TLSv1.2","159","Application Data"
"118","2.220688","146.75.37.140","192.168.12.35","TLSv1.2","260","Application Data"
"119","2.220688","146.75.37.140","192.168.12.35","TLSv1.2","128","Application Data"
"120","2.220688","146.75.37.140","192.168.12.35","TLSv1.2","242","Application Data"
"121","2.220688","146.75.37.140","192.168.12.35","TLSv1.2","341","Application Data"
"122","2.220688","146.75.37.140","192.168.12.35","TCP","1430","443  >  61013 [ACK] Seq=69601 Ack=16497 Win=8244 Len=1376 [TCP PDU reassembled in 123]"
"123","2.220688","146.75.37.140","192.168.12.35","TLSv1.2","504","Application Data"
"124","2.220688","146.75.37.140","192.168.12.35","TLSv1.2","312","Application Data"
"125","2.221644","192.168.12.35","146.75.37.140","TCP","54","61013  >  443 [ACK] Seq=16532 Ack=64666 Win=1021 Len=0"
"126","2.221994","192.168.12.35","146.75.37.140","TCP","54","61013  >  443 [ACK] Seq=16532 Ack=64875 Win=1020 Len=0"
"127","2.222032","192.168.12.35","146.75.37.140","TCP","54","61013  >  443 [ACK] Seq=16532 Ack=66002 Win=1025 Len=0"
"128","2.222054","192.168.12.35","146.75.37.140","TCP","54","61013  >  443 [ACK] Seq=16532 Ack=66167 Win=1024 Len=0"
"129","2.222082","192.168.12.35","146.75.37.140","TCP","54","61013  >  443 [ACK] Seq=16532 Ack=66270 Win=1024 Len=0"
"130","2.222109","192.168.12.35","146.75.37.140","TCP","54","61013  >  443 [ACK] Seq=16532 Ack=67609 Win=1025 Len=0"
"131","2.222138","192.168.12.35","146.75.37.140","TCP","54","61013  >  443 [ACK] Seq=16532 Ack=68268 Win=1022 Len=0"
"132","2.222181","192.168.12.35","146.75.37.140","TCP","54","61013  >  443 [ACK] Seq=16532 Ack=68667 Win=1021 Len=0"
"133","2.222224","192.168.12.35","146.75.37.140","TCP","54","61013  >  443 [ACK] Seq=16532 Ack=68846 Win=1020 Len=0"
"134","2.222250","192.168.12.35","146.75.37.140","TCP","54","61013  >  443 [ACK] Seq=16532 Ack=69052 Win=1025 Len=0"
"135","2.222271","192.168.12.35","146.75.37.140","TCP","54","61013  >  443 [ACK] Seq=16532 Ack=69126 Win=1024 Len=0"
"136","2.222340","192.168.12.35","146.75.37.140","TCP","54","61013  >  443 [ACK] Seq=16532 Ack=69601 Win=1023 Len=0"
"137","2.222370","192.168.12.35","146.75.37.140","TCP","54","61013  >  443 [ACK] Seq=16532 Ack=70977 Win=1025 Len=0"
"138","2.222404","192.168.12.35","146.75.37.140","TCP","54","61013  >  443 [ACK] Seq=16532 Ack=71427 Win=1023 Len=0"
"139","2.227726","146.75.37.140","192.168.12.35","TLSv1.2","581","Application Data"
"140","2.227726","146.75.37.140","192.168.12.35","TLSv1.2","587","Application Data"
"141","2.227956","192.168.12.35","146.75.37.140","TCP","54","61013  >  443 [ACK] Seq=16532 Ack=72212 Win=1020 Len=0"
"142","2.228002","192.168.12.35","146.75.37.140","TCP","54","61013  >  443 [ACK] Seq=16532 Ack=72745 Win=1025 Len=0"
"143","2.248620","146.75.37.140","192.168.12.35","TCP","1430","443  >  61013 [ACK] Seq=72745 Ack=16497 Win=8244 Len=1376 [TCP PDU reassembled in 144]"
"144","2.248620","146.75.37.140","192.168.12.35","TLSv1.2","756","Application Data"
"145","2.249344","192.168.12.35","146.75.37.140","TCP","54","61013  >  443 [ACK] Seq=16532 Ack=74121 Win=1019 Len=0"
"146","2.249623","192.168.12.35","146.75.37.140","TCP","54","61013  >  443 [ACK] Seq=16532 Ack=74823 Win=1025 Len=0"
"147","2.254145","192.168.12.35","146.75.37.140","UDP","96","52870  >  443 Len=54"
"148","2.286857","146.75.37.140","192.168.12.35","TCP","54","443  >  61013 [ACK] Seq=74823 Ack=16532 Win=8244 Len=0"
"149","2.338856","146.75.37.140","192.168.12.35","TLSv1.2","207","Application Data"
"150","2.338856","146.75.37.140","192.168.12.35","UDP","67","443  >  52870 Len=25"
"151","2.343285","146.75.37.140","192.168.12.35","TLSv1.2","1227","Application Data"
"152","2.343285","146.75.37.140","192.168.12.35","TLSv1.2","497","Application Data"
"153","2.343285","146.75.37.140","192.168.12.35","TLSv1.2","115","Application Data"
"154","2.343285","146.75.37.140","192.168.12.35","TLSv1.2","109","Application Data"
"155","2.343285","146.75.37.140","192.168.12.35","TLSv1.2","858","Application Data"
"156","2.343285","146.75.37.140","192.168.12.35","TLSv1.2","145","Application Data"
"157","2.343285","146.75.37.140","192.168.12.35","TLSv1.2","1261","Application Data"
"158","2.343285","146.75.37.140","192.168.12.35","TLSv1.2","319","Application Data"
"159","2.344127","192.168.12.35","146.75.37.140","TCP","54","61013  >  443 [ACK] Seq=16532 Ack=76149 Win=1020 Len=0"
"160","2.344583","192.168.12.35","146.75.37.140","TCP","54","61013  >  443 [ACK] Seq=16532 Ack=76653 Win=1025 Len=0"
"161","2.344678","192.168.12.35","146.75.37.140","TCP","54","61013  >  443 [ACK] Seq=16532 Ack=77512 Win=1021 Len=0"
"162","2.344770","192.168.12.35","146.75.37.140","TCP","54","61013  >  443 [ACK] Seq=16532 Ack=78810 Win=1025 Len=0"
"163","2.345207","192.168.12.35","146.75.37.140","UDP","103","52870  >  443 Len=61"
"164","2.367427","146.75.37.140","192.168.12.35","TLSv1.2","861","Application Data"
"165","2.367427","146.75.37.140","192.168.12.35","TLSv1.2","953","Application Data"
"166","2.367427","146.75.37.140","192.168.12.35","TCP","1430","443  >  61013 [ACK] Seq=80781 Ack=16532 Win=8244 Len=1376 [TCP PDU reassembled in 167]"
"167","2.367427","146.75.37.140","192.168.12.35","TLSv1.2","567","Application Data"
"168","2.367427","146.75.37.140","192.168.12.35","TCP","1430","443  >  61013 [ACK] Seq=82670 Ack=16532 Win=8244 Len=1376 [TCP PDU reassembled in 170]"
"169","2.367427","146.75.37.140","192.168.12.35","UDP","69","443  >  52870 Len=27"
"170","2.367427","146.75.37.140","192.168.12.35","TLSv1.2","661","Application Data"
"171","2.367427","146.75.37.140","192.168.12.35","TLSv1.2","512","Application Data"
"172","2.367427","146.75.37.140","192.168.12.35","TLSv1.2","290","Application Data"
"173","2.367427","146.75.37.140","192.168.12.35","TLSv1.2","172","Application Data"
"174","2.367427","146.75.37.140","192.168.12.35","TLSv1.2","113","Application Data"
"175","2.367427","146.75.37.140","192.168.12.35","TLSv1.2","97","Application Data"
"176","2.367427","146.75.37.140","192.168.12.35","TLSv1.2","160","Application Data"
"177","2.367427","146.75.37.140","192.168.12.35","TLSv1.2","161","Application Data"
"178","2.368377","192.168.12.35","146.75.37.140","TCP","54","61013  >  443 [ACK] Seq=16532 Ack=79882 Win=1021 Len=0"
"179","2.368754","192.168.12.35","146.75.37.140","TCP","54","61013  >  443 [ACK] Seq=16532 Ack=82157 Win=1025 Len=0"
"180","2.368850","192.168.12.35","146.75.37.140","TCP","54","61013  >  443 [ACK] Seq=16532 Ack=84046 Win=1025 Len=0"
"181","2.369072","192.168.12.35","146.75.37.140","TCP","54","61013  >  443 [ACK] Seq=16532 Ack=85111 Win=1021 Len=0"
"182","2.369143","192.168.12.35","146.75.37.140","TCP","54","61013  >  443 [ACK] Seq=16532 Ack=85465 Win=1025 Len=0"
"183","2.369221","192.168.12.35","146.75.37.140","TCP","54","61013  >  443 [ACK] Seq=16532 Ack=85567 Win=1024 Len=0"
"184","2.369297","192.168.12.35","146.75.37.140","TCP","54","61013  >  443 [ACK] Seq=16532 Ack=85780 Win=1023 Len=0"
"185","2.387587","146.75.37.140","192.168.12.35","UDP","69","443  >  52870 Len=27"
"186","2.598745","146.75.37.140","192.168.12.35","TCP","1430","443  >  61013 [ACK] Seq=85780 Ack=16532 Win=8244 Len=1376 [TCP PDU reassembled in 187]"
"187","2.598745","146.75.37.140","192.168.12.35","TLSv1.2","77","Application Data"
"188","2.598745","146.75.37.140","192.168.12.35","TCP","1430","443  >  61013 [ACK] Seq=87179 Ack=16532 Win=8244 Len=1376 [TCP PDU reassembled in 189]"
"189","2.598745","146.75.37.140","192.168.12.35","TLSv1.2","909","Application Data"
"190","2.600003","192.168.12.35","146.75.37.140","TCP","54","61013  >  443 [ACK] Seq=16532 Ack=87179 Win=1025 Len=0"
"191","2.600469","192.168.12.35","146.75.37.140","TCP","54","61013  >  443 [ACK] Seq=16532 Ack=89410 Win=1025 Len=0"
"192","2.611920","146.75.37.140","192.168.12.35","TLSv1.2","373","Application Data"
"193","2.611920","146.75.37.140","192.168.12.35","TLSv1.2","789","Application Data"
"194","2.611920","146.75.37.140","192.168.12.35","TLSv1.2","943","Application Data"
"195","2.611920","146.75.37.140","192.168.12.35","TLSv1.2","886","Application Data"
"196","2.611920","146.75.37.140","192.168.12.35","TLSv1.2","1199","Application Data"
"197","2.611920","146.75.37.140","192.168.12.35","TLSv1.2","511","Application Data"
"198","2.611920","146.75.37.140","192.168.12.35","TLSv1.2","564","Application Data"
"199","2.611920","146.75.37.140","192.168.12.35","TLSv1.2","659","Application Data"
"200","2.613009","192.168.12.35","146.75.37.140","TCP","54","61013  >  443 [ACK] Seq=16532 Ack=90464 Win=1021 Len=0"
"201","2.613453","192.168.12.35","146.75.37.140","TCP","54","61013  >  443 [ACK] Seq=16532 Ack=92185 Win=1025 Len=0"
"202","2.613540","192.168.12.35","146.75.37.140","TCP","54","61013  >  443 [ACK] Seq=16532 Ack=93787 Win=1025 Len=0"
"203","2.613650","192.168.12.35","146.75.37.140","TCP","54","61013  >  443 [ACK] Seq=16532 Ack=94902 Win=1020 Len=0"
"204","2.618501","146.75.37.140","192.168.12.35","TLSv1.2","1247","Application Data"
"205","2.618501","146.75.37.140","192.168.12.35","TLSv1.2","469","Application Data"
"206","2.618501","146.75.37.140","192.168.12.35","TLSv1.2","1190","Application Data"
"207","2.618501","146.75.37.140","192.168.12.35","TLSv1.2","453","Application Data"
"208","2.618501","146.75.37.140","192.168.12.35","TLSv1.2","102","Application Data"
"209","2.618501","146.75.37.140","192.168.12.35","TLSv1.2","184","Application Data"
"210","2.618501","146.75.37.140","192.168.12.35","TLSv1.2","232","Application Data"
"211","2.618501","146.75.37.140","192.168.12.35","TLSv1.2","101","Application Data"
"212","2.618501","146.75.37.140","192.168.12.35","TLSv1.2","665","Application Data"
"213","2.618501","146.75.37.140","192.168.12.35","TLSv1.2","297","Application Data"
"214","2.618501","146.75.37.140","192.168.12.35","TLSv1.2","285","Application Data"
"215","2.618501","146.75.37.140","192.168.12.35","TLSv1.2","368","Application Data"
"216","2.618501","146.75.37.140","192.168.12.35","TLSv1.2","1067","Application Data"
"217","2.618501","146.75.37.140","192.168.12.35","TLSv1.2","927","Application Data"
"218","2.618501","146.75.37.140","192.168.12.35","TLSv1.2","841","Application Data"
"219","2.618501","146.75.37.140","192.168.12.35","TLSv1.2","790","Application Data"
"220","2.618501","146.75.37.140","192.168.12.35","TLSv1.2","592","Application Data"
"221","2.618501","146.75.37.140","192.168.12.35","TLSv1.2","332","Application Data"
"222","2.618501","146.75.37.140","192.168.12.35","TLSv1.2","130","Application Data"
"223","2.618501","146.75.37.140","192.168.12.35","TLSv1.2","104","Application Data"
"224","2.618501","146.75.37.140","192.168.12.35","TLSv1.2","257","Application Data"
"225","2.619593","192.168.12.35","146.75.37.140","TCP","54","61013  >  443 [ACK] Seq=16532 Ack=96510 Win=1025 Len=0"
"226","2.619801","192.168.12.35","146.75.37.140","TCP","54","61013  >  443 [ACK] Seq=16532 Ack=98045 Win=1025 Len=0"
"227","2.619832","192.168.12.35","146.75.37.140","TCP","54","61013  >  443 [ACK] Seq=16532 Ack=98223 Win=1024 Len=0"
"228","2.619864","192.168.12.35","146.75.37.140","TCP","54","61013  >  443 [ACK] Seq=16532 Ack=98448 Win=1023 Len=0"
"229","2.619895","192.168.12.35","146.75.37.140","TCP","54","61013  >  443 [ACK] Seq=16532 Ack=99302 Win=1020 Len=0"
"230","2.619961","192.168.12.35","146.75.37.140","TCP","54","61013  >  443 [ACK] Seq=16532 Ack=99847 Win=1025 Len=0"
"231","2.620003","192.168.12.35","146.75.37.140","TCP","54","61013  >  443 [ACK] Seq=16532 Ack=101733 Win=1025 Len=0"
"232","2.620045","192.168.12.35","146.75.37.140","TCP","54","61013  >  443 [ACK] Seq=16532 Ack=103256 Win=1025 Len=0"
"233","2.620135","192.168.12.35","146.75.37.140","TCP","54","61013  >  443 [ACK] Seq=16532 Ack=104072 Win=1022 Len=0"
"234","2.620168","192.168.12.35","146.75.37.140","TCP","54","61013  >  443 [ACK] Seq=16532 Ack=104198 Win=1021 Len=0"
"235","2.621536","146.75.37.140","192.168.12.35","TLSv1.2","803","Application Data"
"236","2.621720","192.168.12.35","146.75.37.140","TCP","54","61013  >  443 [ACK] Seq=16532 Ack=105150 Win=1025 Len=0"
"237","2.828999","192.168.12.35","146.75.37.140","TLSv1.2","3213","Application Data"
"238","2.891130","146.75.37.140","192.168.12.35","TCP","54","443  >  61013 [ACK] Seq=105150 Ack=17928 Win=8244 Len=0"
"239","2.905062","146.75.37.140","192.168.12.35","TCP","54","443  >  61013 [ACK] Seq=105150 Ack=19324 Win=8244 Len=0"
"240","2.905062","146.75.37.140","192.168.12.35","TCP","54","443  >  61013 [ACK] Seq=105150 Ack=19691 Win=8244 Len=0"
"241","2.932469","146.75.37.140","192.168.12.35","TCP","1430","443  >  61013 [ACK] Seq=105150 Ack=19691 Win=8244 Len=1376 [TCP PDU reassembled in 242]"
"242","2.939671","146.75.37.140","192.168.12.35","TLSv1.2","635","Application Data"
"243","2.939671","146.75.37.140","192.168.12.35","TLSv1.2","100","Application Data"
"244","2.940309","192.168.12.35","146.75.37.140","TCP","54","61013  >  443 [ACK] Seq=19691 Ack=107107 Win=1025 Len=0"
"245","2.988208","192.168.12.35","146.75.37.140","TCP","54","61013  >  443 [ACK] Seq=19691 Ack=107153 Win=1025 Len=0"
"246","3.010377","192.168.12.35","146.75.37.140","TLSv1.2","199","Application Data"
"247","3.010741","192.168.12.35","146.75.37.140","TLSv1.2","93","Application Data"
"248","3.069578","146.75.37.140","192.168.12.35","TCP","54","443  >  61034 [ACK] Seq=1 Ack=146 Win=424 Len=0"
"249","3.069578","146.75.37.140","192.168.12.35","TLSv1.2","155","Application Data"
"250","3.069578","146.75.37.140","192.168.12.35","TCP","1430","443  >  61034 [ACK] Seq=102 Ack=146 Win=424 Len=1376 [TCP PDU reassembled in 261]"
"251","3.069578","146.75.37.140","192.168.12.35","TCP","1430","443  >  61034 [ACK] Seq=1478 Ack=146 Win=424 Len=1376 [TCP PDU reassembled in 261]"
"252","3.069578","146.75.37.140","192.168.12.35","TCP","1430","443  >  61034 [ACK] Seq=2854 Ack=146 Win=424 Len=1376 [TCP PDU reassembled in 261]"
"253","3.069578","146.75.37.140","192.168.12.35","TCP","1430","443  >  61034 [ACK] Seq=4230 Ack=146 Win=424 Len=1376 [TCP PDU reassembled in 261]"
"254","3.069578","146.75.37.140","192.168.12.35","TCP","1430","443  >  61034 [ACK] Seq=5606 Ack=146 Win=424 Len=1376 [TCP PDU reassembled in 261]"
"255","3.069578","146.75.37.140","192.168.12.35","TCP","1430","443  >  61034 [ACK] Seq=6982 Ack=146 Win=424 Len=1376 [TCP PDU reassembled in 261]"
"256","3.069578","146.75.37.140","192.168.12.35","TCP","1430","443  >  61034 [ACK] Seq=8358 Ack=146 Win=424 Len=1376 [TCP PDU reassembled in 261]"
"257","3.069578","146.75.37.140","192.168.12.35","TCP","1430","443  >  61034 [ACK] Seq=9734 Ack=146 Win=424 Len=1376 [TCP PDU reassembled in 261]"
"258","3.069578","146.75.37.140","192.168.12.35","TCP","1430","443  >  61034 [ACK] Seq=11110 Ack=146 Win=424 Len=1376 [TCP PDU reassembled in 261]"
"259","3.069578","146.75.37.140","192.168.12.35","TCP","1430","443  >  61034 [ACK] Seq=12486 Ack=146 Win=424 Len=1376 [TCP PDU reassembled in 261]"
"260","3.069578","146.75.37.140","192.168.12.35","TCP","1430","443  >  61034 [ACK] Seq=13862 Ack=146 Win=424 Len=1376 [TCP PDU reassembled in 261]"
"261","3.069578","146.75.37.140","192.168.12.35","TLSv1.2","1430","Application Data"
"262","3.069578","146.75.37.140","192.168.12.35","TCP","1430","443  >  61034 [ACK] Seq=16614 Ack=146 Win=424 Len=1376 [TCP PDU reassembled in 272]"
"263","3.069578","146.75.37.140","192.168.12.35","TCP","1430","443  >  61034 [ACK] Seq=17990 Ack=146 Win=424 Len=1376 [TCP PDU reassembled in 272]"
"264","3.069578","146.75.37.140","192.168.12.35","TCP","1430","443  >  61034 [ACK] Seq=19366 Ack=146 Win=424 Len=1376 [TCP PDU reassembled in 272]"
"265","3.069578","146.75.37.140","192.168.12.35","TCP","1430","443  >  61034 [ACK] Seq=20742 Ack=146 Win=424 Len=1376 [TCP PDU reassembled in 272]"
"266","3.069578","146.75.37.140","192.168.12.35","TCP","1430","443  >  61034 [ACK] Seq=22118 Ack=146 Win=424 Len=1376 [TCP PDU reassembled in 272]"
"267","3.069578","146.75.37.140","192.168.12.35","TCP","1430","443  >  61034 [ACK] Seq=23494 Ack=146 Win=424 Len=1376 [TCP PDU reassembled in 272]"
"268","3.069578","146.75.37.140","192.168.12.35","TCP","1430","443  >  61034 [ACK] Seq=24870 Ack=146 Win=424 Len=1376 [TCP PDU reassembled in 272]"
"269","3.069578","146.75.37.140","192.168.12.35","TCP","1430","443  >  61034 [ACK] Seq=26246 Ack=146 Win=424 Len=1376 [TCP PDU reassembled in 272]"
"270","3.069578","146.75.37.140","192.168.12.35","TCP","1430","443  >  61034 [ACK] Seq=27622 Ack=146 Win=424 Len=1376 [TCP PDU reassembled in 272]"
"271","3.069578","146.75.37.140","192.168.12.35","TCP","1430","443  >  61034 [ACK] Seq=28998 Ack=146 Win=424 Len=1376 [TCP PDU reassembled in 272]"
"272","3.069578","146.75.37.140","192.168.12.35","TLSv1.2","1162","Application Data"
"273","3.069578","146.75.37.140","192.168.12.35","TCP","54","443  >  61034 [ACK] Seq=31482 Ack=185 Win=424 Len=0"
"274","3.069578","146.75.37.140","192.168.12.35","TLSv1.2","93","Application Data"
"275","3.071168","192.168.12.35","146.75.37.140","TCP","54","61034  >  443 [ACK] Seq=185 Ack=30374 Win=8201 Len=0"
"276","3.071924","192.168.12.35","146.75.37.140","TCP","54","61034  >  443 [ACK] Seq=185 Ack=31482 Win=8197 Len=0"
"277","3.080246","192.168.12.35","146.75.37.140","TLSv1.2","89","Application Data"
"278","3.110935","146.75.37.140","192.168.12.35","TCP","54","443  >  61034 [ACK] Seq=31521 Ack=220 Win=424 Len=0"
"279","3.488003","192.168.12.35","146.75.37.140","TLSv1.2","3242","Application Data"
"280","3.497027","192.168.12.35","146.75.37.140","TLSv1.2","3231","Application Data"
"281","3.497426","192.168.12.35","146.75.37.140","TLSv1.2","1017","Application Data"
"282","3.505481","192.168.12.35","146.75.37.140","TLSv1.2","3245","Application Data"
"283","3.524947","146.75.37.140","192.168.12.35","TCP","54","443  >  61013 [ACK] Seq=107153 Ack=21087 Win=8244 Len=0"
"284","3.536643","146.75.37.140","192.168.12.35","TCP","54","443  >  61013 [ACK] Seq=107153 Ack=22483 Win=8244 Len=0"
"285","3.549799","146.75.37.140","192.168.12.35","TCP","54","443  >  61013 [ACK] Seq=107153 Ack=22879 Win=8244 Len=0"
"286","3.569133","146.75.37.140","192.168.12.35","TCP","54","443  >  61013 [ACK] Seq=107153 Ack=24275 Win=8244 Len=0"
"287","3.580446","146.75.37.140","192.168.12.35","TCP","54","443  >  61013 [ACK] Seq=107153 Ack=25671 Win=8244 Len=0"
"288","3.585069","146.75.37.140","192.168.12.35","TCP","1430","443  >  61013 [ACK] Seq=107153 Ack=25671 Win=8244 Len=1376 [TCP PDU reassembled in 289]"
"289","3.585069","146.75.37.140","192.168.12.35","TLSv1.2","849","Application Data"
"290","3.585069","146.75.37.140","192.168.12.35","TCP","54","443  >  61013 [ACK] Seq=109324 Ack=26056 Win=8244 Len=0"
"291","3.585651","192.168.12.35","146.75.37.140","TCP","54","61013  >  443 [ACK] Seq=30210 Ack=109324 Win=1025 Len=0"
"292","3.595326","146.75.37.140","192.168.12.35","TLSv1.2","148","Application Data"
"293","3.595326","146.75.37.140","192.168.12.35","TCP","54","443  >  61013 [ACK] Seq=109418 Ack=27019 Win=8244 Len=0"
"294","3.597785","146.75.37.140","192.168.12.35","TLSv1.2","223","Application Data"
"295","3.598019","192.168.12.35","146.75.37.140","TCP","54","61013  >  443 [ACK] Seq=30210 Ack=109587 Win=1024 Len=0"
"296","3.602778","146.75.37.140","192.168.12.35","TLSv1.2","1160","Application Data"
"297","3.618482","146.75.37.140","192.168.12.35","TCP","1430","443  >  61013 [ACK] Seq=110693 Ack=28415 Win=8244 Len=1376 [TCP PDU reassembled in 298]"
"298","3.618482","146.75.37.140","192.168.12.35","TLSv1.2","424","Application Data"
"299","3.618482","146.75.37.140","192.168.12.35","TLSv1.2","979","Application Data"
"300","3.619120","192.168.12.35","146.75.37.140","TCP","54","61013  >  443 [ACK] Seq=30210 Ack=112069 Win=1025 Len=0"
"301","3.619325","192.168.12.35","146.75.37.140","TCP","54","61013  >  443 [ACK] Seq=30210 Ack=113364 Win=1020 Len=0"
"302","3.627255","146.75.37.140","192.168.12.35","TLSv1.2","432","Application Data"
"303","3.627255","146.75.37.140","192.168.12.35","TLSv1.2","511","Application Data"
"304","3.628185","192.168.12.35","146.75.37.140","TCP","54","61013  >  443 [ACK] Seq=30210 Ack=113742 Win=1025 Len=0"
"305","3.628618","192.168.12.35","146.75.37.140","TCP","54","61013  >  443 [ACK] Seq=30210 Ack=114199 Win=1023 Len=0"
"306","3.632973","146.75.37.140","192.168.12.35","TLSv1.2","328","Application Data"
"307","3.634803","192.168.12.35","146.75.37.140","TLSv1.2","3242","Application Data"
"308","3.635061","192.168.12.35","146.75.37.140","TLSv1.2","3257","Application Data"
"309","3.635111","192.168.12.35","146.75.37.140","TLSv1.2","3234","Application Data"
"310","3.635187","192.168.12.35","146.75.37.140","TLSv1.2","3264","Application Data"
"311","3.635233","192.168.12.35","146.75.37.140","TLSv1.2","3242","Application Data"
"312","3.635276","192.168.12.35","146.75.37.140","TLSv1.2","3245","Application Data"
"313","3.635555","192.168.12.35","146.75.37.140","TLSv1.2","3246","Application Data"
"314","3.635686","192.168.12.35","146.75.37.140","TLSv1.2","3242","Application Data"
"315","3.635793","192.168.12.35","146.75.37.140","TLSv1.2","3245","Application Data"
"316","3.687083","146.75.37.140","192.168.12.35","TCP","54","443  >  61013 [ACK] Seq=114473 Ack=30210 Win=8244 Len=0"
"317","3.687083","146.75.37.140","192.168.12.35","TLSv1.2","484","Application Data"
"318","3.702532","146.75.37.140","192.168.12.35","TLSv1.2","244","Application Data"
"319","3.702532","146.75.37.140","192.168.12.35","TLSv1.2","102","Application Data"
"320","3.702532","146.75.37.140","192.168.12.35","TLSv1.2","103","Application Data"
"321","3.702532","146.75.37.140","192.168.12.35","TLSv1.2","807","Application Data"
"322","3.702532","146.75.37.140","192.168.12.35","TLSv1.2","1391","Application Data"
"323","3.702532","146.75.37.140","192.168.12.35","TLSv1.2","1335","Application Data"
"324","3.702532","146.75.37.140","192.168.12.35","TLSv1.2","1206","Application Data"
"325","3.702532","146.75.37.140","192.168.12.35","TLSv1.2","158","Application Data"
"326","3.702532","146.75.37.140","192.168.12.35","TLSv1.2","190","Application Data"
"327","3.702532","146.75.37.140","192.168.12.35","TLSv1.2","1093","Application Data"
"328","3.702532","146.75.37.140","192.168.12.35","TCP","1430","443  >  61013 [ACK] Seq=120992 Ack=30210 Win=8244 Len=1376 [TCP PDU reassembled in 329]"
"329","3.702532","146.75.37.140","192.168.12.35","TLSv1.2","906","Application Data"
"330","3.702532","146.75.37.140","192.168.12.35","TLSv1.2","231","Application Data"
"331","3.702532","146.75.37.140","192.168.12.35","TLSv1.2","417","Application Data"
"332","3.702532","146.75.37.140","192.168.12.35","TLSv1.2","100","Application Data"
"333","3.702532","146.75.37.140","192.168.12.35","TLSv1.2","229","Application Data"
"334","3.702532","146.75.37.140","192.168.12.35","TCP","54","443  >  61013 [ACK] Seq=123981 Ack=31606 Win=8244 Len=0"
"335","3.702532","146.75.37.140","192.168.12.35","TLSv1.2","165","Application Data"
"336","3.702532","146.75.37.140","192.168.12.35","TLSv1.2","368","Application Data"
"337","3.702532","146.75.37.140","192.168.12.35","TCP","54","443  >  61013 [ACK] Seq=124406 Ack=33002 Win=8244 Len=0"
"338","3.702532","146.75.37.140","192.168.12.35","TLSv1.2","256","Application Data"
"339","3.702532","146.75.37.140","192.168.12.35","TLSv1.2","412","Application Data"
"340","3.702532","146.75.37.140","192.168.12.35","TLSv1.2","345","Application Data"
"341","3.702532","146.75.37.140","192.168.12.35","TLSv1.2","131","Application Data"
"342","3.702532","146.75.37.140","192.168.12.35","TLSv1.2","653","Application Data"
"343","3.702532","146.75.37.140","192.168.12.35","TLSv1.2","194","Application Data"
"344","3.702532","146.75.37.140","192.168.12.35","TLSv1.2","230","Application Data"
"345","3.703852","192.168.12.35","146.75.37.140","TCP","54","61013  >  443 [ACK] Seq=58941 Ack=115093 Win=1019 Len=0"
"346","3.704070","146.75.37.140","192.168.12.35","TLSv1.2","310","Application Data"
"347","3.704070","146.75.37.140","192.168.12.35","TLSv1.2","219","Application Data"
"348","3.704070","146.75.37.140","192.168.12.35","TLSv1.2","286","Application Data"
"349","3.704070","146.75.37.140","192.168.12.35","TLSv1.2","282","Application Data"
"350","3.704070","146.75.37.140","192.168.12.35","TLSv1.2","424","Application Data"
"351","3.704070","146.75.37.140","192.168.12.35","TCP","54","443  >  61013 [ACK] Seq=127500 Ack=33398 Win=8244 Len=0"
"352","3.704335","192.168.12.35","146.75.37.140","TCP","54","61013  >  443 [ACK] Seq=58941 Ack=115141 Win=1025 Len=0"
"353","3.704332","192.168.12.35","146.75.37.140","TCP","54","61013  >  443 [ACK] Seq=58941 Ack=115190 Win=1024 Len=0"
"354","3.704428","192.168.12.35","146.75.37.140","TCP","54","61013  >  443 [ACK] Seq=58941 Ack=117280 Win=1025 Len=0"
"355","3.704489","192.168.12.35","146.75.37.140","TCP","54","61013  >  443 [ACK] Seq=58941 Ack=119713 Win=1025 Len=0"
"356","3.704535","192.168.12.35","146.75.37.140","TCP","54","61013  >  443 [ACK] Seq=58941 Ack=119953 Win=1024 Len=0"
"357","3.704714","192.168.12.35","146.75.37.140","TCP","54","61013  >  443 [ACK] Seq=58941 Ack=122368 Win=1025 Len=0"
"358","3.704762","192.168.12.35","146.75.37.140","TCP","54","61013  >  443 [ACK] Seq=58941 Ack=123397 Win=1021 Len=0"
"359","3.704803","192.168.12.35","146.75.37.140","TCP","54","61013  >  443 [ACK] Seq=58941 Ack=123806 Win=1025 Len=0"
"360","3.704871","192.168.12.35","146.75.37.140","TCP","54","61013  >  443 [ACK] Seq=58941 Ack=124092 Win=1024 Len=0"
"361","3.704931","192.168.12.35","146.75.37.140","TCP","54","61013  >  443 [ACK] Seq=58941 Ack=124608 Win=1022 Len=0"
"362","3.704984","192.168.12.35","146.75.37.140","TCP","54","61013  >  443 [ACK] Seq=58941 Ack=125257 Win=1025 Len=0"
"363","3.705036","192.168.12.35","146.75.37.140","TCP","54","61013  >  443 [ACK] Seq=58941 Ack=125933 Win=1022 Len=0"
"364","3.705082","192.168.12.35","146.75.37.140","TCP","54","61013  >  443 [ACK] Seq=58941 Ack=126249 Win=1021 Len=0"
"365","3.705141","192.168.12.35","146.75.37.140","TCP","54","61013  >  443 [ACK] Seq=58941 Ack=126670 Win=1025 Len=0"
"366","3.705231","192.168.12.35","146.75.37.140","TCP","54","61013  >  443 [ACK] Seq=58941 Ack=127130 Win=1023 Len=0"
"367","3.712347","146.75.37.140","192.168.12.35","TLSv1.2","149","Application Data"
"368","3.713112","192.168.12.35","146.75.37.140","TCP","54","61013  >  443 [ACK] Seq=58941 Ack=127595 Win=1021 Len=0"
"369","3.726387","146.75.37.140","192.168.12.35","TCP","54","443  >  61013 [ACK] Seq=127595 Ack=34794 Win=8244 Len=0"
