"No.","Time","Source","Destination","Protocol","Length","Info"
"1","0.000000","192.168.12.35","146.75.37.140","TLSv1.2","3241","Application Data"
"2","0.000258","192.168.12.35","146.75.37.140","TLSv1.2","93","Application Data"
"3","0.000341","192.168.12.35","146.75.37.140","TLSv1.2","3360","Application Data"
"4","0.000417","192.168.12.35","146.75.37.140","TLSv1.2","1359","Application Data"
"5","0.044052","146.75.37.140","192.168.12.35","TCP","54","443  >  61013 [ACK] Seq=1 Ack=1397 Win=8244 Len=0"
"6","0.052953","146.75.37.140","192.168.12.35","TCP","54","443  >  61013 [ACK] Seq=1 Ack=2793 Win=8244 Len=0"
"7","0.052953","146.75.37.140","192.168.12.35","TCP","54","443  >  61013 [ACK] Seq=1 Ack=3188 Win=8244 Len=0"
"8","0.052953","146.75.37.140","192.168.12.35","TCP","54","443  >  61013 [ACK] Seq=1 Ack=3227 Win=8244 Len=0"
"9","0.058583","146.75.37.140","192.168.12.35","TLSv1.2","93","Application Data"
"10","0.068459","192.168.12.35","146.75.37.140","TCP","55","61039  >  443 [ACK] Seq=1 Ack=1 Win=4095 Len=1"
"11","0.078329","146.75.37.140","192.168.12.35","TCP","54","443  >  61013 [ACK] Seq=40 Ack=4623 Win=8244 Len=0"
"12","0.082552","146.75.37.140","192.168.12.35","TCP","54","443  >  61013 [ACK] Seq=40 Ack=6019 Win=8244 Len=0"
"13","0.087611","146.75.37.140","192.168.12.35","TCP","54","443  >  61013 [ACK] Seq=40 Ack=6533 Win=8244 Len=0"
"14","0.099695","192.168.12.35","146.75.37.140","TCP","54","61013  >  443 [ACK] Seq=7838 Ack=40 Win=1024 Len=0"
"15","0.105839","146.75.37.140","192.168.12.35","TCP","1430","443  >  61013 [ACK] Seq=40 Ack=6533 Win=8244 Len=1376 [TCP PDU reassembled in 16]"
"16","0.105839","146.75.37.140","192.168.12.35","TLSv1.2","1074","Application Data"
"17","0.105839","146.75.37.140","192.168.12.35","TCP","1430","443  >  61013 [ACK] Seq=2436 Ack=6533 Win=8244 Len=1376 [TCP PDU reassembled in 18]"
"18","0.105839","146.75.37.140","192.168.12.35","TLSv1.2","1071","Application Data"
"19","0.105839","146.75.37.140","192.168.12.35","TCP","54","443  >  61013 [ACK] Seq=4829 Ack=7838 Win=8244 Len=0"
"20","0.105839","146.75.37.140","192.168.12.35","TCP","66","443  >  61039 [ACK] Seq=1 Ack=2 Win=424 Len=0 SLE=1 SRE=2"
"21","0.106633","192.168.12.35","146.75.37.140","TCP","54","61013  >  443 [ACK] Seq=7838 Ack=2436 Win=1025 Len=0"
"22","0.106888","192.168.12.35","146.75.37.140","TCP","54","61013  >  443 [ACK] Seq=7838 Ack=4829 Win=1025 Len=0"
"23","0.115375","192.168.12.35","146.75.37.140","TLSv1.2","89","Application Data"
"24","0.122907","146.75.37.140","192.168.12.35","TCP","1430","443  >  61013 [ACK] Seq=4829 Ack=7838 Win=8244 Len=1376 [TCP PDU reassembled in 34]"
"25","0.122907","146.75.37.140","192.168.12.35","TCP","1430","443  >  61013 [PSH, ACK] Seq=6205 Ack=7838 Win=8244 Len=1376 [TCP PDU reassembled in 34]"
"26","0.122907","146.75.37.140","192.168.12.35","TCP","1430","443  >  61013 [ACK] Seq=7581 Ack=7838 Win=8244 Len=1376 [TCP PDU reassembled in 34]"
"27","0.122907","146.75.37.140","192.168.12.35","TCP","1430","443  >  61013 [PSH, ACK] Seq=8957 Ack=7838 Win=8244 Len=1376 [TCP PDU reassembled in 34]"
"28","0.122907","146.75.37.140","192.168.12.35","TCP","1430","443  >  61013 [ACK] Seq=10333 Ack=7838 Win=8244 Len=1376 [TCP PDU reassembled in 34]"
"29","0.122907","146.75.37.140","192.168.12.35","TCP","1430","443  >  61013 [PSH, ACK] Seq=11709 Ack=7838 Win=8244 Len=1376 [TCP PDU reassembled in 34]"
"30","0.122907","146.75.37.140","192.168.12.35","TCP","1430","443  >  61013 [ACK] Seq=13085 Ack=7838 Win=8244 Len=1376 [TCP PDU reassembled in 34]"
"31","0.122907","146.75.37.140","192.168.12.35","TCP","1430","443  >  61013 [PSH, ACK] Seq=14461 Ack=7838 Win=8244 Len=1376 [TCP PDU reassembled in 34]"
"32","0.122907","146.75.37.140","192.168.12.35","TCP","1430","443  >  61013 [ACK] Seq=15837 Ack=7838 Win=8244 Len=1376 [TCP PDU reassembled in 34]"
"33","0.122907","146.75.37.140","192.168.12.35","TCP","1430","443  >  61013 [PSH, ACK] Seq=17213 Ack=7838 Win=8244 Len=1376 [TCP PDU reassembled in 34]"
"34","0.122907","146.75.37.140","192.168.12.35","TLSv1.2","1159","Application Data, Application Data"
"35","0.122907","146.75.37.140","192.168.12.35","TLSv1.2","90","Application Data"
"36","0.122907","146.75.37.140","192.168.12.35","TCP","1430","443  >  61013 [ACK] Seq=19730 Ack=7838 Win=8244 Len=1376 [TCP PDU reassembled in 50]"
"37","0.122907","146.75.37.140","192.168.12.35","TCP","1430","443  >  61013 [PSH, ACK] Seq=21106 Ack=7838 Win=8244 Len=1376 [TCP PDU reassembled in 50]"
"38","0.122907","146.75.37.140","192.168.12.35","TCP","1430","443  >  61013 [ACK] Seq=22482 Ack=7838 Win=8244 Len=1376 [TCP PDU reassembled in 50]"
"39","0.122907","146.75.37.140","192.168.12.35","TCP","1430","443  >  61013 [PSH, ACK] Seq=23858 Ack=7838 Win=8244 Len=1376 [TCP PDU reassembled in 50]"
"40","0.122907","146.75.37.140","192.168.12.35","TCP","1430","443  >  61013 [ACK] Seq=25234 Ack=7838 Win=8244 Len=1376 [TCP PDU reassembled in 50]"
"41","0.122907","146.75.37.140","192.168.12.35","TCP","1430","443  >  61013 [PSH, ACK] Seq=26610 Ack=7838 Win=8244 Len=1376 [TCP PDU reassembled in 50]"
"42","0.122907","146.75.37.140","192.168.12.35","TCP","1430","443  >  61013 [ACK] Seq=27986 Ack=7838 Win=8244 Len=1376 [TCP PDU reassembled in 50]"
"43","0.122907","146.75.37.140","192.168.12.35","TCP","1430","443  >  61013 [PSH, ACK] Seq=29362 Ack=7838 Win=8244 Len=1376 [TCP PDU reassembled in 50]"
"44","0.122907","146.75.37.140","192.168.12.35","TCP","1430","443  >  61013 [ACK] Seq=30738 Ack=7838 Win=8244 Len=1376 [TCP PDU reassembled in 50]"
"45","0.122907","146.75.37.140","192.168.12.35","TCP","1430","443  >  61013 [PSH, ACK] Seq=32114 Ack=7838 Win=8244 Len=1376 [TCP PDU reassembled in 50]"
"46","0.124078","192.168.12.35","146.75.37.140","TCP","54","61013  >  443 [ACK] Seq=7873 Ack=18589 Win=1025 Len=0"
"47","0.124300","192.168.12.35","146.75.37.140","TCP","54","61013  >  443 [ACK] Seq=7873 Ack=19730 Win=1020 Len=0"
"48","0.124367","192.168.12.35","146.75.37.140","TCP","54","61013  >  443 [ACK] Seq=7873 Ack=33490 Win=1025 Len=0"
"49","0.128882","146.75.37.140","192.168.12.35","TCP","1430","443  >  61013 [ACK] Seq=33490 Ack=7838 Win=8244 Len=1376 [TCP PDU reassembled in 50]"
"50","0.128882","146.75.37.140","192.168.12.35","TLSv1.2","1430","Application Data"
"51","0.128882","146.75.37.140","192.168.12.35","TCP","1430","443  >  61013 [ACK] Seq=36242 Ack=7838 Win=8244 Len=1376 [TCP PDU reassembled in 63]"
"52","0.128882","146.75.37.140","192.168.12.35","TCP","1430","443  >  61013 [PSH, ACK] Seq=37618 Ack=7838 Win=8244 Len=1376 [TCP PDU reassembled in 63]"
"53","0.128882","146.75.37.140","192.168.12.35","TCP","1430","443  >  61013 [ACK] Seq=38994 Ack=7838 Win=8244 Len=1376 [TCP PDU reassembled in 63]"
"54","0.128882","146.75.37.140","192.168.12.35","TCP","1430","443  >  61013 [PSH, ACK] Seq=40370 Ack=7838 Win=8244 Len=1376 [TCP PDU reassembled in 63]"
"55","0.128882","146.75.37.140","192.168.12.35","TCP","1430","443  >  61013 [ACK] Seq=41746 Ack=7838 Win=8244 Len=1376 [TCP PDU reassembled in 63]"
"56","0.128882","146.75.37.140","192.168.12.35","TCP","1430","443  >  61013 [PSH, ACK] Seq=43122 Ack=7838 Win=8244 Len=1376 [TCP PDU reassembled in 63]"
"57","0.129532","192.168.12.35","146.75.37.140","TCP","54","61013  >  443 [ACK] Seq=7873 Ack=44498 Win=1025 Len=0"
"58","0.131939","146.75.37.140","192.168.12.35","TCP","1430","443  >  61013 [ACK] Seq=44498 Ack=7838 Win=8244 Len=1376 [TCP PDU reassembled in 63]"
"59","0.131939","146.75.37.140","192.168.12.35","TCP","1430","443  >  61013 [PSH, ACK] Seq=45874 Ack=7838 Win=8244 Len=1376 [TCP PDU reassembled in 63]"
"60","0.131939","146.75.37.140","192.168.12.35","TCP","1430","443  >  61013 [ACK] Seq=47250 Ack=7838 Win=8244 Len=1376 [TCP PDU reassembled in 63]"
"61","0.131939","146.75.37.140","192.168.12.35","TCP","1430","443  >  61013 [PSH, ACK] Seq=48626 Ack=7838 Win=8244 Len=1376 [TCP PDU reassembled in 63]"
"62","0.131939","146.75.37.140","192.168.12.35","TCP","1430","443  >  61013 [ACK] Seq=50002 Ack=7838 Win=8244 Len=1376 [TCP PDU reassembled in 63]"
"63","0.131939","146.75.37.140","192.168.12.35","TLSv1.2","1430","Application Data, Application Data"
"64","0.131939","146.75.37.140","192.168.12.35","TLSv1.2","1430","Application Data"
"65","0.131939","146.75.37.140","192.168.12.35","TLSv1.2","1430","Application Data"
"66","0.131939","146.75.37.140","192.168.12.35","TLSv1.2","1430","Application Data"
"67","0.131939","146.75.37.140","192.168.12.35","TLSv1.2","430","Application Data"
"68","0.131939","146.75.37.140","192.168.12.35","TCP","1430","443  >  61013 [ACK] Seq=57258 Ack=7838 Win=8244 Len=1376 [TCP PDU reassembled in 71]"
"69","0.131939","146.75.37.140","192.168.12.35","TCP","1430","443  >  61013 [PSH, ACK] Seq=58634 Ack=7838 Win=8244 Len=1376 [TCP PDU reassembled in 71]"
"70","0.131939","146.75.37.140","192.168.12.35","TCP","1430","443  >  61013 [ACK] Seq=60010 Ack=7838 Win=8244 Len=1376 [TCP PDU reassembled in 71]"
"71","0.131939","146.75.37.140","192.168.12.35","TLSv1.2","1430","Application Data"
"72","0.132698","192.168.12.35","146.75.37.140","TCP","54","61013  >  443 [ACK] Seq=7873 Ack=56882 Win=1025 Len=0"
"73","0.132913","192.168.12.35","146.75.37.140","TCP","54","61013  >  443 [ACK] Seq=7873 Ack=57258 Win=1023 Len=0"
"74","0.132976","192.168.12.35","146.75.37.140","TCP","54","61013  >  443 [ACK] Seq=7873 Ack=62762 Win=1025 Len=0"
"75","0.139143","146.75.37.140","192.168.12.35","TLSv1.2","1430","Application Data"
"76","0.139143","146.75.37.140","192.168.12.35","TLSv1.2","1014","Application Data"
"77","0.139143","146.75.37.140","192.168.12.35","TLSv1.2","1430","Application Data"
"78","0.139143","146.75.37.140","192.168.12.35","TLSv1.2","530","Application Data, Application Data"
"79","0.139143","146.75.37.140","192.168.12.35","TLSv1.2","709","Application Data, Application Data"
"80","0.139143","146.75.37.140","192.168.12.35","TCP","1430","443  >  61013 [ACK] Seq=67605 Ack=7838 Win=8244 Len=1376 [TCP PDU reassembled in 81]"
"81","0.139143","146.75.37.140","192.168.12.35","TLSv1.2","502","Application Data"
"82","0.140343","192.168.12.35","146.75.37.140","TCP","54","61013  >  443 [ACK] Seq=7873 Ack=65098 Win=1025 Len=0"
"83","0.141037","192.168.12.35","146.75.37.140","TCP","54","61013  >  443 [ACK] Seq=7873 Ack=66950 Win=1025 Len=0"
"84","0.141270","192.168.12.35","146.75.37.140","TCP","54","61013  >  443 [ACK] Seq=7873 Ack=68981 Win=1025 Len=0"
"85","0.144876","146.75.37.140","192.168.12.35","TCP","54","443  >  61013 [ACK] Seq=69429 Ack=7873 Win=8244 Len=0"
"86","0.151349","192.168.12.35","146.75.37.140","UDP","96","50355  >  443 Len=54"
"87","0.193119","192.168.12.35","146.75.37.140","TCP","54","61013  >  443 [ACK] Seq=7873 Ack=69429 Win=1023 Len=0"
"88","0.222962","146.75.37.140","192.168.12.35","UDP","67","443  >  50355 Len=25"
"89","0.241327","192.168.12.35","146.75.37.140","UDP","84","50355  >  443 Len=42"
"90","0.241797","192.168.12.35","146.75.37.140","UDP","96","50355  >  443 Len=54"
"91","0.251211","146.75.37.140","192.168.12.35","UDP","67","443  >  50355 Len=25"
"92","0.272880","146.75.37.140","192.168.12.35","UDP","69","443  >  50355 Len=27"
"93","0.663396","146.75.37.140","192.168.12.35","TLSv1.2","564","Application Data"
"94","0.663396","146.75.37.140","192.168.12.35","TLSv1.2","133","Application Data"
"95","0.663396","146.75.37.140","192.168.12.35","TLSv1.2","399","Application Data"
"96","0.663396","146.75.37.140","192.168.12.35","TLSv1.2","191","Application Data"
"97","0.663396","146.75.37.140","192.168.12.35","TLSv1.2","227","Application Data"
"98","0.663396","146.75.37.140","192.168.12.35","TLSv1.2","154","Application Data"
"99","0.663396","146.75.37.140","192.168.12.35","TLSv1.2","227","Application Data"
"100","0.663396","146.75.37.140","192.168.12.35","TLSv1.2","115","Application Data"
"101","0.663396","146.75.37.140","192.168.12.35","TLSv1.2","772","Application Data"
"102","0.663396","146.75.37.140","192.168.12.35","TLSv1.2","156","Application Data"
"103","0.664009","192.168.12.35","146.75.37.140","TCP","54","61013  >  443 [ACK] Seq=7873 Ack=70018 Win=1021 Len=0"
"104","0.664090","192.168.12.35","146.75.37.140","TCP","54","61013  >  443 [ACK] Seq=7873 Ack=70500 Win=1025 Len=0"
"105","0.664189","192.168.12.35","146.75.37.140","TCP","54","61013  >  443 [ACK] Seq=7873 Ack=70773 Win=1024 Len=0"
"106","0.664240","192.168.12.35","146.75.37.140","TCP","54","61013  >  443 [ACK] Seq=7873 Ack=71007 Win=1023 Len=0"
"107","0.664413","192.168.12.35","146.75.37.140","TCP","54","61013  >  443 [ACK] Seq=7873 Ack=71827 Win=1020 Len=0"
"108","0.664918","146.75.37.140","192.168.12.35","TLSv1.2","152","Application Data"
"109","0.664918","146.75.37.140","192.168.12.35","TLSv1.2","427","Application Data"
"110","0.664918","146.75.37.140","192.168.12.35","TLSv1.2","185","Application Data"
"111","0.664918","146.75.37.140","192.168.12.35","TLSv1.2","961","Application Data"
"112","0.664918","146.75.37.140","192.168.12.35","TLSv1.2","733","Application Data"
"113","0.665677","192.168.12.35","146.75.37.140","TCP","54","61013  >  443 [ACK] Seq=7873 Ack=72298 Win=1025 Len=0"
"114","0.666403","192.168.12.35","146.75.37.140","TCP","54","61013  >  443 [ACK] Seq=7873 Ack=73336 Win=1021 Len=0"
"115","0.674242","146.75.37.140","192.168.12.35","TCP","1430","443  >  61013 [ACK] Seq=74015 Ack=7873 Win=8244 Len=1376 [TCP PDU reassembled in 116]"
"116","0.674242","146.75.37.140","192.168.12.35","TLSv1.2","1071","Application Data"
"117","0.674242","146.75.37.140","192.168.12.35","TLSv1.2","562","Application Data"
"118","0.674242","146.75.37.140","192.168.12.35","TLSv1.2","518","Application Data"
"119","0.674242","146.75.37.140","192.168.12.35","TCP","1430","443  >  61013 [ACK] Seq=77380 Ack=7873 Win=8244 Len=1376 [TCP PDU reassembled in 120]"
"120","0.674242","146.75.37.140","192.168.12.35","TLSv1.2","1043","Application Data"
"121","0.674242","146.75.37.140","192.168.12.35","TLSv1.2","836","Application Data"
"122","0.674242","146.75.37.140","192.168.12.35","TLSv1.2","855","Application Data"
"123","0.674242","146.75.37.140","192.168.12.35","TLSv1.2","977","Application Data"
"124","0.675420","192.168.12.35","146.75.37.140","TCP","54","61013  >  443 [ACK] Seq=7873 Ack=75391 Win=1025 Len=0"
"125","0.675825","146.75.37.140","192.168.12.35","TLSv1.2","431","Application Data"
"126","0.675825","146.75.37.140","192.168.12.35","TCP","1430","443  >  61013 [ACK] Seq=82628 Ack=7873 Win=8244 Len=1376 [TCP PDU reassembled in 127]"
"127","0.675825","146.75.37.140","192.168.12.35","TLSv1.2","131","Application Data"
"128","0.675825","146.75.37.140","192.168.12.35","TLSv1.2","585","Application Data"
"129","0.675825","146.75.37.140","192.168.12.35","TLSv1.2","1291","Application Data"
"130","0.675825","146.75.37.140","192.168.12.35","TLSv1.2","250","Application Data"
"131","0.675825","146.75.37.140","192.168.12.35","TLSv1.2","307","Application Data"
"132","0.675987","192.168.12.35","146.75.37.140","TCP","54","61013  >  443 [ACK] Seq=7873 Ack=76916 Win=1025 Len=0"
"133","0.675825","146.75.37.140","192.168.12.35","TLSv1.2","227","Application Data"
"134","0.675825","146.75.37.140","192.168.12.35","TLSv1.2","196","Application Data"
"135","0.675825","146.75.37.140","192.168.12.35","TLSv1.2","580","Application Data"
"136","0.676142","192.168.12.35","146.75.37.140","TCP","54","61013  >  443 [ACK] Seq=7873 Ack=78756 Win=1025 Len=0"
"137","0.676264","192.168.12.35","146.75.37.140","TCP","54","61013  >  443 [ACK] Seq=7873 Ack=80527 Win=1025 Len=0"
"138","0.676318","192.168.12.35","146.75.37.140","TCP","54","61013  >  443 [ACK] Seq=7873 Ack=82251 Win=1025 Len=0"
"139","0.676349","192.168.12.35","146.75.37.140","TCP","54","61013  >  443 [ACK] Seq=7873 Ack=84004 Win=1025 Len=0"
"140","0.676383","192.168.12.35","146.75.37.140","TCP","54","61013  >  443 [ACK] Seq=7873 Ack=84612 Win=1022 Len=0"
"141","0.676481","192.168.12.35","146.75.37.140","TCP","54","61013  >  443 [ACK] Seq=7873 Ack=86045 Win=1025 Len=0"
"142","0.676558","192.168.12.35","146.75.37.140","TCP","54","61013  >  443 [ACK] Seq=7873 Ack=86471 Win=1023 Len=0"
"143","0.676611","192.168.12.35","146.75.37.140","TCP","54","61013  >  443 [ACK] Seq=7873 Ack=87139 Win=1020 Len=0"
"144","0.682671","146.75.37.140","192.168.12.35","TLSv1.2","767","Application Data"
"145","0.682671","146.75.37.140","192.168.12.35","TLSv1.2","1305","Application Data"
"146","0.682671","146.75.37.140","192.168.12.35","TLSv1.2","129","Application Data"
"147","0.682671","146.75.37.140","192.168.12.35","TLSv1.2","176","Application Data"
"148","0.682671","146.75.37.140","192.168.12.35","TLSv1.2","1240","Application Data"
"149","0.682671","146.75.37.140","192.168.12.35","TLSv1.2","922","Application Data"
"150","0.682671","146.75.37.140","192.168.12.35","TLSv1.2","601","Application Data"
"151","0.683213","192.168.12.35","146.75.37.140","TCP","54","61013  >  443 [ACK] Seq=7873 Ack=89103 Win=1025 Len=0"
"152","0.683440","192.168.12.35","146.75.37.140","TCP","54","61013  >  443 [ACK] Seq=7873 Ack=89300 Win=1024 Len=0"
"153","0.683507","192.168.12.35","146.75.37.140","TCP","54","61013  >  443 [ACK] Seq=7873 Ack=91354 Win=1025 Len=0"
"154","0.688696","146.75.37.140","192.168.12.35","TLSv1.2","318","Application Data"
"155","0.688696","146.75.37.140","192.168.12.35","TLSv1.2","480","Application Data"
"156","0.688696","146.75.37.140","192.168.12.35","TLSv1.2","1340","Application Data"
"157","0.688696","146.75.37.140","192.168.12.35","TLSv1.2","657","Application Data"
"158","0.688696","146.75.37.140","192.168.12.35","TLSv1.2","85","Application Data"
"159","0.689185","192.168.12.35","146.75.37.140","TCP","54","61013  >  443 [ACK] Seq=7873 Ack=92165 Win=1022 Len=0"
"160","0.689353","192.168.12.35","146.75.37.140","TCP","54","61013  >  443 [ACK] Seq=7873 Ack=93877 Win=1025 Len=0"
"161","0.689388","192.168.12.35","146.75.37.140","TCP","54","61013  >  443 [ACK] Seq=7873 Ack=94511 Win=1022 Len=0"
"162","0.720712","192.168.12.35","146.75.37.140","TLSv1.2","201","Application Data"
"163","0.720782","192.168.12.35","146.75.37.140","TLSv1.2","93","Application Data"
"164","0.753348","146.75.37.140","192.168.12.35","TCP","54","443  >  61034 [ACK] Seq=1 Ack=148 Win=424 Len=0"
"165","0.764588","146.75.37.140","192.168.12.35","TCP","54","443  >  61034 [ACK] Seq=1 Ack=187 Win=424 Len=0"
"166","0.764588","146.75.37.140","192.168.12.35","TLSv1.2","93","Application Data"
"167","0.764588","146.75.37.140","192.168.12.35","TLSv1.2","181","Application Data"
"168","0.764588","146.75.37.140","192.168.12.35","TCP","1430","443  >  61034 [ACK] Seq=167 Ack=187 Win=424 Len=1376 [TCP PDU reassembled in 179]"
"169","0.764588","146.75.37.140","192.168.12.35","TCP","1430","443  >  61034 [ACK] Seq=1543 Ack=187 Win=424 Len=1376 [TCP PDU reassembled in 179]"
"170","0.764588","146.75.37.140","192.168.12.35","TCP","1430","443  >  61034 [ACK] Seq=2919 Ack=187 Win=424 Len=1376 [TCP PDU reassembled in 179]"
"171","0.764588","146.75.37.140","192.168.12.35","TCP","1430","443  >  61034 [ACK] Seq=4295 Ack=187 Win=424 Len=1376 [TCP PDU reassembled in 179]"
"172","0.764588","146.75.37.140","192.168.12.35","TCP","1430","443  >  61034 [ACK] Seq=5671 Ack=187 Win=424 Len=1376 [TCP PDU reassembled in 179]"
"173","0.764588","146.75.37.140","192.168.12.35","TCP","1430","443  >  61034 [ACK] Seq=7047 Ack=187 Win=424 Len=1376 [TCP PDU reassembled in 179]"
"174","0.764588","146.75.37.140","192.168.12.35","TCP","1430","443  >  61034 [ACK] Seq=8423 Ack=187 Win=424 Len=1376 [TCP PDU reassembled in 179]"
"175","0.764588","146.75.37.140","192.168.12.35","TCP","1430","443  >  61034 [ACK] Seq=9799 Ack=187 Win=424 Len=1376 [TCP PDU reassembled in 179]"
"176","0.764588","146.75.37.140","192.168.12.35","TCP","1430","443  >  61034 [ACK] Seq=11175 Ack=187 Win=424 Len=1376 [TCP PDU reassembled in 179]"
"177","0.764588","146.75.37.140","192.168.12.35","TCP","1430","443  >  61034 [ACK] Seq=12551 Ack=187 Win=424 Len=1376 [TCP PDU reassembled in 179]"
"178","0.764588","146.75.37.140","192.168.12.35","TCP","1430","443  >  61034 [ACK] Seq=13927 Ack=187 Win=424 Len=1376 [TCP PDU reassembled in 179]"
"179","0.764588","146.75.37.140","192.168.12.35","TLSv1.2","1430","Application Data"
"180","0.764588","146.75.37.140","192.168.12.35","TCP","1430","443  >  61034 [ACK] Seq=16679 Ack=187 Win=424 Len=1376 [TCP PDU reassembled in 189]"
"181","0.764588","146.75.37.140","192.168.12.35","TCP","1430","443  >  61034 [ACK] Seq=18055 Ack=187 Win=424 Len=1376 [TCP PDU reassembled in 189]"
"182","0.764588","146.75.37.140","192.168.12.35","TCP","1430","443  >  61034 [ACK] Seq=19431 Ack=187 Win=424 Len=1376 [TCP PDU reassembled in 189]"
"183","0.764588","146.75.37.140","192.168.12.35","TCP","1430","443  >  61034 [PSH, ACK] Seq=20807 Ack=187 Win=424 Len=1376 [TCP PDU reassembled in 189]"
"184","0.764588","146.75.37.140","192.168.12.35","TCP","1430","443  >  61034 [ACK] Seq=22183 Ack=187 Win=424 Len=1376 [TCP PDU reassembled in 189]"
"185","0.764588","146.75.37.140","192.168.12.35","TCP","1430","443  >  61034 [ACK] Seq=23559 Ack=187 Win=424 Len=1376 [TCP PDU reassembled in 189]"
"186","0.764588","146.75.37.140","192.168.12.35","TCP","1430","443  >  61034 [ACK] Seq=24935 Ack=187 Win=424 Len=1376 [TCP PDU reassembled in 189]"
"187","0.764588","146.75.37.140","192.168.12.35","TCP","1430","443  >  61034 [ACK] Seq=26311 Ack=187 Win=424 Len=1376 [TCP PDU reassembled in 189]"
"188","0.764588","146.75.37.140","192.168.12.35","TCP","1430","443  >  61034 [ACK] Seq=27687 Ack=187 Win=424 Len=1376 [TCP PDU reassembled in 189]"
"189","0.764588","146.75.37.140","192.168.12.35","TLSv1.2","1172","Application Data"
"190","0.765512","192.168.12.35","146.75.37.140","TCP","54","61034  >  443 [ACK] Seq=187 Ack=167 Win=8198 Len=0"
"191","0.765560","192.168.12.35","146.75.37.140","TLSv1.2","3183","Application Data"
"192","0.765624","192.168.12.35","146.75.37.140","TLSv1.2","718","Application Data"
"193","0.765682","192.168.12.35","146.75.37.140","TCP","54","61034  >  443 [ACK] Seq=187 Ack=29063 Win=8201 Len=0"
"194","0.765726","192.168.12.35","146.75.37.140","TCP","54","61034  >  443 [ACK] Seq=187 Ack=30181 Win=8197 Len=0"
"195","0.766786","192.168.12.35","146.75.37.140","TLSv1.2","3187","Application Data"
"196","0.767319","192.168.12.35","146.75.37.140","TLSv1.2","89","Application Data"
"197","0.803749","192.168.12.35","146.75.37.140","TLSv1.2","3196","Application Data"
"198","0.820104","146.75.37.140","192.168.12.35","TCP","54","443  >  61013 [ACK] Seq=94511 Ack=9269 Win=8244 Len=0"
"199","0.820104","146.75.37.140","192.168.12.35","TCP","54","443  >  61013 [ACK] Seq=94511 Ack=10665 Win=8244 Len=0"
"200","0.824467","146.75.37.140","192.168.12.35","TCP","54","443  >  61013 [ACK] Seq=94511 Ack=11002 Win=8244 Len=0"
"201","0.842779","146.75.37.140","192.168.12.35","TCP","54","443  >  61013 [ACK] Seq=94511 Ack=11666 Win=8244 Len=0"
"202","0.852599","146.75.37.140","192.168.12.35","TCP","54","443  >  61013 [ACK] Seq=94511 Ack=13062 Win=8244 Len=0"
"203","0.862375","146.75.37.140","192.168.12.35","TCP","1430","443  >  61013 [ACK] Seq=94511 Ack=13062 Win=8244 Len=1376 [TCP PDU reassembled in 204]"
"204","0.862375","146.75.37.140","192.168.12.35","TLSv1.2","777","Application Data"
"205","0.862914","192.168.12.35","146.75.37.140","TCP","54","61013  >  443 [ACK] Seq=17941 Ack=95887 Win=1025 Len=0"
"206","0.863099","192.168.12.35","146.75.37.140","TCP","54","61013  >  443 [ACK] Seq=17941 Ack=96610 Win=1022 Len=0"
"207","0.867699","146.75.37.140","192.168.12.35","TCP","54","443  >  61013 [ACK] Seq=96610 Ack=14458 Win=8244 Len=0"
"208","0.872634","146.75.37.140","192.168.12.35","TCP","54","443  >  61013 [ACK] Seq=96610 Ack=14799 Win=8244 Len=0"
"209","0.872634","146.75.37.140","192.168.12.35","TCP","54","443  >  61034 [ACK] Seq=30181 Ack=222 Win=424 Len=0"
"210","0.887973","146.75.37.140","192.168.12.35","TCP","54","443  >  61013 [ACK] Seq=96610 Ack=16195 Win=8244 Len=0"
"211","0.923705","146.75.37.140","192.168.12.35","TCP","1430","443  >  61013 [ACK] Seq=96610 Ack=16195 Win=8244 Len=1376 [TCP PDU reassembled in 212]"
"212","0.923705","146.75.37.140","192.168.12.35","TLSv1.2","483","Application Data"
"213","0.923705","146.75.37.140","192.168.12.35","TCP","54","443  >  61013 [ACK] Seq=98415 Ack=17591 Win=8244 Len=0"
"214","0.923705","146.75.37.140","192.168.12.35","TCP","54","443  >  61013 [ACK] Seq=98415 Ack=17941 Win=8244 Len=0"
"215","0.924270","192.168.12.35","146.75.37.140","TCP","54","61013  >  443 [ACK] Seq=17941 Ack=98415 Win=1025 Len=0"
"216","0.927871","192.168.12.35","146.75.37.140","TLSv1.2","3176","Application Data"
"217","0.928239","192.168.12.35","146.75.37.140","TLSv1.2","210","Application Data"
"218","0.937257","146.75.37.140","192.168.12.35","TCP","1430","443  >  61013 [ACK] Seq=98415 Ack=17941 Win=8244 Len=1376 [TCP PDU reassembled in 219]"
"219","0.937257","146.75.37.140","192.168.12.35","TLSv1.2","870","Application Data"
"220","0.937257","146.75.37.140","192.168.12.35","TLSv1.2","100","Application Data"
"221","0.937657","192.168.12.35","146.75.37.140","TCP","54","61013  >  443 [ACK] Seq=21219 Ack=100607 Win=1025 Len=0"
"222","0.973938","146.75.37.140","192.168.12.35","TCP","54","443  >  61013 [ACK] Seq=100653 Ack=19337 Win=8244 Len=0"
"223","0.987443","146.75.37.140","192.168.12.35","TLSv1.2","604","Application Data"
"224","0.987954","192.168.12.35","146.75.37.140","TCP","54","61013  >  443 [ACK] Seq=21219 Ack=101203 Win=1022 Len=0"
"225","0.992717","146.75.37.140","192.168.12.35","TCP","54","443  >  61013 [ACK] Seq=101203 Ack=20733 Win=8244 Len=0"
"226","0.992717","146.75.37.140","192.168.12.35","TCP","54","443  >  61013 [ACK] Seq=101203 Ack=21063 Win=8244 Len=0"
"227","0.992717","146.75.37.140","192.168.12.35","TCP","54","443  >  61013 [ACK] Seq=101203 Ack=21219 Win=8244 Len=0"
"228","1.063590","146.75.37.140","192.168.12.35","TCP","1430","443  >  61013 [ACK] Seq=101203 Ack=21219 Win=8244 Len=1376 [TCP PDU reassembled in 229]"
"229","1.063590","146.75.37.140","192.168.12.35","TLSv1.2","608","Application Data"
"230","1.064338","192.168.12.35","146.75.37.140","TCP","54","61013  >  443 [ACK] Seq=21219 Ack=103133 Win=1025 Len=0"
"231","1.070508","192.168.12.35","146.75.37.140","TLSv1.2","3290","Application Data"
"232","1.089313","192.168.12.35","146.75.37.140","TLSv1.2","3195","Application Data"
"233","1.089642","192.168.12.35","146.75.37.140","TLSv1.2","3210","Application Data"
"234","1.089692","192.168.12.35","146.75.37.140","TLSv1.2","3187","Application Data"
"235","1.145226","146.75.37.140","192.168.12.35","TCP","54","443  >  61013 [ACK] Seq=103133 Ack=22615 Win=8244 Len=0"
"236","1.145226","146.75.37.140","192.168.12.35","TCP","54","443  >  61013 [ACK] Seq=103133 Ack=24011 Win=8244 Len=0"
"237","1.160397","146.75.37.140","192.168.12.35","TCP","54","443  >  61013 [ACK] Seq=103133 Ack=24455 Win=8244 Len=0"
"238","1.176031","146.75.37.140","192.168.12.35","TCP","54","443  >  61013 [ACK] Seq=103133 Ack=25851 Win=8244 Len=0"
"239","1.195143","146.75.37.140","192.168.12.35","TCP","54","443  >  61013 [ACK] Seq=103133 Ack=27596 Win=8244 Len=0"
"240","1.207624","146.75.37.140","192.168.12.35","TCP","1430","443  >  61013 [ACK] Seq=103133 Ack=28992 Win=8244 Len=1376 [TCP PDU reassembled in 241]"
"241","1.207624","146.75.37.140","192.168.12.35","TLSv1.2","898","Application Data"
"242","1.208902","192.168.12.35","146.75.37.140","TCP","54","61013  >  443 [ACK] Seq=33885 Ack=105353 Win=1025 Len=0"
"243","1.223883","146.75.37.140","192.168.12.35","TCP","1430","443  >  61013 [ACK] Seq=105353 Ack=30388 Win=8244 Len=1376 [TCP PDU reassembled in 244]"
"244","1.223883","146.75.37.140","192.168.12.35","TLSv1.2","462","Application Data"
"245","1.223883","146.75.37.140","192.168.12.35","TLSv1.2","100","Application Data"
"246","1.223883","146.75.37.140","192.168.12.35","TCP","54","443  >  61013 [ACK] Seq=107183 Ack=30752 Win=8244 Len=0"
"247","1.224605","192.168.12.35","146.75.37.140","TCP","54","61013  >  443 [ACK] Seq=33885 Ack=107137 Win=1025 Len=0"
"248","1.239883","146.75.37.140","192.168.12.35","TCP","54","443  >  61013 [ACK] Seq=107183 Ack=32148 Win=8244 Len=0"
"249","1.255588","146.75.37.140","192.168.12.35","TCP","1430","443  >  61013 [ACK] Seq=107183 Ack=32148 Win=8244 Len=1376 [TCP PDU reassembled in 250]"
"250","1.255588","146.75.37.140","192.168.12.35","TLSv1.2","847","Application Data"
"251","1.255588","146.75.37.140","192.168.12.35","TLSv1.2","100","Application Data"
"252","1.255588","146.75.37.140","192.168.12.35","TCP","54","443  >  61013 [ACK] Seq=109398 Ack=33885 Win=8244 Len=0"
"253","1.256017","192.168.12.35","146.75.37.140","TCP","54","61013  >  443 [ACK] Seq=33885 Ack=108559 Win=1025 Len=0"
"254","1.256254","192.168.12.35","146.75.37.140","TCP","54","61013  >  443 [ACK] Seq=33885 Ack=109398 Win=1021 Len=0"
"255","1.270478","146.75.37.140","192.168.12.35","TLSv1.2","1034","Application Data"
"256","1.286014","146.75.37.140","192.168.12.35","TCP","1430","443  >  61013 [ACK] Seq=110378 Ack=33885 Win=8244 Len=1376 [TCP PDU reassembled in 257]"
"257","1.286014","146.75.37.140","192.168.12.35","TLSv1.2","464","Application Data"
"258","1.286014","146.75.37.140","192.168.12.35","TLSv1.2","100","Application Data"
"259","1.286567","192.168.12.35","146.75.37.140","TCP","54","61013  >  443 [ACK] Seq=33885 Ack=111754 Win=1025 Len=0"
"260","1.286820","192.168.12.35","146.75.37.140","TCP","54","61013  >  443 [ACK] Seq=33885 Ack=112210 Win=1023 Len=0"
"261","1.303470","146.75.37.140","192.168.12.35","TLSv1.2","947","Application Data"
"262","1.303470","146.75.37.140","192.168.12.35","TLSv1.2","95","Application Data"
"263","1.303470","146.75.37.140","192.168.12.35","TLSv1.2","85","Application Data"
"264","1.303697","192.168.12.35","146.75.37.140","TCP","54","61013  >  443 [ACK] Seq=33885 Ack=113144 Win=1019 Len=0"
"265","1.304142","192.168.12.35","146.75.37.140","TLSv1.2","3174","Application Data"
"266","1.304172","192.168.12.35","146.75.37.140","TLSv1.2","134","Application Data"
"267","1.336803","146.75.37.140","192.168.12.35","TCP","1430","443  >  61013 [ACK] Seq=113175 Ack=33885 Win=8244 Len=1376 [TCP PDU reassembled in 268]"
"268","1.336803","146.75.37.140","192.168.12.35","TLSv1.2","112","Application Data"
"269","1.336803","146.75.37.140","192.168.12.35","TLSv1.2","610","Application Data"
"270","1.338040","192.168.12.35","146.75.37.140","TCP","54","61013  >  443 [ACK] Seq=37085 Ack=114609 Win=1025 Len=0"
"271","1.338620","146.75.37.140","192.168.12.35","TLSv1.2","367","Application Data"
"272","1.338850","192.168.12.35","146.75.37.140","TCP","54","61013  >  443 [ACK] Seq=37085 Ack=115478 Win=1021 Len=0"
"273","1.348082","146.75.37.140","192.168.12.35","TCP","54","443  >  61013 [ACK] Seq=115478 Ack=35281 Win=8244 Len=0"
"274","1.360727","192.168.12.35","146.75.37.140","TLSv1.2","3144","Application Data"
"275","1.364702","146.75.37.140","192.168.12.35","TCP","54","443  >  61013 [ACK] Seq=115478 Ack=37005 Win=8244 Len=0"
"276","1.364702","146.75.37.140","192.168.12.35","TCP","54","443  >  61013 [ACK] Seq=115478 Ack=37085 Win=8244 Len=0"
"277","1.394617","146.75.37.140","192.168.12.35","TCP","1430","443  >  61013 [ACK] Seq=115478 Ack=37085 Win=8244 Len=1376 [TCP PDU reassembled in 278]"
"278","1.394617","146.75.37.140","192.168.12.35","TLSv1.2","797","Application Data"
"279","1.394617","146.75.37.140","192.168.12.35","TLSv1.2","1108","Application Data"
"280","1.395544","192.168.12.35","146.75.37.140","TCP","54","61013  >  443 [ACK] Seq=40175 Ack=116854 Win=1025 Len=0"
"281","1.395993","192.168.12.35","146.75.37.140","TCP","54","61013  >  443 [ACK] Seq=40175 Ack=117597 Win=1022 Len=0"
"282","1.396100","192.168.12.35","146.75.37.140","TCP","54","61013  >  443 [ACK] Seq=40175 Ack=118651 Win=1025 Len=0"
"283","1.412905","146.75.37.140","192.168.12.35","TCP","54","443  >  61013 [ACK] Seq=118651 Ack=38481 Win=8244 Len=0"
"284","1.422532","146.75.37.140","192.168.12.35","TCP","54","443  >  61013 [ACK] Seq=118651 Ack=40175 Win=8244 Len=0"
"285","1.448726","146.75.37.140","192.168.12.35","TCP","1430","443  >  61013 [ACK] Seq=118651 Ack=40175 Win=8244 Len=1376 [TCP PDU reassembled in 286]"
"286","1.448726","146.75.37.140","192.168.12.35","TLSv1.2","477","Application Data"
"287","1.449650","192.168.12.35","146.75.37.140","TCP","54","61013  >  443 [ACK] Seq=40175 Ack=120450 Win=1025 Len=0"
"288","2.019747","146.75.37.140","192.168.12.35","TLSv1.2","251","Application Data"
"289","2.019747","146.75.37.140","192.168.12.35","TLSv1.2","173","Application Data"
"290","2.020411","192.168.12.35","146.75.37.140","TCP","54","61013  >  443 [ACK] Seq=40175 Ack=120766 Win=1023 Len=0"
"291","2.027450","146.75.37.140","192.168.12.35","TLSv1.2","1101","Application Data"
"292","2.027450","146.75.37.140","192.168.12.35","TLSv1.2","815","Application Data"
"293","2.027450","146.75.37.140","192.168.12.35","TLSv1.2","511","Application Data"
"294","2.027778","192.168.12.35","146.75.37.140","TCP","54","61013  >  443 [ACK] Seq=40175 Ack=122574 Win=1025 Len=0"
"295","2.030657","146.75.37.140","192.168.12.35","TLSv1.2","1072","Application Data"
"296","2.030657","146.75.37.140","192.168.12.35","TLSv1.2","650","Application Data"
"297","2.030657","146.75.37.140","192.168.12.35","TLSv1.2","480","Application Data"
"298","2.030657","146.75.37.140","192.168.12.35","TLSv1.2","866","Application Data"
"299","2.030657","146.75.37.140","192.168.12.35","TLSv1.2","811","Application Data"
"300","2.030657","146.75.37.140","192.168.12.35","TLSv1.2","981","Application Data"
"301","2.030657","146.75.37.140","192.168.12.35","TLSv1.2","276","Application Data"
"302","2.030657","146.75.37.140","192.168.12.35","TLSv1.2","368","Application Data"
"303","2.030657","146.75.37.140","192.168.12.35","TLSv1.2","381","Application Data, Application Data"
"304","2.030657","146.75.37.140","192.168.12.35","TLSv1.2","389","Application Data"
"305","2.030657","146.75.37.140","192.168.12.35","TLSv1.2","145","Application Data"
"306","2.031046","192.168.12.35","146.75.37.140","TCP","54","61013  >  443 [ACK] Seq=40175 Ack=124049 Win=1025 Len=0"
"307","2.031183","192.168.12.35","146.75.37.140","TCP","54","61013  >  443 [ACK] Seq=40175 Ack=125071 Win=1021 Len=0"
"308","2.031261","192.168.12.35","146.75.37.140","TCP","54","61013  >  443 [ACK] Seq=40175 Ack=126640 Win=1025 Len=0"
"309","2.031325","192.168.12.35","146.75.37.140","TCP","54","61013  >  443 [ACK] Seq=40175 Ack=127789 Win=1020 Len=0"
"310","2.031398","192.168.12.35","146.75.37.140","TCP","54","61013  >  443 [ACK] Seq=40175 Ack=128430 Win=1025 Len=0"
"311","2.031454","192.168.12.35","146.75.37.140","TCP","54","61013  >  443 [ACK] Seq=40175 Ack=128856 Win=1023 Len=0"
"312","2.050011","146.75.37.140","192.168.12.35","TLSv1.2","472","Application Data"
"313","2.050011","146.75.37.140","192.168.12.35","TLSv1.2","641","Application Data"
"314","2.050741","192.168.12.35","146.75.37.140","TCP","54","61013  >  443 [ACK] Seq=40175 Ack=129861 Win=1025 Len=0"
"315","2.054281","146.75.37.140","192.168.12.35","TLSv1.2","671","Application Data"
"316","2.054281","146.75.37.140","192.168.12.35","TLSv1.2","380","Application Data"
"317","2.054281","146.75.37.140","192.168.12.35","TLSv1.2","374","Application Data"
"318","2.054612","192.168.12.35","146.75.37.140","TCP","54","61013  >  443 [ACK] Seq=40175 Ack=130804 Win=1021 Len=0"
"319","2.065150","146.75.37.140","192.168.12.35","TLSv1.2","254","Application Data"
"320","2.065311","192.168.12.35","146.75.37.140","TCP","54","61013  >  443 [ACK] Seq=40175 Ack=131324 Win=1025 Len=0"
"321","2.079503","146.75.37.140","192.168.12.35","TLSv1.2","183","Application Data"
"322","2.079503","146.75.37.140","192.168.12.35","TLSv1.2","885","Application Data"
"323","2.079503","146.75.37.140","192.168.12.35","TLSv1.2","318","Application Data"
"324","2.079503","146.75.37.140","192.168.12.35","TLSv1.2","302","Application Data"
"325","2.079503","146.75.37.140","192.168.12.35","TLSv1.2","267","Application Data"
"326","2.079503","146.75.37.140","192.168.12.35","TLSv1.2","520","Application Data"
"327","2.079503","146.75.37.140","192.168.12.35","TLSv1.2","124","Application Data"
"328","2.079503","146.75.37.140","192.168.12.35","TLSv1.2","191","Application Data"
"329","2.079503","146.75.37.140","192.168.12.35","TLSv1.2","303","Application Data"
"330","2.079503","146.75.37.140","192.168.12.35","TLSv1.2","424","Application Data"
"331","2.079503","146.75.37.140","192.168.12.35","TLSv1.2","597","Application Data"
"332","2.079503","146.75.37.140","192.168.12.35","TLSv1.2","293","Application Data"
"333","2.079503","146.75.37.140","192.168.12.35","TLSv1.2","197","Application Data"
"334","2.079503","146.75.37.140","192.168.12.35","TLSv1.2","312","Application Data"
"335","2.079503","146.75.37.140","192.168.12.35","TLSv1.2","279","Application Data"
"336","2.079503","146.75.37.140","192.168.12.35","TLSv1.2","699","Application Data"
"337","2.080177","192.168.12.35","146.75.37.140","TCP","54","61013  >  443 [ACK] Seq=40175 Ack=132284 Win=1021 Len=0"
"338","2.080501","192.168.12.35","146.75.37.140","TCP","54","61013  >  443 [ACK] Seq=40175 Ack=132796 Win=1025 Len=0"
"339","2.080560","192.168.12.35","146.75.37.140","TCP","54","61013  >  443 [ACK] Seq=40175 Ack=133475 Win=1022 Len=0"
"340","2.080607","192.168.12.35","146.75.37.140","TCP","54","61013  >  443 [ACK] Seq=40175 Ack=133682 Win=1021 Len=0"
"341","2.080664","192.168.12.35","146.75.37.140","TCP","54","61013  >  443 [ACK] Seq=40175 Ack=134301 Win=1025 Len=0"
"342","2.080713","192.168.12.35","146.75.37.140","TCP","54","61013  >  443 [ACK] Seq=40175 Ack=135083 Win=1022 Len=0"
"343","2.080755","192.168.12.35","146.75.37.140","TCP","54","61013  >  443 [ACK] Seq=40175 Ack=135484 Win=1020 Len=0"
"344","2.080790","192.168.12.35","146.75.37.140","TCP","54","61013  >  443 [ACK] Seq=40175 Ack=136354 Win=1025 Len=0"
"345","2.102622","146.75.37.140","192.168.12.35","TLSv1.2","311","Application Data"
"346","2.107617","146.75.37.140","192.168.12.35","TLSv1.2","313","Application Data"
"347","2.107617","146.75.37.140","192.168.12.35","TLSv1.2","263","Application Data"
"348","2.107617","146.75.37.140","192.168.12.35","TLSv1.2","274","Application Data"
"349","2.107617","146.75.37.140","192.168.12.35","TLSv1.2","775","Application Data"
"350","2.107617","146.75.37.140","192.168.12.35","TLSv1.2","248","Application Data"
"351","2.107617","146.75.37.140","192.168.12.35","TLSv1.2","166","Application Data"
"352","2.107617","146.75.37.140","192.168.12.35","TLSv1.2","459","Application Data"
"353","2.108569","192.168.12.35","146.75.37.140","TCP","54","61013  >  443 [ACK] Seq=40175 Ack=136870 Win=1023 Len=0"
"354","2.109039","192.168.12.35","146.75.37.140","TCP","54","61013  >  443 [ACK] Seq=40175 Ack=137299 Win=1021 Len=0"
"355","2.109144","192.168.12.35","146.75.37.140","TCP","54","61013  >  443 [ACK] Seq=40175 Ack=138214 Win=1025 Len=0"
"356","2.109209","192.168.12.35","146.75.37.140","TCP","54","61013  >  443 [ACK] Seq=40175 Ack=138731 Win=1023 Len=0"
"357","2.112779","146.75.37.140","192.168.12.35","TLSv1.2","237","Application Data"
"358","2.112779","146.75.37.140","192.168.12.35","TLSv1.2","217","Application Data"
"359","2.113145","192.168.12.35","146.75.37.140","TCP","54","61013  >  443 [ACK] Seq=40175 Ack=139077 Win=1021 Len=0"
"360","2.138721","146.75.37.140","192.168.12.35","TLSv1.2","179","Application Data"
"361","2.138721","146.75.37.140","192.168.12.35","TLSv1.2","318","Application Data"
"362","2.138721","146.75.37.140","192.168.12.35","TLSv1.2","232","Application Data"
"363","2.138721","146.75.37.140","192.168.12.35","TCP","1430","443  >  61013 [ACK] Seq=139644 Ack=40175 Win=8244 Len=1376 [TCP PDU reassembled in 364]"
"364","2.138721","146.75.37.140","192.168.12.35","TLSv1.2","416","Application Data"
"365","2.138721","146.75.37.140","192.168.12.35","TLSv1.2","389","Application Data"
"366","2.138721","146.75.37.140","192.168.12.35","TLSv1.2","478","Application Data, Application Data"
"367","2.138721","146.75.37.140","192.168.12.35","TLSv1.2","608","Application Data"
"368","2.138721","146.75.37.140","192.168.12.35","TLSv1.2","358","Application Data"
"369","2.138721","146.75.37.140","192.168.12.35","TLSv1.2","416","Application Data"
