"No.","Time","Source","Destination","Protocol","Length","Info"
"1","0.000000","192.168.12.35","146.75.37.140","TLSv1.2","163","Application Data"
"2","0.000449","192.168.12.35","146.75.37.140","TLSv1.2","152","Application Data"
"3","0.024901","146.75.37.140","192.168.12.35","TCP","54","443  >  61140 [ACK] Seq=1 Ack=110 Win=424 Len=0"
"4","0.024901","146.75.37.140","192.168.12.35","TLSv1.2","165","Application Data"
"5","0.024901","146.75.37.140","192.168.12.35","TCP","1430","443  >  61140 [ACK] Seq=112 Ack=110 Win=424 Len=1376 [TCP PDU reassembled in 16]"
"6","0.024901","146.75.37.140","192.168.12.35","TCP","1430","443  >  61140 [ACK] Seq=1488 Ack=110 Win=424 Len=1376 [TCP PDU reassembled in 16]"
"7","0.024901","146.75.37.140","192.168.12.35","TCP","1430","443  >  61140 [ACK] Seq=2864 Ack=110 Win=424 Len=1376 [TCP PDU reassembled in 16]"
"8","0.024901","146.75.37.140","192.168.12.35","TCP","1430","443  >  61140 [ACK] Seq=4240 Ack=110 Win=424 Len=1376 [TCP PDU reassembled in 16]"
"9","0.024901","146.75.37.140","192.168.12.35","TCP","1430","443  >  61140 [ACK] Seq=5616 Ack=110 Win=424 Len=1376 [TCP PDU reassembled in 16]"
"10","0.024901","146.75.37.140","192.168.12.35","TCP","1430","443  >  61140 [ACK] Seq=6992 Ack=110 Win=424 Len=1376 [TCP PDU reassembled in 16]"
"11","0.024901","146.75.37.140","192.168.12.35","TCP","1430","443  >  61140 [ACK] Seq=8368 Ack=110 Win=424 Len=1376 [TCP PDU reassembled in 16]"
"12","0.024901","146.75.37.140","192.168.12.35","TCP","1430","443  >  61140 [ACK] Seq=9744 Ack=110 Win=424 Len=1376 [TCP PDU reassembled in 16]"
"13","0.024901","146.75.37.140","192.168.12.35","TCP","1430","443  >  61140 [ACK] Seq=11120 Ack=110 Win=424 Len=1376 [TCP PDU reassembled in 16]"
"14","0.024901","146.75.37.140","192.168.12.35","TCP","1430","443  >  61140 [ACK] Seq=12496 Ack=110 Win=424 Len=1376 [TCP PDU reassembled in 16]"
"15","0.024901","146.75.37.140","192.168.12.35","TCP","1430","443  >  61140 [ACK] Seq=13872 Ack=110 Win=424 Len=1376 [TCP PDU reassembled in 16]"
"16","0.024901","146.75.37.140","192.168.12.35","TLSv1.2","1430","Application Data"
"17","0.024901","146.75.37.140","192.168.12.35","TCP","1430","443  >  61140 [ACK] Seq=16624 Ack=110 Win=424 Len=1376 [TCP PDU reassembled in 29]"
"18","0.024901","146.75.37.140","192.168.12.35","TCP","1430","443  >  61140 [PSH, ACK] Seq=18000 Ack=110 Win=424 Len=1376 [TCP PDU reassembled in 29]"
"19","0.024901","146.75.37.140","192.168.12.35","TCP","1430","443  >  61140 [ACK] Seq=19376 Ack=110 Win=424 Len=1376 [TCP PDU reassembled in 29]"
"20","0.024901","146.75.37.140","192.168.12.35","TCP","1430","443  >  61140 [ACK] Seq=20752 Ack=110 Win=424 Len=1376 [TCP PDU reassembled in 29]"
"21","0.024901","146.75.37.140","192.168.12.35","TCP","1430","443  >  61140 [ACK] Seq=22128 Ack=110 Win=424 Len=1376 [TCP PDU reassembled in 29]"
"22","0.024901","146.75.37.140","192.168.12.35","TCP","1430","443  >  61140 [ACK] Seq=23504 Ack=110 Win=424 Len=1376 [TCP PDU reassembled in 29]"
"23","0.024901","146.75.37.140","192.168.12.35","TCP","1430","443  >  61140 [ACK] Seq=24880 Ack=110 Win=424 Len=1376 [TCP PDU reassembled in 29]"
"24","0.025326","192.168.12.35","146.75.37.140","TCP","54","61140  >  443 [ACK] Seq=208 Ack=26256 Win=4100 Len=0"
"25","0.034542","146.75.37.140","192.168.12.35","TCP","1430","443  >  61140 [ACK] Seq=26256 Ack=110 Win=424 Len=1376 [TCP PDU reassembled in 29]"
"26","0.034542","146.75.37.140","192.168.12.35","TCP","1430","443  >  61140 [ACK] Seq=27632 Ack=110 Win=424 Len=1376 [TCP PDU reassembled in 29]"
"27","0.034542","146.75.37.140","192.168.12.35","TCP","1430","443  >  61140 [ACK] Seq=29008 Ack=110 Win=424 Len=1376 [TCP PDU reassembled in 29]"
"28","0.034542","146.75.37.140","192.168.12.35","TCP","1430","443  >  61140 [ACK] Seq=30384 Ack=110 Win=424 Len=1376 [TCP PDU reassembled in 29]"
"29","0.034542","146.75.37.140","192.168.12.35","TLSv1.2","1430","Application Data"
"30","0.034542","146.75.37.140","192.168.12.35","TCP","1430","443  >  61140 [ACK] Seq=33136 Ack=110 Win=424 Len=1376 [TCP PDU reassembled in 42]"
"31","0.034542","146.75.37.140","192.168.12.35","TCP","1430","443  >  61140 [ACK] Seq=34512 Ack=110 Win=424 Len=1376 [TCP PDU reassembled in 42]"
"32","0.034542","146.75.37.140","192.168.12.35","TCP","1430","443  >  61140 [ACK] Seq=35888 Ack=110 Win=424 Len=1376 [TCP PDU reassembled in 42]"
"33","0.034542","146.75.37.140","192.168.12.35","TCP","1430","443  >  61140 [PSH, ACK] Seq=37264 Ack=110 Win=424 Len=1376 [TCP PDU reassembled in 42]"
"34","0.034764","192.168.12.35","146.75.37.140","TCP","54","61140  >  443 [ACK] Seq=208 Ack=38640 Win=4100 Len=0"
"35","0.035818","146.75.37.140","192.168.12.35","TCP","1430","443  >  61140 [ACK] Seq=38640 Ack=110 Win=424 Len=1376 [TCP PDU reassembled in 42]"
"36","0.035818","146.75.37.140","192.168.12.35","TCP","1430","443  >  61140 [ACK] Seq=40016 Ack=110 Win=424 Len=1376 [TCP PDU reassembled in 42]"
"37","0.035818","146.75.37.140","192.168.12.35","TCP","1430","443  >  61140 [ACK] Seq=41392 Ack=110 Win=424 Len=1376 [TCP PDU reassembled in 42]"
"38","0.035818","146.75.37.140","192.168.12.35","TCP","1430","443  >  61140 [ACK] Seq=42768 Ack=110 Win=424 Len=1376 [TCP PDU reassembled in 42]"
"39","0.035818","146.75.37.140","192.168.12.35","TCP","1430","443  >  61140 [ACK] Seq=44144 Ack=110 Win=424 Len=1376 [TCP PDU reassembled in 42]"
"40","0.035818","146.75.37.140","192.168.12.35","TCP","1430","443  >  61140 [ACK] Seq=45520 Ack=110 Win=424 Len=1376 [TCP PDU reassembled in 42]"
"41","0.035818","146.75.37.140","192.168.12.35","TCP","1430","443  >  61140 [ACK] Seq=46896 Ack=110 Win=424 Len=1376 [TCP PDU reassembled in 42]"
"42","0.035818","146.75.37.140","192.168.12.35","TLSv1.2","1430","Application Data"
"43","0.035818","146.75.37.140","192.168.12.35","TCP","1430","443  >  61140 [ACK] Seq=49648 Ack=110 Win=424 Len=1376 [TCP PDU reassembled in 54]"
"44","0.035818","146.75.37.140","192.168.12.35","TCP","1430","443  >  61140 [ACK] Seq=51024 Ack=110 Win=424 Len=1376 [TCP PDU reassembled in 54]"
"45","0.035818","146.75.37.140","192.168.12.35","TCP","1430","443  >  61140 [ACK] Seq=52400 Ack=110 Win=424 Len=1376 [TCP PDU reassembled in 54]"
"46","0.035818","146.75.37.140","192.168.12.35","TCP","1430","443  >  61140 [ACK] Seq=53776 Ack=110 Win=424 Len=1376 [TCP PDU reassembled in 54]"
"47","0.035818","146.75.37.140","192.168.12.35","TCP","1430","443  >  61140 [ACK] Seq=55152 Ack=110 Win=424 Len=1376 [TCP PDU reassembled in 54]"
"48","0.035818","146.75.37.140","192.168.12.35","TCP","1430","443  >  61140 [PSH, ACK] Seq=56528 Ack=110 Win=424 Len=1376 [TCP PDU reassembled in 54]"
"49","0.035818","146.75.37.140","192.168.12.35","TCP","1430","443  >  61140 [ACK] Seq=57904 Ack=110 Win=424 Len=1376 [TCP PDU reassembled in 54]"
"50","0.035818","146.75.37.140","192.168.12.35","TCP","1430","443  >  61140 [ACK] Seq=59280 Ack=110 Win=424 Len=1376 [TCP PDU reassembled in 54]"
"51","0.035818","146.75.37.140","192.168.12.35","TCP","1430","443  >  61140 [ACK] Seq=60656 Ack=110 Win=424 Len=1376 [TCP PDU reassembled in 54]"
"52","0.035818","146.75.37.140","192.168.12.35","TCP","1430","443  >  61140 [ACK] Seq=62032 Ack=110 Win=424 Len=1376 [TCP PDU reassembled in 54]"
"53","0.035818","146.75.37.140","192.168.12.35","TCP","1430","443  >  61140 [ACK] Seq=63408 Ack=110 Win=424 Len=1376 [TCP PDU reassembled in 54]"
"54","0.035818","146.75.37.140","192.168.12.35","TLSv1.2","1430","Application Data, Application Data"
"55","0.035818","146.75.37.140","192.168.12.35","TCP","1430","443  >  61140 [ACK] Seq=66160 Ack=110 Win=424 Len=1376 [TCP PDU reassembled in 66]"
"56","0.035818","146.75.37.140","192.168.12.35","TCP","1430","443  >  61140 [ACK] Seq=67536 Ack=110 Win=424 Len=1376 [TCP PDU reassembled in 66]"
"57","0.035818","146.75.37.140","192.168.12.35","TCP","1430","443  >  61140 [ACK] Seq=68912 Ack=110 Win=424 Len=1376 [TCP PDU reassembled in 66]"
"58","0.035818","146.75.37.140","192.168.12.35","TCP","1430","443  >  61140 [ACK] Seq=70288 Ack=110 Win=424 Len=1376 [TCP PDU reassembled in 66]"
"59","0.035818","146.75.37.140","192.168.12.35","TCP","1430","443  >  61140 [ACK] Seq=71664 Ack=110 Win=424 Len=1376 [TCP PDU reassembled in 66]"
"60","0.035818","146.75.37.140","192.168.12.35","TCP","1430","443  >  61140 [ACK] Seq=73040 Ack=110 Win=424 Len=1376 [TCP PDU reassembled in 66]"
"61","0.035818","146.75.37.140","192.168.12.35","TCP","1430","443  >  61140 [ACK] Seq=74416 Ack=110 Win=424 Len=1376 [TCP PDU reassembled in 66]"
"62","0.035818","146.75.37.140","192.168.12.35","TCP","1430","443  >  61140 [PSH, ACK] Seq=75792 Ack=110 Win=424 Len=1376 [TCP PDU reassembled in 66]"
"63","0.035818","146.75.37.140","192.168.12.35","TCP","1430","443  >  61140 [ACK] Seq=77168 Ack=110 Win=424 Len=1376 [TCP PDU reassembled in 66]"
"64","0.035818","146.75.37.140","192.168.12.35","TCP","1430","443  >  61140 [ACK] Seq=78544 Ack=110 Win=424 Len=1376 [TCP PDU reassembled in 66]"
"65","0.035818","146.75.37.140","192.168.12.35","TCP","1430","443  >  61140 [ACK] Seq=79920 Ack=110 Win=424 Len=1376 [TCP PDU reassembled in 66]"
"66","0.035818","146.75.37.140","192.168.12.35","TLSv1.2","1430","Application Data"
"67","0.036288","192.168.12.35","146.75.37.140","TCP","54","61140  >  443 [ACK] Seq=208 Ack=82672 Win=4100 Len=0"
"68","0.036261","146.75.37.140","192.168.12.35","TCP","1430","443  >  61140 [ACK] Seq=82672 Ack=110 Win=424 Len=1376 [TCP PDU reassembled in 79]"
"69","0.036261","146.75.37.140","192.168.12.35","TCP","1430","443  >  61140 [ACK] Seq=84048 Ack=110 Win=424 Len=1376 [TCP PDU reassembled in 79]"
"70","0.036261","146.75.37.140","192.168.12.35","TCP","1430","443  >  61140 [ACK] Seq=85424 Ack=110 Win=424 Len=1376 [TCP PDU reassembled in 79]"
"71","0.036261","146.75.37.140","192.168.12.35","TCP","1430","443  >  61140 [ACK] Seq=86800 Ack=110 Win=424 Len=1376 [TCP PDU reassembled in 79]"
"72","0.036261","146.75.37.140","192.168.12.35","TCP","1430","443  >  61140 [ACK] Seq=88176 Ack=110 Win=424 Len=1376 [TCP PDU reassembled in 79]"
"73","0.036261","146.75.37.140","192.168.12.35","TCP","1430","443  >  61140 [ACK] Seq=89552 Ack=110 Win=424 Len=1376 [TCP PDU reassembled in 79]"
"74","0.036261","146.75.37.140","192.168.12.35","TCP","1430","443  >  61140 [ACK] Seq=90928 Ack=110 Win=424 Len=1376 [TCP PDU reassembled in 79]"
"75","0.036261","146.75.37.140","192.168.12.35","TCP","1430","443  >  61140 [ACK] Seq=92304 Ack=110 Win=424 Len=1376 [TCP PDU reassembled in 79]"
"76","0.036261","146.75.37.140","192.168.12.35","TCP","1430","443  >  61140 [ACK] Seq=93680 Ack=110 Win=424 Len=1376 [TCP PDU reassembled in 79]"
"77","0.036261","146.75.37.140","192.168.12.35","TCP","1430","443  >  61140 [PSH, ACK] Seq=95056 Ack=110 Win=424 Len=1376 [TCP PDU reassembled in 79]"
"78","0.036261","146.75.37.140","192.168.12.35","TCP","1430","443  >  61140 [ACK] Seq=96432 Ack=110 Win=424 Len=1376 [TCP PDU reassembled in 79]"
"79","0.036261","146.75.37.140","192.168.12.35","TLSv1.2","1430","Application Data"
"80","0.036261","146.75.37.140","192.168.12.35","TCP","1430","443  >  61140 [ACK] Seq=99184 Ack=110 Win=424 Len=1376 [TCP PDU reassembled in 91]"
"81","0.036261","146.75.37.140","192.168.12.35","TCP","1430","443  >  61140 [ACK] Seq=100560 Ack=110 Win=424 Len=1376 [TCP PDU reassembled in 91]"
"82","0.036261","146.75.37.140","192.168.12.35","TCP","1430","443  >  61140 [ACK] Seq=101936 Ack=110 Win=424 Len=1376 [TCP PDU reassembled in 91]"
"83","0.036261","146.75.37.140","192.168.12.35","TCP","1430","443  >  61140 [ACK] Seq=103312 Ack=110 Win=424 Len=1376 [TCP PDU reassembled in 91]"
"84","0.036261","146.75.37.140","192.168.12.35","TCP","1430","443  >  61140 [ACK] Seq=104688 Ack=110 Win=424 Len=1376 [TCP PDU reassembled in 91]"
"85","0.036261","146.75.37.140","192.168.12.35","TCP","1430","443  >  61140 [ACK] Seq=106064 Ack=110 Win=424 Len=1376 [TCP PDU reassembled in 91]"
"86","0.036261","146.75.37.140","192.168.12.35","TCP","1430","443  >  61140 [ACK] Seq=107440 Ack=110 Win=424 Len=1376 [TCP PDU reassembled in 91]"
"87","0.036261","146.75.37.140","192.168.12.35","TCP","1430","443  >  61140 [ACK] Seq=108816 Ack=110 Win=424 Len=1376 [TCP PDU reassembled in 91]"
"88","0.036261","146.75.37.140","192.168.12.35","TCP","1430","443  >  61140 [ACK] Seq=110192 Ack=110 Win=424 Len=1376 [TCP PDU reassembled in 91]"
"89","0.036261","146.75.37.140","192.168.12.35","TCP","1430","443  >  61140 [ACK] Seq=111568 Ack=110 Win=424 Len=1376 [TCP PDU reassembled in 91]"
"90","0.036261","146.75.37.140","192.168.12.35","TCP","1430","443  >  61140 [ACK] Seq=112944 Ack=110 Win=424 Len=1376 [TCP PDU reassembled in 91]"
"91","0.036261","146.75.37.140","192.168.12.35","TLSv1.2","1430","Application Data"
"92","0.036261","146.75.37.140","192.168.12.35","TCP","54","443  >  61140 [ACK] Seq=115696 Ack=208 Win=424 Len=0"
"93","0.036261","146.75.37.140","192.168.12.35","TCP","1430","443  >  61140 [ACK] Seq=115696 Ack=208 Win=424 Len=1376 [TCP PDU reassembled in 106]"
"94","0.036261","146.75.37.140","192.168.12.35","TCP","1430","443  >  61140 [ACK] Seq=117072 Ack=208 Win=424 Len=1376 [TCP PDU reassembled in 106]"
"95","0.036261","146.75.37.140","192.168.12.35","TCP","1430","443  >  61140 [ACK] Seq=118448 Ack=208 Win=424 Len=1376 [TCP PDU reassembled in 106]"
"96","0.036261","146.75.37.140","192.168.12.35","TCP","1430","443  >  61140 [ACK] Seq=119824 Ack=208 Win=424 Len=1376 [TCP PDU reassembled in 106]"
"97","0.036261","146.75.37.140","192.168.12.35","TCP","1430","443  >  61140 [PSH, ACK] Seq=121200 Ack=208 Win=424 Len=1376 [TCP PDU reassembled in 106]"
"98","0.036261","146.75.37.140","192.168.12.35","TCP","1430","443  >  61140 [ACK] Seq=122576 Ack=208 Win=424 Len=1376 [TCP PDU reassembled in 106]"
"99","0.036261","146.75.37.140","192.168.12.35","TCP","1430","443  >  61140 [ACK] Seq=123952 Ack=208 Win=424 Len=1376 [TCP PDU reassembled in 106]"
"100","0.036655","192.168.12.35","146.75.37.140","TCP","54","61140  >  443 [ACK] Seq=208 Ack=115696 Win=4100 Len=0"
"101","0.036715","192.168.12.35","146.75.37.140","TCP","54","61140  >  443 [ACK] Seq=208 Ack=125328 Win=4100 Len=0"
"102","0.037269","146.75.37.140","192.168.12.35","TCP","1430","443  >  61140 [ACK] Seq=125328 Ack=208 Win=424 Len=1376 [TCP PDU reassembled in 106]"
"103","0.037269","146.75.37.140","192.168.12.35","TCP","1430","443  >  61140 [ACK] Seq=126704 Ack=208 Win=424 Len=1376 [TCP PDU reassembled in 106]"
"104","0.037269","146.75.37.140","192.168.12.35","TCP","1430","443  >  61140 [ACK] Seq=128080 Ack=208 Win=424 Len=1376 [TCP PDU reassembled in 106]"
"105","0.037269","146.75.37.140","192.168.12.35","TCP","1430","443  >  61140 [ACK] Seq=129456 Ack=208 Win=424 Len=1376 [TCP PDU reassembled in 106]"
"106","0.037269","146.75.37.140","192.168.12.35","TLSv1.2","1430","Application Data, Application Data"
"107","0.037269","146.75.37.140","192.168.12.35","TCP","1430","443  >  61140 [ACK] Seq=132208 Ack=208 Win=424 Len=1376 [TCP PDU reassembled in 118]"
"108","0.037269","146.75.37.140","192.168.12.35","TCP","1430","443  >  61140 [ACK] Seq=133584 Ack=208 Win=424 Len=1376 [TCP PDU reassembled in 118]"
"109","0.037269","146.75.37.140","192.168.12.35","TCP","1430","443  >  61140 [ACK] Seq=134960 Ack=208 Win=424 Len=1376 [TCP PDU reassembled in 118]"
"110","0.037269","146.75.37.140","192.168.12.35","TCP","1430","443  >  61140 [ACK] Seq=136336 Ack=208 Win=424 Len=1376 [TCP PDU reassembled in 118]"
"111","0.037269","146.75.37.140","192.168.12.35","TCP","1430","443  >  61140 [ACK] Seq=137712 Ack=208 Win=424 Len=1376 [TCP PDU reassembled in 118]"
"112","0.037269","146.75.37.140","192.168.12.35","TCP","1430","443  >  61140 [ACK] Seq=139088 Ack=208 Win=424 Len=1376 [TCP PDU reassembled in 118]"
"113","0.037269","146.75.37.140","192.168.12.35","TCP","1430","443  >  61140 [PSH, ACK] Seq=140464 Ack=208 Win=424 Len=1376 [TCP PDU reassembled in 118]"
"114","0.037269","146.75.37.140","192.168.12.35","TCP","1430","443  >  61140 [ACK] Seq=141840 Ack=208 Win=424 Len=1376 [TCP PDU reassembled in 118]"
"115","0.037269","146.75.37.140","192.168.12.35","TCP","1430","443  >  61140 [ACK] Seq=143216 Ack=208 Win=424 Len=1376 [TCP PDU reassembled in 118]"
"116","0.037269","146.75.37.140","192.168.12.35","TCP","1430","443  >  61140 [ACK] Seq=144592 Ack=208 Win=424 Len=1376 [TCP PDU reassembled in 118]"
"117","0.037269","146.75.37.140","192.168.12.35","TCP","1430","443  >  61140 [ACK] Seq=145968 Ack=208 Win=424 Len=1376 [TCP PDU reassembled in 118]"
"118","0.037269","146.75.37.140","192.168.12.35","TLSv1.2","1430","Application Data"
"119","0.037269","146.75.37.140","192.168.12.35","TCP","1430","443  >  61140 [ACK] Seq=148720 Ack=208 Win=424 Len=1376 [TCP PDU reassembled in 130]"
"120","0.037269","146.75.37.140","192.168.12.35","TCP","1430","443  >  61140 [ACK] Seq=150096 Ack=208 Win=424 Len=1376 [TCP PDU reassembled in 130]"
"121","0.037269","146.75.37.140","192.168.12.35","TCP","1430","443  >  61140 [ACK] Seq=151472 Ack=208 Win=424 Len=1376 [TCP PDU reassembled in 130]"
"122","0.037269","146.75.37.140","192.168.12.35","TCP","1430","443  >  61140 [ACK] Seq=152848 Ack=208 Win=424 Len=1376 [TCP PDU reassembled in 130]"
"123","0.037269","146.75.37.140","192.168.12.35","TCP","1430","443  >  61140 [ACK] Seq=154224 Ack=208 Win=424 Len=1376 [TCP PDU reassembled in 130]"
"124","0.037269","146.75.37.140","192.168.12.35","TCP","1430","443  >  61140 [ACK] Seq=155600 Ack=208 Win=424 Len=1376 [TCP PDU reassembled in 130]"
"125","0.037269","146.75.37.140","192.168.12.35","TCP","1430","443  >  61140 [ACK] Seq=156976 Ack=208 Win=424 Len=1376 [TCP PDU reassembled in 130]"
"126","0.037269","146.75.37.140","192.168.12.35","TCP","1430","443  >  61140 [ACK] Seq=158352 Ack=208 Win=424 Len=1376 [TCP PDU reassembled in 130]"
"127","0.037269","146.75.37.140","192.168.12.35","TCP","1430","443  >  61140 [PSH, ACK] Seq=159728 Ack=208 Win=424 Len=1376 [TCP PDU reassembled in 130]"
"128","0.037269","146.75.37.140","192.168.12.35","TCP","1430","443  >  61140 [ACK] Seq=161104 Ack=208 Win=424 Len=1376 [TCP PDU reassembled in 130]"
"129","0.037269","146.75.37.140","192.168.12.35","TCP","1430","443  >  61140 [ACK] Seq=162480 Ack=208 Win=424 Len=1376 [TCP PDU reassembled in 130]"
"130","0.037269","146.75.37.140","192.168.12.35","TLSv1.2","1430","Application Data"
"131","0.037269","146.75.37.140","192.168.12.35","TCP","1430","443  >  61140 [ACK] Seq=165232 Ack=208 Win=424 Len=1376 [TCP PDU reassembled in 143]"
"132","0.037269","146.75.37.140","192.168.12.35","TCP","1430","443  >  61140 [ACK] Seq=166608 Ack=208 Win=424 Len=1376 [TCP PDU reassembled in 143]"
"133","0.037269","146.75.37.140","192.168.12.35","TCP","1430","443  >  61140 [ACK] Seq=167984 Ack=208 Win=424 Len=1376 [TCP PDU reassembled in 143]"
"134","0.037678","192.168.12.35","146.75.37.140","TCP","54","61140  >  443 [ACK] Seq=208 Ack=169360 Win=4100 Len=0"
"135","0.037808","146.75.37.140","192.168.12.35","TCP","1430","443  >  61140 [ACK] Seq=169360 Ack=208 Win=424 Len=1376 [TCP PDU reassembled in 143]"
"136","0.037808","146.75.37.140","192.168.12.35","TCP","1430","443  >  61140 [ACK] Seq=170736 Ack=208 Win=424 Len=1376 [TCP PDU reassembled in 143]"
"137","0.037808","146.75.37.140","192.168.12.35","TCP","1430","443  >  61140 [ACK] Seq=172112 Ack=208 Win=424 Len=1376 [TCP PDU reassembled in 143]"
"138","0.037808","146.75.37.140","192.168.12.35","TCP","1430","443  >  61140 [ACK] Seq=173488 Ack=208 Win=424 Len=1376 [TCP PDU reassembled in 143]"
"139","0.037808","146.75.37.140","192.168.12.35","TCP","1430","443  >  61140 [ACK] Seq=174864 Ack=208 Win=424 Len=1376 [TCP PDU reassembled in 143]"
"140","0.037808","146.75.37.140","192.168.12.35","TCP","1430","443  >  61140 [ACK] Seq=176240 Ack=208 Win=424 Len=1376 [TCP PDU reassembled in 143]"
"141","0.037808","146.75.37.140","192.168.12.35","TCP","1430","443  >  61140 [ACK] Seq=177616 Ack=208 Win=424 Len=1376 [TCP PDU reassembled in 143]"
"142","0.037808","146.75.37.140","192.168.12.35","TCP","1430","443  >  61140 [PSH, ACK] Seq=178992 Ack=208 Win=424 Len=1376 [TCP PDU reassembled in 143]"
"143","0.037808","146.75.37.140","192.168.12.35","TLSv1.2","1430","Application Data"
"144","0.037808","146.75.37.140","192.168.12.35","TCP","1430","443  >  61140 [ACK] Seq=181744 Ack=208 Win=424 Len=1376 [TCP PDU reassembled in 155]"
"145","0.037808","146.75.37.140","192.168.12.35","TCP","1430","443  >  61140 [ACK] Seq=183120 Ack=208 Win=424 Len=1376 [TCP PDU reassembled in 155]"
"146","0.037808","146.75.37.140","192.168.12.35","TCP","1430","443  >  61140 [ACK] Seq=184496 Ack=208 Win=424 Len=1376 [TCP PDU reassembled in 155]"
"147","0.037808","146.75.37.140","192.168.12.35","TCP","1430","443  >  61140 [PSH, ACK] Seq=185872 Ack=208 Win=424 Len=1376 [TCP PDU reassembled in 155]"
"148","0.037808","146.75.37.140","192.168.12.35","TCP","1430","443  >  61140 [ACK] Seq=187248 Ack=208 Win=424 Len=1376 [TCP PDU reassembled in 155]"
"149","0.037808","146.75.37.140","192.168.12.35","TCP","1430","443  >  61140 [ACK] Seq=188624 Ack=208 Win=424 Len=1376 [TCP PDU reassembled in 155]"
"150","0.037808","146.75.37.140","192.168.12.35","TCP","1430","443  >  61140 [ACK] Seq=190000 Ack=208 Win=424 Len=1376 [TCP PDU reassembled in 155]"
"151","0.037808","146.75.37.140","192.168.12.35","TCP","1430","443  >  61140 [ACK] Seq=191376 Ack=208 Win=424 Len=1376 [TCP PDU reassembled in 155]"
"152","0.037808","146.75.37.140","192.168.12.35","TCP","1430","443  >  61140 [ACK] Seq=192752 Ack=208 Win=424 Len=1376 [TCP PDU reassembled in 155]"
"153","0.037808","146.75.37.140","192.168.12.35","TCP","1430","443  >  61140 [ACK] Seq=194128 Ack=208 Win=424 Len=1376 [TCP PDU reassembled in 155]"
"154","0.037808","146.75.37.140","192.168.12.35","TCP","1430","443  >  61140 [ACK] Seq=195504 Ack=208 Win=424 Len=1376 [TCP PDU reassembled in 155]"
"155","0.037808","146.75.37.140","192.168.12.35","TLSv1.2","1430","Application Data, Application Data"
"156","0.037808","146.75.37.140","192.168.12.35","TCP","1430","443  >  61140 [ACK] Seq=198256 Ack=208 Win=424 Len=1376 [TCP PDU reassembled in 168]"
"157","0.037808","146.75.37.140","192.168.12.35","TCP","1430","443  >  61140 [ACK] Seq=199632 Ack=208 Win=424 Len=1376 [TCP PDU reassembled in 168]"
"158","0.037808","146.75.37.140","192.168.12.35","TCP","1430","443  >  61140 [ACK] Seq=201008 Ack=208 Win=424 Len=1376 [TCP PDU reassembled in 168]"
"159","0.037808","146.75.37.140","192.168.12.35","TCP","1430","443  >  61140 [ACK] Seq=202384 Ack=208 Win=424 Len=1376 [TCP PDU reassembled in 168]"
"160","0.037808","146.75.37.140","192.168.12.35","TCP","1430","443  >  61140 [ACK] Seq=203760 Ack=208 Win=424 Len=1376 [TCP PDU reassembled in 168]"
"161","0.037808","146.75.37.140","192.168.12.35","TCP","1430","443  >  61140 [PSH, ACK] Seq=205136 Ack=208 Win=424 Len=1376 [TCP PDU reassembled in 168]"
"162","0.038098","192.168.12.35","146.75.37.140","TCP","54","61140  >  443 [ACK] Seq=208 Ack=206512 Win=4100 Len=0"
"163","0.042877","146.75.37.140","192.168.12.35","TCP","1430","443  >  61140 [ACK] Seq=206512 Ack=208 Win=424 Len=1376 [TCP PDU reassembled in 168]"
"164","0.042877","146.75.37.140","192.168.12.35","TCP","1430","443  >  61140 [ACK] Seq=207888 Ack=208 Win=424 Len=1376 [TCP PDU reassembled in 168]"
"165","0.042877","146.75.37.140","192.168.12.35","TCP","1430","443  >  61140 [ACK] Seq=209264 Ack=208 Win=424 Len=1376 [TCP PDU reassembled in 168]"
"166","0.042877","146.75.37.140","192.168.12.35","TCP","1430","443  >  61140 [ACK] Seq=210640 Ack=208 Win=424 Len=1376 [TCP PDU reassembled in 168]"
"167","0.042877","146.75.37.140","192.168.12.35","TCP","1430","443  >  61140 [ACK] Seq=212016 Ack=208 Win=424 Len=1376 [TCP PDU reassembled in 168]"
"168","0.042877","146.75.37.140","192.168.12.35","TLSv1.2","1430","Application Data"
"169","0.042877","146.75.37.140","192.168.12.35","TCP","1430","443  >  61140 [ACK] Seq=214768 Ack=208 Win=424 Len=1376 [TCP PDU reassembled in 180]"
"170","0.042877","146.75.37.140","192.168.12.35","TCP","1430","443  >  61140 [ACK] Seq=216144 Ack=208 Win=424 Len=1376 [TCP PDU reassembled in 180]"
"171","0.042877","146.75.37.140","192.168.12.35","TCP","1430","443  >  61140 [ACK] Seq=217520 Ack=208 Win=424 Len=1376 [TCP PDU reassembled in 180]"
"172","0.042877","146.75.37.140","192.168.12.35","TCP","1430","443  >  61140 [ACK] Seq=218896 Ack=208 Win=424 Len=1376 [TCP PDU reassembled in 180]"
"173","0.042877","146.75.37.140","192.168.12.35","TCP","1430","443  >  61140 [ACK] Seq=220272 Ack=208 Win=424 Len=1376 [TCP PDU reassembled in 180]"
"174","0.042877","146.75.37.140","192.168.12.35","TCP","1430","443  >  61140 [ACK] Seq=221648 Ack=208 Win=424 Len=1376 [TCP PDU reassembled in 180]"
"175","0.042877","146.75.37.140","192.168.12.35","TCP","1430","443  >  61140 [ACK] Seq=223024 Ack=208 Win=424 Len=1376 [TCP PDU reassembled in 180]"
"176","0.042877","146.75.37.140","192.168.12.35","TCP","1430","443  >  61140 [PSH, ACK] Seq=224400 Ack=208 Win=424 Len=1376 [TCP PDU reassembled in 180]"
"177","0.042877","146.75.37.140","192.168.12.35","TCP","1430","443  >  61140 [ACK] Seq=225776 Ack=208 Win=424 Len=1376 [TCP PDU reassembled in 180]"
"178","0.042877","146.75.37.140","192.168.12.35","TCP","1430","443  >  61140 [ACK] Seq=227152 Ack=208 Win=424 Len=1376 [TCP PDU reassembled in 180]"
"179","0.042877","146.75.37.140","192.168.12.35","TCP","1430","443  >  61140 [ACK] Seq=228528 Ack=208 Win=424 Len=1376 [TCP PDU reassembled in 180]"
"180","0.042877","146.75.37.140","192.168.12.35","TLSv1.2","1430","Application Data"
"181","0.042877","146.75.37.140","192.168.12.35","TCP","1430","443  >  61140 [ACK] Seq=231280 Ack=208 Win=424 Len=1376 [TCP PDU reassembled in 191]"
"182","0.042877","146.75.37.140","192.168.12.35","TCP","1430","443  >  61140 [ACK] Seq=232656 Ack=208 Win=424 Len=1376 [TCP PDU reassembled in 191]"
"183","0.042877","146.75.37.140","192.168.12.35","TCP","1430","443  >  61140 [ACK] Seq=234032 Ack=208 Win=424 Len=1376 [TCP PDU reassembled in 191]"
"184","0.042877","146.75.37.140","192.168.12.35","TCP","1430","443  >  61140 [ACK] Seq=235408 Ack=208 Win=424 Len=1376 [TCP PDU reassembled in 191]"
"185","0.042877","146.75.37.140","192.168.12.35","TCP","1430","443  >  61140 [ACK] Seq=236784 Ack=208 Win=424 Len=1376 [TCP PDU reassembled in 191]"
"186","0.042877","146.75.37.140","192.168.12.35","TCP","1430","443  >  61140 [ACK] Seq=238160 Ack=208 Win=424 Len=1376 [TCP PDU reassembled in 191]"
"187","0.042877","146.75.37.140","192.168.12.35","TCP","1430","443  >  61140 [ACK] Seq=239536 Ack=208 Win=424 Len=1376 [TCP PDU reassembled in 191]"
"188","0.042877","146.75.37.140","192.168.12.35","TCP","1430","443  >  61140 [ACK] Seq=240912 Ack=208 Win=424 Len=1376 [TCP PDU reassembled in 191]"
"189","0.042877","146.75.37.140","192.168.12.35","TCP","1430","443  >  61140 [ACK] Seq=242288 Ack=208 Win=424 Len=1376 [TCP PDU reassembled in 191]"
"190","0.042877","146.75.37.140","192.168.12.35","TCP","1430","443  >  61140 [PSH, ACK] Seq=243664 Ack=208 Win=424 Len=1376 [TCP PDU reassembled in 191]"
"191","0.042877","146.75.37.140","192.168.12.35","TLSv1.2","1430","Application Data"
"192","0.042877","146.75.37.140","192.168.12.35","TCP","1430","443  >  61140 [ACK] Seq=246416 Ack=208 Win=424 Len=1376 [TCP PDU reassembled in 199]"
"193","0.042877","146.75.37.140","192.168.12.35","TCP","1430","443  >  61140 [ACK] Seq=247792 Ack=208 Win=424 Len=1376 [TCP PDU reassembled in 199]"
"194","0.042877","146.75.37.140","192.168.12.35","TCP","1430","443  >  61140 [ACK] Seq=249168 Ack=208 Win=424 Len=1376 [TCP PDU reassembled in 199]"
"195","0.043294","146.75.37.140","192.168.12.35","TCP","1430","443  >  61140 [PSH, ACK] Seq=250544 Ack=208 Win=424 Len=1376 [TCP PDU reassembled in 199]"
"196","0.043294","146.75.37.140","192.168.12.35","TCP","1430","443  >  61140 [ACK] Seq=251920 Ack=208 Win=424 Len=1376 [TCP PDU reassembled in 199]"
"197","0.043294","146.75.37.140","192.168.12.35","TCP","1430","443  >  61140 [ACK] Seq=253296 Ack=208 Win=424 Len=1376 [TCP PDU reassembled in 199]"
"198","0.043294","146.75.37.140","192.168.12.35","TCP","1430","443  >  61140 [ACK] Seq=254672 Ack=208 Win=424 Len=1376 [TCP PDU reassembled in 199]"
"199","0.043294","146.75.37.140","192.168.12.35","TLSv1.2","1430","Application Data"
"200","0.043294","146.75.37.140","192.168.12.35","TCP","1430","443  >  61140 [ACK] Seq=257424 Ack=208 Win=424 Len=1376 [TCP PDU reassembled in 208]"
"201","0.043294","146.75.37.140","192.168.12.35","TCP","1430","443  >  61140 [ACK] Seq=258800 Ack=208 Win=424 Len=1376 [TCP PDU reassembled in 208]"
"202","0.043294","146.75.37.140","192.168.12.35","TCP","1430","443  >  61140 [ACK] Seq=260176 Ack=208 Win=424 Len=1376 [TCP PDU reassembled in 208]"
"203","0.043294","146.75.37.140","192.168.12.35","TCP","1430","443  >  61140 [ACK] Seq=261552 Ack=208 Win=424 Len=1376 [TCP PDU reassembled in 208]"
"204","0.043294","146.75.37.140","192.168.12.35","TCP","1430","443  >  61140 [ACK] Seq=262928 Ack=208 Win=424 Len=1376 [TCP PDU reassembled in 208]"
"205","0.043400","192.168.12.35","146.75.37.140","TCP","54","61140  >  443 [ACK] Seq=208 Ack=250544 Win=4100 Len=0"
"206","0.043517","192.168.12.35","146.75.37.140","TCP","54","61140  >  443 [ACK] Seq=208 Ack=264304 Win=4100 Len=0"
"207","0.043879","146.75.37.140","192.168.12.35","TCP","1430","443  >  61140 [ACK] Seq=264304 Ack=208 Win=424 Len=1376 [TCP PDU reassembled in 208]"
"208","0.043879","146.75.37.140","192.168.12.35","TLSv1.2","1430","Application Data"
"209","0.043879","146.75.37.140","192.168.12.35","TCP","1430","443  >  61140 [ACK] Seq=267056 Ack=208 Win=424 Len=1376 [TCP PDU reassembled in 219]"
"210","0.043879","146.75.37.140","192.168.12.35","TCP","1430","443  >  61140 [ACK] Seq=268432 Ack=208 Win=424 Len=1376 [TCP PDU reassembled in 219]"
"211","0.043879","146.75.37.140","192.168.12.35","TCP","1430","443  >  61140 [PSH, ACK] Seq=269808 Ack=208 Win=424 Len=1376 [TCP PDU reassembled in 219]"
"212","0.043879","146.75.37.140","192.168.12.35","TCP","1430","443  >  61140 [ACK] Seq=271184 Ack=208 Win=424 Len=1376 [TCP PDU reassembled in 219]"
"213","0.043879","146.75.37.140","192.168.12.35","TCP","1430","443  >  61140 [ACK] Seq=272560 Ack=208 Win=424 Len=1376 [TCP PDU reassembled in 219]"
"214","0.043879","146.75.37.140","192.168.12.35","TCP","1430","443  >  61140 [ACK] Seq=273936 Ack=208 Win=424 Len=1376 [TCP PDU reassembled in 219]"
"215","0.043879","146.75.37.140","192.168.12.35","TCP","1430","443  >  61140 [ACK] Seq=275312 Ack=208 Win=424 Len=1376 [TCP PDU reassembled in 219]"
"216","0.043879","146.75.37.140","192.168.12.35","TCP","1430","443  >  61140 [ACK] Seq=276688 Ack=208 Win=424 Len=1376 [TCP PDU reassembled in 219]"
"217","0.043879","146.75.37.140","192.168.12.35","TCP","1430","443  >  61140 [ACK] Seq=278064 Ack=208 Win=424 Len=1376 [TCP PDU reassembled in 219]"
"218","0.043879","146.75.37.140","192.168.12.35","TCP","1430","443  >  61140 [ACK] Seq=279440 Ack=208 Win=424 Len=1376 [TCP PDU reassembled in 219]"
"219","0.043879","146.75.37.140","192.168.12.35","TLSv1.2","1430","Application Data"
"220","0.043879","146.75.37.140","192.168.12.35","TCP","1430","443  >  61140 [ACK] Seq=282192 Ack=208 Win=424 Len=1376 [TCP PDU reassembled in 231]"
"221","0.043879","146.75.37.140","192.168.12.35","TCP","1430","443  >  61140 [ACK] Seq=283568 Ack=208 Win=424 Len=1376 [TCP PDU reassembled in 231]"
"222","0.043879","146.75.37.140","192.168.12.35","TCP","1430","443  >  61140 [ACK] Seq=284944 Ack=208 Win=424 Len=1376 [TCP PDU reassembled in 231]"
"223","0.043879","146.75.37.140","192.168.12.35","TCP","1430","443  >  61140 [ACK] Seq=286320 Ack=208 Win=424 Len=1376 [TCP PDU reassembled in 231]"
"224","0.043879","146.75.37.140","192.168.12.35","TCP","1430","443  >  61140 [ACK] Seq=287696 Ack=208 Win=424 Len=1376 [TCP PDU reassembled in 231]"
"225","0.043879","146.75.37.140","192.168.12.35","TCP","1430","443  >  61140 [PSH, ACK] Seq=289072 Ack=208 Win=424 Len=1376 [TCP PDU reassembled in 231]"
"226","0.043879","146.75.37.140","192.168.12.35","TCP","1430","443  >  61140 [ACK] Seq=290448 Ack=208 Win=424 Len=1376 [TCP PDU reassembled in 231]"
"227","0.043879","146.75.37.140","192.168.12.35","TCP","1430","443  >  61140 [ACK] Seq=291824 Ack=208 Win=424 Len=1376 [TCP PDU reassembled in 231]"
"228","0.043879","146.75.37.140","192.168.12.35","TCP","1430","443  >  61140 [ACK] Seq=293200 Ack=208 Win=424 Len=1376 [TCP PDU reassembled in 231]"
"229","0.043879","146.75.37.140","192.168.12.35","TCP","1430","443  >  61140 [ACK] Seq=294576 Ack=208 Win=424 Len=1376 [TCP PDU reassembled in 231]"
"230","0.043879","146.75.37.140","192.168.12.35","TCP","1430","443  >  61140 [ACK] Seq=295952 Ack=208 Win=424 Len=1376 [TCP PDU reassembled in 231]"
"231","0.043879","146.75.37.140","192.168.12.35","TLSv1.2","1430","Application Data"
"232","0.043879","146.75.37.140","192.168.12.35","TCP","1430","443  >  61140 [ACK] Seq=298704 Ack=208 Win=424 Len=1376 [TCP PDU reassembled in 243]"
"233","0.043879","146.75.37.140","192.168.12.35","TCP","1430","443  >  61140 [ACK] Seq=300080 Ack=208 Win=424 Len=1376 [TCP PDU reassembled in 243]"
"234","0.043879","146.75.37.140","192.168.12.35","TCP","1430","443  >  61140 [ACK] Seq=301456 Ack=208 Win=424 Len=1376 [TCP PDU reassembled in 243]"
"235","0.043879","146.75.37.140","192.168.12.35","TCP","1430","443  >  61140 [ACK] Seq=302832 Ack=208 Win=424 Len=1376 [TCP PDU reassembled in 243]"
"236","0.043879","146.75.37.140","192.168.12.35","TCP","1430","443  >  61140 [ACK] Seq=304208 Ack=208 Win=424 Len=1376 [TCP PDU reassembled in 243]"
"237","0.043879","146.75.37.140","192.168.12.35","TCP","1430","443  >  61140 [ACK] Seq=305584 Ack=208 Win=424 Len=1376 [TCP PDU reassembled in 243]"
"238","0.043879","146.75.37.140","192.168.12.35","TCP","1430","443  >  61140 [ACK] Seq=306960 Ack=208 Win=424 Len=1376 [TCP PDU reassembled in 243]"
"239","0.044329","146.75.37.140","192.168.12.35","TCP","1430","443  >  61140 [PSH, ACK] Seq=308336 Ack=208 Win=424 Len=1376 [TCP PDU reassembled in 243]"
"240","0.044329","146.75.37.140","192.168.12.35","TCP","1430","443  >  61140 [ACK] Seq=309712 Ack=208 Win=424 Len=1376 [TCP PDU reassembled in 243]"
"241","0.044329","146.75.37.140","192.168.12.35","TCP","1430","443  >  61140 [ACK] Seq=311088 Ack=208 Win=424 Len=1376 [TCP PDU reassembled in 243]"
"242","0.044329","146.75.37.140","192.168.12.35","TCP","1430","443  >  61140 [ACK] Seq=312464 Ack=208 Win=424 Len=1376 [TCP PDU reassembled in 243]"
"243","0.044329","146.75.37.140","192.168.12.35","TLSv1.2","1430","Application Data"
"244","0.044329","146.75.37.140","192.168.12.35","TCP","1430","443  >  61140 [PSH, ACK] Seq=315216 Ack=208 Win=424 Len=1376 [TCP PDU reassembled in 256]"
"245","0.044329","146.75.37.140","192.168.12.35","TCP","1430","443  >  61140 [ACK] Seq=316592 Ack=208 Win=424 Len=1376 [TCP PDU reassembled in 256]"
"246","0.044329","146.75.37.140","192.168.12.35","TCP","1430","443  >  61140 [ACK] Seq=317968 Ack=208 Win=424 Len=1376 [TCP PDU reassembled in 256]"
"247","0.044390","192.168.12.35","146.75.37.140","TCP","54","61140  >  443 [ACK] Seq=208 Ack=308336 Win=4100 Len=0"
"248","0.044414","146.75.37.140","192.168.12.35","TCP","1430","443  >  61140 [ACK] Seq=319344 Ack=208 Win=424 Len=1376 [TCP PDU reassembled in 256]"
"249","0.044414","146.75.37.140","192.168.12.35","TCP","1430","443  >  61140 [ACK] Seq=320720 Ack=208 Win=424 Len=1376 [TCP PDU reassembled in 256]"
"250","0.044414","146.75.37.140","192.168.12.35","TCP","1430","443  >  61140 [ACK] Seq=322096 Ack=208 Win=424 Len=1376 [TCP PDU reassembled in 256]"
"251","0.044414","146.75.37.140","192.168.12.35","TCP","1430","443  >  61140 [ACK] Seq=323472 Ack=208 Win=424 Len=1376 [TCP PDU reassembled in 256]"
"252","0.044414","146.75.37.140","192.168.12.35","TCP","1430","443  >  61140 [ACK] Seq=324848 Ack=208 Win=424 Len=1376 [TCP PDU reassembled in 256]"
"253","0.044414","146.75.37.140","192.168.12.35","TCP","1430","443  >  61140 [ACK] Seq=326224 Ack=208 Win=424 Len=1376 [TCP PDU reassembled in 256]"
"254","0.044414","146.75.37.140","192.168.12.35","TCP","1430","443  >  61140 [ACK] Seq=327600 Ack=208 Win=424 Len=1376 [TCP PDU reassembled in 256]"
"255","0.044414","146.75.37.140","192.168.12.35","TCP","1430","443  >  61140 [ACK] Seq=328976 Ack=208 Win=424 Len=1376 [TCP PDU reassembled in 256]"
"256","0.044414","146.75.37.140","192.168.12.35","TLSv1.2","1430","Application Data"
"257","0.044414","146.75.37.140","192.168.12.35","TCP","1430","443  >  61140 [ACK] Seq=331728 Ack=208 Win=424 Len=1376 [TCP PDU reassembled in 270]"
"258","0.044414","146.75.37.140","192.168.12.35","TCP","1430","443  >  61140 [ACK] Seq=333104 Ack=208 Win=424 Len=1376 [TCP PDU reassembled in 270]"
"259","0.044414","146.75.37.140","192.168.12.35","TCP","1430","443  >  61140 [PSH, ACK] Seq=334480 Ack=208 Win=424 Len=1376 [TCP PDU reassembled in 270]"
"260","0.044467","192.168.12.35","146.75.37.140","TCP","54","61140  >  443 [ACK] Seq=208 Ack=319344 Win=4100 Len=0"
"261","0.044570","192.168.12.35","146.75.37.140","TCP","54","61140  >  443 [ACK] Seq=208 Ack=335856 Win=4100 Len=0"
"262","0.051028","146.75.37.140","192.168.12.35","TCP","1430","443  >  61140 [ACK] Seq=335856 Ack=208 Win=424 Len=1376 [TCP PDU reassembled in 270]"
"263","0.051028","146.75.37.140","192.168.12.35","TCP","1430","443  >  61140 [ACK] Seq=337232 Ack=208 Win=424 Len=1376 [TCP PDU reassembled in 270]"
"264","0.051028","146.75.37.140","192.168.12.35","TCP","1430","443  >  61140 [ACK] Seq=338608 Ack=208 Win=424 Len=1376 [TCP PDU reassembled in 270]"
"265","0.051028","146.75.37.140","192.168.12.35","TCP","1430","443  >  61140 [ACK] Seq=339984 Ack=208 Win=424 Len=1376 [TCP PDU reassembled in 270]"
"266","0.051028","146.75.37.140","192.168.12.35","TCP","1430","443  >  61140 [ACK] Seq=341360 Ack=208 Win=424 Len=1376 [TCP PDU reassembled in 270]"
"267","0.051028","146.75.37.140","192.168.12.35","TCP","1430","443  >  61140 [ACK] Seq=342736 Ack=208 Win=424 Len=1376 [TCP PDU reassembled in 270]"
"268","0.051028","146.75.37.140","192.168.12.35","TCP","1430","443  >  61140 [ACK] Seq=344112 Ack=208 Win=424 Len=1376 [TCP PDU reassembled in 270]"
"269","0.051028","146.75.37.140","192.168.12.35","TCP","1430","443  >  61140 [ACK] Seq=345488 Ack=208 Win=424 Len=1376 [TCP PDU reassembled in 270]"
"270","0.051028","146.75.37.140","192.168.12.35","TLSv1.2","1430","Application Data, Application Data"
"271","0.051028","146.75.37.140","192.168.12.35","TCP","1430","443  >  61140 [ACK] Seq=348240 Ack=208 Win=424 Len=1376 [TCP PDU reassembled in 278]"
"272","0.051028","146.75.37.140","192.168.12.35","TCP","1430","443  >  61140 [ACK] Seq=349616 Ack=208 Win=424 Len=1376 [TCP PDU reassembled in 278]"
"273","0.051028","146.75.37.140","192.168.12.35","TCP","1430","443  >  61140 [ACK] Seq=350992 Ack=208 Win=424 Len=1376 [TCP PDU reassembled in 278]"
"274","0.051028","146.75.37.140","192.168.12.35","TCP","1430","443  >  61140 [ACK] Seq=352368 Ack=208 Win=424 Len=1376 [TCP PDU reassembled in 278]"
"275","0.051028","146.75.37.140","192.168.12.35","TCP","1430","443  >  61140 [PSH, ACK] Seq=353744 Ack=208 Win=424 Len=1376 [TCP PDU reassembled in 278]"
"276","0.051028","146.75.37.140","192.168.12.35","TCP","1430","443  >  61140 [ACK] Seq=355120 Ack=208 Win=424 Len=1376 [TCP PDU reassembled in 278]"
"277","0.051028","146.75.37.140","192.168.12.35","TCP","1430","443  >  61140 [ACK] Seq=356496 Ack=208 Win=424 Len=1376 [TCP PDU reassembled in 278]"
"278","0.051028","146.75.37.140","192.168.12.35","TLSv1.2","164","Application Data"
"279","0.051359","192.168.12.35","146.75.37.140","TCP","54","61140  >  443 [ACK] Seq=208 Ack=357872 Win=4100 Len=0"
"280","0.051457","192.168.12.35","146.75.37.140","TCP","54","61140  >  443 [ACK] Seq=208 Ack=357982 Win=4100 Len=0"
"281","3.999943","192.168.12.35","146.75.37.140","TLSv1.2","163","Application Data"
"282","4.010267","192.168.12.35","146.75.37.140","TLSv1.2","152","Application Data"
"283","4.030270","146.75.37.140","192.168.12.35","TCP","54","443  >  61140 [ACK] Seq=357982 Ack=317 Win=424 Len=0"
"284","4.030270","146.75.37.140","192.168.12.35","TCP","1430","443  >  61140 [ACK] Seq=357982 Ack=317 Win=424 Len=1376 [TCP PDU reassembled in 295]"
