"No.","Time","Source","Destination","Protocol","Length","Info"
"1","0.000000","192.168.12.35","146.75.37.140","TLSv1.2","3238","Application Data"
"2","0.000178","192.168.12.35","146.75.37.140","TLSv1.2","93","Application Data"
"3","0.000227","192.168.12.35","146.75.37.140","TLSv1.2","3357","Application Data"
"4","0.000268","192.168.12.35","146.75.37.140","TLSv1.2","1382","Application Data"
"5","0.033304","192.168.12.35","146.75.37.140","UDP","80","52870  >  443 Len=38"
"6","0.051670","146.75.37.140","192.168.12.35","TCP","54","443  >  63572 [ACK] Seq=1 Ack=1397 Win=424 Len=0"
"7","0.079680","146.75.37.140","192.168.12.35","TCP","54","443  >  63572 [ACK] Seq=1 Ack=2793 Win=424 Len=0"
"8","0.084584","146.75.37.140","192.168.12.35","TCP","54","443  >  63572 [ACK] Seq=1 Ack=3185 Win=424 Len=0"
"9","0.084584","146.75.37.140","192.168.12.35","TCP","54","443  >  63572 [ACK] Seq=1 Ack=3224 Win=424 Len=0"
"10","0.084584","146.75.37.140","192.168.12.35","TLSv1.2","93","Application Data"
"11","0.113466","146.75.37.140","192.168.12.35","TCP","54","443  >  63572 [ACK] Seq=40 Ack=4620 Win=424 Len=0"
"12","0.113466","146.75.37.140","192.168.12.35","TLSv1.2","1430","Application Data"
"13","0.113772","192.168.12.35","146.75.37.140","TCP","54","63572  >  443 [ACK] Seq=7855 Ack=1416 Win=512 Len=0"
"14","0.133299","146.75.37.140","192.168.12.35","TLSv1.2","1099","Application Data"
"15","0.133299","146.75.37.140","192.168.12.35","TLSv1.2","1430","Application Data"
"16","0.133299","146.75.37.140","192.168.12.35","TLSv1.2","1092","Application Data"
"17","0.134160","192.168.12.35","146.75.37.140","TCP","54","63572  >  443 [ACK] Seq=7855 Ack=3837 Win=512 Len=0"
"18","0.134216","146.75.37.140","192.168.12.35","TLSv1.2","1430","Application Data"
"19","0.134216","146.75.37.140","192.168.12.35","TLSv1.2","1430","Application Data"
"20","0.134216","146.75.37.140","192.168.12.35","TLSv1.2","1430","Application Data"
"21","0.134216","146.75.37.140","192.168.12.35","TLSv1.2","1430","Application Data"
"22","0.134216","146.75.37.140","192.168.12.35","TLSv1.2","1430","Application Data"
"23","0.134216","146.75.37.140","192.168.12.35","TLSv1.2","1430","Application Data"
"24","0.134216","146.75.37.140","192.168.12.35","TLSv1.2","1430","Application Data"
"25","0.134216","146.75.37.140","192.168.12.35","TLSv1.2","1430","Application Data"
"26","0.134216","146.75.37.140","192.168.12.35","TLSv1.2","1430","Application Data"
"27","0.134216","146.75.37.140","192.168.12.35","TLSv1.2","1430","Application Data"
"28","0.134216","146.75.37.140","192.168.12.35","TLSv1.2","1415","Application Data, Application Data, Application Data"
"29","0.134593","192.168.12.35","146.75.37.140","TCP","54","63572  >  443 [ACK] Seq=7855 Ack=18635 Win=512 Len=0"
"30","0.134677","192.168.12.35","146.75.37.140","TCP","54","63572  >  443 [ACK] Seq=7855 Ack=19996 Win=507 Len=0"
"31","0.143221","192.168.12.35","146.75.37.140","TLSv1.2","89","Application Data"
"32","0.144175","146.75.37.140","192.168.12.35","TCP","54","443  >  63572 [ACK] Seq=19996 Ack=6016 Win=424 Len=0"
"33","0.144175","146.75.37.140","192.168.12.35","TLSv1.2","1430","Application Data"
"34","0.144175","146.75.37.140","192.168.12.35","TLSv1.2","1430","Application Data"
"35","0.144175","146.75.37.140","192.168.12.35","TLSv1.2","1430","Application Data"
"36","0.144175","146.75.37.140","192.168.12.35","TLSv1.2","1430","Application Data"
"37","0.144175","146.75.37.140","192.168.12.35","TLSv1.2","1430","Application Data"
"38","0.144175","146.75.37.140","192.168.12.35","TLSv1.2","1430","Application Data"
"39","0.144175","146.75.37.140","192.168.12.35","TLSv1.2","1430","Application Data"
"40","0.144175","146.75.37.140","192.168.12.35","TLSv1.2","1430","Application Data"
"41","0.144175","146.75.37.140","192.168.12.35","TLSv1.2","1430","Application Data"
"42","0.144175","146.75.37.140","192.168.12.35","TLSv1.2","1430","Application Data"
"43","0.144175","146.75.37.140","192.168.12.35","TLSv1.2","1430","Application Data"
"44","0.144175","146.75.37.140","192.168.12.35","TLSv1.2","1430","Application Data"
"45","0.145153","192.168.12.35","146.75.37.140","TCP","54","63572  >  443 [ACK] Seq=7890 Ack=36508 Win=512 Len=0"
"46","0.148385","146.75.37.140","192.168.12.35","TCP","54","443  >  63572 [ACK] Seq=36508 Ack=6527 Win=424 Len=0"
"47","0.148385","146.75.37.140","192.168.12.35","TLSv1.2","1430","Application Data"
"48","0.148385","146.75.37.140","192.168.12.35","TLSv1.2","1430","Application Data"
"49","0.148804","192.168.12.35","146.75.37.140","TCP","54","63572  >  443 [ACK] Seq=7890 Ack=39260 Win=512 Len=0"
"50","0.154244","146.75.37.140","192.168.12.35","TCP","54","443  >  63572 [ACK] Seq=39260 Ack=7855 Win=424 Len=0"
"51","0.167288","146.75.37.140","192.168.12.35","TLSv1.2","1430","Application Data"
"52","0.167288","146.75.37.140","192.168.12.35","TLSv1.2","1430","Application Data"
"53","0.167288","146.75.37.140","192.168.12.35","TLSv1.2","1430","Application Data"
"54","0.167288","146.75.37.140","192.168.12.35","TLSv1.2","1430","Application Data"
"55","0.167288","146.75.37.140","192.168.12.35","TLSv1.2","1430","Application Data"
"56","0.167288","146.75.37.140","192.168.12.35","TLSv1.2","1430","Application Data"
"57","0.167288","146.75.37.140","192.168.12.35","TLSv1.2","1430","Application Data"
"58","0.167288","146.75.37.140","192.168.12.35","TLSv1.2","1430","Application Data"
"59","0.167288","146.75.37.140","192.168.12.35","TLSv1.2","1430","Application Data"
"60","0.167288","146.75.37.140","192.168.12.35","TLSv1.2","790","Application Data"
"61","0.167288","146.75.37.140","192.168.12.35","TLSv1.2","224","Application Data"
"62","0.167288","146.75.37.140","192.168.12.35","TLSv1.2","1430","Application Data"
"63","0.167288","146.75.37.140","192.168.12.35","TLSv1.2","1430","Application Data"
"64","0.167288","146.75.37.140","192.168.12.35","TLSv1.2","1430","Application Data"
"65","0.167288","146.75.37.140","192.168.12.35","TLSv1.2","1430","Application Data"
"66","0.167288","146.75.37.140","192.168.12.35","TLSv1.2","1430","Application Data"
"67","0.167288","146.75.37.140","192.168.12.35","TLSv1.2","1191","Application Data"
"68","0.167288","146.75.37.140","192.168.12.35","TCP","54","443  >  63572 [ACK] Seq=60567 Ack=7890 Win=424 Len=0"
"69","0.168746","192.168.12.35","146.75.37.140","TCP","54","63572  >  443 [ACK] Seq=7890 Ack=51644 Win=512 Len=0"
"70","0.169007","192.168.12.35","146.75.37.140","TCP","54","63572  >  443 [ACK] Seq=7890 Ack=52380 Win=509 Len=0"
"71","0.169077","192.168.12.35","146.75.37.140","TCP","54","63572  >  443 [ACK] Seq=7890 Ack=59430 Win=512 Len=0"
"72","0.174311","146.75.37.140","192.168.12.35","TLSv1.2","1430","Application Data"
"73","0.174311","146.75.37.140","192.168.12.35","TLSv1.2","529","Application Data"
"74","0.174612","192.168.12.35","146.75.37.140","TCP","54","63572  >  443 [ACK] Seq=7890 Ack=61943 Win=512 Len=0"
"75","0.183747","146.75.37.140","192.168.12.35","UDP","75","443  >  52870 Len=33"
"76","0.197641","146.75.37.140","192.168.12.35","TLSv1.2","187","Application Data"
"77","0.198178","192.168.12.35","146.75.37.140","TCP","54","63572  >  443 [ACK] Seq=7890 Ack=62551 Win=510 Len=0"
"78","0.208397","146.75.37.140","192.168.12.35","TLSv1.2","232","Application Data"
"79","0.243475","146.75.37.140","192.168.12.35","TLSv1.2","582","Application Data"
"80","0.243777","192.168.12.35","146.75.37.140","TCP","54","63572  >  443 [ACK] Seq=7890 Ack=63257 Win=507 Len=0"
"81","0.254326","146.75.37.140","192.168.12.35","TCP","1430","443  >  63572 [ACK] Seq=63257 Ack=7890 Win=424 Len=1376 [TCP PDU reassembled in 82]"
"82","0.254326","146.75.37.140","192.168.12.35","TLSv1.2","311","Application Data"
"83","0.254685","192.168.12.35","146.75.37.140","TCP","54","63572  >  443 [ACK] Seq=7890 Ack=64890 Win=512 Len=0"
"84","0.282033","146.75.37.140","192.168.12.35","TLSv1.2","769","Application Data"
"85","0.292729","146.75.37.140","192.168.12.35","TLSv1.2","97","Application Data"
"86","0.293013","192.168.12.35","146.75.37.140","TCP","54","63572  >  443 [ACK] Seq=7890 Ack=65648 Win=509 Len=0"
"87","0.301902","192.168.12.35","146.75.37.140","UDP","97","52870  >  443 Len=55"
"88","0.307769","146.75.37.140","192.168.12.35","TLSv1.2","213","Application Data"
"89","0.307769","146.75.37.140","192.168.12.35","TLSv1.2","474","Application Data"
"90","0.308905","192.168.12.35","146.75.37.140","TCP","54","63572  >  443 [ACK] Seq=7890 Ack=66227 Win=507 Len=0"
"91","0.318277","146.75.37.140","192.168.12.35","TLSv1.2","118","Application Data"
"92","0.324168","146.75.37.140","192.168.12.35","TLSv1.2","95","Application Data"
"93","0.324439","192.168.12.35","146.75.37.140","TCP","54","63572  >  443 [ACK] Seq=7890 Ack=66332 Win=512 Len=0"
"94","0.344016","146.75.37.140","192.168.12.35","TLSv1.2","113","Application Data"
"95","0.344016","146.75.37.140","192.168.12.35","TLSv1.2","115","Application Data"
"96","0.344824","192.168.12.35","146.75.37.140","TCP","54","63572  >  443 [ACK] Seq=7890 Ack=66452 Win=512 Len=0"
"97","0.354421","146.75.37.140","192.168.12.35","TLSv1.2","107","Application Data"
"98","0.354421","146.75.37.140","192.168.12.35","TLSv1.2","103","Application Data"
"99","0.354421","146.75.37.140","192.168.12.35","TLSv1.2","675","Application Data"
"100","0.354421","146.75.37.140","192.168.12.35","TLSv1.2","189","Application Data"
"101","0.354421","146.75.37.140","192.168.12.35","TLSv1.2","579","Application Data"
"102","0.355018","192.168.12.35","146.75.37.140","TCP","54","63572  >  443 [ACK] Seq=7890 Ack=66554 Win=511 Len=0"
"103","0.355184","192.168.12.35","146.75.37.140","TCP","54","63572  >  443 [ACK] Seq=7890 Ack=67310 Win=508 Len=0"
"104","0.359494","146.75.37.140","192.168.12.35","TLSv1.2","417","Application Data"
"105","0.359494","146.75.37.140","192.168.12.35","TLSv1.2","464","Application Data"
"106","0.359494","146.75.37.140","192.168.12.35","TLSv1.2","399","Application Data"
"107","0.359494","146.75.37.140","192.168.12.35","TLSv1.2","129","Application Data"
"108","0.359494","146.75.37.140","192.168.12.35","TLSv1.2","156","Application Data"
"109","0.359494","146.75.37.140","192.168.12.35","TLSv1.2","119","Application Data"
"110","0.359494","146.75.37.140","192.168.12.35","TLSv1.2","108","Application Data"
"111","0.359494","146.75.37.140","192.168.12.35","TLSv1.2","114","Application Data"
"112","0.359494","146.75.37.140","192.168.12.35","TLSv1.2","177","Application Data"
"113","0.359494","146.75.37.140","192.168.12.35","TLSv1.2","185","Application Data"
"114","0.359494","146.75.37.140","192.168.12.35","TLSv1.2","107","Application Data"
"115","0.359494","146.75.37.140","192.168.12.35","TLSv1.2","94","Application Data"
"116","0.359494","146.75.37.140","192.168.12.35","TLSv1.2","97","Application Data"
"117","0.359494","146.75.37.140","192.168.12.35","TLSv1.2","130","Application Data"
"118","0.359494","146.75.37.140","192.168.12.35","TLSv1.2","98","Application Data"
"119","0.359494","146.75.37.140","192.168.12.35","TLSv1.2","406","Application Data"
"120","0.359494","146.75.37.140","192.168.12.35","TLSv1.2","141","Application Data"
"121","0.359494","146.75.37.140","192.168.12.35","TLSv1.2","108","Application Data"
"122","0.359494","146.75.37.140","192.168.12.35","TLSv1.2","157","Application Data"
"123","0.359494","146.75.37.140","192.168.12.35","TLSv1.2","292","Application Data"
"124","0.359494","146.75.37.140","192.168.12.35","TLSv1.2","310","Application Data"
"125","0.359494","146.75.37.140","192.168.12.35","TLSv1.2","191","Application Data"
"126","0.359494","146.75.37.140","192.168.12.35","TLSv1.2","225","Application Data"
"127","0.360158","192.168.12.35","146.75.37.140","TCP","54","63572  >  443 [ACK] Seq=7890 Ack=68198 Win=512 Len=0"
"128","0.360261","192.168.12.35","146.75.37.140","TCP","54","63572  >  443 [ACK] Seq=7890 Ack=68953 Win=509 Len=0"
"129","0.360373","192.168.12.35","146.75.37.140","TCP","54","63572  >  443 [ACK] Seq=7890 Ack=69130 Win=508 Len=0"
"130","0.360414","192.168.12.35","146.75.37.140","TCP","54","63572  >  443 [ACK] Seq=7890 Ack=69249 Win=508 Len=0"
"131","0.360462","192.168.12.35","146.75.37.140","TCP","54","63572  >  443 [ACK] Seq=7890 Ack=69432 Win=507 Len=0"
"132","0.360538","192.168.12.35","146.75.37.140","TCP","54","63572  >  443 [ACK] Seq=7890 Ack=69616 Win=512 Len=0"
"133","0.360586","192.168.12.35","146.75.37.140","TCP","54","63572  >  443 [ACK] Seq=7890 Ack=69699 Win=512 Len=0"
"134","0.360655","192.168.12.35","146.75.37.140","TCP","54","63572  >  443 [ACK] Seq=7890 Ack=69819 Win=511 Len=0"
"135","0.360707","192.168.12.35","146.75.37.140","TCP","54","63572  >  443 [ACK] Seq=7890 Ack=70258 Win=510 Len=0"
"136","0.360756","192.168.12.35","146.75.37.140","TCP","54","63572  >  443 [ACK] Seq=7890 Ack=70415 Win=509 Len=0"
"137","0.360818","192.168.12.35","146.75.37.140","TCP","54","63572  >  443 [ACK] Seq=7890 Ack=70909 Win=507 Len=0"
"138","0.360863","192.168.12.35","146.75.37.140","TCP","54","63572  >  443 [ACK] Seq=7890 Ack=71217 Win=512 Len=0"
"139","0.386530","146.75.37.140","192.168.12.35","UDP","67","443  >  52870 Len=25"
"140","0.396894","192.168.12.35","146.75.37.140","UDP","84","52870  >  443 Len=42"
"141","0.412492","146.75.37.140","192.168.12.35","UDP","75","443  >  52870 Len=33"
"142","0.535019","192.168.12.35","146.75.37.140","TLSv1.2","116","Application Data"
"143","0.535109","192.168.12.35","146.75.37.140","TLSv1.2","93","Application Data"
"144","0.637215","146.75.37.140","192.168.12.35","TCP","54","443  >  63571 [ACK] Seq=1 Ack=63 Win=357 Len=0"
"145","0.637215","146.75.37.140","192.168.12.35","TLSv1.2","126","Application Data"
"146","0.638355","192.168.12.35","146.75.37.140","TLSv1.2","89","Application Data"
"147","0.638474","192.168.12.35","146.75.37.140","TLSv1.2","112","Application Data"
"148","0.638536","192.168.12.35","146.75.37.140","TLSv1.2","3094","Application Data"
"149","0.642215","146.75.37.140","192.168.12.35","TCP","54","443  >  63571 [ACK] Seq=73 Ack=102 Win=357 Len=0"
"150","0.642215","146.75.37.140","192.168.12.35","TLSv1.2","93","Application Data"
"151","0.657185","146.75.37.140","192.168.12.35","TLSv1.2","564","Application Data"
"152","0.661925","146.75.37.140","192.168.12.35","TLSv1.2","133","Application Data"
"153","0.662545","192.168.12.35","146.75.37.140","TCP","54","63572  >  443 [ACK] Seq=7890 Ack=71806 Win=510 Len=0"
"154","0.674002","146.75.37.140","192.168.12.35","TCP","54","443  >  63571 [ACK] Seq=112 Ack=137 Win=357 Len=0"
"155","0.674002","146.75.37.140","192.168.12.35","TCP","54","443  >  63571 [ACK] Seq=112 Ack=195 Win=357 Len=0"
"156","0.674002","146.75.37.140","192.168.12.35","TLSv1.2","399","Application Data"
"157","0.674002","146.75.37.140","192.168.12.35","TLSv1.2","199","Application Data"
"158","0.674002","146.75.37.140","192.168.12.35","TLSv1.2","219","Application Data"
"159","0.674002","146.75.37.140","192.168.12.35","TLSv1.2","154","Application Data"
"160","0.674234","192.168.12.35","146.75.37.140","TCP","54","63572  >  443 [ACK] Seq=7890 Ack=72296 Win=508 Len=0"
"161","0.674308","192.168.12.35","146.75.37.140","TCP","54","63572  >  443 [ACK] Seq=7890 Ack=72561 Win=507 Len=0"
"162","0.680528","146.75.37.140","192.168.12.35","TLSv1.2","114","Application Data"
"163","0.680528","146.75.37.140","192.168.12.35","TLSv1.2","198","Application Data"
"164","0.680528","146.75.37.140","192.168.12.35","TLSv1.2","738","Application Data"
"165","0.680528","146.75.37.140","192.168.12.35","TLSv1.2","149","Application Data"
"166","0.680528","146.75.37.140","192.168.12.35","TLSv1.2","223","Application Data"
"167","0.680528","146.75.37.140","192.168.12.35","TLSv1.2","405","Application Data"
"168","0.680528","146.75.37.140","192.168.12.35","TLSv1.2","156","Application Data"
"169","0.680528","146.75.37.140","192.168.12.35","TLSv1.2","136","Application Data"
"170","0.680528","146.75.37.140","192.168.12.35","TLSv1.2","982","Application Data"
"171","0.680528","146.75.37.140","192.168.12.35","TCP","1430","443  >  63572 [ACK] Seq=75176 Ack=7890 Win=424 Len=1376 [TCP PDU reassembled in 172]"
"172","0.680528","146.75.37.140","192.168.12.35","TLSv1.2","465","Application Data"
"173","0.680528","146.75.37.140","192.168.12.35","TLSv1.2","325","Application Data"
"174","0.680528","146.75.37.140","192.168.12.35","TLSv1.2","997","Application Data"
"175","0.680528","146.75.37.140","192.168.12.35","TLSv1.2","502","Application Data"
"176","0.680528","146.75.37.140","192.168.12.35","TLSv1.2","340","Application Data"
"177","0.680528","146.75.37.140","192.168.12.35","TLSv1.2","1430","Application Data, Application Data, Application Data"
"178","0.680528","146.75.37.140","192.168.12.35","TLSv1.2","174","Application Data"
"179","0.680528","146.75.37.140","192.168.12.35","TCP","1430","443  >  63572 [ACK] Seq=80407 Ack=7890 Win=424 Len=1376 [TCP PDU reassembled in 180]"
"180","0.680528","146.75.37.140","192.168.12.35","TLSv1.2","1085","Application Data"
"181","0.681044","192.168.12.35","146.75.37.140","TCP","54","63572  >  443 [ACK] Seq=7890 Ack=72765 Win=512 Len=0"
"182","0.681143","192.168.12.35","146.75.37.140","TCP","54","63572  >  443 [ACK] Seq=7890 Ack=73544 Win=509 Len=0"
"183","0.681169","192.168.12.35","146.75.37.140","TCP","54","63572  >  443 [ACK] Seq=7890 Ack=74064 Win=507 Len=0"
"184","0.681195","192.168.12.35","146.75.37.140","TCP","54","63572  >  443 [ACK] Seq=7890 Ack=74248 Win=512 Len=0"
"185","0.681223","192.168.12.35","146.75.37.140","TCP","54","63572  >  443 [ACK] Seq=7890 Ack=76552 Win=512 Len=0"
"186","0.681255","192.168.12.35","146.75.37.140","TCP","54","63572  >  443 [ACK] Seq=7890 Ack=77234 Win=509 Len=0"
"187","0.681294","192.168.12.35","146.75.37.140","TCP","54","63572  >  443 [ACK] Seq=7890 Ack=78625 Win=512 Len=0"
"188","0.681384","192.168.12.35","146.75.37.140","TCP","54","63572  >  443 [ACK] Seq=7890 Ack=80287 Win=512 Len=0"
"189","0.681420","192.168.12.35","146.75.37.140","TCP","54","63572  >  443 [ACK] Seq=7890 Ack=81783 Win=512 Len=0"
"190","0.692958","146.75.37.140","192.168.12.35","TLSv1.2","545","Application Data"
"191","0.692958","146.75.37.140","192.168.12.35","TLSv1.2","516","Application Data"
"192","0.692958","146.75.37.140","192.168.12.35","TLSv1.2","828","Application Data"
"193","0.692958","146.75.37.140","192.168.12.35","TLSv1.2","572","Application Data"
"194","0.692958","146.75.37.140","192.168.12.35","TLSv1.2","450","Application Data"
"195","0.692958","146.75.37.140","192.168.12.35","TLSv1.2","236","Application Data"
"196","0.692958","146.75.37.140","192.168.12.35","TLSv1.2","669","Application Data"
"197","0.692958","146.75.37.140","192.168.12.35","TLSv1.2","235","Application Data"
"198","0.692958","146.75.37.140","192.168.12.35","TLSv1.2","516","Application Data"
"199","0.692958","146.75.37.140","192.168.12.35","TLSv1.2","207","Application Data"
"200","0.692958","146.75.37.140","192.168.12.35","TLSv1.2","360","Application Data, Application Data"
"201","0.692958","146.75.37.140","192.168.12.35","TLSv1.2","266","Application Data"
"202","0.692958","146.75.37.140","192.168.12.35","TLSv1.2","251","Application Data"
"203","0.692958","146.75.37.140","192.168.12.35","TLSv1.2","443","Application Data"
"204","0.692958","146.75.37.140","192.168.12.35","TLSv1.2","213","Application Data"
"205","0.692958","146.75.37.140","192.168.12.35","TLSv1.2","791","Application Data"
"206","0.693205","192.168.12.35","146.75.37.140","TCP","54","63572  >  443 [ACK] Seq=7890 Ack=83305 Win=512 Len=0"
"207","0.693310","192.168.12.35","146.75.37.140","TCP","54","63572  >  443 [ACK] Seq=7890 Ack=84541 Win=507 Len=0"
"208","0.693346","192.168.12.35","146.75.37.140","TCP","54","63572  >  443 [ACK] Seq=7890 Ack=85455 Win=512 Len=0"
"209","0.693379","192.168.12.35","146.75.37.140","TCP","54","63572  >  443 [ACK] Seq=7890 Ack=86252 Win=509 Len=0"
"210","0.693414","192.168.12.35","146.75.37.140","TCP","54","63572  >  443 [ACK] Seq=7890 Ack=86895 Win=512 Len=0"
"211","0.693479","192.168.12.35","146.75.37.140","TCP","54","63572  >  443 [ACK] Seq=7890 Ack=87354 Win=510 Len=0"
"212","0.693525","192.168.12.35","146.75.37.140","TCP","54","63572  >  443 [ACK] Seq=7890 Ack=87763 Win=509 Len=0"
"213","0.693583","192.168.12.35","146.75.37.140","TCP","54","63572  >  443 [ACK] Seq=7890 Ack=88311 Win=512 Len=0"
"214","0.696270","192.168.12.35","146.75.37.140","TCP","54","63571  >  443 [ACK] Seq=3235 Ack=112 Win=509 Len=0"
"215","0.698463","146.75.37.140","192.168.12.35","TLSv1.2","200","Application Data"
"216","0.698463","146.75.37.140","192.168.12.35","TLSv1.2","292","Application Data"
"217","0.699239","192.168.12.35","146.75.37.140","TCP","54","63572  >  443 [ACK] Seq=7890 Ack=89194 Win=509 Len=0"
"218","0.707112","146.75.37.140","192.168.12.35","TCP","54","443  >  63571 [ACK] Seq=112 Ack=1591 Win=362 Len=0"
"219","0.714282","146.75.37.140","192.168.12.35","TLSv1.2","220","Application Data"
"220","0.714282","146.75.37.140","192.168.12.35","TLSv1.2","132","Application Data"
"221","0.714535","192.168.12.35","146.75.37.140","TCP","54","63572  >  443 [ACK] Seq=7890 Ack=89598 Win=507 Len=0"
"222","0.721267","146.75.37.140","192.168.12.35","TLSv1.2","99","Application Data"
"223","0.721267","146.75.37.140","192.168.12.35","TLSv1.2","455","Application Data"
"224","0.721267","146.75.37.140","192.168.12.35","TLSv1.2","337","Application Data"
"225","0.721267","146.75.37.140","192.168.12.35","TLSv1.2","700","Application Data"
"226","0.721267","146.75.37.140","192.168.12.35","TLSv1.2","884","Application Data"
"227","0.721267","146.75.37.140","192.168.12.35","TCP","1430","443  >  63572 [ACK] Seq=91881 Ack=7890 Win=424 Len=1376 [TCP PDU reassembled in 234]"
"228","0.721545","192.168.12.35","146.75.37.140","TCP","54","63572  >  443 [ACK] Seq=7890 Ack=89721 Win=512 Len=0"
"229","0.721693","192.168.12.35","146.75.37.140","TCP","54","63572  >  443 [ACK] Seq=7890 Ack=90405 Win=509 Len=0"
"230","0.721791","192.168.12.35","146.75.37.140","TCP","54","63572  >  443 [ACK] Seq=7890 Ack=91881 Win=512 Len=0"
"231","0.722648","146.75.37.140","192.168.12.35","TCP","1430","443  >  63572 [PSH, ACK] Seq=93257 Ack=7890 Win=424 Len=1376 [TCP PDU reassembled in 234]"
"232","0.722780","192.168.12.35","146.75.37.140","TCP","54","63572  >  443 [ACK] Seq=7890 Ack=94633 Win=512 Len=0"
"233","0.724238","146.75.37.140","192.168.12.35","TCP","1430","443  >  63572 [ACK] Seq=94633 Ack=7890 Win=424 Len=1376 [TCP PDU reassembled in 234]"
"234","0.724238","146.75.37.140","192.168.12.35","TLSv1.2","116","Application Data"
"235","0.724238","146.75.37.140","192.168.12.35","TLSv1.2","295","Application Data"
"236","0.724238","146.75.37.140","192.168.12.35","TLSv1.2","553","Application Data"
"237","0.724238","146.75.37.140","192.168.12.35","TLSv1.2","85","Application Data"
"238","0.724421","192.168.12.35","146.75.37.140","TCP","54","63572  >  443 [ACK] Seq=7890 Ack=96071 Win=512 Len=0"
"239","0.724508","192.168.12.35","146.75.37.140","TCP","54","63572  >  443 [ACK] Seq=7890 Ack=96811 Win=509 Len=0"
"240","0.753662","146.75.37.140","192.168.12.35","TCP","54","443  >  63571 [ACK] Seq=112 Ack=2987 Win=367 Len=0"
"241","0.766557","146.75.37.140","192.168.12.35","TCP","54","443  >  63571 [ACK] Seq=112 Ack=3235 Win=373 Len=0"
"242","0.774041","192.168.12.35","146.75.37.140","TCP","54","63572  >  443 [ACK] Seq=7890 Ack=96842 Win=509 Len=0"
"243","0.775712","192.168.12.35","146.75.37.140","TLSv1.2","3184","Application Data"
"244","0.775837","192.168.12.35","146.75.37.140","TLSv1.2","718","Application Data"
"245","0.775941","192.168.12.35","146.75.37.140","TLSv1.2","3187","Application Data"
"246","0.776488","146.75.37.140","192.168.12.35","TLSv1.2","106","Application Data"
"247","0.777076","192.168.12.35","146.75.37.140","TLSv1.2","89","Application Data"
"248","0.802125","192.168.12.35","146.75.37.140","TLSv1.2","3197","Application Data"
"249","0.897544","146.75.37.140","192.168.12.35","TCP","54","443  >  63572 [ACK] Seq=96842 Ack=9286 Win=424 Len=0"
"250","0.925137","192.168.12.35","146.75.37.140","TLSv1.2","3175","Application Data"
"251","0.925465","192.168.12.35","146.75.37.140","TLSv1.2","210","Application Data"
"252","0.932112","146.75.37.140","192.168.12.35","TCP","54","443  >  63572 [ACK] Seq=96842 Ack=10682 Win=424 Len=0"
"253","0.941985","146.75.37.140","192.168.12.35","TCP","54","443  >  63572 [ACK] Seq=96842 Ack=11020 Win=424 Len=0"
"254","0.957390","146.75.37.140","192.168.12.35","TCP","54","443  >  63572 [ACK] Seq=96842 Ack=11684 Win=424 Len=0"
"255","0.993725","146.75.37.140","192.168.12.35","TCP","54","443  >  63572 [ACK] Seq=96842 Ack=13080 Win=424 Len=0"
"256","1.001199","146.75.37.140","192.168.12.35","TCP","1430","443  >  63572 [ACK] Seq=96842 Ack=13080 Win=424 Len=1376 [TCP PDU reassembled in 257]"
"257","1.001199","146.75.37.140","192.168.12.35","TLSv1.2","771","Application Data"
"258","1.001199","146.75.37.140","192.168.12.35","TLSv1.2","87","Application Data"
"259","1.001429","192.168.12.35","146.75.37.140","TCP","54","63572  >  443 [ACK] Seq=21237 Ack=98218 Win=512 Len=0"
"260","1.001547","192.168.12.35","146.75.37.140","TCP","54","63572  >  443 [ACK] Seq=21237 Ack=98935 Win=509 Len=0"
"261","1.031212","146.75.37.140","192.168.12.35","TCP","54","443  >  63572 [ACK] Seq=98968 Ack=14476 Win=424 Len=0"
"262","1.031707","146.75.37.140","192.168.12.35","TCP","54","443  >  63572 [ACK] Seq=98968 Ack=14817 Win=424 Len=0"
"263","1.033280","192.168.12.35","146.75.37.140","TLSv1.2","3211","Application Data"
"264","1.033552","192.168.12.35","146.75.37.140","TLSv1.2","3196","Application Data"
"265","1.033604","192.168.12.35","146.75.37.140","TLSv1.2","3188","Application Data"
"266","1.036246","192.168.12.35","146.75.37.140","TLSv1.2","3290","Application Data"
"267","1.036706","146.75.37.140","192.168.12.35","TCP","54","443  >  63571 [ACK] Seq=164 Ack=3270 Win=373 Len=0"
"268","1.063789","146.75.37.140","192.168.12.35","TCP","1430","443  >  63572 [ACK] Seq=98968 Ack=14817 Win=424 Len=1376 [TCP PDU reassembled in 269]"
"269","1.063789","146.75.37.140","192.168.12.35","TLSv1.2","472","Application Data"
"270","1.063789","146.75.37.140","192.168.12.35","TLSv1.2","87","Application Data"
"271","1.063789","146.75.37.140","192.168.12.35","TCP","54","443  >  63572 [ACK] Seq=100795 Ack=16213 Win=424 Len=0"
"272","1.064335","192.168.12.35","146.75.37.140","TCP","54","63572  >  443 [ACK] Seq=33906 Ack=100762 Win=512 Len=0"
"273","1.096605","146.75.37.140","192.168.12.35","TCP","54","443  >  63572 [ACK] Seq=100795 Ack=17609 Win=424 Len=0"
"274","1.106893","146.75.37.140","192.168.12.35","TCP","54","443  >  63572 [ACK] Seq=100795 Ack=17960 Win=424 Len=0"
"275","1.118123","192.168.12.35","146.75.37.140","TCP","54","63572  >  443 [ACK] Seq=33906 Ack=100795 Win=512 Len=0"
"276","1.133157","146.75.37.140","192.168.12.35","TCP","1430","443  >  63572 [ACK] Seq=100795 Ack=17960 Win=424 Len=1376 [TCP PDU reassembled in 277]"
"277","1.133157","146.75.37.140","192.168.12.35","TLSv1.2","899","Application Data"
"278","1.133157","146.75.37.140","192.168.12.35","TCP","54","443  >  63572 [ACK] Seq=103016 Ack=19356 Win=424 Len=0"
"279","1.133585","192.168.12.35","146.75.37.140","TCP","54","63572  >  443 [ACK] Seq=33906 Ack=103016 Win=512 Len=0"
"280","1.166785","146.75.37.140","192.168.12.35","TCP","54","443  >  63572 [ACK] Seq=103016 Ack=20752 Win=424 Len=0"
"281","1.171403","146.75.37.140","192.168.12.35","TCP","54","443  >  63572 [ACK] Seq=103016 Ack=21081 Win=424 Len=0"
"282","1.171403","146.75.37.140","192.168.12.35","TLSv1.2","604","Application Data"
"283","1.177944","192.168.12.35","146.75.37.140","TLSv1.2","3144","Application Data"
"284","1.183161","146.75.37.140","192.168.12.35","TCP","54","443  >  63572 [ACK] Seq=103566 Ack=21237 Win=424 Len=0"
"285","1.261664","146.75.37.140","192.168.12.35","TCP","1430","443  >  63572 [ACK] Seq=103566 Ack=21237 Win=424 Len=1376 [TCP PDU reassembled in 286]"
"286","1.261664","146.75.37.140","192.168.12.35","TLSv1.2","608","Application Data"
"287","1.262071","192.168.12.35","146.75.37.140","TCP","54","63572  >  443 [ACK] Seq=36996 Ack=104942 Win=512 Len=0"
"288","1.262270","192.168.12.35","146.75.37.140","TCP","54","63572  >  443 [ACK] Seq=36996 Ack=105496 Win=510 Len=0"
"289","1.441931","146.75.37.140","192.168.12.35","TCP","54","443  >  63572 [ACK] Seq=105496 Ack=22633 Win=424 Len=0"
"290","1.473497","146.75.37.140","192.168.12.35","TCP","54","443  >  63572 [ACK] Seq=105496 Ack=24029 Win=424 Len=0"
"291","1.473497","146.75.37.140","192.168.12.35","TCP","54","443  >  63572 [ACK] Seq=105496 Ack=24394 Win=424 Len=0"
"292","1.503598","146.75.37.140","192.168.12.35","TCP","1430","443  >  63572 [ACK] Seq=105496 Ack=24394 Win=424 Len=1376 [TCP PDU reassembled in 293]"
"293","1.503598","146.75.37.140","192.168.12.35","TLSv1.2","901","Application Data"
"294","1.503854","192.168.12.35","146.75.37.140","TCP","54","63572  >  443 [ACK] Seq=36996 Ack=106872 Win=512 Len=0"
"295","1.503995","192.168.12.35","146.75.37.140","TCP","54","63572  >  443 [ACK] Seq=36996 Ack=107719 Win=509 Len=0"
"296","1.521787","146.75.37.140","192.168.12.35","TCP","54","443  >  63572 [ACK] Seq=107719 Ack=25790 Win=424 Len=0"
"297","1.557798","146.75.37.140","192.168.12.35","TLSv1.2","957","Application Data"
"298","1.558046","192.168.12.35","146.75.37.140","TCP","54","63572  >  443 [ACK] Seq=36996 Ack=108622 Win=512 Len=0"
"299","1.567754","146.75.37.140","192.168.12.35","TCP","54","443  >  63572 [ACK] Seq=108622 Ack=27536 Win=424 Len=0"
"300","1.598496","146.75.37.140","192.168.12.35","TCP","1430","443  >  63572 [ACK] Seq=108622 Ack=27536 Win=424 Len=1376 [TCP PDU reassembled in 301]"
"301","1.598496","146.75.37.140","192.168.12.35","TLSv1.2","463","Application Data"
"302","1.598496","146.75.37.140","192.168.12.35","TLSv1.2","100","Application Data"
"303","1.599263","192.168.12.35","146.75.37.140","TCP","54","63572  >  443 [ACK] Seq=36996 Ack=109998 Win=507 Len=0"
"304","1.599496","192.168.12.35","146.75.37.140","TCP","54","63572  >  443 [ACK] Seq=36996 Ack=110407 Win=512 Len=0"
"305","1.599567","192.168.12.35","146.75.37.140","TCP","54","63572  >  443 [ACK] Seq=36996 Ack=110453 Win=512 Len=0"
"306","1.611611","146.75.37.140","192.168.12.35","TCP","54","443  >  63572 [ACK] Seq=110453 Ack=28932 Win=424 Len=0"
"307","1.633695","146.75.37.140","192.168.12.35","TCP","54","443  >  63572 [ACK] Seq=110453 Ack=30328 Win=424 Len=0"
"308","1.633695","146.75.37.140","192.168.12.35","TCP","54","443  >  63572 [ACK] Seq=110453 Ack=30670 Win=424 Len=0"
"309","1.659346","146.75.37.140","192.168.12.35","TCP","1430","443  >  63572 [ACK] Seq=110453 Ack=30670 Win=424 Len=1376 [TCP PDU reassembled in 310]"
"310","1.659346","146.75.37.140","192.168.12.35","TLSv1.2","848","Application Data"
"311","1.659346","146.75.37.140","192.168.12.35","TLSv1.2","100","Application Data"
"312","1.659620","192.168.12.35","146.75.37.140","TCP","54","63572  >  443 [ACK] Seq=36996 Ack=111829 Win=512 Len=0"
"313","1.659748","192.168.12.35","146.75.37.140","TCP","54","63572  >  443 [ACK] Seq=36996 Ack=112623 Win=509 Len=0"
"314","1.686603","146.75.37.140","192.168.12.35","TCP","54","443  >  63572 [ACK] Seq=112669 Ack=32066 Win=424 Len=0"
"315","1.712989","192.168.12.35","146.75.37.140","TCP","54","63572  >  443 [ACK] Seq=36996 Ack=112669 Win=509 Len=0"
"316","1.713598","146.75.37.140","192.168.12.35","TCP","54","443  >  63572 [ACK] Seq=112669 Ack=33906 Win=424 Len=0"
"317","1.713598","146.75.37.140","192.168.12.35","TCP","1430","443  >  63572 [ACK] Seq=112669 Ack=33906 Win=424 Len=1376 [TCP PDU reassembled in 318]"
"318","1.713598","146.75.37.140","192.168.12.35","TLSv1.2","112","Application Data"
"319","1.713957","192.168.12.35","146.75.37.140","TCP","54","63572  >  443 [ACK] Seq=36996 Ack=114045 Win=512 Len=0"
"320","1.714061","192.168.12.35","146.75.37.140","TCP","54","63572  >  443 [ACK] Seq=36996 Ack=114103 Win=512 Len=0"
"321","1.718431","146.75.37.140","192.168.12.35","TLSv1.2","610","Application Data"
"322","1.718431","146.75.37.140","192.168.12.35","TLSv1.2","367","Application Data"
"323","1.718431","146.75.37.140","192.168.12.35","TLSv1.2","85","Application Data"
"324","1.718889","192.168.12.35","146.75.37.140","TCP","54","63572  >  443 [ACK] Seq=36996 Ack=114972 Win=508 Len=0"
"325","1.736922","146.75.37.140","192.168.12.35","TCP","1430","443  >  63572 [ACK] Seq=115003 Ack=33906 Win=424 Len=1376 [TCP PDU reassembled in 326]"
"326","1.736922","146.75.37.140","192.168.12.35","TLSv1.2","467","Application Data"
"327","1.736922","146.75.37.140","192.168.12.35","TLSv1.2","100","Application Data"
"328","1.737148","192.168.12.35","146.75.37.140","TCP","54","63572  >  443 [ACK] Seq=36996 Ack=116379 Win=512 Len=0"
"329","1.737264","192.168.12.35","146.75.37.140","TCP","54","63572  >  443 [ACK] Seq=36996 Ack=116838 Win=510 Len=0"
"330","1.793910","146.75.37.140","192.168.12.35","TCP","54","443  >  63572 [ACK] Seq=116838 Ack=35302 Win=424 Len=0"
"331","1.804054","146.75.37.140","192.168.12.35","TCP","54","443  >  63572 [ACK] Seq=116838 Ack=36996 Win=424 Len=0"
"332","1.814146","146.75.37.140","192.168.12.35","TLSv1.2","1034","Application Data"
"333","1.839757","146.75.37.140","192.168.12.35","TCP","1430","443  >  63572 [ACK] Seq=117818 Ack=36996 Win=424 Len=1376 [TCP PDU reassembled in 334]"
"334","1.839757","146.75.37.140","192.168.12.35","TLSv1.2","836","Application Data"
"335","1.840472","192.168.12.35","146.75.37.140","TCP","54","63572  >  443 [ACK] Seq=36996 Ack=119194 Win=512 Len=0"
"336","1.869473","192.168.12.35","146.75.37.140","TCP","66","63631  >  443 [SYN] Seq=0 Win=64240 Len=0 MSS=1460 WS=256 SACK_PERM"
"337","1.895523","192.168.12.35","146.75.37.140","TCP","54","63572  >  443 [ACK] Seq=36996 Ack=119976 Win=509 Len=0"
"338","1.896717","146.75.37.140","192.168.12.35","TCP","66","443  >  63631 [SYN, ACK] Seq=0 Ack=1 Win=65535 Len=0 MSS=1396 SACK_PERM WS=512"
"339","1.897500","192.168.12.35","146.75.37.140","TCP","54","63631  >  443 [ACK] Seq=1 Ack=1 Win=262400 Len=0"
"340","1.899384","192.168.12.35","146.75.37.140","TLSv1.3","2073","Client Hello (SNI=styles.redditmedia.com)"
"341","1.905310","192.168.12.35","146.75.37.140","UDP","1292","52870  >  443 Len=1250"
"342","1.905804","192.168.12.35","146.75.37.140","UDP","546","52870  >  443 Len=504"
"343","1.942125","192.168.12.35","146.75.37.140","UDP","1292","52870  >  443 Len=1250"
"344","1.942319","192.168.12.35","146.75.37.140","UDP","543","52870  >  443 Len=501"
"345","1.957915","192.168.12.35","146.75.37.140","TCP","1450","[TCP Retransmission] 63631  >  443 [PSH, ACK] Seq=624 Ack=1 Win=262400 Len=1396"
"346","1.968998","192.168.12.35","146.75.37.140","UDP","1292","52870  >  443 Len=1250"
"347","1.969082","192.168.12.35","146.75.37.140","UDP","1019","52870  >  443 Len=977"
"348","1.997281","146.75.37.140","192.168.12.35","TCP","54","443  >  63631 [ACK] Seq=1 Ack=1397 Win=148992 Len=0"
"349","2.005616","146.75.37.140","192.168.12.35","TCP","54","443  >  63631 [ACK] Seq=1 Ack=2020 Win=152064 Len=0"
"350","2.005616","146.75.37.140","192.168.12.35","TLSv1.3","1430","Server Hello, Change Cipher Spec, Application Data, Application Data"
"351","2.005616","146.75.37.140","192.168.12.35","TLSv1.3","219","Application Data"
"352","2.006448","192.168.12.35","146.75.37.140","TCP","54","63631  >  443 [ACK] Seq=2020 Ack=1542 Win=262400 Len=0"
"353","2.007543","192.168.12.35","146.75.37.140","TLSv1.3","118","Change Cipher Spec, Application Data"
"354","2.008394","192.168.12.35","146.75.37.140","TLSv1.3","146","Application Data"
"355","2.008769","192.168.12.35","146.75.37.140","TLSv1.3","615","Application Data"
"356","2.018716","146.75.37.140","192.168.12.35","UDP","67","443  >  52870 Len=25"
"357","2.040295","146.75.37.140","192.168.12.35","UDP","953","443  >  52870 Len=911"
"358","2.049966","192.168.12.35","146.75.37.140","UDP","84","52870  >  443 Len=42"
"359","2.056574","146.75.37.140","192.168.12.35","UDP","67","443  >  52870 Len=25"
"360","2.076514","146.75.37.140","192.168.12.35","UDP","1322","443  >  52870 Len=1280"
"361","2.076514","146.75.37.140","192.168.12.35","UDP","639","443  >  52870 Len=597"
"362","2.081803","146.75.37.140","192.168.12.35","TCP","66","[TCP Dup ACK 349#1] 443  >  63631 [ACK] Seq=1542 Ack=2020 Win=152064 Len=0 SLE=624 SRE=2020"
"363","2.082725","192.168.12.35","146.75.37.140","UDP","84","52870  >  443 Len=42"
"364","2.088083","192.168.12.35","146.75.37.140","TLSv1.2","3351","Application Data"
"365","2.088227","192.168.12.35","146.75.37.140","TLSv1.2","134","Application Data"
"366","2.113938","146.75.37.140","192.168.12.35","TCP","54","443  >  63631 [ACK] Seq=1542 Ack=2084 Win=152064 Len=0"
"367","2.113938","146.75.37.140","192.168.12.35","TCP","54","443  >  63631 [ACK] Seq=1542 Ack=2176 Win=152064 Len=0"
"368","2.113938","146.75.37.140","192.168.12.35","UDP","67","443  >  52870 Len=25"
"369","2.113938","146.75.37.140","192.168.12.35","TLSv1.3","119","Application Data"
"370","2.113938","146.75.37.140","192.168.12.35","TCP","54","443  >  63631 [ACK] Seq=1607 Ack=2737 Win=154624 Len=0"
"371","2.113938","146.75.37.140","192.168.12.35","TLSv1.3","793","Application Data"
"372","2.113938","146.75.37.140","192.168.12.35","TLSv1.3","1430","Application Data"
"373","2.113938","146.75.37.140","192.168.12.35","TLSv1.3","1430","Application Data"
"374","2.114565","146.75.37.140","192.168.12.35","TLSv1.3","1430","Application Data"
"375","2.114565","146.75.37.140","192.168.12.35","TLSv1.3","353","Application Data"
"376","2.114877","192.168.12.35","146.75.37.140","TCP","54","63631  >  443 [ACK] Seq=2737 Ack=2346 Win=261632 Len=0"
"377","2.115132","192.168.12.35","146.75.37.140","TCP","54","63631  >  443 [ACK] Seq=2737 Ack=5098 Win=262400 Len=0"
"378","2.115225","192.168.12.35","146.75.37.140","TCP","54","63631  >  443 [ACK] Seq=2737 Ack=6773 Win=262400 Len=0"
"379","2.116828","192.168.12.35","146.75.37.140","TLSv1.3","85","Application Data"
"380","2.136397","146.75.37.140","192.168.12.35","TCP","54","443  >  63572 [ACK] Seq=119976 Ack=38392 Win=424 Len=0"
"381","2.136397","146.75.37.140","192.168.12.35","UDP","835","443  >  52870 Len=793"
"382","2.136397","146.75.37.140","192.168.12.35","UDP","453","443  >  52870 Len=411"
"383","2.144091","192.168.12.35","146.75.37.140","UDP","84","52870  >  443 Len=42"
"384","2.151892","146.75.37.140","192.168.12.35","TCP","54","443  >  63572 [ACK] Seq=119976 Ack=39788 Win=424 Len=0"
"385","2.153408","192.168.12.35","146.75.37.140","UDP","1292","52870  >  443 Len=1250"
"386","2.153484","192.168.12.35","146.75.37.140","UDP","1022","52870  >  443 Len=980"
"387","2.156825","146.75.37.140","192.168.12.35","TCP","54","443  >  63572 [ACK] Seq=119976 Ack=40293 Win=424 Len=0"
"388","2.156825","146.75.37.140","192.168.12.35","TCP","54","443  >  63572 [ACK] Seq=119976 Ack=40373 Win=424 Len=0"
"389","2.162224","146.75.37.140","192.168.12.35","TCP","54","443  >  63631 [ACK] Seq=6773 Ack=2768 Win=154624 Len=0"
"390","2.177800","146.75.37.140","192.168.12.35","TCP","1430","443  >  63572 [ACK] Seq=119976 Ack=40373 Win=424 Len=1376 [TCP PDU reassembled in 392]"
"391","2.177800","146.75.37.140","192.168.12.35","TCP","1430","443  >  63572 [PSH, ACK] Seq=121352 Ack=40373 Win=424 Len=1376 [TCP PDU reassembled in 392]"
"392","2.177800","146.75.37.140","192.168.12.35","TLSv1.2","100","Application Data"
"393","2.178475","192.168.12.35","146.75.37.140","TCP","54","63572  >  443 [ACK] Seq=40373 Ack=122728 Win=512 Len=0"
"394","2.193572","146.75.37.140","192.168.12.35","UDP","67","443  >  52870 Len=25"
"395","2.221313","192.168.12.35","146.75.37.140","TCP","54","63572  >  443 [ACK] Seq=40373 Ack=122774 Win=512 Len=0"
"396","2.395094","192.168.12.35","146.75.37.140","UDP","80","52870  >  443 Len=38"
"397","2.442722","146.75.37.140","192.168.12.35","UDP","67","443  >  52870 Len=25"
"398","2.657368","192.168.12.35","146.75.37.140","UDP","80","52870  >  443 Len=38"
"399","2.658478","146.75.37.140","192.168.12.35","TLSv1.2","251","Application Data"
"400","2.677854","146.75.37.140","192.168.12.35","TLSv1.2","173","Application Data"
"401","2.677854","146.75.37.140","192.168.12.35","TLSv1.2","1101","Application Data"
"402","2.677854","146.75.37.140","192.168.12.35","TCP","1430","443  >  63572 [ACK] Seq=124137 Ack=40373 Win=424 Len=1376 [TCP PDU reassembled in 403]"
