"No.","Time","Source","Destination","Protocol","Length","Info"
"1","0.000000","192.168.12.35","146.75.37.140","TLSv1.2","3238","Application Data"
"2","0.000069","192.168.12.35","146.75.37.140","TLSv1.2","93","Application Data"
"3","0.000092","192.168.12.35","146.75.37.140","TLSv1.2","3356","Application Data"
"4","0.000134","192.168.12.35","146.75.37.140","TLSv1.2","1312","Application Data"
"5","0.045830","146.75.37.140","192.168.12.35","TCP","54","443  >  61013 [ACK] Seq=1 Ack=1397 Win=8244 Len=0"
"6","0.047907","146.75.37.140","192.168.12.35","TCP","54","443  >  61013 [ACK] Seq=1 Ack=2793 Win=8244 Len=0"
"7","0.047907","146.75.37.140","192.168.12.35","TCP","54","443  >  61013 [ACK] Seq=1 Ack=3185 Win=8244 Len=0"
"8","0.053945","146.75.37.140","192.168.12.35","TCP","54","443  >  61013 [ACK] Seq=1 Ack=3224 Win=8244 Len=0"
"9","0.053945","146.75.37.140","192.168.12.35","TLSv1.2","93","Application Data"
"10","0.064649","146.75.37.140","192.168.12.35","TCP","54","443  >  61013 [ACK] Seq=40 Ack=4620 Win=8244 Len=0"
"11","0.077754","146.75.37.140","192.168.12.35","TCP","54","443  >  61013 [ACK] Seq=40 Ack=6016 Win=8244 Len=0"
"12","0.087994","146.75.37.140","192.168.12.35","TCP","54","443  >  61013 [ACK] Seq=40 Ack=6526 Win=8244 Len=0"
"13","0.100642","146.75.37.140","192.168.12.35","TCP","1430","443  >  61013 [ACK] Seq=40 Ack=6526 Win=8244 Len=1376 [TCP PDU reassembled in 14]"
"14","0.100642","146.75.37.140","192.168.12.35","TLSv1.2","593","Application Data"
"15","0.100642","146.75.37.140","192.168.12.35","TCP","1430","443  >  61013 [ACK] Seq=1955 Ack=6526 Win=8244 Len=1376 [TCP PDU reassembled in 16]"
"16","0.100642","146.75.37.140","192.168.12.35","TLSv1.2","1073","Application Data"
"17","0.100642","146.75.37.140","192.168.12.35","TCP","54","443  >  61013 [ACK] Seq=4350 Ack=7784 Win=8244 Len=0"
"18","0.100642","146.75.37.140","192.168.12.35","TCP","1430","443  >  61013 [ACK] Seq=4350 Ack=7784 Win=8244 Len=1376 [TCP PDU reassembled in 24]"
"19","0.100642","146.75.37.140","192.168.12.35","TCP","1430","443  >  61013 [PSH, ACK] Seq=5726 Ack=7784 Win=8244 Len=1376 [TCP PDU reassembled in 24]"
"20","0.100642","146.75.37.140","192.168.12.35","TCP","1430","443  >  61013 [ACK] Seq=7102 Ack=7784 Win=8244 Len=1376 [TCP PDU reassembled in 24]"
"21","0.100642","146.75.37.140","192.168.12.35","TCP","1430","443  >  61013 [PSH, ACK] Seq=8478 Ack=7784 Win=8244 Len=1376 [TCP PDU reassembled in 24]"
"22","0.100642","146.75.37.140","192.168.12.35","TCP","1430","443  >  61013 [ACK] Seq=9854 Ack=7784 Win=8244 Len=1376 [TCP PDU reassembled in 24]"
"23","0.100642","146.75.37.140","192.168.12.35","TCP","1430","443  >  61013 [PSH, ACK] Seq=11230 Ack=7784 Win=8244 Len=1376 [TCP PDU reassembled in 24]"
"24","0.100642","146.75.37.140","192.168.12.35","TLSv1.2","1430","Application Data"
"25","0.100642","146.75.37.140","192.168.12.35","TCP","1430","443  >  61013 [PSH, ACK] Seq=13982 Ack=7784 Win=8244 Len=1376 [TCP PDU reassembled in 28]"
"26","0.100642","146.75.37.140","192.168.12.35","TCP","1430","443  >  61013 [ACK] Seq=15358 Ack=7784 Win=8244 Len=1376 [TCP PDU reassembled in 28]"
"27","0.100642","146.75.37.140","192.168.12.35","TCP","1430","443  >  61013 [PSH, ACK] Seq=16734 Ack=7784 Win=8244 Len=1376 [TCP PDU reassembled in 28]"
"28","0.100642","146.75.37.140","192.168.12.35","TLSv1.2","376","Application Data"
"29","0.101694","192.168.12.35","146.75.37.140","TCP","54","61013  >  443 [ACK] Seq=7784 Ack=1416 Win=1025 Len=0"
"30","0.101971","192.168.12.35","146.75.37.140","TCP","54","61013  >  443 [ACK] Seq=7784 Ack=3331 Win=1025 Len=0"
"31","0.102083","192.168.12.35","146.75.37.140","TCP","54","61013  >  443 [ACK] Seq=7784 Ack=18110 Win=1025 Len=0"
"32","0.102158","192.168.12.35","146.75.37.140","TCP","54","61013  >  443 [ACK] Seq=7784 Ack=18432 Win=1023 Len=0"
"33","0.106470","146.75.37.140","192.168.12.35","TLSv1.2","868","Application Data"
"34","0.106470","146.75.37.140","192.168.12.35","TLSv1.2","90","Application Data"
"35","0.106470","146.75.37.140","192.168.12.35","TCP","1430","443  >  61013 [ACK] Seq=19282 Ack=7784 Win=8244 Len=1376 [TCP PDU reassembled in 49]"
"36","0.106470","146.75.37.140","192.168.12.35","TCP","1430","443  >  61013 [PSH, ACK] Seq=20658 Ack=7784 Win=8244 Len=1376 [TCP PDU reassembled in 49]"
"37","0.106470","146.75.37.140","192.168.12.35","TCP","1430","443  >  61013 [ACK] Seq=22034 Ack=7784 Win=8244 Len=1376 [TCP PDU reassembled in 49]"
"38","0.106470","146.75.37.140","192.168.12.35","TCP","1430","443  >  61013 [PSH, ACK] Seq=23410 Ack=7784 Win=8244 Len=1376 [TCP PDU reassembled in 49]"
"39","0.107632","192.168.12.35","146.75.37.140","TCP","54","61013  >  443 [ACK] Seq=7784 Ack=19282 Win=1020 Len=0"
"40","0.107804","192.168.12.35","146.75.37.140","TCP","54","61013  >  443 [ACK] Seq=7784 Ack=24786 Win=1025 Len=0"
"41","0.108345","192.168.12.35","146.75.37.140","TLSv1.2","89","Application Data"
"42","0.112307","146.75.37.140","192.168.12.35","TCP","1430","443  >  61013 [ACK] Seq=24786 Ack=7784 Win=8244 Len=1376 [TCP PDU reassembled in 49]"
"43","0.112307","146.75.37.140","192.168.12.35","TCP","1430","443  >  61013 [PSH, ACK] Seq=26162 Ack=7784 Win=8244 Len=1376 [TCP PDU reassembled in 49]"
"44","0.112307","146.75.37.140","192.168.12.35","TCP","1430","443  >  61013 [ACK] Seq=27538 Ack=7784 Win=8244 Len=1376 [TCP PDU reassembled in 49]"
"45","0.112307","146.75.37.140","192.168.12.35","TCP","1430","443  >  61013 [PSH, ACK] Seq=28914 Ack=7784 Win=8244 Len=1376 [TCP PDU reassembled in 49]"
"46","0.112307","146.75.37.140","192.168.12.35","TCP","1430","443  >  61013 [ACK] Seq=30290 Ack=7784 Win=8244 Len=1376 [TCP PDU reassembled in 49]"
"47","0.112307","146.75.37.140","192.168.12.35","TCP","1430","443  >  61013 [PSH, ACK] Seq=31666 Ack=7784 Win=8244 Len=1376 [TCP PDU reassembled in 49]"
"48","0.112307","146.75.37.140","192.168.12.35","TCP","1430","443  >  61013 [ACK] Seq=33042 Ack=7784 Win=8244 Len=1376 [TCP PDU reassembled in 49]"
"49","0.112307","146.75.37.140","192.168.12.35","TLSv1.2","545","Application Data"
"50","0.113028","192.168.12.35","146.75.37.140","TCP","54","61013  >  443 [ACK] Seq=7819 Ack=34418 Win=1025 Len=0"
"51","0.113169","192.168.12.35","146.75.37.140","TCP","54","61013  >  443 [ACK] Seq=7819 Ack=34909 Win=1023 Len=0"
"52","0.118377","146.75.37.140","192.168.12.35","TCP","1430","443  >  61013 [ACK] Seq=34909 Ack=7784 Win=8244 Len=1376 [TCP PDU reassembled in 64]"
"53","0.118377","146.75.37.140","192.168.12.35","TCP","1430","443  >  61013 [PSH, ACK] Seq=36285 Ack=7784 Win=8244 Len=1376 [TCP PDU reassembled in 64]"
"54","0.118850","192.168.12.35","146.75.37.140","TCP","54","61013  >  443 [ACK] Seq=7819 Ack=37661 Win=1025 Len=0"
"55","0.123663","146.75.37.140","192.168.12.35","TCP","1430","443  >  61013 [ACK] Seq=37661 Ack=7784 Win=8244 Len=1376 [TCP PDU reassembled in 64]"
"56","0.123663","146.75.37.140","192.168.12.35","TCP","1430","443  >  61013 [PSH, ACK] Seq=39037 Ack=7784 Win=8244 Len=1376 [TCP PDU reassembled in 64]"
"57","0.123663","146.75.37.140","192.168.12.35","TCP","1430","443  >  61013 [ACK] Seq=40413 Ack=7784 Win=8244 Len=1376 [TCP PDU reassembled in 64]"
"58","0.123663","146.75.37.140","192.168.12.35","TCP","1430","443  >  61013 [PSH, ACK] Seq=41789 Ack=7784 Win=8244 Len=1376 [TCP PDU reassembled in 64]"
"59","0.123663","146.75.37.140","192.168.12.35","TCP","1430","443  >  61013 [ACK] Seq=43165 Ack=7784 Win=8244 Len=1376 [TCP PDU reassembled in 64]"
"60","0.123663","146.75.37.140","192.168.12.35","TCP","1430","443  >  61013 [PSH, ACK] Seq=44541 Ack=7784 Win=8244 Len=1376 [TCP PDU reassembled in 64]"
"61","0.123663","146.75.37.140","192.168.12.35","TCP","1430","443  >  61013 [ACK] Seq=45917 Ack=7784 Win=8244 Len=1376 [TCP PDU reassembled in 64]"
"62","0.123663","146.75.37.140","192.168.12.35","TCP","1430","443  >  61013 [PSH, ACK] Seq=47293 Ack=7784 Win=8244 Len=1376 [TCP PDU reassembled in 64]"
"63","0.123663","146.75.37.140","192.168.12.35","TCP","1430","443  >  61013 [ACK] Seq=48669 Ack=7784 Win=8244 Len=1376 [TCP PDU reassembled in 64]"
"64","0.123663","146.75.37.140","192.168.12.35","TLSv1.2","1430","Application Data"
"65","0.123663","146.75.37.140","192.168.12.35","TCP","1430","443  >  61013 [ACK] Seq=51421 Ack=7784 Win=8244 Len=1376 [TCP PDU reassembled in 68]"
"66","0.123663","146.75.37.140","192.168.12.35","TCP","1430","443  >  61013 [PSH, ACK] Seq=52797 Ack=7784 Win=8244 Len=1376 [TCP PDU reassembled in 68]"
"67","0.123663","146.75.37.140","192.168.12.35","TCP","1430","443  >  61013 [ACK] Seq=54173 Ack=7784 Win=8244 Len=1376 [TCP PDU reassembled in 68]"
"68","0.123663","146.75.37.140","192.168.12.35","TLSv1.2","280","Application Data"
"69","0.123663","146.75.37.140","192.168.12.35","TLSv1.2","1051","Application Data"
"70","0.123663","146.75.37.140","192.168.12.35","TLSv1.2","1181","Application Data"
"71","0.123663","146.75.37.140","192.168.12.35","TLSv1.2","1068","Application Data"
"72","0.123663","146.75.37.140","192.168.12.35","TLSv1.2","1191","Application Data"
"73","0.123663","146.75.37.140","192.168.12.35","TLSv1.2","603","Application Data"
"74","0.123663","146.75.37.140","192.168.12.35","TCP","1430","443  >  61013 [ACK] Seq=60599 Ack=7784 Win=8244 Len=1376 [TCP PDU reassembled in 81]"
"75","0.123663","146.75.37.140","192.168.12.35","TCP","1430","443  >  61013 [PSH, ACK] Seq=61975 Ack=7784 Win=8244 Len=1376 [TCP PDU reassembled in 81]"
"76","0.124547","192.168.12.35","146.75.37.140","TCP","54","61013  >  443 [ACK] Seq=7819 Ack=55549 Win=1025 Len=0"
"77","0.124721","192.168.12.35","146.75.37.140","TCP","54","61013  >  443 [ACK] Seq=7819 Ack=55775 Win=1024 Len=0"
"78","0.124773","192.168.12.35","146.75.37.140","TCP","54","61013  >  443 [ACK] Seq=7819 Ack=57899 Win=1025 Len=0"
"79","0.124819","192.168.12.35","146.75.37.140","TCP","54","61013  >  443 [ACK] Seq=7819 Ack=60050 Win=1025 Len=0"
"80","0.124890","192.168.12.35","146.75.37.140","TCP","54","61013  >  443 [ACK] Seq=7819 Ack=63351 Win=1025 Len=0"
"81","0.129291","146.75.37.140","192.168.12.35","TLSv1.2","594","Application Data"
"82","0.129291","146.75.37.140","192.168.12.35","TLSv1.2","781","Application Data"
"83","0.129291","146.75.37.140","192.168.12.35","TLSv1.2","213","Application Data"
"84","0.129291","146.75.37.140","192.168.12.35","TLSv1.2","547","Application Data"
"85","0.129291","146.75.37.140","192.168.12.35","TLSv1.2","849","Application Data"
"86","0.129291","146.75.37.140","192.168.12.35","TLSv1.2","653","Application Data"
"87","0.129291","146.75.37.140","192.168.12.35","TLSv1.2","320","Application Data"
"88","0.129291","146.75.37.140","192.168.12.35","TLSv1.2","487","Application Data"
"89","0.129291","146.75.37.140","192.168.12.35","TLSv1.2","399","Application Data"
"90","0.129291","146.75.37.140","192.168.12.35","TLSv1.2","129","Application Data"
"91","0.129291","146.75.37.140","192.168.12.35","TLSv1.2","156","Application Data"
"92","0.129291","146.75.37.140","192.168.12.35","TLSv1.2","119","Application Data"
"93","0.129291","146.75.37.140","192.168.12.35","TLSv1.2","108","Application Data"
"94","0.129291","146.75.37.140","192.168.12.35","TLSv1.2","306","Application Data"
"95","0.129291","146.75.37.140","192.168.12.35","TLSv1.2","107","Application Data"
"96","0.129291","146.75.37.140","192.168.12.35","TLSv1.2","251","Application Data"
"97","0.129291","146.75.37.140","192.168.12.35","TLSv1.2","291","Application Data"
"98","0.130222","192.168.12.35","146.75.37.140","TCP","54","61013  >  443 [ACK] Seq=7819 Ack=63891 Win=1023 Len=0"
"99","0.130806","192.168.12.35","146.75.37.140","TCP","54","61013  >  443 [ACK] Seq=7819 Ack=64777 Win=1025 Len=0"
"100","0.130981","192.168.12.35","146.75.37.140","TCP","54","61013  >  443 [ACK] Seq=7819 Ack=66065 Win=1020 Len=0"
"101","0.131023","192.168.12.35","146.75.37.140","TCP","54","61013  >  443 [ACK] Seq=7819 Ack=66664 Win=1025 Len=0"
"102","0.131060","192.168.12.35","146.75.37.140","TCP","54","61013  >  443 [ACK] Seq=7819 Ack=66930 Win=1024 Len=0"
"103","0.131139","192.168.12.35","146.75.37.140","TCP","54","61013  >  443 [ACK] Seq=7819 Ack=67708 Win=1021 Len=0"
"104","0.131211","192.168.12.35","146.75.37.140","TCP","54","61013  >  443 [ACK] Seq=7819 Ack=67885 Win=1020 Len=0"
"105","0.131269","192.168.12.35","146.75.37.140","TCP","54","61013  >  443 [ACK] Seq=7819 Ack=68004 Win=1019 Len=0"
"106","0.131322","192.168.12.35","146.75.37.140","TCP","54","61013  >  443 [ACK] Seq=7819 Ack=68256 Win=1025 Len=0"
"107","0.131372","192.168.12.35","146.75.37.140","TCP","54","61013  >  443 [ACK] Seq=7819 Ack=68309 Win=1024 Len=0"
"108","0.131422","192.168.12.35","146.75.37.140","TCP","54","61013  >  443 [ACK] Seq=7819 Ack=68743 Win=1023 Len=0"
"109","0.136940","146.75.37.140","192.168.12.35","TLSv1.2","192","Application Data"
"110","0.136940","146.75.37.140","192.168.12.35","TLSv1.2","177","Application Data"
"111","0.136940","146.75.37.140","192.168.12.35","TLSv1.2","131","Application Data"
"112","0.136940","146.75.37.140","192.168.12.35","TLSv1.2","451","Application Data"
"113","0.136940","146.75.37.140","192.168.12.35","TLSv1.2","255","Application Data"
"114","0.136940","146.75.37.140","192.168.12.35","TLSv1.2","138","Application Data"
"115","0.136940","146.75.37.140","192.168.12.35","TLSv1.2","108","Application Data"
"116","0.136940","146.75.37.140","192.168.12.35","TCP","54","443  >  61013 [ACK] Seq=69817 Ack=7819 Win=8244 Len=0"
"117","0.137735","192.168.12.35","146.75.37.140","TCP","54","61013  >  443 [ACK] Seq=7819 Ack=69004 Win=1022 Len=0"
"118","0.138035","192.168.12.35","146.75.37.140","TCP","54","61013  >  443 [ACK] Seq=7819 Ack=69478 Win=1020 Len=0"
"119","0.138078","192.168.12.35","146.75.37.140","TCP","54","61013  >  443 [ACK] Seq=7819 Ack=69763 Win=1025 Len=0"
"120","0.159939","192.168.12.35","146.75.37.140","UDP","96","50355  >  443 Len=54"
"121","0.180389","192.168.12.35","146.75.37.140","TCP","54","61013  >  443 [ACK] Seq=7819 Ack=69817 Win=1024 Len=0"
"122","0.183169","146.75.37.140","192.168.12.35","UDP","67","443  >  50355 Len=25"
"123","0.196534","192.168.12.35","146.75.37.140","UDP","84","50355  >  443 Len=42"
"124","0.211137","146.75.37.140","192.168.12.35","UDP","67","443  >  50355 Len=25"
"125","0.587571","146.75.37.140","192.168.12.35","TLSv1.2","564","Application Data"
"126","0.587571","146.75.37.140","192.168.12.35","TLSv1.2","133","Application Data"
"127","0.587571","146.75.37.140","192.168.12.35","TLSv1.2","399","Application Data"
"128","0.588237","192.168.12.35","146.75.37.140","TCP","54","61013  >  443 [ACK] Seq=7819 Ack=70406 Win=1022 Len=0"
"129","0.596195","146.75.37.140","192.168.12.35","TLSv1.2","186","Application Data"
"130","0.596195","146.75.37.140","192.168.12.35","TLSv1.2","301","Application Data"
"131","0.596195","146.75.37.140","192.168.12.35","TLSv1.2","114","Application Data"
"132","0.596195","146.75.37.140","192.168.12.35","TLSv1.2","198","Application Data"
"133","0.596195","146.75.37.140","192.168.12.35","TLSv1.2","115","Application Data"
"134","0.596195","146.75.37.140","192.168.12.35","TLSv1.2","743","Application Data"
"135","0.596195","146.75.37.140","192.168.12.35","TLSv1.2","114","Application Data"
"136","0.596195","146.75.37.140","192.168.12.35","TLSv1.2","223","Application Data"
"137","0.596195","146.75.37.140","192.168.12.35","TLSv1.2","374","Application Data"
"138","0.596195","146.75.37.140","192.168.12.35","TLSv1.2","238","Application Data"
"139","0.596195","146.75.37.140","192.168.12.35","TLSv1.2","1021","Application Data"
"140","0.597240","192.168.12.35","146.75.37.140","TCP","54","61013  >  443 [ACK] Seq=7819 Ack=70883 Win=1020 Len=0"
"141","0.597696","192.168.12.35","146.75.37.140","TCP","54","61013  >  443 [ACK] Seq=7819 Ack=71190 Win=1025 Len=0"
"142","0.597790","192.168.12.35","146.75.37.140","TCP","54","61013  >  443 [ACK] Seq=7819 Ack=71395 Win=1024 Len=0"
"143","0.597838","192.168.12.35","146.75.37.140","TCP","54","61013  >  443 [ACK] Seq=7819 Ack=72144 Win=1021 Len=0"
"144","0.597893","192.168.12.35","146.75.37.140","TCP","54","61013  >  443 [ACK] Seq=7819 Ack=72633 Win=1025 Len=0"
"145","0.597985","192.168.12.35","146.75.37.140","TCP","54","61013  >  443 [ACK] Seq=7819 Ack=73784 Win=1020 Len=0"
"146","0.603317","146.75.37.140","192.168.12.35","TLSv1.2","695","Application Data"
"147","0.603317","146.75.37.140","192.168.12.35","TLSv1.2","1070","Application Data"
"148","0.603317","146.75.37.140","192.168.12.35","TLSv1.2","288","Application Data"
"149","0.604693","192.168.12.35","146.75.37.140","TCP","54","61013  >  443 [ACK] Seq=7819 Ack=75441 Win=1025 Len=0"
"150","0.610479","146.75.37.140","192.168.12.35","TCP","1430","443  >  61013 [ACK] Seq=75675 Ack=7819 Win=8244 Len=1376 [TCP PDU reassembled in 151]"
"151","0.610479","146.75.37.140","192.168.12.35","TLSv1.2","118","Application Data"
"152","0.610479","146.75.37.140","192.168.12.35","TLSv1.2","351","Application Data"
"153","0.610479","146.75.37.140","192.168.12.35","TLSv1.2","173","Application Data"
"154","0.610479","146.75.37.140","192.168.12.35","TLSv1.2","839","Application Data"
"155","0.610479","146.75.37.140","192.168.12.35","TLSv1.2","389","Application Data"
"156","0.610479","146.75.37.140","192.168.12.35","TLSv1.2","426","Application Data"
"157","0.610479","146.75.37.140","192.168.12.35","TLSv1.2","421","Application Data"
"158","0.610479","146.75.37.140","192.168.12.35","TLSv1.2","237","Application Data"
"159","0.610479","146.75.37.140","192.168.12.35","TLSv1.2","258","Application Data"
"160","0.610479","146.75.37.140","192.168.12.35","TLSv1.2","371","Application Data"
"161","0.610479","146.75.37.140","192.168.12.35","TLSv1.2","97","Application Data"
"162","0.610479","146.75.37.140","192.168.12.35","TLSv1.2","266","Application Data"
"163","0.610479","146.75.37.140","192.168.12.35","TLSv1.2","164","Application Data"
"164","0.610479","146.75.37.140","192.168.12.35","TLSv1.2","464","Application Data"
"165","0.610479","146.75.37.140","192.168.12.35","TLSv1.2","404","Application Data"
"166","0.610479","146.75.37.140","192.168.12.35","TLSv1.2","892","Application Data"
"167","0.610479","146.75.37.140","192.168.12.35","TLSv1.2","180","Application Data"
"168","0.610479","146.75.37.140","192.168.12.35","TLSv1.2","437","Application Data"
"169","0.611804","192.168.12.35","146.75.37.140","TCP","54","61013  >  443 [ACK] Seq=7819 Ack=77051 Win=1025 Len=0"
"170","0.612120","192.168.12.35","146.75.37.140","TCP","54","61013  >  443 [ACK] Seq=7819 Ack=77412 Win=1023 Len=0"
"171","0.612193","192.168.12.35","146.75.37.140","TCP","54","61013  >  443 [ACK] Seq=7819 Ack=78316 Win=1020 Len=0"
"172","0.612254","192.168.12.35","146.75.37.140","TCP","54","61013  >  443 [ACK] Seq=7819 Ack=79023 Win=1025 Len=0"
"173","0.612312","192.168.12.35","146.75.37.140","TCP","54","61013  >  443 [ACK] Seq=7819 Ack=79573 Win=1023 Len=0"
"174","0.612373","192.168.12.35","146.75.37.140","TCP","54","61013  >  443 [ACK] Seq=7819 Ack=80094 Win=1021 Len=0"
"175","0.612418","192.168.12.35","146.75.37.140","TCP","54","61013  >  443 [ACK] Seq=7819 Ack=80349 Win=1020 Len=0"
"176","0.612456","192.168.12.35","146.75.37.140","TCP","54","61013  >  443 [ACK] Seq=7819 Ack=80869 Win=1025 Len=0"
"177","0.612499","192.168.12.35","146.75.37.140","TCP","54","61013  >  443 [ACK] Seq=7819 Ack=82057 Win=1020 Len=0"
"178","0.612550","192.168.12.35","146.75.37.140","TCP","54","61013  >  443 [ACK] Seq=7819 Ack=82566 Win=1025 Len=0"
"179","0.614905","146.75.37.140","192.168.12.35","TLSv1.2","1091","Application Data"
"180","0.614905","146.75.37.140","192.168.12.35","TLSv1.2","260","Application Data"
"181","0.614905","146.75.37.140","192.168.12.35","TLSv1.2","335","Application Data"
"182","0.614905","146.75.37.140","192.168.12.35","TLSv1.2","195","Application Data"
"183","0.614905","146.75.37.140","192.168.12.35","TLSv1.2","731","Application Data"
"184","0.614905","146.75.37.140","192.168.12.35","TLSv1.2","225","Application Data"
"185","0.614905","146.75.37.140","192.168.12.35","TLSv1.2","233","Application Data"
"186","0.614905","146.75.37.140","192.168.12.35","TLSv1.2","655","Application Data"
"187","0.614905","146.75.37.140","192.168.12.35","TLSv1.2","202","Application Data"
"188","0.614905","146.75.37.140","192.168.12.35","TLSv1.2","472","Application Data"
"189","0.614905","146.75.37.140","192.168.12.35","TLSv1.2","226","Application Data"
"190","0.614905","146.75.37.140","192.168.12.35","TLSv1.2","360","Application Data"
"191","0.614905","146.75.37.140","192.168.12.35","TLSv1.2","225","Application Data"
"192","0.614905","146.75.37.140","192.168.12.35","TLSv1.2","281","Application Data"
"193","0.616011","192.168.12.35","146.75.37.140","TCP","54","61013  >  443 [ACK] Seq=7819 Ack=83809 Win=1020 Len=0"
"194","0.616248","192.168.12.35","146.75.37.140","TCP","54","61013  >  443 [ACK] Seq=7819 Ack=84231 Win=1025 Len=0"
"195","0.616363","192.168.12.35","146.75.37.140","TCP","54","61013  >  443 [ACK] Seq=7819 Ack=85079 Win=1021 Len=0"
"196","0.616412","192.168.12.35","146.75.37.140","TCP","54","61013  >  443 [ACK] Seq=7819 Ack=85859 Win=1025 Len=0"
"197","0.616464","192.168.12.35","146.75.37.140","TCP","54","61013  >  443 [ACK] Seq=7819 Ack=86425 Win=1022 Len=0"
"198","0.616549","192.168.12.35","146.75.37.140","TCP","54","61013  >  443 [ACK] Seq=7819 Ack=86903 Win=1021 Len=0"
"199","0.616582","192.168.12.35","146.75.37.140","TCP","54","61013  >  443 [ACK] Seq=7819 Ack=87301 Win=1025 Len=0"
"200","0.625799","146.75.37.140","192.168.12.35","TLSv1.2","178","Application Data"
"201","0.625799","146.75.37.140","192.168.12.35","TLSv1.2","422","Application Data"
"202","0.625799","146.75.37.140","192.168.12.35","TLSv1.2","155","Application Data"
"203","0.625799","146.75.37.140","192.168.12.35","TLSv1.2","956","Application Data"
"204","0.625799","146.75.37.140","192.168.12.35","TLSv1.2","560","Application Data"
"205","0.625799","146.75.37.140","192.168.12.35","TLSv1.2","233","Application Data"
"206","0.625799","146.75.37.140","192.168.12.35","TLSv1.2","259","Application Data"
"207","0.625799","146.75.37.140","192.168.12.35","TLSv1.2","94","Application Data"
"208","0.625799","146.75.37.140","192.168.12.35","TLSv1.2","527","Application Data"
"209","0.626467","192.168.12.35","146.75.37.140","TCP","54","61013  >  443 [ACK] Seq=7819 Ack=87793 Win=1023 Len=0"
"210","0.626920","192.168.12.35","146.75.37.140","TCP","54","61013  >  443 [ACK] Seq=7819 Ack=88796 Win=1025 Len=0"
"211","0.626986","192.168.12.35","146.75.37.140","TCP","54","61013  >  443 [ACK] Seq=7819 Ack=89481 Win=1022 Len=0"
"212","0.627043","192.168.12.35","146.75.37.140","TCP","54","61013  >  443 [ACK] Seq=7819 Ack=89726 Win=1021 Len=0"
"213","0.638633","146.75.37.140","192.168.12.35","TLSv1.2","655","Application Data"
"214","0.638633","146.75.37.140","192.168.12.35","TLSv1.2","697","Application Data"
"215","0.638633","146.75.37.140","192.168.12.35","TLSv1.2","310","Application Data"
"216","0.638633","146.75.37.140","192.168.12.35","TLSv1.2","1229","Application Data"
"217","0.638633","146.75.37.140","192.168.12.35","TLSv1.2","393","Application Data"
"218","0.638633","146.75.37.140","192.168.12.35","TLSv1.2","835","Application Data"
"219","0.638633","146.75.37.140","192.168.12.35","TLSv1.2","155","Application Data"
"220","0.638633","146.75.37.140","192.168.12.35","TLSv1.2","105","Application Data"
"221","0.638633","146.75.37.140","192.168.12.35","TLSv1.2","467","Application Data"
"222","0.638633","146.75.37.140","192.168.12.35","TLSv1.2","385","Application Data"
"223","0.638633","146.75.37.140","192.168.12.35","TLSv1.2","85","Application Data"
"224","0.639607","192.168.12.35","146.75.37.140","TCP","54","61013  >  443 [ACK] Seq=7819 Ack=90800 Win=1025 Len=0"
"225","0.639956","192.168.12.35","146.75.37.140","TCP","54","61013  >  443 [ACK] Seq=7819 Ack=91699 Win=1021 Len=0"
"226","0.640049","192.168.12.35","146.75.37.140","TCP","54","61013  >  443 [ACK] Seq=7819 Ack=93213 Win=1025 Len=0"
"227","0.640112","192.168.12.35","146.75.37.140","TCP","54","61013  >  443 [ACK] Seq=7819 Ack=94095 Win=1021 Len=0"
"228","0.640182","192.168.12.35","146.75.37.140","TCP","54","61013  >  443 [ACK] Seq=7819 Ack=94559 Win=1019 Len=0"
"229","0.640285","192.168.12.35","146.75.37.140","TCP","54","61013  >  443 [ACK] Seq=7819 Ack=94921 Win=1025 Len=0"
"230","0.714548","192.168.12.35","146.75.37.140","TLSv1.2","3184","Application Data"
"231","0.714742","192.168.12.35","146.75.37.140","TLSv1.2","718","Application Data"
"232","0.714771","192.168.12.35","146.75.37.140","TLSv1.2","3187","Application Data"
"233","0.748306","192.168.12.35","146.75.37.140","TLSv1.2","3197","Application Data"
"234","0.757208","146.75.37.140","192.168.12.35","TCP","54","443  >  61013 [ACK] Seq=94921 Ack=9215 Win=8244 Len=0"
"235","0.757208","146.75.37.140","192.168.12.35","TCP","54","443  >  61013 [ACK] Seq=94921 Ack=10611 Win=8244 Len=0"
"236","0.757208","146.75.37.140","192.168.12.35","TCP","54","443  >  61013 [ACK] Seq=94921 Ack=10949 Win=8244 Len=0"
"237","0.762668","146.75.37.140","192.168.12.35","TCP","54","443  >  61013 [ACK] Seq=94921 Ack=11613 Win=8244 Len=0"
"238","0.768055","146.75.37.140","192.168.12.35","TCP","54","443  >  61013 [ACK] Seq=94921 Ack=13009 Win=8244 Len=0"
"239","0.785065","146.75.37.140","192.168.12.35","TCP","54","443  >  61013 [ACK] Seq=94921 Ack=14405 Win=8244 Len=0"
"240","0.785065","146.75.37.140","192.168.12.35","TCP","54","443  >  61013 [ACK] Seq=94921 Ack=14746 Win=8244 Len=0"
"241","0.794549","146.75.37.140","192.168.12.35","TCP","1430","443  >  61013 [ACK] Seq=94921 Ack=14746 Win=8244 Len=1376 [TCP PDU reassembled in 242]"
"242","0.794549","146.75.37.140","192.168.12.35","TLSv1.2","439","Application Data"
"243","0.794549","146.75.37.140","192.168.12.35","TCP","54","443  >  61013 [ACK] Seq=96682 Ack=16142 Win=8244 Len=0"
"244","0.795241","192.168.12.35","146.75.37.140","TCP","54","61013  >  443 [ACK] Seq=17889 Ack=96682 Win=1025 Len=0"
"245","0.807717","146.75.37.140","192.168.12.35","TCP","1430","443  >  61013 [ACK] Seq=96682 Ack=16142 Win=8244 Len=1376 [TCP PDU reassembled in 246]"
"246","0.807717","146.75.37.140","192.168.12.35","TLSv1.2","824","Application Data"
"247","0.807717","146.75.37.140","192.168.12.35","TCP","54","443  >  61013 [ACK] Seq=98828 Ack=17538 Win=8244 Len=0"
"248","0.808097","192.168.12.35","146.75.37.140","TCP","54","61013  >  443 [ACK] Seq=17889 Ack=98828 Win=1025 Len=0"
"249","0.812459","146.75.37.140","192.168.12.35","TCP","54","443  >  61013 [ACK] Seq=98828 Ack=17889 Win=8244 Len=0"
"250","0.840146","146.75.37.140","192.168.12.35","TCP","1430","443  >  61013 [ACK] Seq=98828 Ack=17889 Win=8244 Len=1376 [TCP PDU reassembled in 251]"
"251","0.840146","146.75.37.140","192.168.12.35","TLSv1.2","533","Application Data"
"252","0.840146","146.75.37.140","192.168.12.35","TLSv1.2","100","Application Data"
"253","0.840479","192.168.12.35","146.75.37.140","TCP","54","61013  >  443 [ACK] Seq=17889 Ack=100683 Win=1025 Len=0"
"254","0.870783","192.168.12.35","146.75.37.140","TLSv1.2","3176","Application Data"
"255","0.871188","192.168.12.35","146.75.37.140","TLSv1.2","210","Application Data"
"256","0.882863","146.75.37.140","192.168.12.35","TLSv1.2","594","Application Data"
"257","0.887461","146.75.37.140","192.168.12.35","TLSv1.2","95","Application Data"
"258","0.887836","192.168.12.35","146.75.37.140","TCP","54","61013  >  443 [ACK] Seq=21167 Ack=101310 Win=1022 Len=0"
"259","0.912666","146.75.37.140","192.168.12.35","TCP","54","443  >  61013 [ACK] Seq=101310 Ack=19285 Win=8244 Len=0"
"260","0.923414","146.75.37.140","192.168.12.35","TCP","54","443  >  61013 [ACK] Seq=101310 Ack=20681 Win=8244 Len=0"
"261","0.928525","146.75.37.140","192.168.12.35","TCP","54","443  >  61013 [ACK] Seq=101310 Ack=21011 Win=8244 Len=0"
"262","0.928525","146.75.37.140","192.168.12.35","TCP","54","443  >  61013 [ACK] Seq=101310 Ack=21167 Win=8244 Len=0"
"263","0.982702","146.75.37.140","192.168.12.35","TCP","1430","443  >  61013 [ACK] Seq=101310 Ack=21167 Win=8244 Len=1376 [TCP PDU reassembled in 264]"
"264","0.982702","146.75.37.140","192.168.12.35","TLSv1.2","829","Application Data"
"265","0.982702","146.75.37.140","192.168.12.35","TLSv1.2","222","Application Data"
"266","0.983325","192.168.12.35","146.75.37.140","TCP","54","61013  >  443 [ACK] Seq=21167 Ack=103461 Win=1025 Len=0"
"267","1.034663","192.168.12.35","146.75.37.140","TCP","54","61013  >  443 [ACK] Seq=21167 Ack=103629 Win=1024 Len=0"
"268","1.038328","192.168.12.35","146.75.37.140","TLSv1.2","3290","Application Data"
"269","1.047512","192.168.12.35","146.75.37.140","TLSv1.2","3195","Application Data"
"270","1.048474","192.168.12.35","146.75.37.140","TLSv1.2","3210","Application Data"
"271","1.048687","192.168.12.35","146.75.37.140","TLSv1.2","3187","Application Data"
"272","1.051324","192.168.12.35","146.75.37.140","TLSv1.2","195","Application Data"
"273","1.051468","192.168.12.35","146.75.37.140","TLSv1.2","93","Application Data"
"274","1.073803","146.75.37.140","192.168.12.35","TCP","54","443  >  61013 [ACK] Seq=103629 Ack=22563 Win=8244 Len=0"
"275","1.089252","146.75.37.140","192.168.12.35","TCP","54","443  >  61013 [ACK] Seq=103629 Ack=23959 Win=8244 Len=0"
"276","1.089252","146.75.37.140","192.168.12.35","TCP","54","443  >  61013 [ACK] Seq=103629 Ack=24403 Win=8244 Len=0"
"277","1.099031","192.168.12.35","146.75.37.140","TLSv1.2","3175","Application Data"
"278","1.099480","192.168.12.35","146.75.37.140","TLSv1.2","134","Application Data"
"279","1.112781","146.75.37.140","192.168.12.35","TCP","54","443  >  61013 [ACK] Seq=103629 Ack=25799 Win=8244 Len=0"
"280","1.125827","146.75.37.140","192.168.12.35","TCP","1430","443  >  61013 [ACK] Seq=103629 Ack=27195 Win=8244 Len=1376 [TCP PDU reassembled in 281]"
"281","1.125827","146.75.37.140","192.168.12.35","TLSv1.2","513","Application Data"
"282","1.125827","146.75.37.140","192.168.12.35","TLSv1.2","100","Application Data"
"283","1.125827","146.75.37.140","192.168.12.35","TCP","54","443  >  61013 [ACK] Seq=105510 Ack=27544 Win=8244 Len=0"
"284","1.126745","192.168.12.35","146.75.37.140","TCP","54","61013  >  443 [ACK] Seq=37034 Ack=105464 Win=1025 Len=0"
"285","1.145924","146.75.37.140","192.168.12.35","TCP","54","443  >  61013 [ACK] Seq=105510 Ack=28940 Win=8244 Len=0"
"286","1.147762","192.168.12.35","146.75.37.140","TLSv1.2","146","Application Data"
"287","1.147868","192.168.12.35","146.75.37.140","TLSv1.2","93","Application Data"
"288","1.157845","146.75.37.140","192.168.12.35","TCP","1430","443  >  61013 [ACK] Seq=105510 Ack=28940 Win=8244 Len=1376 [TCP PDU reassembled in 289]"
"289","1.157845","146.75.37.140","192.168.12.35","TLSv1.2","850","Application Data"
"290","1.157845","146.75.37.140","192.168.12.35","TCP","54","443  >  61013 [ACK] Seq=107682 Ack=30700 Win=8244 Len=0"
"291","1.158474","192.168.12.35","146.75.37.140","TCP","54","61013  >  443 [ACK] Seq=37034 Ack=106886 Win=1025 Len=0"
"292","1.184975","146.75.37.140","192.168.12.35","TCP","54","443  >  61013 [ACK] Seq=107682 Ack=32096 Win=8244 Len=0"
"293","1.184975","146.75.37.140","192.168.12.35","TCP","54","443  >  61013 [ACK] Seq=107682 Ack=33833 Win=8244 Len=0"
"294","1.200842","146.75.37.140","192.168.12.35","TCP","54","443  >  61034 [ACK] Seq=1 Ack=142 Win=424 Len=0"
"295","1.200842","146.75.37.140","192.168.12.35","TCP","54","443  >  61034 [ACK] Seq=1 Ack=181 Win=424 Len=0"
"296","1.200842","146.75.37.140","192.168.12.35","TLSv1.2","93","Application Data"
"297","1.200842","146.75.37.140","192.168.12.35","TLSv1.2","1034","Application Data"
"298","1.200842","146.75.37.140","192.168.12.35","TLSv1.2","183","Application Data"
"299","1.200842","146.75.37.140","192.168.12.35","TCP","1430","443  >  61034 [ACK] Seq=169 Ack=181 Win=424 Len=1376 [TCP PDU reassembled in 313]"
"300","1.200842","146.75.37.140","192.168.12.35","TCP","1430","443  >  61034 [ACK] Seq=1545 Ack=181 Win=424 Len=1376 [TCP PDU reassembled in 313]"
"301","1.200842","146.75.37.140","192.168.12.35","TCP","1430","443  >  61034 [ACK] Seq=2921 Ack=181 Win=424 Len=1376 [TCP PDU reassembled in 313]"
"302","1.200842","146.75.37.140","192.168.12.35","TCP","1430","443  >  61034 [ACK] Seq=4297 Ack=181 Win=424 Len=1376 [TCP PDU reassembled in 313]"
"303","1.200842","146.75.37.140","192.168.12.35","TCP","1430","443  >  61034 [ACK] Seq=5673 Ack=181 Win=424 Len=1376 [TCP PDU reassembled in 313]"
"304","1.200842","146.75.37.140","192.168.12.35","TCP","1430","443  >  61034 [ACK] Seq=7049 Ack=181 Win=424 Len=1376 [TCP PDU reassembled in 313]"
"305","1.200842","146.75.37.140","192.168.12.35","TCP","1430","443  >  61034 [ACK] Seq=8425 Ack=181 Win=424 Len=1376 [TCP PDU reassembled in 313]"
"306","1.200842","146.75.37.140","192.168.12.35","TCP","1430","443  >  61034 [ACK] Seq=9801 Ack=181 Win=424 Len=1376 [TCP PDU reassembled in 313]"
"307","1.200842","146.75.37.140","192.168.12.35","TCP","1430","443  >  61034 [ACK] Seq=11177 Ack=181 Win=424 Len=1376 [TCP PDU reassembled in 313]"
"308","1.201794","192.168.12.35","146.75.37.140","TCP","54","61034  >  443 [ACK] Seq=181 Ack=169 Win=8197 Len=0"
"309","1.202020","192.168.12.35","146.75.37.140","TCP","54","61034  >  443 [ACK] Seq=181 Ack=12553 Win=8201 Len=0"
"310","1.202148","192.168.12.35","146.75.37.140","TCP","54","61013  >  443 [ACK] Seq=37034 Ack=108662 Win=1025 Len=0"
"311","1.208589","146.75.37.140","192.168.12.35","TCP","1430","443  >  61034 [ACK] Seq=12553 Ack=181 Win=424 Len=1376 [TCP PDU reassembled in 313]"
"312","1.208589","146.75.37.140","192.168.12.35","TCP","1430","443  >  61034 [ACK] Seq=13929 Ack=181 Win=424 Len=1376 [TCP PDU reassembled in 313]"
"313","1.208589","146.75.37.140","192.168.12.35","TLSv1.2","1430","Application Data"
"314","1.208589","146.75.37.140","192.168.12.35","TCP","1430","443  >  61034 [ACK] Seq=16681 Ack=181 Win=424 Len=1376 [TCP PDU reassembled in 325]"
"315","1.208589","146.75.37.140","192.168.12.35","TCP","1430","443  >  61034 [ACK] Seq=18057 Ack=181 Win=424 Len=1376 [TCP PDU reassembled in 325]"
"316","1.208589","146.75.37.140","192.168.12.35","TCP","1430","443  >  61034 [ACK] Seq=19433 Ack=181 Win=424 Len=1376 [TCP PDU reassembled in 325]"
"317","1.208589","146.75.37.140","192.168.12.35","TCP","1430","443  >  61034 [PSH, ACK] Seq=20809 Ack=181 Win=424 Len=1376 [TCP PDU reassembled in 325]"
"318","1.208589","146.75.37.140","192.168.12.35","TCP","1430","443  >  61034 [ACK] Seq=22185 Ack=181 Win=424 Len=1376 [TCP PDU reassembled in 325]"
"319","1.208589","146.75.37.140","192.168.12.35","TCP","1430","443  >  61034 [ACK] Seq=23561 Ack=181 Win=424 Len=1376 [TCP PDU reassembled in 325]"
"320","1.208589","146.75.37.140","192.168.12.35","TCP","1430","443  >  61034 [ACK] Seq=24937 Ack=181 Win=424 Len=1376 [TCP PDU reassembled in 325]"
"321","1.208589","146.75.37.140","192.168.12.35","TCP","1430","443  >  61034 [ACK] Seq=26313 Ack=181 Win=424 Len=1376 [TCP PDU reassembled in 325]"
"322","1.208589","146.75.37.140","192.168.12.35","TCP","1430","443  >  61034 [ACK] Seq=27689 Ack=181 Win=424 Len=1376 [TCP PDU reassembled in 325]"
"323","1.208589","146.75.37.140","192.168.12.35","TCP","1430","443  >  61034 [ACK] Seq=29065 Ack=181 Win=424 Len=1376 [TCP PDU reassembled in 325]"
"324","1.208589","146.75.37.140","192.168.12.35","TCP","1430","443  >  61034 [ACK] Seq=30441 Ack=181 Win=424 Len=1376 [TCP PDU reassembled in 325]"
"325","1.208589","146.75.37.140","192.168.12.35","TLSv1.2","1430","Application Data"
"326","1.208589","146.75.37.140","192.168.12.35","TCP","1430","443  >  61034 [ACK] Seq=33193 Ack=181 Win=424 Len=1376 [TCP PDU reassembled in 337]"
"327","1.208589","146.75.37.140","192.168.12.35","TCP","1430","443  >  61034 [ACK] Seq=34569 Ack=181 Win=424 Len=1376 [TCP PDU reassembled in 337]"
"328","1.208589","146.75.37.140","192.168.12.35","TCP","1430","443  >  61034 [ACK] Seq=35945 Ack=181 Win=424 Len=1376 [TCP PDU reassembled in 337]"
"329","1.208589","146.75.37.140","192.168.12.35","TCP","1430","443  >  61034 [ACK] Seq=37321 Ack=181 Win=424 Len=1376 [TCP PDU reassembled in 337]"
"330","1.208589","146.75.37.140","192.168.12.35","TCP","1430","443  >  61034 [ACK] Seq=38697 Ack=181 Win=424 Len=1376 [TCP PDU reassembled in 337]"
"331","1.208589","146.75.37.140","192.168.12.35","TCP","1430","443  >  61034 [ACK] Seq=40073 Ack=181 Win=424 Len=1376 [TCP PDU reassembled in 337]"
"332","1.208589","146.75.37.140","192.168.12.35","TCP","1430","443  >  61034 [ACK] Seq=41449 Ack=181 Win=424 Len=1376 [TCP PDU reassembled in 337]"
"333","1.208589","146.75.37.140","192.168.12.35","TCP","1430","443  >  61034 [PSH, ACK] Seq=42825 Ack=181 Win=424 Len=1376 [TCP PDU reassembled in 337]"
"334","1.208589","146.75.37.140","192.168.12.35","TCP","1430","443  >  61034 [ACK] Seq=44201 Ack=181 Win=424 Len=1376 [TCP PDU reassembled in 337]"
"335","1.208589","146.75.37.140","192.168.12.35","TCP","1430","443  >  61034 [ACK] Seq=45577 Ack=181 Win=424 Len=1376 [TCP PDU reassembled in 337]"
"336","1.208589","146.75.37.140","192.168.12.35","TCP","1430","443  >  61034 [ACK] Seq=46953 Ack=181 Win=424 Len=1376 [TCP PDU reassembled in 337]"
"337","1.208589","146.75.37.140","192.168.12.35","TLSv1.2","1430","Application Data"
"338","1.208589","146.75.37.140","192.168.12.35","TCP","1430","443  >  61034 [ACK] Seq=49705 Ack=181 Win=424 Len=1376 [TCP PDU reassembled in 349]"
"339","1.208589","146.75.37.140","192.168.12.35","TCP","1430","443  >  61034 [ACK] Seq=51081 Ack=181 Win=424 Len=1376 [TCP PDU reassembled in 349]"
"340","1.208589","146.75.37.140","192.168.12.35","TCP","1430","443  >  61034 [ACK] Seq=52457 Ack=181 Win=424 Len=1376 [TCP PDU reassembled in 349]"
"341","1.208589","146.75.37.140","192.168.12.35","TCP","1430","443  >  61034 [ACK] Seq=53833 Ack=181 Win=424 Len=1376 [TCP PDU reassembled in 349]"
"342","1.208589","146.75.37.140","192.168.12.35","TCP","1430","443  >  61034 [ACK] Seq=55209 Ack=181 Win=424 Len=1376 [TCP PDU reassembled in 349]"
"343","1.209720","146.75.37.140","192.168.12.35","TCP","1430","443  >  61034 [ACK] Seq=56585 Ack=181 Win=424 Len=1376 [TCP PDU reassembled in 349]"
"344","1.209720","146.75.37.140","192.168.12.35","TCP","1430","443  >  61034 [ACK] Seq=57961 Ack=181 Win=424 Len=1376 [TCP PDU reassembled in 349]"
"345","1.209720","146.75.37.140","192.168.12.35","TCP","1430","443  >  61034 [ACK] Seq=59337 Ack=181 Win=424 Len=1376 [TCP PDU reassembled in 349]"
"346","1.209720","146.75.37.140","192.168.12.35","TCP","1430","443  >  61034 [ACK] Seq=60713 Ack=181 Win=424 Len=1376 [TCP PDU reassembled in 349]"
"347","1.209720","146.75.37.140","192.168.12.35","TCP","1430","443  >  61034 [ACK] Seq=62089 Ack=181 Win=424 Len=1376 [TCP PDU reassembled in 349]"
"348","1.209720","146.75.37.140","192.168.12.35","TCP","1430","443  >  61034 [ACK] Seq=63465 Ack=181 Win=424 Len=1376 [TCP PDU reassembled in 349]"
"349","1.209720","146.75.37.140","192.168.12.35","TLSv1.2","1006","Application Data"
"350","1.209720","146.75.37.140","192.168.12.35","TLSv1.2","1430","Application Data"
"351","1.209720","146.75.37.140","192.168.12.35","TCP","1430","443  >  61034 [ACK] Seq=67169 Ack=181 Win=424 Len=1376 [TCP PDU reassembled in 361]"
"352","1.209720","146.75.37.140","192.168.12.35","TCP","1430","443  >  61034 [ACK] Seq=68545 Ack=181 Win=424 Len=1376 [TCP PDU reassembled in 361]"
"353","1.209720","146.75.37.140","192.168.12.35","TCP","1430","443  >  61034 [ACK] Seq=69921 Ack=181 Win=424 Len=1376 [TCP PDU reassembled in 361]"
"354","1.209720","146.75.37.140","192.168.12.35","TCP","1430","443  >  61034 [ACK] Seq=71297 Ack=181 Win=424 Len=1376 [TCP PDU reassembled in 361]"
"355","1.209720","146.75.37.140","192.168.12.35","TCP","1430","443  >  61034 [ACK] Seq=72673 Ack=181 Win=424 Len=1376 [TCP PDU reassembled in 361]"
"356","1.209720","146.75.37.140","192.168.12.35","TCP","1430","443  >  61034 [ACK] Seq=74049 Ack=181 Win=424 Len=1376 [TCP PDU reassembled in 361]"
"357","1.209720","146.75.37.140","192.168.12.35","TCP","1430","443  >  61034 [ACK] Seq=75425 Ack=181 Win=424 Len=1376 [TCP PDU reassembled in 361]"
"358","1.209720","146.75.37.140","192.168.12.35","TCP","1430","443  >  61034 [ACK] Seq=76801 Ack=181 Win=424 Len=1376 [TCP PDU reassembled in 361]"
