"No.","Time","Source","Destination","Protocol","Length","Info"
"1","0.000000","192.168.12.35","146.75.37.140","TLSv1.2","3356","Application Data"
"2","0.000123","192.168.12.35","146.75.37.140","TLSv1.2","93","Application Data"
"3","0.000154","192.168.12.35","146.75.37.140","TLSv1.2","3374","Application Data"
"4","0.000178","192.168.12.35","146.75.37.140","TLSv1.2","753","Application Data"
"5","0.036558","146.75.37.140","192.168.12.35","TCP","54","443  >  61013 [ACK] Seq=1 Ack=1397 Win=8141 Len=0"
"6","0.047566","146.75.37.140","192.168.12.35","TCP","54","443  >  61013 [ACK] Seq=1 Ack=2793 Win=8147 Len=0"
"7","0.047566","146.75.37.140","192.168.12.35","TCP","54","443  >  61013 [ACK] Seq=1 Ack=3303 Win=8147 Len=0"
"8","0.047566","146.75.37.140","192.168.12.35","TCP","54","443  >  61013 [ACK] Seq=1 Ack=3342 Win=8147 Len=0"
"9","0.047566","146.75.37.140","192.168.12.35","TLSv1.2","93","Application Data"
"10","0.062756","192.168.12.35","146.75.37.140","QUIC","1292","Initial, DCID=197b8a76ae8f23ce, PKN: 1, CRYPTO, PING, PADDING, PING, PING, PADDING, PING, PING, CRYPTO, PADDING, CRYPTO, CRYPTO, PING"
"11","0.063179","192.168.12.35","146.75.37.140","QUIC","1292","Initial, DCID=197b8a76ae8f23ce, PKN: 2, CRYPTO, PADDING, CRYPTO, CRYPTO, PADDING, PING, PADDING, PING, CRYPTO, PING, PADDING, CRYPTO, PING, CRYPTO, PING, CRYPTO, CRYPTO, CRYPTO, PING, CRYPTO"
"12","0.065550","146.75.37.140","192.168.12.35","TCP","54","443  >  61013 [ACK] Seq=40 Ack=4738 Win=8152 Len=0"
"13","0.071118","146.75.37.140","192.168.12.35","TCP","54","443  >  61013 [ACK] Seq=40 Ack=6134 Win=8157 Len=0"
"14","0.080811","146.75.37.140","192.168.12.35","TCP","54","443  >  61013 [ACK] Seq=40 Ack=6662 Win=8157 Len=0"
"15","0.080811","146.75.37.140","192.168.12.35","TCP","54","443  >  61013 [ACK] Seq=40 Ack=7361 Win=8157 Len=0"
"16","0.102730","192.168.12.35","146.75.37.140","TCP","54","61013  >  443 [ACK] Seq=7361 Ack=40 Win=1025 Len=0"
"17","0.113923","146.75.37.140","192.168.12.35","TCP","1430","443  >  61013 [ACK] Seq=40 Ack=7361 Win=8157 Len=1376 [TCP PDU reassembled in 18]"
"18","0.113923","146.75.37.140","192.168.12.35","TLSv1.2","804","Application Data"
"19","0.113923","146.75.37.140","192.168.12.35","TLSv1.2","87","Application Data"
"20","0.113923","146.75.37.140","192.168.12.35","QUIC","1322","Initial, SCID=95b7b671ac19869f8be168bf655ef85da4, PKN: 0, ACK, PADDING"
"21","0.113923","146.75.37.140","192.168.12.35","TCP","1430","443  >  61013 [ACK] Seq=2199 Ack=7361 Win=8157 Len=1376 [TCP PDU reassembled in 22]"
"22","0.113923","146.75.37.140","192.168.12.35","TLSv1.2","449","Application Data"
"23","0.113923","146.75.37.140","192.168.12.35","TLSv1.2","87","Application Data"
"24","0.113923","146.75.37.140","192.168.12.35","QUIC","1322","Initial, SCID=95b7b671ac19869f8be168bf655ef85da4, PKN: 1, ACK, CRYPTO, PADDING"
"25","0.113923","146.75.37.140","192.168.12.35","QUIC","620","Protected Payload (KP0)"
"26","0.114390","192.168.12.35","146.75.37.140","TCP","54","61013  >  443 [ACK] Seq=7361 Ack=2166 Win=1025 Len=0"
"27","0.114505","192.168.12.35","146.75.37.140","TCP","54","61013  >  443 [ACK] Seq=7361 Ack=3575 Win=1025 Len=0"
"28","0.114535","192.168.12.35","146.75.37.140","TCP","54","61013  >  443 [ACK] Seq=7361 Ack=4003 Win=1023 Len=0"
"29","0.117915","192.168.12.35","146.75.37.140","QUIC","229","Protected Payload (KP0), DCID=95b7b671ac19869f8be168bf655ef85da4"
"30","0.117958","192.168.12.35","146.75.37.140","TLSv1.2","89","Application Data"
"31","0.118093","192.168.12.35","146.75.37.140","QUIC","1292","Protected Payload (KP0), DCID=95b7b671ac19869f8be168bf655ef85da4"
"32","0.118125","192.168.12.35","146.75.37.140","QUIC","1016","Protected Payload (KP0), DCID=95b7b671ac19869f8be168bf655ef85da4"
"33","0.145752","146.75.37.140","192.168.12.35","TCP","54","443  >  61013 [ACK] Seq=4003 Ack=7396 Win=8157 Len=0"
"34","0.150975","146.75.37.140","192.168.12.35","QUIC","67","Protected Payload (KP0)"
"35","0.167349","146.75.37.140","192.168.12.35","QUIC","66","Protected Payload (KP0)"
"36","0.177826","192.168.12.35","146.75.37.140","QUIC","84","Protected Payload (KP0), DCID=95b7b671ac19869f8be168bf655ef85da4"
"37","0.340866","146.75.37.140","192.168.12.35","QUIC","1219","Protected Payload (KP0)"
"38","0.349280","192.168.12.35","146.75.37.140","QUIC","1292","Protected Payload (KP0), DCID=95b7b671ac19869f8be168bf655ef85da4"
"39","0.349353","192.168.12.35","146.75.37.140","QUIC","1024","Protected Payload (KP0), DCID=95b7b671ac19869f8be168bf655ef85da4"
"40","0.365725","192.168.12.35","146.75.37.140","TLSv1.2","3236","Application Data"
"41","0.365816","192.168.12.35","146.75.37.140","TLSv1.2","3359","Application Data"
"42","0.365846","192.168.12.35","146.75.37.140","TLSv1.2","1334","Application Data"
"43","0.464249","146.75.37.140","192.168.12.35","QUIC","1220","Protected Payload (KP0)"
"44","0.464929","192.168.12.35","146.75.37.140","QUIC","1291","Protected Payload (KP0), DCID=95b7b671ac19869f8be168bf655ef85da4"
"45","0.487145","146.75.37.140","192.168.12.35","TCP","54","443  >  61013 [ACK] Seq=4003 Ack=8792 Win=8163 Len=0"
"46","0.487145","146.75.37.140","192.168.12.35","TCP","54","443  >  61013 [ACK] Seq=4003 Ack=10188 Win=8168 Len=0"
"47","0.487145","146.75.37.140","192.168.12.35","TCP","54","443  >  61013 [ACK] Seq=4003 Ack=10578 Win=8168 Len=0"
"48","0.487145","146.75.37.140","192.168.12.35","TCP","54","443  >  61013 [ACK] Seq=4003 Ack=11974 Win=8174 Len=0"
"49","0.487145","146.75.37.140","192.168.12.35","QUIC","66","Protected Payload (KP0)"
"50","0.492884","146.75.37.140","192.168.12.35","TCP","54","443  >  61013 [ACK] Seq=4003 Ack=13370 Win=8179 Len=0"
"51","0.500591","146.75.37.140","192.168.12.35","TCP","54","443  >  61013 [ACK] Seq=4003 Ack=13883 Win=8179 Len=0"
"52","0.541928","146.75.37.140","192.168.12.35","TCP","54","443  >  61013 [ACK] Seq=4003 Ack=15163 Win=8185 Len=0"
"53","0.550806","146.75.37.140","192.168.12.35","TCP","1430","443  >  61013 [ACK] Seq=4003 Ack=15163 Win=8185 Len=1376 [TCP PDU reassembled in 54]"
"54","0.550806","146.75.37.140","192.168.12.35","TLSv1.2","933","Application Data"
"55","0.550948","192.168.12.35","146.75.37.140","TCP","54","61013  >  443 [ACK] Seq=15163 Ack=6258 Win=1025 Len=0"
"56","0.566853","146.75.37.140","192.168.12.35","TCP","1430","443  >  61013 [ACK] Seq=6258 Ack=15163 Win=8185 Len=1376 [TCP PDU reassembled in 57]"
"57","0.566853","146.75.37.140","192.168.12.35","TLSv1.2","1072","Application Data"
"58","0.567197","192.168.12.35","146.75.37.140","TCP","54","61013  >  443 [ACK] Seq=15163 Ack=8652 Win=1025 Len=0"
"59","0.571227","192.168.12.35","146.75.37.140","QUIC","92","Protected Payload (KP0), DCID=95b7b671ac19869f8be168bf655ef85da4"
"60","0.576160","146.75.37.140","192.168.12.35","TCP","1430","443  >  61013 [ACK] Seq=8652 Ack=15163 Win=8185 Len=1376 [TCP PDU reassembled in 70]"
"61","0.576160","146.75.37.140","192.168.12.35","TCP","1430","443  >  61013 [PSH, ACK] Seq=10028 Ack=15163 Win=8185 Len=1376 [TCP PDU reassembled in 70]"
"62","0.576160","146.75.37.140","192.168.12.35","TCP","1430","443  >  61013 [ACK] Seq=11404 Ack=15163 Win=8185 Len=1376 [TCP PDU reassembled in 70]"
"63","0.576160","146.75.37.140","192.168.12.35","TCP","1430","443  >  61013 [PSH, ACK] Seq=12780 Ack=15163 Win=8185 Len=1376 [TCP PDU reassembled in 70]"
"64","0.576160","146.75.37.140","192.168.12.35","TCP","1430","443  >  61013 [ACK] Seq=14156 Ack=15163 Win=8185 Len=1376 [TCP PDU reassembled in 70]"
"65","0.576160","146.75.37.140","192.168.12.35","TCP","1430","443  >  61013 [PSH, ACK] Seq=15532 Ack=15163 Win=8185 Len=1376 [TCP PDU reassembled in 70]"
"66","0.576160","146.75.37.140","192.168.12.35","TCP","1430","443  >  61013 [ACK] Seq=16908 Ack=15163 Win=8185 Len=1376 [TCP PDU reassembled in 70]"
"67","0.576160","146.75.37.140","192.168.12.35","TCP","1430","443  >  61013 [PSH, ACK] Seq=18284 Ack=15163 Win=8185 Len=1376 [TCP PDU reassembled in 70]"
"68","0.576160","146.75.37.140","192.168.12.35","TCP","1430","443  >  61013 [ACK] Seq=19660 Ack=15163 Win=8185 Len=1376 [TCP PDU reassembled in 70]"
"69","0.576160","146.75.37.140","192.168.12.35","TCP","1430","443  >  61013 [PSH, ACK] Seq=21036 Ack=15163 Win=8185 Len=1376 [TCP PDU reassembled in 70]"
"70","0.576160","146.75.37.140","192.168.12.35","TLSv1.2","1164","Application Data, Application Data"
"71","0.576160","146.75.37.140","192.168.12.35","TCP","1430","443  >  61013 [ACK] Seq=23522 Ack=15163 Win=8185 Len=1376 [TCP PDU reassembled in 85]"
"72","0.576160","146.75.37.140","192.168.12.35","TCP","1430","443  >  61013 [PSH, ACK] Seq=24898 Ack=15163 Win=8185 Len=1376 [TCP PDU reassembled in 85]"
"73","0.576427","192.168.12.35","146.75.37.140","TCP","54","61013  >  443 [ACK] Seq=15163 Ack=22412 Win=1025 Len=0"
"74","0.576560","192.168.12.35","146.75.37.140","TCP","54","61013  >  443 [ACK] Seq=15163 Ack=26274 Win=1025 Len=0"
"75","0.579963","146.75.37.140","192.168.12.35","TCP","1430","443  >  61013 [ACK] Seq=26274 Ack=15163 Win=8185 Len=1376 [TCP PDU reassembled in 85]"
"76","0.579963","146.75.37.140","192.168.12.35","TCP","1430","443  >  61013 [PSH, ACK] Seq=27650 Ack=15163 Win=8185 Len=1376 [TCP PDU reassembled in 85]"
"77","0.579963","146.75.37.140","192.168.12.35","TCP","1430","443  >  61013 [ACK] Seq=29026 Ack=15163 Win=8185 Len=1376 [TCP PDU reassembled in 85]"
"78","0.579963","146.75.37.140","192.168.12.35","TCP","1430","443  >  61013 [PSH, ACK] Seq=30402 Ack=15163 Win=8185 Len=1376 [TCP PDU reassembled in 85]"
"79","0.580076","192.168.12.35","146.75.37.140","TCP","54","61013  >  443 [ACK] Seq=15163 Ack=31778 Win=1025 Len=0"
"80","0.593204","146.75.37.140","192.168.12.35","TCP","1430","443  >  61013 [ACK] Seq=31778 Ack=15163 Win=8185 Len=1376 [TCP PDU reassembled in 85]"
"81","0.593204","146.75.37.140","192.168.12.35","TCP","1430","443  >  61013 [PSH, ACK] Seq=33154 Ack=15163 Win=8185 Len=1376 [TCP PDU reassembled in 85]"
"82","0.593204","146.75.37.140","192.168.12.35","TCP","1430","443  >  61013 [ACK] Seq=34530 Ack=15163 Win=8185 Len=1376 [TCP PDU reassembled in 85]"
"83","0.593204","146.75.37.140","192.168.12.35","TCP","1430","443  >  61013 [PSH, ACK] Seq=35906 Ack=15163 Win=8185 Len=1376 [TCP PDU reassembled in 85]"
"84","0.593204","146.75.37.140","192.168.12.35","TCP","1430","443  >  61013 [ACK] Seq=37282 Ack=15163 Win=8185 Len=1376 [TCP PDU reassembled in 85]"
"85","0.593204","146.75.37.140","192.168.12.35","TLSv1.2","1430","Application Data"
"86","0.593204","146.75.37.140","192.168.12.35","TCP","1430","443  >  61013 [ACK] Seq=40034 Ack=15163 Win=8185 Len=1376 [TCP PDU reassembled in 98]"
"87","0.593204","146.75.37.140","192.168.12.35","TCP","1430","443  >  61013 [PSH, ACK] Seq=41410 Ack=15163 Win=8185 Len=1376 [TCP PDU reassembled in 98]"
"88","0.593204","146.75.37.140","192.168.12.35","TCP","1430","443  >  61013 [ACK] Seq=42786 Ack=15163 Win=8185 Len=1376 [TCP PDU reassembled in 98]"
"89","0.593204","146.75.37.140","192.168.12.35","TCP","1430","443  >  61013 [PSH, ACK] Seq=44162 Ack=15163 Win=8185 Len=1376 [TCP PDU reassembled in 98]"
"90","0.593204","146.75.37.140","192.168.12.35","TCP","1430","443  >  61013 [ACK] Seq=45538 Ack=15163 Win=8185 Len=1376 [TCP PDU reassembled in 98]"
"91","0.593204","146.75.37.140","192.168.12.35","TCP","1430","443  >  61013 [PSH, ACK] Seq=46914 Ack=15163 Win=8185 Len=1376 [TCP PDU reassembled in 98]"
"92","0.593204","146.75.37.140","192.168.12.35","TCP","1430","443  >  61013 [ACK] Seq=48290 Ack=15163 Win=8185 Len=1376 [TCP PDU reassembled in 98]"
"93","0.593204","146.75.37.140","192.168.12.35","QUIC","68","Protected Payload (KP0)"
"94","0.593204","146.75.37.140","192.168.12.35","TCP","1430","443  >  61013 [PSH, ACK] Seq=49666 Ack=15163 Win=8185 Len=1376 [TCP PDU reassembled in 98]"
"95","0.593204","146.75.37.140","192.168.12.35","TCP","1430","443  >  61013 [ACK] Seq=51042 Ack=15163 Win=8185 Len=1376 [TCP PDU reassembled in 98]"
"96","0.593204","146.75.37.140","192.168.12.35","TCP","1430","443  >  61013 [PSH, ACK] Seq=52418 Ack=15163 Win=8185 Len=1376 [TCP PDU reassembled in 98]"
"97","0.593204","146.75.37.140","192.168.12.35","TCP","1430","443  >  61013 [ACK] Seq=53794 Ack=15163 Win=8185 Len=1376 [TCP PDU reassembled in 98]"
"98","0.593204","146.75.37.140","192.168.12.35","TLSv1.2","1430","Application Data, Application Data, Application Data"
"99","0.593204","146.75.37.140","192.168.12.35","TCP","1430","443  >  61013 [ACK] Seq=56546 Ack=15163 Win=8185 Len=1376 [TCP PDU reassembled in 100]"
"100","0.593204","146.75.37.140","192.168.12.35","TLSv1.2","1430","Application Data, Application Data"
"101","0.593204","146.75.37.140","192.168.12.35","TLSv1.2","1430","Application Data"
"102","0.593625","192.168.12.35","146.75.37.140","TCP","54","61013  >  443 [ACK] Seq=15163 Ack=49666 Win=1025 Len=0"
"103","0.593737","192.168.12.35","146.75.37.140","TCP","54","61013  >  443 [ACK] Seq=15163 Ack=60674 Win=1025 Len=0"
"104","0.607153","146.75.37.140","192.168.12.35","TCP","1430","443  >  61013 [PSH, ACK] Seq=60674 Ack=15163 Win=8185 Len=1376 [TCP PDU reassembled in 105]"
"105","0.607153","146.75.37.140","192.168.12.35","TLSv1.2","1430","Application Data"
"106","0.607153","146.75.37.140","192.168.12.35","TLSv1.2","585","Application Data, Application Data, Application Data"
"107","0.607153","146.75.37.140","192.168.12.35","TCP","1430","443  >  61013 [ACK] Seq=63957 Ack=15163 Win=8185 Len=1376 [TCP PDU reassembled in 108]"
"108","0.607153","146.75.37.140","192.168.12.35","TLSv1.2","467","Application Data"
"109","0.607153","146.75.37.140","192.168.12.35","TLSv1.2","87","Application Data"
"110","0.607837","192.168.12.35","146.75.37.140","TCP","54","61013  >  443 [ACK] Seq=15163 Ack=63426 Win=1025 Len=0"
"111","0.608066","192.168.12.35","146.75.37.140","TCP","54","61013  >  443 [ACK] Seq=15163 Ack=65333 Win=1025 Len=0"
"112","0.608154","192.168.12.35","146.75.37.140","TCP","54","61013  >  443 [ACK] Seq=15163 Ack=65779 Win=1023 Len=0"
"113","0.619049","146.75.37.140","192.168.12.35","TLSv1.2","582","Application Data"
"114","0.619049","146.75.37.140","192.168.12.35","TCP","1430","443  >  61013 [ACK] Seq=66307 Ack=15163 Win=8185 Len=1376 [TCP PDU reassembled in 115]"
"115","0.619049","146.75.37.140","192.168.12.35","TLSv1.2","311","Application Data"
"116","0.619049","146.75.37.140","192.168.12.35","TLSv1.2","909","Application Data"
"117","0.619049","146.75.37.140","192.168.12.35","TLSv1.2","617","Application Data"
"118","0.619049","146.75.37.140","192.168.12.35","TLSv1.2","690","Application Data"
"119","0.619049","146.75.37.140","192.168.12.35","TLSv1.2","668","Application Data"
"120","0.619049","146.75.37.140","192.168.12.35","TLSv1.2","159","Application Data"
"121","0.619955","192.168.12.35","146.75.37.140","TCP","54","61013  >  443 [ACK] Seq=15163 Ack=67683 Win=1025 Len=0"
"122","0.620253","192.168.12.35","146.75.37.140","TCP","54","61013  >  443 [ACK] Seq=15163 Ack=68795 Win=1020 Len=0"
"123","0.620420","192.168.12.35","146.75.37.140","TCP","54","61013  >  443 [ACK] Seq=15163 Ack=69994 Win=1025 Len=0"
"124","0.620475","192.168.12.35","146.75.37.140","TCP","54","61013  >  443 [ACK] Seq=15163 Ack=70713 Win=1022 Len=0"
"125","0.621077","146.75.37.140","192.168.12.35","TLSv1.2","93","Application Data"
"126","0.621077","146.75.37.140","192.168.12.35","TLSv1.2","101","Application Data"
"127","0.621077","146.75.37.140","192.168.12.35","TLSv1.2","296","Application Data"
"128","0.621077","146.75.37.140","192.168.12.35","TLSv1.2","108","Application Data"
"129","0.621077","146.75.37.140","192.168.12.35","TLSv1.2","893","Application Data"
"130","0.621077","146.75.37.140","192.168.12.35","TLSv1.2","119","Application Data"
"131","0.621077","146.75.37.140","192.168.12.35","QUIC","66","Protected Payload (KP0)"
"132","0.621312","192.168.12.35","146.75.37.140","TCP","54","61013  >  443 [ACK] Seq=15163 Ack=70799 Win=1022 Len=0"
"133","0.621459","192.168.12.35","146.75.37.140","TCP","54","61013  >  443 [ACK] Seq=15163 Ack=71095 Win=1020 Len=0"
"134","0.621516","192.168.12.35","146.75.37.140","TCP","54","61013  >  443 [ACK] Seq=15163 Ack=71999 Win=1025 Len=0"
"135","0.632569","146.75.37.140","192.168.12.35","TLSv1.2","94","Application Data"
"136","0.632569","146.75.37.140","192.168.12.35","TLSv1.2","107","Application Data"
"137","0.632569","146.75.37.140","192.168.12.35","TLSv1.2","106","Application Data"
"138","0.632569","146.75.37.140","192.168.12.35","TLSv1.2","237","Application Data"
"139","0.632569","146.75.37.140","192.168.12.35","TLSv1.2","147","Application Data"
"140","0.632569","146.75.37.140","192.168.12.35","TLSv1.2","187","Application Data"
"141","0.632569","146.75.37.140","192.168.12.35","TLSv1.2","129","Application Data"
"142","0.632569","146.75.37.140","192.168.12.35","QUIC","68","Protected Payload (KP0)"
"143","0.632935","192.168.12.35","146.75.37.140","TCP","54","61013  >  443 [ACK] Seq=15163 Ack=72092 Win=1024 Len=0"
"144","0.633062","192.168.12.35","146.75.37.140","TCP","54","61013  >  443 [ACK] Seq=15163 Ack=72327 Win=1023 Len=0"
"145","0.633097","192.168.12.35","146.75.37.140","TCP","54","61013  >  443 [ACK] Seq=15163 Ack=72553 Win=1023 Len=0"
"146","0.639899","146.75.37.140","192.168.12.35","TLSv1.2","697","Application Data"
"147","0.640258","192.168.12.35","146.75.37.140","TCP","54","61013  >  443 [ACK] Seq=15163 Ack=73271 Win=1020 Len=0"
"148","0.644589","146.75.37.140","192.168.12.35","TLSv1.2","104","Application Data"
"149","0.647135","192.168.12.35","146.75.37.140","QUIC","83","Protected Payload (KP0), DCID=95b7b671ac19869f8be168bf655ef85da4"
"150","0.651083","146.75.37.140","192.168.12.35","TLSv1.2","291","Application Data"
"151","0.651083","146.75.37.140","192.168.12.35","TLSv1.2","217","Application Data"
"152","0.651083","146.75.37.140","192.168.12.35","TLSv1.2","176","Application Data"
"153","0.651083","146.75.37.140","192.168.12.35","TLSv1.2","108","Application Data"
"154","0.651288","192.168.12.35","146.75.37.140","TCP","54","61013  >  443 [ACK] Seq=15163 Ack=73558 Win=1025 Len=0"
"155","0.651386","192.168.12.35","146.75.37.140","TCP","54","61013  >  443 [ACK] Seq=15163 Ack=73843 Win=1024 Len=0"
"156","0.693883","192.168.12.35","146.75.37.140","TCP","54","61013  >  443 [ACK] Seq=15163 Ack=73897 Win=1023 Len=0"
"157","1.093105","146.75.37.140","192.168.12.35","TLSv1.2","564","Application Data"
"158","1.098062","146.75.37.140","192.168.12.35","TLSv1.2","447","Application Data"
"159","1.098062","146.75.37.140","192.168.12.35","TLSv1.2","402","Application Data"
"160","1.098062","146.75.37.140","192.168.12.35","TLSv1.2","1071","Application Data"
"161","1.098062","146.75.37.140","192.168.12.35","TLSv1.2","538","Application Data"
"162","1.098062","146.75.37.140","192.168.12.35","TLSv1.2","966","Application Data"
"163","1.098062","146.75.37.140","192.168.12.35","TLSv1.2","758","Application Data"
"164","1.098062","146.75.37.140","192.168.12.35","TLSv1.2","1401","Application Data"
"165","1.098062","146.75.37.140","192.168.12.35","TLSv1.2","1120","Application Data, Application Data"
"166","1.098062","146.75.37.140","192.168.12.35","TLSv1.2","505","Application Data"
"167","1.098062","146.75.37.140","192.168.12.35","TLSv1.2","943","Application Data"
"168","1.098062","146.75.37.140","192.168.12.35","TLSv1.2","1113","Application Data, Application Data, Application Data"
"169","1.098062","146.75.37.140","192.168.12.35","TLSv1.2","243","Application Data"
"170","1.098062","146.75.37.140","192.168.12.35","TLSv1.2","301","Application Data"
"171","1.098062","146.75.37.140","192.168.12.35","TLSv1.2","1389","Application Data"
"172","1.098062","146.75.37.140","192.168.12.35","TLSv1.2","935","Application Data"
"173","1.098275","192.168.12.35","146.75.37.140","TCP","54","61013  >  443 [ACK] Seq=15163 Ack=74800 Win=1020 Len=0"
"174","1.098371","192.168.12.35","146.75.37.140","TCP","54","61013  >  443 [ACK] Seq=15163 Ack=76165 Win=1025 Len=0"
"175","1.098403","192.168.12.35","146.75.37.140","TCP","54","61013  >  443 [ACK] Seq=15163 Ack=77561 Win=1025 Len=0"
"176","1.098431","192.168.12.35","146.75.37.140","TCP","54","61013  >  443 [ACK] Seq=15163 Ack=79612 Win=1025 Len=0"
"177","1.098469","192.168.12.35","146.75.37.140","TCP","54","61013  >  443 [ACK] Seq=15163 Ack=81129 Win=1025 Len=0"
"178","1.098500","192.168.12.35","146.75.37.140","TCP","54","61013  >  443 [ACK] Seq=15163 Ack=83077 Win=1025 Len=0"
"179","1.098529","192.168.12.35","146.75.37.140","TCP","54","61013  >  443 [ACK] Seq=15163 Ack=83513 Win=1023 Len=0"
"180","1.098561","192.168.12.35","146.75.37.140","TCP","54","61013  >  443 [ACK] Seq=15163 Ack=85729 Win=1025 Len=0"
"181","1.105085","146.75.37.140","192.168.12.35","TLSv1.2","922","Application Data"
"182","1.105085","146.75.37.140","192.168.12.35","TLSv1.2","211","Application Data"
"183","1.105085","146.75.37.140","192.168.12.35","TLSv1.2","1428","Application Data"
"184","1.105085","146.75.37.140","192.168.12.35","TLSv1.2","336","Application Data"
"185","1.105085","146.75.37.140","192.168.12.35","TLSv1.2","364","Application Data"
"186","1.105085","146.75.37.140","192.168.12.35","TLSv1.2","313","Application Data"
"187","1.105085","146.75.37.140","192.168.12.35","TLSv1.2","503","Application Data"
"188","1.105085","146.75.37.140","192.168.12.35","TLSv1.2","224","Application Data"
"189","1.105282","192.168.12.35","146.75.37.140","TCP","54","61013  >  443 [ACK] Seq=15163 Ack=86754 Win=1021 Len=0"
"190","1.105351","192.168.12.35","146.75.37.140","TCP","54","61013  >  443 [ACK] Seq=15163 Ack=88410 Win=1025 Len=0"
"191","1.105388","192.168.12.35","146.75.37.140","TCP","54","61013  >  443 [ACK] Seq=15163 Ack=88979 Win=1022 Len=0"
"192","1.105407","192.168.12.35","146.75.37.140","TCP","54","61013  >  443 [ACK] Seq=15163 Ack=89598 Win=1020 Len=0"
"193","1.110871","146.75.37.140","192.168.12.35","TLSv1.2","820","Application Data"
"194","1.110871","146.75.37.140","192.168.12.35","TLSv1.2","381","Application Data"
"195","1.110871","146.75.37.140","192.168.12.35","TLSv1.2","722","Application Data"
"196","1.111198","192.168.12.35","146.75.37.140","TCP","54","61013  >  443 [ACK] Seq=15163 Ack=90691 Win=1025 Len=0"
"197","1.116710","146.75.37.140","192.168.12.35","TLSv1.2","104","Application Data"
"198","1.116838","192.168.12.35","146.75.37.140","TCP","54","61013  >  443 [ACK] Seq=15163 Ack=91409 Win=1022 Len=0"
"199","1.144015","146.75.37.140","192.168.12.35","TLSv1.2","99","Application Data"
"200","1.144015","146.75.37.140","192.168.12.35","TLSv1.2","93","Application Data"
"201","1.144546","192.168.12.35","146.75.37.140","TCP","54","61013  >  443 [ACK] Seq=15163 Ack=91493 Win=1022 Len=0"
"202","1.149001","146.75.37.140","192.168.12.35","TLSv1.2","121","Application Data"
"203","1.149001","146.75.37.140","192.168.12.35","TLSv1.2","350","Application Data"
"204","1.149652","192.168.12.35","146.75.37.140","TCP","54","61013  >  443 [ACK] Seq=15163 Ack=91856 Win=1020 Len=0"
"205","1.155265","146.75.37.140","192.168.12.35","TLSv1.2","140","Application Data"
"206","1.162360","146.75.37.140","192.168.12.35","TLSv1.2","94","Application Data"
"207","1.162360","146.75.37.140","192.168.12.35","TLSv1.2","93","Application Data"
"208","1.162738","192.168.12.35","146.75.37.140","TCP","54","61013  >  443 [ACK] Seq=15163 Ack=91982 Win=1020 Len=0"
"209","1.204158","192.168.12.35","146.75.37.140","TCP","54","61013  >  443 [ACK] Seq=15163 Ack=92021 Win=1019 Len=0"
"210","1.207838","146.75.37.140","192.168.12.35","TLSv1.2","394","[TCP Previous segment not captured] , Application Data"
"211","1.207838","146.75.37.140","192.168.12.35","TLSv1.2","589","Application Data"
"212","1.208083","192.168.12.35","146.75.37.140","TCP","66","[TCP Dup ACK 209#1] 61013  >  443 [ACK] Seq=15163 Ack=92021 Win=1019 Len=0 SLE=97277 SRE=97617"
"213","1.208203","192.168.12.35","146.75.37.140","TCP","66","[TCP Dup ACK 209#2] 61013  >  443 [ACK] Seq=15163 Ack=92021 Win=1019 Len=0 SLE=97277 SRE=98152"
"214","1.208536","146.75.37.140","192.168.12.35","TLSv1.2","334","Application Data"
"215","1.208536","146.75.37.140","192.168.12.35","TLSv1.2","147","Application Data"
"216","1.208536","146.75.37.140","192.168.12.35","TLSv1.2","323","Application Data"
"217","1.208536","146.75.37.140","192.168.12.35","TLSv1.2","556","Application Data"
"218","1.208536","146.75.37.140","192.168.12.35","TLSv1.2","85","Application Data"
"219","1.208596","192.168.12.35","146.75.37.140","TCP","66","[TCP Dup ACK 209#3] 61013  >  443 [ACK] Seq=15163 Ack=92021 Win=1019 Len=0 SLE=97277 SRE=98432"
"220","1.208615","192.168.12.35","146.75.37.140","TCP","66","[TCP Dup ACK 209#4] 61013  >  443 [ACK] Seq=15163 Ack=92021 Win=1019 Len=0 SLE=97277 SRE=98525"
"221","1.208645","192.168.12.35","146.75.37.140","TCP","66","[TCP Dup ACK 209#5] 61013  >  443 [ACK] Seq=15163 Ack=92021 Win=1019 Len=0 SLE=97277 SRE=98794"
"222","1.208688","192.168.12.35","146.75.37.140","TCP","66","[TCP Dup ACK 209#6] 61013  >  443 [ACK] Seq=15163 Ack=92021 Win=1019 Len=0 SLE=97277 SRE=99296"
"223","1.208709","192.168.12.35","146.75.37.140","TCP","66","[TCP Dup ACK 209#7] 61013  >  443 [ACK] Seq=15163 Ack=92021 Win=1019 Len=0 SLE=97277 SRE=99327"
"224","1.240420","146.75.37.140","192.168.12.35","TCP","1395","[TCP Retransmission] 443  >  61013 [PSH, ACK] Seq=92021 Ack=15163 Win=8185 Len=1341"
"225","1.240420","146.75.37.140","192.168.12.35","TCP","1246","[TCP Retransmission] 443  >  61013 [PSH, ACK] Seq=93362 Ack=15163 Win=8185 Len=1192"
"226","1.240420","146.75.37.140","192.168.12.35","TCP","1307","[TCP Retransmission] 443  >  61013 [PSH, ACK] Seq=94554 Ack=15163 Win=8185 Len=1253"
"227","1.240420","146.75.37.140","192.168.12.35","TCP","861","[TCP Retransmission] 443  >  61013 [PSH, ACK] Seq=95807 Ack=15163 Win=8185 Len=807"
"228","1.241285","192.168.12.35","146.75.37.140","TCP","66","61013  >  443 [ACK] Seq=15163 Ack=93362 Win=1025 Len=0 SLE=97277 SRE=99327"
"229","1.241652","192.168.12.35","146.75.37.140","TCP","66","61013  >  443 [ACK] Seq=15163 Ack=94554 Win=1020 Len=0 SLE=97277 SRE=99327"
"230","1.241723","192.168.12.35","146.75.37.140","TCP","66","61013  >  443 [ACK] Seq=15163 Ack=95807 Win=1025 Len=0 SLE=97277 SRE=99327"
"231","1.241772","192.168.12.35","146.75.37.140","TCP","66","61013  >  443 [ACK] Seq=15163 Ack=96614 Win=1022 Len=0 SLE=97277 SRE=99327"
"232","1.247548","146.75.37.140","192.168.12.35","TCP","717","[TCP Retransmission] 443  >  61013 [PSH, ACK] Seq=96614 Ack=15163 Win=8185 Len=663"
"233","1.247827","192.168.12.35","146.75.37.140","TCP","54","61013  >  443 [ACK] Seq=15163 Ack=99327 Win=1025 Len=0"
"234","1.275727","192.168.12.35","146.75.37.140","TLSv1.2","3183","Application Data"
"235","1.275868","192.168.12.35","146.75.37.140","TLSv1.2","718","Application Data"
"236","1.275897","192.168.12.35","146.75.37.140","TLSv1.2","3187","Application Data"
"237","1.289812","192.168.12.35","146.75.37.140","TLSv1.2","3196","Application Data"
"238","1.316060","146.75.37.140","192.168.12.35","TCP","54","443  >  61013 [ACK] Seq=99327 Ack=16559 Win=8190 Len=0"
"239","1.327612","146.75.37.140","192.168.12.35","TCP","54","443  >  61013 [ACK] Seq=99327 Ack=17955 Win=8196 Len=0"
"240","1.332803","146.75.37.140","192.168.12.35","TCP","54","443  >  61013 [ACK] Seq=99327 Ack=18292 Win=8196 Len=0"
"241","1.366959","146.75.37.140","192.168.12.35","TCP","54","443  >  61013 [ACK] Seq=99327 Ack=18956 Win=8196 Len=0"
"242","1.367903","192.168.12.35","146.75.37.140","TLSv1.2","3174","Application Data"
"243","1.368299","192.168.12.35","146.75.37.140","TLSv1.2","210","Application Data"
"244","1.375566","146.75.37.140","192.168.12.35","TCP","54","443  >  61013 [ACK] Seq=99327 Ack=20352 Win=8196 Len=0"
"245","1.387109","146.75.37.140","192.168.12.35","TCP","1430","443  >  61013 [ACK] Seq=99327 Ack=20352 Win=8196 Len=1376 [TCP PDU reassembled in 246]"
"246","1.387109","146.75.37.140","192.168.12.35","TLSv1.2","778","Application Data"
"247","1.387109","146.75.37.140","192.168.12.35","TCP","54","443  >  61013 [ACK] Seq=101427 Ack=21748 Win=8196 Len=0"
"248","1.387109","146.75.37.140","192.168.12.35","TCP","54","443  >  61013 [ACK] Seq=101427 Ack=22089 Win=8196 Len=0"
"249","1.387431","192.168.12.35","146.75.37.140","TCP","54","61013  >  443 [ACK] Seq=28507 Ack=101427 Win=1025 Len=0"
"250","1.407562","146.75.37.140","192.168.12.35","TCP","54","443  >  61013 [ACK] Seq=101427 Ack=23485 Win=8196 Len=0"
"251","1.412888","146.75.37.140","192.168.12.35","TCP","54","443  >  61013 [ACK] Seq=101427 Ack=24881 Win=8196 Len=0"
"252","1.412888","146.75.37.140","192.168.12.35","TCP","54","443  >  61013 [ACK] Seq=101427 Ack=25231 Win=8196 Len=0"
"253","1.419195","146.75.37.140","192.168.12.35","TCP","1430","443  >  61013 [ACK] Seq=101427 Ack=25231 Win=8196 Len=1376 [TCP PDU reassembled in 254]"
"254","1.419195","146.75.37.140","192.168.12.35","TLSv1.2","496","Application Data"
"255","1.419195","146.75.37.140","192.168.12.35","TLSv1.2","87","Application Data"
"256","1.419499","192.168.12.35","146.75.37.140","TCP","54","61013  >  443 [ACK] Seq=28507 Ack=103245 Win=1025 Len=0"
"257","1.446945","146.75.37.140","192.168.12.35","TCP","1430","443  >  61013 [ACK] Seq=103278 Ack=25231 Win=8196 Len=1376 [TCP PDU reassembled in 258]"
"258","1.446945","146.75.37.140","192.168.12.35","TLSv1.2","850","Application Data"
"259","1.446945","146.75.37.140","192.168.12.35","TLSv1.2","100","Application Data"
"260","1.447474","192.168.12.35","146.75.37.140","TCP","54","61013  >  443 [ACK] Seq=28507 Ack=104654 Win=1025 Len=0"
"261","1.447718","192.168.12.35","146.75.37.140","TCP","54","61013  >  443 [ACK] Seq=28507 Ack=105496 Win=1021 Len=0"
"262","1.487642","146.75.37.140","192.168.12.35","TLSv1.2","594","Application Data"
"263","1.487642","146.75.37.140","192.168.12.35","TLSv1.2","95","Application Data"
"264","1.487990","192.168.12.35","146.75.37.140","TCP","54","61013  >  443 [ACK] Seq=28507 Ack=106077 Win=1025 Len=0"
"265","1.490257","192.168.12.35","146.75.37.140","TLSv1.2","3287","Application Data"
"266","1.490353","192.168.12.35","146.75.37.140","TLSv1.2","3193","Application Data"
"267","1.490412","192.168.12.35","146.75.37.140","TLSv1.2","3208","Application Data"
"268","1.490437","192.168.12.35","146.75.37.140","TLSv1.2","3185","Application Data"
"269","1.540643","146.75.37.140","192.168.12.35","TCP","54","443  >  61013 [ACK] Seq=106077 Ack=26627 Win=8196 Len=0"
"270","1.550848","146.75.37.140","192.168.12.35","TCP","54","443  >  61013 [ACK] Seq=106077 Ack=28023 Win=8196 Len=0"
"271","1.556808","146.75.37.140","192.168.12.35","TCP","54","443  >  61013 [ACK] Seq=106077 Ack=28351 Win=8196 Len=0"
"272","1.556808","146.75.37.140","192.168.12.35","TCP","54","443  >  61013 [ACK] Seq=106077 Ack=28507 Win=8196 Len=0"
"273","1.592728","146.75.37.140","192.168.12.35","TCP","54","443  >  61013 [ACK] Seq=106077 Ack=29903 Win=8196 Len=0"
"274","1.598689","146.75.37.140","192.168.12.35","TCP","54","443  >  61013 [ACK] Seq=106077 Ack=31299 Win=8196 Len=0"
"275","1.604660","146.75.37.140","192.168.12.35","TCP","1430","443  >  61013 [ACK] Seq=106077 Ack=31299 Win=8196 Len=1376 [TCP PDU reassembled in 276]"
"276","1.604660","146.75.37.140","192.168.12.35","TLSv1.2","633","Application Data"
"277","1.604660","146.75.37.140","192.168.12.35","TCP","54","443  >  61013 [ACK] Seq=108032 Ack=31740 Win=8196 Len=0"
"278","1.605042","192.168.12.35","146.75.37.140","TCP","54","61013  >  443 [ACK] Seq=41164 Ack=108032 Win=1025 Len=0"
"279","1.611496","146.75.37.140","192.168.12.35","TCP","54","443  >  61013 [ACK] Seq=108032 Ack=33136 Win=8196 Len=0"
"280","1.629240","146.75.37.140","192.168.12.35","TCP","54","443  >  61013 [ACK] Seq=108032 Ack=34879 Win=8196 Len=0"
"281","1.634060","192.168.12.35","146.75.37.140","TLSv1.2","3144","Application Data"
"282","1.637574","146.75.37.140","192.168.12.35","TCP","1430","443  >  61013 [ACK] Seq=108032 Ack=36275 Win=8196 Len=1376 [TCP PDU reassembled in 283]"
"283","1.642830","146.75.37.140","192.168.12.35","TLSv1.2","853","Application Data"
"284","1.643219","192.168.12.35","146.75.37.140","TCP","54","61013  >  443 [ACK] Seq=44254 Ack=110207 Win=1025 Len=0"
"285","1.648901","146.75.37.140","192.168.12.35","TLSv1.2","100","Application Data"
"286","1.655833","146.75.37.140","192.168.12.35","TCP","54","443  >  61013 [ACK] Seq=110253 Ack=38033 Win=8196 Len=0"
"287","1.664439","146.75.37.140","192.168.12.35","TCP","1430","443  >  61013 [ACK] Seq=110253 Ack=38033 Win=8196 Len=1376 [TCP PDU reassembled in 288]"
"288","1.664439","146.75.37.140","192.168.12.35","TLSv1.2","487","Application Data"
"289","1.664439","146.75.37.140","192.168.12.35","TLSv1.2","100","Application Data"
"290","1.664735","192.168.12.35","146.75.37.140","TCP","54","61013  >  443 [ACK] Seq=44254 Ack=111629 Win=1025 Len=0"
"291","1.664903","192.168.12.35","146.75.37.140","TCP","54","61013  >  443 [ACK] Seq=44254 Ack=112108 Win=1023 Len=0"
"292","1.670581","146.75.37.140","192.168.12.35","TCP","54","443  >  61013 [ACK] Seq=112108 Ack=39429 Win=8196 Len=0"
"293","1.680828","146.75.37.140","192.168.12.35","TCP","54","443  >  61013 [ACK] Seq=112108 Ack=41164 Win=8196 Len=0"
"294","1.686817","146.75.37.140","192.168.12.35","TCP","1430","443  >  61013 [ACK] Seq=112108 Ack=41164 Win=8196 Len=1376 [TCP PDU reassembled in 295]"
"295","1.686817","146.75.37.140","192.168.12.35","TLSv1.2","824","Application Data"
"296","1.686817","146.75.37.140","192.168.12.35","TLSv1.2","100","Application Data"
"297","1.687119","192.168.12.35","146.75.37.140","TCP","54","61013  >  443 [ACK] Seq=44254 Ack=113484 Win=1025 Len=0"
"298","1.687270","192.168.12.35","146.75.37.140","TCP","54","61013  >  443 [ACK] Seq=44254 Ack=114254 Win=1022 Len=0"
"299","1.706991","146.75.37.140","192.168.12.35","TCP","1430","443  >  61013 [ACK] Seq=114300 Ack=41164 Win=8196 Len=1376 [TCP PDU reassembled in 300]"
"300","1.706991","146.75.37.140","192.168.12.35","TLSv1.2","512","Application Data"
"301","1.707317","192.168.12.35","146.75.37.140","TCP","54","61013  >  443 [ACK] Seq=44254 Ack=115676 Win=1025 Len=0"
"302","1.728295","146.75.37.140","192.168.12.35","TLSv1.2","1034","Application Data"
"303","1.728295","146.75.37.140","192.168.12.35","TLSv1.2","85","Application Data"
"304","1.728800","192.168.12.35","146.75.37.140","TCP","54","61013  >  443 [ACK] Seq=44254 Ack=117114 Win=1025 Len=0"
"305","1.764689","146.75.37.140","192.168.12.35","TCP","1430","443  >  61013 [ACK] Seq=117145 Ack=41164 Win=8196 Len=1376 [TCP PDU reassembled in 306]"
"306","1.764689","146.75.37.140","192.168.12.35","TLSv1.2","637","Application Data"
"307","1.764689","146.75.37.140","192.168.12.35","TLSv1.2","367","Application Data"
"308","1.764689","146.75.37.140","192.168.12.35","TLSv1.2","85","Application Data"
"309","1.765075","192.168.12.35","146.75.37.140","TCP","54","61013  >  443 [ACK] Seq=44254 Ack=118521 Win=1025 Len=0"
"310","1.765216","192.168.12.35","146.75.37.140","TCP","54","61013  >  443 [ACK] Seq=44254 Ack=119417 Win=1021 Len=0"
"311","1.808008","192.168.12.35","146.75.37.140","TCP","54","61013  >  443 [ACK] Seq=44254 Ack=119448 Win=1021 Len=0"
"312","1.819897","192.168.12.35","146.75.37.140","TLSv1.2","3347","Application Data"
"313","1.820153","192.168.12.35","146.75.37.140","TLSv1.2","134","Application Data"
"314","1.880194","192.168.12.35","146.75.37.140","QUIC","1292","Protected Payload (KP0), DCID=95b7b671ac19869f8be168bf655ef85da4"
"315","1.880286","192.168.12.35","146.75.37.140","QUIC","543","Protected Payload (KP0), DCID=95b7b671ac19869f8be168bf655ef85da4"
"316","1.894823","146.75.37.140","192.168.12.35","TCP","54","443  >  61013 [ACK] Seq=119448 Ack=42560 Win=8196 Len=0"
"317","1.900967","192.168.12.35","146.75.37.140","QUIC","1292","Protected Payload (KP0), DCID=95b7b671ac19869f8be168bf655ef85da4"
"318","1.901166","192.168.12.35","146.75.37.140","QUIC","540","Protected Payload (KP0), DCID=95b7b671ac19869f8be168bf655ef85da4"
"319","1.906908","146.75.37.140","192.168.12.35","TCP","54","443  >  61013 [ACK] Seq=119448 Ack=44254 Win=8196 Len=0"
"320","1.908309","192.168.12.35","146.75.37.140","QUIC","1292","Protected Payload (KP0), DCID=95b7b671ac19869f8be168bf655ef85da4"
"321","1.908358","192.168.12.35","146.75.37.140","QUIC","1017","Protected Payload (KP0), DCID=95b7b671ac19869f8be168bf655ef85da4"
"322","1.924744","146.75.37.140","192.168.12.35","TCP","1430","443  >  61013 [ACK] Seq=119448 Ack=44254 Win=8196 Len=1376 [TCP PDU reassembled in 323]"
"323","1.924744","146.75.37.140","192.168.12.35","TLSv1.2","798","Application Data"
"324","1.924744","146.75.37.140","192.168.12.35","TLSv1.2","87","Application Data"
"325","1.925053","192.168.12.35","146.75.37.140","TCP","54","61013  >  443 [ACK] Seq=47627 Ack=120824 Win=1025 Len=0"
"326","1.925202","192.168.12.35","146.75.37.140","TCP","54","61013  >  443 [ACK] Seq=47627 Ack=121568 Win=1022 Len=0"
"327","1.973162","146.75.37.140","192.168.12.35","TCP","54","443  >  61013 [ACK] Seq=121601 Ack=47046 Win=8196 Len=0"
"328","1.978618","192.168.12.35","146.75.37.140","TCP","54","61013  >  443 [ACK] Seq=47627 Ack=121601 Win=1022 Len=0"
"329","1.985422","146.75.37.140","192.168.12.35","TCP","54","443  >  61013 [ACK] Seq=121601 Ack=47547 Win=8196 Len=0"
"330","1.985422","146.75.37.140","192.168.12.35","TCP","54","443  >  61013 [ACK] Seq=121601 Ack=47627 Win=8196 Len=0"
"331","2.008841","146.75.37.140","192.168.12.35","TCP","1430","443  >  61013 [ACK] Seq=121601 Ack=47627 Win=8196 Len=1376 [TCP PDU reassembled in 334]"
"332","2.008841","146.75.37.140","192.168.12.35","TCP","1430","443  >  61013 [PSH, ACK] Seq=122977 Ack=47627 Win=8196 Len=1376 [TCP PDU reassembled in 334]"
"333","2.009162","192.168.12.35","146.75.37.140","TCP","54","61013  >  443 [ACK] Seq=47627 Ack=124353 Win=1025 Len=0"
"334","2.014892","146.75.37.140","192.168.12.35","TLSv1.2","126","Application Data"
"335","2.033086","146.75.37.140","192.168.12.35","TLSv1.2","957","Application Data"
"336","2.033086","146.75.37.140","192.168.12.35","TLSv1.2","85","Application Data"
"337","2.033306","192.168.12.35","146.75.37.140","TCP","54","61013  >  443 [ACK] Seq=47627 Ack=125328 Win=1021 Len=0"
"338","2.058407","192.168.12.35","146.75.37.140","QUIC","1292","Protected Payload (KP0), DCID=95b7b671ac19869f8be168bf655ef85da4"
"339","2.087931","192.168.12.35","146.75.37.140","TCP","54","61013  >  443 [ACK] Seq=47627 Ack=125359 Win=1021 Len=0"
"340","2.090857","146.75.37.140","192.168.12.35","QUIC","66","Protected Payload (KP0)"
"341","2.116735","146.75.37.140","192.168.12.35","QUIC","952","Protected Payload (KP0)"
"342","2.128695","146.75.37.140","192.168.12.35","QUIC","66","Protected Payload (KP0)"
"343","2.151620","192.168.12.35","146.75.37.140","QUIC","83","Protected Payload (KP0), DCID=95b7b671ac19869f8be168bf655ef85da4"
"344","2.155998","146.75.37.140","192.168.12.35","QUIC","834","Protected Payload (KP0)"
"345","2.155998","146.75.37.140","192.168.12.35","QUIC","1127","Protected Payload (KP0)"
"346","2.156789","192.168.12.35","146.75.37.140","QUIC","82","Protected Payload (KP0), DCID=95b7b671ac19869f8be168bf655ef85da4"
"347","2.162789","146.75.37.140","192.168.12.35","QUIC","66","Protected Payload (KP0)"
"348","2.180992","146.75.37.140","192.168.12.35","QUIC","1219","Protected Payload (KP0)"
"349","2.210606","192.168.12.35","146.75.37.140","QUIC","83","Protected Payload (KP0), DCID=95b7b671ac19869f8be168bf655ef85da4"
"350","2.211073","192.168.12.35","146.75.37.140","QUIC","1292","Protected Payload (KP0), DCID=95b7b671ac19869f8be168bf655ef85da4"
"351","2.211107","192.168.12.35","146.75.37.140","QUIC","1019","Protected Payload (KP0), DCID=95b7b671ac19869f8be168bf655ef85da4"
"352","2.295148","146.75.37.140","192.168.12.35","QUIC","68","Protected Payload (KP0)"
"353","2.399553","146.75.37.140","192.168.12.35","QUIC","1322","Protected Payload (KP0)"
"354","2.399553","146.75.37.140","192.168.12.35","QUIC","1322","Protected Payload (KP0)"
"355","2.399553","146.75.37.140","192.168.12.35","QUIC","272","Protected Payload (KP0)"
"356","2.400257","192.168.12.35","146.75.37.140","QUIC","82","Protected Payload (KP0), DCID=95b7b671ac19869f8be168bf655ef85da4"
"357","2.431050","192.168.12.35","146.75.37.140","QUIC","83","Protected Payload (KP0), DCID=95b7b671ac19869f8be168bf655ef85da4"
"358","2.468870","146.75.37.140","192.168.12.35","QUIC","66","Protected Payload (KP0)"
"359","2.566828","146.75.37.140","192.168.12.35","TLSv1.2","251","Application Data"
"360","2.576874","146.75.37.140","192.168.12.35","TLSv1.2","173","Application Data"
"361","2.576991","192.168.12.35","146.75.37.140","TCP","54","61013  >  443 [ACK] Seq=47627 Ack=125675 Win=1020 Len=0"
"362","2.582037","146.75.37.140","192.168.12.35","TLSv1.2","1001","Application Data"
"363","2.582037","146.75.37.140","192.168.12.35","TLSv1.2","1215","Application Data"
"364","2.582037","146.75.37.140","192.168.12.35","TCP","1430","443  >  61013 [ACK] Seq=127783 Ack=47627 Win=8196 Len=1376 [TCP PDU reassembled in 365]"
"365","2.582037","146.75.37.140","192.168.12.35","TLSv1.2","946","Application Data"
"366","2.582037","146.75.37.140","192.168.12.35","TLSv1.2","1247","Application Data"
"367","2.582037","146.75.37.140","192.168.12.35","TLSv1.2","1430","Application Data, Application Data"
"368","2.582037","146.75.37.140","192.168.12.35","TLSv1.2","543","Application Data"
"369","2.582037","146.75.37.140","192.168.12.35","TLSv1.2","570","Application Data"
"370","2.582037","146.75.37.140","192.168.12.35","TLSv1.2","1430","Application Data, Application Data, Application Data, Application Data"
"371","2.582037","146.75.37.140","192.168.12.35","TLSv1.2","1059","Application Data, Application Data, Application Data"
"372","2.582191","192.168.12.35","146.75.37.140","TCP","54","61013  >  443 [ACK] Seq=47627 Ack=127783 Win=1025 Len=0"
"373","2.582222","192.168.12.35","146.75.37.140","TCP","54","61013  >  443 [ACK] Seq=47627 Ack=130051 Win=1025 Len=0"
"374","2.582240","192.168.12.35","146.75.37.140","TCP","54","61013  >  443 [ACK] Seq=47627 Ack=132620 Win=1025 Len=0"
"375","2.582263","192.168.12.35","146.75.37.140","TCP","54","61013  >  443 [ACK] Seq=47627 Ack=133625 Win=1021 Len=0"
"376","2.582365","192.168.12.35","146.75.37.140","TCP","54","61013  >  443 [ACK] Seq=47627 Ack=136006 Win=1025 Len=0"
"377","2.595981","146.75.37.140","192.168.12.35","TLSv1.2","237","Application Data"
"378","2.605368","146.75.37.140","192.168.12.35","TLSv1.2","238","Application Data"
"379","2.605463","192.168.12.35","146.75.37.140","TCP","54","61013  >  443 [ACK] Seq=47627 Ack=136373 Win=1023 Len=0"
"380","2.606503","146.75.37.140","192.168.12.35","TCP","1430","443  >  61013 [ACK] Seq=136373 Ack=47627 Win=8196 Len=1376 [TCP PDU reassembled in 381]"
"381","2.606503","146.75.37.140","192.168.12.35","TLSv1.2","559","Application Data"
"382","2.606503","146.75.37.140","192.168.12.35","TCP","1430","443  >  61013 [ACK] Seq=138254 Ack=47627 Win=8196 Len=1376 [TCP PDU reassembled in 384]"
"383","2.606503","146.75.37.140","192.168.12.35","TCP","1430","443  >  61013 [PSH, ACK] Seq=139630 Ack=47627 Win=8196 Len=1376 [TCP PDU reassembled in 384]"
"384","2.606503","146.75.37.140","192.168.12.35","TLSv1.2","810","Application Data"
"385","2.606757","192.168.12.35","146.75.37.140","TCP","54","61013  >  443 [ACK] Seq=47627 Ack=138254 Win=1025 Len=0"
"386","2.606902","192.168.12.35","146.75.37.140","TCP","54","61013  >  443 [ACK] Seq=47627 Ack=141006 Win=1025 Len=0"
"387","2.618736","146.75.37.140","192.168.12.35","TLSv1.2","368","Application Data"
"388","2.618736","146.75.37.140","192.168.12.35","TLSv1.2","189","Application Data"
"389","2.619117","192.168.12.35","146.75.37.140","TCP","54","61013  >  443 [ACK] Seq=47627 Ack=142076 Win=1021 Len=0"
"390","2.631994","146.75.37.140","192.168.12.35","TLSv1.2","315","Application Data"
"391","2.632141","192.168.12.35","146.75.37.140","TCP","54","61013  >  443 [ACK] Seq=47627 Ack=142472 Win=1025 Len=0"
"392","2.640569","146.75.37.140","192.168.12.35","TLSv1.2","503","Application Data"
"393","2.640569","146.75.37.140","192.168.12.35","TLSv1.2","474","Application Data"
"394","2.640569","146.75.37.140","192.168.12.35","TLSv1.2","846","Application Data"
"395","2.640569","146.75.37.140","192.168.12.35","TLSv1.2","129","Application Data"
"396","2.640569","146.75.37.140","192.168.12.35","TLSv1.2","274","Application Data"
"397","2.640569","146.75.37.140","192.168.12.35","TLSv1.2","916","Application Data"
"398","2.640569","146.75.37.140","192.168.12.35","TLSv1.2","494","Application Data"
"399","2.640569","146.75.37.140","192.168.12.35","TLSv1.2","259","Application Data"
"400","2.640569","146.75.37.140","192.168.12.35","TLSv1.2","258","Application Data"
"401","2.640569","146.75.37.140","192.168.12.35","TLSv1.2","631","Application Data"
"402","2.640569","146.75.37.140","192.168.12.35","TLSv1.2","679","Application Data"
"403","2.640569","146.75.37.140","192.168.12.35","TCP","1430","443  >  61013 [ACK] Seq=147341 Ack=47627 Win=8196 Len=1376 [TCP PDU reassembled in 404]"
"404","2.640569","146.75.37.140","192.168.12.35","TLSv1.2","349","Application Data"
"405","2.640569","146.75.37.140","192.168.12.35","TCP","1430","443  >  61013 [ACK] Seq=149012 Ack=47627 Win=8196 Len=1376 [TCP PDU reassembled in 406]"
"406","2.640569","146.75.37.140","192.168.12.35","TLSv1.2","228","Application Data"
"407","2.641233","192.168.12.35","146.75.37.140","TCP","54","61013  >  443 [ACK] Seq=47627 Ack=143341 Win=1021 Len=0"
"408","2.641448","192.168.12.35","146.75.37.140","TCP","54","61013  >  443 [ACK] Seq=47627 Ack=144208 Win=1025 Len=0"
"409","2.641536","192.168.12.35","146.75.37.140","TCP","54","61013  >  443 [ACK] Seq=47627 Ack=145290 Win=1020 Len=0"
"410","2.641624","192.168.12.35","146.75.37.140","TCP","54","61013  >  443 [ACK] Seq=47627 Ack=145935 Win=1025 Len=0"
"411","2.641814","192.168.12.35","146.75.37.140","TCP","54","61013  >  443 [ACK] Seq=47627 Ack=146716 Win=1022 Len=0"
"412","2.641923","192.168.12.35","146.75.37.140","TCP","54","61013  >  443 [ACK] Seq=47627 Ack=148717 Win=1025 Len=0"
"413","2.642026","192.168.12.35","146.75.37.140","TCP","54","61013  >  443 [ACK] Seq=47627 Ack=150388 Win=1025 Len=0"
"414","2.649011","146.75.37.140","192.168.12.35","TLSv1.2","603","Application Data"
"415","2.649011","146.75.37.140","192.168.12.35","TLSv1.2","172","Application Data"
"416","2.649011","146.75.37.140","192.168.12.35","TLSv1.2","152","Application Data"
"417","2.649352","192.168.12.35","146.75.37.140","TCP","54","61013  >  443 [ACK] Seq=47627 Ack=151111 Win=1022 Len=0"
"418","2.649500","192.168.12.35","146.75.37.140","TCP","54","61013  >  443 [ACK] Seq=47627 Ack=151327 Win=1021 Len=0"
"419","2.655004","146.75.37.140","192.168.12.35","TLSv1.2","292","Application Data"
"420","2.655004","146.75.37.140","192.168.12.35","TLSv1.2","392","Application Data"
"421","2.655004","146.75.37.140","192.168.12.35","TLSv1.2","277","Application Data"
"422","2.655004","146.75.37.140","192.168.12.35","TLSv1.2","247","Application Data"
"423","2.655004","146.75.37.140","192.168.12.35","TLSv1.2","174","Application Data"
"424","2.655004","146.75.37.140","192.168.12.35","TLSv1.2","645","Application Data"
"425","2.655004","146.75.37.140","192.168.12.35","TLSv1.2","714","Application Data"
"426","2.655004","146.75.37.140","192.168.12.35","TLSv1.2","704","Application Data"
"427","2.655004","146.75.37.140","192.168.12.35","TLSv1.2","569","Application Data, Application Data"
"428","2.655004","146.75.37.140","192.168.12.35","TLSv1.2","318","Application Data"
"429","2.655004","146.75.37.140","192.168.12.35","TLSv1.2","198","Application Data"
"430","2.655004","146.75.37.140","192.168.12.35","TLSv1.2","1298","Application Data"
"431","2.655004","146.75.37.140","192.168.12.35","TLSv1.2","209","Application Data"
"432","2.655004","146.75.37.140","192.168.12.35","TLSv1.2","302","Application Data"
"433","2.655004","146.75.37.140","192.168.12.35","TLSv1.2","912","Application Data, Application Data"
"434","2.655004","146.75.37.140","192.168.12.35","TLSv1.2","277","Application Data"
"435","2.655004","146.75.37.140","192.168.12.35","TLSv1.2","486","Application Data"
"436","2.655004","146.75.37.140","192.168.12.35","TLSv1.2","304","Application Data"
"437","2.655681","192.168.12.35","146.75.37.140","TCP","54","61013  >  443 [ACK] Seq=47627 Ack=151903 Win=1025 Len=0"
"438","2.655774","192.168.12.35","146.75.37.140","TCP","54","61013  >  443 [ACK] Seq=47627 Ack=152319 Win=1023 Len=0"
"439","2.655839","192.168.12.35","146.75.37.140","TCP","54","61013  >  443 [ACK] Seq=47627 Ack=153030 Win=1020 Len=0"
"440","2.655887","192.168.12.35","146.75.37.140","TCP","54","61013  >  443 [ACK] Seq=47627 Ack=154340 Win=1025 Len=0"
"441","2.655998","192.168.12.35","146.75.37.140","TCP","54","61013  >  443 [ACK] Seq=47627 Ack=155119 Win=1022 Len=0"
"442","2.656037","192.168.12.35","146.75.37.140","TCP","54","61013  >  443 [ACK] Seq=47627 Ack=156507 Win=1025 Len=0"
"443","2.656070","192.168.12.35","146.75.37.140","TCP","54","61013  >  443 [ACK] Seq=47627 Ack=156910 Win=1023 Len=0"
"444","2.656118","192.168.12.35","146.75.37.140","TCP","54","61013  >  443 [ACK] Seq=47627 Ack=157991 Win=1025 Len=0"
"445","2.656148","192.168.12.35","146.75.37.140","TCP","54","61013  >  443 [ACK] Seq=47627 Ack=158673 Win=1022 Len=0"
"446","2.668951","146.75.37.140","192.168.12.35","TLSv1.2","257","Application Data"
"447","2.668951","146.75.37.140","192.168.12.35","TLSv1.2","220","Application Data"
"448","2.669171","192.168.12.35","146.75.37.140","TCP","54","61013  >  443 [ACK] Seq=47627 Ack=159042 Win=1021 Len=0"
"449","2.669917","192.168.12.35","146.75.37.140","QUIC","80","Protected Payload (KP0), DCID=95b7b671ac19869f8be168bf655ef85da4"
"450","2.674696","146.75.37.140","192.168.12.35","TLSv1.2","197","Application Data"
"451","2.674696","146.75.37.140","192.168.12.35","TLSv1.2","282","Application Data"
"452","2.674696","146.75.37.140","192.168.12.35","TLSv1.2","223","Application Data"
"453","2.674769","192.168.12.35","146.75.37.140","TCP","54","61013  >  443 [ACK] Seq=47627 Ack=159413 Win=1025 Len=0"
"454","2.680196","146.75.37.140","192.168.12.35","TLSv1.2","352","Application Data"
"455","2.680196","146.75.37.140","192.168.12.35","TLSv1.2","226","Application Data"
"456","2.680196","146.75.37.140","192.168.12.35","TLSv1.2","607","Application Data"
"457","2.680196","146.75.37.140","192.168.12.35","TLSv1.2","1253","Application Data"
"458","2.680196","146.75.37.140","192.168.12.35","TLSv1.2","134","Application Data"
"459","2.680196","146.75.37.140","192.168.12.35","TLSv1.2","184","Application Data"
"460","2.680196","146.75.37.140","192.168.12.35","TLSv1.2","266","Application Data"
"461","2.680196","146.75.37.140","192.168.12.35","TLSv1.2","531","Application Data"
"462","2.680196","146.75.37.140","192.168.12.35","TLSv1.2","415","Application Data, Application Data"
"463","2.680196","146.75.37.140","192.168.12.35","TLSv1.2","192","Application Data"
"464","2.680196","146.75.37.140","192.168.12.35","TLSv1.2","1040","Application Data"
"465","2.680196","146.75.37.140","192.168.12.35","TLSv1.2","670","Application Data"
"466","2.680314","192.168.12.35","146.75.37.140","TCP","54","61013  >  443 [ACK] Seq=47627 Ack=159880 Win=1023 Len=0"
"467","2.680333","192.168.12.35","146.75.37.140","TCP","54","61013  >  443 [ACK] Seq=47627 Ack=160605 Win=1020 Len=0"
"468","2.680349","192.168.12.35","146.75.37.140","TCP","54","61013  >  443 [ACK] Seq=47627 Ack=161884 Win=1025 Len=0"
"469","2.680369","192.168.12.35","146.75.37.140","TCP","54","61013  >  443 [ACK] Seq=47627 Ack=162226 Win=1023 Len=0"
"470","2.680397","192.168.12.35","146.75.37.140","TCP","54","61013  >  443 [ACK] Seq=47627 Ack=163064 Win=1020 Len=0"
"471","2.680417","192.168.12.35","146.75.37.140","TCP","54","61013  >  443 [ACK] Seq=47627 Ack=164188 Win=1025 Len=0"
"472","2.690739","146.75.37.140","192.168.12.35","TLSv1.2","222","Application Data"
"473","2.690739","146.75.37.140","192.168.12.35","TLSv1.2","174","Application Data"
"474","2.690739","146.75.37.140","192.168.12.35","TLSv1.2","369","Application Data"
"475","2.690739","146.75.37.140","192.168.12.35","TLSv1.2","239","Application Data"
"476","2.690739","146.75.37.140","192.168.12.35","TLSv1.2","539","Application Data"
"477","2.690739","146.75.37.140","192.168.12.35","TLSv1.2","1219","Application Data"
"478","2.690739","146.75.37.140","192.168.12.35","TLSv1.2","306","Application Data"
"479","2.690739","146.75.37.140","192.168.12.35","TLSv1.2","830","Application Data"
"480","2.691392","192.168.12.35","146.75.37.140","TCP","54","61013  >  443 [ACK] Seq=47627 Ack=164972 Win=1022 Len=0"
"481","2.691641","192.168.12.35","146.75.37.140","TCP","54","61013  >  443 [ACK] Seq=47627 Ack=165407 Win=1020 Len=0"
"482","2.691716","192.168.12.35","146.75.37.140","TCP","54","61013  >  443 [ACK] Seq=47627 Ack=166077 Win=1025 Len=0"
"483","2.691951","192.168.12.35","146.75.37.140","TCP","54","61013  >  443 [ACK] Seq=47627 Ack=167494 Win=1025 Len=0"
"484","2.692932","146.75.37.140","192.168.12.35","TLSv1.2","1430","Application Data, Application Data, Application Data, Application Data"
"485","2.692932","146.75.37.140","192.168.12.35","TLSv1.2","1430","Application Data, Application Data, Application Data"
"486","2.692932","146.75.37.140","192.168.12.35","TLSv1.2","1430","Application Data, Application Data, Application Data"
"487","2.692932","146.75.37.140","192.168.12.35","TLSv1.2","197","Application Data"
"488","2.693069","192.168.12.35","146.75.37.140","TCP","54","61013  >  443 [ACK] Seq=47627 Ack=172398 Win=1025 Len=0"
"489","2.733906","192.168.12.35","146.75.37.140","TLSv1.2","218","Application Data"
"490","2.733945","192.168.12.35","146.75.37.140","TLSv1.2","93","Application Data"
"491","2.742653","192.168.12.35","146.75.37.140","TCP","54","61013  >  443 [ACK] Seq=47627 Ack=172541 Win=1024 Len=0"
"492","2.937161","192.168.12.35","146.75.37.140","TLSv1.2","3351","Application Data"
"493","2.937252","192.168.12.35","146.75.37.140","TLSv1.2","2264","Application Data"
"494","2.940914","146.75.37.140","192.168.12.35","TCP","54","443  >  61034 [ACK] Seq=1 Ack=165 Win=424 Len=0"
"495","2.940914","146.75.37.140","192.168.12.35","TCP","54","443  >  61034 [ACK] Seq=1 Ack=204 Win=424 Len=0"
"496","2.940914","146.75.37.140","192.168.12.35","TLSv1.2","93","Application Data"
"497","2.940914","146.75.37.140","192.168.12.35","TLSv1.2","351","Application Data"
"498","2.940914","146.75.37.140","192.168.12.35","TCP","1430","443  >  61034 [ACK] Seq=337 Ack=204 Win=424 Len=1376 [TCP PDU reassembled in 510]"
"499","2.940914","146.75.37.140","192.168.12.35","TCP","1430","443  >  61034 [ACK] Seq=1713 Ack=204 Win=424 Len=1376 [TCP PDU reassembled in 510]"
"500","2.940914","146.75.37.140","192.168.12.35","TCP","1430","443  >  61034 [ACK] Seq=3089 Ack=204 Win=424 Len=1376 [TCP PDU reassembled in 510]"
"501","2.940914","146.75.37.140","192.168.12.35","QUIC","66","Protected Payload (KP0)"
"502","2.940914","146.75.37.140","192.168.12.35","TCP","1430","443  >  61034 [ACK] Seq=4465 Ack=204 Win=424 Len=1376 [TCP PDU reassembled in 510]"
"503","2.940914","146.75.37.140","192.168.12.35","TCP","1430","443  >  61034 [ACK] Seq=5841 Ack=204 Win=424 Len=1376 [TCP PDU reassembled in 510]"
"504","2.940914","146.75.37.140","192.168.12.35","TCP","1430","443  >  61034 [ACK] Seq=7217 Ack=204 Win=424 Len=1376 [TCP PDU reassembled in 510]"
"505","2.940914","146.75.37.140","192.168.12.35","TCP","1430","443  >  61034 [ACK] Seq=8593 Ack=204 Win=424 Len=1376 [TCP PDU reassembled in 510]"
"506","2.940914","146.75.37.140","192.168.12.35","TCP","1430","443  >  61034 [ACK] Seq=9969 Ack=204 Win=424 Len=1376 [TCP PDU reassembled in 510]"
"507","2.940914","146.75.37.140","192.168.12.35","TCP","1430","443  >  61034 [ACK] Seq=11345 Ack=204 Win=424 Len=1376 [TCP PDU reassembled in 510]"
"508","2.940914","146.75.37.140","192.168.12.35","TCP","1430","443  >  61034 [ACK] Seq=12721 Ack=204 Win=424 Len=1376 [TCP PDU reassembled in 510]"
"509","2.940914","146.75.37.140","192.168.12.35","TCP","1430","443  >  61034 [ACK] Seq=14097 Ack=204 Win=424 Len=1376 [TCP PDU reassembled in 510]"
"510","2.940914","146.75.37.140","192.168.12.35","TLSv1.2","1430","Application Data"
"511","2.940914","146.75.37.140","192.168.12.35","TCP","1430","443  >  61034 [ACK] Seq=16849 Ack=204 Win=424 Len=1376 [TCP PDU reassembled in 524]"
"512","2.941095","192.168.12.35","146.75.37.140","TCP","54","61034  >  443 [ACK] Seq=204 Ack=337 Win=8199 Len=0"
"513","2.941157","192.168.12.35","146.75.37.140","TCP","54","61034  >  443 [ACK] Seq=204 Ack=4465 Win=8201 Len=0"
"514","2.941197","192.168.12.35","146.75.37.140","TCP","54","61034  >  443 [ACK] Seq=204 Ack=18225 Win=8201 Len=0"
"515","2.941356","146.75.37.140","192.168.12.35","TCP","1430","443  >  61034 [ACK] Seq=18225 Ack=204 Win=424 Len=1376 [TCP PDU reassembled in 524]"
"516","2.941356","146.75.37.140","192.168.12.35","TCP","1430","443  >  61034 [ACK] Seq=19601 Ack=204 Win=424 Len=1376 [TCP PDU reassembled in 524]"
"517","2.941356","146.75.37.140","192.168.12.35","TCP","1430","443  >  61034 [ACK] Seq=20977 Ack=204 Win=424 Len=1376 [TCP PDU reassembled in 524]"
"518","2.941356","146.75.37.140","192.168.12.35","TCP","1430","443  >  61034 [ACK] Seq=22353 Ack=204 Win=424 Len=1376 [TCP PDU reassembled in 524]"
"519","2.941356","146.75.37.140","192.168.12.35","TCP","1430","443  >  61034 [ACK] Seq=23729 Ack=204 Win=424 Len=1376 [TCP PDU reassembled in 524]"
"520","2.941356","146.75.37.140","192.168.12.35","TCP","1430","443  >  61034 [ACK] Seq=25105 Ack=204 Win=424 Len=1376 [TCP PDU reassembled in 524]"
"521","2.941356","146.75.37.140","192.168.12.35","TCP","1430","443  >  61034 [ACK] Seq=26481 Ack=204 Win=424 Len=1376 [TCP PDU reassembled in 524]"
"522","2.941356","146.75.37.140","192.168.12.35","TCP","1430","443  >  61034 [ACK] Seq=27857 Ack=204 Win=424 Len=1376 [TCP PDU reassembled in 524]"
"523","2.941356","146.75.37.140","192.168.12.35","TCP","1430","443  >  61034 [ACK] Seq=29233 Ack=204 Win=424 Len=1376 [TCP PDU reassembled in 524]"
"524","2.941356","146.75.37.140","192.168.12.35","TLSv1.2","980","Application Data"
"525","2.941356","146.75.37.140","192.168.12.35","TCP","1430","443  >  61034 [ACK] Seq=31535 Ack=204 Win=424 Len=1376 [TCP PDU reassembled in 540]"
"526","2.941497","192.168.12.35","146.75.37.140","TCP","54","61034  >  443 [ACK] Seq=204 Ack=27857 Win=8201 Len=0"
"527","2.941540","192.168.12.35","146.75.37.140","TCP","54","61034  >  443 [ACK] Seq=204 Ack=30609 Win=8201 Len=0"
"528","2.941565","192.168.12.35","146.75.37.140","TCP","54","61034  >  443 [ACK] Seq=204 Ack=32911 Win=8201 Len=0"
"529","2.942451","192.168.12.35","146.75.37.140","TLSv1.2","89","Application Data"
"530","2.951058","146.75.37.140","192.168.12.35","TCP","1430","443  >  61034 [ACK] Seq=32911 Ack=204 Win=424 Len=1376 [TCP PDU reassembled in 540]"
"531","2.951058","146.75.37.140","192.168.12.35","TCP","1430","443  >  61034 [ACK] Seq=34287 Ack=204 Win=424 Len=1376 [TCP PDU reassembled in 540]"
"532","2.951058","146.75.37.140","192.168.12.35","TCP","1430","443  >  61034 [ACK] Seq=35663 Ack=204 Win=424 Len=1376 [TCP PDU reassembled in 540]"
"533","2.951058","146.75.37.140","192.168.12.35","TCP","1430","443  >  61034 [ACK] Seq=37039 Ack=204 Win=424 Len=1376 [TCP PDU reassembled in 540]"
"534","2.951058","146.75.37.140","192.168.12.35","TCP","1430","443  >  61034 [ACK] Seq=38415 Ack=204 Win=424 Len=1376 [TCP PDU reassembled in 540]"
"535","2.951058","146.75.37.140","192.168.12.35","TCP","1430","443  >  61034 [ACK] Seq=39791 Ack=204 Win=424 Len=1376 [TCP PDU reassembled in 540]"
"536","2.951058","146.75.37.140","192.168.12.35","TCP","1430","443  >  61034 [ACK] Seq=41167 Ack=204 Win=424 Len=1376 [TCP PDU reassembled in 540]"
"537","2.951058","146.75.37.140","192.168.12.35","TCP","1430","443  >  61034 [ACK] Seq=42543 Ack=204 Win=424 Len=1376 [TCP PDU reassembled in 540]"
"538","2.951058","146.75.37.140","192.168.12.35","TCP","1430","443  >  61034 [ACK] Seq=43919 Ack=204 Win=424 Len=1376 [TCP PDU reassembled in 540]"
"539","2.951058","146.75.37.140","192.168.12.35","TCP","1430","443  >  61034 [ACK] Seq=45295 Ack=204 Win=424 Len=1376 [TCP PDU reassembled in 540]"
"540","2.951058","146.75.37.140","192.168.12.35","TLSv1.2","1355","Application Data, Application Data"
"541","2.951058","146.75.37.140","192.168.12.35","TCP","1430","443  >  61034 [ACK] Seq=47972 Ack=204 Win=424 Len=1376 [TCP PDU reassembled in 552]"
"542","2.951058","146.75.37.140","192.168.12.35","TCP","1430","443  >  61034 [ACK] Seq=49348 Ack=204 Win=424 Len=1376 [TCP PDU reassembled in 552]"
"543","2.951058","146.75.37.140","192.168.12.35","TCP","1430","443  >  61034 [ACK] Seq=50724 Ack=204 Win=424 Len=1376 [TCP PDU reassembled in 552]"
"544","2.951058","146.75.37.140","192.168.12.35","TCP","1430","443  >  61034 [ACK] Seq=52100 Ack=204 Win=424 Len=1376 [TCP PDU reassembled in 552]"
"545","2.951058","146.75.37.140","192.168.12.35","TCP","1430","443  >  61034 [ACK] Seq=53476 Ack=204 Win=424 Len=1376 [TCP PDU reassembled in 552]"
"546","2.951058","146.75.37.140","192.168.12.35","TCP","1430","443  >  61034 [ACK] Seq=54852 Ack=204 Win=424 Len=1376 [TCP PDU reassembled in 552]"
"547","2.951058","146.75.37.140","192.168.12.35","TCP","1430","443  >  61034 [ACK] Seq=56228 Ack=204 Win=424 Len=1376 [TCP PDU reassembled in 552]"
"548","2.951058","146.75.37.140","192.168.12.35","TCP","1430","443  >  61034 [ACK] Seq=57604 Ack=204 Win=424 Len=1376 [TCP PDU reassembled in 552]"
"549","2.951058","146.75.37.140","192.168.12.35","TCP","1430","443  >  61034 [ACK] Seq=58980 Ack=204 Win=424 Len=1376 [TCP PDU reassembled in 552]"
"550","2.951058","146.75.37.140","192.168.12.35","TCP","1430","443  >  61034 [ACK] Seq=60356 Ack=204 Win=424 Len=1376 [TCP PDU reassembled in 552]"
"551","2.951058","146.75.37.140","192.168.12.35","TCP","1430","443  >  61034 [ACK] Seq=61732 Ack=204 Win=424 Len=1376 [TCP PDU reassembled in 552]"
"552","2.951058","146.75.37.140","192.168.12.35","TLSv1.2","1430","Application Data, Application Data"
"553","2.951058","146.75.37.140","192.168.12.35","TCP","1430","443  >  61034 [ACK] Seq=64484 Ack=204 Win=424 Len=1376 [TCP PDU reassembled in 566]"
"554","2.951058","146.75.37.140","192.168.12.35","TCP","1430","443  >  61034 [ACK] Seq=65860 Ack=204 Win=424 Len=1376 [TCP PDU reassembled in 566]"
"555","2.951058","146.75.37.140","192.168.12.35","TCP","1430","443  >  61034 [ACK] Seq=67236 Ack=204 Win=424 Len=1376 [TCP PDU reassembled in 566]"
"556","2.951058","146.75.37.140","192.168.12.35","TCP","1430","443  >  61034 [ACK] Seq=68612 Ack=204 Win=424 Len=1376 [TCP PDU reassembled in 566]"
"557","2.951058","146.75.37.140","192.168.12.35","TCP","1430","443  >  61034 [ACK] Seq=69988 Ack=204 Win=424 Len=1376 [TCP PDU reassembled in 566]"
"558","2.951058","146.75.37.140","192.168.12.35","TCP","1430","443  >  61034 [ACK] Seq=71364 Ack=204 Win=424 Len=1376 [TCP PDU reassembled in 566]"
"559","2.951706","192.168.12.35","146.75.37.140","TCP","54","61034  >  443 [ACK] Seq=239 Ack=46671 Win=8201 Len=0"
"560","2.951987","192.168.12.35","146.75.37.140","TCP","54","61034  >  443 [ACK] Seq=239 Ack=72740 Win=8201 Len=0"
"561","2.958437","146.75.37.140","192.168.12.35","TCP","1430","443  >  61034 [ACK] Seq=72740 Ack=204 Win=424 Len=1376 [TCP PDU reassembled in 566]"
"562","2.958437","146.75.37.140","192.168.12.35","TCP","1430","443  >  61034 [ACK] Seq=74116 Ack=204 Win=424 Len=1376 [TCP PDU reassembled in 566]"
"563","2.958437","146.75.37.140","192.168.12.35","TCP","1430","443  >  61034 [ACK] Seq=75492 Ack=204 Win=424 Len=1376 [TCP PDU reassembled in 566]"
"564","2.958437","146.75.37.140","192.168.12.35","TCP","1430","443  >  61034 [ACK] Seq=76868 Ack=204 Win=424 Len=1376 [TCP PDU reassembled in 566]"
"565","2.958437","146.75.37.140","192.168.12.35","TCP","1430","443  >  61034 [ACK] Seq=78244 Ack=204 Win=424 Len=1376 [TCP PDU reassembled in 566]"
"566","2.958437","146.75.37.140","192.168.12.35","TLSv1.2","204","Application Data"
"567","2.958437","146.75.37.140","192.168.12.35","TCP","1430","443  >  61034 [ACK] Seq=79770 Ack=204 Win=424 Len=1376 [TCP PDU reassembled in 578]"
"568","2.958437","146.75.37.140","192.168.12.35","TCP","1430","443  >  61034 [ACK] Seq=81146 Ack=204 Win=424 Len=1376 [TCP PDU reassembled in 578]"
"569","2.958437","146.75.37.140","192.168.12.35","TCP","1430","443  >  61034 [ACK] Seq=82522 Ack=204 Win=424 Len=1376 [TCP PDU reassembled in 578]"
"570","2.958437","146.75.37.140","192.168.12.35","TCP","1430","443  >  61034 [ACK] Seq=83898 Ack=204 Win=424 Len=1376 [TCP PDU reassembled in 578]"
"571","2.958437","146.75.37.140","192.168.12.35","TCP","1430","443  >  61034 [ACK] Seq=85274 Ack=204 Win=424 Len=1376 [TCP PDU reassembled in 578]"
"572","2.958437","146.75.37.140","192.168.12.35","TCP","1430","443  >  61034 [ACK] Seq=86650 Ack=204 Win=424 Len=1376 [TCP PDU reassembled in 578]"
"573","2.958437","146.75.37.140","192.168.12.35","TCP","1430","443  >  61034 [ACK] Seq=88026 Ack=204 Win=424 Len=1376 [TCP PDU reassembled in 578]"
"574","2.958437","146.75.37.140","192.168.12.35","TCP","1430","443  >  61034 [ACK] Seq=89402 Ack=204 Win=424 Len=1376 [TCP PDU reassembled in 578]"
"575","2.958437","146.75.37.140","192.168.12.35","TCP","1430","443  >  61034 [ACK] Seq=90778 Ack=204 Win=424 Len=1376 [TCP PDU reassembled in 578]"
"576","2.958437","146.75.37.140","192.168.12.35","TCP","1430","443  >  61034 [ACK] Seq=92154 Ack=204 Win=424 Len=1376 [TCP PDU reassembled in 578]"
"577","2.958437","146.75.37.140","192.168.12.35","TCP","1430","443  >  61034 [ACK] Seq=93530 Ack=204 Win=424 Len=1376 [TCP PDU reassembled in 578]"
"578","2.958437","146.75.37.140","192.168.12.35","TLSv1.2","1430","Application Data, Application Data"
"579","2.958437","146.75.37.140","192.168.12.35","TCP","1430","443  >  61034 [ACK] Seq=96282 Ack=204 Win=424 Len=1376 [TCP PDU reassembled in 589]"
"580","2.958437","146.75.37.140","192.168.12.35","TCP","1430","443  >  61034 [ACK] Seq=97658 Ack=204 Win=424 Len=1376 [TCP PDU reassembled in 589]"
"581","2.958437","146.75.37.140","192.168.12.35","TCP","1430","443  >  61034 [ACK] Seq=99034 Ack=204 Win=424 Len=1376 [TCP PDU reassembled in 589]"
"582","2.958437","146.75.37.140","192.168.12.35","TCP","1430","443  >  61034 [ACK] Seq=100410 Ack=204 Win=424 Len=1376 [TCP PDU reassembled in 589]"
"583","2.958437","146.75.37.140","192.168.12.35","TCP","1430","443  >  61034 [ACK] Seq=101786 Ack=204 Win=424 Len=1376 [TCP PDU reassembled in 589]"
"584","2.958437","146.75.37.140","192.168.12.35","TCP","1430","443  >  61034 [ACK] Seq=103162 Ack=204 Win=424 Len=1376 [TCP PDU reassembled in 589]"
"585","2.958437","146.75.37.140","192.168.12.35","TCP","1430","443  >  61034 [ACK] Seq=104538 Ack=204 Win=424 Len=1376 [TCP PDU reassembled in 589]"
"586","2.958437","146.75.37.140","192.168.12.35","TCP","1430","443  >  61034 [ACK] Seq=105914 Ack=204 Win=424 Len=1376 [TCP PDU reassembled in 589]"
"587","2.958437","146.75.37.140","192.168.12.35","TCP","1430","443  >  61034 [ACK] Seq=107290 Ack=204 Win=424 Len=1376 [TCP PDU reassembled in 589]"
"588","2.958437","146.75.37.140","192.168.12.35","TCP","1430","443  >  61034 [ACK] Seq=108666 Ack=204 Win=424 Len=1376 [TCP PDU reassembled in 589]"
"589","2.958437","146.75.37.140","192.168.12.35","TLSv1.2","606","Application Data"
"590","2.958842","192.168.12.35","146.75.37.140","TCP","54","61034  >  443 [ACK] Seq=239 Ack=76868 Win=8201 Len=0"
"591","2.958952","192.168.12.35","146.75.37.140","TCP","54","61034  >  443 [ACK] Seq=239 Ack=79620 Win=8201 Len=0"
"592","2.959019","192.168.12.35","146.75.37.140","TCP","54","61034  >  443 [ACK] Seq=239 Ack=110042 Win=8201 Len=0"
"593","2.959121","192.168.12.35","146.75.37.140","TCP","54","61034  >  443 [ACK] Seq=239 Ack=110594 Win=8199 Len=0"
"594","3.097992","146.75.37.140","192.168.12.35","TCP","54","443  >  61013 [ACK] Seq=172541 Ack=49023 Win=8196 Len=0"
"595","3.102815","146.75.37.140","192.168.12.35","TCP","54","443  >  61013 [ACK] Seq=172541 Ack=50419 Win=8196 Len=0"
"596","3.108676","146.75.37.140","192.168.12.35","TCP","54","443  >  61013 [ACK] Seq=172541 Ack=50924 Win=8196 Len=0"
"597","3.120529","146.75.37.140","192.168.12.35","TCP","54","443  >  61013 [ACK] Seq=172541 Ack=52320 Win=8196 Len=0"
"598","3.130941","146.75.37.140","192.168.12.35","TCP","54","443  >  61013 [ACK] Seq=172541 Ack=53134 Win=8196 Len=0"
"599","3.130941","146.75.37.140","192.168.12.35","TCP","54","443  >  61034 [ACK] Seq=110594 Ack=239 Win=424 Len=0"
"600","3.147606","192.168.12.35","146.75.37.140","QUIC","80","Protected Payload (KP0), DCID=95b7b671ac19869f8be168bf655ef85da4"
"601","3.175460","146.75.37.140","192.168.12.35","TCP","1430","443  >  61013 [ACK] Seq=172541 Ack=53134 Win=8196 Len=1376 [TCP PDU reassembled in 602]"
"602","3.175460","146.75.37.140","192.168.12.35","TLSv1.2","912","Application Data"
"603","3.175938","192.168.12.35","146.75.37.140","TCP","54","61013  >  443 [ACK] Seq=53134 Ack=174775 Win=1025 Len=0"
"604","3.252984","146.75.37.140","192.168.12.35","QUIC","66","Protected Payload (KP0)"
"605","3.459301","192.168.12.35","146.75.37.140","QUIC","80","Protected Payload (KP0), DCID=95b7b671ac19869f8be168bf655ef85da4"
"606","3.532871","146.75.37.140","192.168.12.35","QUIC","66","Protected Payload (KP0)"
"607","3.736981","192.168.12.35","146.75.37.140","QUIC","80","Protected Payload (KP0), DCID=95b7b671ac19869f8be168bf655ef85da4"
"608","3.800598","146.75.37.140","192.168.12.35","QUIC","66","Protected Payload (KP0)"
"609","4.001628","192.168.12.35","146.75.37.140","QUIC","80","Protected Payload (KP0), DCID=95b7b671ac19869f8be168bf655ef85da4"
"610","4.118710","146.75.37.140","192.168.12.35","QUIC","66","Protected Payload (KP0)"
"611","4.325758","192.168.12.35","146.75.37.140","QUIC","80","Protected Payload (KP0), DCID=95b7b671ac19869f8be168bf655ef85da4"
"612","4.375611","146.75.37.140","192.168.12.35","QUIC","66","Protected Payload (KP0)"
"613","4.436170","192.168.12.35","146.75.37.140","TLSv1.2","3358","Application Data"
"614","4.436332","192.168.12.35","146.75.37.140","TLSv1.2","2312","Application Data"
"615","4.470519","146.75.37.140","192.168.12.35","TCP","54","443  >  61013 [ACK] Seq=174775 Ack=54530 Win=8196 Len=0"
"616","4.481025","146.75.37.140","192.168.12.35","TCP","54","443  >  61013 [ACK] Seq=174775 Ack=55926 Win=8196 Len=0"
"617","4.486694","146.75.37.140","192.168.12.35","TCP","54","443  >  61013 [ACK] Seq=174775 Ack=56438 Win=8196 Len=0"
"618","4.511614","146.75.37.140","192.168.12.35","TCP","54","443  >  61013 [ACK] Seq=174775 Ack=57834 Win=8196 Len=0"
"619","4.511614","146.75.37.140","192.168.12.35","TCP","54","443  >  61013 [ACK] Seq=174775 Ack=58696 Win=8196 Len=0"
"620","4.535038","146.75.37.140","192.168.12.35","TCP","1430","443  >  61013 [ACK] Seq=174775 Ack=58696 Win=8196 Len=1376 [TCP PDU reassembled in 621]"
"621","4.535038","146.75.37.140","192.168.12.35","TLSv1.2","503","Application Data"
"622","4.535427","192.168.12.35","146.75.37.140","TCP","54","61013  >  443 [ACK] Seq=58696 Ack=176600 Win=1025 Len=0"
"623","4.599203","192.168.12.35","146.75.37.140","TLSv1.2","206","Application Data"
"624","4.599276","192.168.12.35","146.75.37.140","TLSv1.2","93","Application Data"
"625","4.632631","146.75.37.140","192.168.12.35","TCP","54","443  >  61140 [ACK] Seq=1 Ack=153 Win=424 Len=0"
"626","4.632631","146.75.37.140","192.168.12.35","TCP","54","443  >  61140 [ACK] Seq=1 Ack=192 Win=424 Len=0"
"627","4.632631","146.75.37.140","192.168.12.35","TLSv1.2","93","Application Data"
"628","4.632631","146.75.37.140","192.168.12.35","TLSv1.2","184","Application Data"
"629","4.632631","146.75.37.140","192.168.12.35","TCP","1430","443  >  61140 [ACK] Seq=170 Ack=192 Win=424 Len=1376 [TCP PDU reassembled in 642]"
"630","4.632631","146.75.37.140","192.168.12.35","TCP","1430","443  >  61140 [ACK] Seq=1546 Ack=192 Win=424 Len=1376 [TCP PDU reassembled in 642]"
"631","4.632631","146.75.37.140","192.168.12.35","TCP","1430","443  >  61140 [ACK] Seq=2922 Ack=192 Win=424 Len=1376 [TCP PDU reassembled in 642]"
"632","4.632945","192.168.12.35","146.75.37.140","TCP","54","61140  >  443 [ACK] Seq=192 Ack=170 Win=2047 Len=0"
"633","4.633091","192.168.12.35","146.75.37.140","TCP","54","61140  >  443 [ACK] Seq=192 Ack=4298 Win=2050 Len=0"
"634","4.634200","146.75.37.140","192.168.12.35","TCP","1430","443  >  61140 [ACK] Seq=4298 Ack=192 Win=424 Len=1376 [TCP PDU reassembled in 642]"
"635","4.634200","146.75.37.140","192.168.12.35","TCP","1430","443  >  61140 [ACK] Seq=5674 Ack=192 Win=424 Len=1376 [TCP PDU reassembled in 642]"
"636","4.634200","146.75.37.140","192.168.12.35","TCP","1430","443  >  61140 [ACK] Seq=7050 Ack=192 Win=424 Len=1376 [TCP PDU reassembled in 642]"
"637","4.634200","146.75.37.140","192.168.12.35","TCP","1430","443  >  61140 [ACK] Seq=8426 Ack=192 Win=424 Len=1376 [TCP PDU reassembled in 642]"
"638","4.634200","146.75.37.140","192.168.12.35","TCP","1430","443  >  61140 [ACK] Seq=9802 Ack=192 Win=424 Len=1376 [TCP PDU reassembled in 642]"
"639","4.634200","146.75.37.140","192.168.12.35","TCP","1430","443  >  61140 [ACK] Seq=11178 Ack=192 Win=424 Len=1376 [TCP PDU reassembled in 642]"
"640","4.634200","146.75.37.140","192.168.12.35","TCP","1430","443  >  61140 [ACK] Seq=12554 Ack=192 Win=424 Len=1376 [TCP PDU reassembled in 642]"
"641","4.634200","146.75.37.140","192.168.12.35","TCP","1430","443  >  61140 [ACK] Seq=13930 Ack=192 Win=424 Len=1376 [TCP PDU reassembled in 642]"
"642","4.634200","146.75.37.140","192.168.12.35","TLSv1.2","1430","Application Data"
"643","4.634200","146.75.37.140","192.168.12.35","TCP","1430","443  >  61140 [ACK] Seq=16682 Ack=192 Win=424 Len=1376 [TCP PDU reassembled in 656]"
"644","4.634200","146.75.37.140","192.168.12.35","TCP","1430","443  >  61140 [ACK] Seq=18058 Ack=192 Win=424 Len=1376 [TCP PDU reassembled in 656]"
"645","4.634200","146.75.37.140","192.168.12.35","TCP","1430","443  >  61140 [PSH, ACK] Seq=19434 Ack=192 Win=424 Len=1376 [TCP PDU reassembled in 656]"
"646","4.634200","146.75.37.140","192.168.12.35","TCP","1430","443  >  61140 [ACK] Seq=20810 Ack=192 Win=424 Len=1376 [TCP PDU reassembled in 656]"
"647","4.634200","146.75.37.140","192.168.12.35","TCP","1430","443  >  61140 [ACK] Seq=22186 Ack=192 Win=424 Len=1376 [TCP PDU reassembled in 656]"
"648","4.634200","146.75.37.140","192.168.12.35","TCP","1430","443  >  61140 [ACK] Seq=23562 Ack=192 Win=424 Len=1376 [TCP PDU reassembled in 656]"
"649","4.634200","146.75.37.140","192.168.12.35","TCP","1430","443  >  61140 [ACK] Seq=24938 Ack=192 Win=424 Len=1376 [TCP PDU reassembled in 656]"
"650","4.634200","146.75.37.140","192.168.12.35","TCP","1430","443  >  61140 [ACK] Seq=26314 Ack=192 Win=424 Len=1376 [TCP PDU reassembled in 656]"
"651","4.634200","146.75.37.140","192.168.12.35","TCP","1430","443  >  61140 [ACK] Seq=27690 Ack=192 Win=424 Len=1376 [TCP PDU reassembled in 656]"
"652","4.634200","146.75.37.140","192.168.12.35","TCP","1430","443  >  61140 [ACK] Seq=29066 Ack=192 Win=424 Len=1376 [TCP PDU reassembled in 656]"
"653","4.634420","192.168.12.35","146.75.37.140","TCP","54","61140  >  443 [ACK] Seq=192 Ack=30442 Win=2050 Len=0"
"654","4.636004","192.168.12.35","146.75.37.140","TLSv1.2","89","Application Data"
"655","4.639303","146.75.37.140","192.168.12.35","TCP","1430","443  >  61140 [ACK] Seq=30442 Ack=192 Win=424 Len=1376 [TCP PDU reassembled in 656]"
"656","4.639303","146.75.37.140","192.168.12.35","TLSv1.2","1430","Application Data"
"657","4.639303","146.75.37.140","192.168.12.35","TCP","1430","443  >  61140 [ACK] Seq=33194 Ack=192 Win=424 Len=1376 [TCP PDU reassembled in 668]"
"658","4.639303","146.75.37.140","192.168.12.35","TCP","1430","443  >  61140 [ACK] Seq=34570 Ack=192 Win=424 Len=1376 [TCP PDU reassembled in 668]"
"659","4.639303","146.75.37.140","192.168.12.35","TCP","1430","443  >  61140 [ACK] Seq=35946 Ack=192 Win=424 Len=1376 [TCP PDU reassembled in 668]"
"660","4.639303","146.75.37.140","192.168.12.35","TCP","1430","443  >  61140 [ACK] Seq=37322 Ack=192 Win=424 Len=1376 [TCP PDU reassembled in 668]"
"661","4.639303","146.75.37.140","192.168.12.35","TCP","1430","443  >  61140 [ACK] Seq=38698 Ack=192 Win=424 Len=1376 [TCP PDU reassembled in 668]"
"662","4.639303","146.75.37.140","192.168.12.35","TCP","1430","443  >  61140 [PSH, ACK] Seq=40074 Ack=192 Win=424 Len=1376 [TCP PDU reassembled in 668]"
"663","4.639303","146.75.37.140","192.168.12.35","TCP","1430","443  >  61140 [ACK] Seq=41450 Ack=192 Win=424 Len=1376 [TCP PDU reassembled in 668]"
"664","4.639303","146.75.37.140","192.168.12.35","TCP","1430","443  >  61140 [ACK] Seq=42826 Ack=192 Win=424 Len=1376 [TCP PDU reassembled in 668]"
"665","4.639303","146.75.37.140","192.168.12.35","TCP","1430","443  >  61140 [ACK] Seq=44202 Ack=192 Win=424 Len=1376 [TCP PDU reassembled in 668]"
"666","4.639303","146.75.37.140","192.168.12.35","TCP","1430","443  >  61140 [ACK] Seq=45578 Ack=192 Win=424 Len=1376 [TCP PDU reassembled in 668]"
"667","4.639303","146.75.37.140","192.168.12.35","TCP","1430","443  >  61140 [ACK] Seq=46954 Ack=192 Win=424 Len=1376 [TCP PDU reassembled in 668]"
"668","4.639303","146.75.37.140","192.168.12.35","TLSv1.2","1430","Application Data"
"669","4.639303","146.75.37.140","192.168.12.35","TCP","1430","443  >  61140 [ACK] Seq=49706 Ack=192 Win=424 Len=1376 [TCP PDU reassembled in 680]"
"670","4.639303","146.75.37.140","192.168.12.35","TCP","1430","443  >  61140 [ACK] Seq=51082 Ack=192 Win=424 Len=1376 [TCP PDU reassembled in 680]"
"671","4.639303","146.75.37.140","192.168.12.35","TCP","1430","443  >  61140 [ACK] Seq=52458 Ack=192 Win=424 Len=1376 [TCP PDU reassembled in 680]"
"672","4.639303","146.75.37.140","192.168.12.35","TCP","1430","443  >  61140 [ACK] Seq=53834 Ack=192 Win=424 Len=1376 [TCP PDU reassembled in 680]"
"673","4.639303","146.75.37.140","192.168.12.35","TCP","1430","443  >  61140 [ACK] Seq=55210 Ack=192 Win=424 Len=1376 [TCP PDU reassembled in 680]"
"674","4.639303","146.75.37.140","192.168.12.35","TCP","1430","443  >  61140 [ACK] Seq=56586 Ack=192 Win=424 Len=1376 [TCP PDU reassembled in 680]"
"675","4.639303","146.75.37.140","192.168.12.35","TCP","1430","443  >  61140 [ACK] Seq=57962 Ack=192 Win=424 Len=1376 [TCP PDU reassembled in 680]"
"676","4.639896","192.168.12.35","146.75.37.140","TCP","54","61140  >  443 [ACK] Seq=227 Ack=59338 Win=2050 Len=0"
"677","4.643212","146.75.37.140","192.168.12.35","TCP","1430","443  >  61140 [ACK] Seq=59338 Ack=192 Win=424 Len=1376 [TCP PDU reassembled in 680]"
"678","4.643212","146.75.37.140","192.168.12.35","TCP","1430","443  >  61140 [PSH, ACK] Seq=60714 Ack=192 Win=424 Len=1376 [TCP PDU reassembled in 680]"
"679","4.643212","146.75.37.140","192.168.12.35","TCP","1430","443  >  61140 [ACK] Seq=62090 Ack=192 Win=424 Len=1376 [TCP PDU reassembled in 680]"
"680","4.643212","146.75.37.140","192.168.12.35","TLSv1.2","288","Application Data"
"681","4.643531","192.168.12.35","146.75.37.140","TCP","54","61140  >  443 [ACK] Seq=227 Ack=63466 Win=2050 Len=0"
"682","4.676950","146.75.37.140","192.168.12.35","TCP","54","443  >  61140 [ACK] Seq=63700 Ack=227 Win=424 Len=0"
"683","4.698612","192.168.12.35","146.75.37.140","TCP","54","61140  >  443 [ACK] Seq=227 Ack=63700 Win=2049 Len=0"
"684","4.776834","192.168.12.35","146.75.37.140","QUIC","80","Protected Payload (KP0), DCID=95b7b671ac19869f8be168bf655ef85da4"
"685","4.825957","146.75.37.140","192.168.12.35","QUIC","66","Protected Payload (KP0)"
"686","5.632016","192.168.12.35","146.75.37.140","QUIC","80","Protected Payload (KP0), DCID=95b7b671ac19869f8be168bf655ef85da4"
"687","5.685646","146.75.37.140","192.168.12.35","QUIC","66","Protected Payload (KP0)"
"688","7.288706","192.168.12.35","146.75.37.140","QUIC","80","Protected Payload (KP0), DCID=95b7b671ac19869f8be168bf655ef85da4"
"689","7.340969","146.75.37.140","192.168.12.35","QUIC","66","Protected Payload (KP0)"
"690","8.172879","192.168.12.35","146.75.37.140","TCP","55","61155  >  443 [ACK] Seq=1 Ack=1 Win=1021 Len=1"
"691","8.195850","146.75.37.140","192.168.12.35","TCP","66","443  >  61155 [ACK] Seq=1 Ack=2 Win=302 Len=0 SLE=1 SRE=2"
"692","10.456687","192.168.12.35","146.75.37.140","TLSv1.2","116","Application Data"
"693","10.456786","192.168.12.35","146.75.37.140","TLSv1.2","93","Application Data"
"694","10.456801","192.168.12.35","146.75.37.140","TLSv1.2","116","Application Data"
"695","10.456814","192.168.12.35","146.75.37.140","TLSv1.2","116","Application Data"
"696","10.496971","146.75.37.140","192.168.12.35","TCP","54","443  >  60961 [ACK] Seq=1 Ack=63 Win=1100 Len=0"
"697","10.496971","146.75.37.140","192.168.12.35","TCP","54","443  >  60961 [ACK] Seq=1 Ack=102 Win=1100 Len=0"
"698","10.496971","146.75.37.140","192.168.12.35","TCP","54","443  >  60961 [ACK] Seq=1 Ack=164 Win=1100 Len=0"
"699","10.496971","146.75.37.140","192.168.12.35","TCP","54","443  >  60961 [ACK] Seq=1 Ack=226 Win=1100 Len=0"
"700","10.496971","146.75.37.140","192.168.12.35","TLSv1.2","93","Application Data"
"701","10.496971","146.75.37.140","192.168.12.35","TLSv1.2","333","Application Data"
"702","10.496971","146.75.37.140","192.168.12.35","TLSv1.2","102","Application Data"
"703","10.497133","192.168.12.35","146.75.37.140","TCP","54","60961  >  443 [ACK] Seq=226 Ack=319 Win=1020 Len=0"
"704","10.497881","192.168.12.35","146.75.37.140","TLSv1.2","89","Application Data"
"705","10.497924","192.168.12.35","146.75.37.140","TLSv1.2","89","Application Data"
"706","10.497941","192.168.12.35","146.75.37.140","TLSv1.2","89","Application Data"
"707","10.497955","192.168.12.35","146.75.37.140","TLSv1.2","113","Application Data"
"708","10.497971","192.168.12.35","146.75.37.140","TLSv1.2","108","Application Data"
"709","10.497987","192.168.12.35","146.75.37.140","TLSv1.2","112","Application Data"
"710","10.498006","192.168.12.35","146.75.37.140","TLSv1.2","16460","Application Data"
"711","10.498044","192.168.12.35","146.75.37.140","TLSv1.2","509","Application Data"
"712","10.498058","192.168.12.35","146.75.37.140","TLSv1.2","1170","Application Data"
"713","10.498073","192.168.12.35","146.75.37.140","TLSv1.2","6792","Application Data"
"714","10.527511","146.75.37.140","192.168.12.35","TCP","54","443  >  60961 [ACK] Seq=367 Ack=261 Win=1100 Len=0"
"715","10.527511","146.75.37.140","192.168.12.35","TCP","54","443  >  60961 [ACK] Seq=367 Ack=296 Win=1100 Len=0"
"716","10.527511","146.75.37.140","192.168.12.35","TCP","54","443  >  60961 [ACK] Seq=367 Ack=331 Win=1100 Len=0"
"717","10.527511","146.75.37.140","192.168.12.35","TCP","54","443  >  60961 [ACK] Seq=367 Ack=390 Win=1100 Len=0"
"718","10.527511","146.75.37.140","192.168.12.35","TCP","54","443  >  60961 [ACK] Seq=367 Ack=444 Win=1100 Len=0"
"719","10.540928","146.75.37.140","192.168.12.35","TCP","54","443  >  60961 [ACK] Seq=367 Ack=502 Win=1100 Len=0"
"720","10.547018","192.168.12.35","146.75.37.140","QUIC","80","Protected Payload (KP0), DCID=95b7b671ac19869f8be168bf655ef85da4"
"721","10.561605","146.75.37.140","192.168.12.35","TCP","54","443  >  60961 [ACK] Seq=367 Ack=1898 Win=1106 Len=0"
"722","10.571089","146.75.37.140","192.168.12.35","TCP","54","443  >  60961 [ACK] Seq=367 Ack=3294 Win=1111 Len=0"
"723","10.590663","146.75.37.140","192.168.12.35","TCP","54","443  >  60961 [ACK] Seq=367 Ack=4690 Win=1117 Len=0"
"724","10.610589","146.75.37.140","192.168.12.35","TCP","54","443  >  60961 [ACK] Seq=367 Ack=6086 Win=1122 Len=0"
"725","10.630636","146.75.37.140","192.168.12.35","TCP","54","443  >  60961 [ACK] Seq=367 Ack=7482 Win=1127 Len=0"
"726","10.650926","146.75.37.140","192.168.12.35","TCP","54","443  >  60961 [ACK] Seq=367 Ack=8878 Win=1133 Len=0"
"727","10.661033","146.75.37.140","192.168.12.35","TCP","54","443  >  60961 [ACK] Seq=367 Ack=10274 Win=1138 Len=0"
"728","10.688843","146.75.37.140","192.168.12.35","TCP","54","443  >  60961 [ACK] Seq=367 Ack=11670 Win=1144 Len=0"
"729","10.704316","146.75.37.140","192.168.12.35","TCP","54","443  >  60961 [ACK] Seq=367 Ack=13066 Win=1149 Len=0"
"730","10.720936","146.75.37.140","192.168.12.35","TCP","54","443  >  60961 [ACK] Seq=367 Ack=14462 Win=1155 Len=0"
"731","10.740586","146.75.37.140","192.168.12.35","TCP","54","443  >  60961 [ACK] Seq=367 Ack=15858 Win=1160 Len=0"
"732","10.751095","146.75.37.140","192.168.12.35","TCP","54","443  >  60961 [ACK] Seq=367 Ack=16908 Win=1166 Len=0"
"733","10.756839","146.75.37.140","192.168.12.35","TLSv1.2","89","Application Data"
"734","10.756839","146.75.37.140","192.168.12.35","TCP","54","443  >  60961 [ACK] Seq=402 Ack=17363 Win=1171 Len=0"
"735","10.767537","146.75.37.140","192.168.12.35","TLSv1.2","106","Application Data"
"736","10.767826","192.168.12.35","146.75.37.140","TCP","54","60961  >  443 [ACK] Seq=25217 Ack=454 Win=1019 Len=0"
"737","10.769165","192.168.12.35","146.75.37.140","TLSv1.2","89","Application Data"
"738","10.772879","146.75.37.140","192.168.12.35","TCP","54","443  >  60961 [ACK] Seq=454 Ack=18479 Win=1177 Len=0"
"739","10.778909","146.75.37.140","192.168.12.35","TLSv1.2","106","Application Data"
"740","10.779129","192.168.12.35","146.75.37.140","TCP","54","60961  >  443 [ACK] Seq=25252 Ack=506 Win=1025 Len=0"
"741","10.779691","192.168.12.35","146.75.37.140","TLSv1.2","89","Application Data"
"742","10.795548","146.75.37.140","192.168.12.35","TCP","54","443  >  60961 [ACK] Seq=506 Ack=19875 Win=1182 Len=0"
"743","10.796661","192.168.12.35","146.75.37.140","QUIC","80","Protected Payload (KP0), DCID=95b7b671ac19869f8be168bf655ef85da4"
"744","10.811046","146.75.37.140","192.168.12.35","TCP","54","443  >  60961 [ACK] Seq=506 Ack=21271 Win=1187 Len=0"
"745","10.826082","146.75.37.140","192.168.12.35","TCP","54","443  >  60961 [ACK] Seq=506 Ack=22667 Win=1193 Len=0"
"746","10.847640","146.75.37.140","192.168.12.35","TCP","54","443  >  60961 [ACK] Seq=506 Ack=24063 Win=1198 Len=0"
"747","10.852864","146.75.37.140","192.168.12.35","TCP","54","443  >  60961 [ACK] Seq=506 Ack=25217 Win=1204 Len=0"
"748","10.858879","146.75.37.140","192.168.12.35","TLSv1.2","123","Application Data"
"749","10.859970","192.168.12.35","146.75.37.140","TLSv1.2","89","Application Data"
"750","10.871019","146.75.37.140","192.168.12.35","TCP","54","443  >  60961 [ACK] Seq=575 Ack=25252 Win=1204 Len=0"
"751","10.871019","146.75.37.140","192.168.12.35","TCP","54","443  >  60961 [ACK] Seq=575 Ack=25287 Win=1204 Len=0"
"752","10.871019","146.75.37.140","192.168.12.35","QUIC","68","Protected Payload (KP0)"
"753","10.890623","146.75.37.140","192.168.12.35","TCP","54","443  >  60961 [ACK] Seq=575 Ack=25322 Win=1204 Len=0"
"754","13.943934","192.168.12.35","146.75.37.140","TCP","55","61938  >  443 [ACK] Seq=1 Ack=1 Win=1024 Len=1"
"755","13.971032","146.75.37.140","192.168.12.35","TCP","66","443  >  61938 [ACK] Seq=1 Ack=2 Win=302 Len=0 SLE=1 SRE=2"
"756","15.979780","192.168.12.35","146.75.37.140","TCP","55","62083  >  443 [ACK] Seq=1 Ack=1 Win=1023 Len=1"
"757","16.009304","146.75.37.140","192.168.12.35","TCP","66","443  >  62083 [ACK] Seq=1 Ack=2 Win=313 Len=0 SLE=1 SRE=2"
"758","17.282107","192.168.12.35","146.75.37.140","QUIC","80","Protected Payload (KP0), DCID=95b7b671ac19869f8be168bf655ef85da4"
"759","17.331486","146.75.37.140","192.168.12.35","QUIC","68","Protected Payload (KP0)"
"760","19.626578","192.168.12.35","146.75.37.140","TCP","55","62042  >  443 [ACK] Seq=1 Ack=1 Win=1025 Len=1"
"761","19.675639","146.75.37.140","192.168.12.35","TCP","66","443  >  62042 [ACK] Seq=1 Ack=2 Win=302 Len=0 SLE=1 SRE=2"
