"No.","Time","Source","Destination","Protocol","Length","Info"
"1","0.000000","192.168.12.35","146.75.37.140","TLSv1.2","3240","Application Data"
"2","0.000096","192.168.12.35","146.75.37.140","TLSv1.2","93","Application Data"
"3","0.000870","192.168.12.35","146.75.37.140","TLSv1.2","3359","Application Data"
"4","0.000944","192.168.12.35","146.75.37.140","TLSv1.2","4777","Application Data"
"5","0.049656","146.75.37.140","192.168.12.35","TCP","54","443  >  61013 [ACK] Seq=1 Ack=1397 Win=8244 Len=0"
"6","0.062274","146.75.37.140","192.168.12.35","TCP","54","443  >  61013 [ACK] Seq=1 Ack=2793 Win=8244 Len=0"
"7","0.062274","146.75.37.140","192.168.12.35","TCP","54","443  >  61013 [ACK] Seq=1 Ack=3187 Win=8244 Len=0"
"8","0.062274","146.75.37.140","192.168.12.35","TCP","54","443  >  61013 [ACK] Seq=1 Ack=3226 Win=8244 Len=0"
"9","0.062274","146.75.37.140","192.168.12.35","TLSv1.2","93","Application Data"
"10","0.097536","146.75.37.140","192.168.12.35","TCP","54","443  >  61013 [ACK] Seq=40 Ack=4622 Win=8244 Len=0"
"11","0.104957","146.75.37.140","192.168.12.35","TCP","54","443  >  61013 [ACK] Seq=40 Ack=6018 Win=8244 Len=0"
"12","0.113200","192.168.12.35","146.75.37.140","TCP","54","61013  >  443 [ACK] Seq=11254 Ack=40 Win=1022 Len=0"
"13","0.126403","146.75.37.140","192.168.12.35","TCP","1430","443  >  61013 [ACK] Seq=40 Ack=6018 Win=8244 Len=1376 [TCP PDU reassembled in 14]"
"14","0.126403","146.75.37.140","192.168.12.35","TLSv1.2","595","Application Data"
"15","0.126403","146.75.37.140","192.168.12.35","TCP","54","443  >  61013 [ACK] Seq=1957 Ack=6531 Win=8244 Len=0"
"16","0.126403","146.75.37.140","192.168.12.35","TCP","1430","443  >  61013 [ACK] Seq=1957 Ack=6531 Win=8244 Len=1376 [TCP PDU reassembled in 17]"
"17","0.126403","146.75.37.140","192.168.12.35","TLSv1.2","1074","Application Data"
"18","0.126403","146.75.37.140","192.168.12.35","TCP","1430","443  >  61013 [ACK] Seq=4353 Ack=6531 Win=8244 Len=1376 [TCP PDU reassembled in 28]"
"19","0.126403","146.75.37.140","192.168.12.35","TCP","1430","443  >  61013 [ACK] Seq=5729 Ack=6531 Win=8244 Len=1376 [TCP PDU reassembled in 28]"
"20","0.126403","146.75.37.140","192.168.12.35","TCP","1430","443  >  61013 [PSH, ACK] Seq=7105 Ack=6531 Win=8244 Len=1376 [TCP PDU reassembled in 28]"
"21","0.126403","146.75.37.140","192.168.12.35","TCP","1430","443  >  61013 [ACK] Seq=8481 Ack=6531 Win=8244 Len=1376 [TCP PDU reassembled in 28]"
"22","0.126403","146.75.37.140","192.168.12.35","TCP","1430","443  >  61013 [ACK] Seq=9857 Ack=6531 Win=8244 Len=1376 [TCP PDU reassembled in 28]"
"23","0.126403","146.75.37.140","192.168.12.35","TCP","1430","443  >  61013 [PSH, ACK] Seq=11233 Ack=6531 Win=8244 Len=1376 [TCP PDU reassembled in 28]"
"24","0.126403","146.75.37.140","192.168.12.35","TCP","1430","443  >  61013 [ACK] Seq=12609 Ack=6531 Win=8244 Len=1376 [TCP PDU reassembled in 28]"
"25","0.126403","146.75.37.140","192.168.12.35","TCP","1430","443  >  61013 [ACK] Seq=13985 Ack=6531 Win=8244 Len=1376 [TCP PDU reassembled in 28]"
"26","0.126403","146.75.37.140","192.168.12.35","TCP","1430","443  >  61013 [PSH, ACK] Seq=15361 Ack=6531 Win=8244 Len=1376 [TCP PDU reassembled in 28]"
"27","0.126403","146.75.37.140","192.168.12.35","TCP","1430","443  >  61013 [ACK] Seq=16737 Ack=6531 Win=8244 Len=1376 [TCP PDU reassembled in 28]"
"28","0.126403","146.75.37.140","192.168.12.35","TLSv1.2","344","Application Data"
"29","0.126403","146.75.37.140","192.168.12.35","TLSv1.2","869","Application Data"
"30","0.127020","192.168.12.35","146.75.37.140","TCP","54","61013  >  443 [ACK] Seq=11254 Ack=1957 Win=1025 Len=0"
"31","0.127226","192.168.12.35","146.75.37.140","TCP","54","61013  >  443 [ACK] Seq=11254 Ack=4353 Win=1025 Len=0"
"32","0.127271","192.168.12.35","146.75.37.140","TCP","54","61013  >  443 [ACK] Seq=11254 Ack=18113 Win=1025 Len=0"
"33","0.127325","192.168.12.35","146.75.37.140","TCP","54","61013  >  443 [ACK] Seq=11254 Ack=19218 Win=1020 Len=0"
"34","0.129101","146.75.37.140","192.168.12.35","TLSv1.2","90","Application Data"
"35","0.129101","146.75.37.140","192.168.12.35","TCP","1430","443  >  61013 [ACK] Seq=19254 Ack=6531 Win=8244 Len=1376 [TCP PDU reassembled in 47]"
"36","0.129101","146.75.37.140","192.168.12.35","TCP","1430","443  >  61013 [ACK] Seq=20630 Ack=6531 Win=8244 Len=1376 [TCP PDU reassembled in 47]"
"37","0.129101","146.75.37.140","192.168.12.35","TCP","1430","443  >  61013 [PSH, ACK] Seq=22006 Ack=6531 Win=8244 Len=1376 [TCP PDU reassembled in 47]"
"38","0.129101","146.75.37.140","192.168.12.35","TCP","1430","443  >  61013 [ACK] Seq=23382 Ack=6531 Win=8244 Len=1376 [TCP PDU reassembled in 47]"
"39","0.129101","146.75.37.140","192.168.12.35","TCP","1430","443  >  61013 [ACK] Seq=24758 Ack=6531 Win=8244 Len=1376 [TCP PDU reassembled in 47]"
"40","0.129101","146.75.37.140","192.168.12.35","TCP","1430","443  >  61013 [PSH, ACK] Seq=26134 Ack=6531 Win=8244 Len=1376 [TCP PDU reassembled in 47]"
"41","0.129101","146.75.37.140","192.168.12.35","TCP","1430","443  >  61013 [ACK] Seq=27510 Ack=6531 Win=8244 Len=1376 [TCP PDU reassembled in 47]"
"42","0.129101","146.75.37.140","192.168.12.35","TCP","1430","443  >  61013 [ACK] Seq=28886 Ack=6531 Win=8244 Len=1376 [TCP PDU reassembled in 47]"
"43","0.129101","146.75.37.140","192.168.12.35","TCP","1430","443  >  61013 [PSH, ACK] Seq=30262 Ack=6531 Win=8244 Len=1376 [TCP PDU reassembled in 47]"
"44","0.129901","192.168.12.35","146.75.37.140","TCP","54","61013  >  443 [ACK] Seq=11254 Ack=31638 Win=1025 Len=0"
"45","0.133698","146.75.37.140","192.168.12.35","TCP","1430","443  >  61013 [ACK] Seq=31638 Ack=6531 Win=8244 Len=1376 [TCP PDU reassembled in 47]"
"46","0.133698","146.75.37.140","192.168.12.35","TCP","1430","443  >  61013 [ACK] Seq=33014 Ack=6531 Win=8244 Len=1376 [TCP PDU reassembled in 47]"
"47","0.133698","146.75.37.140","192.168.12.35","TLSv1.2","544","Application Data"
"48","0.134308","192.168.12.35","146.75.37.140","TCP","54","61013  >  443 [ACK] Seq=11254 Ack=34390 Win=1025 Len=0"
"49","0.135702","192.168.12.35","146.75.37.140","TLSv1.2","89","Application Data"
"50","0.142012","146.75.37.140","192.168.12.35","TCP","1430","443  >  61013 [ACK] Seq=34880 Ack=6531 Win=8244 Len=1376 [TCP PDU reassembled in 61]"
"51","0.142012","146.75.37.140","192.168.12.35","TCP","1430","443  >  61013 [ACK] Seq=36256 Ack=6531 Win=8244 Len=1376 [TCP PDU reassembled in 61]"
"52","0.142012","146.75.37.140","192.168.12.35","TCP","1430","443  >  61013 [PSH, ACK] Seq=37632 Ack=6531 Win=8244 Len=1376 [TCP PDU reassembled in 61]"
"53","0.142012","146.75.37.140","192.168.12.35","TCP","1430","443  >  61013 [ACK] Seq=39008 Ack=6531 Win=8244 Len=1376 [TCP PDU reassembled in 61]"
"54","0.142012","146.75.37.140","192.168.12.35","TCP","1430","443  >  61013 [ACK] Seq=40384 Ack=6531 Win=8244 Len=1376 [TCP PDU reassembled in 61]"
"55","0.142012","146.75.37.140","192.168.12.35","TCP","1430","443  >  61013 [PSH, ACK] Seq=41760 Ack=6531 Win=8244 Len=1376 [TCP PDU reassembled in 61]"
"56","0.142012","146.75.37.140","192.168.12.35","TCP","1430","443  >  61013 [ACK] Seq=43136 Ack=6531 Win=8244 Len=1376 [TCP PDU reassembled in 61]"
"57","0.142012","146.75.37.140","192.168.12.35","TCP","1430","443  >  61013 [ACK] Seq=44512 Ack=6531 Win=8244 Len=1376 [TCP PDU reassembled in 61]"
"58","0.142012","146.75.37.140","192.168.12.35","TCP","1430","443  >  61013 [PSH, ACK] Seq=45888 Ack=6531 Win=8244 Len=1376 [TCP PDU reassembled in 61]"
"59","0.142012","146.75.37.140","192.168.12.35","TCP","1430","443  >  61013 [ACK] Seq=47264 Ack=6531 Win=8244 Len=1376 [TCP PDU reassembled in 61]"
"60","0.142012","146.75.37.140","192.168.12.35","TCP","1430","443  >  61013 [ACK] Seq=48640 Ack=6531 Win=8244 Len=1376 [TCP PDU reassembled in 61]"
"61","0.142012","146.75.37.140","192.168.12.35","TLSv1.2","1430","Application Data, Application Data"
"62","0.142012","146.75.37.140","192.168.12.35","TCP","1430","443  >  61013 [ACK] Seq=51392 Ack=6531 Win=8244 Len=1376 [TCP PDU reassembled in 63]"
"63","0.142012","146.75.37.140","192.168.12.35","TLSv1.2","936","Application Data"
"64","0.142012","146.75.37.140","192.168.12.35","TCP","1430","443  >  61013 [ACK] Seq=53650 Ack=7927 Win=8244 Len=1376 [TCP PDU reassembled in 66]"
"65","0.142012","146.75.37.140","192.168.12.35","TCP","1430","443  >  61013 [ACK] Seq=55026 Ack=7927 Win=8244 Len=1376 [TCP PDU reassembled in 66]"
"66","0.142012","146.75.37.140","192.168.12.35","TLSv1.2","379","Application Data"
"67","0.142012","146.75.37.140","192.168.12.35","TCP","1430","443  >  61013 [ACK] Seq=56727 Ack=7927 Win=8244 Len=1376 [TCP PDU reassembled in 68]"
"68","0.142012","146.75.37.140","192.168.12.35","TLSv1.2","333","Application Data"
"69","0.142012","146.75.37.140","192.168.12.35","TLSv1.2","934","Application Data, Application Data"
"70","0.142012","146.75.37.140","192.168.12.35","TLSv1.2","927","Application Data"
"71","0.142012","146.75.37.140","192.168.12.35","TCP","1430","443  >  61013 [ACK] Seq=60135 Ack=7927 Win=8244 Len=1376 [TCP PDU reassembled in 72]"
"72","0.142012","146.75.37.140","192.168.12.35","TLSv1.2","1135","Application Data"
"73","0.142012","146.75.37.140","192.168.12.35","TLSv1.2","577","Application Data"
"74","0.142012","146.75.37.140","192.168.12.35","TLSv1.2","819","Application Data"
"75","0.142012","146.75.37.140","192.168.12.35","TLSv1.2","1290","Application Data"
"76","0.142012","146.75.37.140","192.168.12.35","TLSv1.2","443","Application Data"
"77","0.142012","146.75.37.140","192.168.12.35","TLSv1.2","242","Application Data"
"78","0.142012","146.75.37.140","192.168.12.35","TLSv1.2","276","Application Data"
"79","0.142012","146.75.37.140","192.168.12.35","TLSv1.2","128","Application Data"
"80","0.144345","192.168.12.35","146.75.37.140","TCP","54","61013  >  443 [ACK] Seq=11289 Ack=52768 Win=1025 Len=0"
"81","0.145087","192.168.12.35","146.75.37.140","TCP","54","61013  >  443 [ACK] Seq=11289 Ack=53650 Win=1021 Len=0"
"82","0.145237","192.168.12.35","146.75.37.140","TCP","54","61013  >  443 [ACK] Seq=11289 Ack=56402 Win=1025 Len=0"
"83","0.145313","192.168.12.35","146.75.37.140","TCP","54","61013  >  443 [ACK] Seq=11289 Ack=58103 Win=1025 Len=0"
"84","0.145391","192.168.12.35","146.75.37.140","TCP","54","61013  >  443 [ACK] Seq=11289 Ack=59262 Win=1020 Len=0"
"85","0.145693","192.168.12.35","146.75.37.140","TCP","54","61013  >  443 [ACK] Seq=11289 Ack=60135 Win=1025 Len=0"
"86","0.145789","192.168.12.35","146.75.37.140","TCP","54","61013  >  443 [ACK] Seq=11289 Ack=61511 Win=1019 Len=0"
"87","0.145852","192.168.12.35","146.75.37.140","TCP","54","61013  >  443 [ACK] Seq=11289 Ack=62592 Win=1025 Len=0"
"88","0.145924","192.168.12.35","146.75.37.140","TCP","54","61013  >  443 [ACK] Seq=11289 Ack=63115 Win=1023 Len=0"
"89","0.146036","192.168.12.35","146.75.37.140","TCP","54","61013  >  443 [ACK] Seq=11289 Ack=65116 Win=1025 Len=0"
"90","0.146114","192.168.12.35","146.75.37.140","TCP","54","61013  >  443 [ACK] Seq=11289 Ack=65693 Win=1022 Len=0"
"91","0.146178","192.168.12.35","146.75.37.140","TCP","54","61013  >  443 [ACK] Seq=11289 Ack=65989 Win=1021 Len=0"
"92","0.159704","146.75.37.140","192.168.12.35","TCP","54","443  >  61013 [ACK] Seq=65989 Ack=9323 Win=8244 Len=0"
"93","0.169726","146.75.37.140","192.168.12.35","TLSv1.2","143","Application Data"
"94","0.174724","146.75.37.140","192.168.12.35","TLSv1.2","99","Application Data"
"95","0.174724","146.75.37.140","192.168.12.35","TCP","54","443  >  61013 [ACK] Seq=66123 Ack=10719 Win=8244 Len=0"
"96","0.174724","146.75.37.140","192.168.12.35","TLSv1.2","471","Application Data"
"97","0.174724","146.75.37.140","192.168.12.35","TLSv1.2","177","Application Data"
"98","0.174724","146.75.37.140","192.168.12.35","TLSv1.2","202","Application Data"
"99","0.174724","146.75.37.140","192.168.12.35","TLSv1.2","155","Application Data"
"100","0.174724","146.75.37.140","192.168.12.35","TLSv1.2","264","Application Data"
"101","0.174724","146.75.37.140","192.168.12.35","TLSv1.2","263","Application Data"
"102","0.174724","146.75.37.140","192.168.12.35","TLSv1.2","199","Application Data"
"103","0.175632","192.168.12.35","146.75.37.140","TCP","54","61013  >  443 [ACK] Seq=11289 Ack=66123 Win=1021 Len=0"
"104","0.175809","192.168.12.35","146.75.37.140","TCP","54","61013  >  443 [ACK] Seq=11289 Ack=66540 Win=1025 Len=0"
"105","0.175991","192.168.12.35","146.75.37.140","TCP","54","61013  >  443 [ACK] Seq=11289 Ack=66663 Win=1024 Len=0"
"106","0.176140","192.168.12.35","146.75.37.140","TCP","54","61013  >  443 [ACK] Seq=11289 Ack=66912 Win=1023 Len=0"
"107","0.176276","192.168.12.35","146.75.37.140","TCP","54","61013  >  443 [ACK] Seq=11289 Ack=67331 Win=1022 Len=0"
"108","0.184656","146.75.37.140","192.168.12.35","TCP","54","443  >  61013 [ACK] Seq=67476 Ack=11254 Win=8244 Len=0"
"109","0.198956","192.168.12.35","146.75.37.140","UDP","96","52870  >  443 Len=54"
"110","0.209527","146.75.37.140","192.168.12.35","TCP","54","443  >  61013 [ACK] Seq=67476 Ack=11289 Win=8244 Len=0"
"111","0.221896","146.75.37.140","192.168.12.35","UDP","67","443  >  52870 Len=25"
"112","0.223336","192.168.12.35","146.75.37.140","TCP","54","61013  >  443 [ACK] Seq=11289 Ack=67476 Win=1021 Len=0"
"113","0.227746","146.75.37.140","192.168.12.35","TCP","1430","443  >  61013 [ACK] Seq=67476 Ack=11289 Win=8244 Len=1376 [TCP PDU reassembled in 114]"
"114","0.227746","146.75.37.140","192.168.12.35","TLSv1.2","821","Application Data"
"115","0.228373","192.168.12.35","146.75.37.140","TCP","54","61013  >  443 [ACK] Seq=11289 Ack=69619 Win=1025 Len=0"
"116","0.234221","192.168.12.35","146.75.37.140","UDP","84","52870  >  443 Len=42"
"117","0.251257","146.75.37.140","192.168.12.35","UDP","67","443  >  52870 Len=25"
"118","0.727673","146.75.37.140","192.168.12.35","TLSv1.2","564","Application Data"
"119","0.727673","146.75.37.140","192.168.12.35","TCP","1430","443  >  61013 [ACK] Seq=70129 Ack=11289 Win=8244 Len=1376 [TCP PDU reassembled in 120]"
"120","0.727673","146.75.37.140","192.168.12.35","TLSv1.2","264","Application Data"
"121","0.728905","192.168.12.35","146.75.37.140","TCP","54","61013  >  443 [ACK] Seq=11289 Ack=71505 Win=1025 Len=0"
"122","0.733960","192.168.12.35","146.75.37.140","TCP","55","61034  >  443 [ACK] Seq=1 Ack=1 Win=8198 Len=1 [TCP PDU reassembled in 222]"
"123","0.740683","146.75.37.140","192.168.12.35","TCP","1430","443  >  61013 [ACK] Seq=71715 Ack=11289 Win=8244 Len=1376 [TCP PDU reassembled in 129]"
"124","0.740683","146.75.37.140","192.168.12.35","TCP","1430","443  >  61013 [ACK] Seq=73091 Ack=11289 Win=8244 Len=1376 [TCP PDU reassembled in 129]"
"125","0.740683","146.75.37.140","192.168.12.35","TCP","1430","443  >  61013 [PSH, ACK] Seq=74467 Ack=11289 Win=8244 Len=1376 [TCP PDU reassembled in 129]"
"126","0.740683","146.75.37.140","192.168.12.35","TCP","1430","443  >  61013 [ACK] Seq=75843 Ack=11289 Win=8244 Len=1376 [TCP PDU reassembled in 129]"
"127","0.740683","146.75.37.140","192.168.12.35","TCP","1430","443  >  61013 [ACK] Seq=77219 Ack=11289 Win=8244 Len=1376 [TCP PDU reassembled in 129]"
"128","0.740683","146.75.37.140","192.168.12.35","TCP","1430","443  >  61013 [PSH, ACK] Seq=78595 Ack=11289 Win=8244 Len=1376 [TCP PDU reassembled in 129]"
"129","0.740683","146.75.37.140","192.168.12.35","TLSv1.2","850","Application Data, Application Data"
"130","0.741422","192.168.12.35","146.75.37.140","TCP","54","61013  >  443 [ACK] Seq=11289 Ack=79971 Win=1025 Len=0"
"131","0.741748","192.168.12.35","146.75.37.140","TCP","54","61013  >  443 [ACK] Seq=11289 Ack=80767 Win=1022 Len=0"
"132","0.749286","192.168.12.35","146.75.37.140","TCP","55","61039  >  443 [ACK] Seq=1 Ack=1 Win=4100 Len=1"
"133","0.751243","146.75.37.140","192.168.12.35","TLSv1.2","482","Application Data"
"134","0.751243","146.75.37.140","192.168.12.35","TLSv1.2","929","Application Data"
"135","0.751243","146.75.37.140","192.168.12.35","TLSv1.2","842","Application Data"
"136","0.751243","146.75.37.140","192.168.12.35","TLSv1.2","1385","Application Data"
"137","0.751243","146.75.37.140","192.168.12.35","TLSv1.2","236","Application Data"
"138","0.751243","146.75.37.140","192.168.12.35","TLSv1.2","530","Application Data"
"139","0.751243","146.75.37.140","192.168.12.35","TLSv1.2","529","Application Data"
"140","0.751243","146.75.37.140","192.168.12.35","TLSv1.2","913","Application Data"
"141","0.752259","192.168.12.35","146.75.37.140","TCP","54","61013  >  443 [ACK] Seq=11289 Ack=82070 Win=1025 Len=0"
"142","0.752748","192.168.12.35","146.75.37.140","TCP","54","61013  >  443 [ACK] Seq=11289 Ack=84189 Win=1025 Len=0"
"143","0.752942","192.168.12.35","146.75.37.140","TCP","54","61013  >  443 [ACK] Seq=11289 Ack=84847 Win=1022 Len=0"
"144","0.753039","192.168.12.35","146.75.37.140","TCP","54","61013  >  443 [ACK] Seq=11289 Ack=86181 Win=1025 Len=0"
"145","0.755836","146.75.37.140","192.168.12.35","TLSv1.2","251","Application Data"
"146","0.755836","146.75.37.140","192.168.12.35","TLSv1.2","442","Application Data"
"147","0.755836","146.75.37.140","192.168.12.35","TLSv1.2","218","Application Data"
"148","0.755836","146.75.37.140","192.168.12.35","TLSv1.2","649","Application Data"
"149","0.755836","146.75.37.140","192.168.12.35","TCP","66","443  >  61034 [ACK] Seq=1 Ack=2 Win=424 Len=0 SLE=1 SRE=2"
"150","0.756439","192.168.12.35","146.75.37.140","TCP","54","61013  >  443 [ACK] Seq=11289 Ack=86766 Win=1022 Len=0"
"151","0.756722","192.168.12.35","146.75.37.140","TCP","54","61013  >  443 [ACK] Seq=11289 Ack=87525 Win=1019 Len=0"
"152","0.771984","146.75.37.140","192.168.12.35","TLSv1.2","231","Application Data"
"153","0.771984","146.75.37.140","192.168.12.35","TLSv1.2","909","Application Data"
"154","0.771984","146.75.37.140","192.168.12.35","TLSv1.2","147","Application Data"
"155","0.773359","192.168.12.35","146.75.37.140","TCP","54","61013  >  443 [ACK] Seq=11289 Ack=88557 Win=1025 Len=0"
"156","0.783480","146.75.37.140","192.168.12.35","TLSv1.2","170","Application Data"
"157","0.783480","146.75.37.140","192.168.12.35","TLSv1.2","1342","Application Data"
"158","0.783480","146.75.37.140","192.168.12.35","TCP","66","443  >  61039 [ACK] Seq=1 Ack=2 Win=424 Len=0 SLE=1 SRE=2"
"159","0.783480","146.75.37.140","192.168.12.35","TCP","1430","443  >  61013 [ACK] Seq=90054 Ack=11289 Win=8244 Len=1376 [TCP PDU reassembled in 160]"
"160","0.783480","146.75.37.140","192.168.12.35","TLSv1.2","889","Application Data"
"161","0.784795","192.168.12.35","146.75.37.140","TCP","54","61013  >  443 [ACK] Seq=11289 Ack=88766 Win=1024 Len=0"
"162","0.785283","192.168.12.35","146.75.37.140","TCP","54","61013  >  443 [ACK] Seq=11289 Ack=91430 Win=1025 Len=0"
"163","0.792378","146.75.37.140","192.168.12.35","TLSv1.2","604","Application Data"
"164","0.792378","146.75.37.140","192.168.12.35","TLSv1.2","322","Application Data"
"165","0.792882","192.168.12.35","146.75.37.140","TCP","54","61013  >  443 [ACK] Seq=11289 Ack=92815 Win=1019 Len=0"
"166","0.797591","146.75.37.140","192.168.12.35","TLSv1.2","480","Application Data"
"167","0.797591","146.75.37.140","192.168.12.35","TLSv1.2","394","Application Data"
"168","0.797591","146.75.37.140","192.168.12.35","TLSv1.2","589","Application Data"
"169","0.797591","146.75.37.140","192.168.12.35","TLSv1.2","416","Application Data"
"170","0.798554","192.168.12.35","146.75.37.140","TCP","54","61013  >  443 [ACK] Seq=11289 Ack=93509 Win=1025 Len=0"
"171","0.798868","192.168.12.35","146.75.37.140","TCP","54","61013  >  443 [ACK] Seq=11289 Ack=94384 Win=1021 Len=0"
"172","0.804204","146.75.37.140","192.168.12.35","TLSv1.2","238","Application Data"
"173","0.804204","146.75.37.140","192.168.12.35","TLSv1.2","150","Application Data"
"174","0.804204","146.75.37.140","192.168.12.35","TLSv1.2","257","Application Data"
"175","0.804204","146.75.37.140","192.168.12.35","TLSv1.2","385","Application Data"
"176","0.804624","192.168.12.35","146.75.37.140","TCP","54","61013  >  443 [ACK] Seq=11289 Ack=94930 Win=1025 Len=0"
"177","0.804794","192.168.12.35","146.75.37.140","TCP","54","61013  >  443 [ACK] Seq=11289 Ack=95229 Win=1024 Len=0"
"178","0.859989","192.168.12.35","146.75.37.140","TCP","54","61013  >  443 [ACK] Seq=11289 Ack=95560 Win=1022 Len=0"
"179","1.005729","192.168.12.35","146.75.37.140","TLSv1.2","3185","Application Data"
"180","1.006613","192.168.12.35","146.75.37.140","TLSv1.2","718","Application Data"
"181","1.006719","192.168.12.35","146.75.37.140","TLSv1.2","3188","Application Data"
"182","1.060025","146.75.37.140","192.168.12.35","TCP","54","443  >  61013 [ACK] Seq=95560 Ack=12685 Win=8244 Len=0"
"183","1.069936","146.75.37.140","192.168.12.35","TCP","54","443  >  61013 [ACK] Seq=95560 Ack=14081 Win=8244 Len=0"
"184","1.074806","146.75.37.140","192.168.12.35","TCP","54","443  >  61013 [ACK] Seq=95560 Ack=14420 Win=8244 Len=0"
"185","1.085501","146.75.37.140","192.168.12.35","TCP","54","443  >  61013 [ACK] Seq=95560 Ack=15084 Win=8244 Len=0"
"186","1.120730","146.75.37.140","192.168.12.35","TCP","54","443  >  61013 [ACK] Seq=95560 Ack=16480 Win=8244 Len=0"
"187","1.136664","146.75.37.140","192.168.12.35","TCP","1430","443  >  61013 [ACK] Seq=95560 Ack=16480 Win=8244 Len=1376 [TCP PDU reassembled in 188]"
"188","1.136664","146.75.37.140","192.168.12.35","TLSv1.2","438","Application Data"
"189","1.136664","146.75.37.140","192.168.12.35","TCP","54","443  >  61013 [ACK] Seq=97320 Ack=17876 Win=8244 Len=0"
"190","1.136664","146.75.37.140","192.168.12.35","TCP","54","443  >  61013 [ACK] Seq=97320 Ack=18218 Win=8244 Len=0"
"191","1.138052","192.168.12.35","146.75.37.140","TCP","54","61013  >  443 [ACK] Seq=18218 Ack=97320 Win=1025 Len=0"
"192","1.151117","192.168.12.35","146.75.37.140","TLSv1.2","3198","Application Data"
"193","1.182028","146.75.37.140","192.168.12.35","TCP","1430","443  >  61013 [ACK] Seq=97320 Ack=18218 Win=8244 Len=1376 [TCP PDU reassembled in 194]"
"194","1.182028","146.75.37.140","192.168.12.35","TLSv1.2","825","Application Data"
"195","1.183180","192.168.12.35","146.75.37.140","TCP","54","61013  >  443 [ACK] Seq=21362 Ack=99467 Win=1025 Len=0"
"196","1.221650","146.75.37.140","192.168.12.35","TCP","54","443  >  61013 [ACK] Seq=99467 Ack=19614 Win=8244 Len=0"
"197","1.221650","146.75.37.140","192.168.12.35","TCP","54","443  >  61013 [ACK] Seq=99467 Ack=21010 Win=8244 Len=0"
"198","1.234965","146.75.37.140","192.168.12.35","TCP","54","443  >  61013 [ACK] Seq=99467 Ack=21362 Win=8244 Len=0"
"199","1.281145","146.75.37.140","192.168.12.35","TCP","1430","443  >  61013 [ACK] Seq=99467 Ack=21362 Win=8244 Len=1376 [TCP PDU reassembled in 200]"
"200","1.281145","146.75.37.140","192.168.12.35","TLSv1.2","535","Application Data"
"201","1.281145","146.75.37.140","192.168.12.35","TLSv1.2","100","Application Data"
"202","1.281426","192.168.12.35","146.75.37.140","TCP","54","61013  >  443 [ACK] Seq=21362 Ack=101324 Win=1025 Len=0"
"203","1.330085","192.168.12.35","146.75.37.140","TCP","54","61013  >  443 [ACK] Seq=21362 Ack=101370 Win=1025 Len=0"
"204","1.330354","146.75.37.140","192.168.12.35","TLSv1.2","594","Application Data"
"205","1.341882","146.75.37.140","192.168.12.35","TLSv1.2","95","Application Data"
"206","1.343136","192.168.12.35","146.75.37.140","TCP","54","61013  >  443 [ACK] Seq=21362 Ack=101951 Win=1022 Len=0"
"207","1.364623","192.168.12.35","146.75.37.140","TLSv1.2","3177","Application Data"
"208","1.365261","192.168.12.35","146.75.37.140","TLSv1.2","210","Application Data"
"209","1.410463","146.75.37.140","192.168.12.35","TCP","54","443  >  61013 [ACK] Seq=101951 Ack=22758 Win=8244 Len=0"
"210","1.425410","146.75.37.140","192.168.12.35","TCP","54","443  >  61013 [ACK] Seq=101951 Ack=24154 Win=8244 Len=0"
"211","1.425410","146.75.37.140","192.168.12.35","TCP","54","443  >  61013 [ACK] Seq=101951 Ack=24485 Win=8244 Len=0"
"212","1.437930","146.75.37.140","192.168.12.35","TCP","54","443  >  61013 [ACK] Seq=101951 Ack=24641 Win=8244 Len=0"
"213","1.514286","146.75.37.140","192.168.12.35","TCP","1430","443  >  61013 [ACK] Seq=101951 Ack=24641 Win=8244 Len=1376 [TCP PDU reassembled in 214]"
"214","1.514286","146.75.37.140","192.168.12.35","TLSv1.2","830","Application Data"
"215","1.514286","146.75.37.140","192.168.12.35","TLSv1.2","222","Application Data"
"216","1.515470","192.168.12.35","146.75.37.140","TCP","54","61013  >  443 [ACK] Seq=24641 Ack=104103 Win=1025 Len=0"
"217","1.569790","192.168.12.35","146.75.37.140","TCP","54","61013  >  443 [ACK] Seq=24641 Ack=104271 Win=1024 Len=0"
"218","1.872034","192.168.12.35","146.75.37.140","TLSv1.2","3195","Application Data"
"219","1.872793","192.168.12.35","146.75.37.140","TLSv1.2","3210","Application Data"
"220","1.879625","192.168.12.35","146.75.37.140","TLSv1.2","3187","Application Data"
"221","1.884130","192.168.12.35","146.75.37.140","TLSv1.2","3288","Application Data"
"222","1.889446","192.168.12.35","146.75.37.140","TLSv1.2","217","Ignored Unknown Record"
"223","1.889661","192.168.12.35","146.75.37.140","TLSv1.2","93","Application Data"
"224","1.985102","192.168.12.35","146.75.37.140","TLSv1.2","3175","Application Data"
"225","1.986000","192.168.12.35","146.75.37.140","TLSv1.2","134","Application Data"
"226","2.015640","146.75.37.140","192.168.12.35","TCP","54","443  >  61013 [ACK] Seq=104271 Ack=26037 Win=8244 Len=0"
"227","2.027637","146.75.37.140","192.168.12.35","TCP","54","443  >  61013 [ACK] Seq=104271 Ack=27433 Win=8244 Len=0"
"228","2.031895","146.75.37.140","192.168.12.35","TCP","54","443  >  61013 [ACK] Seq=104271 Ack=27782 Win=8244 Len=0"
"229","2.044704","146.75.37.140","192.168.12.35","TCP","54","443  >  61013 [ACK] Seq=104271 Ack=29178 Win=8244 Len=0"
"230","2.061809","146.75.37.140","192.168.12.35","TCP","54","443  >  61013 [ACK] Seq=104271 Ack=30574 Win=8244 Len=0"
"231","2.061809","146.75.37.140","192.168.12.35","TCP","54","443  >  61013 [ACK] Seq=104271 Ack=30938 Win=8244 Len=0"
"232","2.081122","146.75.37.140","192.168.12.35","TCP","1430","443  >  61013 [ACK] Seq=104271 Ack=30938 Win=8244 Len=1376 [TCP PDU reassembled in 233]"
"233","2.081122","146.75.37.140","192.168.12.35","TLSv1.2","510","Application Data"
"234","2.081490","192.168.12.35","146.75.37.140","TCP","54","61013  >  443 [ACK] Seq=40506 Ack=105647 Win=1025 Len=0"
"235","2.081612","192.168.12.35","146.75.37.140","TCP","54","61013  >  443 [ACK] Seq=40506 Ack=106103 Win=1023 Len=0"
"236","2.084936","192.168.12.35","146.75.37.140","TLSv1.2","3145","Application Data"
"237","2.086130","146.75.37.140","192.168.12.35","TLSv1.2","100","Application Data"
"238","2.086130","146.75.37.140","192.168.12.35","TCP","1430","443  >  61013 [ACK] Seq=106149 Ack=30938 Win=8244 Len=1376 [TCP PDU reassembled in 239]"
"239","2.086130","146.75.37.140","192.168.12.35","TLSv1.2","832","Application Data"
"240","2.086130","146.75.37.140","192.168.12.35","TLSv1.2","100","Application Data"
"241","2.086130","146.75.37.140","192.168.12.35","TCP","54","443  >  61013 [ACK] Seq=108349 Ack=32334 Win=8244 Len=0"
"242","2.086854","192.168.12.35","146.75.37.140","TCP","54","61013  >  443 [ACK] Seq=43597 Ack=107525 Win=1025 Len=0"
"243","2.087153","192.168.12.35","146.75.37.140","TCP","54","61013  >  443 [ACK] Seq=43597 Ack=108349 Win=1021 Len=0"
"244","2.104987","146.75.37.140","192.168.12.35","TCP","54","443  >  61013 [ACK] Seq=108349 Ack=33730 Win=8244 Len=0"
"245","2.110629","146.75.37.140","192.168.12.35","TCP","54","443  >  61013 [ACK] Seq=108349 Ack=34071 Win=8244 Len=0"
"246","2.142148","146.75.37.140","192.168.12.35","TLSv1.2","947","Application Data"
"247","2.142148","146.75.37.140","192.168.12.35","TCP","54","443  >  61013 [ACK] Seq=109242 Ack=35467 Win=8244 Len=0"
"248","2.142148","146.75.37.140","192.168.12.35","TLSv1.2","95","Application Data"
"249","2.142148","146.75.37.140","192.168.12.35","TCP","1430","443  >  61013 [ACK] Seq=109283 Ack=35467 Win=8244 Len=1376 [TCP PDU reassembled in 250]"
"250","2.142148","146.75.37.140","192.168.12.35","TLSv1.2","481","Application Data"
"251","2.142148","146.75.37.140","192.168.12.35","TLSv1.2","100","Application Data"
"252","2.142148","146.75.37.140","192.168.12.35","TCP","54","443  >  61013 [ACK] Seq=111132 Ack=37305 Win=8244 Len=0"
"253","2.142972","192.168.12.35","146.75.37.140","TCP","54","61013  >  443 [ACK] Seq=43597 Ack=109283 Win=1025 Len=0"
"254","2.143309","192.168.12.35","146.75.37.140","TCP","54","61013  >  443 [ACK] Seq=43597 Ack=111086 Win=1025 Len=0"
"255","2.148058","146.75.37.140","192.168.12.35","TLSv1.2","996","Application Data"
"256","2.149321","192.168.12.35","146.75.37.140","TCP","54","61013  >  443 [ACK] Seq=43597 Ack=112074 Win=1021 Len=0"
"257","2.158828","146.75.37.140","192.168.12.35","TCP","54","443  >  61034 [ACK] Seq=1 Ack=165 Win=424 Len=0"
"258","2.158828","146.75.37.140","192.168.12.35","TLSv1.2","123","Application Data"
"259","2.158828","146.75.37.140","192.168.12.35","TCP","54","443  >  61034 [ACK] Seq=1 Ack=204 Win=424 Len=0"
"260","2.158828","146.75.37.140","192.168.12.35","TLSv1.2","93","Application Data"
"261","2.158828","146.75.37.140","192.168.12.35","TLSv1.2","183","Application Data"
"262","2.159472","192.168.12.35","146.75.37.140","TCP","54","61034  >  443 [ACK] Seq=204 Ack=169 Win=8197 Len=0"
"263","2.161289","146.75.37.140","192.168.12.35","TCP","1430","443  >  61034 [ACK] Seq=169 Ack=204 Win=424 Len=1376 [TCP PDU reassembled in 274]"
"264","2.161289","146.75.37.140","192.168.12.35","TCP","1430","443  >  61034 [ACK] Seq=1545 Ack=204 Win=424 Len=1376 [TCP PDU reassembled in 274]"
"265","2.161289","146.75.37.140","192.168.12.35","TCP","1430","443  >  61034 [ACK] Seq=2921 Ack=204 Win=424 Len=1376 [TCP PDU reassembled in 274]"
"266","2.161289","146.75.37.140","192.168.12.35","TCP","1430","443  >  61034 [ACK] Seq=4297 Ack=204 Win=424 Len=1376 [TCP PDU reassembled in 274]"
"267","2.161289","146.75.37.140","192.168.12.35","TCP","1430","443  >  61034 [ACK] Seq=5673 Ack=204 Win=424 Len=1376 [TCP PDU reassembled in 274]"
"268","2.161289","146.75.37.140","192.168.12.35","TCP","1430","443  >  61034 [ACK] Seq=7049 Ack=204 Win=424 Len=1376 [TCP PDU reassembled in 274]"
"269","2.161289","146.75.37.140","192.168.12.35","TCP","1430","443  >  61034 [ACK] Seq=8425 Ack=204 Win=424 Len=1376 [TCP PDU reassembled in 274]"
"270","2.161289","146.75.37.140","192.168.12.35","TCP","1430","443  >  61034 [ACK] Seq=9801 Ack=204 Win=424 Len=1376 [TCP PDU reassembled in 274]"
"271","2.161289","146.75.37.140","192.168.12.35","TCP","1430","443  >  61034 [ACK] Seq=11177 Ack=204 Win=424 Len=1376 [TCP PDU reassembled in 274]"
"272","2.161289","146.75.37.140","192.168.12.35","TCP","1430","443  >  61034 [ACK] Seq=12553 Ack=204 Win=424 Len=1376 [TCP PDU reassembled in 274]"
"273","2.161289","146.75.37.140","192.168.12.35","TCP","1430","443  >  61034 [ACK] Seq=13929 Ack=204 Win=424 Len=1376 [TCP PDU reassembled in 274]"
"274","2.161289","146.75.37.140","192.168.12.35","TLSv1.2","1430","Application Data"
"275","2.161289","146.75.37.140","192.168.12.35","TCP","1430","443  >  61034 [ACK] Seq=16681 Ack=204 Win=424 Len=1376 [TCP PDU reassembled in 287]"
"276","2.161289","146.75.37.140","192.168.12.35","TCP","1430","443  >  61034 [ACK] Seq=18057 Ack=204 Win=424 Len=1376 [TCP PDU reassembled in 287]"
"277","2.161289","146.75.37.140","192.168.12.35","TCP","1430","443  >  61034 [ACK] Seq=19433 Ack=204 Win=424 Len=1376 [TCP PDU reassembled in 287]"
"278","2.161289","146.75.37.140","192.168.12.35","TCP","1430","443  >  61034 [ACK] Seq=20809 Ack=204 Win=424 Len=1376 [TCP PDU reassembled in 287]"
"279","2.161289","146.75.37.140","192.168.12.35","TCP","1430","443  >  61034 [ACK] Seq=22185 Ack=204 Win=424 Len=1376 [TCP PDU reassembled in 287]"
"280","2.161289","146.75.37.140","192.168.12.35","TCP","1430","443  >  61034 [ACK] Seq=23561 Ack=204 Win=424 Len=1376 [TCP PDU reassembled in 287]"
"281","2.161289","146.75.37.140","192.168.12.35","TCP","1430","443  >  61034 [ACK] Seq=24937 Ack=204 Win=424 Len=1376 [TCP PDU reassembled in 287]"
"282","2.161289","146.75.37.140","192.168.12.35","TCP","1430","443  >  61034 [PSH, ACK] Seq=26313 Ack=204 Win=424 Len=1376 [TCP PDU reassembled in 287]"
"283","2.162144","192.168.12.35","146.75.37.140","TCP","54","61034  >  443 [ACK] Seq=204 Ack=27689 Win=8201 Len=0"
"284","2.168583","146.75.37.140","192.168.12.35","TCP","1430","443  >  61034 [ACK] Seq=27689 Ack=204 Win=424 Len=1376 [TCP PDU reassembled in 287]"
"285","2.168583","146.75.37.140","192.168.12.35","TCP","1430","443  >  61034 [ACK] Seq=29065 Ack=204 Win=424 Len=1376 [TCP PDU reassembled in 287]"
"286","2.168583","146.75.37.140","192.168.12.35","TCP","1430","443  >  61034 [ACK] Seq=30441 Ack=204 Win=424 Len=1376 [TCP PDU reassembled in 287]"
"287","2.168583","146.75.37.140","192.168.12.35","TLSv1.2","1430","Application Data"
"288","2.168583","146.75.37.140","192.168.12.35","TCP","1430","443  >  61034 [ACK] Seq=33193 Ack=204 Win=424 Len=1376 [TCP PDU reassembled in 299]"
"289","2.168583","146.75.37.140","192.168.12.35","TCP","1430","443  >  61034 [ACK] Seq=34569 Ack=204 Win=424 Len=1376 [TCP PDU reassembled in 299]"
"290","2.168583","146.75.37.140","192.168.12.35","TCP","1430","443  >  61034 [ACK] Seq=35945 Ack=204 Win=424 Len=1376 [TCP PDU reassembled in 299]"
"291","2.168583","146.75.37.140","192.168.12.35","TCP","1430","443  >  61034 [ACK] Seq=37321 Ack=204 Win=424 Len=1376 [TCP PDU reassembled in 299]"
"292","2.168583","146.75.37.140","192.168.12.35","TCP","1430","443  >  61034 [ACK] Seq=38697 Ack=204 Win=424 Len=1376 [TCP PDU reassembled in 299]"
"293","2.168583","146.75.37.140","192.168.12.35","TCP","1430","443  >  61034 [ACK] Seq=40073 Ack=204 Win=424 Len=1376 [TCP PDU reassembled in 299]"
"294","2.168583","146.75.37.140","192.168.12.35","TCP","1430","443  >  61034 [ACK] Seq=41449 Ack=204 Win=424 Len=1376 [TCP PDU reassembled in 299]"
"295","2.168583","146.75.37.140","192.168.12.35","TCP","1430","443  >  61034 [ACK] Seq=42825 Ack=204 Win=424 Len=1376 [TCP PDU reassembled in 299]"
"296","2.168583","146.75.37.140","192.168.12.35","TCP","1430","443  >  61034 [ACK] Seq=44201 Ack=204 Win=424 Len=1376 [TCP PDU reassembled in 299]"
"297","2.168583","146.75.37.140","192.168.12.35","TCP","1430","443  >  61034 [ACK] Seq=45577 Ack=204 Win=424 Len=1376 [TCP PDU reassembled in 299]"
"298","2.168583","146.75.37.140","192.168.12.35","TCP","1430","443  >  61034 [ACK] Seq=46953 Ack=204 Win=424 Len=1376 [TCP PDU reassembled in 299]"
"299","2.168583","146.75.37.140","192.168.12.35","TLSv1.2","1430","Application Data"
"300","2.168583","146.75.37.140","192.168.12.35","TLSv1.2","818","Application Data"
"301","2.168583","146.75.37.140","192.168.12.35","TLSv1.2","85","Application Data"
"302","2.169729","192.168.12.35","146.75.37.140","TCP","54","61034  >  443 [ACK] Seq=204 Ack=49705 Win=8201 Len=0"
"303","2.170216","192.168.12.35","146.75.37.140","TCP","54","61013  >  443 [ACK] Seq=43597 Ack=112174 Win=1020 Len=0"
"304","2.173265","192.168.12.35","146.75.37.140","TLSv1.2","89","Application Data"
"305","2.225528","146.75.37.140","192.168.12.35","TCP","1430","443  >  61013 [ACK] Seq=112174 Ack=37305 Win=8244 Len=1376 [TCP PDU reassembled in 306]"
"306","2.225528","146.75.37.140","192.168.12.35","TLSv1.2","828","Application Data"
"307","2.225528","146.75.37.140","192.168.12.35","TLSv1.2","100","Application Data"
"308","2.226265","192.168.12.35","146.75.37.140","TCP","54","61013  >  443 [ACK] Seq=43597 Ack=113550 Win=1025 Len=0"
"309","2.226594","192.168.12.35","146.75.37.140","TCP","54","61013  >  443 [ACK] Seq=43597 Ack=114324 Win=1022 Len=0"
"310","2.234759","146.75.37.140","192.168.12.35","TCP","1430","443  >  61013 [ACK] Seq=114370 Ack=37305 Win=8244 Len=1376 [TCP PDU reassembled in 311]"
"311","2.234759","146.75.37.140","192.168.12.35","TLSv1.2","112","Application Data"
"312","2.234759","146.75.37.140","192.168.12.35","TLSv1.2","892","Application Data"
"313","2.235582","192.168.12.35","146.75.37.140","TCP","54","61013  >  443 [ACK] Seq=43597 Ack=115746 Win=1025 Len=0"
"314","2.235971","192.168.12.35","146.75.37.140","TCP","54","61013  >  443 [ACK] Seq=43597 Ack=116642 Win=1021 Len=0"
"315","2.269092","146.75.37.140","192.168.12.35","TCP","54","443  >  61013 [ACK] Seq=116642 Ack=38701 Win=8244 Len=0"
"316","2.275849","146.75.37.140","192.168.12.35","TCP","54","443  >  61013 [ACK] Seq=116642 Ack=40097 Win=8244 Len=0"
"317","2.280170","146.75.37.140","192.168.12.35","TCP","54","443  >  61013 [ACK] Seq=116642 Ack=40426 Win=8244 Len=0"
"318","2.280170","146.75.37.140","192.168.12.35","TCP","54","443  >  61013 [ACK] Seq=116642 Ack=40506 Win=8244 Len=0"
"319","2.304612","146.75.37.140","192.168.12.35","TCP","54","443  >  61013 [ACK] Seq=116642 Ack=41902 Win=8244 Len=0"
"320","2.316121","146.75.37.140","192.168.12.35","TCP","54","443  >  61013 [ACK] Seq=116642 Ack=43597 Win=8244 Len=0"
"321","2.320945","146.75.37.140","192.168.12.35","TCP","1430","443  >  61013 [ACK] Seq=116642 Ack=43597 Win=8244 Len=1376 [TCP PDU reassembled in 323]"
"322","2.320945","146.75.37.140","192.168.12.35","TCP","1430","443  >  61013 [PSH, ACK] Seq=118018 Ack=43597 Win=8244 Len=1376 [TCP PDU reassembled in 323]"
"323","2.320945","146.75.37.140","192.168.12.35","TLSv1.2","92","Application Data"
"324","2.321264","192.168.12.35","146.75.37.140","TCP","54","61013  >  443 [ACK] Seq=43597 Ack=119394 Win=1025 Len=0"
"325","2.328696","146.75.37.140","192.168.12.35","TCP","54","443  >  61034 [ACK] Seq=50469 Ack=239 Win=424 Len=0"
"326","2.343671","146.75.37.140","192.168.12.35","TCP","1430","443  >  61013 [ACK] Seq=119432 Ack=43597 Win=8244 Len=1376 [TCP PDU reassembled in 327]"
"327","2.343671","146.75.37.140","192.168.12.35","TLSv1.2","833","Application Data"
"328","2.343671","146.75.37.140","192.168.12.35","TLSv1.2","87","Application Data"
"329","2.344436","192.168.12.35","146.75.37.140","TCP","54","61013  >  443 [ACK] Seq=43597 Ack=120808 Win=1025 Len=0"
"330","2.344854","192.168.12.35","146.75.37.140","TCP","54","61013  >  443 [ACK] Seq=43597 Ack=121620 Win=1022 Len=0"
"331","3.182580","146.75.37.140","192.168.12.35","TLSv1.2","251","Application Data"
"332","3.191011","146.75.37.140","192.168.12.35","TLSv1.2","173","Application Data"
"333","3.191687","192.168.12.35","146.75.37.140","TCP","54","61013  >  443 [ACK] Seq=43597 Ack=121936 Win=1020 Len=0"
"334","3.202670","146.75.37.140","192.168.12.35","TLSv1.2","1053","Application Data"
"335","3.202670","146.75.37.140","192.168.12.35","TLSv1.2","847","Application Data"
"336","3.203268","192.168.12.35","146.75.37.140","TCP","54","61013  >  443 [ACK] Seq=43597 Ack=123728 Win=1025 Len=0"
"337","3.210485","146.75.37.140","192.168.12.35","TLSv1.2","1067","Application Data"
"338","3.210485","146.75.37.140","192.168.12.35","TLSv1.2","338","Application Data"
"339","3.210485","146.75.37.140","192.168.12.35","TLSv1.2","566","Application Data"
"340","3.210485","146.75.37.140","192.168.12.35","TLSv1.2","496","Application Data"
"341","3.210485","146.75.37.140","192.168.12.35","TLSv1.2","667","Application Data"
"342","3.211091","192.168.12.35","146.75.37.140","TCP","54","61013  >  443 [ACK] Seq=43597 Ack=125025 Win=1020 Len=0"
"343","3.211545","192.168.12.35","146.75.37.140","TCP","54","61013  >  443 [ACK] Seq=43597 Ack=125979 Win=1025 Len=0"
"344","3.221636","146.75.37.140","192.168.12.35","TLSv1.2","1047","Application Data"
"345","3.221636","146.75.37.140","192.168.12.35","TLSv1.2","739","Application Data"
"346","3.221636","146.75.37.140","192.168.12.35","TLSv1.2","1028","Application Data"
"347","3.221636","146.75.37.140","192.168.12.35","TLSv1.2","504","Application Data"
"348","3.221636","146.75.37.140","192.168.12.35","TLSv1.2","1070","Application Data"
"349","3.222286","192.168.12.35","146.75.37.140","TCP","54","61013  >  443 [ACK] Seq=43597 Ack=127585 Win=1025 Len=0"
"350","3.222563","192.168.12.35","146.75.37.140","TCP","54","61013  >  443 [ACK] Seq=43597 Ack=129244 Win=1025 Len=0"
"351","3.222798","192.168.12.35","146.75.37.140","TCP","54","61013  >  443 [ACK] Seq=43597 Ack=130710 Win=1025 Len=0"
"352","3.237015","146.75.37.140","192.168.12.35","TLSv1.2","156","Application Data"
"353","3.237015","146.75.37.140","192.168.12.35","TLSv1.2","317","Application Data"
