"No.","Time","Source","Destination","Protocol","Length","Info"
"1","0.000000","192.168.12.35","146.75.37.140","TLSv1.2","3359","Application Data"
"2","0.000109","192.168.12.35","146.75.37.140","TLSv1.2","93","Application Data"
"3","0.000132","192.168.12.35","146.75.37.140","TLSv1.2","753","Application Data"
"4","0.000197","192.168.12.35","146.75.37.140","TLSv1.2","3377","Application Data"
"5","0.048382","146.75.37.140","192.168.12.35","TCP","54","443  >  61013 [ACK] Seq=1 Ack=1397 Win=7547 Len=0"
"6","0.058613","146.75.37.140","192.168.12.35","TCP","54","443  >  61013 [ACK] Seq=1 Ack=2793 Win=7552 Len=0"
"7","0.075058","146.75.37.140","192.168.12.35","TCP","54","443  >  61013 [ACK] Seq=1 Ack=3306 Win=7552 Len=0"
"8","0.075058","146.75.37.140","192.168.12.35","TCP","54","443  >  61013 [ACK] Seq=1 Ack=3345 Win=7552 Len=0"
"9","0.075058","146.75.37.140","192.168.12.35","TLSv1.2","93","Application Data"
"10","0.086896","146.75.37.140","192.168.12.35","TCP","54","443  >  61013 [ACK] Seq=40 Ack=4044 Win=7552 Len=0"
"11","0.106945","146.75.37.140","192.168.12.35","TCP","54","443  >  61013 [ACK] Seq=40 Ack=5440 Win=7558 Len=0"
"12","0.117215","146.75.37.140","192.168.12.35","TCP","54","443  >  61013 [ACK] Seq=40 Ack=6836 Win=7563 Len=0"
"13","0.126774","192.168.12.35","146.75.37.140","TCP","54","61013  >  443 [ACK] Seq=7367 Ack=40 Win=1024 Len=0"
"14","0.127854","146.75.37.140","192.168.12.35","TCP","54","443  >  61013 [ACK] Seq=40 Ack=7367 Win=7563 Len=0"
"15","0.143669","146.75.37.140","192.168.12.35","TCP","1430","443  >  61013 [ACK] Seq=40 Ack=7367 Win=7563 Len=1376 [TCP PDU reassembled in 16]"
"16","0.143669","146.75.37.140","192.168.12.35","TLSv1.2","505","Application Data"
"17","0.143813","192.168.12.35","146.75.37.140","TCP","54","61013  >  443 [ACK] Seq=7367 Ack=1867 Win=1025 Len=0"
"18","0.145150","192.168.12.35","146.75.37.140","TLSv1.2","89","Application Data"
"19","0.159950","146.75.37.140","192.168.12.35","TCP","1430","443  >  61013 [ACK] Seq=1867 Ack=7367 Win=7563 Len=1376 [TCP PDU reassembled in 20]"
"20","0.159950","146.75.37.140","192.168.12.35","TLSv1.2","769","Application Data"
"21","0.160171","192.168.12.35","146.75.37.140","TCP","54","61013  >  443 [ACK] Seq=7402 Ack=3958 Win=1025 Len=0"
"22","0.172169","146.75.37.140","192.168.12.35","TCP","54","443  >  61013 [ACK] Seq=3958 Ack=7402 Win=7563 Len=0"
"23","0.209026","192.168.12.35","146.75.37.140","TLSv1.2","3234","Application Data"
"24","0.209078","192.168.12.35","146.75.37.140","TLSv1.2","3358","Application Data"
"25","0.209100","192.168.12.35","146.75.37.140","TLSv1.2","2220","Application Data"
"26","0.257346","146.75.37.140","192.168.12.35","TCP","54","443  >  61013 [ACK] Seq=3958 Ack=8798 Win=7568 Len=0"
"27","0.277133","146.75.37.140","192.168.12.35","TCP","54","443  >  61013 [ACK] Seq=3958 Ack=10194 Win=7574 Len=0"
"28","0.282223","146.75.37.140","192.168.12.35","TCP","54","443  >  61013 [ACK] Seq=3958 Ack=10582 Win=7574 Len=0"
"29","0.297371","146.75.37.140","192.168.12.35","TCP","54","443  >  61013 [ACK] Seq=3958 Ack=11978 Win=7579 Len=0"
"30","0.318276","146.75.37.140","192.168.12.35","TCP","1430","443  >  61013 [ACK] Seq=3958 Ack=11978 Win=7579 Len=1376 [TCP PDU reassembled in 31]"
"31","0.318276","146.75.37.140","192.168.12.35","TLSv1.2","593","Application Data"
"32","0.318276","146.75.37.140","192.168.12.35","TCP","1430","443  >  61013 [ACK] Seq=5873 Ack=11978 Win=7579 Len=1376 [TCP PDU reassembled in 33]"
"33","0.318276","146.75.37.140","192.168.12.35","TLSv1.2","1073","Application Data"
"34","0.318276","146.75.37.140","192.168.12.35","TCP","54","443  >  61013 [ACK] Seq=8268 Ack=13374 Win=7585 Len=0"
"35","0.318276","146.75.37.140","192.168.12.35","TCP","54","443  >  61013 [ACK] Seq=8268 Ack=13886 Win=7585 Len=0"
"36","0.318776","192.168.12.35","146.75.37.140","TCP","54","61013  >  443 [ACK] Seq=16052 Ack=5873 Win=1025 Len=0"
"37","0.318915","192.168.12.35","146.75.37.140","TCP","54","61013  >  443 [ACK] Seq=16052 Ack=8268 Win=1025 Len=0"
"38","0.322327","146.75.37.140","192.168.12.35","TCP","1430","443  >  61013 [ACK] Seq=8268 Ack=13886 Win=7585 Len=1376 [TCP PDU reassembled in 48]"
"39","0.322327","146.75.37.140","192.168.12.35","TCP","1430","443  >  61013 [PSH, ACK] Seq=9644 Ack=13886 Win=7585 Len=1376 [TCP PDU reassembled in 48]"
"40","0.322327","146.75.37.140","192.168.12.35","TCP","1430","443  >  61013 [ACK] Seq=11020 Ack=13886 Win=7585 Len=1376 [TCP PDU reassembled in 48]"
"41","0.322327","146.75.37.140","192.168.12.35","TCP","1430","443  >  61013 [PSH, ACK] Seq=12396 Ack=13886 Win=7585 Len=1376 [TCP PDU reassembled in 48]"
"42","0.322327","146.75.37.140","192.168.12.35","TCP","1430","443  >  61013 [ACK] Seq=13772 Ack=13886 Win=7585 Len=1376 [TCP PDU reassembled in 48]"
"43","0.322327","146.75.37.140","192.168.12.35","TCP","1430","443  >  61013 [PSH, ACK] Seq=15148 Ack=13886 Win=7585 Len=1376 [TCP PDU reassembled in 48]"
"44","0.322327","146.75.37.140","192.168.12.35","TCP","1430","443  >  61013 [ACK] Seq=16524 Ack=13886 Win=7585 Len=1376 [TCP PDU reassembled in 48]"
"45","0.322327","146.75.37.140","192.168.12.35","TCP","1430","443  >  61013 [PSH, ACK] Seq=17900 Ack=13886 Win=7585 Len=1376 [TCP PDU reassembled in 48]"
"46","0.322327","146.75.37.140","192.168.12.35","TCP","1430","443  >  61013 [ACK] Seq=19276 Ack=13886 Win=7585 Len=1376 [TCP PDU reassembled in 48]"
"47","0.322327","146.75.37.140","192.168.12.35","TCP","1430","443  >  61013 [PSH, ACK] Seq=20652 Ack=13886 Win=7585 Len=1376 [TCP PDU reassembled in 48]"
"48","0.322327","146.75.37.140","192.168.12.35","TLSv1.2","1164","Application Data, Application Data"
"49","0.322327","146.75.37.140","192.168.12.35","TCP","1430","443  >  61013 [ACK] Seq=23138 Ack=13886 Win=7585 Len=1376 [TCP PDU reassembled in 62]"
"50","0.322327","146.75.37.140","192.168.12.35","TCP","1430","443  >  61013 [PSH, ACK] Seq=24514 Ack=13886 Win=7585 Len=1376 [TCP PDU reassembled in 62]"
"51","0.322677","192.168.12.35","146.75.37.140","TCP","54","61013  >  443 [ACK] Seq=16052 Ack=22028 Win=1025 Len=0"
"52","0.322795","192.168.12.35","146.75.37.140","TCP","54","61013  >  443 [ACK] Seq=16052 Ack=25890 Win=1025 Len=0"
"53","0.328921","146.75.37.140","192.168.12.35","TCP","1430","443  >  61013 [ACK] Seq=25890 Ack=13886 Win=7585 Len=1376 [TCP PDU reassembled in 62]"
"54","0.328921","146.75.37.140","192.168.12.35","TCP","1430","443  >  61013 [PSH, ACK] Seq=27266 Ack=13886 Win=7585 Len=1376 [TCP PDU reassembled in 62]"
"55","0.328921","146.75.37.140","192.168.12.35","TCP","1430","443  >  61013 [ACK] Seq=28642 Ack=13886 Win=7585 Len=1376 [TCP PDU reassembled in 62]"
"56","0.328921","146.75.37.140","192.168.12.35","TCP","1430","443  >  61013 [PSH, ACK] Seq=30018 Ack=13886 Win=7585 Len=1376 [TCP PDU reassembled in 62]"
"57","0.328921","146.75.37.140","192.168.12.35","TCP","1430","443  >  61013 [ACK] Seq=31394 Ack=13886 Win=7585 Len=1376 [TCP PDU reassembled in 62]"
"58","0.328921","146.75.37.140","192.168.12.35","TCP","1430","443  >  61013 [PSH, ACK] Seq=32770 Ack=13886 Win=7585 Len=1376 [TCP PDU reassembled in 62]"
"59","0.328921","146.75.37.140","192.168.12.35","TCP","1430","443  >  61013 [ACK] Seq=34146 Ack=13886 Win=7585 Len=1376 [TCP PDU reassembled in 62]"
"60","0.328921","146.75.37.140","192.168.12.35","TCP","1430","443  >  61013 [PSH, ACK] Seq=35522 Ack=13886 Win=7585 Len=1376 [TCP PDU reassembled in 62]"
"61","0.328921","146.75.37.140","192.168.12.35","TCP","1430","443  >  61013 [ACK] Seq=36898 Ack=13886 Win=7585 Len=1376 [TCP PDU reassembled in 62]"
"62","0.328921","146.75.37.140","192.168.12.35","TLSv1.2","1430","Application Data"
"63","0.329150","192.168.12.35","146.75.37.140","TCP","54","61013  >  443 [ACK] Seq=16052 Ack=39650 Win=1025 Len=0"
"64","0.335094","146.75.37.140","192.168.12.35","TCP","1430","443  >  61013 [ACK] Seq=39650 Ack=13886 Win=7585 Len=1376 [TCP PDU reassembled in 76]"
"65","0.335094","146.75.37.140","192.168.12.35","TCP","1430","443  >  61013 [PSH, ACK] Seq=41026 Ack=13886 Win=7585 Len=1376 [TCP PDU reassembled in 76]"
"66","0.335094","146.75.37.140","192.168.12.35","TCP","1430","443  >  61013 [ACK] Seq=42402 Ack=13886 Win=7585 Len=1376 [TCP PDU reassembled in 76]"
"67","0.335094","146.75.37.140","192.168.12.35","TCP","1430","443  >  61013 [PSH, ACK] Seq=43778 Ack=13886 Win=7585 Len=1376 [TCP PDU reassembled in 76]"
"68","0.335094","146.75.37.140","192.168.12.35","TCP","1430","443  >  61013 [ACK] Seq=45154 Ack=13886 Win=7585 Len=1376 [TCP PDU reassembled in 76]"
"69","0.335094","146.75.37.140","192.168.12.35","TCP","1430","443  >  61013 [PSH, ACK] Seq=46530 Ack=13886 Win=7585 Len=1376 [TCP PDU reassembled in 76]"
"70","0.335094","146.75.37.140","192.168.12.35","TCP","1430","443  >  61013 [ACK] Seq=47906 Ack=13886 Win=7585 Len=1376 [TCP PDU reassembled in 76]"
"71","0.335094","146.75.37.140","192.168.12.35","TCP","1430","443  >  61013 [PSH, ACK] Seq=49282 Ack=13886 Win=7585 Len=1376 [TCP PDU reassembled in 76]"
"72","0.335094","146.75.37.140","192.168.12.35","TCP","1430","443  >  61013 [ACK] Seq=50658 Ack=13886 Win=7585 Len=1376 [TCP PDU reassembled in 76]"
"73","0.335094","146.75.37.140","192.168.12.35","TCP","1430","443  >  61013 [PSH, ACK] Seq=52034 Ack=13886 Win=7585 Len=1376 [TCP PDU reassembled in 76]"
"74","0.335794","192.168.12.35","146.75.37.140","TCP","54","61013  >  443 [ACK] Seq=16052 Ack=53410 Win=1025 Len=0"
"75","0.341024","146.75.37.140","192.168.12.35","TCP","1430","443  >  61013 [ACK] Seq=53410 Ack=15282 Win=7590 Len=1376 [TCP PDU reassembled in 76]"
"76","0.341024","146.75.37.140","192.168.12.35","TLSv1.2","1430","Application Data"
"77","0.341024","146.75.37.140","192.168.12.35","TCP","1430","443  >  61013 [ACK] Seq=56162 Ack=15282 Win=7590 Len=1376 [TCP PDU reassembled in 79]"
"78","0.341024","146.75.37.140","192.168.12.35","TCP","1430","443  >  61013 [PSH, ACK] Seq=57538 Ack=15282 Win=7590 Len=1376 [TCP PDU reassembled in 79]"
"79","0.341024","146.75.37.140","192.168.12.35","TLSv1.2","1430","Application Data"
"80","0.341024","146.75.37.140","192.168.12.35","TCP","1430","443  >  61013 [PSH, ACK] Seq=60290 Ack=15282 Win=7590 Len=1376 [TCP PDU reassembled in 81]"
"81","0.341024","146.75.37.140","192.168.12.35","TLSv1.2","1430","Application Data, Application Data"
"82","0.341024","146.75.37.140","192.168.12.35","TLSv1.2","326","Application Data, Application Data"
"83","0.341024","146.75.37.140","192.168.12.35","TLSv1.2","232","Application Data"
"84","0.341623","192.168.12.35","146.75.37.140","TCP","54","61013  >  443 [ACK] Seq=16052 Ack=63042 Win=1025 Len=0"
"85","0.341880","192.168.12.35","146.75.37.140","TCP","54","61013  >  443 [ACK] Seq=16052 Ack=63492 Win=1023 Len=0"
"86","0.348597","146.75.37.140","192.168.12.35","TCP","54","443  >  61013 [ACK] Seq=63492 Ack=16052 Win=7590 Len=0"
"87","0.348597","146.75.37.140","192.168.12.35","TLSv1.2","582","Application Data"
"88","0.352937","146.75.37.140","192.168.12.35","TCP","1430","443  >  61013 [ACK] Seq=64020 Ack=16052 Win=7590 Len=1376 [TCP PDU reassembled in 89]"
"89","0.352937","146.75.37.140","192.168.12.35","TLSv1.2","311","Application Data"
"90","0.352937","146.75.37.140","192.168.12.35","TLSv1.2","769","Application Data"
"91","0.352937","146.75.37.140","192.168.12.35","TLSv1.2","97","Application Data"
"92","0.353345","192.168.12.35","146.75.37.140","TCP","54","61013  >  443 [ACK] Seq=16052 Ack=65396 Win=1025 Len=0"
"93","0.353586","192.168.12.35","146.75.37.140","TCP","54","61013  >  443 [ACK] Seq=16052 Ack=66368 Win=1021 Len=0"
"94","0.358888","146.75.37.140","192.168.12.35","TLSv1.2","213","Application Data"
"95","0.358888","146.75.37.140","192.168.12.35","TLSv1.2","476","Application Data"
"96","0.358888","146.75.37.140","192.168.12.35","TLSv1.2","128","Application Data"
"97","0.358888","146.75.37.140","192.168.12.35","TLSv1.2","113","Application Data"
"98","0.358888","146.75.37.140","192.168.12.35","TLSv1.2","137","Application Data"
"99","0.358888","146.75.37.140","192.168.12.35","TLSv1.2","103","Application Data"
"100","0.358888","146.75.37.140","192.168.12.35","TLSv1.2","690","Application Data"
"101","0.358888","146.75.37.140","192.168.12.35","TLSv1.2","174","Application Data"
"102","0.358888","146.75.37.140","192.168.12.35","TLSv1.2","1275","Application Data"
"103","0.358888","146.75.37.140","192.168.12.35","TLSv1.2","138","Application Data"
"104","0.358888","146.75.37.140","192.168.12.35","TLSv1.2","405","Application Data"
"105","0.358888","146.75.37.140","192.168.12.35","TLSv1.2","242","Application Data"
"106","0.358888","146.75.37.140","192.168.12.35","TLSv1.2","308","Application Data"
"107","0.358888","146.75.37.140","192.168.12.35","TLSv1.2","764","Application Data"
"108","0.359489","192.168.12.35","146.75.37.140","TCP","54","61013  >  443 [ACK] Seq=16052 Ack=66570 Win=1020 Len=0"
"109","0.359588","192.168.12.35","146.75.37.140","TCP","54","61013  >  443 [ACK] Seq=16052 Ack=67066 Win=1025 Len=0"
"110","0.359615","192.168.12.35","146.75.37.140","TCP","54","61013  >  443 [ACK] Seq=16052 Ack=67208 Win=1024 Len=0"
"111","0.359643","192.168.12.35","146.75.37.140","TCP","54","61013  >  443 [ACK] Seq=16052 Ack=67893 Win=1021 Len=0"
"112","0.359688","192.168.12.35","146.75.37.140","TCP","54","61013  >  443 [ACK] Seq=16052 Ack=69234 Win=1025 Len=0"
"113","0.359761","192.168.12.35","146.75.37.140","TCP","54","61013  >  443 [ACK] Seq=16052 Ack=69669 Win=1023 Len=0"
"114","0.359818","192.168.12.35","146.75.37.140","TCP","54","61013  >  443 [ACK] Seq=16052 Ack=70111 Win=1021 Len=0"
"115","0.366005","146.75.37.140","192.168.12.35","TLSv1.2","604","Application Data"
"116","0.366005","146.75.37.140","192.168.12.35","TLSv1.2","108","Application Data"
"117","0.366312","192.168.12.35","146.75.37.140","TCP","54","61013  >  443 [ACK] Seq=16052 Ack=71371 Win=1025 Len=0"
"118","0.379014","192.168.12.35","146.75.37.140","QUIC","1292","Initial, DCID=7698d241b3b2309c, PKN: 1, PADDING, CRYPTO, CRYPTO, CRYPTO, CRYPTO, CRYPTO, PADDING, CRYPTO, PING, CRYPTO, PADDING, CRYPTO, PING, CRYPTO, PING, PADDING, CRYPTO, PADDING"
"119","0.379108","192.168.12.35","146.75.37.140","QUIC","1292","Initial, DCID=7698d241b3b2309c, PKN: 2, PING, PING, CRYPTO, CRYPTO, PING, PING, PING, PING, CRYPTO, CRYPTO, CRYPTO, CRYPTO, CRYPTO, PADDING, CRYPTO, PING, PING, PADDING, PING, PADDING, CRYPTO, PING, CRYPTO"
"120","0.395983","146.75.37.140","192.168.12.35","TCP","1430","443  >  61013 [ACK] Seq=71425 Ack=16052 Win=7590 Len=1376 [TCP PDU reassembled in 121]"
"121","0.395983","146.75.37.140","192.168.12.35","TLSv1.2","821","Application Data"
"122","0.396275","192.168.12.35","146.75.37.140","TCP","54","61013  >  443 [ACK] Seq=16052 Ack=72801 Win=1025 Len=0"
"123","0.424710","146.75.37.140","192.168.12.35","QUIC","1322","Initial, SCID=958107b06b5f5be4a54f53c3e28cd8110c, PKN: 0, ACK, PADDING"
"124","0.445015","146.75.37.140","192.168.12.35","QUIC","1322","Initial, SCID=958107b06b5f5be4a54f53c3e28cd8110c, PKN: 1, ACK, CRYPTO, PADDING"
"125","0.445015","146.75.37.140","192.168.12.35","QUIC","620","Protected Payload (KP0)"
"126","0.446427","192.168.12.35","146.75.37.140","QUIC","233","Protected Payload (KP0), DCID=958107b06b5f5be4a54f53c3e28cd8110c"
"127","0.451289","192.168.12.35","146.75.37.140","TCP","54","61013  >  443 [ACK] Seq=16052 Ack=73568 Win=1022 Len=0"
"128","0.479604","146.75.37.140","192.168.12.35","QUIC","67","Protected Payload (KP0)"
"129","0.514702","192.168.12.35","146.75.37.140","QUIC","83","Protected Payload (KP0), DCID=958107b06b5f5be4a54f53c3e28cd8110c"
"130","0.842735","146.75.37.140","192.168.12.35","TLSv1.2","564","Application Data"
"131","0.842735","146.75.37.140","192.168.12.35","TLSv1.2","133","Application Data"
"132","0.843514","192.168.12.35","146.75.37.140","TCP","54","61013  >  443 [ACK] Seq=16052 Ack=74157 Win=1019 Len=0"
"133","0.853963","146.75.37.140","192.168.12.35","TCP","1430","443  >  61013 [ACK] Seq=74157 Ack=16052 Win=7590 Len=1376 [TCP PDU reassembled in 134]"
"134","0.853963","146.75.37.140","192.168.12.35","TLSv1.2","135","Application Data"
"135","0.853963","146.75.37.140","192.168.12.35","TLSv1.2","629","Application Data"
"136","0.853963","146.75.37.140","192.168.12.35","TLSv1.2","185","Application Data"
"137","0.853963","146.75.37.140","192.168.12.35","TLSv1.2","932","Application Data"
"138","0.853963","146.75.37.140","192.168.12.35","TLSv1.2","751","Application Data"
"139","0.853963","146.75.37.140","192.168.12.35","TLSv1.2","464","Application Data"
"140","0.853963","146.75.37.140","192.168.12.35","TLSv1.2","543","Application Data"
"141","0.853963","146.75.37.140","192.168.12.35","TLSv1.2","693","Application Data"
"142","0.853963","146.75.37.140","192.168.12.35","TLSv1.2","1110","Application Data"
"143","0.853963","146.75.37.140","192.168.12.35","TLSv1.2","300","Application Data"
"144","0.853963","146.75.37.140","192.168.12.35","TLSv1.2","960","Application Data"
"145","0.853963","146.75.37.140","192.168.12.35","TLSv1.2","699","Application Data"
"146","0.853963","146.75.37.140","192.168.12.35","TLSv1.2","186","Application Data"
"147","0.853963","146.75.37.140","192.168.12.35","TLSv1.2","257","Application Data"
"148","0.853963","146.75.37.140","192.168.12.35","TLSv1.2","315","Application Data"
"149","0.853963","146.75.37.140","192.168.12.35","TLSv1.2","169","Application Data"
"150","0.853963","146.75.37.140","192.168.12.35","TLSv1.2","348","Application Data"
"151","0.854353","192.168.12.35","146.75.37.140","TCP","54","61013  >  443 [ACK] Seq=16052 Ack=75614 Win=1025 Len=0"
"152","0.854423","192.168.12.35","146.75.37.140","TCP","54","61013  >  443 [ACK] Seq=16052 Ack=76320 Win=1022 Len=0"
"153","0.854456","192.168.12.35","146.75.37.140","TCP","54","61013  >  443 [ACK] Seq=16052 Ack=77895 Win=1025 Len=0"
"154","0.854480","192.168.12.35","146.75.37.140","TCP","54","61013  >  443 [ACK] Seq=16052 Ack=78794 Win=1021 Len=0"
"155","0.854561","192.168.12.35","146.75.37.140","TCP","54","61013  >  443 [ACK] Seq=16052 Ack=80489 Win=1025 Len=0"
"156","0.854698","192.168.12.35","146.75.37.140","TCP","54","61013  >  443 [ACK] Seq=16052 Ack=81641 Win=1020 Len=0"
"157","0.854794","192.168.12.35","146.75.37.140","TCP","54","61013  >  443 [ACK] Seq=16052 Ack=82418 Win=1025 Len=0"
"158","0.854895","192.168.12.35","146.75.37.140","TCP","54","61013  >  443 [ACK] Seq=16052 Ack=82882 Win=1023 Len=0"
"159","0.854989","192.168.12.35","146.75.37.140","TCP","54","61013  >  443 [ACK] Seq=16052 Ack=83291 Win=1021 Len=0"
"160","0.891853","192.168.12.35","146.75.37.140","TLSv1.2","219","Application Data"
"161","0.891905","192.168.12.35","146.75.37.140","TLSv1.2","93","Application Data"
"162","0.891926","192.168.12.35","146.75.37.140","TLSv1.2","212","Application Data"
"163","0.924336","146.75.37.140","192.168.12.35","TCP","54","443  >  61034 [ACK] Seq=1 Ack=166 Win=424 Len=0"
"164","0.924336","146.75.37.140","192.168.12.35","TCP","54","443  >  61034 [ACK] Seq=1 Ack=205 Win=424 Len=0"
"165","0.924336","146.75.37.140","192.168.12.35","TCP","54","443  >  61034 [ACK] Seq=1 Ack=363 Win=424 Len=0"
"166","0.924336","146.75.37.140","192.168.12.35","TLSv1.2","93","Application Data"
"167","0.924336","146.75.37.140","192.168.12.35","TCP","1430","443  >  61034 [ACK] Seq=40 Ack=363 Win=424 Len=1376 [TCP PDU reassembled in 178]"
"168","0.924336","146.75.37.140","192.168.12.35","TCP","1430","443  >  61034 [ACK] Seq=1416 Ack=363 Win=424 Len=1376 [TCP PDU reassembled in 178]"
"169","0.924336","146.75.37.140","192.168.12.35","TCP","1430","443  >  61034 [ACK] Seq=2792 Ack=363 Win=424 Len=1376 [TCP PDU reassembled in 178]"
"170","0.924336","146.75.37.140","192.168.12.35","TCP","1430","443  >  61034 [ACK] Seq=4168 Ack=363 Win=424 Len=1376 [TCP PDU reassembled in 178]"
"171","0.924336","146.75.37.140","192.168.12.35","TCP","1430","443  >  61034 [ACK] Seq=5544 Ack=363 Win=424 Len=1376 [TCP PDU reassembled in 178]"
"172","0.924336","146.75.37.140","192.168.12.35","TCP","1430","443  >  61034 [ACK] Seq=6920 Ack=363 Win=424 Len=1376 [TCP PDU reassembled in 178]"
"173","0.924336","146.75.37.140","192.168.12.35","TCP","1430","443  >  61034 [ACK] Seq=8296 Ack=363 Win=424 Len=1376 [TCP PDU reassembled in 178]"
"174","0.924336","146.75.37.140","192.168.12.35","TCP","1430","443  >  61034 [ACK] Seq=9672 Ack=363 Win=424 Len=1376 [TCP PDU reassembled in 178]"
"175","0.924336","146.75.37.140","192.168.12.35","TCP","1430","443  >  61034 [ACK] Seq=11048 Ack=363 Win=424 Len=1376 [TCP PDU reassembled in 178]"
"176","0.924336","146.75.37.140","192.168.12.35","TCP","1430","443  >  61034 [ACK] Seq=12424 Ack=363 Win=424 Len=1376 [TCP PDU reassembled in 178]"
"177","0.924336","146.75.37.140","192.168.12.35","TCP","1430","443  >  61034 [ACK] Seq=13800 Ack=363 Win=424 Len=1376 [TCP PDU reassembled in 178]"
"178","0.924336","146.75.37.140","192.168.12.35","TLSv1.2","369","Application Data"
"179","0.924336","146.75.37.140","192.168.12.35","TCP","1430","443  >  61034 [ACK] Seq=15491 Ack=363 Win=424 Len=1376 [TCP PDU reassembled in 193]"
"180","0.924336","146.75.37.140","192.168.12.35","TCP","1430","443  >  61034 [ACK] Seq=16867 Ack=363 Win=424 Len=1376 [TCP PDU reassembled in 193]"
"181","0.924336","146.75.37.140","192.168.12.35","TCP","1430","443  >  61034 [ACK] Seq=18243 Ack=363 Win=424 Len=1376 [TCP PDU reassembled in 193]"
"182","0.924336","146.75.37.140","192.168.12.35","TCP","1430","443  >  61034 [ACK] Seq=19619 Ack=363 Win=424 Len=1376 [TCP PDU reassembled in 193]"
"183","0.924336","146.75.37.140","192.168.12.35","TCP","1430","443  >  61034 [ACK] Seq=20995 Ack=363 Win=424 Len=1376 [TCP PDU reassembled in 193]"
"184","0.924336","146.75.37.140","192.168.12.35","TCP","1430","443  >  61034 [ACK] Seq=22371 Ack=363 Win=424 Len=1376 [TCP PDU reassembled in 193]"
"185","0.925355","192.168.12.35","146.75.37.140","TCP","54","61034  >  443 [ACK] Seq=363 Ack=15176 Win=8201 Len=0"
"186","0.925551","192.168.12.35","146.75.37.140","TCP","54","61034  >  443 [ACK] Seq=363 Ack=23747 Win=8201 Len=0"
"187","0.926922","192.168.12.35","146.75.37.140","TLSv1.2","89","Application Data"
"188","0.931559","146.75.37.140","192.168.12.35","TCP","1430","443  >  61034 [ACK] Seq=23747 Ack=363 Win=424 Len=1376 [TCP PDU reassembled in 193]"
"189","0.931559","146.75.37.140","192.168.12.35","TCP","1430","443  >  61034 [ACK] Seq=25123 Ack=363 Win=424 Len=1376 [TCP PDU reassembled in 193]"
"190","0.931559","146.75.37.140","192.168.12.35","TCP","1430","443  >  61034 [ACK] Seq=26499 Ack=363 Win=424 Len=1376 [TCP PDU reassembled in 193]"
"191","0.931559","146.75.37.140","192.168.12.35","TCP","1430","443  >  61034 [ACK] Seq=27875 Ack=363 Win=424 Len=1376 [TCP PDU reassembled in 193]"
"192","0.931559","146.75.37.140","192.168.12.35","TCP","1430","443  >  61034 [ACK] Seq=29251 Ack=363 Win=424 Len=1376 [TCP PDU reassembled in 193]"
"193","0.931559","146.75.37.140","192.168.12.35","TLSv1.2","1430","Application Data"
"194","0.931559","146.75.37.140","192.168.12.35","TCP","1430","443  >  61034 [ACK] Seq=32003 Ack=363 Win=424 Len=1376 [TCP PDU reassembled in 205]"
"195","0.931559","146.75.37.140","192.168.12.35","TCP","1430","443  >  61034 [ACK] Seq=33379 Ack=363 Win=424 Len=1376 [TCP PDU reassembled in 205]"
"196","0.931559","146.75.37.140","192.168.12.35","TCP","1430","443  >  61034 [ACK] Seq=34755 Ack=363 Win=424 Len=1376 [TCP PDU reassembled in 205]"
"197","0.931559","146.75.37.140","192.168.12.35","TCP","1430","443  >  61034 [ACK] Seq=36131 Ack=363 Win=424 Len=1376 [TCP PDU reassembled in 205]"
"198","0.931559","146.75.37.140","192.168.12.35","TCP","1430","443  >  61034 [ACK] Seq=37507 Ack=363 Win=424 Len=1376 [TCP PDU reassembled in 205]"
"199","0.931559","146.75.37.140","192.168.12.35","TCP","1430","443  >  61034 [ACK] Seq=38883 Ack=363 Win=424 Len=1376 [TCP PDU reassembled in 205]"
"200","0.931559","146.75.37.140","192.168.12.35","TCP","1430","443  >  61034 [ACK] Seq=40259 Ack=363 Win=424 Len=1376 [TCP PDU reassembled in 205]"
"201","0.931559","146.75.37.140","192.168.12.35","TCP","1430","443  >  61034 [ACK] Seq=41635 Ack=363 Win=424 Len=1376 [TCP PDU reassembled in 205]"
"202","0.931559","146.75.37.140","192.168.12.35","TCP","1430","443  >  61034 [PSH, ACK] Seq=43011 Ack=363 Win=424 Len=1376 [TCP PDU reassembled in 205]"
"203","0.931559","146.75.37.140","192.168.12.35","TCP","1430","443  >  61034 [ACK] Seq=44387 Ack=363 Win=424 Len=1376 [TCP PDU reassembled in 205]"
"204","0.931559","146.75.37.140","192.168.12.35","TCP","1430","443  >  61034 [ACK] Seq=45763 Ack=363 Win=424 Len=1376 [TCP PDU reassembled in 205]"
"205","0.931559","146.75.37.140","192.168.12.35","TLSv1.2","1430","Application Data"
"206","0.931559","146.75.37.140","192.168.12.35","TCP","1430","443  >  61034 [ACK] Seq=48515 Ack=363 Win=424 Len=1376 [TCP PDU reassembled in 217]"
"207","0.931559","146.75.37.140","192.168.12.35","TCP","1430","443  >  61034 [ACK] Seq=49891 Ack=363 Win=424 Len=1376 [TCP PDU reassembled in 217]"
"208","0.931559","146.75.37.140","192.168.12.35","TCP","1430","443  >  61034 [ACK] Seq=51267 Ack=363 Win=424 Len=1376 [TCP PDU reassembled in 217]"
"209","0.931559","146.75.37.140","192.168.12.35","TCP","1430","443  >  61034 [ACK] Seq=52643 Ack=363 Win=424 Len=1376 [TCP PDU reassembled in 217]"
"210","0.931559","146.75.37.140","192.168.12.35","TCP","1430","443  >  61034 [ACK] Seq=54019 Ack=363 Win=424 Len=1376 [TCP PDU reassembled in 217]"
"211","0.931559","146.75.37.140","192.168.12.35","TCP","1430","443  >  61034 [ACK] Seq=55395 Ack=363 Win=424 Len=1376 [TCP PDU reassembled in 217]"
"212","0.931559","146.75.37.140","192.168.12.35","TCP","1430","443  >  61034 [ACK] Seq=56771 Ack=363 Win=424 Len=1376 [TCP PDU reassembled in 217]"
"213","0.931559","146.75.37.140","192.168.12.35","TCP","1430","443  >  61034 [ACK] Seq=58147 Ack=363 Win=424 Len=1376 [TCP PDU reassembled in 217]"
"214","0.931559","146.75.37.140","192.168.12.35","TCP","1430","443  >  61034 [ACK] Seq=59523 Ack=363 Win=424 Len=1376 [TCP PDU reassembled in 217]"
"215","0.931559","146.75.37.140","192.168.12.35","TCP","1430","443  >  61034 [ACK] Seq=60899 Ack=363 Win=424 Len=1376 [TCP PDU reassembled in 217]"
"216","0.931559","146.75.37.140","192.168.12.35","TCP","1430","443  >  61034 [ACK] Seq=62275 Ack=363 Win=424 Len=1376 [TCP PDU reassembled in 217]"
"217","0.931559","146.75.37.140","192.168.12.35","TLSv1.2","1430","Application Data"
"218","0.931559","146.75.37.140","192.168.12.35","TCP","1430","443  >  61034 [ACK] Seq=65027 Ack=363 Win=424 Len=1376 [TCP PDU reassembled in 230]"
"219","0.931559","146.75.37.140","192.168.12.35","TCP","1430","443  >  61034 [ACK] Seq=66403 Ack=363 Win=424 Len=1376 [TCP PDU reassembled in 230]"
"220","0.932322","192.168.12.35","146.75.37.140","TCP","54","61034  >  443 [ACK] Seq=398 Ack=67779 Win=8201 Len=0"
"221","0.932268","146.75.37.140","192.168.12.35","TCP","1430","443  >  61034 [ACK] Seq=67779 Ack=363 Win=424 Len=1376 [TCP PDU reassembled in 230]"
"222","0.932268","146.75.37.140","192.168.12.35","TCP","1430","443  >  61034 [ACK] Seq=69155 Ack=363 Win=424 Len=1376 [TCP PDU reassembled in 230]"
"223","0.932268","146.75.37.140","192.168.12.35","TCP","1430","443  >  61034 [ACK] Seq=70531 Ack=363 Win=424 Len=1376 [TCP PDU reassembled in 230]"
"224","0.932268","146.75.37.140","192.168.12.35","TCP","1430","443  >  61034 [PSH, ACK] Seq=71907 Ack=363 Win=424 Len=1376 [TCP PDU reassembled in 230]"
"225","0.932268","146.75.37.140","192.168.12.35","TCP","1430","443  >  61034 [ACK] Seq=73283 Ack=363 Win=424 Len=1376 [TCP PDU reassembled in 230]"
"226","0.932268","146.75.37.140","192.168.12.35","TCP","1430","443  >  61034 [ACK] Seq=74659 Ack=363 Win=424 Len=1376 [TCP PDU reassembled in 230]"
"227","0.932268","146.75.37.140","192.168.12.35","TCP","1430","443  >  61034 [ACK] Seq=76035 Ack=363 Win=424 Len=1376 [TCP PDU reassembled in 230]"
"228","0.932268","146.75.37.140","192.168.12.35","TCP","1430","443  >  61034 [ACK] Seq=77411 Ack=363 Win=424 Len=1376 [TCP PDU reassembled in 230]"
"229","0.932268","146.75.37.140","192.168.12.35","TCP","1430","443  >  61034 [ACK] Seq=78787 Ack=363 Win=424 Len=1376 [TCP PDU reassembled in 230]"
"230","0.932268","146.75.37.140","192.168.12.35","TLSv1.2","1430","Application Data, Application Data"
"231","0.932268","146.75.37.140","192.168.12.35","TCP","1430","443  >  61034 [ACK] Seq=81539 Ack=363 Win=424 Len=1376 [TCP PDU reassembled in 240]"
"232","0.932268","146.75.37.140","192.168.12.35","TCP","1430","443  >  61034 [ACK] Seq=82915 Ack=363 Win=424 Len=1376 [TCP PDU reassembled in 240]"
"233","0.932268","146.75.37.140","192.168.12.35","TCP","1430","443  >  61034 [ACK] Seq=84291 Ack=363 Win=424 Len=1376 [TCP PDU reassembled in 240]"
"234","0.932268","146.75.37.140","192.168.12.35","TCP","1430","443  >  61034 [ACK] Seq=85667 Ack=363 Win=424 Len=1376 [TCP PDU reassembled in 240]"
"235","0.932268","146.75.37.140","192.168.12.35","TCP","1430","443  >  61034 [ACK] Seq=87043 Ack=363 Win=424 Len=1376 [TCP PDU reassembled in 240]"
"236","0.932268","146.75.37.140","192.168.12.35","TCP","1430","443  >  61034 [ACK] Seq=88419 Ack=363 Win=424 Len=1376 [TCP PDU reassembled in 240]"
"237","0.932268","146.75.37.140","192.168.12.35","TCP","1430","443  >  61034 [ACK] Seq=89795 Ack=363 Win=424 Len=1376 [TCP PDU reassembled in 240]"
"238","0.932268","146.75.37.140","192.168.12.35","TCP","1430","443  >  61034 [ACK] Seq=91171 Ack=363 Win=424 Len=1376 [TCP PDU reassembled in 240]"
"239","0.932268","146.75.37.140","192.168.12.35","TCP","1430","443  >  61034 [ACK] Seq=92547 Ack=363 Win=424 Len=1376 [TCP PDU reassembled in 240]"
"240","0.932268","146.75.37.140","192.168.12.35","TLSv1.2","903","Application Data"
"241","0.932268","146.75.37.140","192.168.12.35","TLSv1.2","1430","Application Data"
"242","0.932268","146.75.37.140","192.168.12.35","TCP","1430","443  >  61034 [ACK] Seq=96148 Ack=363 Win=424 Len=1376 [TCP PDU reassembled in 253]"
"243","0.932268","146.75.37.140","192.168.12.35","TCP","1430","443  >  61034 [ACK] Seq=97524 Ack=363 Win=424 Len=1376 [TCP PDU reassembled in 253]"
"244","0.932268","146.75.37.140","192.168.12.35","TCP","1430","443  >  61034 [ACK] Seq=98900 Ack=363 Win=424 Len=1376 [TCP PDU reassembled in 253]"
"245","0.932268","146.75.37.140","192.168.12.35","TCP","1430","443  >  61034 [ACK] Seq=100276 Ack=363 Win=424 Len=1376 [TCP PDU reassembled in 253]"
"246","0.932268","146.75.37.140","192.168.12.35","TCP","1430","443  >  61034 [ACK] Seq=101652 Ack=363 Win=424 Len=1376 [TCP PDU reassembled in 253]"
"247","0.932268","146.75.37.140","192.168.12.35","TCP","1430","443  >  61034 [ACK] Seq=103028 Ack=363 Win=424 Len=1376 [TCP PDU reassembled in 253]"
"248","0.932268","146.75.37.140","192.168.12.35","TCP","1430","443  >  61034 [ACK] Seq=104404 Ack=363 Win=424 Len=1376 [TCP PDU reassembled in 253]"
"249","0.932268","146.75.37.140","192.168.12.35","TCP","1430","443  >  61034 [ACK] Seq=105780 Ack=363 Win=424 Len=1376 [TCP PDU reassembled in 253]"
"250","0.932268","146.75.37.140","192.168.12.35","TCP","1430","443  >  61034 [ACK] Seq=107156 Ack=363 Win=424 Len=1376 [TCP PDU reassembled in 253]"
"251","0.932268","146.75.37.140","192.168.12.35","TCP","1430","443  >  61034 [ACK] Seq=108532 Ack=363 Win=424 Len=1376 [TCP PDU reassembled in 253]"
"252","0.932268","146.75.37.140","192.168.12.35","TCP","1430","443  >  61034 [ACK] Seq=109908 Ack=363 Win=424 Len=1376 [TCP PDU reassembled in 253]"
"253","0.932834","146.75.37.140","192.168.12.35","TLSv1.2","1430","Application Data, Application Data"
"254","0.932834","146.75.37.140","192.168.12.35","TCP","1430","443  >  61034 [ACK] Seq=112660 Ack=363 Win=424 Len=1376 [TCP PDU reassembled in 262]"
"255","0.932834","146.75.37.140","192.168.12.35","TCP","1430","443  >  61034 [ACK] Seq=114036 Ack=363 Win=424 Len=1376 [TCP PDU reassembled in 262]"
"256","0.932834","146.75.37.140","192.168.12.35","TCP","1430","443  >  61034 [ACK] Seq=115412 Ack=363 Win=424 Len=1376 [TCP PDU reassembled in 262]"
"257","0.932834","146.75.37.140","192.168.12.35","TCP","1430","443  >  61034 [ACK] Seq=116788 Ack=363 Win=424 Len=1376 [TCP PDU reassembled in 262]"
"258","0.932834","146.75.37.140","192.168.12.35","TCP","1430","443  >  61034 [ACK] Seq=118164 Ack=363 Win=424 Len=1376 [TCP PDU reassembled in 262]"
"259","0.932834","146.75.37.140","192.168.12.35","TCP","1430","443  >  61034 [ACK] Seq=119540 Ack=363 Win=424 Len=1376 [TCP PDU reassembled in 262]"
"260","0.932834","146.75.37.140","192.168.12.35","TCP","1430","443  >  61034 [ACK] Seq=120916 Ack=363 Win=424 Len=1376 [TCP PDU reassembled in 262]"
"261","0.932834","146.75.37.140","192.168.12.35","TCP","1430","443  >  61034 [PSH, ACK] Seq=122292 Ack=363 Win=424 Len=1376 [TCP PDU reassembled in 262]"
"262","0.932834","146.75.37.140","192.168.12.35","TLSv1.2","78","Application Data"
"263","0.932988","192.168.12.35","146.75.37.140","TCP","54","61034  >  443 [ACK] Seq=398 Ack=93923 Win=8201 Len=0"
"264","0.933144","192.168.12.35","146.75.37.140","TCP","54","61034  >  443 [ACK] Seq=398 Ack=94772 Win=8198 Len=0"
"265","0.933228","192.168.12.35","146.75.37.140","TCP","54","61034  >  443 [ACK] Seq=398 Ack=111284 Win=8201 Len=0"
"266","0.933366","192.168.12.35","146.75.37.140","TCP","54","61034  >  443 [ACK] Seq=398 Ack=123668 Win=8201 Len=0"
"267","0.933467","192.168.12.35","146.75.37.140","TCP","54","61034  >  443 [ACK] Seq=398 Ack=123692 Win=8201 Len=0"
"268","0.956897","146.75.37.140","192.168.12.35","TCP","54","443  >  61034 [ACK] Seq=123692 Ack=398 Win=424 Len=0"
"269","4.007295","146.75.37.140","192.168.12.35","TLSv1.2","478","Application Data"
"270","4.007295","146.75.37.140","192.168.12.35","TLSv1.2","185","Application Data"
"271","4.007542","192.168.12.35","146.75.37.140","TCP","54","61013  >  443 [ACK] Seq=16052 Ack=83846 Win=1025 Len=0"
"272","4.015614","146.75.37.140","192.168.12.35","TLSv1.2","344","Application Data"
"273","4.015614","146.75.37.140","192.168.12.35","TLSv1.2","807","Application Data"
"274","4.015997","192.168.12.35","146.75.37.140","TCP","54","61013  >  443 [ACK] Seq=16052 Ack=84889 Win=1021 Len=0"
"275","4.022990","146.75.37.140","192.168.12.35","TLSv1.2","796","Application Data"
"276","4.022990","146.75.37.140","192.168.12.35","TLSv1.2","211","Application Data"
"277","4.022990","146.75.37.140","192.168.12.35","TLSv1.2","211","Application Data"
"278","4.022990","146.75.37.140","192.168.12.35","TLSv1.2","192","Application Data"
"279","4.022990","146.75.37.140","192.168.12.35","TCP","1430","443  >  61013 [ACK] Seq=86083 Ack=16052 Win=7590 Len=1376 [TCP PDU reassembled in 280]"
"280","4.022990","146.75.37.140","192.168.12.35","TLSv1.2","847","Application Data"
"281","4.022990","146.75.37.140","192.168.12.35","TLSv1.2","885","Application Data"
"282","4.022990","146.75.37.140","192.168.12.35","TLSv1.2","242","Application Data"
"283","4.023379","192.168.12.35","146.75.37.140","TCP","54","61013  >  443 [ACK] Seq=16052 Ack=85945 Win=1025 Len=0"
"284","4.023456","192.168.12.35","146.75.37.140","TCP","54","61013  >  443 [ACK] Seq=16052 Ack=86083 Win=1024 Len=0"
"285","4.023489","192.168.12.35","146.75.37.140","TCP","54","61013  >  443 [ACK] Seq=16052 Ack=88252 Win=1025 Len=0"
"286","4.023517","192.168.12.35","146.75.37.140","TCP","54","61013  >  443 [ACK] Seq=16052 Ack=89271 Win=1021 Len=0"
"287","4.035571","146.75.37.140","192.168.12.35","TCP","1430","443  >  61013 [ACK] Seq=89271 Ack=16052 Win=7590 Len=1376 [TCP PDU reassembled in 288]"
"288","4.035571","146.75.37.140","192.168.12.35","TLSv1.2","168","Application Data"
"289","4.035571","146.75.37.140","192.168.12.35","TLSv1.2","242","Application Data"
"290","4.035571","146.75.37.140","192.168.12.35","TLSv1.2","857","Application Data"
"291","4.035571","146.75.37.140","192.168.12.35","TLSv1.2","885","Application Data"
"292","4.035571","146.75.37.140","192.168.12.35","TLSv1.2","527","Application Data"
"293","4.035571","146.75.37.140","192.168.12.35","TCP","1430","443  >  61013 [ACK] Seq=93056 Ack=16052 Win=7590 Len=1376 [TCP PDU reassembled in 295]"
"294","4.035571","146.75.37.140","192.168.12.35","TCP","1430","443  >  61013 [ACK] Seq=94432 Ack=16052 Win=7590 Len=1376 [TCP PDU reassembled in 295]"
"295","4.035571","146.75.37.140","192.168.12.35","TLSv1.2","714","Application Data"
"296","4.035571","146.75.37.140","192.168.12.35","TLSv1.2","569","Application Data"
"297","4.035571","146.75.37.140","192.168.12.35","TLSv1.2","150","Application Data"
"298","4.035571","146.75.37.140","192.168.12.35","TLSv1.2","104","Application Data"
"299","4.035571","146.75.37.140","192.168.12.35","TLSv1.2","539","Application Data"
"300","4.035571","146.75.37.140","192.168.12.35","TLSv1.2","85","Application Data"
"301","4.036018","192.168.12.35","146.75.37.140","TCP","54","61013  >  443 [ACK] Seq=16052 Ack=90761 Win=1025 Len=0"
"302","4.036130","192.168.12.35","146.75.37.140","TCP","54","61013  >  443 [ACK] Seq=16052 Ack=91752 Win=1021 Len=0"
"303","4.036159","192.168.12.35","146.75.37.140","TCP","54","61013  >  443 [ACK] Seq=16052 Ack=93056 Win=1025 Len=0"
"304","4.036186","192.168.12.35","146.75.37.140","TCP","54","61013  >  443 [ACK] Seq=16052 Ack=95808 Win=1025 Len=0"
"305","4.036239","192.168.12.35","146.75.37.140","TCP","54","61013  >  443 [ACK] Seq=16052 Ack=96983 Win=1020 Len=0"
"306","4.036320","192.168.12.35","146.75.37.140","TCP","54","61013  >  443 [ACK] Seq=16052 Ack=97129 Win=1020 Len=0"
"307","4.036343","192.168.12.35","146.75.37.140","TCP","54","61013  >  443 [ACK] Seq=16052 Ack=97645 Win=1025 Len=0"
"308","4.075708","192.168.12.35","146.75.37.140","TLSv1.2","3186","Application Data"
"309","4.076013","192.168.12.35","146.75.37.140","TLSv1.2","718","Application Data"
"310","4.076073","192.168.12.35","146.75.37.140","TLSv1.2","3191","Application Data"
"311","4.108132","192.168.12.35","146.75.37.140","TLSv1.2","3199","Application Data"
"312","4.132505","146.75.37.140","192.168.12.35","TCP","54","443  >  61013 [ACK] Seq=97645 Ack=17448 Win=7596 Len=0"
"313","4.142331","146.75.37.140","192.168.12.35","TCP","54","443  >  61013 [ACK] Seq=97645 Ack=18844 Win=7601 Len=0"
"314","4.142331","146.75.37.140","192.168.12.35","TCP","54","443  >  61013 [ACK] Seq=97645 Ack=19184 Win=7601 Len=0"
"315","4.154135","146.75.37.140","192.168.12.35","TCP","54","443  >  61013 [ACK] Seq=97645 Ack=19848 Win=7601 Len=0"
"316","4.162242","192.168.12.35","146.75.37.140","TLSv1.2","3177","Application Data"
"317","4.162340","192.168.12.35","146.75.37.140","TLSv1.2","210","Application Data"
"318","4.176929","146.75.37.140","192.168.12.35","TCP","54","443  >  61013 [ACK] Seq=97645 Ack=21244 Win=7607 Len=0"
"319","4.184444","146.75.37.140","192.168.12.35","TCP","1430","443  >  61013 [ACK] Seq=97645 Ack=21244 Win=7607 Len=1376 [TCP PDU reassembled in 320]"
"320","4.184444","146.75.37.140","192.168.12.35","TLSv1.2","438","Application Data"
"321","4.184841","192.168.12.35","146.75.37.140","TCP","54","61013  >  443 [ACK] Seq=29409 Ack=99405 Win=1025 Len=0"
"322","4.197815","146.75.37.140","192.168.12.35","TCP","54","443  >  61013 [ACK] Seq=99405 Ack=22640 Win=7612 Len=0"
"323","4.197815","146.75.37.140","192.168.12.35","TCP","54","443  >  61013 [ACK] Seq=99405 Ack=22985 Win=7612 Len=0"
"324","4.217945","146.75.37.140","192.168.12.35","TCP","54","443  >  61013 [ACK] Seq=99405 Ack=24381 Win=7618 Len=0"
"325","4.234039","146.75.37.140","192.168.12.35","TCP","1430","443  >  61013 [ACK] Seq=99405 Ack=24381 Win=7618 Len=1376 [TCP PDU reassembled in 326]"
"326","4.234039","146.75.37.140","192.168.12.35","TLSv1.2","825","Application Data"
"327","4.234039","146.75.37.140","192.168.12.35","TCP","54","443  >  61013 [ACK] Seq=101552 Ack=25777 Win=7623 Len=0"
"328","4.234436","192.168.12.35","146.75.37.140","TCP","54","61013  >  443 [ACK] Seq=29409 Ack=101552 Win=1025 Len=0"
"329","4.237289","192.168.12.35","146.75.37.140","TLSv1.2","3184","Application Data"
"330","4.237483","192.168.12.35","146.75.37.140","TLSv1.2","1796","Application Data"
"331","4.247110","146.75.37.140","192.168.12.35","TCP","54","443  >  61013 [ACK] Seq=101552 Ack=26130 Win=7623 Len=0"
"332","4.267794","146.75.37.140","192.168.12.35","TCP","54","443  >  61013 [ACK] Seq=101552 Ack=27526 Win=7628 Len=0"
