"No.","Time","Source","Destination","Protocol","Length","Info"
"1","0.000000","192.168.12.35","146.75.37.140","TCP","55","62042  >  443 [ACK] Seq=1 Ack=1 Win=1025 Len=1"
"2","0.023084","146.75.37.140","192.168.12.35","TCP","66","443  >  62042 [ACK] Seq=1 Ack=2 Win=302 Len=0 SLE=1 SRE=2"
"3","1.192082","192.168.12.35","146.75.37.140","TLSv1.2","3234","Application Data"
"4","1.192143","192.168.12.35","146.75.37.140","TLSv1.2","93","Application Data"
"5","1.192166","192.168.12.35","146.75.37.140","TLSv1.2","3356","Application Data"
"6","1.192190","192.168.12.35","146.75.37.140","TLSv1.2","2731","Application Data"
"7","1.228908","146.75.37.140","192.168.12.35","TCP","54","443  >  61013 [ACK] Seq=1 Ack=1397 Win=6701 Len=0"
"8","1.243187","146.75.37.140","192.168.12.35","TCP","54","443  >  61013 [ACK] Seq=1 Ack=2793 Win=6707 Len=0"
"9","1.248554","146.75.37.140","192.168.12.35","TCP","54","443  >  61013 [ACK] Seq=1 Ack=3181 Win=6707 Len=0"
"10","1.248554","146.75.37.140","192.168.12.35","TCP","54","443  >  61013 [ACK] Seq=1 Ack=3220 Win=6707 Len=0"
"11","1.248554","146.75.37.140","192.168.12.35","TLSv1.2","93","Application Data"
"12","1.269783","146.75.37.140","192.168.12.35","TCP","54","443  >  61013 [ACK] Seq=40 Ack=4616 Win=6712 Len=0"
"13","1.269783","146.75.37.140","192.168.12.35","TCP","54","443  >  61013 [ACK] Seq=40 Ack=6012 Win=6718 Len=0"
"14","1.269783","146.75.37.140","192.168.12.35","TCP","54","443  >  61013 [ACK] Seq=40 Ack=6522 Win=6718 Len=0"
"15","1.287749","146.75.37.140","192.168.12.35","TCP","54","443  >  61013 [ACK] Seq=40 Ack=7918 Win=6723 Len=0"
"16","1.290680","192.168.12.35","146.75.37.140","TCP","54","61013  >  443 [ACK] Seq=9199 Ack=40 Win=1024 Len=0"
"17","1.299074","146.75.37.140","192.168.12.35","TCP","54","443  >  61013 [ACK] Seq=40 Ack=9199 Win=6729 Len=0"
"18","1.309881","146.75.37.140","192.168.12.35","TCP","1430","443  >  61013 [ACK] Seq=40 Ack=9199 Win=6729 Len=1376 [TCP PDU reassembled in 19]"
"19","1.309881","146.75.37.140","192.168.12.35","TLSv1.2","936","Application Data"
"20","1.310122","192.168.12.35","146.75.37.140","TCP","54","61013  >  443 [ACK] Seq=9199 Ack=2298 Win=1025 Len=0"
"21","1.310728","146.75.37.140","192.168.12.35","TCP","1430","443  >  61013 [ACK] Seq=2298 Ack=9199 Win=6729 Len=1376 [TCP PDU reassembled in 22]"
"22","1.310728","146.75.37.140","192.168.12.35","TLSv1.2","1072","Application Data"
"23","1.310791","192.168.12.35","146.75.37.140","TCP","54","61013  >  443 [ACK] Seq=9199 Ack=4692 Win=1025 Len=0"
"24","1.315470","192.168.12.35","146.75.37.140","TLSv1.2","89","Application Data"
"25","1.327102","146.75.37.140","192.168.12.35","TCP","1430","443  >  61013 [ACK] Seq=4692 Ack=9199 Win=6729 Len=1376 [TCP PDU reassembled in 26]"
"26","1.327102","146.75.37.140","192.168.12.35","TLSv1.2","480","Application Data"
"27","1.327337","192.168.12.35","146.75.37.140","TCP","54","61013  >  443 [ACK] Seq=9234 Ack=6494 Win=1025 Len=0"
"28","1.333425","192.168.12.35","146.75.37.140","UDP","96","63474  >  443 Len=54"
"29","1.337703","146.75.37.140","192.168.12.35","TCP","54","443  >  61013 [ACK] Seq=6494 Ack=9234 Win=6729 Len=0"
"30","1.355974","146.75.37.140","192.168.12.35","TCP","1430","443  >  61013 [ACK] Seq=6494 Ack=9234 Win=6729 Len=1376 [TCP PDU reassembled in 40]"
"31","1.355974","146.75.37.140","192.168.12.35","TCP","1430","443  >  61013 [PSH, ACK] Seq=7870 Ack=9234 Win=6729 Len=1376 [TCP PDU reassembled in 40]"
"32","1.355974","146.75.37.140","192.168.12.35","TCP","1430","443  >  61013 [ACK] Seq=9246 Ack=9234 Win=6729 Len=1376 [TCP PDU reassembled in 40]"
"33","1.355974","146.75.37.140","192.168.12.35","TCP","1430","443  >  61013 [PSH, ACK] Seq=10622 Ack=9234 Win=6729 Len=1376 [TCP PDU reassembled in 40]"
"34","1.355974","146.75.37.140","192.168.12.35","TCP","1430","443  >  61013 [ACK] Seq=11998 Ack=9234 Win=6729 Len=1376 [TCP PDU reassembled in 40]"
"35","1.355974","146.75.37.140","192.168.12.35","TCP","1430","443  >  61013 [PSH, ACK] Seq=13374 Ack=9234 Win=6729 Len=1376 [TCP PDU reassembled in 40]"
"36","1.355974","146.75.37.140","192.168.12.35","TCP","1430","443  >  61013 [ACK] Seq=14750 Ack=9234 Win=6729 Len=1376 [TCP PDU reassembled in 40]"
"37","1.355974","146.75.37.140","192.168.12.35","TCP","1430","443  >  61013 [PSH, ACK] Seq=16126 Ack=9234 Win=6729 Len=1376 [TCP PDU reassembled in 40]"
"38","1.355974","146.75.37.140","192.168.12.35","TCP","1430","443  >  61013 [ACK] Seq=17502 Ack=9234 Win=6729 Len=1376 [TCP PDU reassembled in 40]"
"39","1.355974","146.75.37.140","192.168.12.35","TCP","1430","443  >  61013 [PSH, ACK] Seq=18878 Ack=9234 Win=6729 Len=1376 [TCP PDU reassembled in 40]"
"40","1.355974","146.75.37.140","192.168.12.35","TLSv1.2","346","Application Data"
"41","1.356637","192.168.12.35","146.75.37.140","TCP","54","61013  >  443 [ACK] Seq=9234 Ack=20254 Win=1025 Len=0"
"42","1.366359","146.75.37.140","192.168.12.35","UDP","67","443  >  63474 Len=25"
"43","1.385521","192.168.12.35","146.75.37.140","UDP","86","63474  >  443 Len=44"
"44","1.387801","146.75.37.140","192.168.12.35","TLSv1.2","867","Application Data"
"45","1.387801","146.75.37.140","192.168.12.35","UDP","69","443  >  63474 Len=27"
"46","1.388223","192.168.12.35","146.75.37.140","TCP","54","61013  >  443 [ACK] Seq=9234 Ack=21359 Win=1020 Len=0"
"47","1.398457","146.75.37.140","192.168.12.35","TLSv1.2","90","Application Data"
"48","1.398457","146.75.37.140","192.168.12.35","TCP","1430","443  >  61013 [ACK] Seq=21395 Ack=9234 Win=6729 Len=1376 [TCP PDU reassembled in 60]"
"49","1.398457","146.75.37.140","192.168.12.35","TCP","1430","443  >  61013 [PSH, ACK] Seq=22771 Ack=9234 Win=6729 Len=1376 [TCP PDU reassembled in 60]"
"50","1.398457","146.75.37.140","192.168.12.35","TCP","1430","443  >  61013 [ACK] Seq=24147 Ack=9234 Win=6729 Len=1376 [TCP PDU reassembled in 60]"
"51","1.398457","146.75.37.140","192.168.12.35","TCP","1430","443  >  61013 [PSH, ACK] Seq=25523 Ack=9234 Win=6729 Len=1376 [TCP PDU reassembled in 60]"
"52","1.398937","192.168.12.35","146.75.37.140","TCP","54","61013  >  443 [ACK] Seq=9234 Ack=26899 Win=1025 Len=0"
"53","1.404831","146.75.37.140","192.168.12.35","TCP","1430","443  >  61013 [ACK] Seq=26899 Ack=9234 Win=6729 Len=1376 [TCP PDU reassembled in 60]"
"54","1.404831","146.75.37.140","192.168.12.35","TCP","1430","443  >  61013 [PSH, ACK] Seq=28275 Ack=9234 Win=6729 Len=1376 [TCP PDU reassembled in 60]"
"55","1.404831","146.75.37.140","192.168.12.35","TCP","1430","443  >  61013 [ACK] Seq=29651 Ack=9234 Win=6729 Len=1376 [TCP PDU reassembled in 60]"
"56","1.404831","146.75.37.140","192.168.12.35","TCP","1430","443  >  61013 [PSH, ACK] Seq=31027 Ack=9234 Win=6729 Len=1376 [TCP PDU reassembled in 60]"
"57","1.404831","146.75.37.140","192.168.12.35","TCP","1430","443  >  61013 [ACK] Seq=32403 Ack=9234 Win=6729 Len=1376 [TCP PDU reassembled in 60]"
"58","1.404831","146.75.37.140","192.168.12.35","TCP","1430","443  >  61013 [PSH, ACK] Seq=33779 Ack=9234 Win=6729 Len=1376 [TCP PDU reassembled in 60]"
"59","1.404831","146.75.37.140","192.168.12.35","TCP","1430","443  >  61013 [ACK] Seq=35155 Ack=9234 Win=6729 Len=1376 [TCP PDU reassembled in 60]"
"60","1.404831","146.75.37.140","192.168.12.35","TLSv1.2","546","Application Data"
"61","1.405353","192.168.12.35","146.75.37.140","TCP","54","61013  >  443 [ACK] Seq=9234 Ack=36531 Win=1025 Len=0"
"62","1.429069","146.75.37.140","192.168.12.35","TCP","1430","443  >  61013 [ACK] Seq=37023 Ack=9234 Win=6729 Len=1376 [TCP PDU reassembled in 73]"
"63","1.429069","146.75.37.140","192.168.12.35","TCP","1430","443  >  61013 [PSH, ACK] Seq=38399 Ack=9234 Win=6729 Len=1376 [TCP PDU reassembled in 73]"
"64","1.429069","146.75.37.140","192.168.12.35","TCP","1430","443  >  61013 [ACK] Seq=39775 Ack=9234 Win=6729 Len=1376 [TCP PDU reassembled in 73]"
"65","1.429069","146.75.37.140","192.168.12.35","TCP","1430","443  >  61013 [PSH, ACK] Seq=41151 Ack=9234 Win=6729 Len=1376 [TCP PDU reassembled in 73]"
"66","1.429069","146.75.37.140","192.168.12.35","TCP","1430","443  >  61013 [ACK] Seq=42527 Ack=9234 Win=6729 Len=1376 [TCP PDU reassembled in 73]"
"67","1.429069","146.75.37.140","192.168.12.35","TCP","1430","443  >  61013 [PSH, ACK] Seq=43903 Ack=9234 Win=6729 Len=1376 [TCP PDU reassembled in 73]"
"68","1.429069","146.75.37.140","192.168.12.35","TCP","1430","443  >  61013 [ACK] Seq=45279 Ack=9234 Win=6729 Len=1376 [TCP PDU reassembled in 73]"
"69","1.429069","146.75.37.140","192.168.12.35","TCP","1430","443  >  61013 [PSH, ACK] Seq=46655 Ack=9234 Win=6729 Len=1376 [TCP PDU reassembled in 73]"
"70","1.429069","146.75.37.140","192.168.12.35","TCP","1430","443  >  61013 [ACK] Seq=48031 Ack=9234 Win=6729 Len=1376 [TCP PDU reassembled in 73]"
"71","1.429069","146.75.37.140","192.168.12.35","TCP","1430","443  >  61013 [PSH, ACK] Seq=49407 Ack=9234 Win=6729 Len=1376 [TCP PDU reassembled in 73]"
"72","1.429069","146.75.37.140","192.168.12.35","TCP","1430","443  >  61013 [ACK] Seq=50783 Ack=9234 Win=6729 Len=1376 [TCP PDU reassembled in 73]"
"73","1.429069","146.75.37.140","192.168.12.35","TLSv1.2","1355","Application Data, Application Data"
"74","1.429366","192.168.12.35","146.75.37.140","TCP","54","61013  >  443 [ACK] Seq=9234 Ack=52159 Win=1025 Len=0"
"75","1.441530","146.75.37.140","192.168.12.35","TCP","1430","443  >  61013 [ACK] Seq=53460 Ack=9234 Win=6729 Len=1376 [TCP PDU reassembled in 76]"
"76","1.441530","146.75.37.140","192.168.12.35","TLSv1.2","997","Application Data"
"77","1.442267","192.168.12.35","146.75.37.140","TCP","54","61013  >  443 [ACK] Seq=9234 Ack=54836 Win=1025 Len=0"
"78","1.462827","146.75.37.140","192.168.12.35","TLSv1.2","1049","Application Data"
"79","1.462967","192.168.12.35","146.75.37.140","TCP","54","61013  >  443 [ACK] Seq=9234 Ack=56774 Win=1025 Len=0"
"80","1.474358","146.75.37.140","192.168.12.35","TLSv1.2","1181","Application Data"
"81","1.488778","146.75.37.140","192.168.12.35","TLSv1.2","1068","Application Data"
"82","1.488962","192.168.12.35","146.75.37.140","TCP","54","61013  >  443 [ACK] Seq=9234 Ack=58915 Win=1025 Len=0"
"83","1.511408","146.75.37.140","192.168.12.35","TLSv1.2","1191","Application Data"
"84","1.529332","146.75.37.140","192.168.12.35","TLSv1.2","603","Application Data"
"85","1.529556","192.168.12.35","146.75.37.140","TCP","54","61013  >  443 [ACK] Seq=9234 Ack=60601 Win=1025 Len=0"
"86","1.536238","146.75.37.140","192.168.12.35","TLSv1.2","842","Application Data"
"87","1.542759","146.75.37.140","192.168.12.35","TLSv1.2","112","Application Data"
"88","1.543105","192.168.12.35","146.75.37.140","TCP","54","61013  >  443 [ACK] Seq=9234 Ack=61447 Win=1021 Len=0"
"89","1.570972","146.75.37.140","192.168.12.35","TLSv1.2","117","Application Data"
"90","1.590057","146.75.37.140","192.168.12.35","TLSv1.2","181","Application Data"
"91","1.590057","146.75.37.140","192.168.12.35","TLSv1.2","186","Application Data"
"92","1.590799","192.168.12.35","146.75.37.140","TCP","54","61013  >  443 [ACK] Seq=9234 Ack=61637 Win=1021 Len=0"
"93","1.600320","146.75.37.140","192.168.12.35","TLSv1.2","231","Application Data"
"94","1.600591","192.168.12.35","146.75.37.140","TCP","54","61013  >  443 [ACK] Seq=9234 Ack=61946 Win=1019 Len=0"
"95","1.606280","146.75.37.140","192.168.12.35","TLSv1.2","582","Application Data"
"96","1.612558","146.75.37.140","192.168.12.35","TCP","1430","443  >  61013 [ACK] Seq=62474 Ack=9234 Win=6729 Len=1376 [TCP PDU reassembled in 97]"
"97","1.612558","146.75.37.140","192.168.12.35","TLSv1.2","311","Application Data"
"98","1.612685","192.168.12.35","146.75.37.140","TCP","54","61013  >  443 [ACK] Seq=9234 Ack=63850 Win=1025 Len=0"
"99","1.618533","146.75.37.140","192.168.12.35","TLSv1.2","769","Application Data"
"100","1.618533","146.75.37.140","192.168.12.35","TLSv1.2","97","Application Data"
"101","1.619026","192.168.12.35","146.75.37.140","TCP","54","61013  >  443 [ACK] Seq=9234 Ack=64822 Win=1021 Len=0"
"102","1.624460","146.75.37.140","192.168.12.35","TLSv1.2","213","Application Data"
"103","1.625035","192.168.12.35","146.75.37.140","TCP","54","61013  >  443 [ACK] Seq=9234 Ack=65024 Win=1020 Len=0"
"104","1.630277","146.75.37.140","192.168.12.35","TLSv1.2","476","Application Data"
"105","1.636415","146.75.37.140","192.168.12.35","TLSv1.2","118","Application Data"
"106","1.637001","192.168.12.35","146.75.37.140","TCP","54","61013  >  443 [ACK] Seq=9234 Ack=65510 Win=1025 Len=0"
"107","1.642421","146.75.37.140","192.168.12.35","TLSv1.2","95","Application Data"
"108","1.642421","146.75.37.140","192.168.12.35","TLSv1.2","113","Application Data"
"109","1.643039","192.168.12.35","146.75.37.140","TCP","54","61013  >  443 [ACK] Seq=9234 Ack=65610 Win=1024 Len=0"
"110","1.649500","146.75.37.140","192.168.12.35","TLSv1.2","115","Application Data"
"111","1.649500","146.75.37.140","192.168.12.35","TLSv1.2","94","Application Data"
"112","1.649500","146.75.37.140","192.168.12.35","TLSv1.2","98","Application Data"
"113","1.649500","146.75.37.140","192.168.12.35","TLSv1.2","103","Application Data"
"114","1.650332","192.168.12.35","146.75.37.140","TCP","54","61013  >  443 [ACK] Seq=9234 Ack=65711 Win=1024 Len=0"
"115","1.650722","192.168.12.35","146.75.37.140","TCP","54","61013  >  443 [ACK] Seq=9234 Ack=65804 Win=1024 Len=0"
"116","1.653475","146.75.37.140","192.168.12.35","TLSv1.2","656","Application Data"
"117","1.653475","146.75.37.140","192.168.12.35","TLSv1.2","96","Application Data"
"118","1.653475","146.75.37.140","192.168.12.35","TLSv1.2","93","Application Data"
"119","1.653475","146.75.37.140","192.168.12.35","TLSv1.2","100","Application Data"
"120","1.653475","146.75.37.140","192.168.12.35","TLSv1.2","174","Application Data"
"121","1.653475","146.75.37.140","192.168.12.35","TLSv1.2","579","Application Data"
"122","1.653475","146.75.37.140","192.168.12.35","TLSv1.2","167","Application Data"
"123","1.653475","146.75.37.140","192.168.12.35","TLSv1.2","101","Application Data"
"124","1.653475","146.75.37.140","192.168.12.35","TLSv1.2","296","Application Data"
"125","1.653475","146.75.37.140","192.168.12.35","TLSv1.2","108","Application Data"
"126","1.653475","146.75.37.140","192.168.12.35","TLSv1.2","432","Application Data"
"127","1.654363","192.168.12.35","146.75.37.140","TCP","54","61013  >  443 [ACK] Seq=9234 Ack=66448 Win=1021 Len=0"
"128","1.654529","192.168.12.35","146.75.37.140","TCP","54","61013  >  443 [ACK] Seq=9234 Ack=66533 Win=1021 Len=0"
"129","1.654583","192.168.12.35","146.75.37.140","TCP","54","61013  >  443 [ACK] Seq=9234 Ack=67178 Win=1025 Len=0"
"130","1.654638","192.168.12.35","146.75.37.140","TCP","54","61013  >  443 [ACK] Seq=9234 Ack=67338 Win=1024 Len=0"
"131","1.654685","192.168.12.35","146.75.37.140","TCP","54","61013  >  443 [ACK] Seq=9234 Ack=67634 Win=1023 Len=0"
"132","1.660471","146.75.37.140","192.168.12.35","TLSv1.2","102","Application Data"
"133","1.660471","146.75.37.140","192.168.12.35","TLSv1.2","100","Application Data"
"134","1.661240","192.168.12.35","146.75.37.140","TCP","54","61013  >  443 [ACK] Seq=9234 Ack=68060 Win=1021 Len=0"
"135","1.666407","146.75.37.140","192.168.12.35","TLSv1.2","123","Application Data"
"136","1.666782","192.168.12.35","146.75.37.140","TCP","54","61013  >  443 [ACK] Seq=9234 Ack=68175 Win=1021 Len=0"
"137","1.672488","146.75.37.140","192.168.12.35","TLSv1.2","361","Application Data"
"138","1.672488","146.75.37.140","192.168.12.35","TLSv1.2","243","Application Data"
"139","1.672488","146.75.37.140","192.168.12.35","TLSv1.2","128","Application Data"
"140","1.672488","146.75.37.140","192.168.12.35","TLSv1.2","177","Application Data"
"141","1.672722","192.168.12.35","146.75.37.140","TCP","54","61013  >  443 [ACK] Seq=9234 Ack=68671 Win=1025 Len=0"
"142","1.672813","192.168.12.35","146.75.37.140","TCP","54","61013  >  443 [ACK] Seq=9234 Ack=68868 Win=1024 Len=0"
"143","1.677589","146.75.37.140","192.168.12.35","TLSv1.2","123","Application Data"
"144","1.677589","146.75.37.140","192.168.12.35","TLSv1.2","107","Application Data"
"145","1.677589","146.75.37.140","192.168.12.35","TLSv1.2","125","Application Data"
"146","1.677589","146.75.37.140","192.168.12.35","TLSv1.2","107","Application Data"
"147","1.677589","146.75.37.140","192.168.12.35","TLSv1.2","187","Application Data"
"148","1.677589","146.75.37.140","192.168.12.35","TLSv1.2","149","Application Data"
"149","1.677589","146.75.37.140","192.168.12.35","TLSv1.2","291","Application Data"
"150","1.677589","146.75.37.140","192.168.12.35","TLSv1.2","113","Application Data"
"151","1.677589","146.75.37.140","192.168.12.35","TLSv1.2","164","Application Data"
"152","1.677589","146.75.37.140","192.168.12.35","TLSv1.2","157","Application Data"
"153","1.677589","146.75.37.140","192.168.12.35","TLSv1.2","170","Application Data"
"154","1.677589","146.75.37.140","192.168.12.35","TLSv1.2","137","Application Data"
"155","1.677589","146.75.37.140","192.168.12.35","TLSv1.2","104","Application Data"
"156","1.677589","146.75.37.140","192.168.12.35","TLSv1.2","136","Application Data"
"157","1.677589","146.75.37.140","192.168.12.35","TLSv1.2","104","Application Data"
"158","1.677589","146.75.37.140","192.168.12.35","TLSv1.2","423","Application Data"
"159","1.677589","146.75.37.140","192.168.12.35","TLSv1.2","199","Application Data"
"160","1.678097","192.168.12.35","146.75.37.140","TCP","54","61013  >  443 [ACK] Seq=9234 Ack=68990 Win=1023 Len=0"
"161","1.678279","192.168.12.35","146.75.37.140","TCP","54","61013  >  443 [ACK] Seq=9234 Ack=69114 Win=1023 Len=0"
"162","1.678384","192.168.12.35","146.75.37.140","TCP","54","61013  >  443 [ACK] Seq=9234 Ack=69342 Win=1022 Len=0"
"163","1.678489","192.168.12.35","146.75.37.140","TCP","54","61013  >  443 [ACK] Seq=9234 Ack=69638 Win=1021 Len=0"
"164","1.678580","192.168.12.35","146.75.37.140","TCP","54","61013  >  443 [ACK] Seq=9234 Ack=69851 Win=1020 Len=0"
"165","1.678742","192.168.12.35","146.75.37.140","TCP","54","61013  >  443 [ACK] Seq=9234 Ack=70050 Win=1019 Len=0"
"166","1.678823","192.168.12.35","146.75.37.140","TCP","54","61013  >  443 [ACK] Seq=9234 Ack=70182 Win=1025 Len=0"
"167","1.678918","192.168.12.35","146.75.37.140","TCP","54","61013  >  443 [ACK] Seq=9234 Ack=70601 Win=1023 Len=0"
"168","1.727660","192.168.12.35","146.75.37.140","TCP","54","61013  >  443 [ACK] Seq=9234 Ack=70746 Win=1022 Len=0"
"169","1.910035","146.75.37.140","192.168.12.35","TLSv1.2","564","Application Data"
"170","1.910035","146.75.37.140","192.168.12.35","TLSv1.2","133","Application Data"
"171","1.910035","146.75.37.140","192.168.12.35","TLSv1.2","399","Application Data"
"172","1.910035","146.75.37.140","192.168.12.35","TLSv1.2","431","Application Data"
"173","1.910035","146.75.37.140","192.168.12.35","TLSv1.2","198","Application Data"
"174","1.910035","146.75.37.140","192.168.12.35","TLSv1.2","115","Application Data"
"175","1.910035","146.75.37.140","192.168.12.35","TLSv1.2","772","Application Data"
"176","1.910035","146.75.37.140","192.168.12.35","TLSv1.2","212","Application Data"
"177","1.910035","146.75.37.140","192.168.12.35","TLSv1.2","96","Application Data"
"178","1.910369","192.168.12.35","146.75.37.140","TCP","54","61013  >  443 [ACK] Seq=9234 Ack=71335 Win=1020 Len=0"
"179","1.910432","192.168.12.35","146.75.37.140","TCP","54","61013  >  443 [ACK] Seq=9234 Ack=72057 Win=1025 Len=0"
"180","1.910455","192.168.12.35","146.75.37.140","TCP","54","61013  >  443 [ACK] Seq=9234 Ack=72262 Win=1024 Len=0"
"181","1.910480","192.168.12.35","146.75.37.140","TCP","54","61013  >  443 [ACK] Seq=9234 Ack=73138 Win=1020 Len=0"
"182","1.919827","146.75.37.140","192.168.12.35","TLSv1.2","405","Application Data"
"183","1.919827","146.75.37.140","192.168.12.35","TLSv1.2","156","Application Data"
"184","1.919827","146.75.37.140","192.168.12.35","TLSv1.2","136","Application Data"
"185","1.919827","146.75.37.140","192.168.12.35","TLSv1.2","869","Application Data"
"186","1.919827","146.75.37.140","192.168.12.35","TLSv1.2","1221","Application Data"
"187","1.919827","146.75.37.140","192.168.12.35","TCP","1430","443  >  61013 [ACK] Seq=75697 Ack=9234 Win=6729 Len=1376 [TCP PDU reassembled in 189]"
"188","1.919827","146.75.37.140","192.168.12.35","TCP","1430","443  >  61013 [PSH, ACK] Seq=77073 Ack=9234 Win=6729 Len=1376 [TCP PDU reassembled in 189]"
"189","1.919827","146.75.37.140","192.168.12.35","TLSv1.2","262","Application Data"
"190","1.919827","146.75.37.140","192.168.12.35","TLSv1.2","298","Application Data"
"191","1.919827","146.75.37.140","192.168.12.35","TLSv1.2","606","Application Data, Application Data, Application Data"
"192","1.919827","146.75.37.140","192.168.12.35","TLSv1.2","234","Application Data"
"193","1.919827","146.75.37.140","192.168.12.35","TLSv1.2","530","Application Data"
"194","1.919827","146.75.37.140","192.168.12.35","TLSv1.2","617","Application Data"
"195","1.919827","146.75.37.140","192.168.12.35","TCP","1430","443  >  61013 [ACK] Seq=80672 Ack=9234 Win=6729 Len=1376 [TCP PDU reassembled in 196]"
"196","1.919827","146.75.37.140","192.168.12.35","TLSv1.2","558","Application Data"
"197","1.919827","146.75.37.140","192.168.12.35","TLSv1.2","363","Application Data"
"198","1.919827","146.75.37.140","192.168.12.35","TLSv1.2","417","Application Data, Application Data, Application Data"
"199","1.920747","192.168.12.35","146.75.37.140","TCP","54","61013  >  443 [ACK] Seq=9234 Ack=73531 Win=1025 Len=0"
"200","1.920945","192.168.12.35","146.75.37.140","TCP","54","61013  >  443 [ACK] Seq=9234 Ack=73715 Win=1024 Len=0"
"201","1.920987","192.168.12.35","146.75.37.140","TCP","54","61013  >  443 [ACK] Seq=9234 Ack=75697 Win=1025 Len=0"
"202","1.921016","192.168.12.35","146.75.37.140","TCP","54","61013  >  443 [ACK] Seq=9234 Ack=78449 Win=1025 Len=0"
"203","1.921085","192.168.12.35","146.75.37.140","TCP","54","61013  >  443 [ACK] Seq=9234 Ack=78901 Win=1023 Len=0"
"204","1.921225","192.168.12.35","146.75.37.140","TCP","54","61013  >  443 [ACK] Seq=9234 Ack=79633 Win=1020 Len=0"
"205","1.921270","192.168.12.35","146.75.37.140","TCP","54","61013  >  443 [ACK] Seq=9234 Ack=80672 Win=1025 Len=0"
"206","1.921305","192.168.12.35","146.75.37.140","TCP","54","61013  >  443 [ACK] Seq=9234 Ack=82552 Win=1025 Len=0"
"207","1.921362","192.168.12.35","146.75.37.140","TCP","54","61013  >  443 [ACK] Seq=9234 Ack=83224 Win=1022 Len=0"
"208","1.944221","146.75.37.140","192.168.12.35","TLSv1.2","488","Application Data"
"209","1.944221","146.75.37.140","192.168.12.35","TLSv1.2","184","Application Data"
"210","1.944221","146.75.37.140","192.168.12.35","TLSv1.2","328","Application Data"
"211","1.944221","146.75.37.140","192.168.12.35","TLSv1.2","798","Application Data"
"212","1.944221","146.75.37.140","192.168.12.35","TLSv1.2","791","Application Data"
"213","1.944221","146.75.37.140","192.168.12.35","TLSv1.2","333","Application Data"
"214","1.944221","146.75.37.140","192.168.12.35","TLSv1.2","193","Application Data"
"215","1.944221","146.75.37.140","192.168.12.35","TLSv1.2","451","Application Data"
"216","1.944835","192.168.12.35","146.75.37.140","TCP","54","61013  >  443 [ACK] Seq=9234 Ack=83788 Win=1020 Len=0"
"217","1.945083","192.168.12.35","146.75.37.140","TCP","54","61013  >  443 [ACK] Seq=9234 Ack=84806 Win=1025 Len=0"
"218","1.945269","192.168.12.35","146.75.37.140","TCP","54","61013  >  443 [ACK] Seq=9234 Ack=85822 Win=1021 Len=0"
"219","1.945387","192.168.12.35","146.75.37.140","TCP","54","61013  >  443 [ACK] Seq=9234 Ack=86358 Win=1025 Len=0"
"220","1.953919","146.75.37.140","192.168.12.35","TLSv1.2","472","Application Data"
"221","1.953919","146.75.37.140","192.168.12.35","TLSv1.2","234","Application Data"
"222","1.953919","146.75.37.140","192.168.12.35","TLSv1.2","296","Application Data"
"223","1.953919","146.75.37.140","192.168.12.35","TLSv1.2","192","Application Data"
"224","1.953919","146.75.37.140","192.168.12.35","TLSv1.2","454","Application Data"
"225","1.953919","146.75.37.140","192.168.12.35","TLSv1.2","471","Application Data"
"226","1.953919","146.75.37.140","192.168.12.35","TLSv1.2","227","Application Data"
"227","1.953919","146.75.37.140","192.168.12.35","TLSv1.2","197","Application Data"
"228","1.953919","146.75.37.140","192.168.12.35","TLSv1.2","247","Application Data"
"229","1.953919","146.75.37.140","192.168.12.35","TLSv1.2","417","Application Data"
"230","1.953919","146.75.37.140","192.168.12.35","TLSv1.2","180","Application Data"
"231","1.953919","146.75.37.140","192.168.12.35","TLSv1.2","343","Application Data"
"232","1.955002","192.168.12.35","146.75.37.140","TCP","54","61013  >  443 [ACK] Seq=9234 Ack=86956 Win=1022 Len=0"
"233","1.955274","192.168.12.35","146.75.37.140","TCP","54","61013  >  443 [ACK] Seq=9234 Ack=87336 Win=1021 Len=0"
"234","1.955367","192.168.12.35","146.75.37.140","TCP","54","61013  >  443 [ACK] Seq=9234 Ack=88153 Win=1025 Len=0"
"235","1.955405","192.168.12.35","146.75.37.140","TCP","54","61013  >  443 [ACK] Seq=9234 Ack=88469 Win=1023 Len=0"
"236","1.955456","192.168.12.35","146.75.37.140","TCP","54","61013  >  443 [ACK] Seq=9234 Ack=89025 Win=1021 Len=0"
"237","1.955531","192.168.12.35","146.75.37.140","TCP","54","61013  >  443 [ACK] Seq=9234 Ack=89440 Win=1020 Len=0"
"238","1.963805","146.75.37.140","192.168.12.35","TLSv1.2","190","Application Data"
"239","1.963805","146.75.37.140","192.168.12.35","TLSv1.2","169","Application Data"
"240","1.964517","192.168.12.35","146.75.37.140","TCP","54","61013  >  443 [ACK] Seq=9234 Ack=89691 Win=1025 Len=0"
"241","1.970320","146.75.37.140","192.168.12.35","TLSv1.2","216","Application Data"
"242","1.970320","146.75.37.140","192.168.12.35","TLSv1.2","249","Application Data"
"243","1.970670","192.168.12.35","146.75.37.140","TCP","54","61013  >  443 [ACK] Seq=9234 Ack=90048 Win=1023 Len=0"
"244","1.976279","146.75.37.140","192.168.12.35","TLSv1.2","754","Application Data"
"245","1.976279","146.75.37.140","192.168.12.35","TLSv1.2","129","Application Data"
"246","1.976743","192.168.12.35","146.75.37.140","TCP","54","61013  >  443 [ACK] Seq=9234 Ack=90823 Win=1020 Len=0"
"247","1.982625","146.75.37.140","192.168.12.35","TLSv1.2","350","Application Data"
"248","1.982625","146.75.37.140","192.168.12.35","TLSv1.2","242","Application Data"
"249","1.982625","146.75.37.140","192.168.12.35","TLSv1.2","243","Application Data"
"250","1.982625","146.75.37.140","192.168.12.35","TLSv1.2","1054","Application Data"
"251","1.982815","192.168.12.35","146.75.37.140","TCP","54","61013  >  443 [ACK] Seq=9234 Ack=91307 Win=1025 Len=0"
"252","1.982901","192.168.12.35","146.75.37.140","TCP","54","61013  >  443 [ACK] Seq=9234 Ack=92496 Win=1020 Len=0"
"253","1.988939","146.75.37.140","192.168.12.35","TLSv1.2","323","Application Data"
"254","1.988939","146.75.37.140","192.168.12.35","TLSv1.2","272","Application Data"
"255","1.988939","146.75.37.140","192.168.12.35","TLSv1.2","105","Application Data"
"256","1.988939","146.75.37.140","192.168.12.35","TLSv1.2","94","Application Data"
"257","1.988939","146.75.37.140","192.168.12.35","TLSv1.2","518","Application Data"
"258","1.988939","146.75.37.140","192.168.12.35","TLSv1.2","659","Application Data"
"259","1.988939","146.75.37.140","192.168.12.35","TLSv1.2","927","Application Data"
"260","1.988939","146.75.37.140","192.168.12.35","TLSv1.2","842","Application Data"
"261","1.988939","146.75.37.140","192.168.12.35","TLSv1.2","480","Application Data"
"262","1.988939","146.75.37.140","192.168.12.35","TLSv1.2","898","Application Data"
"263","1.988939","146.75.37.140","192.168.12.35","TLSv1.2","334","Application Data"
"264","1.988939","146.75.37.140","192.168.12.35","TLSv1.2","128","Application Data"
"265","1.988939","146.75.37.140","192.168.12.35","TLSv1.2","389","Application Data"
"266","1.988939","146.75.37.140","192.168.12.35","TLSv1.2","210","Application Data"
"267","1.988939","146.75.37.140","192.168.12.35","TLSv1.2","383","Application Data"
"268","1.988939","146.75.37.140","192.168.12.35","TLSv1.2","85","Application Data"
"269","1.989485","192.168.12.35","146.75.37.140","TCP","54","61013  >  443 [ACK] Seq=9234 Ack=92983 Win=1025 Len=0"
"270","1.989591","192.168.12.35","146.75.37.140","TCP","54","61013  >  443 [ACK] Seq=9234 Ack=93074 Win=1024 Len=0"
"271","1.989650","192.168.12.35","146.75.37.140","TCP","54","61013  >  443 [ACK] Seq=9234 Ack=94143 Win=1020 Len=0"
"272","1.989699","192.168.12.35","146.75.37.140","TCP","54","61013  >  443 [ACK] Seq=9234 Ack=95804 Win=1025 Len=0"
"273","1.989725","192.168.12.35","146.75.37.140","TCP","54","61013  >  443 [ACK] Seq=9234 Ack=97074 Win=1020 Len=0"
"274","1.989757","192.168.12.35","146.75.37.140","TCP","54","61013  >  443 [ACK] Seq=9234 Ack=97428 Win=1025 Len=0"
"275","1.989787","192.168.12.35","146.75.37.140","TCP","54","61013  >  443 [ACK] Seq=9234 Ack=97919 Win=1023 Len=0"
"276","1.989824","192.168.12.35","146.75.37.140","TCP","54","61013  >  443 [ACK] Seq=9234 Ack=98279 Win=1021 Len=0"
"277","2.018379","192.168.12.35","146.75.37.140","TLSv1.2","3185","Application Data"
"278","2.018689","192.168.12.35","146.75.37.140","TLSv1.2","718","Application Data"
"279","2.018780","192.168.12.35","146.75.37.140","TLSv1.2","3189","Application Data"
"280","2.029712","192.168.12.35","146.75.37.140","TLSv1.2","3198","Application Data"
"281","2.058059","146.75.37.140","192.168.12.35","TCP","54","443  >  61013 [ACK] Seq=98279 Ack=10630 Win=6734 Len=0"
"282","2.069769","146.75.37.140","192.168.12.35","TCP","54","443  >  61013 [ACK] Seq=98279 Ack=12026 Win=6740 Len=0"
"283","2.079201","192.168.12.35","146.75.37.140","TLSv1.2","3176","Application Data"
"284","2.079286","192.168.12.35","146.75.37.140","TLSv1.2","210","Application Data"
"285","2.082652","146.75.37.140","192.168.12.35","TCP","54","443  >  61013 [ACK] Seq=98279 Ack=12365 Win=6740 Len=0"
"286","2.092610","146.75.37.140","192.168.12.35","TCP","54","443  >  61013 [ACK] Seq=98279 Ack=13029 Win=6740 Len=0"
"287","2.102675","146.75.37.140","192.168.12.35","TCP","54","443  >  61013 [ACK] Seq=98279 Ack=14425 Win=6745 Len=0"
"288","2.112884","146.75.37.140","192.168.12.35","TCP","54","443  >  61013 [ACK] Seq=98279 Ack=15821 Win=6751 Len=0"
"289","2.123659","192.168.12.35","146.75.37.140","TLSv1.2","3289","Application Data"
"290","2.126564","146.75.37.140","192.168.12.35","TCP","1430","443  >  61013 [ACK] Seq=98279 Ack=15821 Win=6751 Len=1376 [TCP PDU reassembled in 291]"
"291","2.126564","146.75.37.140","192.168.12.35","TLSv1.2","782","Application Data"
"292","2.126564","146.75.37.140","192.168.12.35","TCP","54","443  >  61013 [ACK] Seq=100383 Ack=16164 Win=6751 Len=0"
"293","2.126760","192.168.12.35","146.75.37.140","TCP","54","61013  >  443 [ACK] Seq=25821 Ack=100383 Win=1025 Len=0"
"294","2.129344","192.168.12.35","146.75.37.140","TLSv1.2","3196","Application Data"
"295","2.129428","192.168.12.35","146.75.37.140","TLSv1.2","3211","Application Data"
"296","2.129468","192.168.12.35","146.75.37.140","TLSv1.2","3188","Application Data"
"297","2.133483","146.75.37.140","192.168.12.35","TCP","54","443  >  61013 [ACK] Seq=100383 Ack=17560 Win=6756 Len=0"
"298","2.153208","146.75.37.140","192.168.12.35","TCP","54","443  >  61013 [ACK] Seq=100383 Ack=18956 Win=6761 Len=0"
"299","2.153208","146.75.37.140","192.168.12.35","TCP","54","443  >  61013 [ACK] Seq=100383 Ack=19308 Win=6761 Len=0"
"300","2.178539","146.75.37.140","192.168.12.35","TCP","1430","443  >  61013 [ACK] Seq=100383 Ack=19308 Win=6761 Len=1376 [TCP PDU reassembled in 301]"
"301","2.178539","146.75.37.140","192.168.12.35","TLSv1.2","545","Application Data"
"302","2.178539","146.75.37.140","192.168.12.35","TLSv1.2","100","Application Data"
"303","2.178782","192.168.12.35","146.75.37.140","TCP","54","61013  >  443 [ACK] Seq=35254 Ack=102250 Win=1025 Len=0"
"304","2.198363","146.75.37.140","192.168.12.35","TCP","54","443  >  61013 [ACK] Seq=102296 Ack=20704 Win=6767 Len=0"
"305","2.198363","146.75.37.140","192.168.12.35","TCP","1430","443  >  61013 [ACK] Seq=102296 Ack=20704 Win=6767 Len=1376 [TCP PDU reassembled in 306]"
"306","2.198363","146.75.37.140","192.168.12.35","TLSv1.2","809","Application Data"
"307","2.198669","192.168.12.35","146.75.37.140","TCP","54","61013  >  443 [ACK] Seq=35254 Ack=103672 Win=1025 Len=0"
"308","2.208087","146.75.37.140","192.168.12.35","TCP","54","443  >  61013 [ACK] Seq=104427 Ack=22100 Win=6772 Len=0"
"309","2.213628","146.75.37.140","192.168.12.35","TCP","54","443  >  61013 [ACK] Seq=104427 Ack=22430 Win=6772 Len=0"
"310","2.213628","146.75.37.140","192.168.12.35","TCP","54","443  >  61013 [ACK] Seq=104427 Ack=22586 Win=6772 Len=0"
"311","2.229101","192.168.12.35","146.75.37.140","TLSv1.2","215","Application Data"
"312","2.229173","192.168.12.35","146.75.37.140","TLSv1.2","93","Application Data"
"313","2.229191","192.168.12.35","146.75.37.140","TLSv1.2","215","Application Data"
"314","2.229213","192.168.12.35","146.75.37.140","TLSv1.2","215","Application Data"
"315","2.235903","192.168.12.35","146.75.37.140","TLSv1.2","3140","Application Data"
"316","2.243002","146.75.37.140","192.168.12.35","TCP","54","443  >  61013 [ACK] Seq=104427 Ack=23982 Win=6778 Len=0"
"317","2.243002","146.75.37.140","192.168.12.35","TLSv1.2","604","Application Data"
"318","2.262638","146.75.37.140","192.168.12.35","TCP","54","443  >  61013 [ACK] Seq=104977 Ack=25821 Win=6783 Len=0"
"319","2.282621","146.75.37.140","192.168.12.35","TCP","54","443  >  61013 [ACK] Seq=104977 Ack=27217 Win=6789 Len=0"
"320","2.287549","146.75.37.140","192.168.12.35","TCP","54","443  >  61013 [ACK] Seq=104977 Ack=28613 Win=6794 Len=0"
"321","2.287888","192.168.12.35","146.75.37.140","TCP","54","61013  >  443 [ACK] Seq=38340 Ack=104977 Win=1020 Len=0"
"322","2.293033","146.75.37.140","192.168.12.35","TCP","54","443  >  61013 [ACK] Seq=104977 Ack=28963 Win=6794 Len=0"
"323","2.293033","146.75.37.140","192.168.12.35","TCP","1430","443  >  61013 [ACK] Seq=104977 Ack=28963 Win=6794 Len=1376 [TCP PDU reassembled in 324]"
"324","2.293033","146.75.37.140","192.168.12.35","TLSv1.2","542","Application Data"
"325","2.293033","146.75.37.140","192.168.12.35","TLSv1.2","100","Application Data"
"326","2.293170","192.168.12.35","146.75.37.140","TCP","54","61013  >  443 [ACK] Seq=38340 Ack=106353 Win=1025 Len=0"
"327","2.293244","192.168.12.35","146.75.37.140","TCP","54","61013  >  443 [ACK] Seq=38340 Ack=106841 Win=1023 Len=0"
"328","2.312698","146.75.37.140","192.168.12.35","TCP","54","443  >  61013 [ACK] Seq=106887 Ack=30359 Win=6800 Len=0"
"329","2.321999","146.75.37.140","192.168.12.35","TCP","1430","443  >  61013 [ACK] Seq=106887 Ack=30359 Win=6800 Len=1376 [TCP PDU reassembled in 330]"
"330","2.321999","146.75.37.140","192.168.12.35","TLSv1.2","817","Application Data"
"331","2.322214","192.168.12.35","146.75.37.140","TCP","54","61013  >  443 [ACK] Seq=38340 Ack=108263 Win=1025 Len=0"
"332","2.327784","146.75.37.140","192.168.12.35","TCP","54","443  >  61013 [ACK] Seq=109026 Ack=31755 Win=6805 Len=0"
"333","2.332660","146.75.37.140","192.168.12.35","TCP","54","443  >  61013 [ACK] Seq=109026 Ack=32120 Win=6805 Len=0"
"334","2.352650","146.75.37.140","192.168.12.35","TCP","54","443  >  61013 [ACK] Seq=109026 Ack=33516 Win=6811 Len=0"
"335","2.363090","146.75.37.140","192.168.12.35","TCP","54","443  >  61013 [ACK] Seq=109026 Ack=34912 Win=6816 Len=0"
"336","2.365809","192.168.12.35","146.75.37.140","TCP","54","61013  >  443 [ACK] Seq=38340 Ack=109026 Win=1022 Len=0"
"337","2.370080","146.75.37.140","192.168.12.35","TCP","1430","443  >  61013 [ACK] Seq=109026 Ack=34912 Win=6816 Len=1376 [TCP PDU reassembled in 338]"
"338","2.370080","146.75.37.140","192.168.12.35","TLSv1.2","542","Application Data"
"339","2.370080","146.75.37.140","192.168.12.35","TCP","54","443  >  61013 [ACK] Seq=110890 Ack=35254 Win=6816 Len=0"
"340","2.370254","192.168.12.35","146.75.37.140","TCP","54","61013  >  443 [ACK] Seq=38340 Ack=110890 Win=1025 Len=0"
"341","2.393670","146.75.37.140","192.168.12.35","TCP","54","443  >  61034 [ACK] Seq=1 Ack=162 Win=424 Len=0"
"342","2.393670","146.75.37.140","192.168.12.35","TCP","54","443  >  61034 [ACK] Seq=1 Ack=201 Win=424 Len=0"
"343","2.393670","146.75.37.140","192.168.12.35","TLSv1.2","93","Application Data"
"344","2.393670","146.75.37.140","192.168.12.35","TLSv1.2","183","Application Data"
"345","2.393670","146.75.37.140","192.168.12.35","TCP","1430","443  >  61034 [ACK] Seq=169 Ack=201 Win=424 Len=1376 [TCP PDU reassembled in 356]"
"346","2.393670","146.75.37.140","192.168.12.35","TCP","1430","443  >  61034 [ACK] Seq=1545 Ack=201 Win=424 Len=1376 [TCP PDU reassembled in 356]"
"347","2.393670","146.75.37.140","192.168.12.35","TCP","1430","443  >  61034 [ACK] Seq=2921 Ack=201 Win=424 Len=1376 [TCP PDU reassembled in 356]"
"348","2.393670","146.75.37.140","192.168.12.35","TCP","1430","443  >  61034 [ACK] Seq=4297 Ack=201 Win=424 Len=1376 [TCP PDU reassembled in 356]"
"349","2.393670","146.75.37.140","192.168.12.35","TCP","1430","443  >  61034 [ACK] Seq=5673 Ack=201 Win=424 Len=1376 [TCP PDU reassembled in 356]"
"350","2.393670","146.75.37.140","192.168.12.35","TCP","1430","443  >  61034 [ACK] Seq=7049 Ack=201 Win=424 Len=1376 [TCP PDU reassembled in 356]"
"351","2.393670","146.75.37.140","192.168.12.35","TCP","1430","443  >  61034 [ACK] Seq=8425 Ack=201 Win=424 Len=1376 [TCP PDU reassembled in 356]"
"352","2.393670","146.75.37.140","192.168.12.35","TCP","1430","443  >  61034 [ACK] Seq=9801 Ack=201 Win=424 Len=1376 [TCP PDU reassembled in 356]"
"353","2.393670","146.75.37.140","192.168.12.35","TCP","1430","443  >  61034 [ACK] Seq=11177 Ack=201 Win=424 Len=1376 [TCP PDU reassembled in 356]"
"354","2.393670","146.75.37.140","192.168.12.35","TCP","1430","443  >  61034 [ACK] Seq=12553 Ack=201 Win=424 Len=1376 [TCP PDU reassembled in 356]"
"355","2.393670","146.75.37.140","192.168.12.35","TCP","1430","443  >  61034 [ACK] Seq=13929 Ack=201 Win=424 Len=1376 [TCP PDU reassembled in 356]"
"356","2.393670","146.75.37.140","192.168.12.35","TLSv1.2","1355","Application Data, Application Data"
"357","2.393670","146.75.37.140","192.168.12.35","TCP","1430","443  >  61034 [ACK] Seq=16606 Ack=201 Win=424 Len=1376 [TCP PDU reassembled in 368]"
"358","2.393670","146.75.37.140","192.168.12.35","TCP","1430","443  >  61034 [ACK] Seq=17982 Ack=201 Win=424 Len=1376 [TCP PDU reassembled in 368]"
"359","2.393670","146.75.37.140","192.168.12.35","TCP","1430","443  >  61034 [ACK] Seq=19358 Ack=201 Win=424 Len=1376 [TCP PDU reassembled in 368]"
"360","2.393670","146.75.37.140","192.168.12.35","TCP","1430","443  >  61034 [ACK] Seq=20734 Ack=201 Win=424 Len=1376 [TCP PDU reassembled in 368]"
"361","2.393670","146.75.37.140","192.168.12.35","TCP","1430","443  >  61034 [ACK] Seq=22110 Ack=201 Win=424 Len=1376 [TCP PDU reassembled in 368]"
"362","2.393670","146.75.37.140","192.168.12.35","TCP","1430","443  >  61034 [ACK] Seq=23486 Ack=201 Win=424 Len=1376 [TCP PDU reassembled in 368]"
"363","2.393670","146.75.37.140","192.168.12.35","TCP","1430","443  >  61034 [ACK] Seq=24862 Ack=201 Win=424 Len=1376 [TCP PDU reassembled in 368]"
"364","2.393670","146.75.37.140","192.168.12.35","TCP","1430","443  >  61034 [ACK] Seq=26238 Ack=201 Win=424 Len=1376 [TCP PDU reassembled in 368]"
"365","2.393670","146.75.37.140","192.168.12.35","TCP","1430","443  >  61034 [ACK] Seq=27614 Ack=201 Win=424 Len=1376 [TCP PDU reassembled in 368]"
"366","2.393670","146.75.37.140","192.168.12.35","TCP","1430","443  >  61034 [ACK] Seq=28990 Ack=201 Win=424 Len=1376 [TCP PDU reassembled in 368]"
"367","2.393670","146.75.37.140","192.168.12.35","TCP","1430","443  >  61034 [ACK] Seq=30366 Ack=201 Win=424 Len=1376 [TCP PDU reassembled in 368]"
"368","2.393670","146.75.37.140","192.168.12.35","TLSv1.2","1430","Application Data"
"369","2.393670","146.75.37.140","192.168.12.35","TCP","1430","443  >  61034 [ACK] Seq=33118 Ack=201 Win=424 Len=1376 [TCP PDU reassembled in 389]"
"370","2.393670","146.75.37.140","192.168.12.35","TCP","1430","443  >  61034 [PSH, ACK] Seq=34494 Ack=201 Win=424 Len=1376 [TCP PDU reassembled in 389]"
"371","2.393670","146.75.37.140","192.168.12.35","TCP","1430","443  >  61013 [ACK] Seq=110890 Ack=35254 Win=6816 Len=1376 [TCP PDU reassembled in 372]"
