"No.","Time","Source","Destination","Protocol","Length","Info"
"1","0.000000","192.168.12.35","146.75.37.140","TCP","55","61140  >  443 [ACK] Seq=1 Ack=1 Win=4099 Len=1"
"2","0.171226","192.168.12.35","146.75.37.140","TCP","55","61034  >  443 [ACK] Seq=1 Ack=1 Win=8196 Len=1 [TCP PDU reassembled in 595]"
"3","0.674153","146.75.37.140","192.168.12.35","TCP","66","443  >  61140 [ACK] Seq=1 Ack=2 Win=424 Len=0 SLE=1 SRE=2"
"4","0.674153","146.75.37.140","192.168.12.35","TCP","66","443  >  61034 [ACK] Seq=1 Ack=2 Win=424 Len=0 SLE=1 SRE=2"
"5","1.059169","192.168.12.35","146.75.37.140","TLSv1.2","3242","Application Data"
"6","1.059263","192.168.12.35","146.75.37.140","TLSv1.2","93","Application Data"
"7","1.059295","192.168.12.35","146.75.37.140","TLSv1.2","3361","Application Data"
"8","1.059332","192.168.12.35","146.75.37.140","TLSv1.2","1327","Application Data"
"9","1.143758","146.75.37.140","192.168.12.35","TCP","54","443  >  61013 [ACK] Seq=1 Ack=1397 Win=8244 Len=0"
"10","1.143758","146.75.37.140","192.168.12.35","TCP","54","443  >  61013 [ACK] Seq=1 Ack=2793 Win=8244 Len=0"
"11","1.143758","146.75.37.140","192.168.12.35","TCP","54","443  >  61013 [ACK] Seq=1 Ack=3189 Win=8244 Len=0"
"12","1.143758","146.75.37.140","192.168.12.35","TCP","54","443  >  61013 [ACK] Seq=1 Ack=3228 Win=8244 Len=0"
"13","1.143758","146.75.37.140","192.168.12.35","TLSv1.2","93","Application Data"
"14","1.146321","146.75.37.140","192.168.12.35","TCP","54","443  >  61013 [ACK] Seq=40 Ack=4624 Win=8244 Len=0"
"15","1.151237","146.75.37.140","192.168.12.35","TCP","54","443  >  61013 [ACK] Seq=40 Ack=6020 Win=8244 Len=0"
"16","1.156225","146.75.37.140","192.168.12.35","TCP","54","443  >  61013 [ACK] Seq=40 Ack=6535 Win=8244 Len=0"
"17","1.166795","146.75.37.140","192.168.12.35","TCP","54","443  >  61013 [ACK] Seq=40 Ack=7808 Win=8244 Len=0"
"18","1.185412","192.168.12.35","146.75.37.140","TCP","54","61013  >  443 [ACK] Seq=7808 Ack=40 Win=1024 Len=0"
"19","1.210209","146.75.37.140","192.168.12.35","TCP","1430","443  >  61013 [ACK] Seq=40 Ack=7808 Win=8244 Len=1376 [TCP PDU reassembled in 20]"
"20","1.210209","146.75.37.140","192.168.12.35","TLSv1.2","931","Application Data"
"21","1.210406","146.75.37.140","192.168.12.35","TCP","1430","443  >  61013 [ACK] Seq=2293 Ack=7808 Win=8244 Len=1376 [TCP PDU reassembled in 22]"
"22","1.210406","146.75.37.140","192.168.12.35","TLSv1.2","1072","Application Data"
"23","1.210527","192.168.12.35","146.75.37.140","TCP","54","61013  >  443 [ACK] Seq=7808 Ack=2293 Win=1025 Len=0"
"24","1.210593","192.168.12.35","146.75.37.140","TCP","54","61013  >  443 [ACK] Seq=7808 Ack=4687 Win=1025 Len=0"
"25","1.216636","192.168.12.35","146.75.37.140","TLSv1.2","89","Application Data"
"26","1.224441","146.75.37.140","192.168.12.35","TCP","1430","443  >  61013 [ACK] Seq=4687 Ack=7808 Win=8244 Len=1376 [TCP PDU reassembled in 38]"
"27","1.224441","146.75.37.140","192.168.12.35","TCP","1430","443  >  61013 [ACK] Seq=6063 Ack=7808 Win=8244 Len=1376 [TCP PDU reassembled in 38]"
"28","1.224441","146.75.37.140","192.168.12.35","TCP","1430","443  >  61013 [PSH, ACK] Seq=7439 Ack=7808 Win=8244 Len=1376 [TCP PDU reassembled in 38]"
"29","1.224441","146.75.37.140","192.168.12.35","TCP","1430","443  >  61013 [ACK] Seq=8815 Ack=7808 Win=8244 Len=1376 [TCP PDU reassembled in 38]"
"30","1.224441","146.75.37.140","192.168.12.35","TCP","1430","443  >  61013 [ACK] Seq=10191 Ack=7808 Win=8244 Len=1376 [TCP PDU reassembled in 38]"
"31","1.224441","146.75.37.140","192.168.12.35","TCP","1430","443  >  61013 [PSH, ACK] Seq=11567 Ack=7808 Win=8244 Len=1376 [TCP PDU reassembled in 38]"
"32","1.224847","146.75.37.140","192.168.12.35","TCP","1430","443  >  61013 [ACK] Seq=12943 Ack=7808 Win=8244 Len=1376 [TCP PDU reassembled in 38]"
"33","1.224847","146.75.37.140","192.168.12.35","TCP","1430","443  >  61013 [ACK] Seq=14319 Ack=7808 Win=8244 Len=1376 [TCP PDU reassembled in 38]"
"34","1.224847","146.75.37.140","192.168.12.35","TCP","1430","443  >  61013 [PSH, ACK] Seq=15695 Ack=7808 Win=8244 Len=1376 [TCP PDU reassembled in 38]"
"35","1.224847","146.75.37.140","192.168.12.35","TCP","1430","443  >  61013 [ACK] Seq=17071 Ack=7808 Win=8244 Len=1376 [TCP PDU reassembled in 38]"
"36","1.225172","192.168.12.35","146.75.37.140","TCP","54","61013  >  443 [ACK] Seq=7843 Ack=12943 Win=1025 Len=0"
"37","1.225355","192.168.12.35","146.75.37.140","TCP","54","61013  >  443 [ACK] Seq=7843 Ack=18447 Win=1025 Len=0"
"38","1.231352","146.75.37.140","192.168.12.35","TLSv1.2","346","Application Data"
"39","1.231352","146.75.37.140","192.168.12.35","TLSv1.2","867","Application Data"
"40","1.232774","192.168.12.35","146.75.37.140","TCP","54","61013  >  443 [ACK] Seq=7843 Ack=19552 Win=1020 Len=0"
"41","1.233841","146.75.37.140","192.168.12.35","TLSv1.2","90","Application Data"
"42","1.235445","146.75.37.140","192.168.12.35","TCP","1430","443  >  61013 [ACK] Seq=19588 Ack=7808 Win=8244 Len=1376 [TCP PDU reassembled in 55]"
"43","1.235445","146.75.37.140","192.168.12.35","TCP","1430","443  >  61013 [ACK] Seq=20964 Ack=7808 Win=8244 Len=1376 [TCP PDU reassembled in 55]"
"44","1.235445","146.75.37.140","192.168.12.35","TCP","1430","443  >  61013 [PSH, ACK] Seq=22340 Ack=7808 Win=8244 Len=1376 [TCP PDU reassembled in 55]"
"45","1.235582","146.75.37.140","192.168.12.35","TCP","1430","443  >  61013 [ACK] Seq=23716 Ack=7808 Win=8244 Len=1376 [TCP PDU reassembled in 55]"
"46","1.235582","146.75.37.140","192.168.12.35","TCP","1430","443  >  61013 [ACK] Seq=25092 Ack=7808 Win=8244 Len=1376 [TCP PDU reassembled in 55]"
"47","1.235582","146.75.37.140","192.168.12.35","TCP","1430","443  >  61013 [PSH, ACK] Seq=26468 Ack=7808 Win=8244 Len=1376 [TCP PDU reassembled in 55]"
"48","1.235582","146.75.37.140","192.168.12.35","TCP","1430","443  >  61013 [ACK] Seq=27844 Ack=7808 Win=8244 Len=1376 [TCP PDU reassembled in 55]"
"49","1.235582","146.75.37.140","192.168.12.35","TCP","1430","443  >  61013 [ACK] Seq=29220 Ack=7808 Win=8244 Len=1376 [TCP PDU reassembled in 55]"
"50","1.235582","146.75.37.140","192.168.12.35","TCP","1430","443  >  61013 [PSH, ACK] Seq=30596 Ack=7808 Win=8244 Len=1376 [TCP PDU reassembled in 55]"
"51","1.235696","192.168.12.35","146.75.37.140","TCP","54","61013  >  443 [ACK] Seq=7843 Ack=23716 Win=1025 Len=0"
"52","1.235966","192.168.12.35","146.75.37.140","TCP","54","61013  >  443 [ACK] Seq=7843 Ack=31972 Win=1025 Len=0"
"53","1.237360","146.75.37.140","192.168.12.35","TCP","1430","443  >  61013 [ACK] Seq=31972 Ack=7808 Win=8244 Len=1376 [TCP PDU reassembled in 55]"
"54","1.237360","146.75.37.140","192.168.12.35","TCP","1430","443  >  61013 [ACK] Seq=33348 Ack=7808 Win=8244 Len=1376 [TCP PDU reassembled in 55]"
"55","1.237360","146.75.37.140","192.168.12.35","TLSv1.2","546","Application Data"
"56","1.238064","192.168.12.35","146.75.37.140","TCP","54","61013  >  443 [ACK] Seq=7843 Ack=34724 Win=1025 Len=0"
"57","1.241822","146.75.37.140","192.168.12.35","TCP","1430","443  >  61013 [ACK] Seq=35216 Ack=7808 Win=8244 Len=1376 [TCP PDU reassembled in 68]"
"58","1.241822","146.75.37.140","192.168.12.35","TCP","1430","443  >  61013 [ACK] Seq=36592 Ack=7808 Win=8244 Len=1376 [TCP PDU reassembled in 68]"
"59","1.241822","146.75.37.140","192.168.12.35","TCP","1430","443  >  61013 [PSH, ACK] Seq=37968 Ack=7808 Win=8244 Len=1376 [TCP PDU reassembled in 68]"
"60","1.241822","146.75.37.140","192.168.12.35","TCP","1430","443  >  61013 [ACK] Seq=39344 Ack=7808 Win=8244 Len=1376 [TCP PDU reassembled in 68]"
"61","1.241822","146.75.37.140","192.168.12.35","TCP","1430","443  >  61013 [ACK] Seq=40720 Ack=7808 Win=8244 Len=1376 [TCP PDU reassembled in 68]"
"62","1.241822","146.75.37.140","192.168.12.35","TCP","1430","443  >  61013 [PSH, ACK] Seq=42096 Ack=7808 Win=8244 Len=1376 [TCP PDU reassembled in 68]"
"63","1.242350","146.75.37.140","192.168.12.35","TCP","1430","443  >  61013 [ACK] Seq=43472 Ack=7808 Win=8244 Len=1376 [TCP PDU reassembled in 68]"
"64","1.242350","146.75.37.140","192.168.12.35","TCP","1430","443  >  61013 [ACK] Seq=44848 Ack=7808 Win=8244 Len=1376 [TCP PDU reassembled in 68]"
"65","1.242350","146.75.37.140","192.168.12.35","TCP","1430","443  >  61013 [PSH, ACK] Seq=46224 Ack=7808 Win=8244 Len=1376 [TCP PDU reassembled in 68]"
"66","1.242350","146.75.37.140","192.168.12.35","TCP","1430","443  >  61013 [ACK] Seq=47600 Ack=7808 Win=8244 Len=1376 [TCP PDU reassembled in 68]"
"67","1.242768","146.75.37.140","192.168.12.35","TCP","1430","443  >  61013 [ACK] Seq=48976 Ack=7808 Win=8244 Len=1376 [TCP PDU reassembled in 68]"
"68","1.242768","146.75.37.140","192.168.12.35","TLSv1.2","1386","Application Data, Application Data, Application Data"
"69","1.242768","146.75.37.140","192.168.12.35","TCP","1430","443  >  61013 [ACK] Seq=51684 Ack=7808 Win=8244 Len=1376 [TCP PDU reassembled in 70]"
"70","1.242768","146.75.37.140","192.168.12.35","TLSv1.2","1002","Application Data"
"71","1.242880","192.168.12.35","146.75.37.140","TCP","54","61013  >  443 [ACK] Seq=7843 Ack=43472 Win=1025 Len=0"
"72","1.243009","192.168.12.35","146.75.37.140","TCP","54","61013  >  443 [ACK] Seq=7843 Ack=48976 Win=1025 Len=0"
"73","1.243321","192.168.12.35","146.75.37.140","TCP","54","61013  >  443 [ACK] Seq=7843 Ack=50352 Win=1019 Len=0"
"74","1.243365","192.168.12.35","146.75.37.140","TCP","54","61013  >  443 [ACK] Seq=7843 Ack=51684 Win=1025 Len=0"
"75","1.243414","192.168.12.35","146.75.37.140","TCP","54","61013  >  443 [ACK] Seq=7843 Ack=53060 Win=1019 Len=0"
"76","1.243459","192.168.12.35","146.75.37.140","TCP","54","61013  >  443 [ACK] Seq=7843 Ack=54008 Win=1025 Len=0"
"77","1.259598","146.75.37.140","192.168.12.35","TLSv1.2","1049","Application Data"
"78","1.260806","192.168.12.35","146.75.37.140","TCP","54","61013  >  443 [ACK] Seq=7843 Ack=55003 Win=1021 Len=0"
"79","1.263124","192.168.12.35","146.75.37.140","UDP","96","52870  >  443 Len=54"
"80","1.270016","146.75.37.140","192.168.12.35","TCP","1430","443  >  61013 [ACK] Seq=55003 Ack=7808 Win=8244 Len=1376 [TCP PDU reassembled in 82]"
"81","1.270016","146.75.37.140","192.168.12.35","TCP","1430","443  >  61013 [ACK] Seq=56379 Ack=7808 Win=8244 Len=1376 [TCP PDU reassembled in 82]"
"82","1.270016","146.75.37.140","192.168.12.35","TLSv1.2","1036","Application Data"
"83","1.270395","192.168.12.35","146.75.37.140","TCP","54","61013  >  443 [ACK] Seq=7843 Ack=57755 Win=1025 Len=0"
"84","1.300748","146.75.37.140","192.168.12.35","TLSv1.2","841","Application Data"
"85","1.301302","146.75.37.140","192.168.12.35","TLSv1.2","112","Application Data"
"86","1.301694","192.168.12.35","146.75.37.140","TCP","54","61013  >  443 [ACK] Seq=7843 Ack=59524 Win=1025 Len=0"
"87","1.308144","146.75.37.140","192.168.12.35","TLSv1.2","117","Application Data"
"88","1.308144","146.75.37.140","192.168.12.35","TLSv1.2","181","Application Data"
"89","1.308144","146.75.37.140","192.168.12.35","TLSv1.2","186","Application Data"
"90","1.308144","146.75.37.140","192.168.12.35","TLSv1.2","729","Application Data"
"91","1.308144","146.75.37.140","192.168.12.35","TCP","1430","443  >  61013 [ACK] Seq=60579 Ack=7808 Win=8244 Len=1376 [TCP PDU reassembled in 92]"
"92","1.308144","146.75.37.140","192.168.12.35","TLSv1.2","311","Application Data"
"93","1.308144","146.75.37.140","192.168.12.35","TLSv1.2","769","Application Data"
"94","1.308834","192.168.12.35","146.75.37.140","TCP","54","61013  >  443 [ACK] Seq=7843 Ack=59645 Win=1024 Len=0"
"95","1.309175","192.168.12.35","146.75.37.140","TCP","54","61013  >  443 [ACK] Seq=7843 Ack=59904 Win=1023 Len=0"
"96","1.309404","192.168.12.35","146.75.37.140","TCP","54","61013  >  443 [ACK] Seq=7843 Ack=61955 Win=1025 Len=0"
"97","1.309451","192.168.12.35","146.75.37.140","TCP","54","61013  >  443 [ACK] Seq=7843 Ack=62927 Win=1021 Len=0"
"98","1.313522","146.75.37.140","192.168.12.35","TLSv1.2","97","Application Data"
"99","1.313522","146.75.37.140","192.168.12.35","TLSv1.2","213","Application Data"
"100","1.313819","192.168.12.35","146.75.37.140","TCP","54","61013  >  443 [ACK] Seq=7843 Ack=63129 Win=1020 Len=0"
"101","1.318550","146.75.37.140","192.168.12.35","TLSv1.2","476","Application Data"
"102","1.318550","146.75.37.140","192.168.12.35","TLSv1.2","118","Application Data"
"103","1.318550","146.75.37.140","192.168.12.35","TLSv1.2","153","Application Data"
"104","1.318704","146.75.37.140","192.168.12.35","TLSv1.2","94","Application Data"
"105","1.318704","146.75.37.140","192.168.12.35","TLSv1.2","810","Application Data"
"106","1.318708","192.168.12.35","146.75.37.140","TCP","54","61013  >  443 [ACK] Seq=7843 Ack=63551 Win=1025 Len=0"
"107","1.318704","146.75.37.140","192.168.12.35","TLSv1.2","579","Application Data"
"108","1.318827","192.168.12.35","146.75.37.140","TCP","54","61013  >  443 [ACK] Seq=7843 Ack=63615 Win=1024 Len=0"
"109","1.318985","192.168.12.35","146.75.37.140","TCP","54","61013  >  443 [ACK] Seq=7843 Ack=63754 Win=1024 Len=0"
"110","1.319043","192.168.12.35","146.75.37.140","TCP","54","61013  >  443 [ACK] Seq=7843 Ack=65035 Win=1025 Len=0"
"111","1.321971","146.75.37.140","192.168.12.35","TLSv1.2","167","Application Data"
"112","1.322064","146.75.37.140","192.168.12.35","TLSv1.2","320","Application Data"
"113","1.322064","146.75.37.140","192.168.12.35","TLSv1.2","100","Application Data"
"114","1.322122","192.168.12.35","146.75.37.140","TCP","54","61013  >  443 [ACK] Seq=7843 Ack=65414 Win=1023 Len=0"
"115","1.322138","146.75.37.140","192.168.12.35","TLSv1.2","927","Application Data"
"116","1.322138","146.75.37.140","192.168.12.35","TLSv1.2","137","Application Data"
"117","1.322138","146.75.37.140","192.168.12.35","TLSv1.2","214","Application Data"
"118","1.322138","146.75.37.140","192.168.12.35","TLSv1.2","107","Application Data"
"119","1.322199","192.168.12.35","146.75.37.140","TCP","54","61013  >  443 [ACK] Seq=7843 Ack=66333 Win=1020 Len=0"
"120","1.322226","192.168.12.35","146.75.37.140","TCP","54","61013  >  443 [ACK] Seq=7843 Ack=66576 Win=1025 Len=0"
"121","1.322224","146.75.37.140","192.168.12.35","TLSv1.2","168","Application Data"
"122","1.322294","146.75.37.140","192.168.12.35","TLSv1.2","143","Application Data"
"123","1.322294","146.75.37.140","192.168.12.35","TLSv1.2","99","Application Data"
"124","1.322330","192.168.12.35","146.75.37.140","TCP","54","61013  >  443 [ACK] Seq=7843 Ack=66743 Win=1024 Len=0"
"125","1.322413","192.168.12.35","146.75.37.140","TCP","54","61013  >  443 [ACK] Seq=7843 Ack=66877 Win=1024 Len=0"
"126","1.335214","146.75.37.140","192.168.12.35","TCP","1430","443  >  61013 [ACK] Seq=66877 Ack=7808 Win=8244 Len=1376 [TCP PDU reassembled in 127]"
"127","1.335214","146.75.37.140","192.168.12.35","TLSv1.2","482","Application Data"
"128","1.335714","192.168.12.35","146.75.37.140","TCP","54","61013  >  443 [ACK] Seq=7843 Ack=68253 Win=1025 Len=0"
"129","1.335810","192.168.12.35","146.75.37.140","TCP","54","61013  >  443 [ACK] Seq=7843 Ack=68681 Win=1023 Len=0"
"130","1.353398","146.75.37.140","192.168.12.35","TCP","54","443  >  61013 [ACK] Seq=68681 Ack=7843 Win=8244 Len=0"
"131","1.354293","146.75.37.140","192.168.12.35","TLSv1.2","94","Application Data"
"132","1.354293","146.75.37.140","192.168.12.35","TLSv1.2","129","Application Data"
"133","1.354732","192.168.12.35","146.75.37.140","TCP","54","61013  >  443 [ACK] Seq=7843 Ack=68796 Win=1023 Len=0"
"134","1.363613","146.75.37.140","192.168.12.35","TLSv1.2","311","Application Data"
"135","1.363613","146.75.37.140","192.168.12.35","TLSv1.2","113","Application Data"
"136","1.364252","146.75.37.140","192.168.12.35","TLSv1.2","302","Application Data"
"137","1.364252","146.75.37.140","192.168.12.35","TLSv1.2","104","Application Data"
"138","1.364411","192.168.12.35","146.75.37.140","TCP","54","61013  >  443 [ACK] Seq=7843 Ack=69112 Win=1021 Len=0"
"139","1.364941","192.168.12.35","146.75.37.140","TCP","54","61013  >  443 [ACK] Seq=7843 Ack=69410 Win=1020 Len=0"
"140","1.371819","146.75.37.140","192.168.12.35","TLSv1.2","226","Application Data"
"141","1.371819","146.75.37.140","192.168.12.35","TLSv1.2","537","Application Data"
"142","1.372153","192.168.12.35","146.75.37.140","TCP","54","61013  >  443 [ACK] Seq=7843 Ack=70065 Win=1025 Len=0"
"143","1.450818","192.168.12.35","146.75.37.140","UDP","96","52870  >  443 Len=54"
"144","1.640822","146.75.37.140","192.168.12.35","UDP","67","443  >  52870 Len=25"
"145","1.649706","192.168.12.35","146.75.37.140","UDP","84","52870  >  443 Len=42"
"146","1.663233","146.75.37.140","192.168.12.35","UDP","67","443  >  52870 Len=25"
"147","1.664847","146.75.37.140","192.168.12.35","UDP","69","443  >  52870 Len=27"
"148","1.710944","146.75.37.140","192.168.12.35","TLSv1.2","564","Application Data"
"149","1.710944","146.75.37.140","192.168.12.35","TLSv1.2","133","Application Data"
"150","1.711347","192.168.12.35","146.75.37.140","TCP","54","61013  >  443 [ACK] Seq=7843 Ack=70654 Win=1022 Len=0"
"151","1.718841","146.75.37.140","192.168.12.35","TLSv1.2","647","Application Data"
"152","1.718841","146.75.37.140","192.168.12.35","TLSv1.2","326","Application Data"
"153","1.718841","146.75.37.140","192.168.12.35","TLSv1.2","743","Application Data"
"154","1.718841","146.75.37.140","192.168.12.35","TLSv1.2","114","Application Data"
"155","1.718841","146.75.37.140","192.168.12.35","TLSv1.2","212","Application Data"
"156","1.718841","146.75.37.140","192.168.12.35","TLSv1.2","487","Application Data"
"157","1.718841","146.75.37.140","192.168.12.35","TCP","1430","443  >  61013 [ACK] Seq=72859 Ack=7843 Win=8244 Len=1376 [TCP PDU reassembled in 158]"
"158","1.718841","146.75.37.140","192.168.12.35","TLSv1.2","166","Application Data"
"159","1.718841","146.75.37.140","192.168.12.35","TCP","1430","443  >  61013 [ACK] Seq=74347 Ack=7843 Win=8244 Len=1376 [TCP PDU reassembled in 160]"
"160","1.718841","146.75.37.140","192.168.12.35","TLSv1.2","378","Application Data"
"161","1.718841","146.75.37.140","192.168.12.35","TCP","1430","443  >  61013 [ACK] Seq=76047 Ack=7843 Win=8244 Len=1376 [TCP PDU reassembled in 162]"
"162","1.718841","146.75.37.140","192.168.12.35","TLSv1.2","206","Application Data"
"163","1.719388","192.168.12.35","146.75.37.140","TCP","54","61013  >  443 [ACK] Seq=7843 Ack=71519 Win=1025 Len=0"
"164","1.719550","192.168.12.35","146.75.37.140","TCP","54","61013  >  443 [ACK] Seq=7843 Ack=72268 Win=1022 Len=0"
"165","1.719607","192.168.12.35","146.75.37.140","TCP","54","61013  >  443 [ACK] Seq=7843 Ack=72859 Win=1019 Len=0"
"166","1.719680","192.168.12.35","146.75.37.140","TCP","54","61013  >  443 [ACK] Seq=7843 Ack=74347 Win=1025 Len=0"
"167","1.719726","192.168.12.35","146.75.37.140","TCP","54","61013  >  443 [ACK] Seq=7843 Ack=76047 Win=1025 Len=0"
"168","1.719769","192.168.12.35","146.75.37.140","TCP","54","61013  >  443 [ACK] Seq=7843 Ack=77575 Win=1025 Len=0"
"169","1.724222","146.75.37.140","192.168.12.35","TCP","1430","443  >  61013 [ACK] Seq=77575 Ack=7843 Win=8244 Len=1376 [TCP PDU reassembled in 170]"
"170","1.724222","146.75.37.140","192.168.12.35","TLSv1.2","312","Application Data"
"171","1.724222","146.75.37.140","192.168.12.35","TLSv1.2","951","Application Data"
"172","1.724222","146.75.37.140","192.168.12.35","TLSv1.2","557","Application Data"
"173","1.724992","192.168.12.35","146.75.37.140","TCP","54","61013  >  443 [ACK] Seq=7843 Ack=79209 Win=1025 Len=0"
"174","1.725366","192.168.12.35","146.75.37.140","TCP","54","61013  >  443 [ACK] Seq=7843 Ack=80609 Win=1025 Len=0"
"175","1.730270","146.75.37.140","192.168.12.35","TLSv1.2","562","Application Data"
"176","1.731093","146.75.37.140","192.168.12.35","TLSv1.2","380","Application Data"
"177","1.731093","146.75.37.140","192.168.12.35","TLSv1.2","1069","Application Data"
"178","1.731093","146.75.37.140","192.168.12.35","TLSv1.2","964","Application Data"
"179","1.731609","146.75.37.140","192.168.12.35","TLSv1.2","392","Application Data"
"180","1.731609","146.75.37.140","192.168.12.35","TLSv1.2","859","Application Data"
"181","1.731609","146.75.37.140","192.168.12.35","TLSv1.2","224","Application Data"
"182","1.731609","146.75.37.140","192.168.12.35","TLSv1.2","190","Application Data"
"183","1.731609","146.75.37.140","192.168.12.35","TLSv1.2","779","Application Data"
"184","1.731609","146.75.37.140","192.168.12.35","TLSv1.2","245","Application Data"
"185","1.731609","146.75.37.140","192.168.12.35","TLSv1.2","421","Application Data"
"186","1.731609","146.75.37.140","192.168.12.35","TLSv1.2","188","Application Data"
"187","1.731609","146.75.37.140","192.168.12.35","TLSv1.2","847","Application Data"
"188","1.731684","192.168.12.35","146.75.37.140","TCP","54","61013  >  443 [ACK] Seq=7843 Ack=81443 Win=1021 Len=0"
"189","1.731849","192.168.12.35","146.75.37.140","TCP","54","61013  >  443 [ACK] Seq=7843 Ack=83368 Win=1025 Len=0"
"190","1.731988","192.168.12.35","146.75.37.140","TCP","54","61013  >  443 [ACK] Seq=7843 Ack=84511 Win=1020 Len=0"
"191","1.732035","192.168.12.35","146.75.37.140","TCP","54","61013  >  443 [ACK] Seq=7843 Ack=84817 Win=1025 Len=0"
"192","1.732075","192.168.12.35","146.75.37.140","TCP","54","61013  >  443 [ACK] Seq=7843 Ack=85733 Win=1021 Len=0"
"193","1.732119","192.168.12.35","146.75.37.140","TCP","54","61013  >  443 [ACK] Seq=7843 Ack=86234 Win=1025 Len=0"
"194","1.758970","146.75.37.140","192.168.12.35","TLSv1.2","309","Application Data"
"195","1.759249","146.75.37.140","192.168.12.35","TLSv1.2","107","Application Data"
"196","1.759249","146.75.37.140","192.168.12.35","TLSv1.2","439","Application Data"
"197","1.759249","146.75.37.140","192.168.12.35","TLSv1.2","326","Application Data"
"198","1.759249","146.75.37.140","192.168.12.35","TLSv1.2","103","Application Data"
"199","1.759249","146.75.37.140","192.168.12.35","TLSv1.2","454","Application Data"
"200","1.759249","146.75.37.140","192.168.12.35","TLSv1.2","133","Application Data"
"201","1.759463","146.75.37.140","192.168.12.35","TLSv1.2","286","Application Data"
"202","1.759463","146.75.37.140","192.168.12.35","TLSv1.2","416","Application Data"
"203","1.759463","146.75.37.140","192.168.12.35","TLSv1.2","232","Application Data"
"204","1.759463","146.75.37.140","192.168.12.35","TLSv1.2","201","Application Data"
"205","1.759463","146.75.37.140","192.168.12.35","TLSv1.2","116","Application Data"
"206","1.759463","146.75.37.140","192.168.12.35","TLSv1.2","144","Application Data"
"207","1.759463","146.75.37.140","192.168.12.35","TLSv1.2","181","Application Data"
"208","1.759463","146.75.37.140","192.168.12.35","TLSv1.2","105","Application Data"
"209","1.759502","192.168.12.35","146.75.37.140","TCP","54","61013  >  443 [ACK] Seq=7843 Ack=87282 Win=1021 Len=0"
"210","1.759634","192.168.12.35","146.75.37.140","TCP","54","61013  >  443 [ACK] Seq=7843 Ack=87720 Win=1025 Len=0"
"211","1.759671","192.168.12.35","146.75.37.140","TCP","54","61013  >  443 [ACK] Seq=7843 Ack=88041 Win=1023 Len=0"
"212","1.759712","192.168.12.35","146.75.37.140","TCP","54","61013  >  443 [ACK] Seq=7843 Ack=88520 Win=1022 Len=0"
"213","1.759878","192.168.12.35","146.75.37.140","TCP","54","61013  >  443 [ACK] Seq=7843 Ack=89114 Win=1019 Len=0"
"214","1.759911","192.168.12.35","146.75.37.140","TCP","54","61013  >  443 [ACK] Seq=7843 Ack=89439 Win=1025 Len=0"
"215","1.759952","192.168.12.35","146.75.37.140","TCP","54","61013  >  443 [ACK] Seq=7843 Ack=89591 Win=1024 Len=0"
"216","1.759991","192.168.12.35","146.75.37.140","TCP","54","61013  >  443 [ACK] Seq=7843 Ack=89769 Win=1023 Len=0"
"217","1.762349","146.75.37.140","192.168.12.35","TLSv1.2","94","Application Data"
"218","1.762349","146.75.37.140","192.168.12.35","TLSv1.2","516","Application Data"
"219","1.762349","146.75.37.140","192.168.12.35","TLSv1.2","1283","Application Data"
"220","1.762349","146.75.37.140","192.168.12.35","TLSv1.2","836","Application Data"
"221","1.762742","192.168.12.35","146.75.37.140","TCP","54","61013  >  443 [ACK] Seq=7843 Ack=90271 Win=1021 Len=0"
"222","1.762895","192.168.12.35","146.75.37.140","TCP","54","61013  >  443 [ACK] Seq=7843 Ack=92282 Win=1025 Len=0"
"223","1.769003","146.75.37.140","192.168.12.35","TLSv1.2","1023","Application Data"
"224","1.769003","146.75.37.140","192.168.12.35","TLSv1.2","840","Application Data"
"225","1.769003","146.75.37.140","192.168.12.35","TLSv1.2","206","Application Data, Application Data"
"226","1.769003","146.75.37.140","192.168.12.35","TLSv1.2","314","Application Data"
"227","1.769003","146.75.37.140","192.168.12.35","TLSv1.2","113","Application Data"
"228","1.769003","146.75.37.140","192.168.12.35","TLSv1.2","210","Application Data"
"229","1.769412","192.168.12.35","146.75.37.140","TCP","54","61013  >  443 [ACK] Seq=7843 Ack=94037 Win=1025 Len=0"
"230","1.769524","192.168.12.35","146.75.37.140","TCP","54","61013  >  443 [ACK] Seq=7843 Ack=94449 Win=1023 Len=0"
"231","1.769585","192.168.12.35","146.75.37.140","TCP","54","61013  >  443 [ACK] Seq=7843 Ack=94664 Win=1022 Len=0"
"232","1.773660","146.75.37.140","192.168.12.35","TLSv1.2","383","Application Data"
"233","1.823262","192.168.12.35","146.75.37.140","TCP","54","61013  >  443 [ACK] Seq=7843 Ack=94993 Win=1021 Len=0"
"234","2.055312","192.168.12.35","146.75.37.140","TLSv1.2","3185","Application Data"
"235","2.055473","192.168.12.35","146.75.37.140","TLSv1.2","718","Application Data"
"236","2.058810","192.168.12.35","146.75.37.140","TLSv1.2","3189","Application Data"
"237","2.068906","192.168.12.35","146.75.37.140","TLSv1.2","3198","Application Data"
"238","2.104971","192.168.12.35","146.75.37.140","TLSv1.2","3194","Application Data"
"239","2.105495","192.168.12.35","146.75.37.140","TLSv1.2","3209","Application Data"
"240","2.105604","192.168.12.35","146.75.37.140","TLSv1.2","3186","Application Data"
"241","2.105673","192.168.12.35","146.75.37.140","TLSv1.2","3194","Application Data"
"242","2.105769","192.168.12.35","146.75.37.140","TLSv1.2","3197","Application Data"
"243","2.105856","192.168.12.35","146.75.37.140","TLSv1.2","3198","Application Data"
"244","2.105929","192.168.12.35","146.75.37.140","TLSv1.2","3194","Application Data"
"245","2.105990","192.168.12.35","146.75.37.140","TLSv1.2","3197","Application Data"
"246","2.106408","146.75.37.140","192.168.12.35","TCP","54","443  >  61013 [ACK] Seq=94993 Ack=9239 Win=8244 Len=0"
"247","2.115915","146.75.37.140","192.168.12.35","TCP","54","443  >  61013 [ACK] Seq=94993 Ack=10635 Win=8244 Len=0"
"248","2.121880","146.75.37.140","192.168.12.35","TCP","54","443  >  61013 [ACK] Seq=94993 Ack=10974 Win=8244 Len=0"
"249","2.128172","146.75.37.140","192.168.12.35","TCP","54","443  >  61013 [ACK] Seq=94993 Ack=11638 Win=8244 Len=0"
"250","2.136225","146.75.37.140","192.168.12.35","TCP","54","443  >  61013 [ACK] Seq=94993 Ack=13034 Win=8244 Len=0"
"251","2.153822","146.75.37.140","192.168.12.35","TCP","54","443  >  61013 [ACK] Seq=94993 Ack=14430 Win=8244 Len=0"
"252","2.153822","146.75.37.140","192.168.12.35","TCP","54","443  >  61013 [ACK] Seq=94993 Ack=14773 Win=8244 Len=0"
"253","2.165920","146.75.37.140","192.168.12.35","TCP","54","443  >  61013 [ACK] Seq=94993 Ack=16169 Win=8244 Len=0"
"254","2.185616","146.75.37.140","192.168.12.35","TCP","54","443  >  61013 [ACK] Seq=94993 Ack=17565 Win=8244 Len=0"
"255","2.185616","146.75.37.140","192.168.12.35","TCP","54","443  >  61013 [ACK] Seq=94993 Ack=17917 Win=8244 Len=0"
"256","2.185616","146.75.37.140","192.168.12.35","TCP","1430","443  >  61013 [ACK] Seq=94993 Ack=17917 Win=8244 Len=1376 [TCP PDU reassembled in 257]"
"257","2.185616","146.75.37.140","192.168.12.35","TLSv1.2","784","Application Data"
"258","2.185616","146.75.37.140","192.168.12.35","TLSv1.2","87","Application Data"
"259","2.186485","192.168.12.35","146.75.37.140","TCP","54","61013  >  443 [ACK] Seq=43054 Ack=96369 Win=1025 Len=0"
"260","2.186776","192.168.12.35","146.75.37.140","TCP","54","61013  >  443 [ACK] Seq=43054 Ack=97099 Win=1022 Len=0"
"261","2.205938","146.75.37.140","192.168.12.35","TCP","1430","443  >  61013 [ACK] Seq=97132 Ack=19313 Win=8244 Len=1376 [TCP PDU reassembled in 262]"
"262","2.205938","146.75.37.140","192.168.12.35","TLSv1.2","485","Application Data"
"263","2.206691","192.168.12.35","146.75.37.140","TCP","54","61013  >  443 [ACK] Seq=43054 Ack=98508 Win=1025 Len=0"
"264","2.211080","146.75.37.140","192.168.12.35","TCP","1430","443  >  61013 [ACK] Seq=98939 Ack=19313 Win=8244 Len=1376 [TCP PDU reassembled in 265]"
"265","2.211080","146.75.37.140","192.168.12.35","TLSv1.2","875","Application Data"
"266","2.211080","146.75.37.140","192.168.12.35","TLSv1.2","100","Application Data"
"267","2.211080","146.75.37.140","192.168.12.35","TCP","54","443  >  61013 [ACK] Seq=101182 Ack=21057 Win=8244 Len=0"
"268","2.211474","192.168.12.35","146.75.37.140","TCP","54","61013  >  443 [ACK] Seq=43054 Ack=100315 Win=1025 Len=0"
"269","2.211675","192.168.12.35","146.75.37.140","TCP","54","61013  >  443 [ACK] Seq=43054 Ack=101182 Win=1021 Len=0"
"270","2.235836","146.75.37.140","192.168.12.35","TCP","54","443  >  61013 [ACK] Seq=101182 Ack=22453 Win=8244 Len=0"
"271","2.245570","146.75.37.140","192.168.12.35","TLSv1.2","604","Application Data"
"272","2.245958","192.168.12.35","146.75.37.140","TCP","54","61013  >  443 [ACK] Seq=43054 Ack=101732 Win=1025 Len=0"
"273","2.252517","146.75.37.140","192.168.12.35","TCP","54","443  >  61013 [ACK] Seq=101732 Ack=23849 Win=8244 Len=0"
"274","2.252517","146.75.37.140","192.168.12.35","TCP","54","443  >  61013 [ACK] Seq=101732 Ack=24212 Win=8244 Len=0"
"275","2.252517","146.75.37.140","192.168.12.35","TCP","1430","443  >  61013 [ACK] Seq=101732 Ack=24212 Win=8244 Len=1376 [TCP PDU reassembled in 276]"
"276","2.252517","146.75.37.140","192.168.12.35","TLSv1.2","489","Application Data"
"277","2.252774","192.168.12.35","146.75.37.140","TCP","54","61013  >  443 [ACK] Seq=43054 Ack=103108 Win=1019 Len=0"
"278","2.252848","192.168.12.35","146.75.37.140","TCP","54","61013  >  443 [ACK] Seq=43054 Ack=103543 Win=1025 Len=0"
"279","2.271901","146.75.37.140","192.168.12.35","TCP","54","443  >  61013 [ACK] Seq=103543 Ack=25608 Win=8244 Len=0"
"280","2.286533","146.75.37.140","192.168.12.35","TCP","54","443  >  61013 [ACK] Seq=103543 Ack=27344 Win=8244 Len=0"
"281","2.293984","146.75.37.140","192.168.12.35","TCP","1430","443  >  61013 [ACK] Seq=103543 Ack=27344 Win=8244 Len=1376 [TCP PDU reassembled in 282]"
"282","2.293984","146.75.37.140","192.168.12.35","TLSv1.2","872","Application Data"
"283","2.294802","192.168.12.35","146.75.37.140","TCP","54","61013  >  443 [ACK] Seq=43054 Ack=104919 Win=1019 Len=0"
"284","2.295277","192.168.12.35","146.75.37.140","TCP","54","61013  >  443 [ACK] Seq=43054 Ack=105737 Win=1025 Len=0"
"285","2.296241","192.168.12.35","146.75.37.140","TLSv1.2","3145","Application Data"
"286","2.307909","146.75.37.140","192.168.12.35","TCP","54","443  >  61013 [ACK] Seq=105737 Ack=28740 Win=8244 Len=0"
"287","2.320243","146.75.37.140","192.168.12.35","TCP","1430","443  >  61013 [ACK] Seq=105737 Ack=30136 Win=8244 Len=1376 [TCP PDU reassembled in 288]"
"288","2.320243","146.75.37.140","192.168.12.35","TLSv1.2","487","Application Data"
"289","2.320243","146.75.37.140","192.168.12.35","TCP","54","443  >  61013 [ACK] Seq=107546 Ack=30484 Win=8244 Len=0"
"290","2.321092","192.168.12.35","146.75.37.140","TCP","54","61013  >  443 [ACK] Seq=46145 Ack=107546 Win=1025 Len=0"
"291","2.340949","146.75.37.140","192.168.12.35","TCP","54","443  >  61013 [ACK] Seq=107546 Ack=31880 Win=8244 Len=0"
"292","2.346903","146.75.37.140","192.168.12.35","TLSv1.2","996","Application Data"
"293","2.346903","146.75.37.140","192.168.12.35","TLSv1.2","123","Application Data"
"294","2.346903","146.75.37.140","192.168.12.35","TCP","1430","443  >  61013 [ACK] Seq=108557 Ack=31880 Win=8244 Len=1376 [TCP PDU reassembled in 295]"
"295","2.346903","146.75.37.140","192.168.12.35","TLSv1.2","849","Application Data"
"296","2.346903","146.75.37.140","192.168.12.35","TLSv1.2","100","Application Data"
"297","2.347990","192.168.12.35","146.75.37.140","TCP","54","61013  >  443 [ACK] Seq=46145 Ack=108557 Win=1021 Len=0"
"298","2.348403","192.168.12.35","146.75.37.140","TCP","54","61013  >  443 [ACK] Seq=46145 Ack=109933 Win=1025 Len=0"
"299","2.348464","192.168.12.35","146.75.37.140","TCP","54","61013  >  443 [ACK] Seq=46145 Ack=110728 Win=1022 Len=0"
"300","2.371448","146.75.37.140","192.168.12.35","TCP","54","443  >  61013 [ACK] Seq=110774 Ack=33276 Win=8244 Len=0"
"301","2.371448","146.75.37.140","192.168.12.35","TCP","54","443  >  61013 [ACK] Seq=110774 Ack=33627 Win=8244 Len=0"
"302","2.371448","146.75.37.140","192.168.12.35","TCP","1430","443  >  61013 [ACK] Seq=110774 Ack=33627 Win=8244 Len=1376 [TCP PDU reassembled in 303]"
"303","2.371448","146.75.37.140","192.168.12.35","TLSv1.2","112","Application Data"
"304","2.371448","146.75.37.140","192.168.12.35","TLSv1.2","610","Application Data"
"305","2.371448","146.75.37.140","192.168.12.35","TLSv1.2","367","Application Data"
"306","2.371448","146.75.37.140","192.168.12.35","TLSv1.2","85","Application Data"
"307","2.372290","192.168.12.35","146.75.37.140","TCP","54","61013  >  443 [ACK] Seq=46145 Ack=112150 Win=1025 Len=0"
"308","2.372524","192.168.12.35","146.75.37.140","TCP","54","61013  >  443 [ACK] Seq=46145 Ack=112764 Win=1022 Len=0"
"309","2.372622","192.168.12.35","146.75.37.140","TCP","54","61013  >  443 [ACK] Seq=46145 Ack=113108 Win=1021 Len=0"
"310","2.387837","146.75.37.140","192.168.12.35","TCP","54","443  >  61013 [ACK] Seq=113108 Ack=35023 Win=8244 Len=0"
"311","2.401314","146.75.37.140","192.168.12.35","TLSv1.2","947","Application Data"
"312","2.401314","146.75.37.140","192.168.12.35","TLSv1.2","95","Application Data"
"313","2.401314","146.75.37.140","192.168.12.35","TCP","1430","443  >  61013 [ACK] Seq=114042 Ack=36419 Win=8244 Len=1376 [TCP PDU reassembled in 314]"
"314","2.401314","146.75.37.140","192.168.12.35","TLSv1.2","486","Application Data"
"315","2.401314","146.75.37.140","192.168.12.35","TCP","54","443  >  61013 [ACK] Seq=115850 Ack=36771 Win=8244 Len=0"
"316","2.402015","192.168.12.35","146.75.37.140","TCP","54","61013  >  443 [ACK] Seq=46145 Ack=114042 Win=1025 Len=0"
"317","2.402282","192.168.12.35","146.75.37.140","TCP","54","61013  >  443 [ACK] Seq=46145 Ack=115850 Win=1025 Len=0"
"318","2.425859","146.75.37.140","192.168.12.35","TCP","54","443  >  61013 [ACK] Seq=115850 Ack=38167 Win=8244 Len=0"
"319","2.433041","192.168.12.35","146.75.37.140","TLSv1.2","3175","Application Data"
"320","2.433523","192.168.12.35","146.75.37.140","TLSv1.2","210","Application Data"
"321","2.435838","146.75.37.140","192.168.12.35","TCP","54","443  >  61013 [ACK] Seq=115850 Ack=39563 Win=8244 Len=0"
"322","2.435838","146.75.37.140","192.168.12.35","TCP","1430","443  >  61013 [ACK] Seq=115850 Ack=39563 Win=8244 Len=1376 [TCP PDU reassembled in 323]"
"323","2.435838","146.75.37.140","192.168.12.35","TLSv1.2","872","Application Data"
"324","2.435838","146.75.37.140","192.168.12.35","TLSv1.2","95","Application Data"
"325","2.436963","192.168.12.35","146.75.37.140","TCP","54","61013  >  443 [ACK] Seq=49422 Ack=118044 Win=1025 Len=0"
"326","2.445761","146.75.37.140","192.168.12.35","TCP","54","443  >  61013 [ACK] Seq=118085 Ack=39911 Win=8244 Len=0"
"327","2.468080","146.75.37.140","192.168.12.35","TCP","54","443  >  61013 [ACK] Seq=118085 Ack=41307 Win=8244 Len=0"
"328","2.476318","146.75.37.140","192.168.12.35","TLSv1.2","95","Application Data"
"329","2.476318","146.75.37.140","192.168.12.35","TCP","1430","443  >  61013 [ACK] Seq=118126 Ack=42703 Win=8244 Len=1376 [TCP PDU reassembled in 330]"
"330","2.476318","146.75.37.140","192.168.12.35","TLSv1.2","489","Application Data"
"331","2.476318","146.75.37.140","192.168.12.35","TLSv1.2","169","Application Data"
"332","2.476743","192.168.12.35","146.75.37.140","TCP","54","61013  >  443 [ACK] Seq=49422 Ack=118126 Win=1024 Len=0"
"333","2.476875","192.168.12.35","146.75.37.140","TCP","54","61013  >  443 [ACK] Seq=49422 Ack=119502 Win=1025 Len=0"
"334","2.476906","192.168.12.35","146.75.37.140","TCP","54","61013  >  443 [ACK] Seq=49422 Ack=119937 Win=1023 Len=0"
"335","2.486098","146.75.37.140","192.168.12.35","TCP","54","443  >  61013 [ACK] Seq=120052 Ack=43054 Win=8244 Len=0"
"336","2.511640","146.75.37.140","192.168.12.35","TCP","1430","443  >  61013 [ACK] Seq=120052 Ack=43054 Win=8244 Len=1376 [TCP PDU reassembled in 337]"
"337","2.511640","146.75.37.140","192.168.12.35","TLSv1.2","849","Application Data"
"338","2.511640","146.75.37.140","192.168.12.35","TLSv1.2","100","Application Data"
"339","2.512177","192.168.12.35","146.75.37.140","TCP","54","61013  >  443 [ACK] Seq=49422 Ack=121428 Win=1025 Len=0"
"340","2.512398","192.168.12.35","146.75.37.140","TCP","54","61013  >  443 [ACK] Seq=49422 Ack=122269 Win=1021 Len=0"
"341","2.518787","146.75.37.140","192.168.12.35","TCP","54","443  >  61013 [ACK] Seq=122269 Ack=44450 Win=8244 Len=0"
"342","2.531273","146.75.37.140","192.168.12.35","TCP","54","443  >  61013 [ACK] Seq=122269 Ack=45846 Win=8244 Len=0"
"343","2.531273","146.75.37.140","192.168.12.35","TCP","54","443  >  61013 [ACK] Seq=122269 Ack=46145 Win=8244 Len=0"
"344","2.536770","146.75.37.140","192.168.12.35","TLSv1.2","256","Application Data"
"345","2.536770","146.75.37.140","192.168.12.35","TCP","1430","443  >  61013 [ACK] Seq=122471 Ack=46145 Win=8244 Len=1376 [TCP PDU reassembled in 346]"
"346","2.536770","146.75.37.140","192.168.12.35","TLSv1.2","133","Application Data"
"347","2.537042","192.168.12.35","146.75.37.140","TCP","54","61013  >  443 [ACK] Seq=49422 Ack=123847 Win=1025 Len=0"
"348","2.547856","146.75.37.140","192.168.12.35","TCP","1430","443  >  61013 [ACK] Seq=123926 Ack=46145 Win=8244 Len=1376 [TCP PDU reassembled in 349]"
"349","2.547856","146.75.37.140","192.168.12.35","TLSv1.2","499","Application Data"
"350","2.548164","192.168.12.35","146.75.37.140","TCP","54","61013  >  443 [ACK] Seq=49422 Ack=125302 Win=1025 Len=0"
"351","2.561469","192.168.12.35","146.75.37.140","TLSv1.2","3285","Application Data"
"352","2.708453","146.75.37.140","192.168.12.35","TLSv1.2","933","Application Data"
"353","2.717278","146.75.37.140","192.168.12.35","TCP","1430","443  >  61013 [ACK] Seq=126626 Ack=47541 Win=8244 Len=1376 [TCP PDU reassembled in 359]"
"354","2.717278","146.75.37.140","192.168.12.35","TCP","1430","443  >  61013 [PSH, ACK] Seq=128002 Ack=47541 Win=8244 Len=1376 [TCP PDU reassembled in 359]"
"355","2.717278","146.75.37.140","192.168.12.35","TCP","1430","443  >  61013 [ACK] Seq=129378 Ack=47541 Win=8244 Len=1376 [TCP PDU reassembled in 359]"
"356","2.717278","146.75.37.140","192.168.12.35","TCP","1430","443  >  61013 [PSH, ACK] Seq=130754 Ack=47541 Win=8244 Len=1376 [TCP PDU reassembled in 359]"
"357","2.717278","146.75.37.140","192.168.12.35","TCP","1430","443  >  61013 [ACK] Seq=132130 Ack=47541 Win=8244 Len=1376 [TCP PDU reassembled in 359]"
"358","2.717278","146.75.37.140","192.168.12.35","TCP","1430","443  >  61013 [PSH, ACK] Seq=133506 Ack=47541 Win=8244 Len=1376 [TCP PDU reassembled in 359]"
"359","2.717278","146.75.37.140","192.168.12.35","TLSv1.2","965","Application Data, Application Data, Application Data"
"360","2.717278","146.75.37.140","192.168.12.35","TLSv1.2","85","Application Data"
"361","2.717597","192.168.12.35","146.75.37.140","TCP","54","61013  >  443 [ACK] Seq=52653 Ack=134882 Win=1025 Len=0"
"362","2.717729","192.168.12.35","146.75.37.140","TCP","54","61013  >  443 [ACK] Seq=52653 Ack=135793 Win=1021 Len=0"
"363","2.725799","146.75.37.140","192.168.12.35","TCP","54","443  >  61013 [ACK] Seq=135824 Ack=49266 Win=8244 Len=0"
"364","2.731430","146.75.37.140","192.168.12.35","TCP","54","443  >  61013 [ACK] Seq=135824 Ack=49422 Win=8244 Len=0"
"365","2.767522","192.168.12.35","146.75.37.140","TCP","54","61013  >  443 [ACK] Seq=52653 Ack=135824 Win=1021 Len=0"
"366","2.769147","146.75.37.140","192.168.12.35","TCP","54","443  >  61013 [ACK] Seq=135824 Ack=50818 Win=8244 Len=0"
"367","2.788090","146.75.37.140","192.168.12.35","TCP","54","443  >  61013 [ACK] Seq=135824 Ack=52214 Win=8244 Len=0"
"368","2.788090","146.75.37.140","192.168.12.35","TCP","54","443  >  61013 [ACK] Seq=135824 Ack=52653 Win=8244 Len=0"
