"No.","Time","Source","Destination","Protocol","Length","Info"
"1","0.000000","192.168.12.35","146.75.37.140","UDP","80","50355  >  443 Len=38"
"2","0.058774","146.75.37.140","192.168.12.35","UDP","67","443  >  50355 Len=25"
"3","3.542014","192.168.12.35","146.75.37.140","TCP","55","61938  >  443 [ACK] Seq=1 Ack=1 Win=1024 Len=1"
"4","3.649649","146.75.37.140","192.168.12.35","TCP","66","443  >  61938 [ACK] Seq=1 Ack=2 Win=302 Len=0 SLE=1 SRE=2"
"5","3.770474","192.168.12.35","146.75.37.140","TLSv1.2","3241","Application Data"
"6","3.770544","192.168.12.35","146.75.37.140","TLSv1.2","3359","Application Data"
"7","3.770572","192.168.12.35","146.75.37.140","TLSv1.2","1566","Application Data"
"8","3.819091","146.75.37.140","192.168.12.35","TCP","54","443  >  61013 [ACK] Seq=1 Ack=1397 Win=8196 Len=0"
"9","3.836729","146.75.37.140","192.168.12.35","TCP","54","443  >  61013 [ACK] Seq=1 Ack=2793 Win=8196 Len=0"
"10","3.836729","146.75.37.140","192.168.12.35","TCP","54","443  >  61013 [ACK] Seq=1 Ack=3188 Win=8196 Len=0"
"11","3.856269","146.75.37.140","192.168.12.35","TCP","54","443  >  61013 [ACK] Seq=1 Ack=4584 Win=8196 Len=0"
"12","3.871915","146.75.37.140","192.168.12.35","TCP","54","443  >  61013 [ACK] Seq=1 Ack=5980 Win=8196 Len=0"
"13","3.871915","146.75.37.140","192.168.12.35","TCP","54","443  >  61013 [ACK] Seq=1 Ack=6493 Win=8196 Len=0"
"14","3.903932","146.75.37.140","192.168.12.35","TCP","54","443  >  61013 [ACK] Seq=1 Ack=7889 Win=8196 Len=0"
"15","3.903932","146.75.37.140","192.168.12.35","TCP","1430","443  >  61013 [ACK] Seq=1 Ack=7889 Win=8196 Len=1376 [TCP PDU reassembled in 16]"
"16","3.903932","146.75.37.140","192.168.12.35","TLSv1.2","1066","Application Data"
"17","3.903932","146.75.37.140","192.168.12.35","TCP","1430","443  >  61013 [ACK] Seq=2389 Ack=7889 Win=8196 Len=1376 [TCP PDU reassembled in 18]"
"18","3.903932","146.75.37.140","192.168.12.35","TLSv1.2","1070","Application Data"
"19","3.903932","146.75.37.140","192.168.12.35","TCP","54","443  >  61013 [ACK] Seq=4781 Ack=8005 Win=8196 Len=0"
"20","3.903932","146.75.37.140","192.168.12.35","TCP","1430","443  >  61013 [ACK] Seq=4781 Ack=8005 Win=8196 Len=1376 [TCP PDU reassembled in 30]"
"21","3.903932","146.75.37.140","192.168.12.35","TCP","1430","443  >  61013 [PSH, ACK] Seq=6157 Ack=8005 Win=8196 Len=1376 [TCP PDU reassembled in 30]"
"22","3.903932","146.75.37.140","192.168.12.35","TCP","1430","443  >  61013 [ACK] Seq=7533 Ack=8005 Win=8196 Len=1376 [TCP PDU reassembled in 30]"
"23","3.903932","146.75.37.140","192.168.12.35","TCP","1430","443  >  61013 [PSH, ACK] Seq=8909 Ack=8005 Win=8196 Len=1376 [TCP PDU reassembled in 30]"
"24","3.903932","146.75.37.140","192.168.12.35","TCP","1430","443  >  61013 [ACK] Seq=10285 Ack=8005 Win=8196 Len=1376 [TCP PDU reassembled in 30]"
"25","3.903932","146.75.37.140","192.168.12.35","TCP","1430","443  >  61013 [PSH, ACK] Seq=11661 Ack=8005 Win=8196 Len=1376 [TCP PDU reassembled in 30]"
"26","3.903932","146.75.37.140","192.168.12.35","TCP","1430","443  >  61013 [ACK] Seq=13037 Ack=8005 Win=8196 Len=1376 [TCP PDU reassembled in 30]"
"27","3.903932","146.75.37.140","192.168.12.35","TCP","1430","443  >  61013 [PSH, ACK] Seq=14413 Ack=8005 Win=8196 Len=1376 [TCP PDU reassembled in 30]"
"28","3.903932","146.75.37.140","192.168.12.35","TCP","1430","443  >  61013 [ACK] Seq=15789 Ack=8005 Win=8196 Len=1376 [TCP PDU reassembled in 30]"
"29","3.903932","146.75.37.140","192.168.12.35","TCP","1430","443  >  61013 [PSH, ACK] Seq=17165 Ack=8005 Win=8196 Len=1376 [TCP PDU reassembled in 30]"
"30","3.903932","146.75.37.140","192.168.12.35","TLSv1.2","348","Application Data"
"31","3.904628","192.168.12.35","146.75.37.140","TCP","54","61013  >  443 [ACK] Seq=8005 Ack=2389 Win=1025 Len=0"
"32","3.904933","192.168.12.35","146.75.37.140","TCP","54","61013  >  443 [ACK] Seq=8005 Ack=4781 Win=1025 Len=0"
"33","3.904982","192.168.12.35","146.75.37.140","TCP","54","61013  >  443 [ACK] Seq=8005 Ack=18541 Win=1025 Len=0"
"34","3.909005","192.168.12.35","146.75.37.140","TLSv1.2","89","Application Data"
"35","3.913176","146.75.37.140","192.168.12.35","TLSv1.2","870","Application Data"
"36","3.918598","146.75.37.140","192.168.12.35","TCP","1430","443  >  61013 [ACK] Seq=19651 Ack=8005 Win=8196 Len=1376 [TCP PDU reassembled in 48]"
"37","3.918598","146.75.37.140","192.168.12.35","TCP","1430","443  >  61013 [PSH, ACK] Seq=21027 Ack=8005 Win=8196 Len=1376 [TCP PDU reassembled in 48]"
"38","3.918598","146.75.37.140","192.168.12.35","TCP","1430","443  >  61013 [ACK] Seq=22403 Ack=8005 Win=8196 Len=1376 [TCP PDU reassembled in 48]"
"39","3.918598","146.75.37.140","192.168.12.35","TCP","1430","443  >  61013 [PSH, ACK] Seq=23779 Ack=8005 Win=8196 Len=1376 [TCP PDU reassembled in 48]"
"40","3.919170","192.168.12.35","146.75.37.140","TCP","54","61013  >  443 [ACK] Seq=8040 Ack=25155 Win=1025 Len=0"
"41","3.923443","146.75.37.140","192.168.12.35","TCP","1430","443  >  61013 [ACK] Seq=25155 Ack=8005 Win=8196 Len=1376 [TCP PDU reassembled in 48]"
"42","3.923443","146.75.37.140","192.168.12.35","TCP","1430","443  >  61013 [PSH, ACK] Seq=26531 Ack=8005 Win=8196 Len=1376 [TCP PDU reassembled in 48]"
"43","3.923443","146.75.37.140","192.168.12.35","TCP","1430","443  >  61013 [ACK] Seq=27907 Ack=8005 Win=8196 Len=1376 [TCP PDU reassembled in 48]"
"44","3.923443","146.75.37.140","192.168.12.35","TCP","1430","443  >  61013 [PSH, ACK] Seq=29283 Ack=8005 Win=8196 Len=1376 [TCP PDU reassembled in 48]"
"45","3.923443","146.75.37.140","192.168.12.35","TCP","1430","443  >  61013 [ACK] Seq=30659 Ack=8005 Win=8196 Len=1376 [TCP PDU reassembled in 48]"
"46","3.923443","146.75.37.140","192.168.12.35","TCP","1430","443  >  61013 [PSH, ACK] Seq=32035 Ack=8005 Win=8196 Len=1376 [TCP PDU reassembled in 48]"
"47","3.923443","146.75.37.140","192.168.12.35","TCP","1430","443  >  61013 [ACK] Seq=33411 Ack=8005 Win=8196 Len=1376 [TCP PDU reassembled in 48]"
"48","3.923443","146.75.37.140","192.168.12.35","TLSv1.2","548","Application Data"
"49","3.923443","146.75.37.140","192.168.12.35","TCP","1430","443  >  61013 [ACK] Seq=35281 Ack=8005 Win=8196 Len=1376 [TCP PDU reassembled in 62]"
"50","3.923443","146.75.37.140","192.168.12.35","TCP","1430","443  >  61013 [PSH, ACK] Seq=36657 Ack=8005 Win=8196 Len=1376 [TCP PDU reassembled in 62]"
"51","3.923443","146.75.37.140","192.168.12.35","TCP","1430","443  >  61013 [ACK] Seq=38033 Ack=8005 Win=8196 Len=1376 [TCP PDU reassembled in 62]"
"52","3.923443","146.75.37.140","192.168.12.35","TCP","1430","443  >  61013 [PSH, ACK] Seq=39409 Ack=8005 Win=8196 Len=1376 [TCP PDU reassembled in 62]"
"53","3.923443","146.75.37.140","192.168.12.35","TCP","1430","443  >  61013 [ACK] Seq=40785 Ack=8005 Win=8196 Len=1376 [TCP PDU reassembled in 62]"
"54","3.923443","146.75.37.140","192.168.12.35","TCP","1430","443  >  61013 [PSH, ACK] Seq=42161 Ack=8005 Win=8196 Len=1376 [TCP PDU reassembled in 62]"
"55","3.923443","146.75.37.140","192.168.12.35","TCP","1430","443  >  61013 [ACK] Seq=43537 Ack=8005 Win=8196 Len=1376 [TCP PDU reassembled in 62]"
"56","3.923443","146.75.37.140","192.168.12.35","TCP","1430","443  >  61013 [PSH, ACK] Seq=44913 Ack=8005 Win=8196 Len=1376 [TCP PDU reassembled in 62]"
"57","3.924529","192.168.12.35","146.75.37.140","TCP","54","61013  >  443 [ACK] Seq=8040 Ack=34787 Win=1025 Len=0"
"58","3.924866","192.168.12.35","146.75.37.140","TCP","54","61013  >  443 [ACK] Seq=8040 Ack=46289 Win=1025 Len=0"
"59","3.929520","146.75.37.140","192.168.12.35","TCP","1430","443  >  61013 [ACK] Seq=46289 Ack=8005 Win=8196 Len=1376 [TCP PDU reassembled in 62]"
"60","3.929520","146.75.37.140","192.168.12.35","TCP","1430","443  >  61013 [PSH, ACK] Seq=47665 Ack=8005 Win=8196 Len=1376 [TCP PDU reassembled in 62]"
"61","3.929520","146.75.37.140","192.168.12.35","TCP","1430","443  >  61013 [ACK] Seq=49041 Ack=8005 Win=8196 Len=1376 [TCP PDU reassembled in 62]"
"62","3.929520","146.75.37.140","192.168.12.35","TLSv1.2","1355","Application Data, Application Data"
"63","3.929520","146.75.37.140","192.168.12.35","TCP","1430","443  >  61013 [ACK] Seq=51718 Ack=8005 Win=8196 Len=1376 [TCP PDU reassembled in 64]"
"64","3.929520","146.75.37.140","192.168.12.35","TLSv1.2","1001","Application Data"
"65","3.930346","192.168.12.35","146.75.37.140","TCP","54","61013  >  443 [ACK] Seq=8040 Ack=50417 Win=1025 Len=0"
"66","3.930703","192.168.12.35","146.75.37.140","TCP","54","61013  >  443 [ACK] Seq=8040 Ack=53094 Win=1025 Len=0"
"67","3.941190","146.75.37.140","192.168.12.35","TLSv1.2","1049","Application Data"
"68","3.941190","146.75.37.140","192.168.12.35","TLSv1.2","1181","Application Data"
"69","3.941835","192.168.12.35","146.75.37.140","TCP","54","61013  >  443 [ACK] Seq=8040 Ack=55036 Win=1025 Len=0"
"70","3.946219","146.75.37.140","192.168.12.35","TLSv1.2","1068","Application Data"
"71","3.946219","146.75.37.140","192.168.12.35","TCP","1430","443  >  61013 [ACK] Seq=57177 Ack=8005 Win=8196 Len=1376 [TCP PDU reassembled in 72]"
"72","3.946219","146.75.37.140","192.168.12.35","TLSv1.2","504","Application Data"
"73","3.946749","192.168.12.35","146.75.37.140","TCP","54","61013  >  443 [ACK] Seq=8040 Ack=57177 Win=1025 Len=0"
"74","3.947018","192.168.12.35","146.75.37.140","TCP","54","61013  >  443 [ACK] Seq=8040 Ack=59003 Win=1025 Len=0"
"75","3.950934","146.75.37.140","192.168.12.35","TLSv1.2","1191","Application Data"
"76","3.950934","146.75.37.140","192.168.12.35","TLSv1.2","603","Application Data"
"77","3.950934","146.75.37.140","192.168.12.35","TLSv1.2","841","Application Data"
"78","3.951416","192.168.12.35","146.75.37.140","TCP","54","61013  >  443 [ACK] Seq=8040 Ack=60689 Win=1025 Len=0"
"79","3.952177","192.168.12.35","146.75.37.140","UDP","95","50355  >  443 Len=53"
"80","3.956933","146.75.37.140","192.168.12.35","TLSv1.2","112","Application Data"
"81","3.957513","192.168.12.35","146.75.37.140","TCP","54","61013  >  443 [ACK] Seq=8040 Ack=61534 Win=1021 Len=0"
"82","3.962095","146.75.37.140","192.168.12.35","TLSv1.2","117","Application Data"
"83","3.972031","146.75.37.140","192.168.12.35","TLSv1.2","927","Application Data"
"84","3.972031","146.75.37.140","192.168.12.35","TCP","1430","443  >  61013 [ACK] Seq=62470 Ack=8005 Win=8196 Len=1376 [TCP PDU reassembled in 85]"
"85","3.972031","146.75.37.140","192.168.12.35","TLSv1.2","1007","Application Data"
"86","3.972031","146.75.37.140","192.168.12.35","TLSv1.2","213","Application Data"
"87","3.972031","146.75.37.140","192.168.12.35","TLSv1.2","507","Application Data"
"88","3.972031","146.75.37.140","192.168.12.35","TLSv1.2","154","Application Data, Application Data"
"89","3.972031","146.75.37.140","192.168.12.35","TLSv1.2","155","Application Data, Application Data"
"90","3.972031","146.75.37.140","192.168.12.35","TLSv1.2","98","Application Data"
"91","3.972031","146.75.37.140","192.168.12.35","TLSv1.2","103","Application Data"
"92","3.972031","146.75.37.140","192.168.12.35","TLSv1.2","656","Application Data"
"93","3.972031","146.75.37.140","192.168.12.35","TLSv1.2","104","Application Data"
"94","3.972031","146.75.37.140","192.168.12.35","TLSv1.2","100","Application Data"
"95","3.972031","146.75.37.140","192.168.12.35","TLSv1.2","174","Application Data"
"96","3.972031","146.75.37.140","192.168.12.35","TLSv1.2","911","Application Data"
"97","3.972031","146.75.37.140","192.168.12.35","TLSv1.2","432","Application Data"
"98","3.972031","146.75.37.140","192.168.12.35","TLSv1.2","93","Application Data"
"99","3.972031","146.75.37.140","192.168.12.35","TLSv1.2","109","Application Data"
"100","3.972031","146.75.37.140","192.168.12.35","TLSv1.2","123","Application Data"
"101","3.972031","146.75.37.140","192.168.12.35","TLSv1.2","361","Application Data"
"102","3.972031","146.75.37.140","192.168.12.35","TLSv1.2","234","Application Data"
"103","3.972814","192.168.12.35","146.75.37.140","TCP","54","61013  >  443 [ACK] Seq=8040 Ack=62470 Win=1025 Len=0"
"104","3.973032","192.168.12.35","146.75.37.140","TCP","54","61013  >  443 [ACK] Seq=8040 Ack=64799 Win=1025 Len=0"
"105","3.973100","192.168.12.35","146.75.37.140","TCP","54","61013  >  443 [ACK] Seq=8040 Ack=65411 Win=1022 Len=0"
"106","3.973154","192.168.12.35","146.75.37.140","TCP","54","61013  >  443 [ACK] Seq=8040 Ack=65612 Win=1022 Len=0"
"107","3.973197","192.168.12.35","146.75.37.140","TCP","54","61013  >  443 [ACK] Seq=8040 Ack=65705 Win=1021 Len=0"
"108","3.973235","192.168.12.35","146.75.37.140","TCP","54","61013  >  443 [ACK] Seq=8040 Ack=66307 Win=1025 Len=0"
"109","3.973269","192.168.12.35","146.75.37.140","TCP","54","61013  >  443 [ACK] Seq=8040 Ack=66357 Win=1024 Len=0"
"110","3.973315","192.168.12.35","146.75.37.140","TCP","54","61013  >  443 [ACK] Seq=8040 Ack=66523 Win=1024 Len=0"
"111","3.973359","192.168.12.35","146.75.37.140","TCP","54","61013  >  443 [ACK] Seq=8040 Ack=67758 Win=1025 Len=0"
"112","3.973419","192.168.12.35","146.75.37.140","TCP","54","61013  >  443 [ACK] Seq=8040 Ack=67852 Win=1024 Len=0"
"113","3.973460","192.168.12.35","146.75.37.140","TCP","54","61013  >  443 [ACK] Seq=8040 Ack=68228 Win=1023 Len=0"
"114","3.978829","146.75.37.140","192.168.12.35","TLSv1.2","229","Application Data"
"115","3.978829","146.75.37.140","192.168.12.35","TLSv1.2","286","Application Data"
"116","3.978829","146.75.37.140","192.168.12.35","TLSv1.2","99","Application Data"
"117","3.978829","146.75.37.140","192.168.12.35","TLSv1.2","392","Application Data"
"118","3.978829","146.75.37.140","192.168.12.35","TLSv1.2","256","Application Data"
"119","3.978829","146.75.37.140","192.168.12.35","TLSv1.2","131","Application Data"
"120","3.978829","146.75.37.140","192.168.12.35","TLSv1.2","104","Application Data"
"121","3.978829","146.75.37.140","192.168.12.35","TLSv1.2","207","Application Data"
"122","3.979145","192.168.12.35","146.75.37.140","TCP","54","61013  >  443 [ACK] Seq=8040 Ack=68583 Win=1021 Len=0"
"123","3.979314","192.168.12.35","146.75.37.140","TCP","54","61013  >  443 [ACK] Seq=8040 Ack=68860 Win=1020 Len=0"
"124","3.979366","192.168.12.35","146.75.37.140","TCP","54","61013  >  443 [ACK] Seq=8040 Ack=69198 Win=1025 Len=0"
"125","3.979447","192.168.12.35","146.75.37.140","TCP","54","61013  >  443 [ACK] Seq=8040 Ack=69400 Win=1024 Len=0"
"126","3.979485","192.168.12.35","146.75.37.140","TCP","54","61013  >  443 [ACK] Seq=8040 Ack=69527 Win=1023 Len=0"
"127","3.993436","146.75.37.140","192.168.12.35","TLSv1.2","416","Application Data"
"128","3.993436","146.75.37.140","192.168.12.35","TLSv1.2","111","Application Data"
"129","3.993436","146.75.37.140","192.168.12.35","TLSv1.2","199","Application Data"
"130","3.993818","192.168.12.35","146.75.37.140","TCP","54","61013  >  443 [ACK] Seq=8040 Ack=70042 Win=1021 Len=0"
"131","3.994010","192.168.12.35","146.75.37.140","TCP","54","61013  >  443 [ACK] Seq=8040 Ack=70244 Win=1021 Len=0"
"132","4.100813","146.75.37.140","192.168.12.35","TCP","54","443  >  61013 [ACK] Seq=70244 Ack=8040 Win=8196 Len=0"
"133","4.109118","146.75.37.140","192.168.12.35","UDP","67","443  >  50355 Len=25"
"134","4.126741","192.168.12.35","146.75.37.140","UDP","84","50355  >  443 Len=42"
"135","4.136121","146.75.37.140","192.168.12.35","UDP","67","443  >  50355 Len=25"
"136","4.474188","146.75.37.140","192.168.12.35","TLSv1.2","926","Application Data"
"137","4.474188","146.75.37.140","192.168.12.35","TLSv1.2","333","Application Data"
"138","4.474188","146.75.37.140","192.168.12.35","TLSv1.2","183","Application Data"
"139","4.474188","146.75.37.140","192.168.12.35","TLSv1.2","198","Application Data"
"140","4.474188","146.75.37.140","192.168.12.35","TLSv1.2","115","Application Data"
"141","4.474188","146.75.37.140","192.168.12.35","TLSv1.2","789","Application Data"
"142","4.474188","146.75.37.140","192.168.12.35","TLSv1.2","206","Application Data"
"143","4.475390","192.168.12.35","146.75.37.140","TCP","54","61013  >  443 [ACK] Seq=8040 Ack=71395 Win=1025 Len=0"
"144","4.476111","192.168.12.35","146.75.37.140","TCP","54","61013  >  443 [ACK] Seq=8040 Ack=71668 Win=1024 Len=0"
"145","4.476467","192.168.12.35","146.75.37.140","TCP","54","61013  >  443 [ACK] Seq=8040 Ack=72464 Win=1021 Len=0"
"146","4.476765","146.75.37.140","192.168.12.35","TLSv1.2","374","Application Data"
"147","4.476765","146.75.37.140","192.168.12.35","TLSv1.2","116","Application Data"
"148","4.476765","146.75.37.140","192.168.12.35","TLSv1.2","107","Application Data"
"149","4.476765","146.75.37.140","192.168.12.35","TCP","1430","443  >  61013 [ACK] Seq=73051 Ack=8040 Win=8196 Len=1376 [TCP PDU reassembled in 150]"
"150","4.476765","146.75.37.140","192.168.12.35","TLSv1.2","657","Application Data"
"151","4.476765","146.75.37.140","192.168.12.35","TLSv1.2","543","Application Data"
"152","4.477068","146.75.37.140","192.168.12.35","TLSv1.2","680","Application Data"
"153","4.477068","146.75.37.140","192.168.12.35","TCP","1430","443  >  61013 [ACK] Seq=76145 Ack=8040 Win=8196 Len=1376 [TCP PDU reassembled in 154]"
"154","4.477068","146.75.37.140","192.168.12.35","TLSv1.2","907","Application Data"
"155","4.477068","146.75.37.140","192.168.12.35","TLSv1.2","657","Application Data"
"156","4.477068","146.75.37.140","192.168.12.35","TLSv1.2","218","Application Data"
"157","4.477068","146.75.37.140","192.168.12.35","TLSv1.2","994","Application Data"
"158","4.477068","146.75.37.140","192.168.12.35","TLSv1.2","557","Application Data"
"159","4.477207","192.168.12.35","146.75.37.140","TCP","54","61013  >  443 [ACK] Seq=8040 Ack=72936 Win=1025 Len=0"
"160","4.477575","192.168.12.35","146.75.37.140","TCP","54","61013  >  443 [ACK] Seq=8040 Ack=73051 Win=1024 Len=0"
"161","4.477769","192.168.12.35","146.75.37.140","TCP","54","61013  >  443 [ACK] Seq=8040 Ack=75030 Win=1025 Len=0"
"162","4.477867","192.168.12.35","146.75.37.140","TCP","54","61013  >  443 [ACK] Seq=8040 Ack=76145 Win=1020 Len=0"
"163","4.478155","192.168.12.35","146.75.37.140","TCP","54","61013  >  443 [ACK] Seq=8040 Ack=78374 Win=1025 Len=0"
"164","4.478234","192.168.12.35","146.75.37.140","TCP","54","61013  >  443 [ACK] Seq=8040 Ack=79141 Win=1022 Len=0"
"165","4.478333","192.168.12.35","146.75.37.140","TCP","54","61013  >  443 [ACK] Seq=8040 Ack=80584 Win=1025 Len=0"
"166","4.483092","146.75.37.140","192.168.12.35","TLSv1.2","755","Application Data"
"167","4.483092","146.75.37.140","192.168.12.35","TLSv1.2","461","Application Data"
"168","4.483092","146.75.37.140","192.168.12.35","TLSv1.2","1068","Application Data"
"169","4.483092","146.75.37.140","192.168.12.35","TLSv1.2","216","Application Data"
"170","4.483092","146.75.37.140","192.168.12.35","TLSv1.2","569","Application Data"
"171","4.483092","146.75.37.140","192.168.12.35","TLSv1.2","211","Application Data"
"172","4.483092","146.75.37.140","192.168.12.35","TLSv1.2","585","Application Data"
"173","4.483092","146.75.37.140","192.168.12.35","TLSv1.2","326","Application Data"
"174","4.483561","192.168.12.35","146.75.37.140","TCP","54","61013  >  443 [ACK] Seq=8040 Ack=81692 Win=1020 Len=0"
"175","4.483727","192.168.12.35","146.75.37.140","TCP","54","61013  >  443 [ACK] Seq=8040 Ack=82868 Win=1025 Len=0"
"176","4.483814","192.168.12.35","146.75.37.140","TCP","54","61013  >  443 [ACK] Seq=8040 Ack=83540 Win=1022 Len=0"
"177","4.483864","192.168.12.35","146.75.37.140","TCP","54","61013  >  443 [ACK] Seq=8040 Ack=84343 Win=1025 Len=0"
"178","4.492726","146.75.37.140","192.168.12.35","TLSv1.2","226","Application Data"
"179","4.492726","146.75.37.140","192.168.12.35","TLSv1.2","231","Application Data"
"180","4.493043","192.168.12.35","146.75.37.140","TCP","54","61013  >  443 [ACK] Seq=8040 Ack=84692 Win=1023 Len=0"
"181","4.519619","146.75.37.140","192.168.12.35","TLSv1.2","217","Application Data"
"182","4.519619","146.75.37.140","192.168.12.35","TLSv1.2","160","Application Data"
"183","4.519619","146.75.37.140","192.168.12.35","TLSv1.2","726","Application Data"
"184","4.519619","146.75.37.140","192.168.12.35","TLSv1.2","560","Application Data"
"185","4.519619","146.75.37.140","192.168.12.35","TLSv1.2","380","Application Data"
"186","4.519619","146.75.37.140","192.168.12.35","TLSv1.2","281","Application Data"
"187","4.519619","146.75.37.140","192.168.12.35","TLSv1.2","145","Application Data"
"188","4.519619","146.75.37.140","192.168.12.35","TLSv1.2","123","Application Data"
"189","4.519619","146.75.37.140","192.168.12.35","TLSv1.2","184","Application Data"
"190","4.519619","146.75.37.140","192.168.12.35","TLSv1.2","242","Application Data"
"191","4.519619","146.75.37.140","192.168.12.35","TLSv1.2","274","Application Data"
"192","4.519619","146.75.37.140","192.168.12.35","TLSv1.2","215","Application Data"
"193","4.520313","192.168.12.35","146.75.37.140","TCP","54","61013  >  443 [ACK] Seq=8040 Ack=84961 Win=1022 Len=0"
"194","4.520573","192.168.12.35","146.75.37.140","TCP","54","61013  >  443 [ACK] Seq=8040 Ack=86139 Win=1025 Len=0"
"195","4.520633","192.168.12.35","146.75.37.140","TCP","54","61013  >  443 [ACK] Seq=8040 Ack=86692 Win=1023 Len=0"
"196","4.520675","192.168.12.35","146.75.37.140","TCP","54","61013  >  443 [ACK] Seq=8040 Ack=86852 Win=1022 Len=0"
"197","4.520742","192.168.12.35","146.75.37.140","TCP","54","61013  >  443 [ACK] Seq=8040 Ack=87170 Win=1021 Len=0"
"198","4.520814","192.168.12.35","146.75.37.140","TCP","54","61013  >  443 [ACK] Seq=8040 Ack=87551 Win=1025 Len=0"
"199","4.534307","146.75.37.140","192.168.12.35","TLSv1.2","253","Application Data"
"200","4.534307","146.75.37.140","192.168.12.35","TLSv1.2","721","Application Data"
"201","4.534307","146.75.37.140","192.168.12.35","TLSv1.2","104","Application Data"
"202","4.534307","146.75.37.140","192.168.12.35","TLSv1.2","480","Application Data"
"203","4.534307","146.75.37.140","192.168.12.35","TLSv1.2","309","Application Data"
"204","4.534307","146.75.37.140","192.168.12.35","TLSv1.2","533","Application Data"
"205","4.534307","146.75.37.140","192.168.12.35","TLSv1.2","270","Application Data"
"206","4.534307","146.75.37.140","192.168.12.35","TLSv1.2","440","Application Data"
"207","4.534307","146.75.37.140","192.168.12.35","TLSv1.2","510","Application Data"
"208","4.534307","146.75.37.140","192.168.12.35","TCP","1430","443  >  61013 [ACK] Seq=90685 Ack=8040 Win=8196 Len=1376 [TCP PDU reassembled in 210]"
"209","4.534307","146.75.37.140","192.168.12.35","TCP","1430","443  >  61013 [ACK] Seq=92061 Ack=8040 Win=8196 Len=1376 [TCP PDU reassembled in 210]"
"210","4.534307","146.75.37.140","192.168.12.35","TLSv1.2","363","Application Data"
"211","4.534307","146.75.37.140","192.168.12.35","TCP","1430","443  >  61013 [ACK] Seq=93746 Ack=8040 Win=8196 Len=1376 [TCP PDU reassembled in 212]"
"212","4.534307","146.75.37.140","192.168.12.35","TLSv1.2","542","Application Data"
"213","4.534772","192.168.12.35","146.75.37.140","TCP","54","61013  >  443 [ACK] Seq=8040 Ack=88417 Win=1021 Len=0"
"214","4.535065","192.168.12.35","146.75.37.140","TCP","54","61013  >  443 [ACK] Seq=8040 Ack=88893 Win=1019 Len=0"
"215","4.535121","192.168.12.35","146.75.37.140","TCP","54","61013  >  443 [ACK] Seq=8040 Ack=89627 Win=1025 Len=0"
"216","4.535194","192.168.12.35","146.75.37.140","TCP","54","61013  >  443 [ACK] Seq=8040 Ack=90229 Win=1022 Len=0"
"217","4.535259","192.168.12.35","146.75.37.140","TCP","54","61013  >  443 [ACK] Seq=8040 Ack=93437 Win=1025 Len=0"
"218","4.535297","192.168.12.35","146.75.37.140","TCP","54","61013  >  443 [ACK] Seq=8040 Ack=93746 Win=1023 Len=0"
"219","4.535337","192.168.12.35","146.75.37.140","TCP","54","61013  >  443 [ACK] Seq=8040 Ack=95610 Win=1025 Len=0"
"220","4.601312","192.168.12.35","146.75.37.140","TLSv1.2","3187","Application Data"
"221","4.601477","192.168.12.35","146.75.37.140","TLSv1.2","718","Application Data"
"222","4.601558","192.168.12.35","146.75.37.140","TLSv1.2","3191","Application Data"
"223","4.624093","192.168.12.35","146.75.37.140","TLSv1.2","3200","Application Data"
"224","4.651743","146.75.37.140","192.168.12.35","TCP","54","443  >  61013 [ACK] Seq=95610 Ack=9436 Win=8196 Len=0"
"225","4.661132","146.75.37.140","192.168.12.35","TCP","54","443  >  61013 [ACK] Seq=95610 Ack=10832 Win=8196 Len=0"
"226","4.668190","146.75.37.140","192.168.12.35","TCP","54","443  >  61013 [ACK] Seq=95610 Ack=11173 Win=8196 Len=0"
"227","4.673056","146.75.37.140","192.168.12.35","TCP","54","443  >  61013 [ACK] Seq=95610 Ack=11837 Win=8196 Len=0"
"228","4.686267","146.75.37.140","192.168.12.35","TCP","54","443  >  61013 [ACK] Seq=95610 Ack=13233 Win=8196 Len=0"
"229","4.691342","146.75.37.140","192.168.12.35","TCP","1430","443  >  61013 [ACK] Seq=95610 Ack=13233 Win=8196 Len=1376 [TCP PDU reassembled in 230]"
"230","4.691342","146.75.37.140","192.168.12.35","TLSv1.2","755","Application Data"
"231","4.691583","192.168.12.35","146.75.37.140","TCP","54","61013  >  443 [ACK] Seq=18120 Ack=97687 Win=1025 Len=0"
"232","4.697165","146.75.37.140","192.168.12.35","TCP","54","443  >  61013 [ACK] Seq=97687 Ack=14629 Win=8196 Len=0"
"233","4.697165","146.75.37.140","192.168.12.35","TCP","54","443  >  61013 [ACK] Seq=97687 Ack=14974 Win=8196 Len=0"
"234","4.712708","192.168.12.35","146.75.37.140","TLSv1.2","3176","Application Data"
"235","4.712808","192.168.12.35","146.75.37.140","TLSv1.2","210","Application Data"
"236","4.728230","146.75.37.140","192.168.12.35","TCP","1430","443  >  61013 [ACK] Seq=97687 Ack=14974 Win=8196 Len=1376 [TCP PDU reassembled in 237]"
"237","4.728230","146.75.37.140","192.168.12.35","TLSv1.2","503","Application Data"
"238","4.728230","146.75.37.140","192.168.12.35","TCP","54","443  >  61013 [ACK] Seq=99512 Ack=16370 Win=8196 Len=0"
"239","4.728754","192.168.12.35","146.75.37.140","TCP","54","61013  >  443 [ACK] Seq=21398 Ack=99512 Win=1025 Len=0"
"240","4.739872","146.75.37.140","192.168.12.35","TCP","54","443  >  61013 [ACK] Seq=99512 Ack=17766 Win=8196 Len=0"
"241","4.747971","146.75.37.140","192.168.12.35","TCP","54","443  >  61013 [ACK] Seq=99512 Ack=18120 Win=8196 Len=0"
"242","4.796371","146.75.37.140","192.168.12.35","TCP","54","443  >  61013 [ACK] Seq=99512 Ack=19516 Win=8196 Len=0"
"243","4.796371","146.75.37.140","192.168.12.35","TCP","1430","443  >  61013 [ACK] Seq=99512 Ack=19516 Win=8196 Len=1376 [TCP PDU reassembled in 244]"
"244","4.796371","146.75.37.140","192.168.12.35","TLSv1.2","851","Application Data"
"245","4.796371","146.75.37.140","192.168.12.35","TLSv1.2","100","Application Data"
"246","4.796371","146.75.37.140","192.168.12.35","TCP","54","443  >  61013 [ACK] Seq=101731 Ack=21242 Win=8196 Len=0"
"247","4.796371","146.75.37.140","192.168.12.35","TCP","54","443  >  61013 [ACK] Seq=101731 Ack=21398 Win=8196 Len=0"
"248","4.797339","192.168.12.35","146.75.37.140","TCP","54","61013  >  443 [ACK] Seq=21398 Ack=101685 Win=1025 Len=0"
"249","4.813876","146.75.37.140","192.168.12.35","TLSv1.2","604","Application Data"
"250","4.814645","192.168.12.35","146.75.37.140","TCP","54","61013  >  443 [ACK] Seq=21398 Ack=102281 Win=1022 Len=0"
"251","4.851827","146.75.37.140","192.168.12.35","TCP","1430","443  >  61013 [ACK] Seq=102281 Ack=21398 Win=8196 Len=1376 [TCP PDU reassembled in 252]"
"252","4.851827","146.75.37.140","192.168.12.35","TLSv1.2","636","Application Data"
"253","4.852401","192.168.12.35","146.75.37.140","TCP","54","61013  >  443 [ACK] Seq=21398 Ack=104239 Win=1025 Len=0"
"254","5.102840","192.168.12.35","146.75.37.140","TLSv1.2","3290","Application Data"
"255","5.114463","192.168.12.35","146.75.37.140","TLSv1.2","3195","Application Data"
"256","5.114792","192.168.12.35","146.75.37.140","TLSv1.2","3210","Application Data"
"257","5.114843","192.168.12.35","146.75.37.140","TLSv1.2","3187","Application Data"
"258","5.151549","146.75.37.140","192.168.12.35","TCP","54","443  >  61013 [ACK] Seq=104239 Ack=22794 Win=8196 Len=0"
"259","5.168745","146.75.37.140","192.168.12.35","TCP","54","443  >  61013 [ACK] Seq=104239 Ack=24190 Win=8196 Len=0"
"260","5.168745","146.75.37.140","192.168.12.35","TCP","54","443  >  61013 [ACK] Seq=104239 Ack=24634 Win=8196 Len=0"
"261","5.180914","146.75.37.140","192.168.12.35","TCP","54","443  >  61013 [ACK] Seq=104239 Ack=26030 Win=8196 Len=0"
"262","5.206970","146.75.37.140","192.168.12.35","TCP","1430","443  >  61013 [ACK] Seq=104239 Ack=26030 Win=8196 Len=1376 [TCP PDU reassembled in 263]"
"263","5.206970","146.75.37.140","192.168.12.35","TLSv1.2","879","Application Data"
"264","5.206970","146.75.37.140","192.168.12.35","TLSv1.2","100","Application Data"
"265","5.206970","146.75.37.140","192.168.12.35","TCP","54","443  >  61013 [ACK] Seq=106486 Ack=27426 Win=8196 Len=0"
"266","5.207763","192.168.12.35","146.75.37.140","TCP","54","61013  >  443 [ACK] Seq=34064 Ack=106440 Win=1025 Len=0"
"267","5.221868","146.75.37.140","192.168.12.35","TCP","54","443  >  61013 [ACK] Seq=106486 Ack=27775 Win=8196 Len=0"
"268","5.231386","146.75.37.140","192.168.12.35","TCP","54","443  >  61013 [ACK] Seq=106486 Ack=29171 Win=8196 Len=0"
"269","5.251767","192.168.12.35","146.75.37.140","TCP","54","61013  >  443 [ACK] Seq=34064 Ack=106486 Win=1025 Len=0"
"270","5.252747","146.75.37.140","192.168.12.35","TCP","1430","443  >  61013 [ACK] Seq=106486 Ack=29171 Win=8196 Len=1376 [TCP PDU reassembled in 271]"
"271","5.252747","146.75.37.140","192.168.12.35","TLSv1.2","486","Application Data"
"272","5.252747","146.75.37.140","192.168.12.35","TCP","54","443  >  61013 [ACK] Seq=108294 Ack=30567 Win=8196 Len=0"
"273","5.253174","192.168.12.35","146.75.37.140","TCP","54","61013  >  443 [ACK] Seq=34064 Ack=108294 Win=1025 Len=0"
"274","5.256571","146.75.37.140","192.168.12.35","TCP","54","443  >  61013 [ACK] Seq=108294 Ack=30931 Win=8196 Len=0"
"275","5.262694","192.168.12.35","146.75.37.140","TLSv1.2","3172","Application Data"
"276","5.262913","192.168.12.35","146.75.37.140","TLSv1.2","134","Application Data"
"277","5.283623","146.75.37.140","192.168.12.35","TCP","1430","443  >  61013 [ACK] Seq=108294 Ack=30931 Win=8196 Len=1376 [TCP PDU reassembled in 278]"
"278","5.283623","146.75.37.140","192.168.12.35","TLSv1.2","850","Application Data"
"279","5.283623","146.75.37.140","192.168.12.35","TLSv1.2","100","Application Data"
"280","5.284521","192.168.12.35","146.75.37.140","TCP","54","61013  >  443 [ACK] Seq=37262 Ack=110466 Win=1025 Len=0"
"281","5.291197","146.75.37.140","192.168.12.35","TCP","54","443  >  61013 [ACK] Seq=110512 Ack=32327 Win=8196 Len=0"
"282","5.311891","146.75.37.140","192.168.12.35","TCP","54","443  >  61013 [ACK] Seq=110512 Ack=33723 Win=8196 Len=0"
"283","5.318320","146.75.37.140","192.168.12.35","TCP","54","443  >  61013 [ACK] Seq=110512 Ack=34064 Win=8196 Len=0"
"284","5.318320","146.75.37.140","192.168.12.35","TLSv1.2","996","Application Data"
"285","5.318641","192.168.12.35","146.75.37.140","TCP","54","61013  >  443 [ACK] Seq=37262 Ack=111454 Win=1021 Len=0"
"286","5.324998","192.168.12.35","146.75.37.140","TLSv1.2","3146","Application Data"
"287","5.357525","146.75.37.140","192.168.12.35","TLSv1.2","123","Application Data"
"288","5.357525","146.75.37.140","192.168.12.35","TLSv1.2","85","Application Data"
"289","5.357525","146.75.37.140","192.168.12.35","TCP","1430","443  >  61013 [ACK] Seq=111554 Ack=34064 Win=8196 Len=1376 [TCP PDU reassembled in 290]"
"290","5.357525","146.75.37.140","192.168.12.35","TLSv1.2","486","Application Data"
"291","5.358027","192.168.12.35","146.75.37.140","TCP","54","61013  >  443 [ACK] Seq=40354 Ack=111554 Win=1020 Len=0"
"292","5.358200","192.168.12.35","146.75.37.140","TCP","54","61013  >  443 [ACK] Seq=40354 Ack=112930 Win=1025 Len=0"
"293","5.358244","192.168.12.35","146.75.37.140","TCP","54","61013  >  443 [ACK] Seq=40354 Ack=113362 Win=1023 Len=0"
"294","5.398509","146.75.37.140","192.168.12.35","TCP","1430","443  >  61013 [ACK] Seq=113362 Ack=34064 Win=8196 Len=1376 [TCP PDU reassembled in 295]"
"295","5.398509","146.75.37.140","192.168.12.35","TLSv1.2","112","Application Data"
"296","5.398509","146.75.37.140","192.168.12.35","TLSv1.2","892","Application Data"
"297","5.398509","146.75.37.140","192.168.12.35","TLSv1.2","85","Application Data"
"298","5.398846","192.168.12.35","146.75.37.140","TCP","54","61013  >  443 [ACK] Seq=40354 Ack=114738 Win=1025 Len=0"
"299","5.398940","192.168.12.35","146.75.37.140","TCP","54","61013  >  443 [ACK] Seq=40354 Ack=114796 Win=1024 Len=0"
"300","5.398968","192.168.12.35","146.75.37.140","TCP","54","61013  >  443 [ACK] Seq=40354 Ack=115665 Win=1021 Len=0"
"301","5.544622","146.75.37.140","192.168.12.35","TLSv1.2","957","Application Data"
"302","5.544622","146.75.37.140","192.168.12.35","TLSv1.2","85","Application Data"
"303","5.545347","192.168.12.35","146.75.37.140","TCP","54","61013  >  443 [ACK] Seq=40354 Ack=116568 Win=1025 Len=0"
"304","5.545684","192.168.12.35","146.75.37.140","TCP","54","61013  >  443 [ACK] Seq=40354 Ack=116599 Win=1025 Len=0"
"305","5.591950","192.168.12.35","146.75.37.140","TCP","1450","[TCP Retransmission] 61013  >  443 [PSH, ACK] Seq=38958 Ack=116599 Win=1025 Len=1396"
"306","5.868442","146.75.37.140","192.168.12.35","TCP","54","443  >  61013 [ACK] Seq=116599 Ack=35460 Win=8196 Len=0"
"307","5.892104","146.75.37.140","192.168.12.35","TCP","54","443  >  61013 [ACK] Seq=116599 Ack=36856 Win=8196 Len=0"
"308","5.892104","146.75.37.140","192.168.12.35","TCP","54","443  >  61013 [ACK] Seq=116599 Ack=37182 Win=8196 Len=0"
"309","5.892104","146.75.37.140","192.168.12.35","TCP","54","443  >  61013 [ACK] Seq=116599 Ack=37262 Win=8196 Len=0"
"310","5.913534","146.75.37.140","192.168.12.35","TCP","54","443  >  61013 [ACK] Seq=116599 Ack=38658 Win=8196 Len=0"
"311","5.919001","146.75.37.140","192.168.12.35","TCP","1430","443  >  61013 [ACK] Seq=116599 Ack=38658 Win=8196 Len=1376 [TCP PDU reassembled in 312]"
"312","5.919001","146.75.37.140","192.168.12.35","TLSv1.2","796","Application Data"
"313","5.919001","146.75.37.140","192.168.12.35","TLSv1.2","1108","Application Data"
"314","5.919787","192.168.12.35","146.75.37.140","TCP","54","61013  >  443 [ACK] Seq=40354 Ack=117975 Win=1025 Len=0"
"315","5.920143","192.168.12.35","146.75.37.140","TCP","54","61013  >  443 [ACK] Seq=40354 Ack=118717 Win=1022 Len=0"
"316","5.920199","192.168.12.35","146.75.37.140","TCP","54","61013  >  443 [ACK] Seq=40354 Ack=119771 Win=1025 Len=0"
"317","5.944831","146.75.37.140","192.168.12.35","TCP","54","443  >  61013 [ACK] Seq=119771 Ack=40054 Win=8196 Len=0"
"318","5.951429","146.75.37.140","192.168.12.35","TCP","54","443  >  61013 [ACK] Seq=119771 Ack=40354 Win=8196 Len=0"
"319","5.988228","146.75.37.140","192.168.12.35","TCP","1430","443  >  61013 [ACK] Seq=119771 Ack=40354 Win=8196 Len=1376 [TCP PDU reassembled in 320]"
"320","5.988228","146.75.37.140","192.168.12.35","TLSv1.2","479","Application Data"
"321","5.989056","192.168.12.35","146.75.37.140","TCP","54","61013  >  443 [ACK] Seq=40354 Ack=121572 Win=1025 Len=0"
"322","6.074789","146.75.37.140","192.168.12.35","TLSv1.2","251","Application Data"
"323","6.074789","146.75.37.140","192.168.12.35","TLSv1.2","173","Application Data"
"324","6.074789","146.75.37.140","192.168.12.35","TCP","1430","443  >  61013 [ACK] Seq=121888 Ack=40354 Win=8196 Len=1376 [TCP PDU reassembled in 325]"
"325","6.074789","146.75.37.140","192.168.12.35","TLSv1.2","995","Application Data"
"326","6.076008","192.168.12.35","146.75.37.140","TCP","54","61013  >  443 [ACK] Seq=40354 Ack=121888 Win=1023 Len=0"
"327","6.076464","192.168.12.35","146.75.37.140","TCP","54","61013  >  443 [ACK] Seq=40354 Ack=124205 Win=1025 Len=0"
"328","6.080212","146.75.37.140","192.168.12.35","TLSv1.2","1428","Application Data"
"329","6.080212","146.75.37.140","192.168.12.35","TLSv1.2","1239","Application Data"
"330","6.080212","146.75.37.140","192.168.12.35","TLSv1.2","263","Application Data"
"331","6.080212","146.75.37.140","192.168.12.35","TCP","1430","443  >  61013 [ACK] Seq=126973 Ack=40354 Win=8196 Len=1376 [TCP PDU reassembled in 332]"
"332","6.080212","146.75.37.140","192.168.12.35","TLSv1.2","595","Application Data"
"333","6.080212","146.75.37.140","192.168.12.35","TLSv1.2","335","Application Data"
"334","6.080758","192.168.12.35","146.75.37.140","TCP","54","61013  >  443 [ACK] Seq=40354 Ack=126764 Win=1025 Len=0"
"335","6.081044","192.168.12.35","146.75.37.140","TCP","54","61013  >  443 [ACK] Seq=40354 Ack=128349 Win=1025 Len=0"
"336","6.081233","192.168.12.35","146.75.37.140","TCP","54","61013  >  443 [ACK] Seq=40354 Ack=129171 Win=1021 Len=0"
"337","6.093965","146.75.37.140","192.168.12.35","TLSv1.2","261","Application Data"
"338","6.093965","146.75.37.140","192.168.12.35","TLSv1.2","240","Application Data"
"339","6.094621","192.168.12.35","146.75.37.140","TCP","54","61013  >  443 [ACK] Seq=40354 Ack=129564 Win=1020 Len=0"
"340","6.096899","146.75.37.140","192.168.12.35","TLSv1.2","175","Application Data"
"341","6.103875","146.75.37.140","192.168.12.35","TCP","66","[TCP Dup ACK 318#1] 443  >  61013 [ACK] Seq=129685 Ack=40354 Win=8196 Len=0 SLE=38958 SRE=40354"
"342","6.103875","146.75.37.140","192.168.12.35","TLSv1.2","417","Application Data"
"343","6.103875","146.75.37.140","192.168.12.35","TLSv1.2","309","Application Data"
"344","6.103875","146.75.37.140","192.168.12.35","TLSv1.2","251","Application Data"
"345","6.103875","146.75.37.140","192.168.12.35","TLSv1.2","177","Application Data"
"346","6.103875","146.75.37.140","192.168.12.35","TLSv1.2","518","Application Data"
"347","6.103875","146.75.37.140","192.168.12.35","TLSv1.2","281","Application Data"
"348","6.104895","192.168.12.35","146.75.37.140","TCP","54","61013  >  443 [ACK] Seq=40354 Ack=130048 Win=1025 Len=0"
"349","6.105271","192.168.12.35","146.75.37.140","TCP","54","61013  >  443 [ACK] Seq=40354 Ack=130500 Win=1023 Len=0"
"350","6.105337","192.168.12.35","146.75.37.140","TCP","54","61013  >  443 [ACK] Seq=40354 Ack=131087 Win=1021 Len=0"
"351","6.117928","146.75.37.140","192.168.12.35","TLSv1.2","404","Application Data"
"352","6.117928","146.75.37.140","192.168.12.35","TLSv1.2","274","Application Data"
"353","6.117928","146.75.37.140","192.168.12.35","TLSv1.2","236","Application Data"
"354","6.117928","146.75.37.140","192.168.12.35","TLSv1.2","179","Application Data"
"355","6.118708","192.168.12.35","146.75.37.140","TCP","54","61013  >  443 [ACK] Seq=40354 Ack=131664 Win=1025 Len=0"
"356","6.119051","192.168.12.35","146.75.37.140","TCP","54","61013  >  443 [ACK] Seq=40354 Ack=132066 Win=1023 Len=0"
"357","6.124757","146.75.37.140","192.168.12.35","TLSv1.2","610","Application Data"
"358","6.124757","146.75.37.140","192.168.12.35","TLSv1.2","509","Application Data"
"359","6.124757","146.75.37.140","192.168.12.35","TLSv1.2","580","Application Data"
"360","6.124757","146.75.37.140","192.168.12.35","TLSv1.2","572","Application Data"
"361","6.124757","146.75.37.140","192.168.12.35","TLSv1.2","258","Application Data"
"362","6.124757","146.75.37.140","192.168.12.35","TLSv1.2","744","Application Data"
"363","6.124757","146.75.37.140","192.168.12.35","TLSv1.2","233","Application Data"
"364","6.124757","146.75.37.140","192.168.12.35","TLSv1.2","486","Application Data"
"365","6.126278","192.168.12.35","146.75.37.140","TCP","54","61013  >  443 [ACK] Seq=40354 Ack=132747 Win=1020 Len=0"
"366","6.126594","192.168.12.35","146.75.37.140","TCP","54","61013  >  443 [ACK] Seq=40354 Ack=133728 Win=1025 Len=0"
"367","6.126772","192.168.12.35","146.75.37.140","TCP","54","61013  >  443 [ACK] Seq=40354 Ack=134450 Win=1022 Len=0"
"368","6.126901","192.168.12.35","146.75.37.140","TCP","54","61013  >  443 [ACK] Seq=40354 Ack=135319 Win=1025 Len=0"
"369","6.131989","192.168.12.35","146.75.37.140","UDP","1292","50355  >  443 Len=1250"
"370","6.132496","192.168.12.35","146.75.37.140","UDP","546","50355  >  443 Len=504"
"371","6.138060","146.75.37.140","192.168.12.35","TLSv1.2","672","Application Data"
"372","6.139294","192.168.12.35","146.75.37.140","TCP","54","61013  >  443 [ACK] Seq=40354 Ack=136369 Win=1021 Len=0"
"373","6.158988","146.75.37.140","192.168.12.35","TLSv1.2","567","Application Data"
"374","6.158988","146.75.37.140","192.168.12.35","TLSv1.2","262","Application Data"
"375","6.158988","146.75.37.140","192.168.12.35","TLSv1.2","761","Application Data"
"376","6.158988","146.75.37.140","192.168.12.35","TLSv1.2","317","Application Data"
"377","6.159461","192.168.12.35","146.75.37.140","TCP","54","61013  >  443 [ACK] Seq=40354 Ack=137090 Win=1025 Len=0"
"378","6.159692","192.168.12.35","146.75.37.140","TCP","54","61013  >  443 [ACK] Seq=40354 Ack=138060 Win=1021 Len=0"
"379","6.176575","146.75.37.140","192.168.12.35","TLSv1.2","763","Application Data"
"380","6.201739","146.75.37.140","192.168.12.35","TLSv1.2","282","Application Data"
"381","6.201739","146.75.37.140","192.168.12.35","TLSv1.2","145","Application Data"
"382","6.201739","146.75.37.140","192.168.12.35","TLSv1.2","574","Application Data"
"383","6.201739","146.75.37.140","192.168.12.35","TLSv1.2","618","Application Data"
"384","6.201739","146.75.37.140","192.168.12.35","TLSv1.2","388","Application Data"
"385","6.201739","146.75.37.140","192.168.12.35","TLSv1.2","211","Application Data"
"386","6.201739","146.75.37.140","192.168.12.35","TLSv1.2","349","Application Data"
"387","6.201739","146.75.37.140","192.168.12.35","TLSv1.2","265","Application Data"
"388","6.201739","146.75.37.140","192.168.12.35","TLSv1.2","450","Application Data"
"389","6.201739","146.75.37.140","192.168.12.35","TLSv1.2","537","Application Data"
"390","6.201739","146.75.37.140","192.168.12.35","TLSv1.2","375","Application Data"
"391","6.202812","192.168.12.35","146.75.37.140","TCP","54","61013  >  443 [ACK] Seq=40354 Ack=138997 Win=1025 Len=0"
"392","6.203287","192.168.12.35","146.75.37.140","TCP","54","61013  >  443 [ACK] Seq=40354 Ack=139608 Win=1022 Len=0"
"393","6.203365","192.168.12.35","146.75.37.140","TCP","54","61013  >  443 [ACK] Seq=40354 Ack=140506 Win=1025 Len=0"
"394","6.203422","192.168.12.35","146.75.37.140","TCP","54","61013  >  443 [ACK] Seq=40354 Ack=140958 Win=1023 Len=0"
"395","6.203629","192.168.12.35","146.75.37.140","TCP","54","61013  >  443 [ACK] Seq=40354 Ack=141565 Win=1021 Len=0"
"396","6.203700","192.168.12.35","146.75.37.140","TCP","54","61013  >  443 [ACK] Seq=40354 Ack=142369 Win=1025 Len=0"
"397","6.205463","192.168.12.35","146.75.37.140","UDP","1292","50355  >  443 Len=1250"
"398","6.205597","192.168.12.35","146.75.37.140","UDP","543","50355  >  443 Len=501"
"399","6.219371","146.75.37.140","192.168.12.35","TLSv1.2","674","Application Data"
"400","6.219371","146.75.37.140","192.168.12.35","TLSv1.2","430","Application Data"
"401","6.219371","146.75.37.140","192.168.12.35","TLSv1.2","251","Application Data"
"402","6.219371","146.75.37.140","192.168.12.35","TLSv1.2","919","Application Data"
"403","6.219371","146.75.37.140","192.168.12.35","TLSv1.2","737","Application Data"
"404","6.219371","146.75.37.140","192.168.12.35","TLSv1.2","433","Application Data"
"405","6.220208","192.168.12.35","146.75.37.140","TCP","54","61013  >  443 [ACK] Seq=40354 Ack=143365 Win=1021 Len=0"
"406","6.220364","192.168.12.35","146.75.37.140","TCP","54","61013  >  443 [ACK] Seq=40354 Ack=144427 Win=1025 Len=0"
"407","6.220398","192.168.12.35","146.75.37.140","TCP","54","61013  >  443 [ACK] Seq=40354 Ack=145489 Win=1021 Len=0"
"408","6.234077","146.75.37.140","192.168.12.35","TLSv1.2","175","Application Data"
"409","6.234077","146.75.37.140","192.168.12.35","TLSv1.2","591","Application Data"
"410","6.234077","146.75.37.140","192.168.12.35","TLSv1.2","323","Application Data"
"411","6.234077","146.75.37.140","192.168.12.35","TLSv1.2","1214","Application Data"
"412","6.234077","146.75.37.140","192.168.12.35","TCP","1430","443  >  61013 [ACK] Seq=147576 Ack=40354 Win=8196 Len=1376 [TCP PDU reassembled in 413]"
"413","6.234077","146.75.37.140","192.168.12.35","TLSv1.2","186","Application Data"
"414","6.234077","146.75.37.140","192.168.12.35","TLSv1.2","908","Application Data"
"415","6.234910","192.168.12.35","146.75.37.140","TCP","54","61013  >  443 [ACK] Seq=40354 Ack=146147 Win=1025 Len=0"
"416","6.235537","192.168.12.35","146.75.37.140","TCP","54","61013  >  443 [ACK] Seq=40354 Ack=147576 Win=1025 Len=0"
"417","6.235663","192.168.12.35","146.75.37.140","TCP","54","61013  >  443 [ACK] Seq=40354 Ack=149084 Win=1025 Len=0"
"418","6.241833","192.168.12.35","146.75.37.140","UDP","888","50355  >  443 Len=846"
"419","6.246670","146.75.37.140","192.168.12.35","TLSv1.2","319","Application Data"
"420","6.246670","146.75.37.140","192.168.12.35","TLSv1.2","246","Application Data"
"421","6.246670","146.75.37.140","192.168.12.35","TLSv1.2","309","Application Data"
"422","6.246670","146.75.37.140","192.168.12.35","TLSv1.2","196","Application Data"
"423","6.246670","146.75.37.140","192.168.12.35","TLSv1.2","473","Application Data"
"424","6.246670","146.75.37.140","192.168.12.35","TCP","1430","443  >  61013 [ACK] Seq=151211 Ack=40354 Win=8196 Len=1376 [TCP PDU reassembled in 425]"
"425","6.246670","146.75.37.140","192.168.12.35","TLSv1.2","825","Application Data"
"426","6.246670","146.75.37.140","192.168.12.35","TLSv1.2","536","Application Data"
"427","6.247295","192.168.12.35","146.75.37.140","TCP","54","61013  >  443 [ACK] Seq=40354 Ack=150203 Win=1020 Len=0"
"428","6.247650","192.168.12.35","146.75.37.140","TCP","54","61013  >  443 [ACK] Seq=40354 Ack=150650 Win=1025 Len=0"
"429","6.247863","192.168.12.35","146.75.37.140","TCP","54","61013  >  443 [ACK] Seq=40354 Ack=151211 Win=1022 Len=0"
"430","6.247946","192.168.12.35","146.75.37.140","TCP","54","61013  >  443 [ACK] Seq=40354 Ack=153358 Win=1025 Len=0"
"431","6.261671","146.75.37.140","192.168.12.35","TLSv1.2","200","Application Data"
"432","6.261671","146.75.37.140","192.168.12.35","TLSv1.2","172","Application Data"
"433","6.262364","192.168.12.35","146.75.37.140","TCP","54","61013  >  443 [ACK] Seq=40354 Ack=153986 Win=1022 Len=0"
"434","6.266797","146.75.37.140","192.168.12.35","TLSv1.2","513","Application Data"
"435","6.266797","146.75.37.140","192.168.12.35","TLSv1.2","799","Application Data"
"436","6.266797","146.75.37.140","192.168.12.35","TLSv1.2","447","Application Data"
"437","6.266797","146.75.37.140","192.168.12.35","TLSv1.2","176","Application Data"
"438","6.266797","146.75.37.140","192.168.12.35","TLSv1.2","871","Application Data"
"439","6.266797","146.75.37.140","192.168.12.35","TLSv1.2","379","Application Data"
"440","6.266797","146.75.37.140","192.168.12.35","TLSv1.2","408","Application Data"
"441","6.266797","146.75.37.140","192.168.12.35","TLSv1.2","177","Application Data"
"442","6.266797","146.75.37.140","192.168.12.35","TLSv1.2","340","Application Data"
"443","6.266797","146.75.37.140","192.168.12.35","TLSv1.2","457","Application Data"
"444","6.266797","146.75.37.140","192.168.12.35","TLSv1.2","449","Application Data"
"445","6.266797","146.75.37.140","192.168.12.35","TLSv1.2","256","Application Data"
"446","6.266797","146.75.37.140","192.168.12.35","TLSv1.2","463","Application Data"
"447","6.266797","146.75.37.140","192.168.12.35","TLSv1.2","301","Application Data"
"448","6.266797","146.75.37.140","192.168.12.35","TLSv1.2","216","Application Data"
"449","6.266797","146.75.37.140","192.168.12.35","TLSv1.2","231","Application Data"
"450","6.266797","146.75.37.140","192.168.12.35","TLSv1.2","237","Application Data"
"451","6.266797","146.75.37.140","192.168.12.35","TLSv1.2","238","Application Data"
"452","6.266797","146.75.37.140","192.168.12.35","TLSv1.2","211","Application Data"
"453","6.266797","146.75.37.140","192.168.12.35","TLSv1.2","238","Application Data"
"454","6.267910","192.168.12.35","146.75.37.140","TCP","54","61013  >  443 [ACK] Seq=40354 Ack=154563 Win=1020 Len=0"
"455","6.268068","192.168.12.35","146.75.37.140","TCP","54","61013  >  443 [ACK] Seq=40354 Ack=155701 Win=1025 Len=0"
"456","6.268130","192.168.12.35","146.75.37.140","TCP","54","61013  >  443 [ACK] Seq=40354 Ack=156640 Win=1021 Len=0"
"457","6.268172","192.168.12.35","146.75.37.140","TCP","54","61013  >  443 [ACK] Seq=40354 Ack=157319 Win=1025 Len=0"
"458","6.268207","192.168.12.35","146.75.37.140","TCP","54","61013  >  443 [ACK] Seq=40354 Ack=157728 Win=1023 Len=0"
"459","6.268244","192.168.12.35","146.75.37.140","TCP","54","61013  >  443 [ACK] Seq=40354 Ack=158526 Win=1020 Len=0"
"460","6.268273","192.168.12.35","146.75.37.140","TCP","54","61013  >  443 [ACK] Seq=40354 Ack=159137 Win=1025 Len=0"
"461","6.268317","192.168.12.35","146.75.37.140","TCP","54","61013  >  443 [ACK] Seq=40354 Ack=159546 Win=1023 Len=0"
"462","6.268355","192.168.12.35","146.75.37.140","TCP","54","61013  >  443 [ACK] Seq=40354 Ack=159906 Win=1022 Len=0"
"463","6.268382","192.168.12.35","146.75.37.140","TCP","54","61013  >  443 [ACK] Seq=40354 Ack=160247 Win=1020 Len=0"
"464","6.273344","146.75.37.140","192.168.12.35","TLSv1.2","445","Application Data"
"465","6.273344","146.75.37.140","192.168.12.35","TLSv1.2","504","Application Data"
"466","6.273344","146.75.37.140","192.168.12.35","TLSv1.2","211","Application Data"
"467","6.273344","146.75.37.140","192.168.12.35","TLSv1.2","187","Application Data"
"468","6.273344","146.75.37.140","192.168.12.35","TLSv1.2","618","Application Data"
"469","6.273344","146.75.37.140","192.168.12.35","TLSv1.2","441","Application Data"
"470","6.273344","146.75.37.140","192.168.12.35","TLSv1.2","611","Application Data"
"471","6.273344","146.75.37.140","192.168.12.35","TLSv1.2","465","Application Data"
"472","6.273344","146.75.37.140","192.168.12.35","TLSv1.2","246","Application Data"
"473","6.273344","146.75.37.140","192.168.12.35","TLSv1.2","847","Application Data"
"474","6.273344","146.75.37.140","192.168.12.35","TLSv1.2","239","Application Data"
"475","6.273344","146.75.37.140","192.168.12.35","TLSv1.2","237","Application Data"
"476","6.273344","146.75.37.140","192.168.12.35","TLSv1.2","1427","Application Data"
"477","6.273344","146.75.37.140","192.168.12.35","TLSv1.2","755","Application Data"
"478","6.273344","146.75.37.140","192.168.12.35","TCP","1430","443  >  61013 [ACK] Seq=166908 Ack=40354 Win=8196 Len=1376 [TCP PDU reassembled in 479]"
"479","6.273344","146.75.37.140","192.168.12.35","TLSv1.2","229","Application Data"
"480","6.273848","192.168.12.35","146.75.37.140","TCP","54","61013  >  443 [ACK] Seq=40354 Ack=160822 Win=1025 Len=0"
"481","6.273974","192.168.12.35","146.75.37.140","TCP","54","61013  >  443 [ACK] Seq=40354 Ack=161429 Win=1022 Len=0"
"482","6.274019","192.168.12.35","146.75.37.140","TCP","54","61013  >  443 [ACK] Seq=40354 Ack=162126 Win=1020 Len=0"
"483","6.274044","192.168.12.35","146.75.37.140","TCP","54","61013  >  443 [ACK] Seq=40354 Ack=163070 Win=1025 Len=0"
"484","6.274084","192.168.12.35","146.75.37.140","TCP","54","61013  >  443 [ACK] Seq=40354 Ack=163673 Win=1022 Len=0"
"485","6.274107","192.168.12.35","146.75.37.140","TCP","54","61013  >  443 [ACK] Seq=40354 Ack=164651 Win=1025 Len=0"
"486","6.274130","192.168.12.35","146.75.37.140","TCP","54","61013  >  443 [ACK] Seq=40354 Ack=166207 Win=1025 Len=0"
"487","6.274152","192.168.12.35","146.75.37.140","TCP","54","61013  >  443 [ACK] Seq=40354 Ack=168284 Win=1025 Len=0"
"488","6.279631","146.75.37.140","192.168.12.35","TLSv1.2","434","Application Data"
"489","6.279631","146.75.37.140","192.168.12.35","TLSv1.2","295","Application Data"
"490","6.279631","146.75.37.140","192.168.12.35","TLSv1.2","85","Application Data"
"491","6.280382","192.168.12.35","146.75.37.140","TCP","54","61013  >  443 [ACK] Seq=40354 Ack=168839 Win=1023 Len=0"
"492","6.280905","192.168.12.35","146.75.37.140","TCP","54","61013  >  443 [ACK] Seq=40354 Ack=169111 Win=1021 Len=0"
"493","6.293892","192.168.12.35","146.75.37.140","TCP","55","61140  >  443 [ACK] Seq=1 Ack=1 Win=2047 Len=1"
"494","6.378031","146.75.37.140","192.168.12.35","UDP","67","443  >  50355 Len=25"
"495","6.393560","146.75.37.140","192.168.12.35","UDP","953","443  >  50355 Len=911"
"496","6.411945","146.75.37.140","192.168.12.35","UDP","67","443  >  50355 Len=25"
"497","6.413669","192.168.12.35","146.75.37.140","UDP","83","50355  >  443 Len=41"
"498","6.426504","146.75.37.140","192.168.12.35","UDP","1322","443  >  50355 Len=1280"
"499","6.426504","146.75.37.140","192.168.12.35","UDP","639","443  >  50355 Len=597"
"500","6.430972","146.75.37.140","192.168.12.35","UDP","795","443  >  50355 Len=753"
"501","6.435158","192.168.12.35","146.75.37.140","UDP","83","50355  >  443 Len=41"
"502","6.436651","146.75.37.140","192.168.12.35","TCP","66","443  >  61140 [ACK] Seq=1 Ack=2 Win=424 Len=0 SLE=1 SRE=2"
"503","6.438936","192.168.12.35","146.75.37.140","UDP","1292","50355  >  443 Len=1250"
"504","6.439105","192.168.12.35","146.75.37.140","UDP","1019","50355  >  443 Len=977"
"505","6.456258","146.75.37.140","192.168.12.35","UDP","67","443  >  50355 Len=25"
"506","6.772152","192.168.12.35","146.75.37.140","UDP","1292","50355  >  443 Len=1250"
"507","6.815011","146.75.37.140","192.168.12.35","UDP","67","443  >  50355 Len=25"
"508","6.886528","146.75.37.140","192.168.12.35","UDP","69","443  >  50355 Len=27"
"509","6.997696","146.75.37.140","192.168.12.35","UDP","1220","443  >  50355 Len=1178"
"510","7.021528","192.168.12.35","146.75.37.140","UDP","84","50355  >  443 Len=42"
"511","7.305753","192.168.12.35","146.75.37.140","UDP","1292","50355  >  443 Len=1250"
"512","7.305969","192.168.12.35","146.75.37.140","UDP","1022","50355  >  443 Len=980"
"513","7.366882","146.75.37.140","192.168.12.35","UDP","67","443  >  50355 Len=25"
"514","7.578867","192.168.12.35","146.75.37.140","UDP","80","50355  >  443 Len=38"
"515","7.670959","146.75.37.140","192.168.12.35","UDP","67","443  >  50355 Len=25"
"516","7.874911","192.168.12.35","146.75.37.140","UDP","80","50355  >  443 Len=38"
"517","7.927626","146.75.37.140","192.168.12.35","UDP","67","443  >  50355 Len=25"
"518","8.138015","192.168.12.35","146.75.37.140","UDP","80","50355  >  443 Len=38"
"519","8.192638","146.75.37.140","192.168.12.35","UDP","67","443  >  50355 Len=25"
"520","8.400020","192.168.12.35","146.75.37.140","UDP","80","50355  >  443 Len=38"
"521","8.568976","146.75.37.140","192.168.12.35","UDP","67","443  >  50355 Len=25"
"522","8.772231","192.168.12.35","146.75.37.140","UDP","80","50355  >  443 Len=38"
"523","8.971861","146.75.37.140","192.168.12.35","UDP","67","443  >  50355 Len=25"
"524","9.147099","192.168.12.35","146.75.37.140","TLSv1.2","3359","Application Data"
"525","9.147292","192.168.12.35","146.75.37.140","TLSv1.2","1833","Application Data"
"526","9.177318","192.168.12.35","146.75.37.140","UDP","80","50355  >  443 Len=38"
"527","9.211425","146.75.37.140","192.168.12.35","TCP","54","443  >  61013 [ACK] Seq=169111 Ack=41750 Win=8196 Len=0"
"528","9.219441","146.75.37.140","192.168.12.35","TCP","54","443  >  61013 [ACK] Seq=169111 Ack=43146 Win=8196 Len=0"
"529","9.226449","146.75.37.140","192.168.12.35","TCP","54","443  >  61013 [ACK] Seq=169111 Ack=43659 Win=8196 Len=0"
"530","9.256065","146.75.37.140","192.168.12.35","TCP","54","443  >  61013 [ACK] Seq=169111 Ack=45055 Win=8196 Len=0"
"531","9.256065","146.75.37.140","192.168.12.35","TCP","54","443  >  61013 [ACK] Seq=169111 Ack=45438 Win=8196 Len=0"
"532","9.281634","146.75.37.140","192.168.12.35","TCP","1430","443  >  61013 [ACK] Seq=169111 Ack=45438 Win=8196 Len=1376 [TCP PDU reassembled in 533]"
"533","9.281634","146.75.37.140","192.168.12.35","TLSv1.2","797","Application Data"
"534","9.281634","146.75.37.140","192.168.12.35","UDP","67","443  >  50355 Len=25"
"535","9.281937","192.168.12.35","146.75.37.140","TCP","54","61013  >  443 [ACK] Seq=45438 Ack=171230 Win=1025 Len=0"
"536","9.284148","192.168.12.35","146.75.37.140","TLSv1.2","89","Application Data"
"537","9.353463","146.75.37.140","192.168.12.35","TCP","54","443  >  61013 [ACK] Seq=171230 Ack=45473 Win=8196 Len=0"
"538","9.440913","192.168.12.35","146.75.37.140","TCP","55","62042  >  443 [ACK] Seq=1 Ack=1 Win=1025 Len=1"
"539","9.656934","146.75.37.140","192.168.12.35","TCP","66","443  >  62042 [ACK] Seq=1 Ack=2 Win=302 Len=0 SLE=1 SRE=2"
"540","9.688344","192.168.12.35","146.75.37.140","UDP","80","50355  >  443 Len=38"
"541","9.748202","146.75.37.140","192.168.12.35","UDP","67","443  >  50355 Len=25"
"542","9.764995","192.168.12.35","146.75.37.140","TLSv1.2","3351","Application Data"
"543","9.765086","192.168.12.35","146.75.37.140","TLSv1.2","2286","Application Data"
"544","9.861490","146.75.37.140","192.168.12.35","TCP","54","443  >  61013 [ACK] Seq=171230 Ack=46869 Win=8196 Len=0"
"545","9.876488","146.75.37.140","192.168.12.35","TCP","54","443  >  61013 [ACK] Seq=171230 Ack=48265 Win=8196 Len=0"
"546","9.886050","146.75.37.140","192.168.12.35","TCP","54","443  >  61013 [ACK] Seq=171230 Ack=48770 Win=8196 Len=0"
"547","9.903228","146.75.37.140","192.168.12.35","TCP","54","443  >  61013 [ACK] Seq=171230 Ack=50166 Win=8196 Len=0"
"548","9.912821","146.75.37.140","192.168.12.35","TCP","54","443  >  61013 [ACK] Seq=171230 Ack=51002 Win=8196 Len=0"
"549","9.954061","146.75.37.140","192.168.12.35","TCP","1430","443  >  61013 [ACK] Seq=171230 Ack=51002 Win=8196 Len=1376 [TCP PDU reassembled in 550]"
"550","9.954061","146.75.37.140","192.168.12.35","TLSv1.2","612","Application Data"
"551","9.954255","192.168.12.35","146.75.37.140","TCP","54","61013  >  443 [ACK] Seq=51002 Ack=173164 Win=1025 Len=0"
"552","10.556165","192.168.12.35","146.75.37.140","UDP","80","50355  >  443 Len=38"
"553","10.606997","146.75.37.140","192.168.12.35","UDP","67","443  >  50355 Len=25"
"554","12.208153","192.168.12.35","146.75.37.140","UDP","80","50355  >  443 Len=38"
"555","12.360982","146.75.37.140","192.168.12.35","UDP","67","443  >  50355 Len=25"
"556","13.352592","192.168.12.35","146.75.37.140","TCP","55","61034  >  443 [ACK] Seq=1 Ack=1 Win=8201 Len=1"
"557","13.368608","192.168.12.35","146.75.37.140","TCP","55","61039  >  443 [ACK] Seq=1 Ack=1 Win=2050 Len=1"
"558","13.390408","146.75.37.140","192.168.12.35","TCP","66","443  >  61034 [ACK] Seq=1 Ack=2 Win=424 Len=0 SLE=1 SRE=2"
"559","13.394964","146.75.37.140","192.168.12.35","TCP","66","443  >  61039 [ACK] Seq=1 Ack=2 Win=424 Len=0 SLE=1 SRE=2"
"560","14.169807","192.168.12.35","146.75.37.140","TLSv1.2","3359","Application Data"
"561","14.169911","192.168.12.35","146.75.37.140","TLSv1.2","571","Application Data"
"562","14.286482","146.75.37.140","192.168.12.35","TCP","54","443  >  61013 [ACK] Seq=173164 Ack=52398 Win=8196 Len=0"
"563","14.303038","146.75.37.140","192.168.12.35","TCP","54","443  >  61013 [ACK] Seq=173164 Ack=53794 Win=8196 Len=0"
"564","14.314455","146.75.37.140","192.168.12.35","TCP","54","443  >  61013 [ACK] Seq=173164 Ack=54307 Win=8196 Len=0"
"565","14.314455","146.75.37.140","192.168.12.35","TCP","54","443  >  61013 [ACK] Seq=173164 Ack=54824 Win=8196 Len=0"
"566","14.341139","146.75.37.140","192.168.12.35","TCP","1430","443  >  61013 [ACK] Seq=173164 Ack=54824 Win=8196 Len=1376 [TCP PDU reassembled in 567]"
"567","14.341139","146.75.37.140","192.168.12.35","TLSv1.2","813","Application Data"
"568","14.341294","192.168.12.35","146.75.37.140","TCP","54","61013  >  443 [ACK] Seq=54824 Ack=175299 Win=1025 Len=0"
"569","14.342871","192.168.12.35","146.75.37.140","TLSv1.2","89","Application Data"
"570","14.374900","146.75.37.140","192.168.12.35","TCP","54","443  >  61013 [ACK] Seq=175299 Ack=54859 Win=8196 Len=0"
"571","15.563516","192.168.12.35","146.75.37.140","UDP","80","50355  >  443 Len=38"
"572","15.618913","146.75.37.140","192.168.12.35","UDP","67","443  >  50355 Len=25"
