"No.","Time","Source","Destination","Protocol","Length","Info"
"1","0.000000","192.168.12.35","146.75.37.140","TCP","55","62042  >  443 [ACK] Seq=1 Ack=1 Win=1025 Len=1 [TCP PDU reassembled in 2302]"
"2","0.399007","146.75.37.140","192.168.12.35","TCP","66","443  >  62042 [ACK] Seq=1 Ack=2 Win=302 Len=0 SLE=1 SRE=2"
"3","0.421376","192.168.12.35","146.75.37.140","TLSv1.2","3190","Application Data"
"4","0.421557","192.168.12.35","146.75.37.140","TLSv1.2","93","Application Data"
"5","0.429499","192.168.12.35","146.75.37.140","TLSv1.2","3359","Application Data"
"6","0.429728","192.168.12.35","146.75.37.140","TLSv1.2","452","Application Data"
"7","0.467146","146.75.37.140","192.168.12.35","TCP","54","443  >  61013 [ACK] Seq=1 Ack=1397 Win=8196 Len=0"
"8","0.490139","146.75.37.140","192.168.12.35","TCP","54","443  >  61013 [ACK] Seq=1 Ack=2793 Win=8196 Len=0"
"9","0.500449","146.75.37.140","192.168.12.35","TCP","54","443  >  61013 [ACK] Seq=1 Ack=3137 Win=8196 Len=0"
"10","0.506484","146.75.37.140","192.168.12.35","TCP","54","443  >  61013 [ACK] Seq=1 Ack=3176 Win=8196 Len=0"
"11","0.506484","146.75.37.140","192.168.12.35","TLSv1.2","93","Application Data"
"12","0.532574","146.75.37.140","192.168.12.35","TLSv1.2","462","Application Data"
"13","0.532574","146.75.37.140","192.168.12.35","TLSv1.2","129","Application Data"
"14","0.532823","192.168.12.35","146.75.37.140","TCP","54","61013  >  443 [ACK] Seq=6879 Ack=448 Win=1023 Len=0"
"15","0.534356","146.75.37.140","192.168.12.35","TLSv1.2","914","Application Data"
"16","0.534356","146.75.37.140","192.168.12.35","TLSv1.2","454","Application Data"
"17","0.534594","192.168.12.35","146.75.37.140","TCP","54","61013  >  443 [ACK] Seq=6879 Ack=1383 Win=1019 Len=0"
"18","0.534729","192.168.12.35","146.75.37.140","TCP","54","61013  >  443 [ACK] Seq=6879 Ack=1783 Win=1025 Len=0"
"19","0.538018","192.168.12.35","146.75.37.140","TLSv1.2","89","Application Data"
"20","0.546454","146.75.37.140","192.168.12.35","TCP","54","443  >  61013 [ACK] Seq=1783 Ack=4572 Win=8196 Len=0"
"21","0.560422","146.75.37.140","192.168.12.35","TCP","54","443  >  61013 [ACK] Seq=1783 Ack=5968 Win=8196 Len=0"
"22","0.575476","146.75.37.140","192.168.12.35","TLSv1.2","223","Application Data"
"23","0.575476","146.75.37.140","192.168.12.35","TCP","54","443  >  61013 [ACK] Seq=1952 Ack=6481 Win=8196 Len=0"
"24","0.581864","146.75.37.140","192.168.12.35","TLSv1.2","295","Application Data"
"25","0.581864","146.75.37.140","192.168.12.35","TCP","1430","443  >  61013 [ACK] Seq=2193 Ack=6481 Win=8196 Len=1376 [TCP PDU reassembled in 26]"
"26","0.581864","146.75.37.140","192.168.12.35","TLSv1.2","893","Application Data"
"27","0.581864","146.75.37.140","192.168.12.35","TLSv1.2","1411","Application Data"
"28","0.582868","192.168.12.35","146.75.37.140","TCP","54","61013  >  443 [ACK] Seq=6914 Ack=2193 Win=1023 Len=0"
"29","0.583133","192.168.12.35","146.75.37.140","TCP","54","61013  >  443 [ACK] Seq=6914 Ack=3569 Win=1025 Len=0"
"30","0.583228","192.168.12.35","146.75.37.140","TCP","54","61013  >  443 [ACK] Seq=6914 Ack=4408 Win=1021 Len=0"
"31","0.583274","192.168.12.35","146.75.37.140","TCP","54","61013  >  443 [ACK] Seq=6914 Ack=5765 Win=1025 Len=0"
"32","0.583888","146.75.37.140","192.168.12.35","TLSv1.2","159","Application Data"
"33","0.583888","146.75.37.140","192.168.12.35","TCP","54","443  >  61013 [ACK] Seq=5870 Ack=6879 Win=8196 Len=0"
"34","0.583888","146.75.37.140","192.168.12.35","TLSv1.2","680","Application Data"
"35","0.583888","146.75.37.140","192.168.12.35","TLSv1.2","93","Application Data"
"36","0.583888","146.75.37.140","192.168.12.35","TLSv1.2","248","Application Data"
"37","0.583888","146.75.37.140","192.168.12.35","TLSv1.2","688","Application Data"
"38","0.584188","192.168.12.35","146.75.37.140","TCP","54","61013  >  443 [ACK] Seq=6914 Ack=5870 Win=1024 Len=0"
"39","0.584218","192.168.12.35","146.75.37.140","TCP","54","61013  >  443 [ACK] Seq=6914 Ack=6535 Win=1022 Len=0"
"40","0.584275","192.168.12.35","146.75.37.140","TCP","54","61013  >  443 [ACK] Seq=6914 Ack=7363 Win=1025 Len=0"
"41","0.588524","146.75.37.140","192.168.12.35","TLSv1.2","335","Application Data"
"42","0.588524","146.75.37.140","192.168.12.35","TLSv1.2","1003","Application Data"
"43","0.588524","146.75.37.140","192.168.12.35","TLSv1.2","472","Application Data"
"44","0.588524","146.75.37.140","192.168.12.35","TLSv1.2","619","Application Data"
"45","0.588524","146.75.37.140","192.168.12.35","TLSv1.2","685","Application Data"
"46","0.589178","192.168.12.35","146.75.37.140","TCP","54","61013  >  443 [ACK] Seq=6914 Ack=8593 Win=1020 Len=0"
"47","0.589362","192.168.12.35","146.75.37.140","TCP","54","61013  >  443 [ACK] Seq=6914 Ack=9011 Win=1025 Len=0"
"48","0.589447","192.168.12.35","146.75.37.140","TCP","54","61013  >  443 [ACK] Seq=6914 Ack=9576 Win=1022 Len=0"
"49","0.599709","146.75.37.140","192.168.12.35","TCP","54","443  >  61013 [ACK] Seq=10207 Ack=6914 Win=8196 Len=0"
"50","0.604700","146.75.37.140","192.168.12.35","TCP","1430","443  >  61013 [ACK] Seq=10207 Ack=6914 Win=8196 Len=1376 [TCP PDU reassembled in 51]"
"51","0.604700","146.75.37.140","192.168.12.35","TLSv1.2","991","Application Data"
"52","0.605499","192.168.12.35","146.75.37.140","TCP","54","61013  >  443 [ACK] Seq=6914 Ack=11583 Win=1025 Len=0"
"53","0.653136","192.168.12.35","146.75.37.140","TCP","54","61013  >  443 [ACK] Seq=6914 Ack=12520 Win=1021 Len=0"
"54","1.052297","146.75.37.140","192.168.12.35","TLSv1.2","564","Application Data"
"55","1.065928","146.75.37.140","192.168.12.35","TLSv1.2","447","Application Data"
"56","1.065928","146.75.37.140","192.168.12.35","TLSv1.2","1232","Application Data"
"57","1.065928","146.75.37.140","192.168.12.35","TLSv1.2","114","Application Data"
"58","1.065928","146.75.37.140","192.168.12.35","TLSv1.2","665","Application Data"
"59","1.065928","146.75.37.140","192.168.12.35","TCP","1430","443  >  61013 [ACK] Seq=15272 Ack=6914 Win=8196 Len=1376 [TCP PDU reassembled in 61]"
"60","1.065928","146.75.37.140","192.168.12.35","TCP","1430","443  >  61013 [PSH, ACK] Seq=16648 Ack=6914 Win=8196 Len=1376 [TCP PDU reassembled in 61]"
"61","1.065928","146.75.37.140","192.168.12.35","TLSv1.2","1025","Application Data"
"62","1.065928","146.75.37.140","192.168.12.35","TLSv1.2","1430","Application Data, Application Data"
"63","1.065928","146.75.37.140","192.168.12.35","TLSv1.2","303","Application Data"
"64","1.065928","146.75.37.140","192.168.12.35","TLSv1.2","487","Application Data"
"65","1.065928","146.75.37.140","192.168.12.35","TLSv1.2","929","Application Data, Application Data"
"66","1.065928","146.75.37.140","192.168.12.35","TLSv1.2","245","Application Data"
"67","1.067022","192.168.12.35","146.75.37.140","TCP","54","61013  >  443 [ACK] Seq=6914 Ack=13423 Win=1025 Len=0"
"68","1.067741","192.168.12.35","146.75.37.140","TCP","54","61013  >  443 [ACK] Seq=6914 Ack=14661 Win=1020 Len=0"
"69","1.068359","192.168.12.35","146.75.37.140","TCP","54","61013  >  443 [ACK] Seq=6914 Ack=18024 Win=1025 Len=0"
"70","1.068543","192.168.12.35","146.75.37.140","TCP","54","61013  >  443 [ACK] Seq=6914 Ack=18995 Win=1021 Len=0"
"71","1.068734","192.168.12.35","146.75.37.140","TCP","54","61013  >  443 [ACK] Seq=6914 Ack=20620 Win=1025 Len=0"
"72","1.069395","192.168.12.35","146.75.37.140","TCP","54","61013  >  443 [ACK] Seq=6914 Ack=21928 Win=1020 Len=0"
"73","1.070336","146.75.37.140","192.168.12.35","TLSv1.2","1405","Application Data"
"74","1.070336","146.75.37.140","192.168.12.35","TLSv1.2","574","Application Data"
"75","1.070336","146.75.37.140","192.168.12.35","TLSv1.2","579","Application Data"
"76","1.070336","146.75.37.140","192.168.12.35","TLSv1.2","306","Application Data"
"77","1.070336","146.75.37.140","192.168.12.35","TLSv1.2","1153","Application Data"
"78","1.071311","192.168.12.35","146.75.37.140","TCP","54","61013  >  443 [ACK] Seq=6914 Ack=23470 Win=1025 Len=0"
"79","1.071850","192.168.12.35","146.75.37.140","TCP","54","61013  >  443 [ACK] Seq=6914 Ack=24515 Win=1021 Len=0"
"80","1.072053","192.168.12.35","146.75.37.140","TCP","54","61013  >  443 [ACK] Seq=6914 Ack=25866 Win=1025 Len=0"
"81","1.075295","146.75.37.140","192.168.12.35","TLSv1.2","205","Application Data"
"82","1.075295","146.75.37.140","192.168.12.35","TLSv1.2","373","Application Data"
"83","1.075295","146.75.37.140","192.168.12.35","TLSv1.2","589","Application Data"
"84","1.075295","146.75.37.140","192.168.12.35","TLSv1.2","262","Application Data"
"85","1.075295","146.75.37.140","192.168.12.35","TLSv1.2","598","Application Data"
"86","1.075295","146.75.37.140","192.168.12.35","TLSv1.2","895","Application Data"
"87","1.075295","146.75.37.140","192.168.12.35","TLSv1.2","386","Application Data"
"88","1.075295","146.75.37.140","192.168.12.35","TLSv1.2","157","Application Data"
"89","1.075295","146.75.37.140","192.168.12.35","TLSv1.2","777","Application Data"
"90","1.075295","146.75.37.140","192.168.12.35","TLSv1.2","124","Application Data"
"91","1.075295","146.75.37.140","192.168.12.35","TLSv1.2","624","Application Data"
"92","1.075295","146.75.37.140","192.168.12.35","TLSv1.2","110","Application Data"
"93","1.075295","146.75.37.140","192.168.12.35","TLSv1.2","354","Application Data"
"94","1.075295","146.75.37.140","192.168.12.35","TLSv1.2","125","Application Data"
"95","1.075295","146.75.37.140","192.168.12.35","TLSv1.2","220","Application Data"
"96","1.075295","146.75.37.140","192.168.12.35","TLSv1.2","94","Application Data"
"97","1.075295","146.75.37.140","192.168.12.35","TLSv1.2","526","Application Data"
"98","1.075295","146.75.37.140","192.168.12.35","TCP","1430","443  >  61013 [ACK] Seq=31367 Ack=6914 Win=8196 Len=1376 [TCP PDU reassembled in 99]"
"99","1.075295","146.75.37.140","192.168.12.35","TLSv1.2","865","Application Data"
"100","1.075295","146.75.37.140","192.168.12.35","TLSv1.2","480","Application Data"
"101","1.075295","146.75.37.140","192.168.12.35","TLSv1.2","1215","Application Data, Application Data"
"102","1.075295","146.75.37.140","192.168.12.35","TLSv1.2","132","Application Data"
"103","1.077335","192.168.12.35","146.75.37.140","TCP","54","61013  >  443 [ACK] Seq=6914 Ack=26336 Win=1023 Len=0"
"104","1.077579","192.168.12.35","146.75.37.140","TCP","54","61013  >  443 [ACK] Seq=6914 Ack=27079 Win=1020 Len=0"
"105","1.077663","192.168.12.35","146.75.37.140","TCP","54","61013  >  443 [ACK] Seq=6914 Ack=28464 Win=1025 Len=0"
"106","1.077935","192.168.12.35","146.75.37.140","TCP","54","61013  >  443 [ACK] Seq=6914 Ack=28899 Win=1023 Len=0"
"107","1.078275","192.168.12.35","146.75.37.140","TCP","54","61013  >  443 [ACK] Seq=6914 Ack=29692 Win=1020 Len=0"
"108","1.078576","192.168.12.35","146.75.37.140","TCP","54","61013  >  443 [ACK] Seq=6914 Ack=30318 Win=1025 Len=0"
"109","1.078778","192.168.12.35","146.75.37.140","TCP","54","61013  >  443 [ACK] Seq=6914 Ack=30689 Win=1023 Len=0"
"110","1.078926","192.168.12.35","146.75.37.140","TCP","54","61013  >  443 [ACK] Seq=6914 Ack=30895 Win=1022 Len=0"
"111","1.079097","192.168.12.35","146.75.37.140","TCP","54","61013  >  443 [ACK] Seq=6914 Ack=32743 Win=1025 Len=0"
"112","1.079264","192.168.12.35","146.75.37.140","TCP","54","61013  >  443 [ACK] Seq=6914 Ack=33980 Win=1020 Len=0"
"113","1.079394","192.168.12.35","146.75.37.140","TCP","54","61013  >  443 [ACK] Seq=6914 Ack=35219 Win=1025 Len=0"
"114","1.080489","146.75.37.140","192.168.12.35","TLSv1.2","318","Application Data"
"115","1.121863","192.168.12.35","146.75.37.140","TCP","54","61013  >  443 [ACK] Seq=6914 Ack=35483 Win=1024 Len=0"
"116","1.311546","192.168.12.35","146.75.37.140","TLSv1.2","3353","Application Data"
"117","1.311764","192.168.12.35","146.75.37.140","TLSv1.2","210","Application Data"
"118","1.404647","192.168.12.35","146.75.37.140","TLSv1.2","3362","Application Data"
"119","1.404835","192.168.12.35","146.75.37.140","TLSv1.2","3367","Application Data"
"120","1.404880","192.168.12.35","146.75.37.140","TLSv1.2","2777","Application Data"
"121","1.430777","192.168.12.35","146.75.37.140","TLSv1.2","3321","Application Data"
"122","1.454835","192.168.12.35","146.75.37.140","TLSv1.2","3199","Application Data"
"123","1.478167","192.168.12.35","146.75.37.140","TLSv1.2","216","Application Data"
"124","1.478400","192.168.12.35","146.75.37.140","TLSv1.2","93","Application Data"
"125","1.491002","192.168.12.35","146.75.37.140","TLSv1.2","3195","Application Data"
"126","1.491385","192.168.12.35","146.75.37.140","TLSv1.2","3210","Application Data"
"127","1.492032","192.168.12.35","146.75.37.140","TLSv1.2","3289","Application Data"
"128","1.511167","192.168.12.35","146.75.37.140","TCP","1450","[TCP Retransmission] 61013  >  443 [PSH, ACK] Seq=34261 Ack=35483 Win=1024 Len=1396"
"129","1.549943","146.75.37.140","192.168.12.35","TCP","54","443  >  61013 [ACK] Seq=35483 Ack=9706 Win=8196 Len=0"
"130","1.549943","146.75.37.140","192.168.12.35","TCP","54","443  >  61013 [ACK] Seq=35483 Ack=10213 Win=8196 Len=0"
"131","1.549943","146.75.37.140","192.168.12.35","TCP","54","443  >  61013 [ACK] Seq=35483 Ack=13161 Win=8207 Len=0"
"132","1.549943","146.75.37.140","192.168.12.35","TCP","54","443  >  61013 [ACK] Seq=35483 Ack=16469 Win=8220 Len=0"
"133","1.549943","146.75.37.140","192.168.12.35","TCP","54","443  >  61013 [ACK] Seq=35483 Ack=16990 Win=8220 Len=0"
"134","1.555272","146.75.37.140","192.168.12.35","TCP","54","443  >  61013 [ACK] Seq=35483 Ack=19713 Win=8220 Len=0"
"135","1.591460","146.75.37.140","192.168.12.35","TCP","1430","443  >  61013 [ACK] Seq=35483 Ack=19713 Win=8220 Len=1376 [TCP PDU reassembled in 136]"
"136","1.591460","146.75.37.140","192.168.12.35","TLSv1.2","307","Application Data"
"137","1.591460","146.75.37.140","192.168.12.35","TCP","1430","443  >  61013 [ACK] Seq=37112 Ack=19713 Win=8220 Len=1376 [TCP PDU reassembled in 138]"
"138","1.591460","146.75.37.140","192.168.12.35","TLSv1.2","966","Application Data"
"139","1.591816","192.168.12.35","146.75.37.140","TCP","54","61013  >  443 [ACK] Seq=35657 Ack=36859 Win=1025 Len=0"
"140","1.591856","192.168.12.35","146.75.37.140","TCP","54","61013  >  443 [ACK] Seq=35657 Ack=37112 Win=1024 Len=0"
"141","1.591875","192.168.12.35","146.75.37.140","TCP","54","61013  >  443 [ACK] Seq=35657 Ack=38488 Win=1025 Len=0"
"142","1.591910","192.168.12.35","146.75.37.140","TCP","54","61013  >  443 [ACK] Seq=35657 Ack=39400 Win=1021 Len=0"
"143","1.605133","146.75.37.140","192.168.12.35","TCP","54","443  >  61013 [ACK] Seq=39400 Ack=21109 Win=8220 Len=0"
"144","1.616531","146.75.37.140","192.168.12.35","TCP","54","443  >  61013 [ACK] Seq=39400 Ack=22505 Win=8220 Len=0"
"145","1.633547","146.75.37.140","192.168.12.35","TCP","54","443  >  61013 [ACK] Seq=39400 Ack=22980 Win=8220 Len=0"
"146","1.633547","146.75.37.140","192.168.12.35","TCP","1430","443  >  61013 [ACK] Seq=39400 Ack=22980 Win=8220 Len=1376 [TCP PDU reassembled in 147]"
"147","1.633547","146.75.37.140","192.168.12.35","TLSv1.2","457","Application Data"
"148","1.633547","146.75.37.140","192.168.12.35","TCP","54","443  >  61013 [ACK] Seq=41179 Ack=25772 Win=8220 Len=0"
"149","1.633547","146.75.37.140","192.168.12.35","TCP","54","443  >  61013 [ACK] Seq=41179 Ack=26125 Win=8220 Len=0"
"150","1.634772","192.168.12.35","146.75.37.140","TCP","54","61013  >  443 [ACK] Seq=35657 Ack=41179 Win=1025 Len=0"
"151","1.638764","146.75.37.140","192.168.12.35","TCP","54","443  >  61034 [ACK] Seq=1 Ack=163 Win=424 Len=0"
"152","1.638764","146.75.37.140","192.168.12.35","TCP","54","443  >  61034 [ACK] Seq=1 Ack=202 Win=424 Len=0"
"153","1.638764","146.75.37.140","192.168.12.35","TLSv1.2","93","Application Data"
"154","1.643090","146.75.37.140","192.168.12.35","TLSv1.2","186","Application Data"
"155","1.643090","146.75.37.140","192.168.12.35","TCP","1430","443  >  61034 [ACK] Seq=172 Ack=202 Win=424 Len=1376 [TCP PDU reassembled in 166]"
"156","1.643090","146.75.37.140","192.168.12.35","TCP","1430","443  >  61034 [ACK] Seq=1548 Ack=202 Win=424 Len=1376 [TCP PDU reassembled in 166]"
"157","1.643090","146.75.37.140","192.168.12.35","TCP","1430","443  >  61034 [ACK] Seq=2924 Ack=202 Win=424 Len=1376 [TCP PDU reassembled in 166]"
"158","1.643090","146.75.37.140","192.168.12.35","TCP","1430","443  >  61034 [ACK] Seq=4300 Ack=202 Win=424 Len=1376 [TCP PDU reassembled in 166]"
"159","1.643090","146.75.37.140","192.168.12.35","TCP","1430","443  >  61034 [ACK] Seq=5676 Ack=202 Win=424 Len=1376 [TCP PDU reassembled in 166]"
"160","1.643090","146.75.37.140","192.168.12.35","TCP","1430","443  >  61034 [PSH, ACK] Seq=7052 Ack=202 Win=424 Len=1376 [TCP PDU reassembled in 166]"
"161","1.643090","146.75.37.140","192.168.12.35","TCP","1430","443  >  61034 [ACK] Seq=8428 Ack=202 Win=424 Len=1376 [TCP PDU reassembled in 166]"
"162","1.643090","146.75.37.140","192.168.12.35","TCP","1430","443  >  61034 [ACK] Seq=9804 Ack=202 Win=424 Len=1376 [TCP PDU reassembled in 166]"
"163","1.643090","146.75.37.140","192.168.12.35","TCP","1430","443  >  61034 [ACK] Seq=11180 Ack=202 Win=424 Len=1376 [TCP PDU reassembled in 166]"
"164","1.643090","146.75.37.140","192.168.12.35","TCP","1430","443  >  61034 [ACK] Seq=12556 Ack=202 Win=424 Len=1376 [TCP PDU reassembled in 166]"
"165","1.643090","146.75.37.140","192.168.12.35","TCP","1430","443  >  61034 [ACK] Seq=13932 Ack=202 Win=424 Len=1376 [TCP PDU reassembled in 166]"
"166","1.643090","146.75.37.140","192.168.12.35","TLSv1.2","1430","Application Data"
"167","1.643090","146.75.37.140","192.168.12.35","TCP","1430","443  >  61034 [ACK] Seq=16684 Ack=202 Win=424 Len=1376 [TCP PDU reassembled in 178]"
"168","1.643090","146.75.37.140","192.168.12.35","TCP","1430","443  >  61034 [ACK] Seq=18060 Ack=202 Win=424 Len=1376 [TCP PDU reassembled in 178]"
"169","1.643090","146.75.37.140","192.168.12.35","TCP","1430","443  >  61034 [ACK] Seq=19436 Ack=202 Win=424 Len=1376 [TCP PDU reassembled in 178]"
"170","1.643090","146.75.37.140","192.168.12.35","TCP","1430","443  >  61034 [ACK] Seq=20812 Ack=202 Win=424 Len=1376 [TCP PDU reassembled in 178]"
"171","1.643090","146.75.37.140","192.168.12.35","TCP","1430","443  >  61034 [ACK] Seq=22188 Ack=202 Win=424 Len=1376 [TCP PDU reassembled in 178]"
"172","1.643090","146.75.37.140","192.168.12.35","TCP","1430","443  >  61034 [PSH, ACK] Seq=23564 Ack=202 Win=424 Len=1376 [TCP PDU reassembled in 178]"
"173","1.643090","146.75.37.140","192.168.12.35","TCP","1430","443  >  61034 [ACK] Seq=24940 Ack=202 Win=424 Len=1376 [TCP PDU reassembled in 178]"
"174","1.643090","146.75.37.140","192.168.12.35","TCP","1430","443  >  61034 [ACK] Seq=26316 Ack=202 Win=424 Len=1376 [TCP PDU reassembled in 178]"
"175","1.643090","146.75.37.140","192.168.12.35","TCP","1430","443  >  61034 [ACK] Seq=27692 Ack=202 Win=424 Len=1376 [TCP PDU reassembled in 178]"
"176","1.643090","146.75.37.140","192.168.12.35","TCP","1430","443  >  61034 [ACK] Seq=29068 Ack=202 Win=424 Len=1376 [TCP PDU reassembled in 178]"
"177","1.643090","146.75.37.140","192.168.12.35","TCP","1430","443  >  61034 [ACK] Seq=30444 Ack=202 Win=424 Len=1376 [TCP PDU reassembled in 178]"
"178","1.643090","146.75.37.140","192.168.12.35","TLSv1.2","1430","Application Data"
"179","1.643090","146.75.37.140","192.168.12.35","TCP","1430","443  >  61034 [ACK] Seq=33196 Ack=202 Win=424 Len=1376 [TCP PDU reassembled in 190]"
"180","1.643090","146.75.37.140","192.168.12.35","TCP","1430","443  >  61034 [ACK] Seq=34572 Ack=202 Win=424 Len=1376 [TCP PDU reassembled in 190]"
"181","1.643090","146.75.37.140","192.168.12.35","TCP","1430","443  >  61034 [ACK] Seq=35948 Ack=202 Win=424 Len=1376 [TCP PDU reassembled in 190]"
"182","1.643090","146.75.37.140","192.168.12.35","TCP","1430","443  >  61034 [ACK] Seq=37324 Ack=202 Win=424 Len=1376 [TCP PDU reassembled in 190]"
"183","1.643090","146.75.37.140","192.168.12.35","TCP","1430","443  >  61034 [ACK] Seq=38700 Ack=202 Win=424 Len=1376 [TCP PDU reassembled in 190]"
"184","1.643090","146.75.37.140","192.168.12.35","TCP","1430","443  >  61034 [PSH, ACK] Seq=40076 Ack=202 Win=424 Len=1376 [TCP PDU reassembled in 190]"
"185","1.643090","146.75.37.140","192.168.12.35","TCP","1430","443  >  61034 [ACK] Seq=41452 Ack=202 Win=424 Len=1376 [TCP PDU reassembled in 190]"
"186","1.644815","146.75.37.140","192.168.12.35","TCP","1430","443  >  61034 [ACK] Seq=42828 Ack=202 Win=424 Len=1376 [TCP PDU reassembled in 190]"
"187","1.644815","146.75.37.140","192.168.12.35","TCP","1430","443  >  61034 [ACK] Seq=44204 Ack=202 Win=424 Len=1376 [TCP PDU reassembled in 190]"
"188","1.644815","146.75.37.140","192.168.12.35","TCP","1430","443  >  61034 [ACK] Seq=45580 Ack=202 Win=424 Len=1376 [TCP PDU reassembled in 190]"
"189","1.644815","146.75.37.140","192.168.12.35","TCP","1430","443  >  61034 [ACK] Seq=46956 Ack=202 Win=424 Len=1376 [TCP PDU reassembled in 190]"
"190","1.644815","146.75.37.140","192.168.12.35","TLSv1.2","1430","Application Data"
"191","1.645032","192.168.12.35","146.75.37.140","TCP","54","61034  >  443 [ACK] Seq=202 Ack=172 Win=8200 Len=0"
"192","1.645582","192.168.12.35","146.75.37.140","TCP","54","61034  >  443 [ACK] Seq=202 Ack=42828 Win=8201 Len=0"
"193","1.645826","192.168.12.35","146.75.37.140","TCP","54","61034  >  443 [ACK] Seq=202 Ack=49708 Win=8201 Len=0"
"194","1.647492","146.75.37.140","192.168.12.35","TCP","1430","443  >  61034 [ACK] Seq=49708 Ack=202 Win=424 Len=1376 [TCP PDU reassembled in 205]"
"195","1.647492","146.75.37.140","192.168.12.35","TCP","1430","443  >  61034 [ACK] Seq=51084 Ack=202 Win=424 Len=1376 [TCP PDU reassembled in 205]"
"196","1.647492","146.75.37.140","192.168.12.35","TCP","1430","443  >  61034 [ACK] Seq=52460 Ack=202 Win=424 Len=1376 [TCP PDU reassembled in 205]"
"197","1.647492","146.75.37.140","192.168.12.35","TCP","1430","443  >  61034 [ACK] Seq=53836 Ack=202 Win=424 Len=1376 [TCP PDU reassembled in 205]"
"198","1.647492","146.75.37.140","192.168.12.35","TCP","1430","443  >  61034 [ACK] Seq=55212 Ack=202 Win=424 Len=1376 [TCP PDU reassembled in 205]"
"199","1.647492","146.75.37.140","192.168.12.35","TCP","1430","443  >  61034 [PSH, ACK] Seq=56588 Ack=202 Win=424 Len=1376 [TCP PDU reassembled in 205]"
"200","1.647492","146.75.37.140","192.168.12.35","TCP","1430","443  >  61034 [ACK] Seq=57964 Ack=202 Win=424 Len=1376 [TCP PDU reassembled in 205]"
"201","1.647492","146.75.37.140","192.168.12.35","TCP","1430","443  >  61034 [ACK] Seq=59340 Ack=202 Win=424 Len=1376 [TCP PDU reassembled in 205]"
"202","1.647492","146.75.37.140","192.168.12.35","TCP","1430","443  >  61034 [ACK] Seq=60716 Ack=202 Win=424 Len=1376 [TCP PDU reassembled in 205]"
"203","1.647492","146.75.37.140","192.168.12.35","TCP","1430","443  >  61034 [ACK] Seq=62092 Ack=202 Win=424 Len=1376 [TCP PDU reassembled in 205]"
"204","1.647492","146.75.37.140","192.168.12.35","TCP","1430","443  >  61034 [ACK] Seq=63468 Ack=202 Win=424 Len=1376 [TCP PDU reassembled in 205]"
"205","1.647492","146.75.37.140","192.168.12.35","TLSv1.2","1430","Application Data, Application Data"
"206","1.647492","146.75.37.140","192.168.12.35","TCP","1430","443  >  61034 [ACK] Seq=66220 Ack=202 Win=424 Len=1376 [TCP PDU reassembled in 217]"
"207","1.647492","146.75.37.140","192.168.12.35","TCP","1430","443  >  61034 [ACK] Seq=67596 Ack=202 Win=424 Len=1376 [TCP PDU reassembled in 217]"
"208","1.647492","146.75.37.140","192.168.12.35","TCP","1430","443  >  61034 [ACK] Seq=68972 Ack=202 Win=424 Len=1376 [TCP PDU reassembled in 217]"
"209","1.647492","146.75.37.140","192.168.12.35","TCP","1430","443  >  61034 [ACK] Seq=70348 Ack=202 Win=424 Len=1376 [TCP PDU reassembled in 217]"
"210","1.647492","146.75.37.140","192.168.12.35","TCP","1430","443  >  61034 [ACK] Seq=71724 Ack=202 Win=424 Len=1376 [TCP PDU reassembled in 217]"
"211","1.647492","146.75.37.140","192.168.12.35","TCP","1430","443  >  61034 [PSH, ACK] Seq=73100 Ack=202 Win=424 Len=1376 [TCP PDU reassembled in 217]"
"212","1.647492","146.75.37.140","192.168.12.35","TCP","1430","443  >  61034 [ACK] Seq=74476 Ack=202 Win=424 Len=1376 [TCP PDU reassembled in 217]"
"213","1.647492","146.75.37.140","192.168.12.35","TCP","1430","443  >  61034 [ACK] Seq=75852 Ack=202 Win=424 Len=1376 [TCP PDU reassembled in 217]"
"214","1.647492","146.75.37.140","192.168.12.35","TCP","1430","443  >  61034 [ACK] Seq=77228 Ack=202 Win=424 Len=1376 [TCP PDU reassembled in 217]"
"215","1.647492","146.75.37.140","192.168.12.35","TCP","1430","443  >  61034 [ACK] Seq=78604 Ack=202 Win=424 Len=1376 [TCP PDU reassembled in 217]"
"216","1.647492","146.75.37.140","192.168.12.35","TCP","1430","443  >  61034 [ACK] Seq=79980 Ack=202 Win=424 Len=1376 [TCP PDU reassembled in 217]"
"217","1.647492","146.75.37.140","192.168.12.35","TLSv1.2","1430","Application Data"
"218","1.647492","146.75.37.140","192.168.12.35","TCP","1430","443  >  61034 [ACK] Seq=82732 Ack=202 Win=424 Len=1376 [TCP PDU reassembled in 232]"
"219","1.647492","146.75.37.140","192.168.12.35","TCP","1430","443  >  61034 [ACK] Seq=84108 Ack=202 Win=424 Len=1376 [TCP PDU reassembled in 232]"
"220","1.647492","146.75.37.140","192.168.12.35","TCP","1430","443  >  61034 [ACK] Seq=85484 Ack=202 Win=424 Len=1376 [TCP PDU reassembled in 232]"
"221","1.647492","146.75.37.140","192.168.12.35","TCP","1430","443  >  61034 [ACK] Seq=86860 Ack=202 Win=424 Len=1376 [TCP PDU reassembled in 232]"
"222","1.647492","146.75.37.140","192.168.12.35","TCP","1430","443  >  61034 [ACK] Seq=88236 Ack=202 Win=424 Len=1376 [TCP PDU reassembled in 232]"
"223","1.647492","146.75.37.140","192.168.12.35","TCP","1430","443  >  61034 [PSH, ACK] Seq=89612 Ack=202 Win=424 Len=1376 [TCP PDU reassembled in 232]"
"224","1.647492","146.75.37.140","192.168.12.35","TCP","1430","443  >  61034 [ACK] Seq=90988 Ack=202 Win=424 Len=1376 [TCP PDU reassembled in 232]"
"225","1.647492","146.75.37.140","192.168.12.35","TCP","1430","443  >  61034 [ACK] Seq=92364 Ack=202 Win=424 Len=1376 [TCP PDU reassembled in 232]"
"226","1.648735","146.75.37.140","192.168.12.35","TCP","1430","443  >  61034 [ACK] Seq=93740 Ack=202 Win=424 Len=1376 [TCP PDU reassembled in 232]"
"227","1.648735","146.75.37.140","192.168.12.35","TCP","1430","443  >  61034 [ACK] Seq=95116 Ack=202 Win=424 Len=1376 [TCP PDU reassembled in 232]"
"228","1.648735","146.75.37.140","192.168.12.35","TCP","1430","443  >  61034 [PSH, ACK] Seq=96492 Ack=202 Win=424 Len=1376 [TCP PDU reassembled in 232]"
"229","1.648694","192.168.12.35","146.75.37.140","TLSv1.2","89","Application Data"
"230","1.648961","192.168.12.35","146.75.37.140","TCP","54","61034  >  443 [ACK] Seq=237 Ack=93740 Win=8201 Len=0"
"231","1.649250","192.168.12.35","146.75.37.140","TCP","54","61034  >  443 [ACK] Seq=237 Ack=97868 Win=8201 Len=0"
"232","1.660883","146.75.37.140","192.168.12.35","TLSv1.2","1430","Application Data"
"233","1.660883","146.75.37.140","192.168.12.35","TCP","1430","443  >  61034 [ACK] Seq=99244 Ack=202 Win=424 Len=1376 [TCP PDU reassembled in 244]"
"234","1.660883","146.75.37.140","192.168.12.35","TCP","1430","443  >  61034 [ACK] Seq=100620 Ack=202 Win=424 Len=1376 [TCP PDU reassembled in 244]"
"235","1.660883","146.75.37.140","192.168.12.35","TCP","1430","443  >  61034 [ACK] Seq=101996 Ack=202 Win=424 Len=1376 [TCP PDU reassembled in 244]"
"236","1.660883","146.75.37.140","192.168.12.35","TCP","1430","443  >  61034 [ACK] Seq=103372 Ack=202 Win=424 Len=1376 [TCP PDU reassembled in 244]"
"237","1.660883","146.75.37.140","192.168.12.35","TCP","1430","443  >  61034 [PSH, ACK] Seq=104748 Ack=202 Win=424 Len=1376 [TCP PDU reassembled in 244]"
"238","1.660883","146.75.37.140","192.168.12.35","TCP","1430","443  >  61034 [ACK] Seq=106124 Ack=202 Win=424 Len=1376 [TCP PDU reassembled in 244]"
"239","1.660883","146.75.37.140","192.168.12.35","TCP","1430","443  >  61034 [ACK] Seq=107500 Ack=202 Win=424 Len=1376 [TCP PDU reassembled in 244]"
"240","1.660883","146.75.37.140","192.168.12.35","TCP","1430","443  >  61034 [ACK] Seq=108876 Ack=202 Win=424 Len=1376 [TCP PDU reassembled in 244]"
"241","1.660883","146.75.37.140","192.168.12.35","TCP","1430","443  >  61034 [ACK] Seq=110252 Ack=202 Win=424 Len=1376 [TCP PDU reassembled in 244]"
"242","1.660883","146.75.37.140","192.168.12.35","TCP","1430","443  >  61034 [ACK] Seq=111628 Ack=202 Win=424 Len=1376 [TCP PDU reassembled in 244]"
"243","1.660883","146.75.37.140","192.168.12.35","TCP","1430","443  >  61034 [PSH, ACK] Seq=113004 Ack=202 Win=424 Len=1376 [TCP PDU reassembled in 244]"
"244","1.660883","146.75.37.140","192.168.12.35","TLSv1.2","1430","Application Data"
"245","1.660883","146.75.37.140","192.168.12.35","TCP","1430","443  >  61034 [ACK] Seq=115756 Ack=202 Win=424 Len=1376 [TCP PDU reassembled in 257]"
"246","1.660883","146.75.37.140","192.168.12.35","TCP","1430","443  >  61034 [ACK] Seq=117132 Ack=202 Win=424 Len=1376 [TCP PDU reassembled in 257]"
"247","1.660883","146.75.37.140","192.168.12.35","TCP","1430","443  >  61034 [ACK] Seq=118508 Ack=202 Win=424 Len=1376 [TCP PDU reassembled in 257]"
"248","1.660883","146.75.37.140","192.168.12.35","TCP","1430","443  >  61034 [ACK] Seq=119884 Ack=202 Win=424 Len=1376 [TCP PDU reassembled in 257]"
"249","1.660883","146.75.37.140","192.168.12.35","TCP","1430","443  >  61034 [PSH, ACK] Seq=121260 Ack=202 Win=424 Len=1376 [TCP PDU reassembled in 257]"
"250","1.660883","146.75.37.140","192.168.12.35","TCP","54","443  >  61013 [ACK] Seq=41179 Ack=27521 Win=8220 Len=0"
"251","1.660883","146.75.37.140","192.168.12.35","TCP","1430","443  >  61034 [ACK] Seq=122636 Ack=202 Win=424 Len=1376 [TCP PDU reassembled in 257]"
"252","1.660883","146.75.37.140","192.168.12.35","TCP","1430","443  >  61034 [ACK] Seq=124012 Ack=202 Win=424 Len=1376 [TCP PDU reassembled in 257]"
"253","1.660883","146.75.37.140","192.168.12.35","TCP","1430","443  >  61034 [ACK] Seq=125388 Ack=202 Win=424 Len=1376 [TCP PDU reassembled in 257]"
"254","1.660883","146.75.37.140","192.168.12.35","TCP","1430","443  >  61034 [ACK] Seq=126764 Ack=202 Win=424 Len=1376 [TCP PDU reassembled in 257]"
"255","1.660883","146.75.37.140","192.168.12.35","TCP","1430","443  >  61034 [ACK] Seq=128140 Ack=202 Win=424 Len=1376 [TCP PDU reassembled in 257]"
"256","1.660883","146.75.37.140","192.168.12.35","TCP","1430","443  >  61034 [PSH, ACK] Seq=129516 Ack=202 Win=424 Len=1376 [TCP PDU reassembled in 257]"
"257","1.660883","146.75.37.140","192.168.12.35","TLSv1.2","1430","Application Data, Application Data"
"258","1.660883","146.75.37.140","192.168.12.35","TCP","1430","443  >  61034 [ACK] Seq=132268 Ack=202 Win=424 Len=1376 [TCP PDU reassembled in 271]"
"259","1.660883","146.75.37.140","192.168.12.35","TCP","1430","443  >  61034 [ACK] Seq=133644 Ack=202 Win=424 Len=1376 [TCP PDU reassembled in 271]"
"260","1.660883","146.75.37.140","192.168.12.35","TCP","1430","443  >  61034 [ACK] Seq=135020 Ack=202 Win=424 Len=1376 [TCP PDU reassembled in 271]"
"261","1.660883","146.75.37.140","192.168.12.35","TCP","1430","443  >  61034 [ACK] Seq=136396 Ack=202 Win=424 Len=1376 [TCP PDU reassembled in 271]"
"262","1.660883","146.75.37.140","192.168.12.35","TCP","1430","443  >  61034 [PSH, ACK] Seq=137772 Ack=202 Win=424 Len=1376 [TCP PDU reassembled in 271]"
"263","1.661828","192.168.12.35","146.75.37.140","TCP","54","61034  >  443 [ACK] Seq=237 Ack=122636 Win=8201 Len=0"
"264","1.662039","192.168.12.35","146.75.37.140","TCP","54","61034  >  443 [ACK] Seq=237 Ack=139148 Win=8201 Len=0"
"265","1.661839","146.75.37.140","192.168.12.35","TCP","1430","443  >  61034 [ACK] Seq=139148 Ack=202 Win=424 Len=1376 [TCP PDU reassembled in 271]"
"266","1.661839","146.75.37.140","192.168.12.35","TCP","1430","443  >  61034 [ACK] Seq=140524 Ack=202 Win=424 Len=1376 [TCP PDU reassembled in 271]"
"267","1.661839","146.75.37.140","192.168.12.35","TCP","1430","443  >  61034 [ACK] Seq=141900 Ack=202 Win=424 Len=1376 [TCP PDU reassembled in 271]"
"268","1.661839","146.75.37.140","192.168.12.35","TCP","1430","443  >  61034 [ACK] Seq=143276 Ack=202 Win=424 Len=1376 [TCP PDU reassembled in 271]"
"269","1.661839","146.75.37.140","192.168.12.35","TCP","1430","443  >  61034 [ACK] Seq=144652 Ack=202 Win=424 Len=1376 [TCP PDU reassembled in 271]"
"270","1.661839","146.75.37.140","192.168.12.35","TCP","1430","443  >  61034 [PSH, ACK] Seq=146028 Ack=202 Win=424 Len=1376 [TCP PDU reassembled in 271]"
"271","1.661839","146.75.37.140","192.168.12.35","TLSv1.2","1430","Application Data"
"272","1.661839","146.75.37.140","192.168.12.35","TCP","1430","443  >  61034 [ACK] Seq=148780 Ack=202 Win=424 Len=1376 [TCP PDU reassembled in 283]"
"273","1.661839","146.75.37.140","192.168.12.35","TCP","1430","443  >  61034 [ACK] Seq=150156 Ack=202 Win=424 Len=1376 [TCP PDU reassembled in 283]"
"274","1.661839","146.75.37.140","192.168.12.35","TCP","1430","443  >  61034 [ACK] Seq=151532 Ack=202 Win=424 Len=1376 [TCP PDU reassembled in 283]"
"275","1.661839","146.75.37.140","192.168.12.35","TCP","1430","443  >  61034 [ACK] Seq=152908 Ack=202 Win=424 Len=1376 [TCP PDU reassembled in 283]"
"276","1.661839","146.75.37.140","192.168.12.35","TCP","1430","443  >  61034 [PSH, ACK] Seq=154284 Ack=202 Win=424 Len=1376 [TCP PDU reassembled in 283]"
"277","1.661839","146.75.37.140","192.168.12.35","TCP","1430","443  >  61034 [ACK] Seq=155660 Ack=202 Win=424 Len=1376 [TCP PDU reassembled in 283]"
"278","1.661839","146.75.37.140","192.168.12.35","TCP","1430","443  >  61034 [ACK] Seq=157036 Ack=202 Win=424 Len=1376 [TCP PDU reassembled in 283]"
"279","1.661839","146.75.37.140","192.168.12.35","TCP","1430","443  >  61034 [ACK] Seq=158412 Ack=202 Win=424 Len=1376 [TCP PDU reassembled in 283]"
"280","1.661839","146.75.37.140","192.168.12.35","TCP","1430","443  >  61034 [ACK] Seq=159788 Ack=202 Win=424 Len=1376 [TCP PDU reassembled in 283]"
"281","1.661839","146.75.37.140","192.168.12.35","TCP","1430","443  >  61034 [PSH, ACK] Seq=161164 Ack=202 Win=424 Len=1376 [TCP PDU reassembled in 283]"
"282","1.661839","146.75.37.140","192.168.12.35","TCP","1430","443  >  61034 [ACK] Seq=162540 Ack=202 Win=424 Len=1376 [TCP PDU reassembled in 283]"
"283","1.661839","146.75.37.140","192.168.12.35","TLSv1.2","1430","Application Data"
"284","1.661839","146.75.37.140","192.168.12.35","TCP","1430","443  >  61034 [ACK] Seq=165292 Ack=202 Win=424 Len=1376 [TCP PDU reassembled in 295]"
"285","1.661839","146.75.37.140","192.168.12.35","TCP","1430","443  >  61034 [ACK] Seq=166668 Ack=202 Win=424 Len=1376 [TCP PDU reassembled in 295]"
"286","1.661839","146.75.37.140","192.168.12.35","TCP","1430","443  >  61034 [ACK] Seq=168044 Ack=202 Win=424 Len=1376 [TCP PDU reassembled in 295]"
"287","1.661839","146.75.37.140","192.168.12.35","TCP","1430","443  >  61034 [PSH, ACK] Seq=169420 Ack=202 Win=424 Len=1376 [TCP PDU reassembled in 295]"
"288","1.661839","146.75.37.140","192.168.12.35","TCP","1430","443  >  61034 [ACK] Seq=170796 Ack=202 Win=424 Len=1376 [TCP PDU reassembled in 295]"
"289","1.661839","146.75.37.140","192.168.12.35","TCP","1430","443  >  61034 [ACK] Seq=172172 Ack=202 Win=424 Len=1376 [TCP PDU reassembled in 295]"
"290","1.661839","146.75.37.140","192.168.12.35","TCP","1430","443  >  61034 [ACK] Seq=173548 Ack=202 Win=424 Len=1376 [TCP PDU reassembled in 295]"
"291","1.661839","146.75.37.140","192.168.12.35","TCP","1430","443  >  61034 [ACK] Seq=174924 Ack=202 Win=424 Len=1376 [TCP PDU reassembled in 295]"
"292","1.661839","146.75.37.140","192.168.12.35","TCP","1430","443  >  61034 [ACK] Seq=176300 Ack=202 Win=424 Len=1376 [TCP PDU reassembled in 295]"
"293","1.661839","146.75.37.140","192.168.12.35","TCP","1430","443  >  61034 [PSH, ACK] Seq=177676 Ack=202 Win=424 Len=1376 [TCP PDU reassembled in 295]"
"294","1.661839","146.75.37.140","192.168.12.35","TCP","1430","443  >  61034 [ACK] Seq=179052 Ack=202 Win=424 Len=1376 [TCP PDU reassembled in 295]"
"295","1.661839","146.75.37.140","192.168.12.35","TLSv1.2","1430","Application Data"
"296","1.661839","146.75.37.140","192.168.12.35","TCP","1430","443  >  61034 [ACK] Seq=181804 Ack=202 Win=424 Len=1376 [TCP PDU reassembled in 308]"
"297","1.662872","192.168.12.35","146.75.37.140","TCP","54","61034  >  443 [ACK] Seq=237 Ack=183180 Win=8201 Len=0"
"298","1.662857","146.75.37.140","192.168.12.35","TCP","1430","443  >  61034 [ACK] Seq=183180 Ack=202 Win=424 Len=1376 [TCP PDU reassembled in 308]"
"299","1.662857","146.75.37.140","192.168.12.35","TCP","1430","443  >  61034 [ACK] Seq=184556 Ack=202 Win=424 Len=1376 [TCP PDU reassembled in 308]"
"300","1.662857","146.75.37.140","192.168.12.35","TCP","1430","443  >  61034 [PSH, ACK] Seq=185932 Ack=202 Win=424 Len=1376 [TCP PDU reassembled in 308]"
"301","1.662857","146.75.37.140","192.168.12.35","TCP","1430","443  >  61034 [ACK] Seq=187308 Ack=202 Win=424 Len=1376 [TCP PDU reassembled in 308]"
"302","1.662857","146.75.37.140","192.168.12.35","TCP","1430","443  >  61034 [ACK] Seq=188684 Ack=202 Win=424 Len=1376 [TCP PDU reassembled in 308]"
"303","1.662857","146.75.37.140","192.168.12.35","TCP","1430","443  >  61034 [ACK] Seq=190060 Ack=202 Win=424 Len=1376 [TCP PDU reassembled in 308]"
"304","1.662857","146.75.37.140","192.168.12.35","TCP","1430","443  >  61034 [ACK] Seq=191436 Ack=202 Win=424 Len=1376 [TCP PDU reassembled in 308]"
"305","1.662857","146.75.37.140","192.168.12.35","TCP","1430","443  >  61034 [ACK] Seq=192812 Ack=202 Win=424 Len=1376 [TCP PDU reassembled in 308]"
"306","1.662857","146.75.37.140","192.168.12.35","TCP","1430","443  >  61034 [PSH, ACK] Seq=194188 Ack=202 Win=424 Len=1376 [TCP PDU reassembled in 308]"
"307","1.662857","146.75.37.140","192.168.12.35","TCP","1430","443  >  61034 [ACK] Seq=195564 Ack=202 Win=424 Len=1376 [TCP PDU reassembled in 308]"
"308","1.662857","146.75.37.140","192.168.12.35","TLSv1.2","1430","Application Data, Application Data"
"309","1.662857","146.75.37.140","192.168.12.35","TCP","1430","443  >  61034 [ACK] Seq=198316 Ack=202 Win=424 Len=1376 [TCP PDU reassembled in 323]"
"310","1.662857","146.75.37.140","192.168.12.35","TCP","1430","443  >  61034 [ACK] Seq=199692 Ack=202 Win=424 Len=1376 [TCP PDU reassembled in 323]"
"311","1.662857","146.75.37.140","192.168.12.35","TCP","1430","443  >  61034 [ACK] Seq=201068 Ack=202 Win=424 Len=1376 [TCP PDU reassembled in 323]"
"312","1.662857","146.75.37.140","192.168.12.35","TCP","1430","443  >  61034 [PSH, ACK] Seq=202444 Ack=202 Win=424 Len=1376 [TCP PDU reassembled in 323]"
"313","1.663191","192.168.12.35","146.75.37.140","TCP","54","61034  >  443 [ACK] Seq=237 Ack=203820 Win=8201 Len=0"
"314","1.666322","146.75.37.140","192.168.12.35","TCP","1430","443  >  61034 [ACK] Seq=203820 Ack=202 Win=424 Len=1376 [TCP PDU reassembled in 323]"
"315","1.666322","146.75.37.140","192.168.12.35","TCP","1430","443  >  61034 [ACK] Seq=205196 Ack=202 Win=424 Len=1376 [TCP PDU reassembled in 323]"
"316","1.666322","146.75.37.140","192.168.12.35","TCP","1430","443  >  61034 [ACK] Seq=206572 Ack=202 Win=424 Len=1376 [TCP PDU reassembled in 323]"
"317","1.666322","146.75.37.140","192.168.12.35","TCP","1430","443  >  61034 [ACK] Seq=207948 Ack=202 Win=424 Len=1376 [TCP PDU reassembled in 323]"
"318","1.666322","146.75.37.140","192.168.12.35","TCP","1430","443  >  61034 [ACK] Seq=209324 Ack=202 Win=424 Len=1376 [TCP PDU reassembled in 323]"
"319","1.666322","146.75.37.140","192.168.12.35","TCP","1430","443  >  61034 [PSH, ACK] Seq=210700 Ack=202 Win=424 Len=1376 [TCP PDU reassembled in 323]"
"320","1.666322","146.75.37.140","192.168.12.35","TCP","1430","443  >  61013 [ACK] Seq=41179 Ack=27521 Win=8220 Len=1376 [TCP PDU reassembled in 321]"
"321","1.666322","146.75.37.140","192.168.12.35","TLSv1.2","950","Application Data"
"322","1.666322","146.75.37.140","192.168.12.35","TCP","1430","443  >  61034 [ACK] Seq=212076 Ack=202 Win=424 Len=1376 [TCP PDU reassembled in 323]"
"323","1.666322","146.75.37.140","192.168.12.35","TLSv1.2","1430","Application Data"
"324","1.666322","146.75.37.140","192.168.12.35","TCP","1430","443  >  61034 [ACK] Seq=214828 Ack=202 Win=424 Len=1376 [TCP PDU reassembled in 339]"
"325","1.666322","146.75.37.140","192.168.12.35","TCP","1430","443  >  61034 [ACK] Seq=216204 Ack=202 Win=424 Len=1376 [TCP PDU reassembled in 339]"
