"No.","Time","Source","Destination","Protocol","Length","Info"
"1","0.000000","192.168.12.35","146.75.37.140","UDP","80","52870  >  443 Len=38"
"2","0.051841","146.75.37.140","192.168.12.35","UDP","67","443  >  52870 Len=25"
"3","0.946695","192.168.12.35","146.75.37.140","TLSv1.2","3391","Application Data"
"4","0.946822","192.168.12.35","146.75.37.140","TLSv1.2","93","Application Data"
"5","0.946851","192.168.12.35","146.75.37.140","TLSv1.2","2428","Application Data"
"6","0.991912","146.75.37.140","192.168.12.35","TCP","54","443  >  61013 [ACK] Seq=1 Ack=1397 Win=8244 Len=0"
"7","1.011583","146.75.37.140","192.168.12.35","TCP","54","443  >  61013 [ACK] Seq=1 Ack=2793 Win=8244 Len=0"
"8","1.023976","146.75.37.140","192.168.12.35","TCP","54","443  >  61013 [ACK] Seq=1 Ack=3338 Win=8244 Len=0"
"9","1.023976","146.75.37.140","192.168.12.35","TCP","54","443  >  61013 [ACK] Seq=1 Ack=3377 Win=8244 Len=0"
"10","1.023976","146.75.37.140","192.168.12.35","TLSv1.2","93","Application Data"
"11","1.056662","146.75.37.140","192.168.12.35","TCP","54","443  >  61013 [ACK] Seq=40 Ack=4773 Win=8244 Len=0"
"12","1.071698","146.75.37.140","192.168.12.35","TCP","54","443  >  61013 [ACK] Seq=40 Ack=5751 Win=8244 Len=0"
"13","1.073899","192.168.12.35","146.75.37.140","TCP","54","61013  >  443 [ACK] Seq=5751 Ack=40 Win=1025 Len=0"
"14","1.103842","146.75.37.140","192.168.12.35","TCP","1430","443  >  61013 [ACK] Seq=40 Ack=5751 Win=8244 Len=1376 [TCP PDU reassembled in 15]"
"15","1.103842","146.75.37.140","192.168.12.35","TLSv1.2","469","Application Data"
"16","1.104025","192.168.12.35","146.75.37.140","TCP","54","61013  >  443 [ACK] Seq=5751 Ack=1831 Win=1025 Len=0"
"17","1.106105","192.168.12.35","146.75.37.140","TLSv1.2","89","Application Data"
"18","1.126581","146.75.37.140","192.168.12.35","TCP","54","443  >  61013 [ACK] Seq=1831 Ack=5786 Win=8244 Len=0"
"19","2.390395","192.168.12.35","146.75.37.140","TLSv1.2","3389","Application Data"
"20","2.390674","192.168.12.35","146.75.37.140","TLSv1.2","869","Application Data"
"21","2.399346","192.168.12.35","146.75.37.140","TLSv1.2","3389","Application Data"
"22","2.399449","192.168.12.35","146.75.37.140","TLSv1.2","5408","Application Data"
"23","2.400684","192.168.12.35","146.75.37.140","TLSv1.2","3275","Application Data"
"24","2.400786","192.168.12.35","146.75.37.140","TLSv1.2","3389","Application Data"
"25","2.400841","192.168.12.35","146.75.37.140","TLSv1.2","1699","Application Data"
"26","2.456640","146.75.37.140","192.168.12.35","TCP","54","443  >  61013 [ACK] Seq=1831 Ack=7182 Win=8244 Len=0"
"27","2.486768","146.75.37.140","192.168.12.35","TCP","54","443  >  61013 [ACK] Seq=1831 Ack=8578 Win=8244 Len=0"
"28","2.507855","146.75.37.140","192.168.12.35","TCP","54","443  >  61013 [ACK] Seq=1831 Ack=9121 Win=8244 Len=0"
"29","2.531499","146.75.37.140","192.168.12.35","TCP","54","443  >  61013 [ACK] Seq=1831 Ack=9936 Win=8244 Len=0"
"30","2.560842","146.75.37.140","192.168.12.35","TCP","1430","443  >  61013 [ACK] Seq=1831 Ack=9936 Win=8244 Len=1376 [TCP PDU reassembled in 31]"
"31","2.560842","146.75.37.140","192.168.12.35","TLSv1.2","810","Application Data"
"32","2.561094","192.168.12.35","146.75.37.140","TCP","54","61013  >  443 [ACK] Seq=26826 Ack=3963 Win=1025 Len=0"
"33","2.587055","146.75.37.140","192.168.12.35","TCP","54","443  >  61013 [ACK] Seq=3963 Ack=11332 Win=8244 Len=0"
"34","2.626901","146.75.37.140","192.168.12.35","TCP","54","443  >  61013 [ACK] Seq=3963 Ack=12728 Win=8244 Len=0"
"35","2.652229","146.75.37.140","192.168.12.35","TCP","54","443  >  61013 [ACK] Seq=3963 Ack=13271 Win=8244 Len=0"
"36","2.686719","146.75.37.140","192.168.12.35","TCP","54","443  >  61013 [ACK] Seq=3963 Ack=14667 Win=8244 Len=0"
"37","2.727390","146.75.37.140","192.168.12.35","TCP","54","443  >  61013 [ACK] Seq=3963 Ack=16063 Win=8244 Len=0"
"38","2.761805","146.75.37.140","192.168.12.35","TCP","54","443  >  61013 [ACK] Seq=3963 Ack=17459 Win=8244 Len=0"
"39","2.783574","146.75.37.140","192.168.12.35","TCP","54","443  >  61013 [ACK] Seq=3963 Ack=18625 Win=8244 Len=0"
"40","2.811589","146.75.37.140","192.168.12.35","TCP","1430","443  >  61013 [ACK] Seq=3963 Ack=18625 Win=8244 Len=1376 [TCP PDU reassembled in 41]"
"41","2.811589","146.75.37.140","192.168.12.35","TLSv1.2","470","Application Data"
"42","2.811902","192.168.12.35","146.75.37.140","TCP","54","61013  >  443 [ACK] Seq=26826 Ack=5755 Win=1025 Len=0"
"43","2.832688","146.75.37.140","192.168.12.35","TCP","54","443  >  61013 [ACK] Seq=5755 Ack=20021 Win=8244 Len=0"
"44","2.863759","146.75.37.140","192.168.12.35","TCP","54","443  >  61013 [ACK] Seq=5755 Ack=21417 Win=8244 Len=0"
"45","2.884095","146.75.37.140","192.168.12.35","TCP","54","443  >  61013 [ACK] Seq=5755 Ack=21846 Win=8244 Len=0"
"46","2.911593","146.75.37.140","192.168.12.35","TCP","54","443  >  61013 [ACK] Seq=5755 Ack=23242 Win=8244 Len=0"
"47","2.911593","146.75.37.140","192.168.12.35","TCP","470","[TCP Spurious Retransmission] 443  >  61013 [PSH, ACK] Seq=5339 Ack=23242 Win=8244 Len=416 [TCP PDU reassembled in 41]"
"48","2.911779","192.168.12.35","146.75.37.140","TCP","66","[TCP Dup ACK 42#1] 61013  >  443 [ACK] Seq=26826 Ack=5755 Win=1025 Len=0 SLE=5339 SRE=5755"
"49","2.938845","146.75.37.140","192.168.12.35","TCP","1430","443  >  61013 [ACK] Seq=5755 Ack=23242 Win=8244 Len=1376 [TCP PDU reassembled in 50]"
"50","2.938845","146.75.37.140","192.168.12.35","TLSv1.2","908","Application Data"
"51","2.938845","146.75.37.140","192.168.12.35","TCP","1430","443  >  61013 [ACK] Seq=7985 Ack=23242 Win=8244 Len=1376 [TCP PDU reassembled in 52]"
"52","2.938845","146.75.37.140","192.168.12.35","TLSv1.2","813","Application Data"
"53","2.938845","146.75.37.140","192.168.12.35","TCP","1430","443  >  61013 [ACK] Seq=10120 Ack=23242 Win=8244 Len=1376 [TCP PDU reassembled in 66]"
"54","2.938845","146.75.37.140","192.168.12.35","TCP","1430","443  >  61013 [ACK] Seq=11496 Ack=23242 Win=8244 Len=1376 [TCP PDU reassembled in 66]"
"55","2.938845","146.75.37.140","192.168.12.35","TCP","1430","443  >  61013 [PSH, ACK] Seq=12872 Ack=23242 Win=8244 Len=1376 [TCP PDU reassembled in 66]"
"56","2.938845","146.75.37.140","192.168.12.35","TCP","1430","443  >  61013 [ACK] Seq=14248 Ack=23242 Win=8244 Len=1376 [TCP PDU reassembled in 66]"
"57","2.938845","146.75.37.140","192.168.12.35","TCP","1430","443  >  61013 [ACK] Seq=15624 Ack=23242 Win=8244 Len=1376 [TCP PDU reassembled in 66]"
"58","2.938845","146.75.37.140","192.168.12.35","TCP","1430","443  >  61013 [PSH, ACK] Seq=17000 Ack=23242 Win=8244 Len=1376 [TCP PDU reassembled in 66]"
"59","2.938845","146.75.37.140","192.168.12.35","TCP","1430","443  >  61013 [ACK] Seq=18376 Ack=23242 Win=8244 Len=1376 [TCP PDU reassembled in 66]"
"60","2.938845","146.75.37.140","192.168.12.35","TCP","1430","443  >  61013 [ACK] Seq=19752 Ack=23242 Win=8244 Len=1376 [TCP PDU reassembled in 66]"
"61","2.938845","146.75.37.140","192.168.12.35","TCP","1430","443  >  61013 [PSH, ACK] Seq=21128 Ack=23242 Win=8244 Len=1376 [TCP PDU reassembled in 66]"
"62","2.939212","192.168.12.35","146.75.37.140","TCP","54","61013  >  443 [ACK] Seq=26826 Ack=7985 Win=1025 Len=0"
"63","2.939364","192.168.12.35","146.75.37.140","TCP","54","61013  >  443 [ACK] Seq=26826 Ack=10120 Win=1025 Len=0"
"64","2.939506","192.168.12.35","146.75.37.140","TCP","54","61013  >  443 [ACK] Seq=26826 Ack=22504 Win=1025 Len=0"
"65","2.944981","146.75.37.140","192.168.12.35","TCP","1430","443  >  61013 [ACK] Seq=22504 Ack=23242 Win=8244 Len=1376 [TCP PDU reassembled in 66]"
"66","2.944981","146.75.37.140","192.168.12.35","TLSv1.2","605","Application Data"
"67","2.944981","146.75.37.140","192.168.12.35","TLSv1.2","623","Application Data"
"68","2.944981","146.75.37.140","192.168.12.35","TCP","1430","443  >  61013 [ACK] Seq=25000 Ack=23242 Win=8244 Len=1376 [TCP PDU reassembled in 79]"
"69","2.944981","146.75.37.140","192.168.12.35","TCP","1430","443  >  61013 [ACK] Seq=26376 Ack=23242 Win=8244 Len=1376 [TCP PDU reassembled in 79]"
"70","2.944981","146.75.37.140","192.168.12.35","TCP","1430","443  >  61013 [PSH, ACK] Seq=27752 Ack=23242 Win=8244 Len=1376 [TCP PDU reassembled in 79]"
"71","2.944981","146.75.37.140","192.168.12.35","TCP","1430","443  >  61013 [ACK] Seq=29128 Ack=23242 Win=8244 Len=1376 [TCP PDU reassembled in 79]"
"72","2.944981","146.75.37.140","192.168.12.35","TCP","1430","443  >  61013 [ACK] Seq=30504 Ack=23242 Win=8244 Len=1376 [TCP PDU reassembled in 79]"
"73","2.944981","146.75.37.140","192.168.12.35","TCP","1430","443  >  61013 [PSH, ACK] Seq=31880 Ack=23242 Win=8244 Len=1376 [TCP PDU reassembled in 79]"
"74","2.944981","146.75.37.140","192.168.12.35","TCP","1430","443  >  61013 [ACK] Seq=33256 Ack=23242 Win=8244 Len=1376 [TCP PDU reassembled in 79]"
"75","2.944981","146.75.37.140","192.168.12.35","TCP","1430","443  >  61013 [ACK] Seq=34632 Ack=23242 Win=8244 Len=1376 [TCP PDU reassembled in 79]"
"76","2.944981","146.75.37.140","192.168.12.35","TCP","1430","443  >  61013 [PSH, ACK] Seq=36008 Ack=23242 Win=8244 Len=1376 [TCP PDU reassembled in 79]"
"77","2.944981","146.75.37.140","192.168.12.35","TCP","1430","443  >  61013 [ACK] Seq=37384 Ack=23242 Win=8244 Len=1376 [TCP PDU reassembled in 79]"
"78","2.944981","146.75.37.140","192.168.12.35","TCP","1430","443  >  61013 [ACK] Seq=38760 Ack=23242 Win=8244 Len=1376 [TCP PDU reassembled in 79]"
"79","2.944981","146.75.37.140","192.168.12.35","TLSv1.2","795","Application Data"
"80","2.944981","146.75.37.140","192.168.12.35","TCP","1430","443  >  61013 [ACK] Seq=40877 Ack=23242 Win=8244 Len=1376 [TCP PDU reassembled in 91]"
"81","2.944981","146.75.37.140","192.168.12.35","TCP","1430","443  >  61013 [ACK] Seq=42253 Ack=23242 Win=8244 Len=1376 [TCP PDU reassembled in 91]"
"82","2.944981","146.75.37.140","192.168.12.35","TCP","1430","443  >  61013 [PSH, ACK] Seq=43629 Ack=23242 Win=8244 Len=1376 [TCP PDU reassembled in 91]"
"83","2.944981","146.75.37.140","192.168.12.35","TCP","1430","443  >  61013 [ACK] Seq=45005 Ack=23242 Win=8244 Len=1376 [TCP PDU reassembled in 91]"
"84","2.944981","146.75.37.140","192.168.12.35","TCP","1430","443  >  61013 [ACK] Seq=46381 Ack=23242 Win=8244 Len=1376 [TCP PDU reassembled in 91]"
"85","2.944981","146.75.37.140","192.168.12.35","TCP","1430","443  >  61013 [PSH, ACK] Seq=47757 Ack=23242 Win=8244 Len=1376 [TCP PDU reassembled in 91]"
"86","2.944981","146.75.37.140","192.168.12.35","TCP","1430","443  >  61013 [ACK] Seq=49133 Ack=24638 Win=8244 Len=1376 [TCP PDU reassembled in 91]"
"87","2.944981","146.75.37.140","192.168.12.35","TCP","1430","443  >  61013 [ACK] Seq=50509 Ack=24638 Win=8244 Len=1376 [TCP PDU reassembled in 91]"
"88","2.944981","146.75.37.140","192.168.12.35","TCP","1430","443  >  61013 [PSH, ACK] Seq=51885 Ack=24638 Win=8244 Len=1376 [TCP PDU reassembled in 91]"
"89","2.944981","146.75.37.140","192.168.12.35","TCP","1430","443  >  61013 [ACK] Seq=53261 Ack=24638 Win=8244 Len=1376 [TCP PDU reassembled in 91]"
"90","2.944981","146.75.37.140","192.168.12.35","TCP","1430","443  >  61013 [ACK] Seq=54637 Ack=24638 Win=8244 Len=1376 [TCP PDU reassembled in 91]"
"91","2.944981","146.75.37.140","192.168.12.35","TLSv1.2","1430","Application Data, Application Data"
"92","2.944981","146.75.37.140","192.168.12.35","TCP","1430","443  >  61013 [ACK] Seq=57389 Ack=24638 Win=8244 Len=1376 [TCP PDU reassembled in 94]"
"93","2.944981","146.75.37.140","192.168.12.35","TCP","1430","443  >  61013 [ACK] Seq=58765 Ack=24638 Win=8244 Len=1376 [TCP PDU reassembled in 94]"
"94","2.944981","146.75.37.140","192.168.12.35","TLSv1.2","1430","Application Data"
"95","2.944981","146.75.37.140","192.168.12.35","TLSv1.2","1430","Application Data"
"96","2.944981","146.75.37.140","192.168.12.35","TLSv1.2","1430","Application Data"
"97","2.945631","146.75.37.140","192.168.12.35","TLSv1.2","1113","Application Data, Application Data"
"98","2.945709","192.168.12.35","146.75.37.140","TCP","54","61013  >  443 [ACK] Seq=26826 Ack=23880 Win=1019 Len=0"
"99","2.945818","192.168.12.35","146.75.37.140","TCP","54","61013  >  443 [ACK] Seq=26826 Ack=24431 Win=1025 Len=0"
"100","2.945847","192.168.12.35","146.75.37.140","TCP","54","61013  >  443 [ACK] Seq=26826 Ack=25000 Win=1022 Len=0"
"101","2.945898","192.168.12.35","146.75.37.140","TCP","54","61013  >  443 [ACK] Seq=26826 Ack=40136 Win=1025 Len=0"
"102","2.945931","192.168.12.35","146.75.37.140","TCP","54","61013  >  443 [ACK] Seq=26826 Ack=40877 Win=1022 Len=0"
"103","2.945980","192.168.12.35","146.75.37.140","TCP","54","61013  >  443 [ACK] Seq=26826 Ack=64269 Win=1025 Len=0"
"104","2.946015","192.168.12.35","146.75.37.140","TCP","54","61013  >  443 [ACK] Seq=26826 Ack=65328 Win=1021 Len=0"
"105","2.960775","146.75.37.140","192.168.12.35","TCP","54","443  >  61013 [ACK] Seq=65328 Ack=25181 Win=8244 Len=0"
"106","2.976881","146.75.37.140","192.168.12.35","TLSv1.2","188","Application Data"
"107","2.982388","146.75.37.140","192.168.12.35","TLSv1.2","232","Application Data"
"108","2.982388","146.75.37.140","192.168.12.35","TLSv1.2","581","Application Data"
"109","2.982388","146.75.37.140","192.168.12.35","TCP","1430","443  >  61013 [ACK] Seq=66167 Ack=25181 Win=8244 Len=1376 [TCP PDU reassembled in 110]"
"110","2.982388","146.75.37.140","192.168.12.35","TLSv1.2","1009","Application Data"
"111","2.982858","192.168.12.35","146.75.37.140","TCP","54","61013  >  443 [ACK] Seq=26826 Ack=65640 Win=1019 Len=0"
"112","2.983240","192.168.12.35","146.75.37.140","TCP","54","61013  >  443 [ACK] Seq=26826 Ack=66167 Win=1025 Len=0"
"113","2.983348","192.168.12.35","146.75.37.140","TCP","54","61013  >  443 [ACK] Seq=26826 Ack=67543 Win=1019 Len=0"
"114","2.983419","192.168.12.35","146.75.37.140","TCP","54","61013  >  443 [ACK] Seq=26826 Ack=68498 Win=1025 Len=0"
"115","2.996049","146.75.37.140","192.168.12.35","TLSv1.2","220","Application Data"
"116","2.996049","146.75.37.140","192.168.12.35","TLSv1.2","1217","Application Data"
"117","2.996049","146.75.37.140","192.168.12.35","TLSv1.2","137","Application Data"
"118","2.996049","146.75.37.140","192.168.12.35","TLSv1.2","104","Application Data"
"119","2.996049","146.75.37.140","192.168.12.35","TLSv1.2","1287","Application Data"
"120","2.996049","146.75.37.140","192.168.12.35","TLSv1.2","160","Application Data"
"121","2.996049","146.75.37.140","192.168.12.35","TLSv1.2","109","Application Data"
"122","2.996049","146.75.37.140","192.168.12.35","TLSv1.2","310","Application Data"
"123","2.996049","146.75.37.140","192.168.12.35","TLSv1.2","458","Application Data"
"124","2.996049","146.75.37.140","192.168.12.35","TLSv1.2","123","Application Data"
"125","2.996049","146.75.37.140","192.168.12.35","TLSv1.2","402","Application Data"
"126","2.996049","146.75.37.140","192.168.12.35","TLSv1.2","159","Application Data"
"127","2.996049","146.75.37.140","192.168.12.35","TLSv1.2","274","Application Data"
"128","2.996049","146.75.37.140","192.168.12.35","TLSv1.2","106","Application Data"
"129","2.996049","146.75.37.140","192.168.12.35","TLSv1.2","242","Application Data"
"130","2.996049","146.75.37.140","192.168.12.35","TLSv1.2","173","Application Data"
"131","2.996049","146.75.37.140","192.168.12.35","TLSv1.2","107","Application Data"
"132","2.996049","146.75.37.140","192.168.12.35","TLSv1.2","106","Application Data"
"133","2.996049","146.75.37.140","192.168.12.35","TLSv1.2","210","Application Data"
"134","2.996049","146.75.37.140","192.168.12.35","TLSv1.2","312","Application Data"
"135","2.996049","146.75.37.140","192.168.12.35","TLSv1.2","169","Application Data"
"136","2.996049","146.75.37.140","192.168.12.35","TLSv1.2","108","Application Data"
"137","2.996049","146.75.37.140","192.168.12.35","TLSv1.2","147","Application Data"
"138","2.997643","192.168.12.35","146.75.37.140","TCP","54","61013  >  443 [ACK] Seq=26826 Ack=68664 Win=1024 Len=0"
"139","2.997934","192.168.12.35","146.75.37.140","TCP","54","61013  >  443 [ACK] Seq=26826 Ack=69910 Win=1025 Len=0"
"140","2.998089","192.168.12.35","146.75.37.140","TCP","54","61013  >  443 [ACK] Seq=26826 Ack=71193 Win=1020 Len=0"
"141","2.998169","192.168.12.35","146.75.37.140","TCP","54","61013  >  443 [ACK] Seq=26826 Ack=71354 Win=1025 Len=0"
"142","2.998294","192.168.12.35","146.75.37.140","TCP","54","61013  >  443 [ACK] Seq=26826 Ack=72014 Win=1022 Len=0"
"143","2.998385","192.168.12.35","146.75.37.140","TCP","54","61013  >  443 [ACK] Seq=26826 Ack=72431 Win=1020 Len=0"
"144","2.998504","192.168.12.35","146.75.37.140","TCP","54","61013  >  443 [ACK] Seq=26826 Ack=72756 Win=1025 Len=0"
"145","2.998577","192.168.12.35","146.75.37.140","TCP","54","61013  >  443 [ACK] Seq=26826 Ack=72996 Win=1024 Len=0"
"146","2.998659","192.168.12.35","146.75.37.140","TCP","54","61013  >  443 [ACK] Seq=26826 Ack=73168 Win=1023 Len=0"
"147","2.998716","192.168.12.35","146.75.37.140","TCP","54","61013  >  443 [ACK] Seq=26826 Ack=73376 Win=1022 Len=0"
"148","2.998775","192.168.12.35","146.75.37.140","TCP","54","61013  >  443 [ACK] Seq=26826 Ack=73749 Win=1021 Len=0"
"149","2.998847","192.168.12.35","146.75.37.140","TCP","54","61013  >  443 [ACK] Seq=26826 Ack=73896 Win=1020 Len=0"
"150","3.003065","146.75.37.140","192.168.12.35","TLSv1.2","216","Application Data"
"151","3.003065","146.75.37.140","192.168.12.35","TLSv1.2","190","Application Data"
"152","3.003065","146.75.37.140","192.168.12.35","TLSv1.2","176","Application Data"
"153","3.003065","146.75.37.140","192.168.12.35","TLSv1.2","157","Application Data"
"154","3.003065","146.75.37.140","192.168.12.35","TLSv1.2","140","Application Data"
"155","3.003065","146.75.37.140","192.168.12.35","TLSv1.2","178","Application Data"
"156","3.003065","146.75.37.140","192.168.12.35","TLSv1.2","169","Application Data"
"157","3.003065","146.75.37.140","192.168.12.35","TLSv1.2","165","Application Data"
"158","3.003065","146.75.37.140","192.168.12.35","TLSv1.2","203","Application Data"
"159","3.003065","146.75.37.140","192.168.12.35","TCP","54","443  >  61013 [ACK] Seq=75004 Ack=26826 Win=8244 Len=0"
"160","3.003478","192.168.12.35","146.75.37.140","TCP","54","61013  >  443 [ACK] Seq=26826 Ack=74194 Win=1025 Len=0"
"161","3.003615","192.168.12.35","146.75.37.140","TCP","54","61013  >  443 [ACK] Seq=26826 Ack=74419 Win=1024 Len=0"
"162","3.003683","192.168.12.35","146.75.37.140","TCP","54","61013  >  443 [ACK] Seq=26826 Ack=74629 Win=1023 Len=0"
"163","3.003713","192.168.12.35","146.75.37.140","TCP","54","61013  >  443 [ACK] Seq=26826 Ack=74855 Win=1022 Len=0"
"164","3.006959","192.168.12.35","146.75.37.140","UDP","96","52870  >  443 Len=54"
"165","3.014551","146.75.37.140","192.168.12.35","TCP","1430","443  >  61013 [ACK] Seq=75004 Ack=26826 Win=8244 Len=1376 [TCP PDU reassembled in 166]"
"166","3.014551","146.75.37.140","192.168.12.35","TLSv1.2","502","Application Data"
"167","3.015342","192.168.12.35","146.75.37.140","TCP","54","61013  >  443 [ACK] Seq=26826 Ack=76380 Win=1025 Len=0"
"168","3.062310","146.75.37.140","192.168.12.35","UDP","67","443  >  52870 Len=25"
"169","3.072693","192.168.12.35","146.75.37.140","TCP","54","61013  >  443 [ACK] Seq=26826 Ack=76828 Win=1023 Len=0"
"170","3.081205","192.168.12.35","146.75.37.140","UDP","84","52870  >  443 Len=42"
"171","3.083797","146.75.37.140","192.168.12.35","UDP","67","443  >  52870 Len=25"
"172","3.184889","146.75.37.140","192.168.12.35","TLSv1.2","206","Application Data"
"173","3.216763","146.75.37.140","192.168.12.35","TLSv1.2","1202","Application Data"
"174","3.216763","146.75.37.140","192.168.12.35","TLSv1.2","98","Application Data"
"175","3.217687","192.168.12.35","146.75.37.140","TCP","54","61013  >  443 [ACK] Seq=26826 Ack=78128 Win=1025 Len=0"
"176","3.217964","146.75.37.140","192.168.12.35","TLSv1.2","163","Application Data"
"177","3.217964","146.75.37.140","192.168.12.35","TLSv1.2","110","Application Data"
"178","3.217964","146.75.37.140","192.168.12.35","TLSv1.2","411","Application Data"
"179","3.217964","146.75.37.140","192.168.12.35","TLSv1.2","109","Application Data"
"180","3.217964","146.75.37.140","192.168.12.35","TLSv1.2","195","Application Data"
"181","3.217964","146.75.37.140","192.168.12.35","TLSv1.2","112","Application Data"
"182","3.217964","146.75.37.140","192.168.12.35","TLSv1.2","573","Application Data"
"183","3.217964","146.75.37.140","192.168.12.35","TLSv1.2","310","Application Data"
"184","3.217964","146.75.37.140","192.168.12.35","TLSv1.2","137","Application Data"
"185","3.217964","146.75.37.140","192.168.12.35","TLSv1.2","138","Application Data"
"186","3.217964","146.75.37.140","192.168.12.35","TLSv1.2","780","Application Data"
"187","3.217964","146.75.37.140","192.168.12.35","TLSv1.2","445","Application Data"
"188","3.217964","146.75.37.140","192.168.12.35","TLSv1.2","122","Application Data"
"189","3.217964","146.75.37.140","192.168.12.35","TCP","1430","443  >  61013 [ACK] Seq=81075 Ack=26826 Win=8244 Len=1376 [TCP PDU reassembled in 190]"
"190","3.217964","146.75.37.140","192.168.12.35","TLSv1.2","810","Application Data"
"191","3.217964","146.75.37.140","192.168.12.35","TCP","1430","443  >  61013 [ACK] Seq=83207 Ack=26826 Win=8244 Len=1376 [TCP PDU reassembled in 192]"
"192","3.217964","146.75.37.140","192.168.12.35","TLSv1.2","691","Application Data"
"193","3.217964","146.75.37.140","192.168.12.35","TLSv1.2","1270","Application Data"
"194","3.217964","146.75.37.140","192.168.12.35","TLSv1.2","1110","Application Data, Application Data, Application Data, Application Data"
"195","3.217964","146.75.37.140","192.168.12.35","TLSv1.2","433","Application Data, Application Data, Application Data, Application Data, Application Data"
"196","3.217964","146.75.37.140","192.168.12.35","TLSv1.2","245","Application Data, Application Data"
"197","3.218559","192.168.12.35","146.75.37.140","TCP","54","61013  >  443 [ACK] Seq=26826 Ack=78281 Win=1024 Len=0"
"198","3.218608","192.168.12.35","146.75.37.140","TCP","54","61013  >  443 [ACK] Seq=26826 Ack=78694 Win=1022 Len=0"
"199","3.218668","192.168.12.35","146.75.37.140","TCP","54","61013  >  443 [ACK] Seq=26826 Ack=78890 Win=1022 Len=0"
"200","3.218728","192.168.12.35","146.75.37.140","TCP","54","61013  >  443 [ACK] Seq=26826 Ack=79467 Win=1019 Len=0"
"201","3.218773","192.168.12.35","146.75.37.140","TCP","54","61013  >  443 [ACK] Seq=26826 Ack=79806 Win=1025 Len=0"
"202","3.218831","192.168.12.35","146.75.37.140","TCP","54","61013  >  443 [ACK] Seq=26826 Ack=80616 Win=1022 Len=0"
"203","3.219011","192.168.12.35","146.75.37.140","TCP","54","61013  >  443 [ACK] Seq=26826 Ack=81075 Win=1020 Len=0"
"204","3.219200","192.168.12.35","146.75.37.140","TCP","54","61013  >  443 [ACK] Seq=26826 Ack=83207 Win=1025 Len=0"
"205","3.219293","192.168.12.35","146.75.37.140","TCP","54","61013  >  443 [ACK] Seq=26826 Ack=85220 Win=1025 Len=0"
"206","3.219397","192.168.12.35","146.75.37.140","TCP","54","61013  >  443 [ACK] Seq=26826 Ack=87492 Win=1025 Len=0"
"207","3.219503","192.168.12.35","146.75.37.140","TCP","54","61013  >  443 [ACK] Seq=26826 Ack=88062 Win=1022 Len=0"
"208","3.226361","146.75.37.140","192.168.12.35","TLSv1.2","1328","Application Data"
"209","3.226361","146.75.37.140","192.168.12.35","TCP","1430","443  >  61013 [ACK] Seq=89336 Ack=26826 Win=8244 Len=1376 [TCP PDU reassembled in 211]"
"210","3.226361","146.75.37.140","192.168.12.35","TCP","1430","443  >  61013 [PSH, ACK] Seq=90712 Ack=26826 Win=8244 Len=1376 [TCP PDU reassembled in 211]"
"211","3.226361","146.75.37.140","192.168.12.35","TLSv1.2","85","Application Data"
"212","3.227333","192.168.12.35","146.75.37.140","TCP","54","61013  >  443 [ACK] Seq=26826 Ack=92088 Win=1025 Len=0"
"213","3.227620","192.168.12.35","146.75.37.140","TCP","54","61013  >  443 [ACK] Seq=26826 Ack=92119 Win=1025 Len=0"
"214","3.236685","146.75.37.140","192.168.12.35","TLSv1.2","1042","Application Data"
"215","3.236685","146.75.37.140","192.168.12.35","TLSv1.2","288","Application Data"
"216","3.236685","146.75.37.140","192.168.12.35","TLSv1.2","325","Application Data"
"217","3.236994","192.168.12.35","146.75.37.140","TCP","54","61013  >  443 [ACK] Seq=26826 Ack=93341 Win=1020 Len=0"
"218","3.242485","146.75.37.140","192.168.12.35","TLSv1.2","460","Application Data"
"219","3.242485","146.75.37.140","192.168.12.35","TLSv1.2","251","Application Data"
"220","3.242728","192.168.12.35","146.75.37.140","TCP","54","61013  >  443 [ACK] Seq=26826 Ack=94018 Win=1025 Len=0"
"221","3.248274","146.75.37.140","192.168.12.35","TLSv1.2","194","Application Data"
"222","3.248274","146.75.37.140","192.168.12.35","TLSv1.2","261","Application Data"
"223","3.248565","192.168.12.35","146.75.37.140","TCP","54","61013  >  443 [ACK] Seq=26826 Ack=94355 Win=1023 Len=0"
"224","3.254727","146.75.37.140","192.168.12.35","TLSv1.2","163","Application Data"
"225","3.254727","146.75.37.140","192.168.12.35","TLSv1.2","325","Application Data"
"226","3.254931","192.168.12.35","146.75.37.140","TCP","54","61013  >  443 [ACK] Seq=26826 Ack=94671 Win=1022 Len=0"
"227","3.259022","192.168.12.35","146.75.37.140","TLSv1.2","3194","Application Data"
"228","3.268517","146.75.37.140","192.168.12.35","TLSv1.2","353","Application Data"
"229","3.274371","146.75.37.140","192.168.12.35","TLSv1.2","360","Application Data"
"230","3.274371","146.75.37.140","192.168.12.35","TLSv1.2","166","Application Data"
"231","3.274371","146.75.37.140","192.168.12.35","TLSv1.2","510","Application Data"
"232","3.274371","146.75.37.140","192.168.12.35","TLSv1.2","283","Application Data"
"233","3.274371","146.75.37.140","192.168.12.35","TLSv1.2","852","Application Data"
"234","3.274704","192.168.12.35","146.75.37.140","TCP","54","61013  >  443 [ACK] Seq=29966 Ack=95547 Win=1025 Len=0"
"235","3.274910","192.168.12.35","146.75.37.140","TCP","54","61013  >  443 [ACK] Seq=29966 Ack=96115 Win=1022 Len=0"
"236","3.274970","192.168.12.35","146.75.37.140","TCP","54","61013  >  443 [ACK] Seq=29966 Ack=97142 Win=1025 Len=0"
"237","3.280397","146.75.37.140","192.168.12.35","TLSv1.2","614","Application Data"
"238","3.280397","146.75.37.140","192.168.12.35","TLSv1.2","299","Application Data"
"239","3.280397","146.75.37.140","192.168.12.35","TLSv1.2","313","Application Data"
"240","3.280397","146.75.37.140","192.168.12.35","TLSv1.2","155","Application Data"
"241","3.280397","146.75.37.140","192.168.12.35","TLSv1.2","215","Application Data"
"242","3.280397","146.75.37.140","192.168.12.35","TLSv1.2","757","Application Data"
"243","3.280397","146.75.37.140","192.168.12.35","TLSv1.2","721","Application Data"
"244","3.280397","146.75.37.140","192.168.12.35","TLSv1.2","211","Application Data"
"245","3.280397","146.75.37.140","192.168.12.35","TLSv1.2","459","Application Data"
"246","3.280397","146.75.37.140","192.168.12.35","TLSv1.2","255","Application Data"
"247","3.280397","146.75.37.140","192.168.12.35","TLSv1.2","173","Application Data"
"248","3.280397","146.75.37.140","192.168.12.35","TLSv1.2","316","Application Data"
"249","3.280397","146.75.37.140","192.168.12.35","TLSv1.2","149","Application Data"
"250","3.280397","146.75.37.140","192.168.12.35","TLSv1.2","519","Application Data"
"251","3.280397","146.75.37.140","192.168.12.35","TLSv1.2","227","Application Data"
"252","3.280397","146.75.37.140","192.168.12.35","TLSv1.2","410","Application Data"
"253","3.281386","192.168.12.35","146.75.37.140","TCP","54","61013  >  443 [ACK] Seq=29966 Ack=97947 Win=1022 Len=0"
"254","3.281716","192.168.12.35","146.75.37.140","TCP","54","61013  >  443 [ACK] Seq=29966 Ack=98307 Win=1020 Len=0"
"255","3.281827","192.168.12.35","146.75.37.140","TCP","54","61013  >  443 [ACK] Seq=29966 Ack=99171 Win=1025 Len=0"
"256","3.281937","192.168.12.35","146.75.37.140","TCP","54","61013  >  443 [ACK] Seq=29966 Ack=99995 Win=1021 Len=0"
"257","3.282013","192.168.12.35","146.75.37.140","TCP","54","61013  >  443 [ACK] Seq=29966 Ack=100601 Win=1025 Len=0"
"258","3.282076","192.168.12.35","146.75.37.140","TCP","54","61013  >  443 [ACK] Seq=29966 Ack=100982 Win=1023 Len=0"
"259","3.282146","192.168.12.35","146.75.37.140","TCP","54","61013  >  443 [ACK] Seq=29966 Ack=101542 Win=1021 Len=0"
"260","3.282226","192.168.12.35","146.75.37.140","TCP","54","61013  >  443 [ACK] Seq=29966 Ack=102071 Win=1025 Len=0"
"261","3.299363","146.75.37.140","192.168.12.35","TLSv1.2","124","Application Data"
"262","3.299363","146.75.37.140","192.168.12.35","TLSv1.2","107","Application Data"
"263","3.299363","146.75.37.140","192.168.12.35","TLSv1.2","283","Application Data"
"264","3.299363","146.75.37.140","192.168.12.35","TLSv1.2","286","Application Data"
"265","3.299363","146.75.37.140","192.168.12.35","TLSv1.2","116","Application Data"
"266","3.299363","146.75.37.140","192.168.12.35","TLSv1.2","201","Application Data"
"267","3.299363","146.75.37.140","192.168.12.35","TLSv1.2","176","Application Data"
"268","3.299363","146.75.37.140","192.168.12.35","TLSv1.2","136","Application Data"
"269","3.299363","146.75.37.140","192.168.12.35","TLSv1.2","145","Application Data"
"270","3.299363","146.75.37.140","192.168.12.35","TLSv1.2","186","Application Data"
"271","3.299363","146.75.37.140","192.168.12.35","TLSv1.2","105","Application Data"
"272","3.299363","146.75.37.140","192.168.12.35","TLSv1.2","94","Application Data"
"273","3.299363","146.75.37.140","192.168.12.35","TLSv1.2","548","Application Data"
"274","3.299363","146.75.37.140","192.168.12.35","TLSv1.2","660","Application Data"
"275","3.299363","146.75.37.140","192.168.12.35","TLSv1.2","708","Application Data"
"276","3.299363","146.75.37.140","192.168.12.35","TLSv1.2","315","Application Data"
"277","3.299363","146.75.37.140","192.168.12.35","TLSv1.2","606","Application Data"
"278","3.299363","146.75.37.140","192.168.12.35","TLSv1.2","318","Application Data"
"279","3.299363","146.75.37.140","192.168.12.35","TLSv1.2","484","Application Data"
"280","3.299363","146.75.37.140","192.168.12.35","TLSv1.2","393","Application Data"
"281","3.299363","146.75.37.140","192.168.12.35","TLSv1.2","590","Application Data"
"282","3.299363","146.75.37.140","192.168.12.35","TLSv1.2","451","Application Data"
"283","3.299363","146.75.37.140","192.168.12.35","TLSv1.2","364","Application Data"
"284","3.299363","146.75.37.140","192.168.12.35","TLSv1.2","330","Application Data"
"285","3.301114","192.168.12.35","146.75.37.140","TCP","54","61013  >  443 [ACK] Seq=29966 Ack=102194 Win=1024 Len=0"
"286","3.301690","192.168.12.35","146.75.37.140","TCP","54","61013  >  443 [ACK] Seq=29966 Ack=102655 Win=1022 Len=0"
"287","3.301803","192.168.12.35","146.75.37.140","TCP","54","61013  >  443 [ACK] Seq=29966 Ack=102864 Win=1022 Len=0"
"288","3.302049","192.168.12.35","146.75.37.140","TCP","54","61013  >  443 [ACK] Seq=29966 Ack=103068 Win=1021 Len=0"
"289","3.302221","192.168.12.35","146.75.37.140","TCP","54","61013  >  443 [ACK] Seq=29966 Ack=103291 Win=1020 Len=0"
"290","3.302323","192.168.12.35","146.75.37.140","TCP","54","61013  >  443 [ACK] Seq=29966 Ack=103382 Win=1020 Len=0"
"291","3.302410","192.168.12.35","146.75.37.140","TCP","54","61013  >  443 [ACK] Seq=29966 Ack=103876 Win=1025 Len=0"
"292","3.302474","192.168.12.35","146.75.37.140","TCP","54","61013  >  443 [ACK] Seq=29966 Ack=104482 Win=1022 Len=0"
"293","3.302574","192.168.12.35","146.75.37.140","TCP","54","61013  >  443 [ACK] Seq=29966 Ack=105397 Win=1025 Len=0"
"294","3.303133","192.168.12.35","146.75.37.140","TCP","54","61013  >  443 [ACK] Seq=29966 Ack=106213 Win=1022 Len=0"
"295","3.303496","192.168.12.35","146.75.37.140","TCP","54","61013  >  443 [ACK] Seq=29966 Ack=106982 Win=1025 Len=0"
"296","3.303784","192.168.12.35","146.75.37.140","TCP","54","61013  >  443 [ACK] Seq=29966 Ack=107915 Win=1021 Len=0"
"297","3.303954","192.168.12.35","146.75.37.140","TCP","54","61013  >  443 [ACK] Seq=29966 Ack=108501 Win=1025 Len=0"
"298","3.313771","146.75.37.140","192.168.12.35","TLSv1.2","383","Application Data"
"299","3.327089","146.75.37.140","192.168.12.35","TCP","54","443  >  61013 [ACK] Seq=108830 Ack=28222 Win=8244 Len=0"
"300","3.365259","192.168.12.35","146.75.37.140","TCP","54","61013  >  443 [ACK] Seq=29966 Ack=108830 Win=1023 Len=0"
"301","3.397633","146.75.37.140","192.168.12.35","TCP","54","443  >  61013 [ACK] Seq=108830 Ack=29618 Win=8244 Len=0"
"302","3.423739","146.75.37.140","192.168.12.35","TCP","54","443  >  61013 [ACK] Seq=108830 Ack=29966 Win=8244 Len=0"
"303","3.461678","146.75.37.140","192.168.12.35","TCP","1430","443  >  61013 [ACK] Seq=108830 Ack=29966 Win=8244 Len=1376 [TCP PDU reassembled in 304]"
"304","3.461678","146.75.37.140","192.168.12.35","TLSv1.2","949","Application Data"
"305","3.463186","192.168.12.35","146.75.37.140","TCP","54","61013  >  443 [ACK] Seq=29966 Ack=111101 Win=1025 Len=0"
"306","3.469824","146.75.37.140","192.168.12.35","TLSv1.2","100","Application Data"
"307","3.516584","192.168.12.35","146.75.37.140","TCP","54","61013  >  443 [ACK] Seq=29966 Ack=111147 Win=1025 Len=0"
"308","3.756798","192.168.12.35","146.75.37.140","TLSv1.2","3231","Application Data"
"309","3.791986","192.168.12.35","146.75.37.140","TLSv1.2","3219","Application Data"
"310","3.792296","192.168.12.35","146.75.37.140","TLSv1.2","989","Application Data"
"311","3.836644","146.75.37.140","192.168.12.35","TCP","54","443  >  61013 [ACK] Seq=111147 Ack=31362 Win=8244 Len=0"
"312","3.844465","192.168.12.35","146.75.37.140","TLSv1.2","3233","Application Data"
"313","3.891892","146.75.37.140","192.168.12.35","TCP","54","443  >  61013 [ACK] Seq=111147 Ack=32758 Win=8244 Len=0"
"314","3.908922","192.168.12.35","146.75.37.140","TLSv1.2","3229","Application Data"
"315","3.909425","192.168.12.35","146.75.37.140","TLSv1.2","3244","Application Data"
"316","3.910585","192.168.12.35","146.75.37.140","TLSv1.2","3221","Application Data"
"317","3.910767","192.168.12.35","146.75.37.140","TLSv1.2","3246","Application Data"
"318","3.910858","192.168.12.35","146.75.37.140","TLSv1.2","3229","Application Data"
"319","3.910950","192.168.12.35","146.75.37.140","TLSv1.2","3232","Application Data"
"320","3.911464","192.168.12.35","146.75.37.140","TLSv1.2","3233","Application Data"
"321","3.911569","192.168.12.35","146.75.37.140","TLSv1.2","3229","Application Data"
"322","3.911605","192.168.12.35","146.75.37.140","TLSv1.2","3232","Application Data"
"323","3.919059","146.75.37.140","192.168.12.35","TCP","54","443  >  61013 [ACK] Seq=111147 Ack=33143 Win=8244 Len=0"
"324","3.948030","146.75.37.140","192.168.12.35","TCP","1430","443  >  61013 [ACK] Seq=111147 Ack=33143 Win=8244 Len=1376 [TCP PDU reassembled in 325]"
"325","3.948030","146.75.37.140","192.168.12.35","TLSv1.2","495","Application Data"
"326","3.948030","146.75.37.140","192.168.12.35","TLSv1.2","87","Application Data"
"327","3.948331","192.168.12.35","146.75.37.140","TCP","54","61013  >  443 [ACK] Seq=69031 Ack=112523 Win=1025 Len=0"
"328","3.948498","192.168.12.35","146.75.37.140","TCP","54","61013  >  443 [ACK] Seq=69031 Ack=112964 Win=1023 Len=0"
"329","3.972363","146.75.37.140","192.168.12.35","TCP","54","443  >  61013 [ACK] Seq=112997 Ack=34539 Win=8244 Len=0"
"330","4.001012","192.168.12.35","146.75.37.140","TCP","54","61013  >  443 [ACK] Seq=69031 Ack=112997 Win=1023 Len=0"
"331","4.041936","146.75.37.140","192.168.12.35","TCP","54","443  >  61013 [ACK] Seq=112997 Ack=35935 Win=8244 Len=0"
"332","4.052336","146.75.37.140","192.168.12.35","TLSv1.2","148","Application Data"
"333","4.054664","192.168.12.35","146.75.37.140","TLSv1.2","3178","Application Data"
"334","4.073557","146.75.37.140","192.168.12.35","TLSv1.2","223","Application Data"
"335","4.073557","146.75.37.140","192.168.12.35","TCP","54","443  >  61013 [ACK] Seq=113260 Ack=36308 Win=8244 Len=0"
"336","4.073557","146.75.37.140","192.168.12.35","TLSv1.2","1160","Application Data"
"337","4.073557","146.75.37.140","192.168.12.35","TLSv1.2","1325","Application Data"
"338","4.073557","146.75.37.140","192.168.12.35","TLSv1.2","511","Application Data"
"339","4.073557","146.75.37.140","192.168.12.35","TLSv1.2","328","Application Data"
"340","4.074658","192.168.12.35","146.75.37.140","TCP","54","61013  >  443 [ACK] Seq=72155 Ack=114366 Win=1025 Len=0"
"341","4.075109","192.168.12.35","146.75.37.140","TCP","54","61013  >  443 [ACK] Seq=72155 Ack=116094 Win=1025 Len=0"
"342","4.075447","146.75.37.140","192.168.12.35","TCP","1430","443  >  61013 [ACK] Seq=116368 Ack=36308 Win=8244 Len=1376 [TCP PDU reassembled in 343]"
"343","4.075447","146.75.37.140","192.168.12.35","TLSv1.2","606","Application Data"
"344","4.075447","146.75.37.140","192.168.12.35","TLSv1.2","449","Application Data"
"345","4.075447","146.75.37.140","192.168.12.35","TLSv1.2","778","Application Data"
"346","4.075447","146.75.37.140","192.168.12.35","TLSv1.2","1411","Application Data"
"347","4.075447","146.75.37.140","192.168.12.35","TLSv1.2","1227","Application Data"
"348","4.075447","146.75.37.140","192.168.12.35","TLSv1.2","564","Application Data"
"349","4.075447","146.75.37.140","192.168.12.35","TLSv1.2","480","Application Data"
"350","4.075834","192.168.12.35","146.75.37.140","TCP","54","61013  >  443 [ACK] Seq=72155 Ack=117744 Win=1025 Len=0"
"351","4.076060","192.168.12.35","146.75.37.140","TCP","54","61013  >  443 [ACK] Seq=72155 Ack=118691 Win=1021 Len=0"
"352","4.076152","192.168.12.35","146.75.37.140","TCP","54","61013  >  443 [ACK] Seq=72155 Ack=119415 Win=1025 Len=0"
"353","4.076201","192.168.12.35","146.75.37.140","TCP","54","61013  >  443 [ACK] Seq=72155 Ack=120772 Win=1019 Len=0"
"354","4.076277","192.168.12.35","146.75.37.140","TCP","54","61013  >  443 [ACK] Seq=72155 Ack=121945 Win=1025 Len=0"
"355","4.076310","192.168.12.35","146.75.37.140","TCP","54","61013  >  443 [ACK] Seq=72155 Ack=122455 Win=1023 Len=0"
"356","4.081612","146.75.37.140","192.168.12.35","TLSv1.2","340","Application Data"
"357","4.082616","192.168.12.35","146.75.37.140","TCP","54","61013  >  443 [ACK] Seq=72155 Ack=123167 Win=1020 Len=0"
"358","4.086314","146.75.37.140","192.168.12.35","TLSv1.2","280","Application Data"
"359","4.086314","146.75.37.140","192.168.12.35","TLSv1.2","154","Application Data"
"360","4.086510","192.168.12.35","146.75.37.140","TCP","54","61013  >  443 [ACK] Seq=72155 Ack=123393 Win=1025 Len=0"
"361","4.086580","192.168.12.35","146.75.37.140","TCP","54","61013  >  443 [ACK] Seq=72155 Ack=123493 Win=1024 Len=0"
"362","4.097284","146.75.37.140","192.168.12.35","TLSv1.2","145","Application Data"
"363","4.102634","146.75.37.140","192.168.12.35","TLSv1.2","250","Application Data"
"364","4.102634","146.75.37.140","192.168.12.35","TLSv1.2","157","Application Data"
"365","4.102634","146.75.37.140","192.168.12.35","TLSv1.2","220","Application Data"
"366","4.102634","146.75.37.140","192.168.12.35","TLSv1.2","218","Application Data"
"367","4.102634","146.75.37.140","192.168.12.35","TLSv1.2","891","Application Data"
"368","4.102634","146.75.37.140","192.168.12.35","TLSv1.2","833","Application Data"
"369","4.102903","192.168.12.35","146.75.37.140","TCP","54","61013  >  443 [ACK] Seq=72155 Ack=123780 Win=1023 Len=0"
"370","4.103013","192.168.12.35","146.75.37.140","TCP","54","61013  >  443 [ACK] Seq=72155 Ack=124049 Win=1022 Len=0"
"371","4.103050","192.168.12.35","146.75.37.140","TCP","54","61013  >  443 [ACK] Seq=72155 Ack=125050 Win=1025 Len=0"
"372","4.116053","146.75.37.140","192.168.12.35","TLSv1.2","1013","Application Data"
"373","4.116053","146.75.37.140","192.168.12.35","TLSv1.2","165","Application Data"
"374","4.116053","146.75.37.140","192.168.12.35","TLSv1.2","486","Application Data"
"375","4.116053","146.75.37.140","192.168.12.35","TLSv1.2","509","Application Data"
"376","4.116053","146.75.37.140","192.168.12.35","TLSv1.2","188","Application Data"
"377","4.116053","146.75.37.140","192.168.12.35","TLSv1.2","184","Application Data"
"378","4.116053","146.75.37.140","192.168.12.35","TCP","54","443  >  61013 [ACK] Seq=128050 Ack=37243 Win=8244 Len=0"
"379","4.116547","192.168.12.35","146.75.37.140","TCP","54","61013  >  443 [ACK] Seq=72155 Ack=126788 Win=1025 Len=0"
"380","4.116750","192.168.12.35","146.75.37.140","TCP","54","61013  >  443 [ACK] Seq=72155 Ack=127331 Win=1023 Len=0"
