"No.","Time","Source","Destination","Protocol","Length","Info"
"1","0.000000","192.168.12.35","146.75.37.140","TLSv1.2","201","Application Data"
"2","0.000123","192.168.12.35","146.75.37.140","TLSv1.2","93","Application Data"
"3","0.038178","146.75.37.140","192.168.12.35","TCP","54","443  >  61140 [ACK] Seq=1 Ack=148 Win=424 Len=0"
"4","0.038178","146.75.37.140","192.168.12.35","TCP","54","443  >  61140 [ACK] Seq=1 Ack=187 Win=424 Len=0"
"5","0.038178","146.75.37.140","192.168.12.35","TLSv1.2","93","Application Data"
"6","0.038178","146.75.37.140","192.168.12.35","TLSv1.2","555","Application Data"
"7","0.038178","146.75.37.140","192.168.12.35","TCP","1430","443  >  61140 [ACK] Seq=541 Ack=187 Win=424 Len=1376 [TCP PDU reassembled in 20]"
"8","0.038178","146.75.37.140","192.168.12.35","TCP","1430","443  >  61140 [ACK] Seq=1917 Ack=187 Win=424 Len=1376 [TCP PDU reassembled in 20]"
"9","0.038937","192.168.12.35","146.75.37.140","TCP","54","61140  >  443 [ACK] Seq=187 Ack=541 Win=2045 Len=0"
"10","0.038872","146.75.37.140","192.168.12.35","TCP","1430","443  >  61140 [ACK] Seq=3293 Ack=187 Win=424 Len=1376 [TCP PDU reassembled in 20]"
"11","0.038872","146.75.37.140","192.168.12.35","TCP","1430","443  >  61140 [ACK] Seq=4669 Ack=187 Win=424 Len=1376 [TCP PDU reassembled in 20]"
"12","0.038872","146.75.37.140","192.168.12.35","TCP","1430","443  >  61140 [ACK] Seq=6045 Ack=187 Win=424 Len=1376 [TCP PDU reassembled in 20]"
"13","0.038872","146.75.37.140","192.168.12.35","TCP","1430","443  >  61140 [ACK] Seq=7421 Ack=187 Win=424 Len=1376 [TCP PDU reassembled in 20]"
"14","0.038872","146.75.37.140","192.168.12.35","TCP","1430","443  >  61140 [ACK] Seq=8797 Ack=187 Win=424 Len=1376 [TCP PDU reassembled in 20]"
"15","0.038872","146.75.37.140","192.168.12.35","TCP","1430","443  >  61140 [ACK] Seq=10173 Ack=187 Win=424 Len=1376 [TCP PDU reassembled in 20]"
"16","0.038872","146.75.37.140","192.168.12.35","TCP","1430","443  >  61140 [ACK] Seq=11549 Ack=187 Win=424 Len=1376 [TCP PDU reassembled in 20]"
"17","0.038872","146.75.37.140","192.168.12.35","TCP","1430","443  >  61140 [ACK] Seq=12925 Ack=187 Win=424 Len=1376 [TCP PDU reassembled in 20]"
"18","0.038872","146.75.37.140","192.168.12.35","TCP","1430","443  >  61140 [ACK] Seq=14301 Ack=187 Win=424 Len=1376 [TCP PDU reassembled in 20]"
"19","0.039191","192.168.12.35","146.75.37.140","TCP","54","61140  >  443 [ACK] Seq=187 Ack=3293 Win=2050 Len=0"
"20","0.038872","146.75.37.140","192.168.12.35","TLSv1.2","1355","Application Data, Application Data"
"21","0.038872","146.75.37.140","192.168.12.35","TCP","1430","443  >  61140 [ACK] Seq=16978 Ack=187 Win=424 Len=1376 [TCP PDU reassembled in 31]"
"22","0.038872","146.75.37.140","192.168.12.35","TCP","1430","443  >  61140 [ACK] Seq=18354 Ack=187 Win=424 Len=1376 [TCP PDU reassembled in 31]"
"23","0.038872","146.75.37.140","192.168.12.35","TCP","1430","443  >  61140 [ACK] Seq=19730 Ack=187 Win=424 Len=1376 [TCP PDU reassembled in 31]"
"24","0.038872","146.75.37.140","192.168.12.35","TCP","1430","443  >  61140 [ACK] Seq=21106 Ack=187 Win=424 Len=1376 [TCP PDU reassembled in 31]"
"25","0.038872","146.75.37.140","192.168.12.35","TCP","1430","443  >  61140 [ACK] Seq=22482 Ack=187 Win=424 Len=1376 [TCP PDU reassembled in 31]"
"26","0.038872","146.75.37.140","192.168.12.35","TCP","1430","443  >  61140 [ACK] Seq=23858 Ack=187 Win=424 Len=1376 [TCP PDU reassembled in 31]"
"27","0.038872","146.75.37.140","192.168.12.35","TCP","1430","443  >  61140 [ACK] Seq=25234 Ack=187 Win=424 Len=1376 [TCP PDU reassembled in 31]"
"28","0.038872","146.75.37.140","192.168.12.35","TCP","1430","443  >  61140 [ACK] Seq=26610 Ack=187 Win=424 Len=1376 [TCP PDU reassembled in 31]"
"29","0.038872","146.75.37.140","192.168.12.35","TCP","1430","443  >  61140 [ACK] Seq=27986 Ack=187 Win=424 Len=1376 [TCP PDU reassembled in 31]"
"30","0.038872","146.75.37.140","192.168.12.35","TCP","1430","443  >  61140 [ACK] Seq=29362 Ack=187 Win=424 Len=1376 [TCP PDU reassembled in 31]"
"31","0.038872","146.75.37.140","192.168.12.35","TLSv1.2","901","Application Data"
"32","0.039964","192.168.12.35","146.75.37.140","TCP","54","61140  >  443 [ACK] Seq=187 Ack=15677 Win=2050 Len=0"
"33","0.040088","192.168.12.35","146.75.37.140","TCP","54","61140  >  443 [ACK] Seq=187 Ack=16978 Win=2045 Len=0"
"34","0.040164","192.168.12.35","146.75.37.140","TCP","54","61140  >  443 [ACK] Seq=187 Ack=30738 Win=2050 Len=0"
"35","0.042150","192.168.12.35","146.75.37.140","TLSv1.2","89","Application Data"
"36","0.085523","146.75.37.140","192.168.12.35","TCP","54","443  >  61140 [ACK] Seq=31585 Ack=222 Win=424 Len=0"
"37","0.348653","192.168.12.35","146.75.37.140","TLSv1.2","3241","Application Data"
"38","0.348758","192.168.12.35","146.75.37.140","TLSv1.2","93","Application Data"
"39","0.348789","192.168.12.35","146.75.37.140","TLSv1.2","3360","Application Data"
"40","0.348823","192.168.12.35","146.75.37.140","TLSv1.2","1326","Application Data"
"41","0.463025","146.75.37.140","192.168.12.35","TCP","54","443  >  61013 [ACK] Seq=1 Ack=1397 Win=8196 Len=0"
"42","0.486394","146.75.37.140","192.168.12.35","TCP","54","443  >  61013 [ACK] Seq=1 Ack=2793 Win=8196 Len=0"
"43","0.501249","146.75.37.140","192.168.12.35","TCP","54","443  >  61013 [ACK] Seq=1 Ack=3188 Win=8196 Len=0"
"44","0.501249","146.75.37.140","192.168.12.35","TCP","54","443  >  61013 [ACK] Seq=1 Ack=3227 Win=8196 Len=0"
"45","0.501249","146.75.37.140","192.168.12.35","TLSv1.2","93","Application Data"
"46","0.525680","146.75.37.140","192.168.12.35","TCP","54","443  >  61013 [ACK] Seq=40 Ack=4623 Win=8196 Len=0"
"47","0.542917","146.75.37.140","192.168.12.35","TCP","1430","443  >  61013 [ACK] Seq=40 Ack=4623 Win=8196 Len=1376 [TCP PDU reassembled in 48]"
"48","0.542917","146.75.37.140","192.168.12.35","TLSv1.2","591","Application Data"
"49","0.542917","146.75.37.140","192.168.12.35","TCP","1430","443  >  61013 [ACK] Seq=1953 Ack=4623 Win=8196 Len=1376 [TCP PDU reassembled in 50]"
"50","0.542917","146.75.37.140","192.168.12.35","TLSv1.2","1074","Application Data"
"51","0.542917","146.75.37.140","192.168.12.35","TCP","54","443  >  61013 [ACK] Seq=4349 Ack=6019 Win=8196 Len=0"
"52","0.542917","146.75.37.140","192.168.12.35","TCP","1430","443  >  61013 [ACK] Seq=4349 Ack=6019 Win=8196 Len=1376 [TCP PDU reassembled in 65]"
"53","0.542917","146.75.37.140","192.168.12.35","TCP","1430","443  >  61013 [PSH, ACK] Seq=5725 Ack=6019 Win=8196 Len=1376 [TCP PDU reassembled in 65]"
"54","0.542917","146.75.37.140","192.168.12.35","TCP","1430","443  >  61013 [ACK] Seq=7101 Ack=6019 Win=8196 Len=1376 [TCP PDU reassembled in 65]"
"55","0.542917","146.75.37.140","192.168.12.35","TCP","1430","443  >  61013 [PSH, ACK] Seq=8477 Ack=6019 Win=8196 Len=1376 [TCP PDU reassembled in 65]"
"56","0.542917","146.75.37.140","192.168.12.35","TCP","1430","443  >  61013 [ACK] Seq=9853 Ack=6019 Win=8196 Len=1376 [TCP PDU reassembled in 65]"
"57","0.542917","146.75.37.140","192.168.12.35","TCP","1430","443  >  61013 [PSH, ACK] Seq=11229 Ack=6019 Win=8196 Len=1376 [TCP PDU reassembled in 65]"
"58","0.542917","146.75.37.140","192.168.12.35","TCP","1430","443  >  61013 [ACK] Seq=12605 Ack=6019 Win=8196 Len=1376 [TCP PDU reassembled in 65]"
"59","0.542917","146.75.37.140","192.168.12.35","TCP","1430","443  >  61013 [PSH, ACK] Seq=13981 Ack=6019 Win=8196 Len=1376 [TCP PDU reassembled in 65]"
"60","0.542917","146.75.37.140","192.168.12.35","TCP","1430","443  >  61013 [ACK] Seq=15357 Ack=6019 Win=8196 Len=1376 [TCP PDU reassembled in 65]"
"61","0.542917","146.75.37.140","192.168.12.35","TCP","1430","443  >  61013 [PSH, ACK] Seq=16733 Ack=6019 Win=8196 Len=1376 [TCP PDU reassembled in 65]"
"62","0.543754","192.168.12.35","146.75.37.140","TCP","54","61013  >  443 [ACK] Seq=7805 Ack=1416 Win=1025 Len=0"
"63","0.544144","192.168.12.35","146.75.37.140","TCP","54","61013  >  443 [ACK] Seq=7805 Ack=3329 Win=1025 Len=0"
"64","0.544267","192.168.12.35","146.75.37.140","TCP","54","61013  >  443 [ACK] Seq=7805 Ack=18109 Win=1025 Len=0"
"65","0.548397","146.75.37.140","192.168.12.35","TLSv1.2","344","Application Data"
"66","0.548397","146.75.37.140","192.168.12.35","TLSv1.2","869","Application Data"
"67","0.548981","192.168.12.35","146.75.37.140","TCP","54","61013  >  443 [ACK] Seq=7805 Ack=18399 Win=1024 Len=0"
"68","0.553929","146.75.37.140","192.168.12.35","TLSv1.2","90","Application Data"
"69","0.553929","146.75.37.140","192.168.12.35","TCP","54","443  >  61013 [ACK] Seq=19250 Ack=6533 Win=8196 Len=0"
"70","0.554469","192.168.12.35","146.75.37.140","TCP","54","61013  >  443 [ACK] Seq=7805 Ack=19250 Win=1020 Len=0"
"71","0.559288","192.168.12.35","146.75.37.140","TLSv1.2","89","Application Data"
"72","0.562532","146.75.37.140","192.168.12.35","TCP","1430","443  >  61013 [ACK] Seq=19250 Ack=6533 Win=8196 Len=1376 [TCP PDU reassembled in 83]"
"73","0.562532","146.75.37.140","192.168.12.35","TCP","1430","443  >  61013 [PSH, ACK] Seq=20626 Ack=6533 Win=8196 Len=1376 [TCP PDU reassembled in 83]"
"74","0.562532","146.75.37.140","192.168.12.35","TCP","1430","443  >  61013 [ACK] Seq=22002 Ack=6533 Win=8196 Len=1376 [TCP PDU reassembled in 83]"
"75","0.562532","146.75.37.140","192.168.12.35","TCP","1430","443  >  61013 [PSH, ACK] Seq=23378 Ack=6533 Win=8196 Len=1376 [TCP PDU reassembled in 83]"
"76","0.562532","146.75.37.140","192.168.12.35","TCP","1430","443  >  61013 [ACK] Seq=24754 Ack=6533 Win=8196 Len=1376 [TCP PDU reassembled in 83]"
"77","0.562532","146.75.37.140","192.168.12.35","TCP","1430","443  >  61013 [PSH, ACK] Seq=26130 Ack=6533 Win=8196 Len=1376 [TCP PDU reassembled in 83]"
"78","0.562532","146.75.37.140","192.168.12.35","TCP","1430","443  >  61013 [ACK] Seq=27506 Ack=6533 Win=8196 Len=1376 [TCP PDU reassembled in 83]"
"79","0.562532","146.75.37.140","192.168.12.35","TCP","1430","443  >  61013 [PSH, ACK] Seq=28882 Ack=6533 Win=8196 Len=1376 [TCP PDU reassembled in 83]"
"80","0.562532","146.75.37.140","192.168.12.35","TCP","1430","443  >  61013 [ACK] Seq=30258 Ack=6533 Win=8196 Len=1376 [TCP PDU reassembled in 83]"
"81","0.562532","146.75.37.140","192.168.12.35","TCP","1430","443  >  61013 [PSH, ACK] Seq=31634 Ack=6533 Win=8196 Len=1376 [TCP PDU reassembled in 83]"
"82","0.562532","146.75.37.140","192.168.12.35","TCP","1430","443  >  61013 [ACK] Seq=33010 Ack=6533 Win=8196 Len=1376 [TCP PDU reassembled in 83]"
"83","0.562532","146.75.37.140","192.168.12.35","TLSv1.2","1430","Application Data, Application Data"
"84","0.563195","192.168.12.35","146.75.37.140","TCP","54","61013  >  443 [ACK] Seq=7840 Ack=35762 Win=1025 Len=0"
"85","0.567536","146.75.37.140","192.168.12.35","TCP","1430","443  >  61013 [ACK] Seq=35762 Ack=6533 Win=8196 Len=1376 [TCP PDU reassembled in 96]"
"86","0.567536","146.75.37.140","192.168.12.35","TCP","1430","443  >  61013 [PSH, ACK] Seq=37138 Ack=6533 Win=8196 Len=1376 [TCP PDU reassembled in 96]"
"87","0.567536","146.75.37.140","192.168.12.35","TCP","1430","443  >  61013 [ACK] Seq=38514 Ack=6533 Win=8196 Len=1376 [TCP PDU reassembled in 96]"
"88","0.567536","146.75.37.140","192.168.12.35","TCP","1430","443  >  61013 [PSH, ACK] Seq=39890 Ack=6533 Win=8196 Len=1376 [TCP PDU reassembled in 96]"
"89","0.567536","146.75.37.140","192.168.12.35","TCP","1430","443  >  61013 [ACK] Seq=41266 Ack=6533 Win=8196 Len=1376 [TCP PDU reassembled in 96]"
"90","0.567536","146.75.37.140","192.168.12.35","TCP","1430","443  >  61013 [PSH, ACK] Seq=42642 Ack=6533 Win=8196 Len=1376 [TCP PDU reassembled in 96]"
"91","0.567536","146.75.37.140","192.168.12.35","TCP","1430","443  >  61013 [ACK] Seq=44018 Ack=6533 Win=8196 Len=1376 [TCP PDU reassembled in 96]"
"92","0.567536","146.75.37.140","192.168.12.35","TCP","1430","443  >  61013 [PSH, ACK] Seq=45394 Ack=6533 Win=8196 Len=1376 [TCP PDU reassembled in 96]"
"93","0.567536","146.75.37.140","192.168.12.35","TCP","1430","443  >  61013 [ACK] Seq=46770 Ack=6533 Win=8196 Len=1376 [TCP PDU reassembled in 96]"
"94","0.567536","146.75.37.140","192.168.12.35","TCP","1430","443  >  61013 [PSH, ACK] Seq=48146 Ack=6533 Win=8196 Len=1376 [TCP PDU reassembled in 96]"
"95","0.567536","146.75.37.140","192.168.12.35","TCP","1430","443  >  61013 [ACK] Seq=49522 Ack=6533 Win=8196 Len=1376 [TCP PDU reassembled in 96]"
"96","0.567536","146.75.37.140","192.168.12.35","TLSv1.2","1430","Application Data"
"97","0.567536","146.75.37.140","192.168.12.35","TLSv1.2","1423","Application Data"
"98","0.567536","146.75.37.140","192.168.12.35","TLSv1.2","1051","Application Data"
"99","0.567536","146.75.37.140","192.168.12.35","TCP","54","443  >  61013 [ACK] Seq=54640 Ack=7805 Win=8196 Len=0"
"100","0.568257","192.168.12.35","146.75.37.140","TCP","54","61013  >  443 [ACK] Seq=7840 Ack=52274 Win=1025 Len=0"
"101","0.568512","192.168.12.35","146.75.37.140","TCP","54","61013  >  443 [ACK] Seq=7840 Ack=54640 Win=1025 Len=0"
"102","0.573307","146.75.37.140","192.168.12.35","TCP","1430","443  >  61013 [ACK] Seq=54640 Ack=7805 Win=8196 Len=1376 [TCP PDU reassembled in 105]"
"103","0.573307","146.75.37.140","192.168.12.35","TCP","1430","443  >  61013 [PSH, ACK] Seq=56016 Ack=7805 Win=8196 Len=1376 [TCP PDU reassembled in 105]"
"104","0.573307","146.75.37.140","192.168.12.35","TCP","1430","443  >  61013 [ACK] Seq=57392 Ack=7805 Win=8196 Len=1376 [TCP PDU reassembled in 105]"
"105","0.573307","146.75.37.140","192.168.12.35","TLSv1.2","1320","Application Data"
"106","0.573307","146.75.37.140","192.168.12.35","TCP","1430","443  >  61013 [ACK] Seq=60034 Ack=7805 Win=8196 Len=1376 [TCP PDU reassembled in 108]"
"107","0.573307","146.75.37.140","192.168.12.35","TCP","1430","443  >  61013 [PSH, ACK] Seq=61410 Ack=7805 Win=8196 Len=1376 [TCP PDU reassembled in 108]"
"108","0.573307","146.75.37.140","192.168.12.35","TLSv1.2","1021","Application Data, Application Data, Application Data, Application Data, Application Data"
"109","0.573307","146.75.37.140","192.168.12.35","TLSv1.2","1008","Application Data, Application Data"
"110","0.573307","146.75.37.140","192.168.12.35","TLSv1.2","916","Application Data"
"111","0.573307","146.75.37.140","192.168.12.35","TLSv1.2","119","Application Data"
"112","0.573307","146.75.37.140","192.168.12.35","TLSv1.2","329","Application Data"
"113","0.573307","146.75.37.140","192.168.12.35","TLSv1.2","116","Application Data"
"114","0.573307","146.75.37.140","192.168.12.35","TLSv1.2","242","Application Data"
"115","0.573307","146.75.37.140","192.168.12.35","TLSv1.2","291","Application Data"
"116","0.573307","146.75.37.140","192.168.12.35","TLSv1.2","113","Application Data"
"117","0.574361","192.168.12.35","146.75.37.140","TCP","54","61013  >  443 [ACK] Seq=7840 Ack=58768 Win=1025 Len=0"
"118","0.574811","192.168.12.35","146.75.37.140","TCP","54","61013  >  443 [ACK] Seq=7840 Ack=60034 Win=1020 Len=0"
"119","0.574951","192.168.12.35","146.75.37.140","TCP","54","61013  >  443 [ACK] Seq=7840 Ack=62786 Win=1025 Len=0"
"120","0.575028","192.168.12.35","146.75.37.140","TCP","54","61013  >  443 [ACK] Seq=7840 Ack=64707 Win=1025 Len=0"
"121","0.575088","192.168.12.35","146.75.37.140","TCP","54","61013  >  443 [ACK] Seq=7840 Ack=65634 Win=1021 Len=0"
"122","0.575154","192.168.12.35","146.75.37.140","TCP","54","61013  >  443 [ACK] Seq=7840 Ack=65971 Win=1020 Len=0"
"123","0.575191","192.168.12.35","146.75.37.140","TCP","54","61013  >  443 [ACK] Seq=7840 Ack=66159 Win=1025 Len=0"
"124","0.575320","192.168.12.35","146.75.37.140","TCP","54","61013  >  443 [ACK] Seq=7840 Ack=66396 Win=1024 Len=0"
"125","0.578650","146.75.37.140","192.168.12.35","TLSv1.2","443","Application Data"
"126","0.578650","146.75.37.140","192.168.12.35","TLSv1.2","104","Application Data"
"127","0.578650","146.75.37.140","192.168.12.35","TLSv1.2","397","Application Data"
"128","0.578650","146.75.37.140","192.168.12.35","TLSv1.2","149","Application Data"
"129","0.578650","146.75.37.140","192.168.12.35","TLSv1.2","161","Application Data"
"130","0.579397","192.168.12.35","146.75.37.140","TCP","54","61013  >  443 [ACK] Seq=7840 Ack=66844 Win=1022 Len=0"
"131","0.579732","192.168.12.35","146.75.37.140","TCP","54","61013  >  443 [ACK] Seq=7840 Ack=67237 Win=1020 Len=0"
"132","0.579826","192.168.12.35","146.75.37.140","TCP","54","61013  >  443 [ACK] Seq=7840 Ack=67439 Win=1020 Len=0"
"133","0.586286","146.75.37.140","192.168.12.35","TCP","54","443  >  61013 [ACK] Seq=67439 Ack=7840 Win=8196 Len=0"
"134","0.647418","146.75.37.140","192.168.12.35","TCP","1430","443  >  61013 [ACK] Seq=67439 Ack=7840 Win=8196 Len=1376 [TCP PDU reassembled in 135]"
"135","0.647418","146.75.37.140","192.168.12.35","TLSv1.2","822","Application Data"
"136","0.648309","192.168.12.35","146.75.37.140","TCP","54","61013  >  443 [ACK] Seq=7840 Ack=69583 Win=1025 Len=0"
"137","0.724116","192.168.12.35","146.75.37.140","UDP","95","50355  >  443 Len=53"
"138","0.750688","146.75.37.140","192.168.12.35","UDP","67","443  >  50355 Len=25"
"139","0.763338","192.168.12.35","146.75.37.140","UDP","84","50355  >  443 Len=42"
"140","0.782709","146.75.37.140","192.168.12.35","UDP","67","443  >  50355 Len=25"
"141","0.934494","192.168.12.35","146.75.37.140","TCP","55","60961  >  443 [ACK] Seq=1 Ack=1 Win=1022 Len=1 [TCP PDU reassembled in 1163]"
"142","0.958416","146.75.37.140","192.168.12.35","TCP","66","443  >  60961 [ACK] Seq=1 Ack=2 Win=1378 Len=0 SLE=1 SRE=2"
"143","1.089958","146.75.37.140","192.168.12.35","TLSv1.2","564","Application Data"
"144","1.089958","146.75.37.140","192.168.12.35","TLSv1.2","133","Application Data"
"145","1.091127","192.168.12.35","146.75.37.140","TCP","54","61013  >  443 [ACK] Seq=7840 Ack=70172 Win=1022 Len=0"
"146","1.094531","146.75.37.140","192.168.12.35","TLSv1.2","399","Application Data"
"147","1.101979","146.75.37.140","192.168.12.35","TLSv1.2","184","Application Data"
"148","1.101979","146.75.37.140","192.168.12.35","TLSv1.2","303","Application Data"
"149","1.101979","146.75.37.140","192.168.12.35","TLSv1.2","738","Application Data"
"150","1.101979","146.75.37.140","192.168.12.35","TLSv1.2","418","Application Data"
"151","1.101979","146.75.37.140","192.168.12.35","TLSv1.2","538","Application Data"
"152","1.101979","146.75.37.140","192.168.12.35","TLSv1.2","1028","Application Data"
"153","1.101979","146.75.37.140","192.168.12.35","TLSv1.2","736","Application Data"
"154","1.101979","146.75.37.140","192.168.12.35","TLSv1.2","628","Application Data"
"155","1.101979","146.75.37.140","192.168.12.35","TLSv1.2","501","Application Data"
"156","1.101979","146.75.37.140","192.168.12.35","TLSv1.2","1163","Application Data"
"157","1.101979","146.75.37.140","192.168.12.35","TLSv1.2","945","Application Data"
"158","1.101979","146.75.37.140","192.168.12.35","TLSv1.2","226","Application Data"
"159","1.103105","192.168.12.35","146.75.37.140","TCP","54","61013  >  443 [ACK] Seq=7840 Ack=70647 Win=1021 Len=0"
"160","1.103506","192.168.12.35","146.75.37.140","TCP","54","61013  >  443 [ACK] Seq=7840 Ack=71580 Win=1025 Len=0"
"161","1.103595","192.168.12.35","146.75.37.140","TCP","54","61013  >  443 [ACK] Seq=7840 Ack=72428 Win=1021 Len=0"
"162","1.103691","192.168.12.35","146.75.37.140","TCP","54","61013  >  443 [ACK] Seq=7840 Ack=74084 Win=1025 Len=0"
"163","1.103761","192.168.12.35","146.75.37.140","TCP","54","61013  >  443 [ACK] Seq=7840 Ack=75105 Win=1021 Len=0"
"164","1.103841","192.168.12.35","146.75.37.140","TCP","54","61013  >  443 [ACK] Seq=7840 Ack=77105 Win=1025 Len=0"
"165","1.107618","146.75.37.140","192.168.12.35","TCP","1430","443  >  61013 [ACK] Seq=77277 Ack=7840 Win=8196 Len=1376 [TCP PDU reassembled in 168]"
"166","1.107618","146.75.37.140","192.168.12.35","TCP","1430","443  >  61013 [ACK] Seq=78653 Ack=7840 Win=8196 Len=1376 [TCP PDU reassembled in 168]"
"167","1.107618","146.75.37.140","192.168.12.35","TCP","1430","443  >  61013 [PSH, ACK] Seq=80029 Ack=7840 Win=8196 Len=1376 [TCP PDU reassembled in 168]"
"168","1.107618","146.75.37.140","192.168.12.35","TLSv1.2","210","Application Data"
"169","1.107994","192.168.12.35","146.75.37.140","TCP","54","61013  >  443 [ACK] Seq=7840 Ack=81405 Win=1025 Len=0"
"170","1.117782","146.75.37.140","192.168.12.35","TCP","1430","443  >  61013 [ACK] Seq=81561 Ack=7840 Win=8196 Len=1376 [TCP PDU reassembled in 172]"
"171","1.118730","192.168.12.35","146.75.37.140","TCP","54","61013  >  443 [ACK] Seq=7840 Ack=82937 Win=1025 Len=0"
"172","1.123827","146.75.37.140","192.168.12.35","TLSv1.2","1404","Application Data"
"173","1.123827","146.75.37.140","192.168.12.35","TCP","1430","443  >  61013 [ACK] Seq=84287 Ack=7840 Win=8196 Len=1376 [TCP PDU reassembled in 174]"
"174","1.123827","146.75.37.140","192.168.12.35","TLSv1.2","1268","Application Data"
"175","1.124595","192.168.12.35","146.75.37.140","TCP","54","61013  >  443 [ACK] Seq=7840 Ack=85663 Win=1025 Len=0"
"176","1.128779","146.75.37.140","192.168.12.35","TLSv1.2","140","Application Data"
"177","1.128779","146.75.37.140","192.168.12.35","TLSv1.2","94","Application Data"
"178","1.128779","146.75.37.140","192.168.12.35","TLSv1.2","93","Application Data"
"179","1.128779","146.75.37.140","192.168.12.35","TLSv1.2","328","Application Data"
"180","1.128779","146.75.37.140","192.168.12.35","TLSv1.2","453","Application Data"
"181","1.128779","146.75.37.140","192.168.12.35","TLSv1.2","146","Application Data"
"182","1.128779","146.75.37.140","192.168.12.35","TLSv1.2","270","Application Data"
"183","1.129464","192.168.12.35","146.75.37.140","TCP","54","61013  >  443 [ACK] Seq=7840 Ack=86963 Win=1020 Len=0"
"184","1.129634","146.75.37.140","192.168.12.35","TLSv1.2","414","Application Data"
"185","1.129671","192.168.12.35","146.75.37.140","TCP","54","61013  >  443 [ACK] Seq=7840 Ack=87042 Win=1019 Len=0"
"186","1.129728","192.168.12.35","146.75.37.140","TCP","54","61013  >  443 [ACK] Seq=7840 Ack=87715 Win=1025 Len=0"
"187","1.129761","192.168.12.35","146.75.37.140","TCP","54","61013  >  443 [ACK] Seq=7840 Ack=88023 Win=1023 Len=0"
"188","1.142216","146.75.37.140","192.168.12.35","TLSv1.2","286","Application Data"
"189","1.142216","146.75.37.140","192.168.12.35","TLSv1.2","148","Application Data"
"190","1.142216","146.75.37.140","192.168.12.35","TLSv1.2","301","Application Data"
"191","1.142216","146.75.37.140","192.168.12.35","TLSv1.2","518","Application Data"
"192","1.142216","146.75.37.140","192.168.12.35","TCP","1430","443  >  61013 [ACK] Seq=89420 Ack=7840 Win=8196 Len=1376 [TCP PDU reassembled in 193]"
"193","1.142216","146.75.37.140","192.168.12.35","TLSv1.2","125","Application Data"
"194","1.142216","146.75.37.140","192.168.12.35","TLSv1.2","605","Application Data"
"195","1.142216","146.75.37.140","192.168.12.35","TLSv1.2","1026","Application Data"
"196","1.142216","146.75.37.140","192.168.12.35","TLSv1.2","589","Application Data"
"197","1.142216","146.75.37.140","192.168.12.35","TLSv1.2","377","Application Data"
"198","1.142216","146.75.37.140","192.168.12.35","TLSv1.2","277","Application Data"
"199","1.142216","146.75.37.140","192.168.12.35","TLSv1.2","169","Application Data"
"200","1.142216","146.75.37.140","192.168.12.35","TLSv1.2","238","Application Data"
"201","1.142216","146.75.37.140","192.168.12.35","TLSv1.2","381","Application Data"
"202","1.142216","146.75.37.140","192.168.12.35","TLSv1.2","85","Application Data"
"203","1.143899","192.168.12.35","146.75.37.140","TCP","54","61013  >  443 [ACK] Seq=7840 Ack=88615 Win=1021 Len=0"
"204","1.144477","192.168.12.35","146.75.37.140","TCP","54","61013  >  443 [ACK] Seq=7840 Ack=88956 Win=1020 Len=0"
"205","1.144638","192.168.12.35","146.75.37.140","TCP","54","61013  >  443 [ACK] Seq=7840 Ack=90796 Win=1025 Len=0"
"206","1.144725","192.168.12.35","146.75.37.140","TCP","54","61013  >  443 [ACK] Seq=7840 Ack=91418 Win=1022 Len=0"
"207","1.144809","192.168.12.35","146.75.37.140","TCP","54","61013  >  443 [ACK] Seq=7840 Ack=92925 Win=1025 Len=0"
"208","1.144957","192.168.12.35","146.75.37.140","TCP","54","61013  >  443 [ACK] Seq=7840 Ack=93471 Win=1023 Len=0"
"209","1.145050","192.168.12.35","146.75.37.140","TCP","54","61013  >  443 [ACK] Seq=7840 Ack=93770 Win=1021 Len=0"
"210","1.145145","192.168.12.35","146.75.37.140","TCP","54","61013  >  443 [ACK] Seq=7840 Ack=94128 Win=1020 Len=0"
"211","1.251724","192.168.12.35","146.75.37.140","TLSv1.2","3184","Application Data"
"212","1.252262","192.168.12.35","146.75.37.140","TLSv1.2","3188","Application Data"
"213","1.252453","192.168.12.35","146.75.37.140","TLSv1.2","718","Application Data"
"214","1.279864","192.168.12.35","146.75.37.140","TLSv1.2","3197","Application Data"
"215","1.310730","146.75.37.140","192.168.12.35","TCP","54","443  >  61013 [ACK] Seq=94128 Ack=9236 Win=8196 Len=0"
"216","1.325563","146.75.37.140","192.168.12.35","TCP","54","443  >  61013 [ACK] Seq=94128 Ack=10632 Win=8196 Len=0"
"217","1.330452","146.75.37.140","192.168.12.35","TCP","54","443  >  61013 [ACK] Seq=94128 Ack=10970 Win=8196 Len=0"
"218","1.365753","146.75.37.140","192.168.12.35","TCP","54","443  >  61013 [ACK] Seq=94128 Ack=12366 Win=8196 Len=0"
"219","1.385802","146.75.37.140","192.168.12.35","TCP","54","443  >  61013 [ACK] Seq=94128 Ack=13762 Win=8196 Len=0"
"220","1.390777","146.75.37.140","192.168.12.35","TCP","54","443  >  61013 [ACK] Seq=94128 Ack=14104 Win=8196 Len=0"
"221","1.406501","146.75.37.140","192.168.12.35","TCP","54","443  >  61013 [ACK] Seq=94128 Ack=14768 Win=8196 Len=0"
"222","1.416460","146.75.37.140","192.168.12.35","TCP","1430","443  >  61013 [ACK] Seq=94128 Ack=14768 Win=8196 Len=1376 [TCP PDU reassembled in 223]"
"223","1.416460","146.75.37.140","192.168.12.35","TLSv1.2","444","Application Data"
"224","1.416460","146.75.37.140","192.168.12.35","TLSv1.2","87","Application Data"
"225","1.417438","192.168.12.35","146.75.37.140","TCP","54","61013  >  443 [ACK] Seq=17911 Ack=95504 Win=1025 Len=0"
"226","1.417866","192.168.12.35","146.75.37.140","TCP","54","61013  >  443 [ACK] Seq=17911 Ack=95894 Win=1023 Len=0"
"227","1.435294","192.168.12.35","146.75.37.140","TLSv1.2","3179","Application Data"
"228","1.435620","146.75.37.140","192.168.12.35","TCP","54","443  >  61013 [ACK] Seq=95927 Ack=16164 Win=8196 Len=0"
"229","1.435932","192.168.12.35","146.75.37.140","TLSv1.2","210","Application Data"
"230","1.465921","146.75.37.140","192.168.12.35","TCP","54","443  >  61013 [ACK] Seq=95927 Ack=17560 Win=8196 Len=0"
"231","1.465921","146.75.37.140","192.168.12.35","TCP","54","443  >  61013 [ACK] Seq=95927 Ack=17911 Win=8196 Len=0"
"232","1.478727","146.75.37.140","192.168.12.35","TCP","1430","443  >  61013 [ACK] Seq=95927 Ack=17911 Win=8196 Len=1376 [TCP PDU reassembled in 233]"
"233","1.478727","146.75.37.140","192.168.12.35","TLSv1.2","820","Application Data"
"234","1.479450","192.168.12.35","146.75.37.140","TCP","54","61013  >  443 [ACK] Seq=21192 Ack=97303 Win=1025 Len=0"
"235","1.479821","192.168.12.35","146.75.37.140","TCP","54","61013  >  443 [ACK] Seq=21192 Ack=98069 Win=1022 Len=0"
"236","1.503701","146.75.37.140","192.168.12.35","TCP","1430","443  >  61013 [ACK] Seq=98069 Ack=17911 Win=8196 Len=1376 [TCP PDU reassembled in 237]"
"237","1.503701","146.75.37.140","192.168.12.35","TLSv1.2","533","Application Data"
"238","1.503701","146.75.37.140","192.168.12.35","TLSv1.2","100","Application Data"
"239","1.504467","192.168.12.35","146.75.37.140","TCP","54","61013  >  443 [ACK] Seq=21192 Ack=99445 Win=1025 Len=0"
"240","1.504839","192.168.12.35","146.75.37.140","TCP","54","61013  >  443 [ACK] Seq=21192 Ack=99924 Win=1023 Len=0"
"241","1.518270","146.75.37.140","192.168.12.35","TCP","54","443  >  61013 [ACK] Seq=99970 Ack=19307 Win=8196 Len=0"
"242","1.536289","146.75.37.140","192.168.12.35","TCP","54","443  >  61013 [ACK] Seq=99970 Ack=20703 Win=8196 Len=0"
"243","1.541137","146.75.37.140","192.168.12.35","TCP","54","443  >  61013 [ACK] Seq=99970 Ack=21036 Win=8196 Len=0"
"244","1.541137","146.75.37.140","192.168.12.35","TCP","54","443  >  61013 [ACK] Seq=99970 Ack=21192 Win=8196 Len=0"
"245","1.550414","146.75.37.140","192.168.12.35","TLSv1.2","594","Application Data"
"246","1.551435","192.168.12.35","146.75.37.140","TCP","54","61013  >  443 [ACK] Seq=21192 Ack=100510 Win=1021 Len=0"
"247","1.570506","146.75.37.140","192.168.12.35","TLSv1.2","95","Application Data"
"248","1.605363","146.75.37.140","192.168.12.35","TCP","1430","443  >  61013 [ACK] Seq=100551 Ack=21192 Win=8196 Len=1376 [TCP PDU reassembled in 249]"
"249","1.605363","146.75.37.140","192.168.12.35","TLSv1.2","949","Application Data"
"250","1.606162","192.168.12.35","146.75.37.140","TCP","54","61013  >  443 [ACK] Seq=21192 Ack=101927 Win=1025 Len=0"
"251","1.638407","192.168.12.35","146.75.37.140","TLSv1.2","3194","Application Data"
"252","1.638535","192.168.12.35","146.75.37.140","TLSv1.2","3209","Application Data"
"253","1.638563","192.168.12.35","146.75.37.140","TLSv1.2","3186","Application Data"
"254","1.640043","192.168.12.35","146.75.37.140","TLSv1.2","3288","Application Data"
"255","1.700554","192.168.12.35","146.75.37.140","TLSv1.2","3144","Application Data"
"256","1.749968","146.75.37.140","192.168.12.35","TCP","54","443  >  61013 [ACK] Seq=102822 Ack=22588 Win=8196 Len=0"
"257","1.760940","146.75.37.140","192.168.12.35","TCP","54","443  >  61013 [ACK] Seq=102822 Ack=23984 Win=8196 Len=0"
"258","1.760940","146.75.37.140","192.168.12.35","TCP","54","443  >  61013 [ACK] Seq=102822 Ack=24332 Win=8196 Len=0"
"259","1.786113","146.75.37.140","192.168.12.35","TCP","54","443  >  61013 [ACK] Seq=102822 Ack=25728 Win=8196 Len=0"
"260","1.795948","146.75.37.140","192.168.12.35","TCP","1430","443  >  61013 [ACK] Seq=102822 Ack=25728 Win=8196 Len=1376 [TCP PDU reassembled in 261]"
"261","1.795948","146.75.37.140","192.168.12.35","TLSv1.2","557","Application Data"
"262","1.796265","192.168.12.35","146.75.37.140","TCP","54","61013  >  443 [ACK] Seq=36943 Ack=104198 Win=1025 Len=0"
"263","1.796405","192.168.12.35","146.75.37.140","TCP","54","61013  >  443 [ACK] Seq=36943 Ack=104701 Win=1023 Len=0"
"264","1.801494","192.168.12.35","146.75.37.140","TLSv1.2","3174","Application Data"
"265","1.801564","192.168.12.35","146.75.37.140","TLSv1.2","134","Application Data"
"266","1.810528","146.75.37.140","192.168.12.35","TCP","54","443  >  61013 [ACK] Seq=104701 Ack=27487 Win=8196 Len=0"
"267","1.843124","146.75.37.140","192.168.12.35","TLSv1.2","996","Application Data"
"268","1.843124","146.75.37.140","192.168.12.35","TCP","1430","443  >  61013 [ACK] Seq=105643 Ack=28883 Win=8196 Len=1376 [TCP PDU reassembled in 269]"
"269","1.843124","146.75.37.140","192.168.12.35","TLSv1.2","804","Application Data"
"270","1.843876","192.168.12.35","146.75.37.140","TCP","54","61013  >  443 [ACK] Seq=40143 Ack=105643 Win=1025 Len=0"
"271","1.844180","192.168.12.35","146.75.37.140","TCP","54","61013  >  443 [ACK] Seq=40143 Ack=107019 Win=1019 Len=0"
"272","1.844237","192.168.12.35","146.75.37.140","TCP","54","61013  >  443 [ACK] Seq=40143 Ack=107769 Win=1025 Len=0"
"273","1.848454","146.75.37.140","192.168.12.35","TLSv1.2","100","Application Data"
"274","1.848454","146.75.37.140","192.168.12.35","TLSv1.2","123","Application Data"
"275","1.848454","146.75.37.140","192.168.12.35","TLSv1.2","85","Application Data"
"276","1.848712","192.168.12.35","146.75.37.140","TCP","54","61013  >  443 [ACK] Seq=40143 Ack=107815 Win=1025 Len=0"
"277","1.848805","192.168.12.35","146.75.37.140","TCP","54","61013  >  443 [ACK] Seq=40143 Ack=107915 Win=1024 Len=0"
"278","1.861019","146.75.37.140","192.168.12.35","TCP","54","443  >  61013 [ACK] Seq=107915 Ack=30619 Win=8196 Len=0"
"279","1.914828","146.75.37.140","192.168.12.35","TLSv1.2","957","Application Data"
"280","1.914828","146.75.37.140","192.168.12.35","TLSv1.2","85","Application Data"
"281","1.914828","146.75.37.140","192.168.12.35","TCP","1430","443  >  61013 [ACK] Seq=108849 Ack=32015 Win=8196 Len=1376 [TCP PDU reassembled in 282]"
"282","1.914828","146.75.37.140","192.168.12.35","TLSv1.2","505","Application Data"
"283","1.914828","146.75.37.140","192.168.12.35","TLSv1.2","100","Application Data"
"284","1.915583","192.168.12.35","146.75.37.140","TCP","54","61013  >  443 [ACK] Seq=40143 Ack=108849 Win=1020 Len=0"
"285","1.916032","192.168.12.35","146.75.37.140","TCP","54","61013  >  443 [ACK] Seq=40143 Ack=110225 Win=1025 Len=0"
"286","1.916170","192.168.12.35","146.75.37.140","TCP","54","61013  >  443 [ACK] Seq=40143 Ack=110676 Win=1023 Len=0"
"287","1.935785","146.75.37.140","192.168.12.35","TCP","54","443  >  61013 [ACK] Seq=110722 Ack=33853 Win=8196 Len=0"
"288","1.955999","146.75.37.140","192.168.12.35","TCP","1430","443  >  61013 [ACK] Seq=110722 Ack=33853 Win=8196 Len=1376 [TCP PDU reassembled in 289]"
"289","1.955999","146.75.37.140","192.168.12.35","TLSv1.2","112","Application Data"
"290","1.955999","146.75.37.140","192.168.12.35","TLSv1.2","892","Application Data"
"291","1.956694","192.168.12.35","146.75.37.140","TCP","54","61013  >  443 [ACK] Seq=40143 Ack=112098 Win=1025 Len=0"
"292","1.957059","192.168.12.35","146.75.37.140","TCP","54","61013  >  443 [ACK] Seq=40143 Ack=112994 Win=1021 Len=0"
"293","1.966085","146.75.37.140","192.168.12.35","TCP","1430","443  >  61013 [ACK] Seq=112994 Ack=33853 Win=8196 Len=1376 [TCP PDU reassembled in 294]"
"294","1.966085","146.75.37.140","192.168.12.35","TLSv1.2","809","Application Data"
"295","1.966085","146.75.37.140","192.168.12.35","TLSv1.2","100","Application Data"
"296","1.966783","192.168.12.35","146.75.37.140","TCP","54","61013  >  443 [ACK] Seq=40143 Ack=114370 Win=1025 Len=0"
"297","1.966912","192.168.12.35","146.75.37.140","TCP","54","61013  >  443 [ACK] Seq=40143 Ack=115125 Win=1022 Len=0"
"298","2.005771","146.75.37.140","192.168.12.35","TCP","54","443  >  61013 [ACK] Seq=115171 Ack=36943 Win=8196 Len=0"
"299","2.006841","192.168.12.35","146.75.37.140","TCP","54","61013  >  443 [ACK] Seq=40143 Ack=115171 Win=1022 Len=0"
"300","2.038454","146.75.37.140","192.168.12.35","TCP","1430","443  >  61013 [ACK] Seq=115171 Ack=36943 Win=8196 Len=1376 [TCP PDU reassembled in 301]"
"301","2.038454","146.75.37.140","192.168.12.35","TLSv1.2","488","Application Data"
"302","2.039780","192.168.12.35","146.75.37.140","TCP","54","61013  >  443 [ACK] Seq=40143 Ack=116547 Win=1025 Len=0"
"303","2.040505","192.168.12.35","146.75.37.140","TCP","54","61013  >  443 [ACK] Seq=40143 Ack=116981 Win=1023 Len=0"
"304","2.045671","146.75.37.140","192.168.12.35","TCP","54","443  >  61013 [ACK] Seq=116981 Ack=38339 Win=8196 Len=0"
"305","2.063592","146.75.37.140","192.168.12.35","TCP","54","443  >  61013 [ACK] Seq=116981 Ack=39735 Win=8196 Len=0"
"306","2.063592","146.75.37.140","192.168.12.35","TCP","54","443  >  61013 [ACK] Seq=116981 Ack=40063 Win=8196 Len=0"
"307","2.063592","146.75.37.140","192.168.12.35","TCP","54","443  >  61013 [ACK] Seq=116981 Ack=40143 Win=8196 Len=0"
"308","2.093087","146.75.37.140","192.168.12.35","TCP","1430","443  >  61013 [ACK] Seq=116981 Ack=40143 Win=8196 Len=1376 [TCP PDU reassembled in 310]"
"309","2.093087","146.75.37.140","192.168.12.35","TCP","1430","443  >  61013 [PSH, ACK] Seq=118357 Ack=40143 Win=8196 Len=1376 [TCP PDU reassembled in 310]"
"310","2.093087","146.75.37.140","192.168.12.35","TLSv1.2","441","Application Data"
"311","2.093911","192.168.12.35","146.75.37.140","TCP","54","61013  >  443 [ACK] Seq=40143 Ack=119733 Win=1025 Len=0"
"312","2.145856","192.168.12.35","146.75.37.140","TCP","54","61013  >  443 [ACK] Seq=40143 Ack=120120 Win=1023 Len=0"
"313","2.306373","192.168.12.35","146.75.37.140","UDP","1292","50355  >  443 Len=1250"
"314","2.306617","192.168.12.35","146.75.37.140","UDP","546","50355  >  443 Len=504"
"315","2.332289","192.168.12.35","146.75.37.140","UDP","1292","50355  >  443 Len=1250"
"316","2.333004","192.168.12.35","146.75.37.140","UDP","543","50355  >  443 Len=501"
"317","2.362873","146.75.37.140","192.168.12.35","UDP","67","443  >  50355 Len=25"
"318","2.378899","192.168.12.35","146.75.37.140","UDP","1292","50355  >  443 Len=1250"
"319","2.379271","192.168.12.35","146.75.37.140","UDP","1019","50355  >  443 Len=977"
"320","2.386070","146.75.37.140","192.168.12.35","UDP","953","443  >  50355 Len=911"
"321","2.395714","192.168.12.35","146.75.37.140","UDP","84","50355  >  443 Len=42"
"322","2.400948","146.75.37.140","192.168.12.35","UDP","67","443  >  50355 Len=25"
"323","2.440854","146.75.37.140","192.168.12.35","UDP","67","443  >  50355 Len=25"
"324","2.440854","146.75.37.140","192.168.12.35","UDP","835","443  >  50355 Len=793"
"325","2.440854","146.75.37.140","192.168.12.35","UDP","1128","443  >  50355 Len=1086"
"326","2.457951","192.168.12.35","146.75.37.140","UDP","84","50355  >  443 Len=42"
"327","2.466600","146.75.37.140","192.168.12.35","UDP","1220","443  >  50355 Len=1178"
"328","2.489630","192.168.12.35","146.75.37.140","UDP","84","50355  >  443 Len=42"
"329","2.602474","192.168.12.35","146.75.37.140","UDP","1292","50355  >  443 Len=1250"
"330","2.603019","192.168.12.35","146.75.37.140","UDP","1022","50355  >  443 Len=980"
"331","2.660698","146.75.37.140","192.168.12.35","UDP","67","443  >  50355 Len=25"
"332","2.876360","192.168.12.35","146.75.37.140","UDP","80","50355  >  443 Len=38"
"333","2.876431","146.75.37.140","192.168.12.35","TLSv1.2","251","Application Data"
"334","2.887445","146.75.37.140","192.168.12.35","TLSv1.2","173","Application Data"
"335","2.887755","192.168.12.35","146.75.37.140","TCP","54","61013  >  443 [ACK] Seq=40143 Ack=120436 Win=1022 Len=0"
"336","2.901614","146.75.37.140","192.168.12.35","TCP","1430","443  >  61013 [ACK] Seq=120436 Ack=40143 Win=8196 Len=1376 [TCP PDU reassembled in 338]"
"337","2.901614","146.75.37.140","192.168.12.35","TCP","1430","443  >  61013 [PSH, ACK] Seq=121812 Ack=40143 Win=8196 Len=1376 [TCP PDU reassembled in 338]"
"338","2.901614","146.75.37.140","192.168.12.35","TLSv1.2","284","Application Data"
"339","2.901614","146.75.37.140","192.168.12.35","TLSv1.2","1028","Application Data"
"340","2.901614","146.75.37.140","192.168.12.35","TLSv1.2","699","Application Data"
"341","2.901614","146.75.37.140","192.168.12.35","TLSv1.2","412","Application Data"
"342","2.901614","146.75.37.140","192.168.12.35","TLSv1.2","411","Application Data"
"343","2.901614","146.75.37.140","192.168.12.35","TLSv1.2","187","Application Data"
"344","2.901614","146.75.37.140","192.168.12.35","TLSv1.2","169","Application Data"
"345","2.901614","146.75.37.140","192.168.12.35","TLSv1.2","395","Application Data"
"346","2.901614","146.75.37.140","192.168.12.35","TLSv1.2","1020","Application Data"
"347","2.901614","146.75.37.140","192.168.12.35","TLSv1.2","1391","Application Data"
"348","2.901614","146.75.37.140","192.168.12.35","TLSv1.2","256","Application Data"
"349","2.901614","146.75.37.140","192.168.12.35","TLSv1.2","437","Application Data"
"350","2.902887","192.168.12.35","146.75.37.140","TCP","54","61013  >  443 [ACK] Seq=40143 Ack=123188 Win=1025 Len=0"
"351","2.903313","192.168.12.35","146.75.37.140","TCP","54","61013  >  443 [ACK] Seq=40143 Ack=124392 Win=1020 Len=0"
"352","2.903374","192.168.12.35","146.75.37.140","TCP","54","61013  >  443 [ACK] Seq=40143 Ack=125395 Win=1025 Len=0"
"353","2.903440","192.168.12.35","146.75.37.140","TCP","54","61013  >  443 [ACK] Seq=40143 Ack=125885 Win=1023 Len=0"
"354","2.903497","192.168.12.35","146.75.37.140","TCP","54","61013  >  443 [ACK] Seq=40143 Ack=126341 Win=1021 Len=0"
"355","2.903591","192.168.12.35","146.75.37.140","TCP","54","61013  >  443 [ACK] Seq=40143 Ack=128644 Win=1025 Len=0"
"356","2.903648","192.168.12.35","146.75.37.140","TCP","54","61013  >  443 [ACK] Seq=40143 Ack=129229 Win=1022 Len=0"
"357","2.907422","146.75.37.140","192.168.12.35","TLSv1.2","306","Application Data"
"358","2.925368","146.75.37.140","192.168.12.35","UDP","67","443  >  50355 Len=25"
"359","2.936388","146.75.37.140","192.168.12.35","TLSv1.2","193","Application Data"
"360","2.936388","146.75.37.140","192.168.12.35","TLSv1.2","274","Application Data"
"361","2.936732","192.168.12.35","146.75.37.140","TCP","54","61013  >  443 [ACK] Seq=40143 Ack=129620 Win=1021 Len=0"
"362","2.943667","146.75.37.140","192.168.12.35","TLSv1.2","193","Application Data"
