"No.","Time","Source","Destination","Protocol","Length","Info"
"1","0.000000","192.168.12.35","146.75.37.140","UDP","80","52870  >  443 Len=38"
"2","0.087016","192.168.12.35","146.75.37.140","UDP","80","52870  >  443 Len=38"
"3","0.096074","146.75.37.140","192.168.12.35","UDP","67","443  >  52870 Len=25"
"4","0.108658","146.75.37.140","192.168.12.35","UDP","69","443  >  52870 Len=27"
"5","1.037752","192.168.12.35","146.75.37.140","TLSv1.2","3238","Application Data"
"6","1.037893","192.168.12.35","146.75.37.140","TLSv1.2","93","Application Data"
"7","1.037922","192.168.12.35","146.75.37.140","TLSv1.2","3356","Application Data"
"8","1.037948","192.168.12.35","146.75.37.140","TLSv1.2","1632","Application Data"
"9","1.078748","146.75.37.140","192.168.12.35","TCP","54","443  >  61013 [ACK] Seq=1 Ack=1397 Win=8244 Len=0"
"10","1.096093","146.75.37.140","192.168.12.35","TCP","54","443  >  61013 [ACK] Seq=1 Ack=2793 Win=8244 Len=0"
"11","1.101565","146.75.37.140","192.168.12.35","TCP","54","443  >  61013 [ACK] Seq=1 Ack=3185 Win=8244 Len=0"
"12","1.101565","146.75.37.140","192.168.12.35","TCP","54","443  >  61013 [ACK] Seq=1 Ack=3224 Win=8244 Len=0"
"13","1.101565","146.75.37.140","192.168.12.35","TLSv1.2","93","Application Data"
"14","1.113848","146.75.37.140","192.168.12.35","TCP","54","443  >  61013 [ACK] Seq=40 Ack=4620 Win=8244 Len=0"
"15","1.133682","146.75.37.140","192.168.12.35","TCP","54","443  >  61013 [ACK] Seq=40 Ack=6016 Win=8244 Len=0"
"16","1.144188","192.168.12.35","146.75.37.140","TCP","54","61013  >  443 [ACK] Seq=8104 Ack=40 Win=1024 Len=0"
"17","1.145390","146.75.37.140","192.168.12.35","TCP","54","443  >  61013 [ACK] Seq=40 Ack=6526 Win=8244 Len=0"
"18","1.145390","146.75.37.140","192.168.12.35","TCP","1430","443  >  61013 [ACK] Seq=40 Ack=6526 Win=8244 Len=1376 [TCP PDU reassembled in 19]"
"19","1.145390","146.75.37.140","192.168.12.35","TLSv1.2","930","Application Data"
"20","1.146130","192.168.12.35","146.75.37.140","TCP","54","61013  >  443 [ACK] Seq=8104 Ack=1416 Win=1025 Len=0"
"21","1.146301","192.168.12.35","146.75.37.140","TCP","54","61013  >  443 [ACK] Seq=8104 Ack=2292 Win=1021 Len=0"
"22","1.149799","146.75.37.140","192.168.12.35","TCP","54","443  >  61013 [ACK] Seq=2292 Ack=7922 Win=8244 Len=0"
"23","1.154478","146.75.37.140","192.168.12.35","TCP","54","443  >  61013 [ACK] Seq=2292 Ack=8104 Win=8244 Len=0"
"24","1.173977","146.75.37.140","192.168.12.35","TCP","1430","443  >  61013 [ACK] Seq=2292 Ack=8104 Win=8244 Len=1376 [TCP PDU reassembled in 25]"
"25","1.173977","146.75.37.140","192.168.12.35","TLSv1.2","1071","Application Data"
"26","1.174298","192.168.12.35","146.75.37.140","TCP","54","61013  >  443 [ACK] Seq=8104 Ack=4685 Win=1025 Len=0"
"27","1.176128","146.75.37.140","192.168.12.35","TCP","1430","443  >  61013 [ACK] Seq=4685 Ack=8104 Win=8244 Len=1376 [TCP PDU reassembled in 28]"
"28","1.176128","146.75.37.140","192.168.12.35","TLSv1.2","470","Application Data"
"29","1.176128","146.75.37.140","192.168.12.35","TLSv1.2","87","Application Data"
"30","1.176407","192.168.12.35","146.75.37.140","TCP","54","61013  >  443 [ACK] Seq=8104 Ack=6477 Win=1025 Len=0"
"31","1.180695","192.168.12.35","146.75.37.140","TLSv1.2","89","Application Data"
"32","1.181064","146.75.37.140","192.168.12.35","TCP","1430","443  >  61013 [ACK] Seq=6510 Ack=8104 Win=8244 Len=1376 [TCP PDU reassembled in 44]"
"33","1.181064","146.75.37.140","192.168.12.35","TCP","1430","443  >  61013 [ACK] Seq=7886 Ack=8104 Win=8244 Len=1376 [TCP PDU reassembled in 44]"
"34","1.181064","146.75.37.140","192.168.12.35","TCP","1430","443  >  61013 [ACK] Seq=9262 Ack=8104 Win=8244 Len=1376 [TCP PDU reassembled in 44]"
"35","1.181064","146.75.37.140","192.168.12.35","TCP","1430","443  >  61013 [ACK] Seq=10638 Ack=8104 Win=8244 Len=1376 [TCP PDU reassembled in 44]"
"36","1.181064","146.75.37.140","192.168.12.35","TCP","1430","443  >  61013 [PSH, ACK] Seq=12014 Ack=8104 Win=8244 Len=1376 [TCP PDU reassembled in 44]"
"37","1.181064","146.75.37.140","192.168.12.35","TCP","1430","443  >  61013 [ACK] Seq=13390 Ack=8104 Win=8244 Len=1376 [TCP PDU reassembled in 44]"
"38","1.181064","146.75.37.140","192.168.12.35","TCP","1430","443  >  61013 [ACK] Seq=14766 Ack=8104 Win=8244 Len=1376 [TCP PDU reassembled in 44]"
"39","1.181064","146.75.37.140","192.168.12.35","TCP","1430","443  >  61013 [ACK] Seq=16142 Ack=8104 Win=8244 Len=1376 [TCP PDU reassembled in 44]"
"40","1.181064","146.75.37.140","192.168.12.35","TCP","1430","443  >  61013 [ACK] Seq=17518 Ack=8104 Win=8244 Len=1376 [TCP PDU reassembled in 44]"
"41","1.181064","146.75.37.140","192.168.12.35","TCP","1430","443  >  61013 [PSH, ACK] Seq=18894 Ack=8104 Win=8244 Len=1376 [TCP PDU reassembled in 44]"
"42","1.181496","192.168.12.35","146.75.37.140","TCP","54","61013  >  443 [ACK] Seq=8139 Ack=20270 Win=1025 Len=0"
"43","1.182303","192.168.12.35","146.75.37.140","UDP","96","52870  >  443 Len=54"
"44","1.191474","146.75.37.140","192.168.12.35","TLSv1.2","347","Application Data"
"45","1.191474","146.75.37.140","192.168.12.35","TLSv1.2","866","Application Data"
"46","1.192243","192.168.12.35","146.75.37.140","TCP","54","61013  >  443 [ACK] Seq=8139 Ack=21375 Win=1020 Len=0"
"47","1.195761","146.75.37.140","192.168.12.35","TLSv1.2","90","Application Data"
"48","1.203094","146.75.37.140","192.168.12.35","TCP","1430","443  >  61013 [ACK] Seq=21411 Ack=8104 Win=8244 Len=1376 [TCP PDU reassembled in 59]"
"49","1.203094","146.75.37.140","192.168.12.35","TCP","1430","443  >  61013 [ACK] Seq=22787 Ack=8104 Win=8244 Len=1376 [TCP PDU reassembled in 59]"
"50","1.203094","146.75.37.140","192.168.12.35","TCP","1430","443  >  61013 [ACK] Seq=24163 Ack=8104 Win=8244 Len=1376 [TCP PDU reassembled in 59]"
"51","1.203094","146.75.37.140","192.168.12.35","TCP","1430","443  >  61013 [ACK] Seq=25539 Ack=8104 Win=8244 Len=1376 [TCP PDU reassembled in 59]"
"52","1.203094","146.75.37.140","192.168.12.35","TCP","1430","443  >  61013 [PSH, ACK] Seq=26915 Ack=8104 Win=8244 Len=1376 [TCP PDU reassembled in 59]"
"53","1.203094","146.75.37.140","192.168.12.35","TCP","1430","443  >  61013 [ACK] Seq=28291 Ack=8104 Win=8244 Len=1376 [TCP PDU reassembled in 59]"
"54","1.203094","146.75.37.140","192.168.12.35","TCP","1430","443  >  61013 [ACK] Seq=29667 Ack=8104 Win=8244 Len=1376 [TCP PDU reassembled in 59]"
"55","1.203094","146.75.37.140","192.168.12.35","TCP","1430","443  >  61013 [ACK] Seq=31043 Ack=8104 Win=8244 Len=1376 [TCP PDU reassembled in 59]"
"56","1.203094","146.75.37.140","192.168.12.35","TCP","1430","443  >  61013 [ACK] Seq=32419 Ack=8104 Win=8244 Len=1376 [TCP PDU reassembled in 59]"
"57","1.203094","146.75.37.140","192.168.12.35","TCP","1430","443  >  61013 [PSH, ACK] Seq=33795 Ack=8104 Win=8244 Len=1376 [TCP PDU reassembled in 59]"
"58","1.203094","146.75.37.140","192.168.12.35","TCP","1430","443  >  61013 [ACK] Seq=35171 Ack=8104 Win=8244 Len=1376 [TCP PDU reassembled in 59]"
"59","1.203094","146.75.37.140","192.168.12.35","TLSv1.2","547","Application Data"
"60","1.203850","192.168.12.35","146.75.37.140","TCP","54","61013  >  443 [ACK] Seq=8139 Ack=36547 Win=1025 Len=0"
"61","1.223030","146.75.37.140","192.168.12.35","TCP","1430","443  >  61013 [ACK] Seq=37040 Ack=8104 Win=8244 Len=1376 [TCP PDU reassembled in 72]"
"62","1.223030","146.75.37.140","192.168.12.35","TCP","1430","443  >  61013 [ACK] Seq=38416 Ack=8104 Win=8244 Len=1376 [TCP PDU reassembled in 72]"
"63","1.223030","146.75.37.140","192.168.12.35","TCP","1430","443  >  61013 [ACK] Seq=39792 Ack=8104 Win=8244 Len=1376 [TCP PDU reassembled in 72]"
"64","1.223030","146.75.37.140","192.168.12.35","TCP","1430","443  >  61013 [ACK] Seq=41168 Ack=8104 Win=8244 Len=1376 [TCP PDU reassembled in 72]"
"65","1.223030","146.75.37.140","192.168.12.35","TCP","1430","443  >  61013 [PSH, ACK] Seq=42544 Ack=8104 Win=8244 Len=1376 [TCP PDU reassembled in 72]"
"66","1.223030","146.75.37.140","192.168.12.35","TCP","1430","443  >  61013 [ACK] Seq=43920 Ack=8104 Win=8244 Len=1376 [TCP PDU reassembled in 72]"
"67","1.223030","146.75.37.140","192.168.12.35","TCP","1430","443  >  61013 [ACK] Seq=45296 Ack=8104 Win=8244 Len=1376 [TCP PDU reassembled in 72]"
"68","1.223030","146.75.37.140","192.168.12.35","TCP","1430","443  >  61013 [ACK] Seq=46672 Ack=8104 Win=8244 Len=1376 [TCP PDU reassembled in 72]"
"69","1.223030","146.75.37.140","192.168.12.35","TCP","1430","443  >  61013 [ACK] Seq=48048 Ack=8104 Win=8244 Len=1376 [TCP PDU reassembled in 72]"
"70","1.223030","146.75.37.140","192.168.12.35","TCP","1430","443  >  61013 [PSH, ACK] Seq=49424 Ack=8104 Win=8244 Len=1376 [TCP PDU reassembled in 72]"
"71","1.223030","146.75.37.140","192.168.12.35","TCP","1430","443  >  61013 [ACK] Seq=50800 Ack=8104 Win=8244 Len=1376 [TCP PDU reassembled in 72]"
"72","1.223030","146.75.37.140","192.168.12.35","TLSv1.2","1430","Application Data, Application Data"
"73","1.223030","146.75.37.140","192.168.12.35","TCP","1430","443  >  61013 [ACK] Seq=53552 Ack=8104 Win=8244 Len=1376 [TCP PDU reassembled in 74]"
"74","1.223030","146.75.37.140","192.168.12.35","TLSv1.2","923","Application Data"
"75","1.223030","146.75.37.140","192.168.12.35","TLSv1.2","1050","Application Data"
"76","1.223917","192.168.12.35","146.75.37.140","TCP","54","61013  >  443 [ACK] Seq=8139 Ack=54928 Win=1025 Len=0"
"77","1.224154","192.168.12.35","146.75.37.140","TCP","54","61013  >  443 [ACK] Seq=8139 Ack=56793 Win=1025 Len=0"
"78","1.252415","146.75.37.140","192.168.12.35","TLSv1.2","1181","Application Data"
"79","1.252415","146.75.37.140","192.168.12.35","TLSv1.2","1068","Application Data"
"80","1.253324","192.168.12.35","146.75.37.140","TCP","54","61013  >  443 [ACK] Seq=8139 Ack=58934 Win=1025 Len=0"
"81","1.257562","146.75.37.140","192.168.12.35","TLSv1.2","1191","Application Data"
"82","1.257562","146.75.37.140","192.168.12.35","TLSv1.2","603","Application Data"
"83","1.257829","192.168.12.35","146.75.37.140","TCP","54","61013  >  443 [ACK] Seq=8139 Ack=60620 Win=1025 Len=0"
"84","1.262894","146.75.37.140","192.168.12.35","TLSv1.2","903","Application Data"
"85","1.262894","146.75.37.140","192.168.12.35","TLSv1.2","181","Application Data"
"86","1.262894","146.75.37.140","192.168.12.35","TLSv1.2","334","Application Data"
"87","1.262894","146.75.37.140","192.168.12.35","TLSv1.2","582","Application Data"
"88","1.262894","146.75.37.140","192.168.12.35","TCP","1430","443  >  61013 [ACK] Seq=62404 Ack=8104 Win=8244 Len=1376 [TCP PDU reassembled in 89]"
"89","1.262894","146.75.37.140","192.168.12.35","TLSv1.2","309","Application Data"
"90","1.262894","146.75.37.140","192.168.12.35","TLSv1.2","769","Application Data"
"91","1.262894","146.75.37.140","192.168.12.35","TLSv1.2","659","Application Data"
"92","1.262894","146.75.37.140","192.168.12.35","TLSv1.2","143","Application Data"
"93","1.262894","146.75.37.140","192.168.12.35","TLSv1.2","107","Application Data"
"94","1.262894","146.75.37.140","192.168.12.35","TLSv1.2","103","Application Data"
"95","1.262894","146.75.37.140","192.168.12.35","TLSv1.2","675","Application Data"
"96","1.262894","146.75.37.140","192.168.12.35","TLSv1.2","189","Application Data"
"97","1.262894","146.75.37.140","192.168.12.35","TLSv1.2","579","Application Data"
"98","1.262894","146.75.37.140","192.168.12.35","TLSv1.2","214","Application Data, Application Data"
"99","1.262894","146.75.37.140","192.168.12.35","TLSv1.2","296","Application Data"
"100","1.262894","146.75.37.140","192.168.12.35","TLSv1.2","93","Application Data"
"101","1.263269","192.168.12.35","146.75.37.140","TCP","54","61013  >  443 [ACK] Seq=8139 Ack=61596 Win=1021 Len=0"
"102","1.263323","192.168.12.35","146.75.37.140","TCP","54","61013  >  443 [ACK] Seq=8139 Ack=62404 Win=1025 Len=0"
"103","1.263350","192.168.12.35","146.75.37.140","TCP","54","61013  >  443 [ACK] Seq=8139 Ack=64035 Win=1025 Len=0"
"104","1.263414","192.168.12.35","146.75.37.140","TCP","54","61013  >  443 [ACK] Seq=8139 Ack=65355 Win=1020 Len=0"
"105","1.263434","192.168.12.35","146.75.37.140","TCP","54","61013  >  443 [ACK] Seq=8139 Ack=65444 Win=1025 Len=0"
"106","1.263451","192.168.12.35","146.75.37.140","TCP","54","61013  >  443 [ACK] Seq=8139 Ack=65497 Win=1024 Len=0"
"107","1.263475","192.168.12.35","146.75.37.140","TCP","54","61013  >  443 [ACK] Seq=8139 Ack=66167 Win=1022 Len=0"
"108","1.263497","192.168.12.35","146.75.37.140","TCP","54","61013  >  443 [ACK] Seq=8139 Ack=66827 Win=1019 Len=0"
"109","1.263514","192.168.12.35","146.75.37.140","TCP","54","61013  >  443 [ACK] Seq=8139 Ack=66987 Win=1025 Len=0"
"110","1.263541","192.168.12.35","146.75.37.140","TCP","54","61013  >  443 [ACK] Seq=8139 Ack=67229 Win=1024 Len=0"
"111","1.270682","146.75.37.140","192.168.12.35","TLSv1.2","447","Application Data"
"112","1.270682","146.75.37.140","192.168.12.35","TLSv1.2","431","Application Data"
"113","1.270682","146.75.37.140","192.168.12.35","TLSv1.2","129","Application Data"
"114","1.270882","192.168.12.35","146.75.37.140","TCP","54","61013  >  443 [ACK] Seq=8139 Ack=67661 Win=1022 Len=0"
"115","1.271000","192.168.12.35","146.75.37.140","TCP","54","61013  >  443 [ACK] Seq=8139 Ack=68113 Win=1020 Len=0"
"116","1.275513","146.75.37.140","192.168.12.35","TLSv1.2","156","Application Data"
"117","1.275513","146.75.37.140","192.168.12.35","TLSv1.2","119","Application Data"
"118","1.275689","192.168.12.35","146.75.37.140","TCP","54","61013  >  443 [ACK] Seq=8139 Ack=68280 Win=1020 Len=0"
"119","1.282794","146.75.37.140","192.168.12.35","TLSv1.2","94","Application Data"
"120","1.283299","192.168.12.35","146.75.37.140","UDP","96","52870  >  443 Len=54"
"121","1.287569","146.75.37.140","192.168.12.35","TLSv1.2","107","Application Data"
"122","1.287953","192.168.12.35","146.75.37.140","TCP","54","61013  >  443 [ACK] Seq=8139 Ack=68373 Win=1019 Len=0"
"123","1.295936","146.75.37.140","192.168.12.35","TLSv1.2","106","Application Data"
"124","1.295936","146.75.37.140","192.168.12.35","TLSv1.2","308","Application Data"
"125","1.295936","146.75.37.140","192.168.12.35","TLSv1.2","222","Application Data"
"126","1.295936","146.75.37.140","192.168.12.35","TLSv1.2","105","Application Data"
"127","1.295936","146.75.37.140","192.168.12.35","TLSv1.2","291","Application Data"
"128","1.295936","146.75.37.140","192.168.12.35","TLSv1.2","113","Application Data"
"129","1.295936","146.75.37.140","192.168.12.35","TLSv1.2","141","Application Data"
"130","1.297006","192.168.12.35","146.75.37.140","TCP","54","61013  >  443 [ACK] Seq=8139 Ack=68425 Win=1025 Len=0"
"131","1.297342","192.168.12.35","146.75.37.140","TCP","54","61013  >  443 [ACK] Seq=8139 Ack=68679 Win=1024 Len=0"
"132","1.297398","192.168.12.35","146.75.37.140","TCP","54","61013  >  443 [ACK] Seq=8139 Ack=68898 Win=1023 Len=0"
"133","1.297459","192.168.12.35","146.75.37.140","TCP","54","61013  >  443 [ACK] Seq=8139 Ack=69194 Win=1022 Len=0"
"134","1.304841","146.75.37.140","192.168.12.35","TLSv1.2","246","Application Data"
"135","1.304841","146.75.37.140","192.168.12.35","TLSv1.2","104","Application Data"
"136","1.304841","146.75.37.140","192.168.12.35","TLSv1.2","157","Application Data"
"137","1.304841","146.75.37.140","192.168.12.35","TLSv1.2","136","Application Data"
"138","1.304841","146.75.37.140","192.168.12.35","TLSv1.2","104","Application Data"
"139","1.305706","192.168.12.35","146.75.37.140","TCP","54","61013  >  443 [ACK] Seq=8139 Ack=69473 Win=1021 Len=0"
"140","1.306050","192.168.12.35","146.75.37.140","TCP","54","61013  >  443 [ACK] Seq=8139 Ack=69626 Win=1020 Len=0"
"141","1.306109","192.168.12.35","146.75.37.140","TCP","54","61013  >  443 [ACK] Seq=8139 Ack=69758 Win=1019 Len=0"
"142","1.306293","146.75.37.140","192.168.12.35","TLSv1.2","130","Application Data"
"143","1.306293","146.75.37.140","192.168.12.35","TLSv1.2","492","Application Data"
"144","1.306479","192.168.12.35","146.75.37.140","TCP","54","61013  >  443 [ACK] Seq=8139 Ack=69834 Win=1025 Len=0"
"145","1.306586","192.168.12.35","146.75.37.140","TCP","54","61013  >  443 [ACK] Seq=8139 Ack=70272 Win=1023 Len=0"
"146","1.362513","146.75.37.140","192.168.12.35","TCP","54","443  >  61013 [ACK] Seq=70272 Ack=8139 Win=8244 Len=0"
"147","1.362513","146.75.37.140","192.168.12.35","UDP","67","443  >  52870 Len=25"
"148","1.375505","146.75.37.140","192.168.12.35","UDP","69","443  >  52870 Len=27"
"149","1.376362","192.168.12.35","146.75.37.140","UDP","84","52870  >  443 Len=42"
"150","1.419178","146.75.37.140","192.168.12.35","UDP","63","443  >  52870 Len=21"
"151","1.427153","192.168.12.35","146.75.37.140","UDP","84","52870  >  443 Len=42"
"152","1.435206","146.75.37.140","192.168.12.35","UDP","71","443  >  52870 Len=29"
"153","1.627196","146.75.37.140","192.168.12.35","TLSv1.2","612","Application Data"
"154","1.628894","146.75.37.140","192.168.12.35","TLSv1.2","399","Application Data"
"155","1.628894","146.75.37.140","192.168.12.35","TLSv1.2","1197","Application Data"
"156","1.628894","146.75.37.140","192.168.12.35","TLSv1.2","166","Application Data"
"157","1.628894","146.75.37.140","192.168.12.35","TLSv1.2","139","Application Data"
"158","1.628894","146.75.37.140","192.168.12.35","TLSv1.2","152","Application Data"
"159","1.628894","146.75.37.140","192.168.12.35","TLSv1.2","405","Application Data"
"160","1.628894","146.75.37.140","192.168.12.35","TLSv1.2","107","Application Data"
"161","1.628894","146.75.37.140","192.168.12.35","TLSv1.2","185","Application Data"
"162","1.628894","146.75.37.140","192.168.12.35","TLSv1.2","964","Application Data"
"163","1.628894","146.75.37.140","192.168.12.35","TLSv1.2","716","Application Data"
"164","1.628894","146.75.37.140","192.168.12.35","TCP","1430","443  >  61013 [ACK] Seq=74720 Ack=8139 Win=8244 Len=1376 [TCP PDU reassembled in 165]"
"165","1.628894","146.75.37.140","192.168.12.35","TLSv1.2","150","Application Data"
"166","1.628894","146.75.37.140","192.168.12.35","TCP","1430","443  >  61013 [ACK] Seq=76192 Ack=8139 Win=8244 Len=1376 [TCP PDU reassembled in 167]"
"167","1.628894","146.75.37.140","192.168.12.35","TLSv1.2","1102","Application Data"
"168","1.628894","146.75.37.140","192.168.12.35","TLSv1.2","408","Application Data"
"169","1.628894","146.75.37.140","192.168.12.35","TCP","1430","443  >  61013 [ACK] Seq=78970 Ack=8139 Win=8244 Len=1376 [TCP PDU reassembled in 170]"
"170","1.628894","146.75.37.140","192.168.12.35","TLSv1.2","140","Application Data"
"171","1.628894","146.75.37.140","192.168.12.35","TLSv1.2","255","Application Data"
"172","1.628894","146.75.37.140","192.168.12.35","TLSv1.2","1224","Application Data"
"173","1.629600","192.168.12.35","146.75.37.140","TCP","54","61013  >  443 [ACK] Seq=8139 Ack=71175 Win=1019 Len=0"
"174","1.630049","192.168.12.35","146.75.37.140","TCP","54","61013  >  443 [ACK] Seq=8139 Ack=72430 Win=1025 Len=0"
"175","1.630151","192.168.12.35","146.75.37.140","TCP","54","61013  >  443 [ACK] Seq=8139 Ack=72613 Win=1024 Len=0"
"176","1.630300","192.168.12.35","146.75.37.140","TCP","54","61013  >  443 [ACK] Seq=8139 Ack=73017 Win=1022 Len=0"
"177","1.630367","192.168.12.35","146.75.37.140","TCP","54","61013  >  443 [ACK] Seq=8139 Ack=74058 Win=1025 Len=0"
"178","1.630454","192.168.12.35","146.75.37.140","TCP","54","61013  >  443 [ACK] Seq=8139 Ack=76096 Win=1025 Len=0"
"179","1.630516","192.168.12.35","146.75.37.140","TCP","54","61013  >  443 [ACK] Seq=8139 Ack=77568 Win=1025 Len=0"
"180","1.630581","192.168.12.35","146.75.37.140","TCP","54","61013  >  443 [ACK] Seq=8139 Ack=78970 Win=1025 Len=0"
"181","1.630658","192.168.12.35","146.75.37.140","TCP","54","61013  >  443 [ACK] Seq=8139 Ack=80432 Win=1025 Len=0"
"182","1.630737","192.168.12.35","146.75.37.140","TCP","54","61013  >  443 [ACK] Seq=8139 Ack=81803 Win=1019 Len=0"
"183","1.636294","146.75.37.140","192.168.12.35","TLSv1.2","628","Application Data"
"184","1.642231","146.75.37.140","192.168.12.35","TCP","1430","443  >  61013 [ACK] Seq=82377 Ack=8139 Win=8244 Len=1376 [TCP PDU reassembled in 185]"
"185","1.642231","146.75.37.140","192.168.12.35","TLSv1.2","410","Application Data"
"186","1.642231","146.75.37.140","192.168.12.35","TCP","1430","443  >  61013 [ACK] Seq=84109 Ack=8139 Win=8244 Len=1376 [TCP PDU reassembled in 187]"
"187","1.642231","146.75.37.140","192.168.12.35","TLSv1.2","320","Application Data"
"188","1.642231","146.75.37.140","192.168.12.35","TCP","1430","443  >  61013 [ACK] Seq=85751 Ack=8139 Win=8244 Len=1376 [TCP PDU reassembled in 189]"
"189","1.642231","146.75.37.140","192.168.12.35","TLSv1.2","1070","Application Data"
"190","1.643566","192.168.12.35","146.75.37.140","TCP","54","61013  >  443 [ACK] Seq=8139 Ack=83753 Win=1025 Len=0"
"191","1.644079","192.168.12.35","146.75.37.140","TCP","54","61013  >  443 [ACK] Seq=8139 Ack=85485 Win=1025 Len=0"
"192","1.644182","192.168.12.35","146.75.37.140","TCP","54","61013  >  443 [ACK] Seq=8139 Ack=87127 Win=1025 Len=0"
"193","1.657065","146.75.37.140","192.168.12.35","TLSv1.2","202","Application Data"
"194","1.657065","146.75.37.140","192.168.12.35","TLSv1.2","444","Application Data"
"195","1.657065","146.75.37.140","192.168.12.35","TLSv1.2","138","Application Data"
"196","1.657065","146.75.37.140","192.168.12.35","TCP","1430","443  >  61013 [ACK] Seq=88765 Ack=8139 Win=8244 Len=1376 [TCP PDU reassembled in 197]"
"197","1.657065","146.75.37.140","192.168.12.35","TLSv1.2","857","Application Data"
"198","1.657065","146.75.37.140","192.168.12.35","TCP","1430","443  >  61013 [ACK] Seq=90944 Ack=8139 Win=8244 Len=1376 [TCP PDU reassembled in 199]"
"199","1.657065","146.75.37.140","192.168.12.35","TLSv1.2","672","Application Data"
"200","1.657065","146.75.37.140","192.168.12.35","TLSv1.2","413","Application Data"
"201","1.657065","146.75.37.140","192.168.12.35","TLSv1.2","238","Application Data"
"202","1.657065","146.75.37.140","192.168.12.35","TLSv1.2","322","Application Data"
"203","1.657065","146.75.37.140","192.168.12.35","TLSv1.2","384","Application Data"
"204","1.657706","192.168.12.35","146.75.37.140","TCP","54","61013  >  443 [ACK] Seq=8139 Ack=88291 Win=1020 Len=0"
"205","1.657860","192.168.12.35","146.75.37.140","TCP","54","61013  >  443 [ACK] Seq=8139 Ack=88765 Win=1025 Len=0"
"206","1.657917","192.168.12.35","146.75.37.140","TCP","54","61013  >  443 [ACK] Seq=8139 Ack=90944 Win=1025 Len=0"
"207","1.658043","192.168.12.35","146.75.37.140","TCP","54","61013  >  443 [ACK] Seq=8139 Ack=92938 Win=1025 Len=0"
"208","1.658103","192.168.12.35","146.75.37.140","TCP","54","61013  >  443 [ACK] Seq=8139 Ack=93481 Win=1023 Len=0"
"209","1.658193","192.168.12.35","146.75.37.140","TCP","54","61013  >  443 [ACK] Seq=8139 Ack=94079 Win=1020 Len=0"
"210","1.747684","192.168.12.35","146.75.37.140","TLSv1.2","3187","Application Data"
"211","1.748175","192.168.12.35","146.75.37.140","TLSv1.2","718","Application Data"
"212","1.748252","192.168.12.35","146.75.37.140","TLSv1.2","3191","Application Data"
"213","1.785962","192.168.12.35","146.75.37.140","TLSv1.2","3200","Application Data"
"214","1.944014","192.168.12.35","146.75.37.140","TLSv1.2","3178","Application Data"
"215","1.944228","192.168.12.35","146.75.37.140","TLSv1.2","210","Application Data"
"216","1.953119","146.75.37.140","192.168.12.35","TCP","54","443  >  61013 [ACK] Seq=94079 Ack=9535 Win=8244 Len=0"
"217","1.965907","146.75.37.140","192.168.12.35","TCP","54","443  >  61013 [ACK] Seq=94079 Ack=10931 Win=8244 Len=0"
"218","1.965907","146.75.37.140","192.168.12.35","TCP","54","443  >  61013 [ACK] Seq=94079 Ack=11272 Win=8244 Len=0"
"219","1.982108","146.75.37.140","192.168.12.35","TCP","54","443  >  61013 [ACK] Seq=94079 Ack=11936 Win=8244 Len=0"
"220","1.996867","146.75.37.140","192.168.12.35","TCP","54","443  >  61013 [ACK] Seq=94079 Ack=13332 Win=8244 Len=0"
"221","2.013840","146.75.37.140","192.168.12.35","TCP","1430","443  >  61013 [ACK] Seq=94079 Ack=13332 Win=8244 Len=1376 [TCP PDU reassembled in 222]"
"222","2.013840","146.75.37.140","192.168.12.35","TLSv1.2","766","Application Data"
"223","2.013840","146.75.37.140","192.168.12.35","TLSv1.2","87","Application Data"
"224","2.014158","192.168.12.35","146.75.37.140","TCP","54","61013  >  443 [ACK] Seq=21499 Ack=95455 Win=1025 Len=0"
"225","2.014306","192.168.12.35","146.75.37.140","TCP","54","61013  >  443 [ACK] Seq=21499 Ack=96167 Win=1022 Len=0"
"226","2.015235","146.75.37.140","192.168.12.35","TCP","54","443  >  61013 [ACK] Seq=96200 Ack=14728 Win=8244 Len=0"
"227","2.019559","146.75.37.140","192.168.12.35","TCP","54","443  >  61013 [ACK] Seq=96200 Ack=15073 Win=8244 Len=0"
"228","2.037185","192.168.12.35","146.75.37.140","TLSv1.2","3287","Application Data"
"229","2.059390","146.75.37.140","192.168.12.35","TCP","1430","443  >  61013 [ACK] Seq=96200 Ack=15073 Win=8244 Len=1376 [TCP PDU reassembled in 230]"
"230","2.059390","146.75.37.140","192.168.12.35","TLSv1.2","471","Application Data"
"231","2.059390","146.75.37.140","192.168.12.35","TLSv1.2","87","Application Data"
"232","2.059816","192.168.12.35","146.75.37.140","TLSv1.2","3194","Application Data"
"233","2.060294","192.168.12.35","146.75.37.140","TCP","54","61013  >  443 [ACK] Seq=27872 Ack=97576 Win=1025 Len=0"
"234","2.060539","192.168.12.35","146.75.37.140","TCP","54","61013  >  443 [ACK] Seq=27872 Ack=97993 Win=1023 Len=0"
"235","2.075348","146.75.37.140","192.168.12.35","TCP","54","443  >  61013 [ACK] Seq=98026 Ack=16469 Win=8244 Len=0"
"236","2.081420","192.168.12.35","146.75.37.140","TLSv1.2","3207","Application Data"
"237","2.081848","192.168.12.35","146.75.37.140","TLSv1.2","3184","Application Data"
"238","2.103338","146.75.37.140","192.168.12.35","TCP","54","443  >  61013 [ACK] Seq=98026 Ack=17865 Win=8244 Len=0"
"239","2.103709","146.75.37.140","192.168.12.35","TCP","54","443  >  61013 [ACK] Seq=98026 Ack=18219 Win=8244 Len=0"
"240","2.256735","146.75.37.140","192.168.12.35","TCP","1430","443  >  61013 [ACK] Seq=98026 Ack=18219 Win=8244 Len=1376 [TCP PDU reassembled in 241]"
"241","2.256735","146.75.37.140","192.168.12.35","TLSv1.2","879","Application Data"
"242","2.257528","192.168.12.35","146.75.37.140","TCP","54","61013  >  443 [ACK] Seq=34155 Ack=99402 Win=1025 Len=0"
"243","2.257807","192.168.12.35","146.75.37.140","TCP","54","61013  >  443 [ACK] Seq=34155 Ack=100227 Win=1021 Len=0"
"244","2.261775","146.75.37.140","192.168.12.35","TLSv1.2","100","Application Data"
"245","2.301987","146.75.37.140","192.168.12.35","TCP","54","443  >  61013 [ACK] Seq=100273 Ack=19615 Win=8244 Len=0"
"246","2.310123","192.168.12.35","146.75.37.140","TCP","54","61013  >  443 [ACK] Seq=34155 Ack=100273 Win=1021 Len=0"
"247","2.328314","146.75.37.140","192.168.12.35","TCP","54","443  >  61013 [ACK] Seq=100273 Ack=21011 Win=8244 Len=0"
"248","2.334704","146.75.37.140","192.168.12.35","TCP","54","443  >  61013 [ACK] Seq=100273 Ack=21343 Win=8244 Len=0"
"249","2.339923","146.75.37.140","192.168.12.35","TCP","54","443  >  61013 [ACK] Seq=100273 Ack=21499 Win=8244 Len=0"
"250","2.374167","146.75.37.140","192.168.12.35","TCP","54","443  >  61013 [ACK] Seq=100273 Ack=22895 Win=8244 Len=0"
"251","2.405465","146.75.37.140","192.168.12.35","TCP","54","443  >  61013 [ACK] Seq=100273 Ack=24291 Win=8244 Len=0"
"252","2.405465","146.75.37.140","192.168.12.35","TCP","54","443  >  61013 [ACK] Seq=100273 Ack=24732 Win=8244 Len=0"
"253","2.405465","146.75.37.140","192.168.12.35","TCP","1430","443  >  61013 [ACK] Seq=100273 Ack=24732 Win=8244 Len=1376 [TCP PDU reassembled in 254]"
"254","2.405465","146.75.37.140","192.168.12.35","TLSv1.2","610","Application Data"
"255","2.406437","192.168.12.35","146.75.37.140","TCP","54","61013  >  443 [ACK] Seq=34155 Ack=101649 Win=1025 Len=0"
"256","2.406753","192.168.12.35","146.75.37.140","TCP","54","61013  >  443 [ACK] Seq=34155 Ack=102205 Win=1023 Len=0"
"257","2.420073","146.75.37.140","192.168.12.35","TCP","54","443  >  61013 [ACK] Seq=102205 Ack=26128 Win=8244 Len=0"
"258","2.424255","192.168.12.35","146.75.37.140","TLSv1.2","205","Application Data"
"259","2.425492","192.168.12.35","146.75.37.140","TLSv1.2","93","Application Data"
"260","2.436177","146.75.37.140","192.168.12.35","TCP","54","443  >  61013 [ACK] Seq=102205 Ack=27524 Win=8244 Len=0"
"261","2.436177","146.75.37.140","192.168.12.35","TCP","54","443  >  61013 [ACK] Seq=102205 Ack=27872 Win=8244 Len=0"
"262","2.439852","146.75.37.140","192.168.12.35","TCP","1430","443  >  61013 [ACK] Seq=102205 Ack=27872 Win=8244 Len=1376 [TCP PDU reassembled in 263]"
"263","2.439852","146.75.37.140","192.168.12.35","TLSv1.2","876","Application Data"
"264","2.439852","146.75.37.140","192.168.12.35","TLSv1.2","100","Application Data"
"265","2.440317","192.168.12.35","146.75.37.140","TCP","54","61013  >  443 [ACK] Seq=34155 Ack=103581 Win=1025 Len=0"
"266","2.440527","192.168.12.35","146.75.37.140","TCP","54","61013  >  443 [ACK] Seq=34155 Ack=104403 Win=1021 Len=0"
"267","2.463923","146.75.37.140","192.168.12.35","TCP","1430","443  >  61013 [ACK] Seq=104449 Ack=29268 Win=8244 Len=1376 [TCP PDU reassembled in 268]"
"268","2.463923","146.75.37.140","192.168.12.35","TLSv1.2","490","Application Data"
"269","2.464507","192.168.12.35","146.75.37.140","TCP","54","61013  >  443 [ACK] Seq=34155 Ack=105825 Win=1025 Len=0"
"270","2.473605","146.75.37.140","192.168.12.35","TCP","54","443  >  61013 [ACK] Seq=106261 Ack=31025 Win=8244 Len=0"
"271","2.496304","146.75.37.140","192.168.12.35","TCP","1430","443  >  61013 [ACK] Seq=106261 Ack=32421 Win=8244 Len=1376 [TCP PDU reassembled in 272]"
"272","2.496304","146.75.37.140","192.168.12.35","TLSv1.2","847","Application Data"
"273","2.496829","192.168.12.35","146.75.37.140","TCP","54","61013  >  443 [ACK] Seq=34155 Ack=107637 Win=1025 Len=0"
"274","2.501666","146.75.37.140","192.168.12.35","TLSv1.2","100","Application Data"
"275","2.502290","192.168.12.35","146.75.37.140","TCP","54","61013  >  443 [ACK] Seq=34155 Ack=108476 Win=1021 Len=0"
"276","2.519885","146.75.37.140","192.168.12.35","TCP","54","443  >  61013 [ACK] Seq=108476 Ack=34155 Win=8244 Len=0"
"277","2.533773","146.75.37.140","192.168.12.35","TLSv1.2","594","Application Data"
"278","2.539669","146.75.37.140","192.168.12.35","TLSv1.2","95","Application Data"
"279","2.540259","192.168.12.35","146.75.37.140","TCP","54","61013  >  443 [ACK] Seq=34155 Ack=109057 Win=1025 Len=0"
"280","2.554934","192.168.12.35","146.75.37.140","TLSv1.2","3144","Application Data"
"281","2.556602","146.75.37.140","192.168.12.35","TCP","1430","443  >  61013 [ACK] Seq=109057 Ack=34155 Win=8244 Len=1376 [TCP PDU reassembled in 282]"
"282","2.556602","146.75.37.140","192.168.12.35","TLSv1.2","466","Application Data"
"283","2.556844","192.168.12.35","146.75.37.140","TCP","54","61013  >  443 [ACK] Seq=37245 Ack=110845 Win=1025 Len=0"
"284","2.571138","146.75.37.140","192.168.12.35","TLSv1.2","100","Application Data"
"285","2.624828","192.168.12.35","146.75.37.140","TCP","54","61013  >  443 [ACK] Seq=37245 Ack=110891 Win=1025 Len=0"
"286","2.687592","146.75.37.140","192.168.12.35","TCP","1430","443  >  61013 [ACK] Seq=110891 Ack=34155 Win=8244 Len=1376 [TCP PDU reassembled in 287]"
"287","2.687592","146.75.37.140","192.168.12.35","TLSv1.2","112","Application Data"
"288","2.687592","146.75.37.140","192.168.12.35","TLSv1.2","610","Application Data"
"289","2.687592","146.75.37.140","192.168.12.35","TLSv1.2","367","Application Data"
"290","2.687592","146.75.37.140","192.168.12.35","TLSv1.2","85","Application Data"
"291","2.688294","192.168.12.35","146.75.37.140","TCP","54","61013  >  443 [ACK] Seq=37245 Ack=112267 Win=1025 Len=0"
"292","2.688394","192.168.12.35","146.75.37.140","TCP","54","61013  >  443 [ACK] Seq=37245 Ack=112325 Win=1024 Len=0"
"293","2.688475","192.168.12.35","146.75.37.140","TCP","54","61013  >  443 [ACK] Seq=37245 Ack=113194 Win=1021 Len=0"
"294","2.733529","192.168.12.35","146.75.37.140","TCP","54","61013  >  443 [ACK] Seq=37245 Ack=113225 Win=1021 Len=0"
"295","2.747036","146.75.37.140","192.168.12.35","TCP","54","443  >  61034 [ACK] Seq=1 Ack=152 Win=424 Len=0"
"296","2.752031","146.75.37.140","192.168.12.35","TLSv1.2","189","Application Data"
"297","2.752031","146.75.37.140","192.168.12.35","TCP","1430","443  >  61034 [ACK] Seq=136 Ack=152 Win=424 Len=1376 [TCP PDU reassembled in 308]"
"298","2.752031","146.75.37.140","192.168.12.35","TCP","1430","443  >  61034 [ACK] Seq=1512 Ack=152 Win=424 Len=1376 [TCP PDU reassembled in 308]"
"299","2.752031","146.75.37.140","192.168.12.35","TCP","1430","443  >  61034 [ACK] Seq=2888 Ack=152 Win=424 Len=1376 [TCP PDU reassembled in 308]"
"300","2.752031","146.75.37.140","192.168.12.35","TCP","1430","443  >  61034 [ACK] Seq=4264 Ack=152 Win=424 Len=1376 [TCP PDU reassembled in 308]"
"301","2.752031","146.75.37.140","192.168.12.35","TCP","1430","443  >  61034 [ACK] Seq=5640 Ack=152 Win=424 Len=1376 [TCP PDU reassembled in 308]"
"302","2.752031","146.75.37.140","192.168.12.35","TCP","1430","443  >  61034 [ACK] Seq=7016 Ack=152 Win=424 Len=1376 [TCP PDU reassembled in 308]"
"303","2.752031","146.75.37.140","192.168.12.35","TCP","1430","443  >  61034 [ACK] Seq=8392 Ack=152 Win=424 Len=1376 [TCP PDU reassembled in 308]"
"304","2.752031","146.75.37.140","192.168.12.35","TCP","1430","443  >  61034 [ACK] Seq=9768 Ack=152 Win=424 Len=1376 [TCP PDU reassembled in 308]"
"305","2.752031","146.75.37.140","192.168.12.35","TCP","1430","443  >  61034 [ACK] Seq=11144 Ack=152 Win=424 Len=1376 [TCP PDU reassembled in 308]"
"306","2.752031","146.75.37.140","192.168.12.35","TCP","1430","443  >  61034 [ACK] Seq=12520 Ack=152 Win=424 Len=1376 [TCP PDU reassembled in 308]"
"307","2.752031","146.75.37.140","192.168.12.35","TCP","1430","443  >  61034 [ACK] Seq=13896 Ack=152 Win=424 Len=1376 [TCP PDU reassembled in 308]"
"308","2.752031","146.75.37.140","192.168.12.35","TLSv1.2","1430","Application Data"
"309","2.752031","146.75.37.140","192.168.12.35","TCP","1430","443  >  61034 [ACK] Seq=16648 Ack=152 Win=424 Len=1376 [TCP PDU reassembled in 320]"
"310","2.752031","146.75.37.140","192.168.12.35","TCP","1430","443  >  61034 [ACK] Seq=18024 Ack=152 Win=424 Len=1376 [TCP PDU reassembled in 320]"
"311","2.752031","146.75.37.140","192.168.12.35","TCP","1430","443  >  61034 [ACK] Seq=19400 Ack=152 Win=424 Len=1376 [TCP PDU reassembled in 320]"
"312","2.752031","146.75.37.140","192.168.12.35","TCP","1430","443  >  61034 [ACK] Seq=20776 Ack=152 Win=424 Len=1376 [TCP PDU reassembled in 320]"
"313","2.752031","146.75.37.140","192.168.12.35","TCP","1430","443  >  61034 [PSH, ACK] Seq=22152 Ack=152 Win=424 Len=1376 [TCP PDU reassembled in 320]"
"314","2.752031","146.75.37.140","192.168.12.35","TCP","1430","443  >  61034 [ACK] Seq=23528 Ack=152 Win=424 Len=1376 [TCP PDU reassembled in 320]"
"315","2.752031","146.75.37.140","192.168.12.35","TCP","1430","443  >  61034 [ACK] Seq=24904 Ack=152 Win=424 Len=1376 [TCP PDU reassembled in 320]"
"316","2.752031","146.75.37.140","192.168.12.35","TCP","1430","443  >  61034 [ACK] Seq=26280 Ack=152 Win=424 Len=1376 [TCP PDU reassembled in 320]"
"317","2.752031","146.75.37.140","192.168.12.35","TCP","1430","443  >  61034 [ACK] Seq=27656 Ack=152 Win=424 Len=1376 [TCP PDU reassembled in 320]"
"318","2.752031","146.75.37.140","192.168.12.35","TCP","1430","443  >  61034 [ACK] Seq=29032 Ack=152 Win=424 Len=1376 [TCP PDU reassembled in 320]"
"319","2.752031","146.75.37.140","192.168.12.35","TCP","1430","443  >  61034 [ACK] Seq=30408 Ack=152 Win=424 Len=1376 [TCP PDU reassembled in 320]"
"320","2.752031","146.75.37.140","192.168.12.35","TLSv1.2","1430","Application Data"
"321","2.752031","146.75.37.140","192.168.12.35","TCP","1430","443  >  61034 [ACK] Seq=33160 Ack=152 Win=424 Len=1376 [TCP PDU reassembled in 323]"
"322","2.752031","146.75.37.140","192.168.12.35","TCP","1430","443  >  61034 [ACK] Seq=34536 Ack=152 Win=424 Len=1376 [TCP PDU reassembled in 323]"
"323","2.752031","146.75.37.140","192.168.12.35","TLSv1.2","71","Application Data"
"324","2.752031","146.75.37.140","192.168.12.35","TCP","54","443  >  61034 [ACK] Seq=35929 Ack=191 Win=424 Len=0"
"325","2.752031","146.75.37.140","192.168.12.35","TLSv1.2","93","Application Data"
"326","2.753393","192.168.12.35","146.75.37.140","TCP","54","61034  >  443 [ACK] Seq=191 Ack=35912 Win=8201 Len=0"
"327","2.753623","192.168.12.35","146.75.37.140","TCP","54","61034  >  443 [ACK] Seq=191 Ack=35929 Win=8201 Len=0"
"328","2.755146","192.168.12.35","146.75.37.140","TLSv1.2","89","Application Data"
"329","2.777771","146.75.37.140","192.168.12.35","TLSv1.2","996","Application Data"
"330","2.778358","146.75.37.140","192.168.12.35","TLSv1.2","123","Application Data"
"331","2.778932","192.168.12.35","146.75.37.140","TCP","54","61013  >  443 [ACK] Seq=37245 Ack=114167 Win=1025 Len=0"
"332","2.779372","192.168.12.35","146.75.37.140","TCP","54","61013  >  443 [ACK] Seq=37245 Ack=114236 Win=1024 Len=0"
"333","2.825531","192.168.12.35","146.75.37.140","TLSv1.2","3175","Application Data"
"334","2.826220","192.168.12.35","146.75.37.140","TLSv1.2","134","Application Data"
"335","2.831873","146.75.37.140","192.168.12.35","TCP","54","443  >  61013 [ACK] Seq=114236 Ack=36947 Win=8244 Len=0"
"336","2.831873","146.75.37.140","192.168.12.35","TCP","54","443  >  61013 [ACK] Seq=114236 Ack=37245 Win=8244 Len=0"
"337","2.860109","146.75.37.140","192.168.12.35","TCP","1430","443  >  61013 [ACK] Seq=114236 Ack=37245 Win=8244 Len=1376 [TCP PDU reassembled in 339]"
"338","2.861150","192.168.12.35","146.75.37.140","TCP","54","61013  >  443 [ACK] Seq=40446 Ack=115612 Win=1025 Len=0"
"339","2.868399","146.75.37.140","192.168.12.35","TLSv1.2","828","Application Data"
"340","2.869149","192.168.12.35","146.75.37.140","TCP","54","61013  >  443 [ACK] Seq=40446 Ack=116386 Win=1022 Len=0"
"341","2.874120","146.75.37.140","192.168.12.35","TCP","54","443  >  61034 [ACK] Seq=35968 Ack=226 Win=424 Len=0"
"342","3.003832","146.75.37.140","192.168.12.35","TCP","54","443  >  61013 [ACK] Seq=116386 Ack=38641 Win=8244 Len=0"
"343","3.010948","146.75.37.140","192.168.12.35","TCP","54","443  >  61013 [ACK] Seq=116386 Ack=40037 Win=8244 Len=0"
"344","3.010948","146.75.37.140","192.168.12.35","TCP","54","443  >  61013 [ACK] Seq=116386 Ack=40366 Win=8244 Len=0"
"345","3.010948","146.75.37.140","192.168.12.35","TCP","54","443  >  61013 [ACK] Seq=116386 Ack=40446 Win=8244 Len=0"
"346","3.050909","146.75.37.140","192.168.12.35","TCP","1430","443  >  61013 [ACK] Seq=116386 Ack=40446 Win=8244 Len=1376 [TCP PDU reassembled in 348]"
"347","3.050909","146.75.37.140","192.168.12.35","TCP","1430","443  >  61013 [PSH, ACK] Seq=117762 Ack=40446 Win=8244 Len=1376 [TCP PDU reassembled in 348]"
"348","3.051553","146.75.37.140","192.168.12.35","TLSv1.2","87","Application Data"
"349","3.051553","146.75.37.140","192.168.12.35","TLSv1.2","95","Application Data"
"350","3.051553","146.75.37.140","192.168.12.35","TLSv1.2","85","Application Data"
"351","3.052008","192.168.12.35","146.75.37.140","TCP","54","61013  >  443 [ACK] Seq=40446 Ack=119138 Win=1025 Len=0"
"352","3.052516","192.168.12.35","146.75.37.140","TCP","54","61013  >  443 [ACK] Seq=40446 Ack=119212 Win=1024 Len=0"
"353","3.105548","192.168.12.35","146.75.37.140","TCP","54","61013  >  443 [ACK] Seq=40446 Ack=119243 Win=1024 Len=0"
"354","3.193446","146.75.37.140","192.168.12.35","TCP","85","[TCP Spurious Retransmission] 443  >  61013 [PSH, ACK] Seq=119212 Ack=40446 Win=8244 Len=31"
"355","3.193590","192.168.12.35","146.75.37.140","TCP","66","[TCP Dup ACK 353#1] 61013  >  443 [ACK] Seq=40446 Ack=119243 Win=1024 Len=0 SLE=119212 SRE=119243"
"356","3.461879","192.168.12.35","146.75.37.140","UDP","1292","52870  >  443 Len=1250"
"357","3.462054","192.168.12.35","146.75.37.140","UDP","546","52870  >  443 Len=504"
"358","3.500881","146.75.37.140","192.168.12.35","TLSv1.2","251","Application Data"
"359","3.510301","146.75.37.140","192.168.12.35","TCP","1430","443  >  61013 [ACK] Seq=119440 Ack=40446 Win=8244 Len=1376 [TCP PDU reassembled in 360]"
"360","3.510301","146.75.37.140","192.168.12.35","TLSv1.2","882","Application Data"
"361","3.510301","146.75.37.140","192.168.12.35","TLSv1.2","504","Application Data"
"362","3.510301","146.75.37.140","192.168.12.35","TLSv1.2","725","Application Data"
